title,album,year,lyrics,urls
Only 1,UnKnown,2012,"And I don't keep my head up, I keep it down cause God do
Ay look, don't worship me, I'm not Christ
I'm not God, but I try to be

Check, check, check check
Damn right, I'm selling out
In case one of my niggas go to jail, I can bail em out
I heard that Lucifer's the angel of music
This is preposterous, so much for Gospel we all stupid
Look, toast to the gods, Del Amo Boulevard
That's where I was, pacing back and forth like I was on drugs
And I was, but I was comin' up with some raw shit
It was either this or hittin' licks with whats-her-name and them
They had that work, turns out I'm sellin' crinack anyway
She been standin' in line since the AM just to hear my statements
I ain't the black lipped bastard no more, I'm more mature
Call me the black lipped pastor, I walk on holy water
And Joseph ain't my father, holla

Many gon' come, many gon' go
Only time'll tell, only God knows
Coldest under moon, hottest under sun
Many gon' come, but there is only one
Soul-o, soul-o, soul-o
S-soul-o, soul-o, soul-o (There is only one)
Soul-o, soul-o, soul-o
S-soul-o, soul-o, soul-o (There is only one)
Soul-o, soul-o, soul-o
S-soul-o, soul-o, soul-o (There is only one)
Soul-o, soul-o, soul-o
S-soul-o, soul-o, soul-o (There is only one)

I told Punch I'll probably get assassinated by the government
Reverse psychology, they gotta keep me alive
To make like what I'm sayin' is lies, surprise!
I just left Burberry and dropped five, like I went half on a dime
But not this time, Soul-o
And I don't find it odd, I'm breakin' even
Maybe I should've prayed to Jesus instead of Herbert Stevens
I'd rather murder beats than murder people, for this reason
I seek an instrumental in attempts to leave it bleedin'
You a menstrual cycle with flower pedals to a Harley
Rap Genius'll decode it for me
Homie
I came from nothin'
No really, I came from nuttin’
You got here, but you came for nothin’
No really, you came for nuttin’, bitches, and money
Me too, I came for change, too much pussy in this game
Whats my motherfuckin' name?

Many gon' come, many gon' go
Only time'll tell, only God knows
Coldest under moon, hottest under sun
Many gon' come, but there is only one
Soul-o, soul-o, soul-o
S-soul-o, soul-o, soul-o (There is only one)
Soul-o, soul-o, soul-o
S-soul-o, soul-o, soul-o (There is only one)
Soul-o, soul-o, soul-o
S-soul-o, soul-o, soul-o (There is only one)
Soul-o, soul-o, soul-o
S-soul-o, soul-o, soul-o (There is only one)

Yo-yo-yo-yo look (Soulo)
Who else could rhyme like me
I'm making profit off of prophecy
We built this dynasty on democracy and philosophy
A lil geometry some vagina and a lot of weed
A fifth of Hen, a pint of lean and a bible, G
OD flow, A-B-Soul, if you forget the dash you uh wish you didn't
Who am I kiddin' I'mma artist arsonist a good samaritan with bad habits
Kendrick Lamar on the acid tablet
And a groove between Q and Langston Hughes
Rock if he was a Rockefeller that was signed to Roc-A-Fella
(Fuck Black Hippy)
Huge views we need a telescope to tell you dope
I'm not like you, I close my eyes and I see Metatron's Cube
No dream to sell you though
 
my mind move like a monsoon
Lagoon it's true I wore the waves back in high school
Life's a bitch with STDs that I just hit
The next ten years is T.D.E.'s
I got dough but I used to shine poor unlike Shyne Po
Cause now Shyne po'and Shyne shine no mo'
Thats how it goes when ya cons outweighin' ya pros
I got three eyes two lungs full of OG 
but only one—",https://genius.com/Ab-soul-only-1-lyrics
Rapper Shit,UnKnown,2012,"My back against the wall, like I see y'all fronting
Drowning in your own spit and ain't coming up with nothing
I call this shit ""Rapper Shit"" cause I ain't a rapper
But if I was, this ain't some shit that I could rap after
Caught up in the rapture, you call yourself a factor
You're lame, paving a way Bob could build faster
I'm a real master, real massive, you just real average
I see your chain, it's strange, they wore those in the Middle Passage
And it's harder to play me than to fiddle backwards
Don't act like you knew my tactics
Cause when it hits the fan, you know I stand last
I see through your true colors like stained glass
I see the fear in your eyes when we arrive
And what's the odds of even thinking you coincide
When every time a nigga open a door you go inside
Just to realize, either you're weak or someone lied
See, you spend more time boasting about what you do than you do
So by the time your shit is due it's doo-doo
And who knew that too cool fool who used to sit in the back
Would slip through the crack, like dudes who went to rehab
Ab-Soul, Abstract Asshole
Black Lip Bastard, et cetera for forever
I follow no ruler, even if I'm under a drastic measure
But whatever

They say pressure bust pipes
And I ain't never had to deal with plumbing in my life, now that's a bar
Sparring with me like blasphemy to cathedral
Or colliding with the diesel with your baby in your arms
You would test me but you know better
It's inadequate to go against the Jesus of Nazareth
Of the rap game, and guess what, I got no cheddar
But my mind is like a wizard
I defy the laws of gravity every time I get high and write a sentence
Back teeth never been in agony, but I got wisdom
I have risen from the wicked to jump on the competition, Scorch ya, third degree burns next to their sideburns,
All sorts of combustible flows, firemen on speed dial
Free the leaders of the free world with a freestyle
Free the teachers, black activists get up off your feet now
And feed off my feelings
As I control my wheel like new power steering, so sincere
Tryna duck court hearings but I got big ears
Rap peers, used to study them wishing they would fuck with me
Now they can't fuck with him, I'm wishing good luck to them
Reluctantly these critics loving me and I don't blame 'em
They say, Kendrick you gunning for these niggas
So when I pull my weapon out, I give 'em the pleasure to see me aim it
And watch these bullets run into these niggas, clear the set
I got now, I got next, give you nouns, give you verbs
Give you adjectives while proposing an agitated threat
I am most debated in barber shops all because they slept on me
Big homie fear young, buck cause when I buck I make more than a buck
Dollars come quick like a fucking nun fucking for the first time
Put me in Alaska for six months in the dark, in my heart I know sun still shine
Still got a skill to be found in a gold mine

I got an appetite for habitual liars on the mic
Who with pliers couldn't get a grip on life
I spit like I sat the tip of my dick on ice, and that's intense
Imagine if I had already came twice, ain't that some shit
Pass the swisher nigga, fill your cup with liquor nigga
Fly your kite till you're gone till November nigga
Show 'em you remember nigga
Pour some Hennessy and Crown for your homie six feet underground
Smoke an ounce and turn that frown upside down
Like the triangle in the panties of my gal
When Mike Jack made ""Raining in Moscow"" I had no style
Tommy Boy stocking on my scalp
And that was like ninety-five, now it's twenty-ten
Two years away from when they say the world's expected to end
And I ain't even begin
That's more ironic than a bum asking for 50 Cent from ""Many Men""
, one

Too many relays for DJs to replay
I do the reject while I eject your new singlay
Hot enough to sit in hell, then unveil in heatwave
Piss on a demon with ice water
And if I lose my voice then I'm probably calling out to all P.A
Systems to assist in with the word I'm tryna spread
Like county jail bread or the legs of a hoochie
And that's off top like a toupee, 
I'm 2Pac
Coming back for doomsday, spitting at cops,
 go and cop my album
Get high to it, pop some valium, then turn up the volume
I influence ghettos where it says caution
And them bloggers get to sparking like L.A. females that's balling
Round the time this happens often, the violence get the flare
We racing against life, the turtle or the hare?
And nobody can compare to the legacy that we bout to build
Y'all work at Build-A-Bear soft as underhand pitching with skills

Shit, and ain't no use in crying over spilt milk
You're dead and gone
The pall-bearers carry you and your family will carry on
And on the real, this ain't a construction site but you know the drill
We lead the league in all aspects
And we deserve more medals than a magnet
Put you niggas in a hole like bad debt
Shooting three pointers with the globe, nothing but nets

Nigga, nothing but the best
Every time we hit your tape deck niggas hit the deck
I rhyme like a fucking TEC-9,
And I 'Clown Posses' if they disrespect
You looking at a T-Rex snapping at 'em with Tourette's
Yeah, this the flow that killed aspiring rappers
Too late, I grab the eight and start expiring rappers
Some shit only BIG and Pac could rap after
And if they was alive, they would have to pay tithes
I am God
M.C.R. squares will disperse in despair, this is me motherfucker",https://genius.com/Ab-soul-rapper-shit-lyrics
Black Lip Bastard,UnKnown,2012,"Yaow!
Yaow!
Yaow! Yeah!

Black lip bastard,
 black shades, black shirt
Puffing on a Black & Mild, I know my lungs blackened out
Smoke 'til I'm blacking out, I know my future blacker now
All black everything, Black Hippy the regime

Do it! Do it! Do it!
 (Black...)
Do it! Do it! Do it!

Black lip bastard, black shades, black shirt
Puffing on a Black & Mild, I know my lungs blackened out
Hot box like Pacquiao packed in the steamroom
That ain't eucalyptus you sniffing, it's weed, fool
We in this motherfucker, thick ass, high like my bitch
Gimme room like a Motel 6 or meet your doom
And tell 'em this: I got more participants
That think it's just a myth (yeah...)
Adjust your motherfucking stereo so I can drop the bomb on you
And watch your fucking ears explode
Soul!

All we do is do it, all we do is do it
All we do is do it, all we do is do it
Nigga, squaaaad, bitch!
And all we do is do it!
All we do is do it, all we do is do it
All we do is do it, all we do is do it
Nigga, squaaaad
And all we do is do it! (
yeah!
)

I'm the highest nigga at the bottom of the totem pole
And I ain't sweating shit, man, I'm cooler than where sodas go
Fuck so and so, long as Soul show up, ho
Tell Doe po' up, I'm finna go in
Blowing Ls, not taking Ls, go win
Do a nigga squad, you will not survive
You ain't on this side, you are living lies
Put two and two together, I'm the one, high five (haaaa!)
Mobbing like I'm tryna catch a case
The dick make your chick jaw drop, Ma, catch your face
Eating rappers on a plate like etouffée
I do this every day, this verse is a eighth of yay
When you look at me, what do you see?
If I wasn't in Black Hippy, I'd be the fourth Fugee
Unruly, seeking redemption in light of Tookie
The game is all ours like violent movies (oh!)

All we do is do it, all we do is do it
All we do is do it, all we do is do it
Nigga, squaaaad, bitch!
And all we do is do it! (
yawk!
)
All we do is do it, all we do is do it
All we do is do it, all we do is do it
Nigga, squaaaad
And all we do is do it! (
uhh!
)

Black lip bastard,
 black shades, black shirt
Puffing on a Black & Mild, I know my lungs blackened out
Smoke 'til I'm blacking out, I know my future blacker now
All black everything
, Black Hippy the regime

Black Panther party reincarnated, y'all hate it
Niggas tryna put a hex on me like the Star of David
Everything I say is real
Got a few jewels in high places, you know the deal
Fuck you niggas talking 'bout?
Your run is over like the Oprah Show, walk it out
Geah! They say I'm really out my mind, mane
All do is get high and play mind games (
hannh?
)
This is my game, I payed off the referee
Been fouled since I was born like Jeffery
The only MC with telepathy
Fuck that, the only celebrity in 11-D (
mmm...
)
I swear to God, it won't be long
I have Tyler lighting bongs and reciting Psalms
I'm an angel with an angle, what I mean, well
I'm just a demon that means well

All we do is do it, all we do is do it
All we do is do it, all we do is do it
Nigga, squaaaad, bitch!
And all we do is do it! (
Q!
)

Hey, Ali, you know what they call me?
You know what they call me, Ali? Huh?
Black lip bastard!
Big bitch!
I know your image of me is what I hope to be
Geah!",https://genius.com/Ab-soul-black-lip-bastard-lyrics
Christopher DRONEr,UnKnown,2012,"It's all subjective shit
Yeah, yeah you know, you know
It's like the, it's like the calm before the storm
Perception is everything
Soulo the god and The Ichiban Don

Bunch of fuckin' drones, bunch of drones, can't think for your own
Bunch of fuckin' drones, bunch of drones, can't think for your own
Bunch of fuckin' drones, bunch of drones, can't think for your own
Bunch of fuckin' drones, bunch of drones, can't think for your own
Can't think for your own
Can't think for your own
Can't think for your own
Can't think for your own

Out my window all I see is Babylon, grab your gun
You ain't a knight tonight, you won't live to see the mornin' sun
Yellow tape, pistols in your face, hold on, show no weakness
Money, murder, grab your burner, cabins burnin' where it's freezing
Soulo, yeah I'm the one you heard about
Fuck's gotten into Herbert now? He's so foul it's birds around
Had it my way like it's Burger King, you don't want beef, put that burger down
Don't go against my coalition, you can kiss my colon, pow
Guess it's in my heritage, I double-cross snakes and go ape shit
Psychedelic, she left on her heels and I'm chewin' pills, I can't taste shit
My dick look like a spaceship, ""Stairway to Heaven"" on my playlist
On 9/11, I called 9-1-1 and the voice recording said this (Hello)

Bunch of fuckin' drones, bunch of drones, can't think for your own
Left, left, left, right, left
Bunch of fuckin' drones, bunch of drones, can't think for your own
Left, left, left, right, left
Bunch of fuckin' drones, bunch of drones, can't think for your own
Left, left, left, right, left
Bunch of fuckin' drones, bunch of drones, can't think for your own
Left, left, left, right, left
About face, about face (can't think for your own)
About face, about face (can't think for your own)
About face, about face (can't think for your own)
About face, about face (can't think for your own)

This ain't no manifesto, you niggas know me
My niggas manifest O's of the OG
High tech, sippin' Hi-Tech like Detroit Red used to coach me
A-B, see he, D-E, F the (most G)
No pen though, I just pulled this shit out the wind, bro
Ain't got shit to lose but a win bro, it's a win bro, this shit's simple
Gettin' dough like Papa John, your momma all on Papa John
Ain't got no chain, I ain't no slave, ain't got no watch, I ain't got the time
The SWAT team got robots and I'm thinkin' 'bout coppin' mine
Literally, fuck a pair of shoes, I'm cockin' nines, dare you to shoot
Headline, Ab-Soul facin' Fed time
Rewind, it wasn't 'bout that, no rat but I'm droppin' dimes
Iceberg Slim with the furnace on, I knows war, that's real talk
All my life, I knew I was ill, Rock had me on the billboard
In God I trust, I ain't no fool, no
But on the real, I just hope my credit card does too, Soul

Bunch of fuckin' drones, bunch of drones, can't think for your own
Left, left, left, right, left
Bunch of fuckin' drones, bunch of drones, can't think for your own
Left, left, left, right, left
Bunch of fuckin' drones, bunch of drones, can't think for your own
Left, left, left, right, left
Bunch of fuckin' drones, bunch of drones, can't think for your own
Left, left, left, right, left
About face, about face (can't think for your own)
About face, about face (can't think for your own)
About face, about face (can't think for your own)
About face, about face (can't think for your own)

I bought some Alexander Wang, after I heard ""New Slaves""
Went and bought some Alexander Wang, after I heard ""New Slaves""
Y'all niggas can't fuck with Soul, y'all niggas can't fuck with Soul
Y'all niggas can't fuck with Soul, y'all niggas can't fuck with Soul, uh!",https://genius.com/Ab-soul-christopher-droner-lyrics
Absolute Assassin,UnKnown,2012,"Yeah, Yeah, I'm feeling like that
So I spit it how I feel it
So you feel it right back x3

My heart, I spill it on them tracks
Like it fell out of glass and it came from Ab
Soul motherfucker, wave your white flag
Your reigns over like summer came over a hurricane
My sun shine bright bitch, throw on your shades
I got mines on now, they look good on my face
Don't give a fuck what you say
'Cos I'm the same nigga everyday
I never change like a penny or a nickle, a dime or a quarter
Under this New Era is the New World Order
My brain could slaughter a nation of recorders
Sit 'em in line, I run through them in chronological order
This is not what you made up for
Sorry for ya
I'm coming like a nut
Whaddup?


Back in school I wrote verses by the paragraph
Now I write like a pilot in a aircraft
In the sky, wear wings like a damn badge
So clean me and Jesus could share a bath
Now that's Soul religion
I'm at the mound with the style, play your position
You at a short stop, I had a long run
I'm at the finish line, you looking at me from behind
That mean you lost one, let's go for two
A perversion of mine, cos I'm berzerk with the lines
I think back to when I first learned to rhyme
But now I'm bad to the bone
I'm like a poisionous sign
Top notch to my socks and my shoes fit perfect
'Nahm saying?' was a classic, I wish you could have heard it
I be fucking over beats til I damage the cervix
I got bars like night clubs, and great service
5:30 in the morning, I'm still up cooking
Cyphers so arised, you would go blind looking
I ain't got punchlines no more, I'm right hooking
If I switch south par, niggas going down dawg
A-b-S-o-u-l-u-t-e
Yeah, you see me
A-b-s-o-u-l-u-t-e
Yeah, you see me


Soul assassin
You know what's happening x3",https://genius.com/Ab-soul-absolute-assassin-lyrics
XXL Freshman Freestyle: Ab-Soul,Freshman Freestyles (Class of 2013),2013,"The sum of all fears is a billion and three
More of a reason why everybody's scared of me
Cause ain't nobody sayin' nothin' rare to me
Just comedy, or a parody
You could suck two dicks for comparin' me
To any rapper that fits in this category
Section 80's baby, pray you follow me home
See my habits, my contradictions and my systems of control
Top Dawg Entertainment
They saying we saviours like this ain't dope we slanging, hope
You can get a feel for the skill like the famous coach
Ain't need a ring on my finger to be a champion
You can't be on my level, you'd get expired
We was racing on unicycles, I wouldn't be the one tired
Soulo Ho3, well known from Del Amo to SoHo ho
Don't stop, roll more dro till you comatose
My egg's fried, probably why I like omelets the most
Lonnie wanted me to vote, I love Lonnie but no
See I ain't into politics and shit, I got my own pole
What's the difference between a person and a human?
One of 'em is free, the other one is stupid
And I'm caught in between the two, which direction are you in?
Put a ""Yo"" in front of ""universe"" and tell me what do you get?",https://genius.com/Ab-soul-xxl-freshman-freestyle-ab-soul-lyrics
Back Then,XXL Freshman 2013 Mixtape,2013,"I'm turnt up right now
I'm turnt up right now
I'm off half a bean it's like eighty degrees
But I got the chills right now
I'm turnt up right now
I'm turnt up right now
I'm off half a bean it's like eighty degrees
But I got the chills right now
I'm turnt up right now
I'm turnt up right now
I'm off half a bean it's like eighty degrees
But I got the chills right now

She looks hot so i need that bop if you can understand my language
A dollar might fuck your main bitch
I fuck a main bitch
Ain't got no main bitch
That was back then, no disrespect to none of them
Cause what i learned from all of em', is that everything comes to an end
So I'mma party to the end, can i finish, counting ends
I don't drive but I'm in a Benz, she don't lie 'less she with her man
She don't smoke, but she roll my dope
I don't licky lick, she knows that's a joke
She suck dick off impulse, that's 69 if you can't divide
I wasn't great in algebra, but i can talk you out ya bra
Take you places you can't see, with just two eyeballs (Three Eyes)
I got three eyes, I got three legs, pick one
Long-term, tre piece
, but this will be my fifth run
Harry fraudulent on the beat I beat Up that's my word
Action Bronson got the weed, I need, I didn't have to pee

Back Then, way back when, I was broke as Bruh Man
Nigga my time is coming, look what i done did
Swag on 300, TDE we ballin' man
Inside the game, ain't too much change, 
I told y'all I been gone insane
, but that was
Back Then, way back when
Back Then, way back when
Back Then, way back when, look what i done did

WHere your nigga at Homegirl, He ain’t sHit
I’m ballin' man
Dollar after dollar, deja vu, bitch
I’m ballin' man
Sacked out blacked out racked out
I’m ballin' man
EverywHere i go gotta Have a Ho
I’m ballin' man, i’m ballin' man, i’m a baller, man
I’m ballin' man, i’m ballin' man, i’m a baller, man
I’m ballin' man, i’m ballin' man, i’m a baller, man
Dollar after dollar, deja vu, bitch
I’m ballin' man, i’m ballin' man, i’m a baller, man
I’m ballin' man, i’m ballin' man, i’m a baller, man
I’m ballin' man, i’m ballin' man, i’m a baller, man
Hit Her one time don’t call her, man

Back then, way back then you’d have thought I had sense
That’s ‘cause you ain’t know what I had since
Ask Q, I’m gettin' boobs too, dude don’t call me BMF
I’m spinning every dough I get, old marijuana by the zippy
Chicken Fetuccine Alfredo, teenagers of promethazine
Codeine, that’s 16 and lean
Keep that on the low, I’m talking too much, I had two eatables
Pour up a foe for soul, I’m doing incredible
Considering my schedule
BET Music Matters, if it don’t, it pay, though
Show ‘em the sing, that top dog, should’ve signed a page row
Grade A though you keep coming, just keep coming

Back Then, way back when, I was broke as Bruh Man
Nigga my time is coming, look what i done did
Swag on 300, TDE we ballin' man
Inside the game, ain't too much change, 
I told y'all I been gone insane
, but that was
Back Then, way back when
Back Then, way back when
Back Then, way back when, look what i done did",https://genius.com/Ab-soul-back-then-lyrics
The End Is Near,UnKnown,2013,"Right on my tongue, look
Yo, check, my flow is unknown to man yet
Dammit, keep running around like an annual banquet
Made a withdrawal with your broad, she left the bank wet
Rub her like a condom contemplating dangerous sex
I'm unimpressed with your talent, skill still appeal
A maestro on the mic though, I'm almost ill as Camille for real
Ain't never runnin' from nothin', I'm fit to tread mills
Name another movement makin' time stand still
Hiiipower to the third degree
Murder, we emerged and it was an emergency
It's closed curtains for you worthless earthlings
Hurtin' cause I rise like mercury in the burning heat
Word on the street Soulo done done it again
Look at me, I used to match a dub sack with my friends
Now we smokin' by the O, like the letters P and N
Ain't have to start watching CNN for you to see an end
It's coming quicker than you think, don't mean to rub it in
Like lubriderm, but you should learn that you could never fuck with him
Ab's gettin' bigger, but I ain't do no sit-ups
Got the hiccups cause I keep puffin' Ports without the filter
Feel the vibe switch in every single room that I enter
Told my bitch to make room for a tomb for her placenta, nigga
I fuck her 'til she have a seizure in my leisure time
She know I love her, also know I don't need her
Cause I'm a king and I smoke a lot of weed
That makes sense, it's about 33 ounces in a liter
In layman's terms you lames had better pay respect
Or you'll be sleepin', they'll be at your wake payin' their respects

Said it's the soul cold wickedness
Old folk killin' shit
Most dope syndicate, the GoPros filmin' it
Good coke sniffin' shit, broke no benefits
Smack him in his face and then I'm blowin' smoke into it
Obliterated on a big estate
Shit, I figure fame is just a bitches game
That's why there's raindrops drippin' off my windowpane
And I was gettin' money far before the Fisker came
Official name's got plugs like a new strain does
You may be hot inside your city, homie you ain't us
You can't trust nothin' if it's comin' with a dollar sign
It's genius comin' from out of my awkward mind
Cross the line, it's just not the time
And he ain't thinkin', put that red dot on his mind
I'm Santana's bandana, against me you don't stand a chance
Call you fancy pants cause when you're drunk you do the hammer dance
If there's a random chance you're fuckin' up my Phantom plans
I'mma go bananas and blam 'em into the ambulance
My mother's sonogram was like a mission statement
Cause I wasn't patient, left that pussy in a spaceship
Y'all fools basic, your parents both racist
I'm lawyering these hoes out here, beatin' cases
She eatin' dick so she plead the fifth
Yeah, it's Larry Fish, homie he's a myth
You sunk my battleship, I'll be in Nazareth by where Jesus live
And your homie with you, he's a bitch, some vagina shit
Gettin' faded, go and sin in Vegas
I'm just observant, man of different faces
Some dick-licker want my kids in her
She a switch-hitter, told her bring her bitch with her
The dick split her like a swisher then I'm outty, outty
Never eat the pussy if it's lousy, it's lousy
I'm the prodigal son
With ominous, Nostradamus anonymous visions
Confidence, some Obama shit, in Mocassins they can
In moccasins they can ante, alright",https://genius.com/Ab-soul-the-end-is-near-lyrics
