title,album,year,lyrics,urls
Thought It Was Love,Long Term 2: Lifestyles of The Broke and Almost Famous,2010,"Uhh, whattup Brown? Whattup Blue?
Yeah, look

Thou-thought it was love, not just a mockery of
We been close since snot noses
That's some old shit, yeah no shit
You chose your path. Me? I was focused on this rapping
You was trapping and I wasn't mad
You was nickel and diming, all the while
I was getting pennies for rhyming
You was eating at Tony Roma's, I had only Top Ramen
I can smell the aroma when you pass
It ain't only the potent doja you just passed
Cause now you tryna go legit, and pick up a mic
All cause you heard So Far Gone and that shit sound tight
You see me buzzing in the streets so you figure a feature
(Should) give your name a boost like the prepaid cell phone would
I lay my verse and the verdict was:
Homie got off, but Herb murdered Cuz
And instead of studying my tactics
You turned dyslexic and now you're looking at me backwards
That's straight madness, we were compadres
And now this, what can I say?
Guess that's what happens when your stick has the shorter end
The strongest niggas start to bend

I thought it was love
I thought it was real
I thought you were being sincere
I thought you'd forever be here, yeah
I thought it was love
I thought it was love
I thought it was real, yeah

She knew his track records
Took a chance on his past
Cause he was sure to
Make her laugh when she was sad
Enjoy the company, especially when her legs were spread
He was a guilty pleasure
Loved it when they were together
But nothing lasts forever
Been talking for a minute
Feelings start to develop, at first there wasn't any
She's entitled to a title but he isn't ready
For commitment, not yet
A year and a half passed in the relationship
But finding messages in his phone from miscellaneous chicks
Lies on top of lies
She was blind, didn't realize
Notice that ignorance is bliss
She put too much time and effort off into him
For it to end up like this
So she forgives what he did
But she doesn't forget
Everything that he puts her through
Through it all, she don't want it to end
Started out as a visit
He was merely a friend
Now her heart was his home
Where she felt he belonged
Was scared of being alone
Held those emotions within
She went through his phone
And she caught him again
She said",https://genius.com/Ab-soul-thought-it-was-love-lyrics
No Pressure,Long Term 2: Lifestyles of The Broke and Almost Famous,2010,"Blue Chucks with my Locs on
Hoping that the blood homies don't take it wrong
And wipe me off the face of this earth
And for the record, I am not banging the turf
I ain't got no record
, I ain't never laid a nigga to dirt
And other than a nine to five I never had no work
But that don't mean shit, I could still get murked
Any given Sunday, In front of a church, chuch
Tabernacle, chapel, If I ain't on the block I'm somewhere behind an apple
Bottom model bottle poppin'
Old English like senior citizens speaking
And me and legend blowing big kush
In a little coupe the same size big foot's foot
And now niggas looking up to me
And I ain't even tall, It's hard to be
.

The pressure is on
I said the pressure's on
The pressure is on
I said the pressure's on
The pressure is on
I said the pressure's on
The pressure is on
I said the pressure's on

See, The Pressure ret everywhere/er were
And if it bust a pipe, it can take your life
Right before your eyes, and your homie's too
You had to run it cause the color of your tennis shoes
And I hope you got a spare pair
And a fresh pack of newports to calm your nerves
Roll up the herb, that's my first name
And I get high until I die, that's on my Daddy's grave
You niggas wearin' a mask
Trying to masquerade away from the facts, of your past
In past tense I pass this like classes, I took at Curtiss Magnet
I remember one time one of the homies had a black burner in a black jacket
Shit, who predicted he'd get hit before twenty one
Blackjack it is, trying to count your cards quicker than us
I'm air tight never flinch when the

The pressure is on
I said the pressure's on
The pressure is on
I said the pressure's on
The pressure is on
I said the pressure's on
The pressure is on
I said the pressure's on

When the pressure was on
Niggas talk loud but they break wild when the weapons are drawn
I should hit ten in his dome, cause he a snitch, he don't represent this gangster shit
Shit, he don't know how it feel to see your homie's cap peeled by the black steel, for real
I can still see the blood spill, it's ill, it's ugly nasty
Uh, still keep the can/cannon in the back seat
What, puffin' the blunt, fully trucked
For any nigga that wanna lay on the dust in the ford trucks
Trust, I ain't with the B.S., I'm out the 
E.S.
,
With a bad bitch
Pro Club 1X tall, no v-neck
Show me where the cheese at, I ain't talkin' Cheese-Its
Use to serve rocks in the lot, Al Paci-ess
Now I crush mics on the song
Life's a gamble plus a nigga never fold when the

The pressure is on
I said the pressure's on
The pressure is on
I said the pressure's on
The pressure is on
I said the pressure's on
The pressure is on
I said the pressure's on

Ah, yeah
Roll up that OG, pop that OE
Aha, know how we do my nig'
TDE, top notch, Soul!
No pressure
Booty-bye-ba
One West",https://genius.com/Ab-soul-no-pressure-lyrics
Livin’ Like,Long Term 2: Lifestyles of The Broke and Almost Famous,2010,"Uh, Soul Brother Number...
Rapper ! Ha, Whats Good Big Homie
Ya Know I Got That Flava
(Good Evening Ladies & Gentleman
This evening takes great pride in presenting)

Uh, Soul brother number 2
Here to take number 2 on any number 2
That's who's ever after me
Don't get my spot confused
Like a gang of dalmatians in the same room
I never sleep; you snooze, you lose
I'm on a consecutive leap
Slick wit it, sippin' a 40, No WD
Splendid, ended my name on your brain
Like a paragraphs first sentence..(MANE!)
Please see the passion in this young man
Burn this bitch down even if I got one fan
Like, You hear this, you ears will sun tan
I'm an army tank, you're just one man
And niggas talkin' bout they label offers
Knowin' damn well them labels off ya
You know you got it all wrong
When you start equating your success with Drake and Trey Songz
Soul

Where you need to be?
Where you need to go?
What you need to see,? lemme know
(Baby I Can show You...show You)
We only got one life
Live it to the T
But, Take It From Me
(Don't let time control you..trol' You)
Whatchu Livin' Like?
Whatchu Livin' Like?
Whatchu Livin' Like?
Whatchu Livin' Like?
I'm livn' like
I'm livn' like
I'm livn' like
I'm livn' like
Whatchu Livin' Like?
Whatchu Livin' Like?
Whatchu Livin' Like?
Whatchu Livin' Like?
I'm livn' like
I'm livn' like
I'm livn' like
I'm livn' like

I say I'm livin' like the world can't hold me
Mama can't scold me, like a lawn chair niggas fold me
Flow sounding moldy & dated
Rap game I hate it
But at the same time I'm in love deeply
I'm in love indiscreetly, stop looking for them neat raps
Go ahead get ya wet naps
Chicago poetic justice with my wave cap
I know some people mad at me cause I ain't wave back
Double Impact; No Jean Claude
Niggas got stories but most of them fraud
We are all flawwed
Only difference is I display mine
If I say your music whack, that's a hate crime
You can debate I'm better than the next one
Each fan text one, I could a have million
Me and Ab building, Me and Ab killing
I wish you would fight the feeling


King of my stomping ground
I don't fuck around, like a Tupperware top I shut shit down
I wear the underwear here, it's best you know now
When Queers interfere I can feel it in the air
They ain't gotta make a sound
Ain't shit sweet
But the swisher full of weed where my thumb and my index meet
You don't quite cut the criteria
We keep trees on us like LRG
, Cause
Mass hysteria walkin' across the street, cause
They never seen a nigga so concrete
And You can understand that right?
You look a little dumbfounded
Believe whatever you looking for I done found it
I can show you the real and I can tell you the grind
But even T-Pain get this shit overnight
And If, nothing else remember this
The smartest man in the world know we don't know shit

Tommy Black, Wassup
Tommy Black, Wassup
Soul Brother Number.....",https://genius.com/Ab-soul-livin-like-lyrics
House Party 5,Long Term 2: Lifestyles of The Broke and Almost Famous,2010,"Guess who's back up in the mix, with my big black shades, read my big black lips
The night is still young like a nine year old kid
Finna hit the Dale's Liqour, and cop another fifth
Of Hennessy, for my personal pleasure
A took a sip, a little head dripped, so I wipe my lip
Luckily it didn't spill on my tee, I'm well-known for that
But the bitches still holla
'Till they go hoarse like Kentucky Derby
The power in the Porsche, all I need is to kick back
So I can just chill like a six-pack, of coors, of course
As soon as I walk up in the door I'm yelling out

Somebody spike my Sprite
So I can feel larger then life
I call this House Party 5
What's popping for the night
What's popping for the night, What's popping for the night
What's popping for the night, What's popping for the night
I call this House Party 5

Yo my party don't stopping up I hit 'em up
I said wuddup, I said wuddup, he said (not much you)
You know what I'm 'bout, what's going down for the night
(Party at Ashback house), I said what
He said (yup), shit y'all be fucked up
Stepping out, like an accident, roof level
Outta elevator in a skyscraper in the clouds
I hung up, ran to the bathroom to clean my Air One's up
I would rock the Timb boots but they all scuffed up
I looked in the mirror, seen my swag was up
Don't play swag out, so I had to adjust
Fast forward, I seen so many cars pulling up
Hoes pulling down they skirts, niggas with
""We can't lose"" on they shirts, you would assume they take it to the dirt
Some of my niggas real killers, put you down to Earth
And they down to Earth, and we Chris Rock
The party like it don't stopping up


And the party don't stopping up
It don't stopping up, don't stopping up
Don't stopping up, don't stopping up
Yeah, and the party don't stopping up
It don't stopping up, it don't stopping up
Now put your hands up in the air
If you tryna put it in the air
Got bitches shaking ass to the left of me
Got homies 2 stepping to the right of me
We got Hennessy, got Nuvo to spare
If you trying to go, we can take you there
Got bitches shaking ass to the left of me
Got the homies 2 stepping to the right of me

Yeah, another round on me
Look at this women move her booty around on me
It's 2:15 in the morning but we up
Finna hit the Denny's, tell 'em hook a scrambled up
Pissy drunk if you didn't know my nigga, no my nigga
Higher then a spirits, of the un-living
In the mist of everybody fucking up the homies house
Think B.I.'s party and bullshit, a fight broke out


And the party don't stopping up
It don't stopping up, don't stopping up
Don't stopping up, don't stopping up
Yeah, And the party don't stopping up
It don't stopping up, it don't stopping up",https://genius.com/Ab-soul-house-party-5-lyrics
Budget Ballin,Long Term 2: Lifestyles of The Broke and Almost Famous,2010,"You could find me in the hood poppin'
Or in the club stuntin'
There is no
Other option
And you can't tell me nothin'
The camera keeps flashin'
So
I'mma keep flauntin'
Cause what you don't know is I'm a baller on a budget
(And I)

Defy the odds when I step out the house
Pull a chick lookin' like a nigga fresh off the couch
Then I pull up in that white thing
But I don't mean it as if its something to brag about
Shit, my car's just white man
Sharp as a tack, in track to get at the club
Bottle service reserved
Go on and po' you a cup
I sip until I throw up
My hands dance in the cut
By myself I ain't lying
Attracting all of the sluts
I got a chip on my shoulder
Like there was chips in my pocket
There ain't a cent in my jeans
But you might smell the ganja
I must be living a dream man
You say I'm her dream man
So why take advantage of her
Fuck her to dreamland
(???)
Absolutely, but I love it ya'll
Still drink that cheap shit
That smells like rubbing alcohol
Still going half on a sack
Hitting pretty broads
Taking off pretty Vickys
With the matching pretty
Bras

You could find me in the hood poppin'
All in the club stuntin'
There is no other option
And you can't tell me nothin'
The camera keeps flashin
So I'mma keep flauntin'
Cause what you don't know is I'm a baller on a budget
(And I)
Fresh dressed like a million bucks
(And I)
I hold it down, they know what's up
The party ain't stopping
So I'mma keep frontin'
Cause what you don't know is I'm a baller on a budget
(And I)

Give em' the chills
Rollin' on hot wheels
It ain't mine, it's the homie's
I'm just keeping it real
Say I'm phoney baloney
Even words tryna bone me
I got the hood on my back
Ain't gotta tattoo it on me
But as a matter of fact
I'mma tattoo it on me
I know you thinking I'm immaculate
That's accurate, homie
(Word Up)
Like the magazine with all of them posters
I keep a Halle Berry in the ashtray full of roaches
(To smoke up)
Pass the light
I'm finna have me a night
If your wifey's hitting the club
Before she leaves, hold her tight
Look her dead in the eye
Tell her you love her to death
And hope she don't come home with black and mild on her breath
It's Ab-Soul, the best dressed nigga in debt
Got chicks fresh outta high school, adult swimwear
(Yes)
I know I make it look simple
Like it ain't really nothing
Cause it ain't really nothing, no

You could find me in the hood poppin'
All in the club stuntin'
There is no other option
And you can't tell me nothin'
The camera keeps flashin
So I'mma keep flauntin'
Cause what you don't know is I'm a baller on a budget
(And I)
Fresh dressed like a million bucks
(And I)
I hold it down, they know what's up
The party ain't stopping
So I'mma keep frontin'
Cause what you don't know is I'm a baller on a budget
(And I)

Keep it cool, they know I'm hot
(And I)
Do what it do, running the spot
(And I)
Don't want no problems
I'm just really tryna party
Ain't a dollar in my wallet
And nobody tryna rob me
(So I)
Keep it cool, they know I'm hot
(They know I'm hot)
Do what it do, running the spot
(Running the spot)
Don't want no problems
I'm just really tryna party
Ain't a dollar in my wallet
And nobody tryna rob me
(So I)
Tell myself its too good to be true
These niggas like, ""Ab, I bet it feel good to be you""
But I'm just living my life, like T.I. and Rihanna
Making grown women melt, like ice in a sauna
And you know I got my shades on
Mackin' a model that keeps pronouncing my name wrong
I don't cuff her, but she respects my authority
So when you lookin' for a G",https://genius.com/Ab-soul-budget-ballin-lyrics
Dictionary Rap,UnKnown,2010,"Soulo
Indubitably!

Still trying to get this loose leaf, lift my legal tender
'Til it's tall enough to reach god's slipper, whatchu think?
Big Dipper nigga quite the constellation 'cross the nation
So ahead I graduated then came to your culmination
Like my little sisters, but these rappers more tender
No pen I don't bowl nigga, you act all bold like an eagle
When you small as gnomes and trolls nigga
Mediocre, novice, throw salt, garlic
I'm big willy, you craw-fish,
 flow silly, retarded
Gimme a helmet, 
like I play for the vikings I be (what?)
Rollin' up that poison ivy, and I don't look at it at all
If it ain't fulla tetrahydrocannabinol, I'm a cannibal dawg
Jeffrey Dahmer pull your skin off if you look at me wrong, it'll turn me on
I'mma turn this up like a thermostat when it's cold as fuck
Am I cold or what? I'm a cobra, venomous
Bad to the bone, break all your ligaments
Everybody gettin' it, ain't nobody innocent
In your pinnacle is benefittin' zero for your penmanship
A missle in a barrel and I'm splittin your apparel
Red Light, Help! We'll sing carols
Vernacular stupid, you're inadequate foolishness tickles my amusement
Don't know if I'm an artist or a Harvard law student
But I pass bars like kids in candy stores
I'm a carnivore and I are the best, absolutely genuine
When it comes to synonyms I'm a thesaurus Rex
Read more, learn more, change the globe
Don't let no one tell you no, yes you can the more you know
You understand how much you don't understand, so now you know
I ain't the pope, but listen what I taughtcha I ain't gon' cross ya, hope I ain't lost ya
I found my utopia, little Cîroc, little fruitopia
I spit opium, cut ya up, fill the room up with sodium

Oh let's do it, oh let's do it
Dictionary music
That intelligent shit I influence
I approve it, dictionary music, yaaaaaaaaa
Oh let's do it, oh let's do it
Dictionary music
That intelligent shit I influence
I approve it, dictionary music

Cataclysmic words, pattern thrash 'em with the verb
I put passion in my work, ethic stretch ya like a paramedic
Mashin' through yo' turf, even if your habitat's obscure
I'll surely make it out alive, precisely how I did at birth
You're miniature, minuscule, I'm a minister, April Fools!
I like literature luchini, indica and fried zucchini
Where my niggas with they beanies on, cocked like a mockingbird
I'm sharp enough to correct a correctional officer
Carp ya like a carpenter, barbecue your body parts
I bet Waka Flocka Flame never met a Charizard
Barbarian, that Samaritan, neanderthal
A package of blacks, a package of matches, and a can of aerosol
No time for no R and R, that sativa got me up
Northen California grown, just to state the obvious
And I'm omnipotent as god, get you bible
And bring your rifle to revival, okay let's do it

Shoutout to Webster!",https://genius.com/Ab-soul-dictionary-rap-lyrics
Fame,UnKnown,2010,"The fame
The fortune
The need to be important
Will exist as long as the Earth is in orbit

Far from a Frankie Lymon but I'm feelin' the scrutiny
The fame, the bitches in they visions is screwin' me
Cause they don't see Soul, they see commas
*Boy you finna be the biggest*, get her a pre-sale ticket
I used to sit and stare at my phone and wait for rings
Like professional athletes or any wife to be
Now it's ringin' off the hook cause I wrote a tight hook
The list goes on man I could write a book
But you know the popular sayin', ""Be careful what you wish for""
I just wanted to move people
I didn't know it'd come with this whore
Got me steppin' outside like menthols
Well sellin' your soul's the end all be all
I'm just tellin' the truth people
But you could prolly only feel me if you're involved
Just know what you in for

Some people wonder why I wear shades at night
I say cause in the dark, they're still that bright
I see my enemies, they see me too
You wish you was me like something's wrong with you
They say I'm becomin' such a household name
That everywhere I go I'm sure to feel the *Fame*
Some people wonder why I wear shades at night

Tell me how you supposed to feel when you walk in a room
Everybody swellin' your head 'til it's as big as the room
You still ain't made it but it appears to be comin' true
At a time you tryna find what the world is comin' to
And don't forget about your family you would think it was all love
They waitin' for you to fuck up to blame it on your moms
Like she did a horrible job, he don't look too good in the eyes of God
But you know the popular sayin', ""Be careful what you wish for""
It just might happen
I never thought I'd make it this far, when I was young I used to wanna ball like Chris Paul
Hoop dreams converted to writin' hit songs
To some of y'all it's just rappin'
And I wrote this over the toilet cause I was pissed off
No shit

Some people wonder why I wear shades at night
I say cause in the dark, they're still that bright
I see my enemies, they see me too
You wish you was me like something's wrong with you
They say I'm becomin' such a household name
That everywhere I go I'm sure to feel the *Fame*
Some people wonder why I wear shades at night

The fame, the fortune, the need to feel important
Will exist as long as the Earth is in orbit
Michael Jackson died just a few days ago
Some people say ""Malpractice"" but just imagine
Sellin' a hundred million plus copies off of one project
Grown men fallin' out just to touch your fashion
You become an object
With or without an objective of your very own
That type of attention can drive a man mad so be careful what you wish for
This music is what I do 'til I die it's what I live for
So if you do it for the jewels or the new tennis shoes
And not to be mentioned with Pac, Biggie, and Nas
Then you do it to pollute
I'm Captain Planet with my pants saggin'
Tell the truth, rewrite it, define it, and spell it too
Make sure you shake every hand and take a picture with every fan
And do whatever you can do

The fame'll consume you
The fame'll confuse you
Make it look like everything is an optical illusion
The fame will haunt you
Listen what I taught you
Even on your day off
The fame is on you
The fame ain't expensive
But the fame will cost you
The fame is your friend
But the fame will cross you
Take what I say as a warning
Precaution
From the captain blockin' moonlight with my sunglasses
Bastards

Yeah
Yeah
Be careful what you wish for
It just might happen
They say I'm becomin' such a household name
I'm tryna feel the.....
Some people wonder why I wear shades at night",https://genius.com/Ab-soul-fame-lyrics
World Wide Web,UnKnown,2010,"Yea, nigga gotta new, nigga gotta new mixtape out
That shit up on Limewire, type that shit in

One time for your mind!...
How do you do? Enough about me how about you?
I'm in any and everything that you do
I'm worldwide with it, You never heard of me?
Your deaf, everybody caught up in my webs
Spiders getting jealous, I can make you feel connected
I can show you whatever you wanna know in a second
You got a clique? Well I'mma click away from everything
You host a club, I host information on everything
Cut from a different cloth, Microsoft
So I can communicate with you all
I like to stare out windows for days
I'm a browser, we might be on the same page
And I got impeccable Aim
I could show the world your message even when you away
Know what I'm saying?
Oh you think I'm insane?
You better not still be trying to remember my name
At first when I came, I moved through the wire
And now I'm even airborne but you can't even see me flying
I'm the messiah of science, the titan of technology
You couldn't go a day without acknowledging me
Your kids stay up late just to holla at me
They ain't gotta be over eighteen
To peep my sites, I show 'em how I get down
Wouldn't believe what they see when you ain't around
I got all the access from sex to addresses
Soon as it gets uploaded I gotta show it
Shit, you heard of about it, I gotta know it
Fill me in, username and password, lets begin

I got like six new friend requests on MySpace, yes!
That's me
Facebook poppin'
That's me
DJ Quik, follow me on Twitter
That's me
Oh shit, I don't know, just Google it then
That's me

Haha, I'm so player
I kick it with the Mack
Told you about my web, I can even make my web chat
I'm also known invading your privacy
You know, credit card fraud, piracy
Them my homies, they be idolizing me
Cause I move so smooth on 'em
If he did it, she did it, I got news on 'em
And I ain't stubborn, I let people shares they views on 'em
Could even show you how to get to 'em if you want 'em
I been seen the future moving in my direction
I kept America online, no question
And I ain't stop there, I made a foreign connection
So you can meet people anywhere you select shit
My plan is to have my hands in everything as if I don't
Get rid of pens, pencils, and paper with the holes
Some people act like they don't love though
This rapper named Ab-Soul, he a prime example
He always got something negative to say about me
When he with his friends but he couldn't go a day without me
Leave him with a stale face when he checks his MySpace
He a disgrace, How he expect play without me
Ain't got no budget for radio
His Day In A Life video, I made show I made him known
And I could do the same for you
You can even Ask Jeeves, he'll tell Yahoo!

Yea just go ahead MapQuest the directions and print 'em out
That's me
My homie homie, I'm telling you man, I seen him on YouTube today
That's me
Hey yea my little sister just went to prom
Yea I'mma email you the pictures, what's your email?
That's me
AllThatAss.com?
That's me
What's my credit card number?",https://genius.com/Ab-soul-world-wide-web-lyrics
