title,album,year,lyrics,urls
EVIL LIKE ME,YUNG RAPUNXEL PT. II,2019,"Going down belower
Hit these bitches up
Not giving a fuck
Goodbye giddy up, giddy up
Make them gimme the bucks
'Cause my lifestyle lush and
My mic style tough - fuck is up?
Thought you left a dead bitch in the ground
Ima reach in the dirt, now I'm diggin' her up, aye
Two hoes in my titties it's sucked
Hit the blunt and a bump
Now I'm ready to fuck
Hades heats the ocean
Hip Hop Witch - get this hypnosis
Callate la boca
 and do what I say or get stomped
That's a quote bitch
Cut the coke up
Cut the dose up
Cut the coke up
Light the smoke up
Don´t you lose your focus
You niggas are too close up
Play with me, I'll load the clip and c-cock and smoke ya
I wrap my hair around your neck
And choke you like I'm supposed ta
Imma blade you like you a ritual
Two cuts to the throat
I'll cut ya open
Bitch I'll cut ya open
Don't ya make me
Don't ya make me
Don't ya make me murk ya
Dont you say too much  cause bitch
Cause I'll expose ya
I'll demolish ya, uh, I'll destroy ya
Tarot reading horror
I can see your aura
I can tell your mother taught you how to be a whore
Here comes the horror
Bitch you are a goner
Two shots and I'm ready to fuck
Got the pump in the trunk
And a clip in the clutch
Caught'em all off guard, they ain't ready for us
Say my name, say my name in the mirror enough
I show up with a machete, give these bitches a cut
Snip, snip little bitch, drop the snippet on ya
Better gimme the buck, tell'em gimme the nut
Tell'em gimme the cup, better give me the Dutch
I got plenty for you niggas
Is you with it or what?
Now niggas, come on bitches and hoes
Stay tuned, come on stay tuned, stay for the next episode-a
Haters, okay them haters must be sniffin’ the cola
Ok - okay now I guess I wish niggas woulda
Put it down and I'm picking it up
Got the coke by the pound, and the drip for the mutts! Aye!
Uptown Harlem niggas, whats up?
We be movin' them mountains, I'm pickin' em' up
Ain't no bitch like me
Ain't no bitch like me
Ain't no bitch crowned with the clarity cuts, Aye!
Uptown Harlem niggas, what's up? Aye!
Hey nigga, I'm livin' it up! I got plenty for you niggas is you with it or what?
Blow ya brains off the wall with the fifth or the four! Better get down when I get in the door!
Get that pussy
Get it wetter
Nigga get in it raw
If that dick long, better gimme some more
(Screaming)
The weak at heart will be the first to burn
Burning alive, burning alive
Burning alive
The succubus is coming alive
Alive
Under the sun
Under the sun
The succubus is coming alive
Under the sun
Under attack
The succubus is coming alive",https://genius.com/Azealia-banks-evil-like-me-lyrics
NEW VICTIM,YUNG RAPUNXEL PT. II,2019,"And in every case
A blood clot eight inches from the victim's neck
The mark of the feast
(I love you baby!)

Slayer, bass up
Boy, gotta get you geekin'
Mixer, elixir
Gotta get this bitch freakin'
Hey cutey, hey cutey
How you got a dick so big in?
Big tits, D cups
I can see this bitches peekin'
Tit lick, clit rub
Tell your little bitch don't fake it
Scissor, sister
We about to get this paper
Are you gonna keep me waiting?
Hey cutey, hey cutey
Are you gonna get me naked?
I don't wanna be impatient
I just wanna take this off
Fuck me to the beat
Cause this my favorite song
Face down, ass up
Anyway you wanna take it
Boy you better break this pussy
Leave my lil' pussy achin'
Boy you better make me take it
Boy you better dick me hard
Dick down, ah-huh
You know that I like it raw
Face down, ass up
Anyway you wanna take it
Boy you better uh, uh
I just wanna get, get naked
Hope you like the pussy
Baby come stick your face in
Slurp it, kiss me
Show me how my pussy tastin'
Make me writhe and moan
Pin me up against the wall
Lick down, lick down
Come on baby, lick some more
Said you wanna be my boyfriend
But you better make me cum
And I got the pinkest pussy
And you know this pussy warm
I just wanna keep you hard
I don't wanna miss a minute
Gotta get you out this jaw
Time to stick your dick in
Boy you know that dick too long
I know you wanna sink your teeth in
But you better take your time
Deep down, deep down
Boy, I'm gotta get you geekin'
Uh, huh! (Uh, huh!)

Abracadabra doll
Yes niggas, I'm a star
I bet these bitches wanna know if my pussy blond
New York, Atlanta, L.A. hoochies up in my squad
A little shot of liquor
Hop in my hoopty, uh
Abracadabra jaws
Hit 'em up, grab 'em up, thrash 'em hard
Big dick I'm grabbin' 'em hard
Hittin' all licks, all racks, all cards
Oh nigga you gon' pop some bottles
Rap nigga you gon' pop some condoms
Hop in this, got you gone
Buddy I got you, got you gone",https://genius.com/Azealia-banks-new-victim-lyrics
BACK FROM HELL (TURN IT UP),YUNG RAPUNXEL PT. II,2019,"I pack the piece
And blow the smoke in the sky cuz' I’m potent
You bitches broke
Cuz I'm loaded
I'm flyin’, I'm focused
You couldn't find me
Got you making another call
I take that paper
Make it flip like a somersault
They talk about me
Keep my name in their mouth like a grill
You cannot copy me
Cannot stop me
I'm sexy and real
Sayonara, see you later
I'm gone and I'm ghost
Cheers to my hater
See you later
I'm making the toast
They can't recall
Said they’ve seen me
They haven’t, withdraws
I just withdraw all deposits, my check and I ball
That crystal ball, show you frontin' and nothing at all
I’m with my dogs and we're ready
So don't get involved
Coast to coast
I'm the reason for these hoes and their feelings
Hands high
Put your palms all the way to the ceiling
I set the price on anybody
I know what I’m worth
I got the drip, I got the water
The water, the earth
Young A.B, heat up the A.C
Hit that escape key
Still can't escape me",https://genius.com/Azealia-banks-back-from-hell-turn-it-up-lyrics
DEXEDRINE,YUNG RAPUNXEL PT. II,2019,"FEAR OF GOD
EVIL IS COMING ALIVE
INSIDE
TERROR INSIDE
I'LL REACH INSIDE AND TEAR OUT YOUR HEART
I TOOK YOUR SOUL RIPPED IT ALL APART!
FEAR OF GOD
DARK INSIDE
COME ALIVE
COMING ALIVE!

In my town
This is my town
This is my country
Anything here belongs to me
You want a piece of candy?
Hey little bitch, do you want a piece of candy?",https://genius.com/Azealia-banks-dexedrine-lyrics
96’ COROLLA (MOTORMAN),YUNG RAPUNXEL PT. II,2019,"Intro
Are you ready for me to destroy you?
Hey girl - hey skinny modern alienne
You tripped on a needle and found you a motorman
He's got a space suit, rocket to the space coup... shift it in gear then out through the stratosphere!
He’s gonna cage you, try to re-create you - he's re-p-til-lian
I don't think you understand!
I tried to save you - now I must erase you....
Spatial race, a rocket to erasure
Another billion
I’ll cut your throat again
Cage you, rape you
I'll eviscerate you...",https://genius.com/Azealia-banks-96-corolla-motorman-lyrics
QUEEN OF THE DAMNED,YUNG RAPUNXEL PT. II,2019,"These Niggas ain't Bona fide
Niggas ain't ready, ain't born to slide
These niggas ain't born to ride
Niggas ain't ready don't want it chile
I'll send you the Dolja guy to
Hit you in your poker pout
Cause you's a joker child
Niggas be makin´ em' LOL a lot!
*muffled/almost inaudible*
Tired of being thrown aside
It's a suicide, you're in a suicide
I feel the soul inside s-s-soulless child
Overdrive, I'm overdrive
Okay nigga sure you right
It's a suicide, you're in a suicide
Tired of being thrown aside
Get goin' child
(Beware of Yung Rapunxel)
It's a suicide, you're in a suicide
Cause you's a joker child
These niggas ain't bonafide
You ain't born to ride
Niggas think
OK LITTLE NIGGA THINK YOU BAD BECAUSE YOU WANNA RIDE!
WHEN I GET MY HANDS UP ON SOME CASH, NIGGA, YOU GONNA DIE! (You Gonna die....)
I GOT SOME HANDGRENADES, SOME EXPLOSIVES, TIME TO DIE!
*muffled/almost inaudible*
Why don't you blow yourselves away??
I'll send you the Dolja guy to
Hit you in your poker pout
Cause you's a joker child
S-Souless child
I'l send you to dolja guy
Hit you in your uh uh uh uh
My coochie oo
Uh, Damn
Azealia's down and loaded
She's fuckin' it up, It's loca
Light the coke up
Light the smoke up
Niggas don't want no smoke
These niggas Don't want no smoke
Niggas don't want no smoke, Uh
X2
I can shape the spot
Ya can't take the spot
Can't pack the Glock
'Cause I'm on!
We ain't got a politic
I flip the script
I'll get the chips
I'll move on!
You bitches gon' bite the dust
I need a pick me up
We grind dusk till' dawn!
I don't who sent you sis
I'm just not convinced
You'll feel the shit
I'll get gone!
Feel the pole like jujitsu
They ain't official, not even a little, God Damn!
Bitches stay suckin´ my dick
I won't defend you
Should I continue?
I raise the bar for your own dance!
If you ain't know
Now you know
Time for the show down
You know who the fuck I am!
(AB, aye!)
*muffled/inaudible*
(I'm watchin', You watchin')
I'm watchin', You watchin'
I'm watchin', You watchin'
I'm watchin', You watchin'
I'm watchin', You watchin'
I'm watchin', You watchin'
I'm watchin', You watchin'
I'm watchin', You watchin'
I'm watchin', You watchin'.....",https://genius.com/Azealia-banks-queen-of-the-damned-lyrics
BONE COLLECTOR,YUNG RAPUNXEL PT. II,2019,"*Muffled/ Inaudible/ Messy Vocals*

Sometimes I feel like I wanna go bang, I...
Mm, I see, the creature, in my vision
I, I met someone, somewhere, in this cave
The Fear, I've felt for so long
Contempt, arises from pain
I, I'm screaming, so no one can hear me cry
There ain't no other option Babe
(I'm) Here to die!
Sometimes I feel like I wanna set one of these motherfuckers on fire!
*Laughs*
You know?
I just look at these fucking weak..fucking..stupid MEN and I just want to set them on fucking fire!
You look like the kind of guy who would ask me to spit in his mouth..
You want me to spit on you?
You want me to do it?
You want me to destroy you?
Of course that's what you want!
Open your mouth and I'm gonna spit!
Ok...Get ready...",https://genius.com/Azealia-banks-bone-collector-lyrics
Billionaire Bully,UnKnown,2019,"Big bitch, on the go but making big moves
Range Rover, hangover
I switch grooves, big shot
On top, bitch I'm in tune
Vast waters, headquarters, the switch room
Moneymaker, mitch flow, this boss shit
You think you're hot?, But you're not
Yeah, I'm off this, on clock
Tick tock, this boss shit
Bitches ain't like me
Guess I'm livin' it up
It's like they reward for taking trips across the water
Mexico borders, I'm meeting Djinn's up in the sauna
Bitches is dead, but they about to be some goners
I told you before, I put a hex up on your momma
Recruiter flow, 
bitches calling me the savior like I'm Neo
Big bitch, signing checks
Add a couple zeros, I'm on my Steelo
If I'm the savior then that must mean that I'm the rap's fucking shero (Shero)
Hold a couple kilos, flip it like it's Repo
Take it like I'm, oh, take it like I'm Debo
He know, she know, we know
Bitches is buggin' and not up in- up in that crack with that heat flow
Bitches want the cheat code
But this ain't no regular pussy, these niggas callin' me a Billionaire Bully
On the clock, tick tock
You lost bitch, bitches ain't like me
Guess I'm livin' it up
Big bitch, on the global making big moves
Range Rover, hangover
I switch grooves, big shot
On top, bitch I'm in tune
Vast waters, headquarters...",https://genius.com/Azealia-banks-billionaire-bully-lyrics
KILO,UnKnown,2019,"Gimme your bone and I'll ride
Boy you know I think about it all the fuckin' time
All the things I never do, I'll do 'em if you like
Long as you don't disrespect the G in me, and so
Don't flex this RiRi, you know
I got that drug you want, I know you love it
I know you love the way I make it crawl
Oh, you never knew a love like this before
Oh, how much you want?  Tell me how much you want it
Oh, I know you love the way I make it crawl babe
A thousand grams of that Hocus Pocus, Pocus
Now look at this is, this is potent, potent, potent
Where you cop it, how you roll it, roll it, roll it
Now light it up my nigga smoke it, smoke it, smoke it
K-K-K-Kilo it's that purest, that rawest, that oh
Overdosin' on that chocha, you know it's the dopest
Tell 'em niggas when I get it, then I got it
Plus I flip it, bitch I chop it
Then I wiggle, then I wobble
Bet them fiends they gon' follow - killer!
Where all my bitches? Tell them niggas that you bout it
Pop a pill, perc or xan
Get you feeling, oochie walley, fuck 'em!
Yeah, where them chickens?
Is they clicking?  Bitch, you clucking
Understand when that hammer click and blam, it ain't nothin' nigga
Where all my bitches? Tell them niggas that you bout it
Pop a pill, perc or xan
Get you feeling oochie walley, fuck 'em
Yeah, where them chickens?
Is they clicking?  Bitch you clucking
Understand when that.... click and blam, it ain't nothin' nigga",https://genius.com/Azealia-banks-kilo-lyrics
1-800-Nu-Checks,Business and Pleasure,2020,"I wiggle and wobble, bouncing that jelly, oh my God!
Guess it's Sweet Pussy Saturday everyday, that's word to Plies
Caesar blonde like he Patti Mayonnaise, he's Patti with them pies
He gon' fuck me like Gladiator, then tat me on his side!
I got some dudes with some legal paper, I fuck 'em on the side
Keep my street nigga under radar, he hustle's with the 9
Niggas be dedicated, you know they down to ride
Keep my mind on my money and keep this pussy on his mind

Ugh, he gon' spend a check
He gon' ice me 'cause my body bangin' like a Genelec
Picture perfect pussy, pretty sex
VVS, my diamond choker, now I'm really getting wet!
You bitches ain't a threat
If I super-soak your nigga you gon' really be upset
He said my pussy is the best
Throwing dollars for the baddest bitch, I came in to collect

Big momma, big dollars
Big choppers, go ""Bracka""
Hip hopper, flow hotter
Ass clapper, show stopper
Panty dropper, pussy popper
Pussy drippin', pussy power
Pussy power, pussy power
Fast cash!

They schemin'
I'm 'bout to heat these niggas up like a soup and eat 'em
I chew these niggas like some Wrigley gum, believe it
I pop the deuce and chop the roof up the coupe, conceited
That pussy pink inside like filet mignon!
Little man, this the wettest dream
Make the pussy cream like you've never seen
Peelin' off in a banana Lamb
Custom Kente cloth on my Timberland
Big Banks, big bankroll
Big Pamela Ann's in ya camera lens
I freak it, pop it, throw that ass
He work all week to throw that cash

Ugh, he gon' spend a check
He gon' ice me 'cause my body bangin' like a Genelec
Picture perfect pussy, pretty sex
VVS, my diamond choker, now I'm really getting wet!
You bitches ain't a threat
If I super-soak your nigga you gon' really be upset
He said my pussy is the best
Throwing dollars for the baddest bitch, I came in to collect",https://genius.com/Azealia-banks-1-800-nu-checks-lyrics
Ain’t Know,Business and Pleasure,2020,"Ladies and gentlemen, cinnamon, feminine
Got plenty of flavor
I'm popping and non-stopping and
Keep dropping that paper
This popular chocolate confidence
I'm blocking them haters
I'm opulence, prominent, time for this
Gun pow to the blazer

Got liquor on the pour
Throwing money on the floor
Pussy swinging from a pole
Gotta pick it up and go
Got your nigga on the phone
Bet you bitches ain't know
Got liquor on the pour
Throwing money on the floor
Pussy swinging from a pole
Gotta pick it up and go
Got your nigga on the phone
Bet you bitches ain't know

Yo, Teflon on the vest
Pump in the trunk in the tech
Hoes really thot for a check
Niggas wild for respect
Pull off the lot in the S
Scooped up your bitch now it's off to the jet
Go, let me see your thighs and your breasts
Better yet, make this a bet
Putting list on the set
Slide into style, when it's wet
Ménage à trois 
I'm that gentleman, 
Quick with that trigger hands
 man
Who the fuck wanna ride?
 45

 for the crown, now 

Got liquor on the pour
10 carats on the lobe
Yeah, nigga got hoes
New pussy on my phone
Gettin pussy on the go
She got a pussy made of gold
Got liquor on the pour
10 carats on the lobe
Yeah, nigga got hoes
New pussy on my phone
Gettin pussy on the go
Bet you bitches ain't know

Back to the boom boom bass
Little bit of booze and a chase
Wiggle when I move and I shake
Lady snake, dominate
Jigglin the boobs in ya face
Hit the perico with some old niggas
Mm, mm, aye
Jimmy Choo shoes in the safe
Two chopsticks on the plate
True to the game
Roof off the coupe in the day",https://genius.com/Azealia-banks-aint-know-lyrics
Black Madonna,Business and Pleasure,2020,"'Bout to get a bag
Show some ass, he spending this cash
Rich and bad, these bitches mad I got the gift of gab
Niggas ass, .40 mag in my Birkin bag
Click and blast, take out the trash, dumping 'em
Got to get a bag
Show some ass, he spending this cash
Rich and bad, these bitches mad I got the gift of gab
Ugh - .40 mag, I'm working 'em bad, ay, uh

Black diamonds, blue dollars and purple clouds for Black Madonna
That calico shred ya fitted, I got it if you want it
Guess I’m poppin ya topper like Jiffy Pop, jelly ya donut
Lil’ mama's a rider, she get them dollars and get going
Put li'l mama in Prada/lacy Provocateur, he zonin'
I'm choppin' that powder, that Oochie Wally, get him open
He slurpin' punana, I point the silencer then smoke him
Robbed him out his Gabbana and hit the highway hit the... oh

Got to split this cash with some bad bitches in the Jag
Digi dash, duffle the stash, then pump on the gas
It's a wrap, yes, it's a wrap if these bitches rats
Ugh - cheese in they crack, 'cause bitches is rats
Got to get a bag, show some ass, these bitches is mad
.40 mag in my Birkin bag, yeah
These niggas ass, I'm workin' em bad, ay, uh, uh, ugh

Fuck what you heard about me
Cold killer, Hillary Rodham with the murder count
She ain't no BM, no nigga bottom bitch workin' a route for cheese
I'll catch ya, cook ya, then murk ya
Cold pistol, wop ya then dirt ya
Clean you safe like detergent
They lurkin', I put that work in
Cook it up then I serve 'em
Then shake the spot like I'm twerkin'
Rider provider, hot box the chopper
Jealous niggas keep talking my stock up
Just send a drop, big big bazookas be scorching your block up
I make it hot up in this bitch, you want hell you can find it
Big Black Madonna pack the clips with the hollow tips and unload
Time to collect your soul, tip toe in the door",https://genius.com/Azealia-banks-black-madonna-lyrics
Nirvana,Business and Pleasure,2020,"Si-si, ah
Si-si, ah

No te enamores
No te ilusiones
Somos salvajes
Tu no me conoces
Bitch I'm the real deal
My diamonds son bien frios
Si tu me preguntas lo que a mi me gusta en la cama soy ""Kill-Bill""
Soy una freak, esa es mi fama
Pero en la mesa, yo soy una dama
Vestida de Prada y en la minifalda
Si te comes todo me quedo sin nada
Y es un placer, no digas nada
Y yo como bala, ya nadie me para

Tan pronto el me dice que me ama
Pero solo lo que quiero a la cama
Dale con calma hasta la mañana
Aprovecha en la noche que ya no hay mañana
Yo soy la princesa, tu eres la rana
Y yo lo que quiero es llegar a nirvana
Llegar a nirvana
Llévame a nirvana
Llévame a nirvana
Llévame a nirvana

Yo no quiero que tu pienses que te quiero ni un poquito
Lo que quiero es doggystyle, y se llama perreito

So seductive in expensive gowns
I got on princess cuts
I'm feeling frigid now
He in Armani tux
I'm gettin' pregnant now
No prenup on
We gettin' married now
Fucked up on me when he skated town
You know that dick was good
I'm bout to bust him down
I'm bout to bust up out
All you fuckin' clowns
Niggas kiss the ring but never touch the crown

Tan pronto el me dice que me ama
Pero solo lo que quiero a la cama
Dale con calma hasta la mañana
Aprovecha en la noche que ya no hay mañana
Yo soy la princesa, tu eres la rana
Y yo lo que quiero es llegar a nirvana
Llegar a nirvana
Llévame a nirvana
Llévame a nirvana
Llévame a nirvana",https://genius.com/Azealia-banks-nirvana-lyrics
Mamma Mia,Business and Pleasure,2020,"Niggas if you want to
I'mma come thru
It's jane of the jungle
Guerillas with bananas
I'mma shoot you and your whole crew

I got feed the demon now
You know the prima-primma donna pack the heater got the armor
Yung rapunxel, kill you if you want to
If you niggas fuck with me
Then you better duck from me
You's a duck to me, niggas wanna cuck for me
I let it loose these niggas' life ain't worth a buck to me
I got the noose, these lil niggas on the run from me
Pack the deuce, I'll hit these niggas with a buck fifty
I'm Mama Goose, these little bitches little ducks to me
They telling stories like I'm not a legend up millions
They wanna suck pussy, bitches wanna suck tiddy
What the fuck you want from me?
He can't fluster me, now he got a crush on me
I don't stress niggas, niggas don't impress me
I seen them checks coming in that tarot deck bitches
That crystal ball said ya nigga wanna sex me
I'm sipping cliqout, ball like 23, hoe
That pussy moist I toss them panties like a free throw
All eyes on me like they peepin' thru the peep hole
I'm mvp, these little bitches wan't the cheat code
Uh, now I'm bleeding out ya speakers
Leave these niggas bleeding on the marble floor like Gina
I'mma snatch a nigga right up out his sneakers
Send him to Jehovah, yea he bout to meet the reaper
Now ya mama with the deacon picking out ya plot
You in the cemetery reeking, uhh
Now I'm sipping on some peach fizz
Hit that myx moscato like I'm nicki on a meeting
You niggas soft like some peach fuzz
Fuzzy like some pussy hair, squishy like my D cups

Bitch come get ya nigga
I don't wanna meet him
I don't wanna feed him
I don't feed niggas, I don't really need him
He could fuck them bitches, I don't want him
I don't need him
Now that molly peaking, and that pussy wet
I'm bout to fuck him thru the weekend
It's ruger season, sally dropping seashells
I'm on the seashore, waiting for some kilos
Ask for the money, now these niggas got amnesia
I pull the eagle out and hawk 'em like chihuahua
Niggas chihuahuas keep ya little dollas
I ain't with the rah rah
Gangsta Senorita
I pull the Ak Out, I call her ""MAMMA MIA""
Spray these niggas out like some roaches on the freezer

You think you wifey, you a skeezer
Fucked ya nigga raw and then I kicked him out like FIFA
Them rhymes is gettin' deeper
Pretty like Melania, this pussy on a visa
I'm Mulan with the sword
Leave a deep cut
Niggas owe me cheese
I slice his face up like a pizza
Soy la nińa, hit you with the nina
Mira la pinta, oh, Santa Maria!
I get spooky on the altar, Santeria
Turn ya into a ghost, I bet I'll make you a believer",https://genius.com/Azealia-banks-mamma-mia-lyrics
Come for Me,Business and Pleasure,2020,"Uh
I'm sitting up comfortably
You was not come to me
Say bitches come for me, never do come for me
What is this something that these bitches want from me
Must be the sight that I'm livin', so
Into the race and I'm owning the course
You talkin' bout shit that you can't even sport
Livin' real large, right up on Mars
Up the space cars, the city is ours

Never been a fan, never been a jan
Never in the band, only one, bitch I'm all about the gram
All black gear in this bitch like I'm Westley
Sniper on my side, yeah I'm callin' him my bestie
You don't wanna check me, do you wanna stoop now?
Bitches in the hefty
Mad cuz' my name ring bells with 'em
Mad cuz' my spot, that you want it, but that it ain't yours",https://genius.com/Azealia-banks-come-for-me-lyrics
Silva (Demo),Business and Pleasure,2020,"It's pretty misses in pretty Benzes, it's pretty vicious
It's pretty women in pretty lenses, it's Bambi bitches
This pretty princess is her, bitches to be specific
From tiara to fur, I reign with these bitches

Once upon a time
Little Bambi will shine
Designer on her mind
Vodka, soda and lime
Misbehavin' all the time
Stayin' up on her grind
Your lady hit it on
The A.B. baby heroine
Your lady’s clearly alarmed
Ya mocha almond pecan
It got ‘em open the, ah
It got ‘em hoping she worn
The chip, benji, the coins
The haters bit it and scoring
She made it bigger, of course
The diva hustles, a don
The primabella performs, this nigga watches her charm
Let me g-get it, get it, anyway that you want
Get the taste of the plum, the nectar is always warm
A kiss under the sun
I'm fairytellin' for what, nigga?

It's pretty misses in pretty Benzes, it's pretty vicious
It's pretty women in pretty lenses, it’s Bambi bitches
This pretty princess is her, bitches to be specific
From tiara to fur, I reign with these bitches

Once upon a time
Bitches they tried to climb
Trip up and slip, they tryin'
These castles are clearly mine
Sweet kisses like lullaby
Slide in the pumpkin five
Feminine, femi-nah
That's something you're nothing like
P-R-E-T-T-Y, I'm one plus with the nine
Fine, gorgeous and giddy
Giddy, gully and grime
At any instance of time, I'm making gentlemen rise
The princess of the prize, I'm flip ‘em and redesign
These are princess cut, the princess is living plush
The mistress of the lux, if you live it then lift your cup
Bambi yummy, the honey bunny
Know you want me touched
My money, hungry
Homie, if you want me then hook me up

It's pretty misses in pretty Benzes, it's pretty vicious
It's pretty women in pretty lenses, it’s Bambi bitches
This pretty princess is her, bitches to be specific
From tiara to fur, I reign with these bitches",https://genius.com/Azealia-banks-silva-demo-lyrics
