title,album,year,lyrics,urls
Desperado,Broke with Expensive Taste,2014,"Yeah, you know what it is, it's Hot 97
My name is Peter Rosenberg, and, uh
We're gonna get to some new music right now
This is a record called ""Desperado""
Okay, by my girl, Azealia Banks
Man, I've been waiting for Azealia Banks
Waiting for Azealia Banks
Waiting for Azealia Banks

(Desperado)
Up's and ups, seductive pup
Flux - did a dip, pack up then strut
Up’s nigga, w-what’s up nigga?
With that buck, can i get that rrr-rompin’ uh?!
Mutts in tux, deluxe and such
I be in the mirror lookin' Luxe N Plush
Looks and such, seductive strut
I be Aquafizzy or that Passion Punch
Or the Fashions Munch, but the fabric’s lush
You don't get the access; none
Spun him on my axis - Sun
Hit him with the hazard, hun
Denim and a satin rump
Blend it with the carrot blush
Plus I got the cash and the bass have you spazzin' some
Come get your limps in bum
Dinner with the princess one
Printed in expensive funds

Hey, yo!
That's how I do my thing!
Desperado!
Hey, yo!
That's how I do my thing!
Desperado!

I be pretty, prissy, plenty plush and stuff
You be piggy-pissy, penny-crushed and crunched
Crust and dust, slumped and jumped
Queen scissor-cut suit, other's not trump
Giddy up, this buck - titty tuck, no such
I be freaky frizzy in the front and up
You be very sleazy lady-lump hip-strut
Betty-bump this bun, parrrump-pun-dun

Hey, yo!
That's how I do my thing!
Desperado!
Hey, yo!
That's how I do my thing!
Desperado!
Hey, yo!
That's how I do my thing!
Desperado!
Hey, yo!
That's how I do my thing!
Desperado!
Hey, yo!
Desperado!
Hey, yo!
Desperado!

We're sorry, your call cannot be completed as dialed
Please, check the number, and dial again
And dial again
And dial again
And dial again

Desperado!
Desperado!
Hey, yo!
That's how I do my thing!
Desperado!
Hey, yo!
That's how I do my thing!
Desperado!
Hey, yo!

Hit 'em with that acid tongue
Venom in that Python Pump
Bet he hunt this hun
Here the huntress come
Get amongst this one
If the freaky function fun
I could be the perfect one
Splurgin' on the purchase, yum
Mergin' on the purpose, won
When the verse is spun, I'ma Hertz this
Can't-can't rehearse this, none

This is 147th street
Next is 157th
Desperado!",https://genius.com/Azealia-banks-desperado-lyrics
Chega de Saudade,Fantasea II: The Second Wave,2016,"Vai, minha tristeza
E diz a ela que sem ela não pode ser
Diz-lhe numa prece que ela regresse
Porque eu não posso mais sofrer

Chega de saudade
A realidade é que sem ela não há paz
Não há beleza, é só tristeza, melancolia
Que não sai de mim, não sai de mim, não sai

Mas se ela voltar, se ela voltar
Que coisa linda, que coisa louca
Pois há menos peixinhos a nadar no mar
Do que os beijinhos que eu darei na sua boca

Dentro dos meus braços
Os abraços hão de ser milhões de abraços
Apertado assim, colado assim, calado assim
Abraços e beijinhos e carinhos sem ter fim
Que é pra acabar com esse negócio de você viver sem mim
Não quero mais esse negócio de você viver sem mim",https://genius.com/Azealia-banks-chega-de-saudade-lyrics
The Big Big Beat,Slay-Z,2016,"Uhh, I'm interrupted... Sometimes I wish I never got the motherfucking thing
Uhh, I'm interrupted... Sometimes I wish I never got the motherfucking thing
Uhh, I'm interrupted... Sometimes I wish I never got the motherfucking thing
Uhh, I'm interrupted... Sometimes I wish I never got the motherfucking thing

Guess who up in this bitch?
Catch you duckin' this clip
Dick, who want it? My nigga it's nothin'
Them boys young drummers, y'all niggas keep gunnin'
But y'all niggas ain't gutter like me
Look at this bitch, magazine cover this shit
Young sex seller, yeah, bitch, keep mumblin'
Fuck how you feel, a young bitch keeps thuggin' it
Nigga, I'm still in these streets
Look at this wrist, look at these colorful chips
Look at these tiddies, double D's, it's double-dutch
I be on the strip, dungarees with the bubble butt
Pumpin' that kilo, that ki!

A to the B!
Dance to the big big beat
Dance to the big big beat with a bitch like
Dance to the big big beat
Dance to the big big beat
A to the B!
Dance to the big big beat
Dance to the big big beat
Just like this, the big big beat
Dance to the big big beat

You've been 'round the world
Looking for love in the strangest places
Don't you think it's time you confess your love to me?
Shining diamond
All of your facets you've so many faces
Bet your evil smile'll convince anyone who sees
You've been 'round the world
Looking for love in the strangest places
Don't you think it's time you confess your love to me?
Shining diamond
All of your facets you've so many faces
Bet your evil smile'll convince anyone who sees

Ooh, boy, ooh, boy
Ooh, boy, I think I know just what you need
Ooh, boy, ooh, boy
Ooh, boy, yeah you need a taste of ecstasy
Ooh, boy, ooh, boy
Ooh, boy, I think I know just what you need
Ooh, boy, ooh, boy
Ooh, boy, yeah you need a taste of ecstasy

Uhh, I'm interrupted... Sometimes I wish I never got the motherfucking thing
Uhh, I'm interrupted... Sometimes I wish I never got the motherfucking thing
Uhh, I'm interrupted... Sometimes I wish I never got the motherfucking thing
Uhh, I'm interrupted... Sometimes I wish I never got the motherfucking thing

Pocket them dividends, christen that bezel
You plottin' on niggas, you pickin' that petal
How could that little young bitch from the ghetto hit the jackpot, ran off with the cash pot!
Keep jockin' this jiggy bitch, jigglin' - hello!
That gymnast body, black feminist rebel
Spend a hundred thou' on the Jesuit medal
Just to prove y'all dudes what it be!

Just like this, dance to the big big beat
Just like this, dance to the big big beat
Just like this, the 1, 2, uh, dance to the big big beat
Just just like me, the big big beat
Here comes the big bad witch from the big big beat
The big big beat
It's the big big, uh, beat
The big big beat
Here comes the big bad witch from the big big beat

Niggas I'm in these streets
Ice cream, butter roll
Chips with bubble gum
Nails with the tips
Gold chains - what a gutterbutt!
New York City everyday what the fuck is up
Haters, I hit 'em real deep in the jugular
Look at this sex -OD",https://genius.com/Azealia-banks-the-big-big-beat-lyrics
Used to Being Alone,Slay-Z,2016,"How does it feel?
(Stuck in my mind)
How does it feel to..
How does it feel?
(Stuck in my mind)
To treat me the way..
How does it feel
To treat me the way you?
How does it feel
To treat me the way you do?

Stuck in my mind
Stuck
Stuck in my mind

Oh, it took so long to get over ya
How do I prepare?
When I swore I'd never see you again?
And now you're here
Looking as surreal as before
(Stuck, stuck in my mind)
Now that I am so used to being alone..
Oh, it took so long to get over ya
How do I prepare?
When I swore I'd never see you again?
And now you're here
Looking as surreal as before
(Stuck, stuck in my mind)
Now that I am so used to being alone..

How does it feel?
How does it feel to..
How does it feel
To treat me the way?
How does it feel
To treat me the way you?
How does it feel
To treat me the way you...",https://genius.com/Azealia-banks-used-to-being-alone-lyrics
Along the Coast,Slay-Z,2016,"Oooooh, hey
Boy I know you know, I said, I say I know you know
That you make me emotional, fill my heart, body, and soul
It's the push and pull, please explain just how you know
How to make me so vulnerable, this love is a roller coaster

Along the coast, come find me along the coast
Sudden raindrops condense and fall
From above me when I'm below
Let your love explode
Boy, please let it overflow
Don't release me, don't let me go
Till the sun rises in the morning

Along the coast, come find me along the coast
Can I watch while you row your boat?
I love the way you stroke it
I know you know, boy I say, I know you know
I'll be missing you until the next time we're along the coast
Yeeeaaah

It's alright for you to touch my ooooh
Hold me tight, you know you feel so good
Spend the nights under the stars and moon
Make it last until the afternoon

Dewy dawn, a misty morning breeze
Set ablaze an entire forest of trees
That's fine by me...

How low can you go? How deep does your love go, baby?
Let me, let me know, make love on the ocean floor
I know you know, boy I said, I know you know
I'll be missing you until the next time we're along the coast
Yeeeaaah, yeeeaaah, yeeeaaah",https://genius.com/Azealia-banks-along-the-coast-lyrics
Can’t Do It like Me,Slay-Z,2016,"Bitches better off leavin' their mans at the hotel waitin'
Playa's drinkin', posted up flingin' out bands
That's for them hoes be naked
Poppin' pussy, rollin' it, shakin' it
Smokin' hot, boiling pot
She got that cho-cha, that cobra, that clutch 'em up
I make 'em wild, I make 'em holla
I blow these niggas away now
Won't fuck a nigga twice
Smokin' aces, rollin' dice
Rice and peas on my hips and thighs
Python g-string hypnotize 'em
Motorboat, motorbike
You should be lucky I even acknowledge you
You should be lucky I shot you that alley-oop
You was just cruisin' the streets, nigga

Pretty A.B., them bitches can't do it like me (no way)
American dream, pussy be peppermint clean (okay)
You sweatin' that steez, I'm hot like a hundred degrees (okay)
Pretty A.B. bitches can't do it like me
Pretty A.B., them bitches can't do it like me (no way)
American dream, pussy be peppermint clean (okay)
You sweatin' that steez, I'm hot like a hundred degrees (okay)
Pretty A.B., y'all bitches can't do it like this

Custom bodice, that bougie babe
That diva donna, that...
Chocolate bombshell, honey glazed
She bustin' out of her bustier
Rich niggas, what up?
Burn them fuckin' hundreds
Christian Lacroix fits, fill her pockets
Trips to the tropics, I want it
I let him spend this paper, but I never lick his lolli'
He eat my pussy out and sing to me like Champagne Papi
Lodi-dodi, 
now who gon' fuckin' stop me?
I'm chasin' the buck, I get it
That's why niggas got to watch me
Woke up in the projects, ended up in Tijuana
I had to fill my pockets, had to holla at my gualas
Dollars, commas, get it, the whole enchilada
Dame pesos, papi, tu prende nigga, copy
Shout out to my ockees and all my freaky hotties
Bitches gettin' money, smokin' like selassi
Let me rub them hundreds all over your body mami

Pretty A.B., bitches can't do it like me
Y'all bitches can't do it like me
Pretty A.B., bitches can't do it like, uh, uh
Y'all bitches can't do it like this
Pretty A.B., bitches can't do it like, uh
Y'all bitches can't do it like this",https://genius.com/Azealia-banks-cant-do-it-like-me-lyrics
Skylar Diggins,Slay-Z,2016,"Riding with my niggas who hustle
We with all of that
Hundreds stuck to hundreds in the duffles
Trunk full of moneybags
We in love with the money and it loves us back
Bottom to the top of the globe, so where the fuck it’s at?

Niggas, bitches, killers, bust that
Hustlers, ballers, gangstas, hoes
Harlem, Brooklyn, Queens, Bronx on my back
New York City, you with me, let's get involved

I said that money keep callin', yeah it keep callin'
If you ain't with the shits bitch get up off the toilet
Snatch ya nigga, spoil him, ditch him and ignore him
Skylar Diggins with the wrist
That bitch ballin'
That bitch ballin', yeah that bitch ballin'
Skylar Diggins with the wrist
That bitch ballin'
That bitch ballin', yeah that bitch ballin'
Skylar Diggins with the wrist
That bitch ballin'
That bitch ballin', yeah that bitch ballin'
I said that money keep callin', yeah it keep callin'
If you ain't with the shits bitch get up off the toilet
Snatch ya nigga, spoil him, ditch him and ignore him
Skylar Diggins with the wrist
That bitch ballin'
Bitch ballin', yeah that bitch ballin'
Skylar Diggins with the wrist
That bitch ballin'
Bitch ballin', yeah that bitch ballin'
Skylar Diggins with the wrist

Watch bitch run through that bread
Get it back in half a day
Make shit move without making moves, I'm feeling like Jean Grey
Feeling like EA, it's my way, I'm in the game
I'm on the roll, I knock 'em down, bitch stay up out my lane
Really ma, I let 'em fly, let one go in your frame
I ain't with the games, no, I ain't with the games
Run 'em down they acting shocked like they just got tazed
Going through a phase while I'm running through these M’s
So much love feel like a honeymoon
Watch the mother goon in her Timbs
My bathroom like your bedroom, bitch better clean your lens
And it's so much, I won't run out of it
I be the realest, them bitches is counterfeit
Way too fly, racking up mileage
And balling so hard I had to skip college, bitch

Niggas, killers, bust that
Hustlers, ballers, gangstas, hoes
Harlem, Brooklyn, Queens, Bronx on my back
New York City, you with me, let's get involved

I said that money keep callin', yeah it keep callin'
If you ain't with the shits bitch get up off the toilet
Snatch ya nigga, spoil him, ditch him and ignore him
Skylar Diggins with the wrist
That bitch ballin'
Bitch ballin', yeah that bitch ballin'
Skylar Diggins with the wrist
That bitch ballin'
Bitch ballin', yeah that bitch ballin'
Skylar Diggins with the wrist
That bitch ballin'
Bitch ballin', yeah that bitch ballin'
I said that money keep callin', yeah it keep callin'
If you ain't with the shits bitch get up off the toilet
Snatch ya nigga, spoil him, ditch him and ignore him
Skylar Diggins with the wrist
That bitch ballin'
Bitch ballin', yeah that bitch ballin'
Skylar Diggins with the wrist
That bitch ballin'
Bitch ballin', yeah that bitch ballin'
Skylar Diggins with the wrist
With the, with the, with the wrist",https://genius.com/Azealia-banks-skylar-diggins-lyrics
Big Talk,Slay-Z,2016,"Ya I know y'all seen that Playboy cover
Bring your sexy ass in here
All I know is that big talk
All I know is that big talk
All I know is that big talk
Banks!
(Maybach Music)

All I know is that big talk
Gold rings, got gold buttons
Going up and down my sheep skin
We the wolf pack and it's a cold summer
Never deep, I keep one gunna
Say her name I might run up on ya
Send that text ""I wanna touch ya girl""
If they don't fuck with us, well, it's fuck the world
Ice box for my princess
Got a double M on that pendant
And back in, I'm bout to spend that
Got a big bag and I been rich
We make love and she talk slick
G-Wagon, she a boss bitch
Major League in that boy pitch
Major League in that boy pitch
Mussolini when I'm out in Rome
Cleopatra, she dipped in gold
Pussy shot and she centerfold
Bel-Air and my mind blown
Rosé and I'm checking out like Caesar did
Slide down my sword
She a blasphemy cause she love The God
Pray you never let 'em come crucify the boy

Black magic, David Blaine flow
Colour money like a rainbow
Azealia Banks keep the bank rolls
Shine like illuminated Angels
Bad bitch, I'm bodacious
Black power but I'm no racist
Balling, I don't need no agent
In the Maybach feelin' so spacious
Focused on another hundred thou
Going up another level now
Nigga's wildin', better settle down
Got the Rollie diamonds in the bezel now
Take notes, get your pen and pencil
With Ricky Ross, we quintessential
Ain't nothing here incidental
We poppin' off on instrumentals
Slide off in the Rolls Royce
I'm slaying bitches in a grey mink
You can slide on it like escapades
This ice on me like a skating rink
Big talk, big bank
Pussy wetter than the Great Lakes
And for this life, I'mma give thanks
And pray they never gon' burn a witch at the stake

All I know is that big talk
All I know is that big talk
This conversation is rich talk, niggas
All I know is that big talk",https://genius.com/Azealia-banks-big-talk-lyrics
Riot,Slay-Z,2016,"We could start a ri-i-i-iot, start a riot
We can start a riot, we can start a riot
We could start a ri-i-i-iot, start a riot
We can start a riot, we can start a riot
We could start a ri-i-i-iot, start a riot
We can start a riot, we can start a riot
We could start a ri-i-i-iot, start a riot
We can start a riot, we can start a riot

Hold up, hold up, disorder
We cause a scene and you're the reporter
We got a riot on our hands
Shits no fun without the clan
I like unrest, understand?
I like conflict and command
I like guzzling the appleton
I like battle hand in hand

I'm not afraid to fight
Anytime the fire rises
Come on everybody-body (Follow, follow)
We gon' get it started, started (Let go, let go)
Come on everybody-body (Follow, follow)
We gon' get it started, started (Let go, let go)

We could start a ri-i-i-iot, start a riot
We could start a riot, we could start a riot
We could start a ri-i-i-iot, start a riot
We could start a riot, we could start a riot
We could start a ri-i-i-iot, start a riot
We could start a riot, we could start a riot
We could start a ri-i-i-iot, start a riot
We could start a riot, we could start a riot

Hold up, hold up, firestarter
Say the wrong thing and get yourself slaughtered
How many fists would it take to land, to slap that bitch back to Babylon
I like unrest, understand?
I like being in demand
You'll be dealing with the consequence
You'll be leaving in the ambulance

I'm not afraid to fight
Any time the fire rises
Come on everybody-body (Follow, follow)
We gon' get it started, started (Let go, let go)
Come on everybody-body (Follow, follow)
We gon' get it started, started (Let go, let go)

We could start a ri-i-i-iot, start a riot
We could start a riot, we could start a riot
We could start a ri-i-i-iot, start a riot
We could start a riot, we could start a riot
We could start a ri-i-i-iot, start a riot
We could start a riot, we could start a riot
We could start a ri-i-i-iot, start a riot
We could start a riot, we could start a riot

We could start a ri-i-i-iot, start a riot
We could start a riot, we could start a riot
We could start a ri-i-i-iot, start a riot
We could start a ri-i-i-iot, start a riot
We could start a riot, we could start a riot
We could start a riot, we could start a riot",https://genius.com/Azealia-banks-riot-lyrics
Red Flame,Unreleased Songs,2016,"Uh
You know, ah
Ha
Let's go
[Chorus: Lady Gaga & 
Azealia Banks
]
Patent leather
6 inch, high heel
Ostrich, platform
Mary Jane, thirty-seven
Red flame (Yes girls, pump it)
Now walk, now walk, now walk
I wanna see you pump it
Now walk, now walk, now walk
(Ha, don't be mad 'cause they always said you'd free-fall)
I wanna see you pump it

Pump it bitch, to the haters a verse
6 inch, lizard skin, alligator, the purse
Shoe game six, six, and steipers and Birks
I like it, I perch
Vixon and viper the first
Viper the first
You like two and a third
Like who is this bird
You like who in the fur
You heard it a her
Little heffa in the flat 10 dollar skirt
Bitch, 
never spit the stack on the frock of the purse
The buzz of the block, why nah-nah be the word
The stock of the hills
Spit fire flame for real
When I vamp down the catwalk, I pump it for real
Liquorice lipstick, candy coated, the deal
[Chorus: Lady Gaga & 
Azealia Banks
]
Patent leather
6 inch high heel
Ostrich, platform
Mary Jane
, thirty-seven
Red flame (Yes girls, pump it)
Now walk, now walk, now walk
I wanna see you pump it
Now walk, now walk, now walk
(Ha, don't be mad 'cause they always said you'd free-fall)
I wanna see you pump it

Pump this, promote this
I know you notice this skill
Notice these high boots plus the focus could kill
Beauty Bambi, young, determined and willed
No previews, baby, it's only premieres

I don't, I don't kn-know what you want
But I know, kn-know that you don't want
None, no you don't want none of me
No, not today
Not today, boy, don't misbehave
Ok, ok

'Cause it's little A-B, Lady G-A-G-A
Tell your little DJ, better hit that replay
Listen up my nigga when I'm sipping Clicquot
Lemme hit that weed, hey, lemme feel that freak-ay
Finna pop a pill and get that feeling she chased
When I dip and plié
Gimme, gimme leeway
Bitches on my rhythm, off that Heem and he say
He remember me-ay
He remember me-member me
[Chorus: Lady Gaga & 
Azealia Banks
]
Patent leather
6 inch high heel
Ostrich, platform
Mary Jane, thirty-seven
Red flame (Yes girls, pump it)
Now walk, now walk, now walk
I wanna see you pump it
Now walk, now walk, now walk
(Ha, don't be mad 'cause they always said you'd free-fall)
I wanna see you pump it",https://genius.com/Azealia-banks-red-flame-lyrics
La Dominadora,Unreleased Songs,2016,"Now!
I could pop the pussy like a cola-coka
Take the stick of bubble
If you ballin, bet em double
Bet the base, I'll break ya
I could make the call and get the
And getcha ace to snake ya
It's that primadona, diva don
Let's get that fuckin' cake up

Look at that feminine switch
Look at her lickin' her lips
Look at that body, - my niggas they love me
I whip it in circles
They spend like they owe me
I get it, I get it, I get it
Bitches be all in they feelings
Got the game on lock, the illest and I run it
Niggas come about a dime a fuckin dozen
You could think ya hot, but who already done it
Bitches talkin shit but never got budgets
You know what it is
That's what it, that's what it is
The fuck what it is
It's always official whenever I'm at

Doin' - it propa
I flew in on a choppa
I pull up, I shock em
All my wigs colossal
This is sexy, persuasive
My house on 40 acres
I wake up, count cake, yup
That's million dollar pay stubs
Buncha lawyers and bankers
Email me my statements
Rubber bands, silver Lam
Hunnid grand in my Jacob
I see ya man, he a fan you a hater
You know Rih gettin' cash
Blowin' gas in the air",https://genius.com/Azealia-banks-la-dominadora-lyrics
Chi Chi,Business and Pleasure,2017,"Hands up, it's a hold up
Keep them pies hot nigga
, pack the heater in the holster
Slip the clip in and pop they tried to G me on the quota
I could picture ya noggin' rockin', you peasy on the corner
I stretch it with the soda
Whip the cream to the top, pot Betty with the shoulder
Got the keys to the drop top, but I'm in the Rover
Keep them fiends on that clock, clock,
 came to get the dough up

Niggas, I be wildin' for that cheddar, for that paper
Island hoppin' in Bahamas, helicopter to Jamaica
Puerto Rican papi got that product and that peso
Get that perico
 on Broadway
Chi Chi get the yayo
You know I'm about it, every dollar on the pay roll
Tell 'em niggas we be grindin' till the motherfuckin' day o'er
Bet you read about it, bet you plottin', bet you hatin'
Get that perico
 on Broadway
Chi Chi get the yay

Hear my Lexus purr, 
I just crept to Jers'
Got genuine leather interi and my texture fur
Icy bezel, I'm freezy and my necklace splurge
Watch me run up on them niggas with that tech and burst
Now niggas wreck their dough for my X and O
La Perla provocateur lace, I feed 'em sex and blow
Chi Chi got it from some gualas in Calexico
Click-c-click, blam, you be next to go

Sittin' in the drop-top
Got money in my pocket, drugs in the glove box
I don't even like ya
(Don't wanna be nothin' near like ya)

All of my bitches get money they made
All of my niggas is handsome with waves
All of these rappers is pussy
You heard they be stuntin' on wax but they really afraid
You a hi-top with a cut on your fade
Harlem shaked in the middle of the fuckin' parade
Told you to put some respect on my name
And stop talkin' that shit, 
put that check on my name
Uh, put the check in my name
Weather advisory can't stop the
 rain
I do not have time to entertain lames
Won't say no names 'cause I won't give you fames
Gang-gang-gang-gang, bang-bang-bang-bang
My niggas gorillas and orangutans
Live from the zoo, this the new 212
When I move with the crew, y'all bird niggas can't hang

Niggas, I be wildin' for that cheddar, for that paper
Island hoppin' in Bahamas, helicopter to Jamaica
Puerto Rican papi got that product and that peso
Get that perico on Broadway
Chi Chi get the yayo
You know I'm about it, every dollar on the pay roll
Tell 'em niggas we be grindin' till the motherfuckin' day o'er
Bet you read about it, bet you plottin', bet you hatin'
Get that perico on Broadway
Chi Chi get the yayo",https://genius.com/Azealia-banks-chi-chi-lyrics
Wut U Do,Corporate Rave,2017,"This rhyme is rugged, it's stamped for the streets
It's nice, it's thuggin' it, damn
NYC reppin, bricks is mints with my Nikes
It's steppin, its stance
Fuck fine french feminine, slammin' petite
Such a price is precious, this jam
Got my flights, I'm pressure than
They ain't ever seen nothing like this mademoiselle
Do all this cruise and blazin'
And beige and ocean island vacation
Tannin' all this, ooh I'm sexy
Pussy pop like a Pepsi
And I'm all on this new expression
Shades of mocha like his complexion
Tannin', foreign cruisin', blazin'
Baby, hope you like this one

Wut-U, Wut, Wut-U, Wut U Do
Wut-U, Wut, Wut-U, Wut U Do
Wut-U, Wut, Wut-U, Wut U Do
Wut-U, Wut, Wut-U, Wut U Do

I try to hide my feelings
And every time you touch me
I could break down and cry
Let's expose my devotion
To get next to you

I'm all caught up on you
What am I gonna do?
Our nights of pleasure
Only fade until the morning new
And if our love is true
I'll give it all to you

Don't you ever worry
'Cause I'm gonna make you fall in love
Kiss me all night
I'll never leave you
Ooh, you do it right
In the middle of the day
I need you in every way
Kiss me all night, set my body free
I'll never leave you
Ooh, you do it right
In the middle of the day
I need you in every way

Anytime I jump in the Jeep, yes the boys
Wave they hands cause they lovin' the beats, bass, the noise
Ice on my bezel, the keepsake a choice
I'll be damned if I'm fuckin' a cheap Jake, keloid
Now we're together, we'll be more than friends
Through the years we forever, we'll be 'til the end
Now we're together, we'll be more than friends
Through the years we forever, we'll be 'til the end

Wut-U, Wut, Wut-U, Wut U Do
Wut-U, Wut, Wut-U, Wut U Do
Wut-U, Wut, Wut-U, Wut U Do
Wut-U, Wut, Wut-U, Wut U Do",https://genius.com/Azealia-banks-wut-u-do-lyrics
