title,album,year,lyrics,urls
Star In Da Hood,The Black Rob Report,2005,"My name is star in the hood, i like the star in the hood , my name is star in the hood,my name is star in the hood, i like the star in the hood , my name is star in the hood, and i ent afraid of you blud
BRAAP im f*cking",https://genius.com/Black-rob-star-in-da-hood-lyrics
Watch Your Movements,The Black Rob Report,2005,"Lights, camera

Your man Black on the rise
Address the lies as those who plan my demise
Through the white man's eyes, I came through with guys
The same guys who gave the whole hood pies, this was back in '95
How the lame dudes lie
Talking about how I changed my strive, when I was locked inside Brothers identified
Understand they only getting three tries, then the heat gon' fly
Now it's me, you and I
Top of the world, but it's still do or die, can't wait for you to fry
As I scream ""bye, bye""
I notified, personified, who am I? The occasional fly?
Mr. Fourth of July
Sometimes Mr. Shoe, Shirt and Tie
Get the loot, hit'em high, big sevens slurve by
And people like it's the nerve of I
Nothin' worse than I

I came home from doin' time, it's do or die, ain't losing
I've been roaming through and wide ??? just cruising
Thinkin' 'bout these goons alive, but the truth is I ain't losin'
Ain't no time for you and I, so you better watch your movements

Mr. Unorthodox
Plus we got the weed on lock, couple C's gon' pop
? in the drop
We comin' through with some brand new drop
Dope phat, don't stop
This is serious knock
The workshop is so hot, honeys rockin' their pants
No tops, and we hit the whole flock
Next year, anticipate it like Pac
Y'all the laughing stock, with the strength of an ox
I locked down a couple blocks up top, and let my young gunners rock
Makin' sure your head bop
The same cat that took your watch, the same cat that went to war with Ed Cox
This is just another notch
Family, the bars rep for those who drink bourbon instead of scotch
Man, just give me my props
I'ma invest in the stocks
Plus turn back the hands of the clock



I got locked for moving crops all day
Circle blocks in a different drop all day
The fat not made them watch all day
And they still couldn't deal with me
And now I'm home, it's still hot all day
On the block where they toting Glocks all day
As long as the shots don't rock my way
Then they won't have to deal with me

Since the day of my birth
I was comin' up the worst, snatch the purse
Put my hand up her skirt, put the body in the earth
Then I thought what's it worth
Now forever, I'm cursed, I'm cursed
Bowin' down in the church
Tryna' pray to stay away from the hearse
And away from the nurse, make my rap thing burst
Man, this is for the fans, fans who slam dance like Fred Durst
Understand it's my turf
So put your boys in reverse, before I have to call ? to do work
Sittin' high on your perch
See, I came from the dirt
No name in the game, I'm the hurt
This is just another perk
It's for those puttin' out that street shit, come through with that jerk
Certain words I blurt
Fam, you can get a price on your head
Then some holes in your shirt",https://genius.com/Black-rob-watch-your-movements-lyrics
B.L.A.C.K.,The Black Rob Report,2005,"B.L.A.C.K.R.O.B
I got a, freaky, freaky, freaky lil flow
Lock the town like Fidel Castro
Went straight to jail, did not pass go
(Aiyyo Black can we ask you a question?), no
Now back to live action, dust my shoulders off on this track, I'm just practicing
And I ain't even at my maximum, imagine if I was, this is for the love
Ladies and gentlemen, kids of all ages
You're about to go on a ride with the wild and outrageous
So buckle your seatbelts, my heat's felt
All in the ghetto, the dominator, Darth Vader creator
Officializing, signed and sealed, dot delivered
Minute, if he don't get no bigger
We never left, naw, we took a break off
You all tucked in? We about to take off

Now there's a rumor being spread about me and the team
And a couple wild brothers outta 115
Y'all might not have heard it, some cat got murdered
Now everybody walking around all shady nervous
I ain't sweatin that, bout to do a show in San Antonio
(Then what?), then fly back home
I calls guy on the phone, they had a car at the airport
Somethin with a chick chaffeur, butt naked in the full length fur
It's on and popping, work it baby ain't no stopping
Bad Boy is in the building, honeys catching feeling
Now we rated number one, now, sales through the ceiling
People had faith in Rob
I'm on that and run the point like Jason , god
It's one thing to be all hood
I guess its safe to say, (what?), so far so good
Black

Downtown we winding down, last call for alcohol
Scoop up your girl
You've never seen this before, that's a Bentely Four
Fresh out the store, this should be against the law
Party don't stop, can't stop, won't stop
Hit the bootlegger, pint of Rock
And I'm a get smart through the hollerin
Long as she doin less talkin and more swallowin
Now Black is what they hollerin out in the east
How he won't go away like permanent crease
And this is how I murder the streets
A lotta dudes is mad when I'm just trying to get a bite to eat
I dont care if yall just two-step to do the hustle
This is New York rapping, bring me some New York muscle
See me in the club, its nothin but love
Love the way I position myself to rise above
Black

One more time baby",https://genius.com/Black-rob-black-lyrics
When You Come Home,The Black Rob Report,2005,"I remember that day clear, the month and the year
I was hustlin, '89 Downtown in Times Square
With ten niggas, but you recognized the Commander
You went to school and worked part time at Alexander 
Chain  and kiss on the cheeks
I said some slick shit like, 'we can do this on a beach'
You laughed, straight teeth, mines was all crooky
You walked away but kept turning back, laughin and lookin
I'm gassed, I said Pity she ain't want me to leave
Then she the one, I also waiting to see
Not called you, you called me we on the same tune
I'm Uptown me and June in the game room
I was glad to hear your voice, you choice
Brown sugar, 5'5'' a body was moist
And on top at all, personalities to match
Had a lot in common, yeah we still took it from scratch

From the streets, to the Pen, lovers and friends
I'mma hold you down, I'll be here when you come home
I'll be waiting for you
I'll be waiting for you when you come home
From the streets, to the Pen, lovers and friends
I'mma hold you down, I'll be here when you come home
I'll be waiting for you (you know)
I'll be waiting for you when you come home

You was there when I signed with Diddy
You was there when  hit the city
There when I cried 
Your advice was like  from your titties
So , after a while I started flourishing
And just to think that you was sitting down
Having a couple of drinks, me and you on the 
I'm calling quits, cheatin, no matter how you call that shit
My stomach hurtin now, on the pit
And that's nonsense, you told you I was fuckin on tour
Not true, 
You know what, boo? I think I showed you too much feelings
I ain't believe when he said you fucked  from the building
It's cool-o, I let you kick me in my culo
I ain't coming back now matter how much you scream 
I spent a lot of dough on you, I put jewelery to goal on you
And that's how this all you gon do? Yo

From the streets, to the Pen, lovers and friends
I'mma hold you down, I'll be here when you come home
I'll be waiting for you
I'll be waiting for you when you come home
From the streets, to the Pen, lovers and friends
I'mma hold you down, I'll be here when you come home
I'll be waiting for you (you know)
I'll be waiting for you when you come home

I admit now, time is hard
Fucked out, I was locked up, you 
We missed each other, guess it's so used to you
Everything about the shit that we used to do
It's spice you cookin, you give a nigga real good lovin and
That's why we still snap back, like a rubberband
Another man can't do what I do, I got you
I said the sky is blue and is blue
You fam, you know was better enough you fucked with Scram
Got you actin up for , smuggling grams
What you want, ma? Ha, the house or the car?
Yeah I know I'm locked down, but I'm still B.R
And love, before a minute there I thought you lost me
I got three and a halfin, happy home shortly
You probably thinkin I'm just poppin shit
Like some nigga get home and do 

From the streets, to the Pen, lovers and friends
I'mma hold you down, I'll be here when you come home
I'll be waiting for you
I'll be waiting for you when you come home
From the streets, to the Pen, lovers and friends
I'mma hold you down, I'll be here when you come home
I'll be waiting for you (you know)
I'll be waiting for you when you come home

Ma, listen I gave you respect because you earned it
You still here fucking with me, could  you see?
Ma, soon as I touch I'm getting money soon
We gon do the engagement, then the Honeymoon
I'm feeling you, you coming or what?
What's crazy, me standing here spilling my guts
How dreams ain't gon turn to dust?
Long is all about me, you and the all outta us

From the streets, to the Pen, lovers and friends
I'mma hold you down, I'll be here when you come home
I'll be waiting for you
I'll be waiting for you when you come home
From the streets, to the Pen, lovers and friends
I'mma hold you down, I'll be here when you come home
I'll be waiting for you (you know)
I'll be waiting for you when you come home",https://genius.com/Black-rob-when-you-come-home-lyrics
They Heard I Got Life,UnKnown,2005,"Didn't I tell you what I'm gonna do?
Here's where I'ma tell you what I'm gonna do
Lights and cameras...I hear that...We love it...Bad Boy bitch fire
I'm wild known in Miami
Puff and Nelly told me
You ain't gotta kill nothing to win no grammy
I keep a thing handy
In case a coward mistake me and think BR's a piece of candy
I used to play the block, moving butter
For that Calcutta, your pockets is Chris Rock
I make em stutter
Ice is pinky
Eyes is chinky
Ho's is kinky
Layin on that full length minky
The jail stank all on my name
It's a fucking shame
So I had to reassess my game and the whole aim
'Yo Black relax fam, show some reserve
You ain't a herb
Just a kid with gust and a lot of nerve'
I used to run up in backa you
Put the gat to you
Make you get on your knees and run your capital
I had the same dope ways of gettin paid
It was either that
Or risk my houses gettin raided
Ya'll about to witness the power of street knowledge
Fuck Long
Got my PHD from a street college
The rap game's real
So it's best you play behind the scenes
Like the ??mouse on the fifth wheel
But I can't do it
So what's the D-dot-E-Q it?
Fans rush me, it's all love ??
So when your dealing with dirt?
Play dirty
What I'ma do is come through in the blue 830
Fuck a quarter to eight
I'm on the corner of 8th
Boxin shorty with a quarter and eighth
Gotta make sure my daughter's straight
She got cake for school
And the bank accounts in good shape
Any dudes trying to get this cream?
Fam, one to the stomach
Bend em over like 6:15
Should have had my dog bite him sooner
Soon as I heard the rumor
He was trying to be Scarface junior
The confrontation short and sweet
Up north is weak
I bought the heat the whole court in the street
There the nigga go
Sipping Clicquot frontin
I'm low in the back
Hugged up with Miss Puerto Rico or somethin
????? been to Brazil with Lebanese
When he say don't move bitch you better freeze
Keep thinking your cute
We gonna turn this shit to Beirut
D? Holla at Absolute
Anytime its time to get dope call
Specially if it ain't nothin between me and duke
But sheetrock walls
If a nigga don't like me
He can lick my balls
I'm world famous for setting off ballroom brawls
I'm out west like 'Fuck the past'
You out west walking around with security up the ass
It ain't fair niggas
They call me Black Night Shamalyan:
Come through the village and I'ma scare niggas
You must don't love life
You fucking a thug's wife
Small timer, still living A Bug's Life
I'm doing 80 north I'm on the turnpike
Here light this up and tell us what that burn like
I don't believe y'all, fuck around and leave y'all
Duke a lame, why the fuck you let him breath for?
It won't stop until your teams ???
This the info, I gotta come and knock y'all senseless
Aaanybody over 25 fronted
At the end I drunk the milk like the Indy 500
It's Black-O the mack-O
Ma, you comin?
You see me
I ain't frontin and my ice is stunnin
'05, yo it must be the season for duck huntin
When I leave here tonight B I'ma fuck somethin
It's mandatory that I get in some ass
And shine on these faggots like I did in the past
You sleep?  Then I'm hittin the stash
Fam, I'm at war
That's why I watch reruns of M.A.S.H
Dudes scheme to hit up my physical
And each one said its just hate
Mufuckas is miserable
So when you come attack my brothers
Watch out: that heat
Make niggas dance like Scatman Caruthers
Ya'll punks paid the ultimate price, I'm not nice
My fourth felony, Ya'll heard that I got life
Life...Life...Life...Life...Life",https://genius.com/Black-rob-they-heard-i-got-life-lyrics
No Fear,"Game Tested, Streets Approved",2011,"Everybody talk, nobody gon' do it
Came through, defied the odds, then I grew here
I must have made 10 mill and ran through it
Baby love come and go man, so screw it
It's nothing to it
Watch me as I stick and move on this groove
While I'm duckin' the paparazzi
Only person shot me was Jonathan Manion
Before and after I was fat as Ralph Cramden
Y'all don't like the fam then shout it
Dumb, dumb, dumb, I don't like Black Rob
Let's talk about it
These motherfuckers change like the seasons
The hate that y'all harbor, 9 times outta 10 there's no reason
Committing treason, then they try to run
Forget that they got asthma, stop and they start wheezing
I see him looking for his asthma pump
I'm in that Maybach watching the ? on the plasma slumped
I'm right here daddy, I no fear
Objects in the mirror is closer than they appear
So people be advised, my eyes on the prize
This ain't an exercise or the birth of some tough guys
A lot of y'all don't figure me rich
Won't follow me around, just twitter me, bitch
And I show you how I done it, pulled out and told 'em run it
Plus I'll let you meet the fam uptown in the wild 100s
Fans wanna walk in my shoes, I give 'em a chance
My lifestyle'll make 'em defecate in their pants
Y'all don't believe me, ask the God 'bout me
He'll tell you how I hate to lose and I can't stand defeat
A product of da streets, P-O-D-S
I don't like cheques, fam, C-O-D's best
That's how I do when I do it, I'm not stressed
These chicks see me stuntin' like boy is a hot mess
I must confess, Harlem made me this way
Fuck what the chicks say, Rob don't play
So people throw your hands up and show me where the cash at
Matter fact, put 'em down, I might catch a flashback
Benz hatchback, TVs in it
Haters like ""that's my car"" till they see me in it
Head reason I go on and all my thoughts' infinite
Furthermore, y'all ain't heard the bars flow in a minute
See Rob can hold his own, ain't nothing timid
He don't sound like y'all, it's all authentic
Gimme the ball on the court, I put all the ?
Just cause I do and-1 moves, its no gimmick nigga
You're spitting limericks, your petty five lines
Wanna see the beast come out, say my name five times

Round for round, I'm down, shake the town
Shake you down, wave the pound, lays it down
P! Haha, listen, listen
Yo, the 4-5th is what I use to spark
For entertainment purpose, no amusement park
Listen pa, duke my movement's smart
Chest blow with a left throw nigga
It'll bruise your heart
Listen pa, I am not kiddin', plot thicken
Shots given to niggas who fuckin' wit' Ahk ?
Rap's my profession, the biz is reefer
I smoke more of that shit than Wiz Khalifa
1-2-6 and Madison got body bags
My gun spit shit, leave your ass in a body bag
Brooklyn's Finest, fuck police
Your wife's a cop then fuck police
Listen, nigga my thing gon' pop
Sean Price on the remix
With bank gon' pop, P!",https://genius.com/Black-rob-no-fear-lyrics
Sand To The Beach,"Game Tested, Streets Approved",2011,"Chorus
Don’t bring sand to the beach
Don’t bring sand to the beach
Don’t bring sand to the beach
Don’t bring sand to the beach
Don’t bring sand to the beach
Don’t bring sand to the beach
Everybody know that I get money
Never kiss me with no .. honey
I won’t stop beat but my team cross gun it
Holler at dollar is holler at money
Come on Sunny you brought your girl
Walk into the club look dummy
Everybody .. at you look funny
Checking out shorty with an ice on her tummy
My shit bring… she got a whole … I don’t see how
Duch bring wife with a rule tonight
This boy is lied down is eh doing this right
Big talks bottles attract top models
Never bring your chick to the club .. model
I don’t need wify at the crib I got her
All up in the VIP like I just hit the lotto
Chorus
Don’t bring sand to the beach
Don’t bring sand to the beach
Don’t bring sand to the beach
Don’t bring sand to the beach
Don’t bring sand to the beach
Don’t bring sand to the beach
Best thing that I have this trip plan for weeks
My whole feet trying to move the …first seat
My honey is .. the position is not fun
Got a new bubby in the house we got one
Chicks so – they want me to bring sweet
I beat the regime I leave them with a recipe
My relationships has been as sweet
All are cheating so therefore I cheat
Black chicks white chicks ..
I don’t know how many chicks will follow
I used to . my boy ..i don’t bring sand to the beach
My motto
Chorus
Don’t bring sand to the beach
Don’t bring sand to the beach
Don’t bring sand to the beach
Don’t bring sand to the beach
Don’t bring sand to the beach
Don’t bring sand to the beach
Have it low when you ..
Your wife won’t be ..
Got off to the sunset
All I am trying to say is leave bubby at home
Don’t tell her where are you going
Turn off your phone glad six feet doctors won’t check up
.. have a good time get of my blessing
Is not fare .. breathing with no air
They want to kick it too even if they don’t see it through
Ask them something they look at you like it’s three of you
You look like what you want me to do
Bringing up the names all a hundred in a random
It’s all a game I don’t bring sand to the beach
And chicks feel the same I know the shit
But I ain’t saying no names with you busy at the bar making it rain
Chorus
Don’t bring sand to the beach
Don’t bring sand to the beach
Don’t bring sand to the beach
Don’t bring sand to the beach
Don’t bring sand to the beach
Don’t bring sand to the beach
Don’t bring sand to the beach
Don’t bring sand to the beach
Don’t bring sand to the beach
Don’t bring sand to the beach
Don’t bring sand to the beach
Don’t bring sand to the beach",https://genius.com/Black-rob-sand-to-the-beach-lyrics
Get Involved,"Game Tested, Streets Approved",2011,"I got hundreds for the ménage
The big house with the 8 car garage
Hurry up and get your drinks from the bar
But holler at Rob if you trying to get involved
I been doing my thing
Since I came home from the swing
I want the money y’all can have the bling bling
Cause diamonds don’t define me and none of y’all design me
Look behind me, phantoms and …
Man I’m used to grinding for chatter, you hate me, whatever
When I was doing bad y’all was happy
Now I got you jumping up and down this bitch like little Scrappy
I hit a chick off now I’m a big pappy
I do it out west then it’s back to …
I get involved wherever I go, always in the after party after the show
Yo, you can say I came back for the dough
Back for the flow, but y’all know it’s worse than the …
Just recognize … hard shit I’m getting involved with
I got hundreds for the ménage
The big house with the 8 car garage
Hurry up and get your drinks from the bar
But holler at Rob if you trying to get involved
I got hundreds for the ménage
The big house with the 8 car garage
Hurry up and get your drinks from the bar
But holler at Rob if you trying to get involved
When I’m down in Miami all I’m saying is 3 words
Who got birds?
Plus … on 8 mile to whip my swerve
… hotel I got rooms reserved
Sugar land … poke you out of…
Sing the words to my song like karaoke
Album DC, I holler at … she one of them … she stay on a low key
Make them stop… everybody so fresh, styling and profiling
Hit the shot no couple of big fish
Reminds me of Los Angeles nothing but realness
Arizona and Texas, the weed aroma’s the best
Something like Oklahoma Dakota, they on that next shit
They rolling out the black carpet for me
Get out the Maybach and let somebody park it for me
Mc’s … pull up in the tour bus, we love … wanna rush man, get involved
It’s the money that we touch, we stack it and pile up
You stack it and pile up more, get involved
We pushing them big trucks out west rocking the chucks
We dealing with big bucks, man, get involved
Chicks getting … we putting our people on, the song
We getting it on
I got hundreds for the ménage
The big house with the 8 car garage
Hurry up and get your drinks from the bar
But holler at Rob if you trying to get involved
I got hundreds for the ménage
The big house with the 8 car garage
Hurry up and get your drinks from the bar
But holler at Rob if you trying to get involved
Out in Vegas we up all night
Ain’t hard to find some females to fuck all night
Out in atl the same … all right
… pretty women get down for the right price
Hard know I seen it, Tennessee and Phoenix
I made it rain in Seattle…
Couple players in Cleveland that’s getting cash
I met some real dudes in Hawaii and Boston ..
… I can’t forget my Baltimore peeps from …
When it’s time to go to war with them things I’m coming to get ya
And Utah I got some Utah ass
And if you like the way it’s going down then move your ass
I got hundreds for the ménage
The big house with the 8 car garage
Hurry up and get your drinks from the bar
But holler at Rob if you trying to get involved
I got hundreds for the ménage
The big house with the 8 car garage
Hurry up and get your drinks from the bar
But holler at Rob if you trying to get involved",https://genius.com/Black-rob-get-involved-lyrics
Celebration,"Game Tested, Streets Approved",2011,"It's a celebration, ha, hey, hey, hey
We do it till we die, oh, hey, hey, hey
Pedal to the metal y'all
I ain't gotta settle y'all
I'm on a different level y'all
Smoke's ... ... my old ... i ain't gotta bother
A ... i'ma show them how the summer time represent
Fresh out of confinements and i do
Everybody rushing to that neighborhood pool
Just trying to keep ...
Louie ... trade in the guns for them big super ...
When the female approach us
...attract us, cold benz sodas
... wear arm legs shoulders
Be ... throw a couple steaks on the grill, let them sizzle
Sunny outdoor grizzle, weather's warm
Everybody happy, all i see is smiling faces and a breeze from the north
Got the footprint on the gas, everybody love me in the city and it feels good
And so bright it's full of cash, this is for my ladies and the fellows in the whole hood
I god the system set for blast, ...we go, ...
Everybody get up, get up, get up
It's about to go ... we bout the ... so we having a celebration
On the shore it's jump rope...laughing joking
Lemonade, portorican, dominican, ...fun for all ages
My man, it's hard enough you gotta wash the car by hand
Come through, speakers spand
Good ... you ain't ...
Let's go, ... top, i'm betting 5 grand on the bank shot
On point, far as the drama goes
Dominoes and ...
2 fifth ... logn beach, down in virginia beach
Nobody home, everybody in the street
Got the footprint on the gas, everybody love me in the city and it feels good
And so bright it's full of cash, this is for my ladies and the fellows in the whole hood
I god the system set for blast, ...we go, ...
Everybody get up, get up, get up
It's about to go ... we bout the ... so we having a celebration
Finer words, chick rocking high ass skirt
Cast selling ... and t shirts
You know the feeling, all in the planet
Snow bunnies on the roofs top tanning
Get fresh at the local tournament
Spectators hanging from the trees like ornaments
East side, west side, south side, north side
Celebrities sitting court side, the whole city
Heavy police presence, nobody going back to the essence
... everybody going ... fish and chips and burgers ...
Doesn't matter where you from, we all can't wait to participate new summertime fun
And black gonna shine like the sun
And this is the sound ... for many year to come
Got the footprint on the gas, everybody love me in the city and it feels good
And so bright it's full of cash, this is for my ladies and the fellows in the whole hood
I god the system set for blast, ...we go, ...
Everybody get up, get up, get up
It's about to go ... we bout the ... so we having a celebration",https://genius.com/Black-rob-celebration-lyrics
