title,album,year,lyrics,urls
Spanish Fly,Life Story,2000,"Yo look clown I come through bully down
Keep thinkin that you hard take a look around
I got soldiers stationed up to bring pain
And when it go down my hoes do the same thing
We all in the same game, we all willin to bang
Ain't nobody going against the grain, so take aim
B.R.'s evasive, cut all the faces, catch all the cases, this real
You rather bet'cha life than face me
I mean I got this rap game locked with more cake than Tastee
Black the feindest, this title I hold I won't relinquish
And this type shit you shouldn't sting wish
And one phone call and I'll extinquish, I mean this you seen this
Blue steel fo-fo the caliber, Excalibur, Im'a destroy my next challenger
B. Rob high post MC, 
quick to spray Raid on the roach MC
So don't be apporachin me without the cross and rosary
Who this nigga 'pose to be, I blast him in the open beef
Damn Black, how you do that der?
'Cuz we..dont..care, I'll take 'em there
Chorus: Jennifer Lopez
Last night, I dreamed of some more dough
Some crystal, sixty thousand, and ten dimes of 'dro (I'll take 'em there)
Last night I realized I'm dreaming
Too late now, guess I'll finish what I started baby

Y'all niggas heard the first verse no doubt shit bangin
Verse two make sure none of y'all left hangin
Got honies lovin this shit too, one wit'choo
Long as you know my pants don't fit'choo
Money good look, understand why he shook
Shit I'm rich, face all up in the Guiness Book
Check, all the records I set, its major
Check, that the sets I wreck with flavor
Fuck that cajun, guns stay bond cock
?Boiler on lock? hold shit down like Fort Knox
Man, knock the rhyme unorthadox
What'cha barely understand, shit I deal with the L.O.X
Give me the props, Im tryin set a mark this year
And bring the equipment out to the parks this year
So y'all could see how it used to be
I'm lookin towards the future see
Black here to stay, its time y'all got used to me
Puff said Black ain't tryin to fit in
Up and down the coast can't count the spots I've been in
Put'cha bid in
Chours

I hit a ??? if my name was Teddy Bender
Hot beats and hot rhymes tossed in a blenda'
I want ch'all to feel hardcore, nothin tenda'
Blessed this mic for as long as I remember
Y'all can't see the Rob, uh-uhh, y'all must be stupid
If I owe Shawn Combs any money then I recouped it
I looped it, this fly shit from ?Nebogada?
Me and Yogi and Hard Pierre from You Dont Know Me
I dare you to come against me
, run against me
Use your gun against me, you finito, finished
I've seen wild cats diminished, foldin for, Bad Boy's known to ball
Internationally, I'm sayin actually
I have to be the next cat to go and sell a million records casually
So, prepare yourself for the storm, Nineteen-nine-nine its on
And I'm just gettin warm
Chorus",https://genius.com/Black-rob-spanish-fly-lyrics
You Don’t Know Me,Life Story,2000,"1- 
You have never seen my face before
You don't know me
Oh, no
You will never see my face again
You don't know me
Oh, no

You've never seen the gloves of an Uptown thug
You say I move drugs, cuz my shit is unplugged
Everywhere I go, results hound our love
Black gon' bless them like the heavens up above
Catch me in the new wave cab with ten bags of that Dro'
The shit you grow in H20
Got beef so I'm taking it slow, making it grow
Right now my main concern is making it blow
Guns and ammo, man, yo, you gots to understand, yo
I'm not the one that hit them with the banjo
Here y'all is, bringing my fingerprints
Up in them cameras and shit like I fucked a singing bitch out
Ask her if she seen my face
Right: Look- I was out of town getting cake with Moore and Little Shake
Wasn't even out here in New York State
Trying to play me like a goat, like my name was Scape
Now you mad, son
Repeat 1
Called a nigga sleepin', outside creepin'
We out in Mexico, for a fun-filled weekend
At least I thought I was, they had the whole place bugged
Still thinkin' I sold drugs, ice 'em up
Kick the door in, I fire escape 'em
From up top, bullets soaring, but I fake 'em
I'm hard to hit, Spanish speaking chick that constantly
And Mafia connections, chopping niggas, it's hard to get
Hit me with the 411, and a gun
Envelope, and transfered funds from Big Pun
Conversation, job well done
This shit is lifestyle now, shit, I do it all for fun
Rippin' the frames, got at least 20 different names
Know at least 20 different games with different lames
Not to mention liftin' Lane's credit cards and passports
Slayin' and flat on asphalt, still
Y'all don't know
Repeat 1
Repeat 1
I'm in the cell now, it's hell now, all stuffy
Seven numbers, told Harve to call Puffy
Say they got his man locked down in sick town
Gotta get him out, not now but right now
Catch him when they shift him when they open the yard
Hurry up, before these six rounds smokin' the guard
On the humble, I'mma just lay up for y'all to come through
Create a diversion; me, I start a rumble
Holdin' me, they ain't even take my flick
Got on Simmy's, they ain't even take my shit
Got my jewels, blended right in with these fools
On the sneak out, the peek out, had two left shoes
I'mma freak 'em, through the front gate, on administrations
All they felt was a gust of wind, still no facin'
Standing by the Crystal Lake, like I'm Jason
All they felt was a gust of wind, still no facin'
You late
Repeat 1 to fade",https://genius.com/Black-rob-you-dont-know-me-lyrics
Thug Story,Life Story,2000,"Heeeeeeerrrreeee we go...
Once upon a time not long ago
When I was outta town movin work with Zo
I used to bring my nigga B.R
And niggas with the burna's holdin' down B-R
There lived a jealous kid that was mislead
By anotha jealous kid who wanted me dead
(He said) Me and you are gonna push this rock
Once we kill Rob we takin over the block
They did the job, but didn't suceed
When I got up off the ground niggas couldn't believe
They started bustin and'a bustin filled my ribs like crusting
Had the vest on so it didn't mean nothin
One kid grabbed a tech and started sprayin erratic
But he fell, two slugs from my semi-automatic
Ran two blocks there was cops all over
Then I dipped into the building ???
Banged on the door of apartment 83
Some lady start screamin like she was afraid of me
Ran to the roof like ""Fuck that sista""
Ask an old man ""Can you help me mista?""
Got to the roof clutchin my four-four
Open up the door, yo guess who I saw (Who?)
Black and ?Deaf? now, ain't this proper
Guns drawn full of ??? toward the helicopter
Escaped alive but my ribs was shattered
Body all battered, and clothes all tattered
Deep in my heart I wanted revenge
But I let the shit slide til I saw 'em again
Pulled out my guns and released a clip (And)
Thats the way I gotta end this shit
He was only one fiend, tryin to live a thugs dream
Slugs to the chest, shoulda heard him scream
Now this ain't funny so don't you dare laugh
'Cuz anyone of us could catch the blood bath
Straight an' narrow is how niggas should live...live
Good night...good night
Knock 'em out the box Black

I just woke up in pain, my ribs broke up
Wifey on the side like Justin, shes kept the hope up
All thats on my mind is revenge revenge
Just then a few dogs kicked the door off the hinge
Go with the drawers on, man its cold as shit
Had the mag by the table, nigga hold this shit
He was one stupid nigga tryin roll for 'Delph
Not knowin that he might get killed himself
Now wifey being trained by the F.O.I
It was horrible, stabbed the otha cat in his eye
He was screamin tryin grab her actin like he had to have her
Swept him off his feet but got sliced with the dagger
Well in these times, well atleast to me
No true niggas rollin come in sets of three
And they won't stop rollin til you let them see
All the permanent scars that the tech nine leaves
Barely out the crib caught one in the leg
Couldn't even get my ??? had to leave 'em for dead (Damn)
That's cold, yeah I know, but the cold in the streets
The one who escaped is the one holdin the heat
Before I breeze grab coke out the freeze
By the time y'all hear this I'll be somewhere in Belize
With some bad asian chick layin between my knees
While I'm blowin off some trees, pumpin B.I.G.'s
Greastest hits, this was my latest shit
Watch how niggas act when they play this shit
This a lesson, shits for real no dressing
No ?lip? infestin, crab cats I'm addressin
Bad Boy, the 44 Mag, fresh off the rack
All you cowards and nasty ass hoes step the fuck back
This ain't funny so don't you dare laugh
'Cuz anyone of us could catch the blood bath
Straight an' narrow is how niggas should live...live
Good night...good night
Knock 'em out the box Black
Thats right
Black Rob, the craziest presentation
All you bitches
Bad Boy, Life stories
Alumni
Crumbs, crumbs",https://genius.com/Black-rob-thug-story-lyrics
Down the Line Joint,Life Story,2000,"Verse One: Puffy
When night falls, that's when it all begins
Be prepared we can allow no loose ends
I highly recommend ya'll bring your arms
This is no false alarm
They want to do us harm
Like I'm nervous, live inside a glass house
They want to bring us down
Then drag us out
It's all about niggas that doubt our reputation
Startin conflict and don't know what they facing
Want twist us all in there black magic
? suggest paper of wars and break havoc
Are you ready, don't sleep on them
Ain't petty, you get that ass thrown like confetti
Meet me at the getaway spot in a jiffy
Leave all the does behind that act iffy
We got maneuvers, that's hard to beat
Till the other side retreats
Under six feet beneath
C'mon
Verse Two: Mark Curry
I told u that is a saw I wore
I'm a kill
When the rebel yells song that don't stop till
It's done, see I got guns and I m sick
See how you said meet me here and I came quick
Them same catz on the most wanted list
We can hit them, Then straight disappear in the mist
?,Won't cease to exist
I shoot to kill and I'll be damned if I miss
A warrior waiting for Armageddon
I get serious as hell when I'm threatened
Intent to get hostile break into a rage of fury
Send them back their apostle's fossils and crazed right
A rude awakening and but now I'm alert
And that's right down my line of work
The whole Brotherhood new verse, gutless cowards with no back
And watch how they all fall flat
Ahh
Chorus:
Niggas gone fall out
They got us up against the wall
Here to call out, let it all out
With or without you I'm for war
Some shit's worth dying for, ah-huh
Niggas gone fall out
They got us up against the wall
Here to call out, let it all out
With or without you I'm for war
Some shit's worth dying for, ah-huh
Verse Three: Black Rob
Yo
You want hot soup, I got shit like up on in Attica
Guns ridiculous like Battlestar Galactica
What's this, want to insult my family?
La Familia, actin like ones of us gonna kill ya
I want ya'll dues
Shit hit the fan, we going to be eatin' your food
Time up in the new
Then torture, I rip a niggas toe nails off
What, I didn't here the news five slayin the law
Man, how I don't want do these catz
I lay mousetraps for those mice house niggas that house gats
They want to out me, I know killers from down south be
Who know and understand, there ain't a thing sweet about me
I earn my respect, and I was born to wreck
Spit techs, by your rockets threw jets
Who's next, to get hit by firepower that's so raw
Go play 4-4's ready for war
Verse Four: Mase
All out, what what
Wanna blow, what what
Teamsters what what
Mother Fucker
]From Monday to Sunday, it's all about the money
Nigga ain't got mine, I guarantee I'm gun play
Moms says ""Mase, you gon need that money one day""
Bitch I'm in the jet, Benz on the runway
Don't be fooled, still squeeze tools
Money like that, why the fuck I need school
M-A dollar sign-E rules
Hundred G jewels
Vacate places you don't even need shoes
Same catz say stay up, prey 4 my day up
No one where my bitch live, plot where I lay up
If you got coke way up, Got doe then pay up
Niggas shoot at me a nigga better spray up
Cause God forbid, you hit me in my Ribs and I live
Comin back and getting you and your kids
Chorus
Verse Five: G-Dep
Dom Dom Dom
Thought I heard something
Last cat that I heard frontin
Burned up herb huntin
Word cause, my heard something
Splurge something
Now I don't care who I hit
Its who I hit I knew I hit
Who would understand though
We vandals and land roles
Program for our own channels
And flannel, this man knew any clan
We're here for the catz in the minivan
Gotta let this schemmie plan
Pay me man, scan
Sex, cars any money
Sex guard the money
With this gun, it be hard to run me
Get it right, or get it tonight
Better tonight
Set up your wife, with the head of the night
Don't fold cause my goals imbedded with ice
To my tents dimming the light
I'm bendin this mic
Lot of niggas don't comprehend
Lots niggas look sloppy when
They don't see me and I see them
Chorus
Chorus",https://genius.com/Black-rob-down-the-line-joint-lyrics
Lookin’ at Us,Life Story,2000,"Yo, yo
Nobody knew where he came from, or got his name from
All we know is he killed Keith with the same gun
He used on Terrell, and Tone from outta jail
Now he see us, we livin' and gettin' a lot a mail
Watch that cat, send thugs to stop that cat!
But niggas like him always got the gat
Gotta take 'em off, gotta break 'em off real soon
Call them two hoes we hit in Cancun, get them a room
At the Radison over Madison
I'm imaginin' somewhere down the line I'mma have to use my gat again
I'm alright with stayin' up all night
And puffin' dark chocolate trees til the dark turns light
That nigga seen us, you actin like there's no beef between us
Act like he ain't got people swayin' the dope fiends around the corner
You fluffed my man, he got me on a
Whole 'notha level, money-grippers are goners
Chorus 
Aiyyo, I seen how them niggas be lookin' at us
Actin' like they wanna do som'thin to us
Cee-Lo, Black Rob just can't be touched
I'll negotiate the matter in gats he trust
In the club one night, war spittin' at us
In the corner sippin drinks on some real hush hush
Yeah, I seen how them niggas be lookin' at us
Aiyyo, I seen how them niggas be lookin' at us

Made them hoes approach duke on some ""How ya doin shit""
Small talk made 'em walk out, thinkin with his *Silence* (Sho' man)
Just like I thought, he about to get caught
They goin all out in the backseat suckin 'em off
Cee-Lo, stay close dogg, we ain't tryin to lose 'em (Alright)
Only thing on my dome is what I'm gon' do to 'em
He killed Keith, I knew that playa since he was small
When he used to ball, and mess with molly down the hall
Now he ghost, and this crab nigga's to blame
Gotta slug him with his dig, I'mma put in his brain
But slow down, he's pullin over, park right behind that Nova
If duke wake up, put 36 in his Rover, cut the motor
He tryin to draw attention to us
This ain't the time baby boy, this is about to blow up
Synchronize ya Rol' up, we got one minute to rock it
Murder's a hard job, but somebody's gotta stop it
Chorus 
Aiyyo, I seen how them niggas be lookin' at us
Actin' like they wanna do som'thin to us
Cee-Lo, Black Rob just can't be touched
I'll negotiate the matter in gats he trust
In the club one night, war spittin' at us
In the corner sippin drinks on some real hush hush
Yeah, I seen how them niggas be lookin' at us
Aiyyo, I seen how them niggas be lookin' at us

Fresh off the plane I'm in New York vacationing
Come on, lets get gone, nigga it's on again
Swervin' in the rain, and workin' the wood grain
We did about two hundred, glide us into an S-lane
Now feel the pain
And if it's affectin' you it involves me in it
And its all great cause I ain't got on a nigga's ass in a minute
We've established innocence, nigga, this Benz ain't rigged
It's easy, accelerate and make those twenties rotate
The corner cowboy invented Hennessy, straight
Satisfaction, in the midst of all the interaction
I sense tension, here
And some nigga over there's givin us his undivided attention
Aiyyo Rob yo, is that this nigga (Who?)
Is that this nigga that been 'round here fuckin with'choo?
Want you want me to do?
Who you want me to run over, and run through?
With my gun drew, and unleash my wrath upon you
We can battle, but nigga, but pay for the bad news is true
This nigga done did somethin' that he can't undo
And anybody who came here with him deserves one too
Is it true? Fuckin' up my good clothes on you scandalous hoes
I suppose that these bullet holes will make ya widow keep the casket closed
How yo kids gonna get gave back to you? That's how it goes
Cee-Lo, Black Rob, Goodie Mob, Bad Boy, down south
Up top it don't stop
Chorus 
Aiyyo, I seen how them niggas be lookin' at us
Actin' like they wanna do som'thin to us
Cee-Lo, Black Rob just can't be touched
I'll negotiate the matter in gats he trust
In the club one night, war spittin' at us
In the corner sippin drinks on some real hush hush
Yeah, I seen how them niggas be lookin' at us
Aiyyo, I seen how them niggas be lookin' at us
Aiyyo, I seen how them niggas be lookin' at us
Actin' like they wanna do som'thin to us
Cee-Lo, Black Rob just can't be touched
I'll negotiate the matter in gats he trust
In the club one night, war spittin' at us
In the corner sippin drinks on some real hush hush
Yeah, I seen how them niggas be lookin' at us
Aiyyo, I seen how them niggas be lookin' at us",https://genius.com/Black-rob-lookin-at-us-lyrics
PD World Tour,Life Story,2000,"Uhh , yeah , c'mon , Black Rob
Where Black Rob at?
PD world tourer , Harlem horror
We back
Yeah ya-, ya-, y'all thought we was gonna stay away for a long time
So what you gon do now?
Sorry, let's go
CHORUS: P Diddy
Yo Black Rob makin all stops we gon party till this motherfucking ball drops
Snatchin all props
Switchin gears on the Ducati , cats schemin prob'ly
But we ain't tryin na hurt nobody (we ain't tryin na hurt nobody)
We just tryin na make it clear , there B.R. is here
And we come to lock it down this year
So without further ado , we bring to you (without further ado)
You highness , (your highness) , Black Rob , Spanish Harlem's finest

I be the PD world tourer , Harlem horror
Catch me in a Lex 470 or the Explorer
The underworld figure , mo morals
Small shit it's only room to get bigger and spread love on my niggas
I figure I'm the best thing since ham and grits
That shit flip it , it's off the hook , it's unlisted
The wizard like Juwan Howard
I drop the bomb when you want test the Don power
It's on dude , I warned you before the wildin
My team some sick cats fresh from Ward's Island
I'm sayin , I try to tell em how I do due to the fact you
Was duckin my debut , duckin the ginsu
B.R., natural born threat
He got his tech and I ain't even put it on yet
Just imagine, me and you toe to toe back of the paddywagon
To the death, till one of us got no breath left
Protect that neck
CHORUS

I roll with soldiers, quick to run pass and snuff you
Regulate the streets of BK with brass knuckles
At last stuck you, and your so called team
Them so called mean, cats sound like Ben Vareen
Caught me, diggin in the scene, 115, Lex minivan light green
Watching my cream, stopping my cream
Shit's been tried before, my shit's stress, with no lactose at all
I mean I'm just limpin, cuz right now I see the profit
Show me some grams I chop it, show me some land I cop it
Show me some ho somewhere in the tropics
And I'mma suck the pussy till she beg me to stop it
That's real, I'mma tell you how the black man feel
Pack toast but still catch him with the backhand steel
Pimp status, while you run around with shrimp status
Got a gat and decided to clap at least twenty right at us
We ain't mad though, we got the bulletproof dough
And that's the way my niggas roll, if you was seein his dough
You'd be the same baby
CHORUS

Yo when I walk up in the place all eyes is on me
Is it me, or the hundred grand worth of icy
Can't underestimate me I beg your pardon
If y'all ain't had guns I probably woudn't of brought my squadron
But unfortunately it's that war outside
And I still roll with bulletproof doors on my ride
They call me PD, holy like Koran
Rockin Sean John, poppin Sean Don
Fucking ghetto Don Juan
Top of the world, watch me snatch your hood treasure
Might have to check a few cats for good measure
Playboy you know the drilly, y'all cats is real silly
What I gotta do sell another ten milly
It's crazy how they all fall down, all balls down
It's hectic so I send Black to come and check it
Ain't shit changed, same shit stains, in the business
Approach me, play me closely, hopin hopefully (keep hopin)
Before I slip I let you know that I'm on to ya
Your hands'll never touch my Bad Boy formula
And this year, I'm gonna hit em severe
Ayo Paul, get the Bent let's get the fuck up outta here
CHORUS 2X",https://genius.com/Black-rob-pd-world-tour-lyrics
Ready,The Black Rob Report,2005,"Ready on the left, ready on the right
Yo, BR, what up my dog
What up, okay
Yo kick that thing you kicked in the studio
Aight, yeah yo, what's that joint?

Round town, I'm bound shake the ground
Shake the town, wave the pound lays you down
Round town, I'm bound shake the ground
Shake the town, wave the pound lays you down

And that's how we approach these faggots
Trying to grow and be fly, but they still maggots
I'm sure all I gotta do is call my man
Forty Cal, watch yourself, I'll spoil your plans
I'm the uptop gangsta, the star in the hood
One of the few mu'fuckas that ain't scared of Suge
Fam, that was 9-5, man fuck the past
See niggas out there frontin, bodyguards up they ass, man

He's Black Rob, he's okay
Play and you'll get robbed today

Ya'll know how I'm coming through the Source Awards
""Somebody's jewels got jacked,"" man it must've been yours
Ya'll dudes be talkin out the side of your mouth
So I put the gem star on the side of your mouth
Ya'll ain't sell no records, made no cash yet
Fuck dude, cause my niggas is goons in every aspect
And don't get beside yourself
A lot of shit gonna be fucked up beside your health, man

He's Black Rob, he's a thug
Fuck with him you'll get fucked up

Fam, I don't threaten dudes, that's a promise
That's honest, you can kiss my ring and pay homage (*kiss noise*)
Or get smart, read books by Nostradomus
Meanwhile, I'm deep-sea diving, oceanomics
I seen green, more green than the Sonics
More green than the Geico lizard, the grand wizard
The 9-mil stalk, I walk up on a nigga
Put the 9 to his throat, watch him shake like the Pope (brrrr)

He's Black Rob, he's our friend
(???) is back again

Aw man, ya'll niggas done got me hype
That's it, we fit the same stereotype
If a nigga wanna wild, we can do that too
Fuck the model bitches, well we can screw that too
Yeah, man, notice I said ""We,"" she's a J-U-M-P
Man, off top, fam, I got figures
In the game she's fuckin with all the top niggas (It's true)

He's Black Rob, he's our man
If he can't do it, NO ONE CAN!

Yeah, bout to put the whole game on smash
Alumni, I put the whole name on smash
After this, they gon' wanna lace me plenty
Who's your man, cause they can't make a JC Penney
Who's your Bad Boy? BR, back with the nutritious
Black attacks like a pit bull - vicious
It's goin down, fam, I'mma bout to shake the ground
It's uptown, holla at your man
Ready on the left...ready on the right",https://genius.com/Black-rob-ready-lyrics
Smile in Ya Face,The Black Rob Report,2005,"They smile in ya face, but they ain't lovin you
Turn your back, they tryin to break your J-A-W
Who a nigga on the run, eatin P.O.W.s
Strapped with arrows, and the chrome b-o-w?
It's no act yo, no
This chick can keep my dick between her cheek and gums, like tobacco
On the F.D.R. doin like 90 a pop
Fuck five-0 niggas too grimey to stop
All we came to do was tear up the spot
Think we care if you, you, you, roll behind us or not?
I'm the one man army, the one hand on the tommy
If you standing next to me, one hand on your mommy
Your arms too short to box with Rob
Swipe your face like the Bad Boy corporate card
A lotta shit I do is off the hard
And I be like shhh, thats why the Feds dont wanna talk to Rob
Yall had to go force the god, naw I ain't got nothin to prove
Ain't gotta carry the two, see my daddy told me bury them fools
And remember this rule: don't fuck with niggas that ain't fuckin with you
So when you're home with nothin to do
Just get comfortable, cause they ain't doin nothin to you
And they can take it like they wanna take it, I ain't just a rapper
Certified Harlem knight, Mister Will-Bust-A-Cap-er
Heyyo, one two three, to get to them you got to get through me
And its the Bad Boy family tree, like I said we gonna do this shit, nonstop
And my sole purpose is makin you dance
Ladies scream ""Blackie, Blackie gimme one more chance!""
Now she backstage hand in my pants
I been tryin to tell myself, I gotta stop fuckin my fans
Like Mi-chelle, uh, my belle
Sucked my dick so well I took her on tour, bitch was so raw
Nice tits, fat boomty, ak, y'know what I'm sayin?
Passed it off to Puff and Loon, wit no delayin
The average nigga walk around here sad
Get the chronic now he honest he gon' bust that ass
Get home, she ain't there, bitch musta mashed
And she caught you for furs and your jewels and cash
Shoulda known it
Me, I could never condone it
Bum bitch walk around my shit like she own it
She got some bitch niggas involoved, they be in cars
That used to shoot dice in back of the ?m rob?
All praise due to them papers, got me watchin my neighbors
If I dont know you do me no favors
And thats comin from the horses mouth, reppin east west and south
Nigga front we airin him out
Old timer said ""Don't leave the label 'til you're paid
And hold yours down from the cradle to the grave""
Sharp as the cut the barber gave you with the shave
Handgun, but you harder wit the gauge
So go ahead front for us, we savage
It's war, consider this collateral damage
And we even did some joints in spanish
We control the entire zone and punks sayin ?bi amon?
That explains why I'm not home
That explains why I'm low, in videos I'm not shown",https://genius.com/Black-rob-smile-in-ya-face-lyrics
