title,album,year,lyrics,urls
Whoa! (Clean Version),Whoa CD-Single,UnKnown,"Yo, I'm gettin' ready to put y'all up on somethin', man (What's goin' on, yo)
Yo
When you see somethin' ill (Uh hun)
You know what I mean
That's whoa (That's what whoa means)
Anything ill you seein'
Whoa (Uh hun)
Have you a big six at the curb, that's whoa (Okay)
Especially if he got the fully equipped kit on it
It's whoa
Like you know what I mean
Like yo
(Verse 1)
I had this bad chick Uptown, she was (Whoa)
Had me messed up in the head, I mean (WHOA)
Bought the chick diamonds and pearls, I mean (Whoa)
Should've seen the ice shinin' on her wrist (Whoa)
Now money ain't a problem, see, my dough is like (Whoa)
Pulled out my bank roll on y'all dudes like (WHOA)
Floss the blue shrimp from two-tenth like (Whoa)
Money wanna peep my blueprints, I'm like (Whoa)
Had to hit the brakes on y'all brothers like (WHOA)
Brothers gettin' bagged on my block like (Whoa)
Comin' home within a half an hour like (Whoa)
Frontin' like they had the manpower like (Whoa)
More or less
More or so
Refrain: Black Rob
I'll rip your torso
I live the fast life
Come through in the Porshe slow like whoa
My people, like dough
Light dro, nitro, mic flow, nice clothes, like whoa
(Verse 2)
Ease pain with  like whoa {*sniffing*}
Now I'm Doc Strange in the Range like (Whoa)
Hundred miles an hour, switchin' lanes like (Whoa)
Plus I'm gettin' brain from this chick like (Whoa)
Finger near a brother A- like (Whoa)
Scene floss riches and chicks like (Whoa)
Nine-nine Jag, Benz, Coupe like (Whoa)
You keep them cheese lines on your block like (Whoa)
Grenade through your window, money
Like whoa
Love to see me do this, sonny
Like whoa
Brothers put me through this, sonny
Like whoa
So I'm a go, toe to toe, blow for blow, like whoa
Repeat Refrain
(Verse 3)
We bag it, then flip it, life, whoa
Cars, we jack it, then strip it, life, whoa
Fully equip it, front to back, like whoa
Spittin' on fiends that come for crack like whoa
Asked 'em for shorts
Now baby, that's whoa
Half on his quart
Now baby, that's whoa
Flow so properly, you'll see I'm whoa
Ain't no stoppin' me, I'm deep like whoa
Joints be poppin', B, and we creep like whoa
Hear my name in these streets like whoa
Must I pound the concrete like whoa
Fill his rich ass
Head to feet like (Whoa)
Your man ain't (Whoa)
The judge ain't (Whoa)
C.E.O.'s ain't (Whoa)
P.O.'s ain't (Whoa)
Play y'allself, I get the G.I. Joe
D-I-C
K riders ain't whoa
Repeat Refrain

Brothers gettin' money in VA is (Whoa)
Honies lookin' right in ATL is (Whoa)
Brothers layin' low in Chi-Town is (Whoa)
Chicks takin' paper in L.A. is (Whoa)
Brothers stacking dough in D.C. is (WHOA)
P.R. and D.R. hold me down like (WHOA)
Ballers in Detroit hold me down like (Whoa)
Brothers gettin' money in New Orleans (Whoa)
Boston and Jersey, my people is (WHOA)
Florida people, Phillideph is (Whoa)
Tampa and Texas, Cleveland is (Whoa)
Memphis and Lil' Rock, my brothers is (Whoa)
My New York people hold me down like (Whoa)
My Panama peeps
Hold me down like (Whoa)
Empire
Hold me down like (Whoa)
My man Dice Roll
Hold me down like (Whoa)
The whole Bad Boy
Hold me down, like whoa
N.C, S.C., hold me down like whoa
My man, Buckwild
Hold me down like whoa
Alumni thug
Hold me down like whoa
My man, P.D
Hold me down like whoa
The whole J.M
Hold me down like whoa
Whole east side
Hold me down like whoa
My man, B.I
Hold me down like whoa
Yeah!",https://genius.com/Black-rob-whoa-clean-version-lyrics
"Whoa! 12""",UnKnown,UnKnown,"We gon' take this all around the world
Yo, I'm 'bout ready to put y'all up on something else, man
(Whatcha gon' put us up on, man?)
Yo, this part two of the raw shit(We ain't never gonna stop)
Okay, y'all know what this is
The remix, you know what I mean? (Life Stories)
Allright, anything ill you see it's WHOA! (I know that)
Like for instance, Black Rob is WHOA! (Oh no doubt)
And Bad Boy is WHOA! (No doubt)
And that's it, man, word up

Digga on a Black Rob track like WHOA!
Brick City where we smack cops back like WHOA!
My whole crew dime pieces in the Jeep like WHOA!
Juicy lips, big tits, pussy deep like WHOA!
Don't trip, on the mic I'm the bitch like WHOA!
Be the illest when I spit, see my flicks like WHOA!
Chicken heads wanna know where I shop like WHOA!
Rah single knocking niggas out they slot like WHOA!
Everywhere honey go, cats jock me like WHOA!
Digga puttin' TVs on Ducati's like WHOA!
Rah first featured on The Score like WHOA!
Broads tried to run up on my draws like WHOA!
C'mon, nigga's got spunk and I freak the funk
H-Town where they lean, ATL where they crunk like WHOA!
Shouts to everybody I know
High pro, nice toes, live shows, tight flows like WHOA!

Cease come through with the E-Pills like WHOA!
A bunch of white hoes following like WHOA!
They pulling my pants down, shit, I'm like WHOA!
They giving me head now, B.R. like WHOA!
Bust off, she swallowed the whole nut, I'm like WHOA!
The bitch was thick, the back shop was like WHOA!
Daddy, long stroke, give it to 'em like WHOA!
Cease-a-Lee bad with a chrome like WHOA!
My four-four blow silently like WHOA!
Cock it back, squeeze one more time like WHOA!
You wanna be B.I.G., nigga, picture that WHOA!
I'mma frame yo' ass, right where you set it at WHOA!
Your flow ain't WHOA! Your crew ain't WHOA!
Your ice ain't WHOA! Your Benz ain't WHOA!
Black Rob, M.A.F.I.A., smoke 'dro
Get dough, nice hoes, nice clothes like WHOA!

G-Dep spit fire like WHOA! (G-Dep, let's go)
Bust two shots through your tire like WHOA!
Tyin' up the getaway driver like WHOA!
Frontin' like you live, but we liver like WHOA!
Gettin' electrified trying to touch it like WHOA!
You reach wrong, might lose your arm like WHOA!
Got the detanator in my palm like WHOA!
3-2-1 hit the bomb like WHOA!
I'm a beast, born in the Belly like WHOA!
Excursion, stolen perellies like WHOA!
I don't think there's nothing y'all can tell me that's WHOA!
So I'mma just wreck the show, get the dough like WHOA!
Wait! Stop the tape!
I live the fast life and I only stop for cake like WHOA!
My niggas, get dough, get low, hit 'dro, hit hoes, spit flows like WHOA!

When the cooch get wet, it's real juicy like WHOA!
You fuck up my check, I'm calling Lucy like WHOA!
I fell off in the club 20 deep like WHOA!
Lit up about five blunts a piece like WHOA!
When my new shit drop niggas gon' be like WHOA!
When the 34-Bs fill up the bra they like WHOA!
When niggas see the size of my ass they like WHOA!
When the chrome rim shine on the Nav they like WHOA!
Ugh! I sparkle on every finger like WHOA!
Same bitch who said the goldier scent lingers like WHOA!
Nigga, what bitch is hotter, I'm most requested it like WHOA!
I'm ""
Unrestricted
"", my perfected like WHOA!
The bitch got jazzy, I had to slap her like
(*immitating slapping sounds*)
When niggas ask me to rap for free I'm like nigga WHOA!
My niggas, So So; Plat, Gold, Brat cold
Flyin' bigga, type clothes WHOA!

Sigel came to set up shop, you gotta ROLL!
Everytime I gotta step on the block, they like WHOA!
Them young 'uns see the print of the Glock be like WHOA!
Everytime I'm spinning the block, they like WHOA!
Bitches talk about ""Can I go?"" I'm like NO!
I'm all about the dough, ain't got no time for no WOES!
You catch me on the block on my ground wit' these HOES!
Niggas takin' nines up the nose straight FROZE!
Got 'em coming back everytime like WHOA!
I got 'em doing petty ass crimes like WHOA!
They do anything for the coke like WHOA!
They know my shit fresh off the boat like WHOA!
I grips the fo-fo and hit your ass up
Come through in the truck slow like WHOA!
My niggas get dough, get locked
Get out, get low, get mo' like WHOA!

I hit to the scene in '95 like WHOA! (Robeo, Robeo)
Broke like a motherfuckin' dog like WHOA!
Robbin' niggas cribs in Mid-Town like WHOA!
Plus I'm on the run from my PO like WHOA!
I remember scraping shanks on the floor like WHOA!
Takin' niggas' commissary flipping it like WHOA!
Now y'all see the God on TV you like WHOA!
Doin' my dance wit' PD like WHOA!
Now I got the house and my whip it's like WHOA!
Jewels heavier the ice clear like WHOA!
Shit, L.O.X. left and Ma$e retired like WHOA!
So I threw the label on my back like WHOA!
And more less, more so, I'll rip your torso
I live the fast life, come through in a X-5 like WHOA!
My niggas like dough, light dro', nitro
Mic flow, nice clothes like WHOA!

Yeah, uh uh, it ain't over yet, man
You know how them...the DJs...y'all gotta...
Spin it back around and start it from the top
I ain't gonna make you do that on this remix
We gon' keep it goin
We gon' give you a little taste..
Of WHOA! young guns..
Bad Boy baby
We won't stop, cuz we can't stop
AAAAHHHH!!

WHOA! Keep a stainless on my hip like WHOA!
Shoulda seen them clips with the tips like WHOA!
Put it to your face for the cake like WHOA!
Expert, six to your shirt like WHOA!
Sin is a problem in Harlem like WHOA!
Born in BK wit a AK like WHOA!
Got wit BR, spit a bar like WHOA!
D's on my back, spit the Mac like WHOA!
Had to cool off smoke a Newport WHOA!
Did the video that had the Feds like WHOA!
Flow off the heezy talking greasy like WHOA!
She's a G.B., so she easy like WHOA!
God bless, for the dough, I pop the pistol
Come through in a Volvo like WHOA!
My niggas fly dro, hydro, 5-0
High low, spit the bars like WHOA!

I'm from the dirty, filthy nasty dirty WHOA!
Bitch in North Carolina, I'm the motherfucking WHOA!
This shit be good to a motherfucker like WHOA!
Smoke neckbones and a pot of rice WHOA!
I know I ain't right, but motherfucker I'm WHOA!
Hit you with a Jackie Chan chop like WHOA!
Chase you with a half a water pipe like WHOA!
Y'all keep actin' like y'all ass can't get it WHOA!
Fuck around and have ta loose your balance like WHOA!
Cuz I'll snap the butane fire on ya like WHOA!
Man, let's get this motherfucker crunk like WHOA!
And tear this motherfuckin' club the fuck up like WHOA!
More or less, more so, I'll kick your asshole
I Am the fast life come through in a dump truck like WHOA!
My people like dough, like dro, ni-tro
Mic flows nice clothes like WHOA!

I really hate you fuckin guys the Madd Rapper's like WHOA!
Ain't got a goddamn dime my shit ain't happen like WHOA!
I'm coming after yo' ice, gon' pull a heist, you like WHOA!
Cuz I'm in Family Court, my daughter mom, she needs DOUGH!
Brooklyn niggas ride trains, we steal your chains you like UGH!
I steal your mics and pull the plugs at your shows you like WHA!
Your new Timbs, I'm steppin' all on your toes, you like WHOA!
I hate you niggas, spill my drink on your clothes you like WHA!
I got a 20 of trash, y'all smokin 'dro I'm like WHOA!
And I'm bootleggin' your albums, y'all need the dough, you like WHOA!
I know y'all hearin my shit, y'all on my dick, I'm like WHOA!
""Well, my album caught a brick"", I'm fairly sick, I'm like WHOA!
No sales, no plaques, no shows, no world tours
I live a rap life so I'm trying to live yours"" I'm like WHOA!
My niggas, Black Rob, Bad Boy, Crazy Cat, Madd Rapp'
And that's that I'm like WHOA!

Bad Boy 2000 WHOA!
We're baaaack
We ain't never going to stop (Life Stories)
Joe Hooker is like WHOA!
Shot back is like WHOA!
Black Rob is like WHOA!
Alumni
Bad Boy baby WHOA!
M.A.F.I.A
Queen Bee WHOA!
D-Dot
Family WHOA! (This the remix y'all)
Now we ain't never gon' stop
WHOA!
Bad Boy is like WHOA!
We been like WHOA! for 10 years
Just bounce",https://genius.com/Black-rob-whoa-12-lyrics
Whoa! - amended version,UnKnown,UnKnown,"Yo I'm gettin ready to put y'all up on somethin man
(What's goin on yo)
Yo, when you see somethin ill (uh-huh)
Knahmean? That shit is WHOA (that's what whoa means)
Anything ill you see is WHOA (uh-huh)
Nigga have a big 6 at the curb that's WHOA (okay?)
Especially if he got the fully equipped kit on it; it's WHOA
Like youknowhatImean? Like yo
I had this bad bitch Uptown, she was WHOA!
Had me fucked up in the head I mean WHOA!
Bought the bitch diamonds and pearls I mean WHOA!
Shoulda seen them shits shinin on her wrist, WHOA!
Now money ain't a problem, see my dough is like WHOA!
Pulled out my bankroll on y'all niggas like WHOA!
Floss the blue shrimp from two-tenth like WHOA!
Faggot wanna peep my blueprints, I'm like WHOA!
Had to hit the brakes on y'all niggas like WHOA!
Niggas gettin pulled on my block like WHOA!
Comin home within a half an hour like WHOA!
Frontin like they had the manpower like WHOA! More or less
More or so, I'll rip your torso
I live the fast life, come through in the Porshe slow like WHOA!
My niggas - like dough, light 'dro
Nitro, might flow, nice clothes like WHOA!
Ease pain with cocaine like WHOA!
Now I'm Doc Strange in the Range like WHOA! (They don't know me)
Hundred miles an hour, switchin lanes like WHOA!
Plus I'm gettin brain from this chick like WHOA!
Finger near a nigga asshole like WHOA!
Scene floss riches and bitches like WHOA!
Nine-nine Jag Benz Coupe like WHOA!
Keep them cheese lines on youe blocks like WHOA!
Grenade through your window bitch, like WHOA!
Love to see me do this shit, like WHOA!
Niggas put me through this shit, like WHOA!
So I'ma go toe to toe, blow for blow like WHOA!
And rip your torso
Live the fast life, come through in the Porshe slow like WHOA!
My niggas - like dough, light 'dro
Nitro, might flow, nice clothes like WHOA!
We bag it, then flip it like WHOA!
Cars we jack it then strip it like WHOA!
Fully equip it, front to back, like WHOA!
Spittin on fiends that come for crack like WHOA!
Askin for shorts and shit nigga like WHOA!
Half on his krunk, now nigga that's WHOA!
Flow so properly you'll see I'm WHOA!
Ain't no stoppin me, I'm deep like WHOA!
Guns be poppin B, we creep like WHOA!
Hear my name in these streets it's like WHOA!
Must I pound the concrete like WHOA!
Fill his bitch ass, head to feet like WHOA!
Your man ain't WHOA! The judge ain't WHOA!
C.O.'s ain't WHOA! P.O.'s ain't WHOA!
Play y'allself I get the G.I. Joe
D-I-C, K riders ain't WHOA!
I'll rip your torso
Live the fast life, come through in the Porshe slow like WHOA!
My niggas - like dough, light 'dro
Nitro, might flow, nice clothes like WHOA!
Niggas gettin money in VA is WHOA!
Honeys lookin right in ATL is WHOA!
Niggas pimpin hoes in Chi-Town is WHOA!
Bitches takin paper in L.A. is WHOA!
Niggas stacking dough in D.C. is WHOA!
P.R. D.R. hold me down like WHOA!
Ballers in Detroit hold me down like WHOA!
Niggas in New Orleans gettin money is WHOA!
Boston and Jersey, muh'fuckers is WHOA!
Florida niggas and Philly niggas is WHOA!
Tampa and Texas, Cleveland is WHOA!
Memphis and Lil' Rock, my niggas is WHOA!
Panama niggas they hold me down like WHOA!
My New York peoples they hold me down like WHOA!
Bad Boy nigga, word is bond we WHOA!
Alumni bitches, word is bond we WHOA!
N.C, S.C., motherfuckers is WHOA!
My nigga Buckwild, word is bond he WHOA!
Uhh. and that's just how the story go
And whoever I forgot on this shit is, WHOA!
Aww man, WHOA!
Eighth street, Life Stories (WHOA!)
P.D.P.R., that nigga
The beat I got from big Buckwild is WHOA!
That nigga Black Rob on the mic is WHOA!
My whole fuckin flow on the mic is WHOA!",https://genius.com/Black-rob-whoa-amended-version-lyrics
Freestyle,UnKnown,UnKnown,"Black Rob get the money
With or without yall, I doubt yall
Know I'm punch'n niggas in there mouth ya'll
5 minities niggas wanna require
Understand this BUCK! BUCK! gunfire
Be yourself do wanna be boss
When I come thur with the phat G series
Ya'll niggas step leerie
Knock it off, take my teams motto
Alcohol out the bottle
Live' like we just hit lotto
Bitches do'n their thing
Sip'n Singapore slings
Mercy-less like Ming
Phat diamond rings
Plus drugs
Female thugs
Sip on Gin & Tonic till they vomit
And still driving home from the clubs
It's about playaz max live wires
Riot insightors
Go 10 rounds with real prize fighters
With beef thats deep, throw hunderds..
6 pack
You just throw your panties on the gods stomach
I'm not the boss but I'm the man
I lounge in parts of Japan
Were going on tour with real live bands
I got it off you, Yes the double breast
Keep the vest on my chest
'cause I'n runnin round with the best
Black man
Cop a Lex for my lady
3.25 carats, we talking Ice baby
Ayo chill.....
(Laughs........)",https://genius.com/Black-rob-freestyle-lyrics
HOTTEST CHIRAQ FREESTYLE (North Hills) #FOE,UnKnown,UnKnown,"BLACK ROB
BLACKOUT
FOE SAVAGE
@LindenAveSAVAGE
FUCK OUR ENEMIES
FAMILY OVER EVERYTHING
VERSE 1
I no a couple of crip niggas that will ride around an hit niggas
you a real nigga or a bitch nigga duck or get hit nigga
them ak shots flip niggas get lost or get wit it
berg shit ima spin bin homeez ima get rich
this rap shit dont work out ima sell dope or ima hit licks
i think im addicted to money music an bitches
no sex bitch give me AMBER COLE yo pussy aint edibal
streets turned me to a canibal mix hennesy an pinnacle
clear wit that brown drink hottest barz in the county
enemies wanna down me broke boys stay from round me
get the fuck out my face been killin shit since MYSPACE
broke niggas dont like me if you gettin money WHY HATE?
hoes come wit you an leave wit me D WADE MY HEAT WIT ME
AINT STARVE WIT ME CANT EAT WIT ME FUCK NIGGAS WANNA BEEF WIT ME
they a half ounce ima kilo you a gemini ima leo
lion heart wit a king soul you smokey im DEBO
smoke niggas for a cheap price you a cheap nigga wit a cheap life
TOUCHWORK BOUT THIS STREET LIFE YALL NIGGAS TOO PREHYPE
run down till im gunned down stain gang when my plug drought
BANG BLOCK till im dead an gone not from north hiL1s dont come round
Le$$ you want work well serve you no new friends in my circle
we was broke down they aint ride wit us now they wanna get high wit us
smoke blunts wit us get drunk wit us bad bitches in love wit us
dont love hoes nigga no cuffin cops come i dont no nothin
bro sell snow to the snow bunnies when i sober up ima smoke sumn
yall niggas love flow snatch nigga dont compare me to no rappers
CHIRAQ MADE DRILL MUSIC NOW ERYBODY SAY THEY NO LACKIN
THEY OBLOCK AN THEY 3HUNNIT YO BLOCK DONT MEAN NOTHIN
WHEN YOU DEAD FIENDS GONE KEEP COMIN AN YO MAIN BITCH GONE KEEP FUCK
WHEN YOU BOOKED FIENDS GONE KEEP COMIN AN YO MAIN BITCH GONE KEEP FUCKIN
HOOK
Ridin Round That chrestmont tryna give a nigga a headshot
blast niggas for fast niggas revolver wit a red dot
hit man real shit man my pockets stuffed i cant count
im smokin on probation my po got me jammed up
blammed up cuz he ran up broskee gave him a and one
run down give ya bandz up cuz we strupped up wit the cannon",https://genius.com/Black-rob-hottest-chiraq-freestyle-north-hills-foe-annotated
Courtroom - Intro,UnKnown,UnKnown,"Order in the court, order in the court
Councillor control your client please
Mr. Robert Ross, one more outburst like this
And I'll see to it that
No one leaves this court room for the next 30 days
Now, will the prosecution please play the video tape?
And I say, why, why can't still
I'ma clean my  out, right now, pardon me
Fuck you, ",https://genius.com/Black-rob-courtroom-intro-lyrics
