title,album,year,lyrics,urls
Singing This Song,Mourning in America and Dreaming in Color,2012,"Singing this song let the whole world know
Singing this song let the whole world know
Let the choir sing
Singing this song let the whole world know
Let the choir sing
Singing this song let the whole world know
Singing this song let the whole world know
Let the choir sing
Singing this song let the whole world know

Blood on our hands, it’s wetter than it ever was
We say its getting better, yet it seldom does
Everybody wanna fuss but what gets discussed
When its all said and done what will be said of us?
This is who we are not who we have to be
In the lasting aftermath of a tragedy
Don’t wanna talk no more, I heard it all before
I just know that I don’t want this on my heart no more
Speeding on a crash course with our final hour
Only thing that can bring us back is our finest hour
Excellence flow from every precious soul is the
Only way that i know to harness that kind of power
We can shine brighter, sing bigger, love louder
We can dream farther, hope harder, work smarter
This is that moment, sand flowing through the hourglass
Is our only opponent that we have, we own it!


All around the world different song same message
Dignity in that spotlight and life’s precious
When we raise voices, we’re joining a chorus
You’re not a solo, the harmony is enormous
Echo John Lennon we echo Nina Simone
We echo my brother Chuck D, that legacy lives on
And when the struggle stress you
Let it bless you keep you strong
And may your voice live on forever in that song

Wallace D. Mohammed
Dr. Betty and Malcom Shabazz
Coretta and Martin King
Let the choir sing
Gil Scott Heron
Bob Dylan
Eyedea
Let the choir sing
Angela Davis
Cornel West
Tim Wise
Let the choir sing
Leonard Peltier
Asata Shakur
Mumia Abu Jamal
Let the choir sing
Singing this song let the whole world know
Singing this song let the whole world know
Singing this song let the whole world know
Singing this song let the whole world know

And so if we want to get anywhere we have to be self loving enough, to be honest with ourselves, to do some soul searching!
I’m not talking about soul searching to see what’s inside our soul, we got to find out what the hell happened to our soul. We’ve got to find that shit. I want my humanity back. I want to be a human being again. I don’t want this shit on my conscience no more! I want to live in a fair world. We’ve got to decide to rejoin the human family again. We’re not talking about just this case, we not talking about just this issue, we’re talking about whether or not we’re going to be human beings again
Peace!
Singing this song let the whole world know
Singing this song let the whole world know",https://genius.com/Brother-ali-singing-this-song-lyrics
Say Amen,Mourning in America and Dreaming in Color,2012,"Truth so heavy it could rumble the earth
I dunked paint brush up in a bucket of words
Ain’t nothing interrupting the urge
Might cut you worse than unguarded love when it hurts
Try to hold it in and my muscles will burst
Do an Incredible Hulk through my shirt
A verse make an old lady jump up in the church
Pass a plate around pulling bucks out her purse
Foremost and first my hunger and thirst
Is not for no blood-stained paper but my love to be heard
Reap what I sowed in the earth
Now watch what emerge out a soul that’s disturbed
Leaning on the very last nerve of you scary ass herbs
Fake thugs and arrogant nerds
Fuck no homo you a no home owning old grown
Unsigned chump month behind on your car loan
You got balls looking down on me
Or got a mirror on the floor trying to find Ali
And dressed flyly but so afraid to soar
You’re all dressed up and got no place to go
And so play a roll there’s no hope of living
More like go broke pretending
Your whole image is imagined I manage
Low expectations high standards
Hip Hop is the legacy of the jazz kings
Kick rocks I’m one of the last standing
Last thing I do is overstate the obvious
Mainstream poppiness underground sloppiness
Dumbed down thuggery and pussy hungry consciousness
Revolution for sale greedy communist
Seinfeld rap your show about nothing
Poetry played it’s all about production
Trying to get placements play like you’re famous
Ain’t added greatness to nary a playlist
Take this bitch take offense
Or if it don’t apply let it fly say amen
Time’s up on y’all posturing imposters
I don’t give a damn if you’re starving or copping Oscars
Out here grinding or floss in your ivory towers
I don’t give a shit about your pants or how you rock em
I ain’t bitter or backpacker or conscious
Just want y’all the fuck out my ear with that nonsense
From the office of Ali and Jake and them
If you feel me raise a hand say amen",https://genius.com/Brother-ali-say-amen-lyrics
Namesake,Mourning in America and Dreaming in Color,2012,"I am somebody
And we am and she am and he am and I am
Somebody

I was raised with the raised fist
Angela Davis summer sixty-eight Olympics
Train banging your wings against
The cage in the event you became cageless
The bane of my existence is to resist
Back never bent re-load never relent
Of All lights shone I’m glimmering glint
I was named after a king in our midst The Greatest
Changed the world in the ring with his fists
More so with the gift when rang from his lips
Bigger than just a individual gift
He had a vision for bringing dignity to the crib
Gold medalist in his Olympic event
Significant respect glistening off his neck
US flag waved the globe was silent
Wore it everywhere he went just to show what it meant
Stepped off the plane back on that pavement
The people hell bent that they will never repent
Celebrate him but his kin still clinched in a
Problem one piece of medal couldn't fix
Legend is he pitched it in the Ohio River
What good is recognition if I know that I’m a -victim
Expelled in a held back curriculum
Class president slash second class citizen
Diligent to fight for people
Nineteen years old sacrificed his ego
So here we go salute my namesake
Many are successful very few are great

Right on y’all. I am somebody
And we am and she am and he am and I am
Somebody
I am he am she am and we am
Somebody",https://genius.com/Brother-ali-namesake-lyrics
Won More Hit,Mourning in America and Dreaming in Color,2012,"Please oh please oh please
Give me just one more hit
Please oh please oh please
Give me just one more hit
It’s an 
exorcism
 bitches
A horror story

Okay we stole you from your mother and we beat you red and bloody
And we made you build a country and we never gave you nothing
But a savior with our ugly face painted on the front
And we let you sing about it entertain us every Sunday
Sing when you’re worshipping sing when you’re working
And see if you can sing your self out of the hurt you’re in
Please oh please give me just one more hit
Make it extra special and you might not get the whip
People want to hear your instruments and voices
It’s just so annoying have to always come and join you
It reminds us of the horrible conditions that we’re causing
Really rather avoid it try hard to ignore it
Give me one performance and an engineer record it
Then we can all enjoy it and we never have to know you
Please oh please give me just one more hit
I sell it ‘round the planet and I’m keeping every cent
Treat you like a hero and we all come to see you
In a big fancy theatre dressed in a tuxedo
Going to have to seat you in the kitchen when you feed you
A place this regal doesn’t serve your kind of people
Love to get an earful and praise and even cheer you
But we’re still too fearful to think of eating near you
Please oh please give me just one more hit
You sing so very nice but I don’t want you ‘round my kids


Fetishize your culture yet while it’s still among you
We analyze insult it and criticize and judge it
Look down upon you say your music’s from the jungle
And a civilized country couldn’t gain anything from it
Said it’s from the devil and it cause nothing but trouble
And tell you that you’re ugly and we think it’s so disgusting
But oh please still give me one more hit
Give me 20 years see if I can learn to spit
Your soul power got me so excited
That I went home and I tried it till I could do it just like you
Just a little bit lighter tired with less fire
Stiff sanitized to the white people’s liking
Now they’re so inspired by the way that I recite it
Celebrate a pirate as our nation’s greatest writer
Please oh please give me just one more hit
We like your music better when it’s spilling from our lips
You create it we can’t relate so we hate it
Say it’s too flagrant human nature too naked
But be patient eventually you’ll escape it
Then we take it reshape it rename it and claim it
If you get in the business we’ll just find a way to flip it
We don’t celebrate success you’re getting for a minute
After years of getting rich if you ever make us split it
We’ll just film your cars and cribs call you materialistic
Boys in blue harass you, say you’re getting too successful
Do you for the taxes and sue you for the samples
You just get a plaque so you can glue it on your mantle
Looking dapper when you tap a little tune on your piano
Patented your soul gave your heart a bar code
Now so appalled at the gall to download
Please oh please give me just one more hit
P.S. Thank you and suck my dick
Please oh please oh please",https://genius.com/Brother-ali-won-more-hit-lyrics
Just Fine,Mourning in America and Dreaming in Color,2012,"The revolution will not be televised
The revolution's about to go out and get some exercise
Oh man, sometimes the revolution just needs a break man
Sometimes the revolution just needs to live life
Stop bugging out all the damn time
Check this one out here

The weight of the world is heavy on my mind
There's too much to do, never enough time
Need to learn how to lean and unwind
Take the days one at a time, be just fine

I woke up a little slower than usual
Sunlight pouring in my room, it was beautiful
Could hear that the baby had awaken
But she weren't even crying, she was giggling and playing
I got a call from my best friend
He outside and he's trying to get some breakfast
He said he knew it's right around here
So we left the Cadillac in the driveway and walked there
Laughs and jokes, and eggs and toast, and
I got the bill while he was outside smoking
He dropped it back off
Swear to God we got to do this more often, it was awesome
Bumping my favourite 2Pac song
I took a shower, put some brand new socks on
Turned the TV off, it's too nice out here
Put some clothes on the kids and we're outta here


Neighborhood park, play in the sunshine
Pushing three kids on the swings at one time
Let them run and climb 'till lunchtime
Put them down for naps and scribble a couple rhymes
I'm in my basement, what?
I painted the walls and brought a matching rug
Surrounded by records and beat-making stuff
Jake track bump, drinking water from a jug
Later on I'll probably throw catfish in water
Thaw it, season it, put cornmeal on it
Fire up the stove and heat me up some greens
Farm up crispy and steam some green beans
I don't bake biscuits from scratch
But listen to that (this is good)
Don't nobody care, a lot of grubbing around here
Sparkle a pair of juice in cups in the air


When the sun finally tucks itself behind the stars
I launch out of my backyard with a cigar
Might take a bike on the quiet blocks alone
Bob Marley playing in my pocket on the phone
Streets are peaceful, the croon is sexy
Slide by the lake, see the moon's reflection
Days are crazy, the evenings fly
Airplanes stopped screaming in the sky
Young lady's skin gets warm, she ain't even knowing why
Love starts to gleaming in her eye
Chest start heaving, she breathing, the feelings of the night
Before long she screaming ''oh my God''
I take a little taste of a mint Milano
And my eyes start to dip to the bliss that follows
And I drift off listening to a novel
The revolution is back on again tomorrow",https://genius.com/Brother-ali-just-fine-lyrics
Dreaming in Color,Mourning in America and Dreaming in Color,2012,"I don't beg nobody pardon to be confident
I'm just saying my shit didn't exist until I did it
I'm the one that's suffered for the politics that I done spit
I ain't quit, I hit every continent and bodied it
School of hard knocks equipped and I ain't get a scholarship
Bet I had it poppin' since hip hop was on that power fist
Then when y'all got counterfeit, I switched and did the opposite
Now I'm on some outsider shit, ain't that about a bitch
I ain't never lied about what my skin is, it's obvious
I'm just so obsessed with bringin power to the powerless
I insist; I would never operate on cowardice
Rather chop my wrist than be afraid to take this kind of risk
Every single line I ever spit, I put it on my kids
On my blood, on my tears
All that pain, all them fears
All them shows, all them years
I was chose for this here
Maybe I'm a dreamer that's exactly what my problem is
But when I do dream, believe I see it all too clear
You can keep your money, I just wanted y'all to hear
And remember...ugh...

Thank heaven for blessin me with a heavy flow
Twelve years old, I was already hella professional
Let it go, follow the regular road, hell no
Listen close to my own/ heart like a stethoscope
Wrote myself an episode/ set it and lettin 'em fold
Turned over every stone/ better than ever before
And every sentence I wrote/ shot it direct for your throat
Made every effort to blow/ you best be ready to go
????? never get the doe/ should've known
Didn't piss and moan/ bit my lip, when out and built my own
Hit the road and did the globe/ so many times I've lost count
Time that I done been at home/ and didn't recognize my house
Doctor said  I shouldn't perform/ I just tuned 'em all out
Temperature 104/ rhyme 'til I fall out
I destroyed my vocal chords/ I'mma stand tall and shout
Never let it go/ until they know what I'm bout
I give it all and ain't never runnin out
If you listen close I'll teach you what this love's about
Just remember...

Y'all know I ....Got that mic
On a mic/ all my life/ drop it like
Glowing out my eyes at night
Come on now what's right is right
Always say it's darkest right before the dawn
Come on write/ Till I reach my highest height
I'll not go out without a fight
Bear witness I gets it in/ tear them bitches limb from limb
Carry this through thick and thin and just jump in and sink or swim
Ain't nobody realer than/ realest always recognize
Best believe the slouchers that doubt me just keep me energized
They hold me in cages but my soul is only strengthened
My whole vocation, I rose to those occasions
Growing short of patience/ my ultimate motivation
And no I don't expect no open invitation
But you gon' have to go bed just knowing that you're hating
You're ignoring greatness; that's no exaggeration
Allow me to stretch your imagination
Any way you look at it this shit is amazing
Remember..who we are..",https://genius.com/Brother-ali-dreaming-in-color-lyrics
Original King,Off the Record,2007,"* originally appeared on Scribble Jam '06 Compilation

Now just you hold on a god damn minute now!
Motherfucker hold your eyes up when you're talking to me
Don't you know you're in the presence of greatness boy? Original king
Love to do his thing. You in trouble right now motherfucker

Yes y'all the flesh and bone season
Veteran, yet it's just my second whole season
Etched in stone one of the best poets breathin'
They don't kick over the respect I don't need 'em
I bring it like it never been brung man
I swing it like it never been swung
I'm second to none
As long as I still got a breath in my lung
Might as well find yourself a place to rest til I'm done
Blessed with somethin' called a sophomore curse
That mean you waitin' for me cause you loved my first
Must have heard hunger and thirst up in the verse
And now wanna bust so much that it hurts
Plus what am I? A flash in the pan?
I fizzle out and stand here, ass in my hand
I ain't that kind of man, I'm attached to my fans
Every track that I smash gotta match their demands
I'm the first to the venue, last to the van
I carry turntables and the wax for my man
I shoot a star out the sky, land in my hand
I'm off to the next one catch me if you can
Amen

Not fuckin' around. Been watchin' you motherfuckers scurrin' around and shit
Swear to God you real. You ain't seen shit. You ain't did shit
You 'bout shit. Hold up

I hear tell that I ain't your cup of tea
I fuck with white rappers and you can't fuck with me
I sold my old pistol and don't run the streets
And I ain't got tattoos all up my sleeves
Well
All I can tell you is that I am what I am
How could you not respect one that stand as a man?
Lest you never peek up out your box
You a follower
I don't kiss ass and suck dick, I'm not popular but
If you were real you would recognize me
They don't make them like motherfuckin' Ali
No more
I ain't here to blow my own horn
But it takes a certain person to write those songs
The biggest difference between us
Is unlike them I don't pretend to be no thug
Just a city kid and know how to throw a punch
I'm no stranger to the taste of my own blood
Got you chain and decide to grow nuts
That shit's Golden Girls that ain't golden gloves
Tell 'em Ant
I ain't scrap no more, I'm growed up
Too busy, no free hand to hold a grudge
Told your ass once that my shit is amazin'
Seen me on stage, think it's biscuits and gravy
I spent my young life in the eye of the shit
Don't hate me for anything I ever did
Motherfucker!

I mean come on now. What you starin' at your speaker for man?
There's nothing wrong with it. There's no holes here
It's you, you're hatin'
 - 3X
I live I die, I laugh so that I don't cry
I work hard
I bust my young ass to survive
Ain't no rap video this is real ass life!",https://genius.com/Brother-ali-original-king-lyrics
The Magnificent,Off the Record,2007,"I. Am the magnificent. Check it out

The magnificent, born gloriousness
South paw raw, ghetto lawlessness
I ain't never hypothetical or ""for instance""
What I'm givin' you is livin' proof that God exists
Santa Claus killer, all of y'all get gifts
Get crossed off my list when the sawed off kicks
Ain't no more bitch shit
Pawns get flipped quick
On some Fresh game of chess on the park benches
I kindly invite y'all to mind y'all business
Before I close down the castle and the draw bridge lift
I clown and kick to get a spot like this
My pocket knife twist through your heart like this
Vocals blastin'
The soul impassioned
Clothes won't be clashin'
I'm so old fashion
Cold blooded assassin
Microphone graspin'
Dealin' with your rappers in an orderly fashion
They lean back baskin' in the gleam of the Brother
I'm Superfly T-N-T motherfucker
Who God bless, let no man curse
Your new-new shit ain't fuckin' with my old ass verse
I flash on your foolish like a Kodak burst
And paint a picture with your weaknesses I know that hurts
Don't you know the prophet feed the poor man first?
Need to fix your own plate daddy, your hands work
The higher the monkey climbs the more he show his asshole
One for the freestyle, two for the cash flow
I am the magnificent

We sent to get down
The magnificent
Knees bend and heads bow
The magnificent
We step through your town
The magnificent
Please bet that my style is magnificent
*scratching*",https://genius.com/Brother-ali-the-magnificent-lyrics
The Trap,Off the Record,2007,"Judge not lest ye shall be judged. Let he who is without sin cast the first stone
Until you have walked a mile in a man's shoes you can not judge a man

What if that was you born to the left of the tracks?
The place where you grow up is infested with rats
The Army didn't segregate that
Everybody who could, left in a snap
And never looked back
And since they've been gone they haven't invested in jack
Left very few ways for you to generate scratch
Your school is under funded, your teachers over worked
And when it comes to text books you gotta settle for scraps
And seldom when trapped
The wall pressed to your back
Can we ever think of anything except to react
If you ain't Einstein, you just a regular cat
And your self preservation is a medical fact
Then done set you up a helluva trap
They put bait in your face and if you take it then you never get back
What kind of set up is that?
The justice is just that
Just us, a public defender, his head up his ass
You're headed to a place where slavery is legal
And you being a human ain't no relevant fact
And if you play nice
You might escape with your life
And get a release date but don't celebrate yet!
Cause they're sending you back
To where you fell threw the cracks
Except now it's harder because you got a felony rap
Might get an interview but your resume's jacked
And the second they find out you got an F it's a wrap
In the 70's cats, from the ghetto made rap
Unifying worldwide, we all felt the impact
But the company that stole out, they sellin' it back
Stripped all down to, really, the irrelevant crap
And the message is that
If you poor you black
Throw some shells up in the gat and go and sell you some crack
Then you'll have shiny things and money in stacks
And Destiny's Child will want to fuck you for that
Look how the fuckin' deck has been stacked
And the effect it can have on you feelin' you never had a chance
Don't be judging people in a second at a glance
Or act superior because the blessings that you had
God don't prefer you, He's testing your ass
With the benefit you're givin', you're expected to pass
Take a look in the mirror
Reflect on that
Just might be a hypocrite reflecting in the glass
With yo bitch ass!",https://genius.com/Brother-ali-the-trap-lyrics
Fire in the Eye,Off the Record,2007,"* originally appeared on A League Of Our Own Vol. 2 compilation

Brother Ali. Rhymesayers Entertainment. Midwest. A League Of Our Own
Volume 2 motherfucker. Fuck with me right now. Listen listen

You are now inside the brain of Americas best
Forrest Whittaker hungry, it's about to get ugly
Police with their arm extended can't touch me
Smacked in the face is how this shit struck me like
Showstopper
A-L-I the Brother
Since 89's the number
And ain't tryin' to slumber
Representin' for the birth pain of my mother
Ali like Rocky, I train in the gutter
But it ain't about the tunnel
It's the light at the end
And we walkin' through life with a mic and a pen
Mentality is that of a cat who gon eat
I grind till the sparks dance off the concrete
Stand close to me
Watch me hopefully
Cause you're gonna see my gift open up the door for me
The last of a dying breed
Live MC
Look inside my eyes and see what's inside of me

The ock got the fire in the eye
All head turn when the brother walk by
And you should know that when you got that little feelin' in your soul and you're cold
And tonight you might die ahhhhh!

The syllabus will be read aloud this evenin'
Watch out now if you're too opposed to be in this
Open season
You should know not to walk nearby the cage when it's this close to feedin'
Hold your feet in the flame
Ali is the name
You'll be chantin' ""boom bye aye"" when you repeat it in vain
His beats are insane
And you can ask any local wack rapper to show you where the teeth are ingrained
Even my lazy eye got that fire in it
Went from grindin' to shinin' and now sky's the limit
They do it every day without disguise or gimmick
Your face look better when my fist grind up in it
This is the house that the Sayers build
Now I use it as a return address when I pay my bills
Pain and guilt fill the pages up
We gonna ride till our days is up
Motherfuckers say...
 - 2X",https://genius.com/Brother-ali-fire-in-the-eye-lyrics
