title,album,year,lyrics,urls
Shadows on the Sun,Shadows on the Sun,2003,"(We'd like to capture your minds right now)
(What you say)
(Take you a little bit higher)
(What you say) (3X)

I like the snares loud enough to make your eyes blink from it
Only male with the Holy Grail, drink from it
I keep an eye on heaven and a ear to the street
And spread a thick layer of blood, sweat and tears on the beats
My brain rest upon the hip-hop lexicon
That I acquired in the decade of work that people slept upon
I don't rap, I recite the prayers of the inner soul
Of the slave ships' human cargo
Seemingly meaningless rappers flood the market
With shit that make me pace in my room until I rip the carpet
I'm fit to start up this next millennium
Swingin the grappling hook at cackling crooks to finish em
The city dweller sendin telegrams from Neverland
The better man, kind now, kindly join the caravan
We're like a rock band that pack contraband
And won't hesitate to stomp a man into the rocks and sand
Brother Ali, and if you haven't heard about me
I'm flyin just beneath your radar so y'all can doubt me
Stay on the sonar with crowbars to open minds
There's a ladder you're supposed to climb
Approach a Rhymesayer with a Buggsy Siegel sized ego
You gon' get yourself snatched out the sky, you know 
the steelo
By now, where, what, why and how
We start the revolution real time, right now

Yes, leave it to me to create hope where there was none
The human being shall cast shadows on the sun
Leave it to me to create hope where there was none
My inner soul shall cast shadows on the sun
Just leave it to me to create hope where there was none
The human being shall cast shadows on the sun
Leave it to me to create hope where there was none
My inner soul shall, my inner light shall..

I rhyme for cats up in the harbor lights
Prayin they don't starve tonight
And stay positive in the face of a harder life
My chorus light the torch for those on whom the sun set
Verses meant to speak for the voiceless
So let us never be dismayed or afraid
The ground we're walkin on is stained
With the blood of those before us who came
Soldiers in this freedom movement are too numerous to name
Cause the human soul yearns to be free, it's all the same
I rhyme for runaways prayin that they see another day
You gotta make it through the winter to feel some summer days
It's for my natives, it's history in the way their hair is braided
Elephants never forget, that's how they say it
Tell my man  in prison keep grinnin because he's innocent
And tell him that the tests we get are heaven-sent
Listen, I rap for the ones that Johnny Cash wore, the black, for
Black and white women that were turned to crackhores
And I empty everything in the bank to give for it
I empty all the days of my life to live for it
And I empty all the blood in my veins to fight for it
So I empty all the ink in this pen to write for it


I glance in the sky and see the same cloud configuration
That Nat Turner saw the day they hanged him
Resisted in the face of adversity with a fist and it was raised
One finger extended, meaning Allah be praised
Spent days in Heaven's embassy
On Qu'ran pages Allah explains this legacy
Angels doubted Adam, Jacob's brothers clapped him
And ancient Pharaohs were too brutal to fathom
If all the earth's oceans were ink and the trees were pens
You could never write the knowledge of God, it never ends
And I know it feels like the whip wounds will never mend
But it's the way of makin the oppressed prevalent men
We standin with humanity at destiny's door
Chanting the war cry, it goes, ""Never no more""
So if y'all tryina talk about the horrors you see
Feel free to tell your stories through me

There's only one God and he's not just above
There's only one man and there's only one love
Till everybody gets what I instill in my seed
For that y'all, we willin to bleed
There's only one God and he's not just above
There's only one woman and there's only one love
We doin this till all of Adam's children are freed
And for that y'all, we willin to bleed",https://genius.com/Brother-ali-shadows-on-the-sun-lyrics
Prince Charming,Shadows on the Sun,2003,"You just don't know what you do to me
If you would just give me a chance then I'm sure you'll see, baby
You just don't know what you do to me
Only God knows what can happen when you fool with me, lady

Excuse me, I mean pardon me
I mean you got me so shook I can hardly see
And I ain't tryin to be foul or disrespectful or nothin'
But I feel like the universe should tell you somethin'
You somethin', and I don't say that to be sayin' it
Many came and went, but baby, you the main event
That's why I stopped ya, it's not just the body parts
That made me watch ya, mama, you got the posture
And demeanor of the Queen of Sheba
And I'm Prince Charming, girl, pleased to meet ya
I could be your student, you could be my teacher
And I'm majorin your idiosyncrasies
And I please trouble you to use a word with 'w'
The way your lips movin got me pluggin too
You a great ten frame draped in heaven-made skin
And a faint grin, can a church say amen?
But why you catchin the bus?
With your backpockets lookin like they're ready to bust
Got a you and a me, now let's make it a us
Long story short, let me get a phone number, somethin, girl

Oh Lord

Third date, can't stop fate
I know you can relate cause I can see it in your face
It's time to take this thing we got to the next level
You know, I mean spend all our waking hours together
Surprise, showed up at your job again
And I took the time to interview all of your friends
I don't think they good enough for a queen like you
In fact, cuttin them bitches off the first thing you need to do
I was thinkin, I wanna be everything to you
I'm the only friend you'll ever need, man, that's true
Besides, I bought you a beeper, so I can reach ya
Anytime I need ya, you in the streets just
Cluckin and cluckin, and cluckin and cluckin
Girl, we could be at home gettin into somethin
So don't look at me foul and don't talk to me funny
Won't you come on through, give daddy some of that honey, girl


Did you have to go and tell the law you scared of me?
They came to mama's house and embarrassed me
Can't no piece of paper keep me away from you
You just don't understand how much I love you
I tried to tell you that I was sorry with a card
But I found it in the garbage in your backyard
Everytime I get involved it's some shit that happen
Girl, you start out nice, then forget your manners
Let me tell you that's what's wrong with these women today
How you gon' have a good man feelin this way?
It's a 30 second message that I left you today
And I know you're home cause your curtains are open
Quit playin these child-ass games, girl
I mean I got a tattoo with your name, girl
You gon' mess around and get somebody killed
Cause if I can't have ya nobody will",https://genius.com/Brother-ali-prince-charming-lyrics
Win Some Lose Some,Shadows on the Sun,2003," (2X)
And you win some, lose some
They run the gamut from hilarious to gruesome
In my life I done caught some and threw some
And I done been in some shit
But this is one that I will never forget

Testosterone theater, hallway confrontation spectacle
Time to see who got the testicles
I'm not the type to holler, ""What you wanna do then?""
Hands parallel to my shoulders, I keep it movin'
There's one thing I hate it's for another man to take control
Of a situation, you don't want me to play the role
I'm in my element on Front Street, I love the spot light
Bringin' an audience to diss me is just not right
I told him, ""Listen stupid, I know what you're here to do
But we're not gonna do it
This is a movement that I'm part of and
You're lucky I'm a righteous black man
""
And you thought I had issues now, really had 'em back then
I turned my back with the anti-climatic spitefulness
That's the worst type of diss
And I stepped off, adolescent, passive aggressive
Jesus Christ superstar to send the world a message
And there stood little man soft dick in hand
Wonderin' ""What the fuck just happened?"" Mad enough to kill a man
I turn the corner like as long as he ain't pullin' a gun
I'd rather catch a ass-whuppin' than run


I put 'em out there bad too, really they had to
I turned around, they runnin' right directly at me, they looked mad, too
A half a minute felt like a half an hour
When he got close enough I stuck him once for black power
All three bombed on me, started swingin' me around
Hollerin' ""Get him down, get him down!""
I'm like fuck that, y'all not gettin' me on the linoleum
So three white boys can start stompin' only one
They didn't hold back at all
They started bangin' my head against a steel locker like a freakin' racket ball
Grill was all busted, the locker was rusted
And when my face hit it it split my bicuspid
They spilled blood on my 'Boys N The Hood Increase the Peace' t-shirt
Now, isn't that symbolic?
I came to school a week later with a eye full of stitches
And I held my head high at them bitches
They lookin' at me like, ""Yeah y'all done fucked me up
What you think that's a thing that's gonna shut me up?""
Shit, nope, still swaggerin', still battle-rappin'
And still not givin' em the satisfaction of bein' mad at 'em",https://genius.com/Brother-ali-win-some-lose-some-lyrics
Missing Teeth,Shadows on the Sun,2003,"I dictate while most MC's lactate
Can't wait for me to smack brakes and fuck em till my sack breaks
They stand still with a little bit of spittle
Drippin off the middle of they lips tryin to light a cigarette
And I'mma watch em all choke on my vomit
Took apart, shook up they heart, they died on it
And I promise, if you could hide from this monster
You'd quit tryin to ride on my divide and conquer
Some gotta die 'fore the dumb realize
Not everyone can fly, most don't have wings
Keep takin a nap, wear a brick for a cap
Or get the fuck off the lap before you lose everything
I spit shrapnel while the villagers babble
Slice deep, pull, peel, and let the skin unravel
We're here to scrape off a layer of your make-up
So we can see what a bitch is really made of

I step off in your hoola-hoop cypher with my eyes all aglow
Walkin tall enough to make your half moon whole
You don't need to get duct-taped to the bathroom flo'
Cause I don't think your shit is flavor - but the rats do, though
You and your little bitch buddies think you're Thelma and Louise
Cause you got a drum machine and you throw jealous to the breeze
You need to respect a fuckin legend when he breathes
'fore you get a K-Swiss logo embedded in your knees
Shock the body-body, rock the consciousness
Stagger the imagination, box your esophagus
The paradigm, you step past the line
And I'll show you why the masterminds have got a fuckin axe to grind
Street magician like David Blaine with these songs
Crip-walkin through your mental corridor with metal cleats on
Slug got the weed smoke, Ant got the beats broke
And your fuckin eyebrows might grow back, but your teeth won't
(You gonna look pretty funny tryin' to eat corn on a cob with no fuckin' teeth)",https://genius.com/Brother-ali-missing-teeth-lyrics
Soul Whisper,Shadows on the Sun,2003,"My brothers in the plight
Who ain't got your head right
Too many people shed blood
For us not to shed light
We hot we dead right
We drop we take mics
We run these streets
Like cops through red lights
We shine so bright
We learn the life
We high beams in rearview
Weaving through the traffic just to see you
Man's truth living is lost
By the time you hear this when your position is took
My brothers in the plight
Who ain't got your head right
Too many people shed blood
For us not to shed light
We hot we dead right
We drop we take mics
We run these streets
Like cops through red lights
Bismillahirahmaanirahim
Rabbana la tuzigh quloobana
BaAAda ith hadaytana
Wahab lana min ladunka rahmatan innaka anta alwahhabu
Rabbana atina fee alddunya hasanatan
Wafee alakhirati hasanatan
Waqina AAathaba alnnari
Astaghfurhallah al azeem kaffeer
My brothers in the plight
Who ain't got your head right
Too many people shed blood
For us not to shed light
We hot we dead right
We drop we take mics
We run these streets
Like cops through red lights",https://genius.com/Brother-ali-soul-whisper-lyrics
Pay Them Back,Shadows on the Sun,2003,"Blood on beats
Tears have been shed
Lives have been lost
Blood has been spilled
Blood on beats
Damn, look at em sittin there, cats missin their chance
Pissin their pants for opportunities and disappear into a bar stool
Pardon you for thinkin I forgot about
The way that children act when the stars come out
It would be too much like right for them to tune up their sight and then
Pursue something tight within, the blue ugly life they're in
Liked your grimace but I must admit it's been a while
Since my outer adult disciplined your inner child
I've taught you the limits now when I crack your slumber
I expect you to say, ""Thank you sir, can I have another?""
Your chance to wonder is up ( ? ) enough talkin
So they won't be caught off guard when I'm knockin the dust off em
Plus tossin em in a moshpit, my village sacrifices virgin rappers
Who don't do the Rites of Passage
Curl em backwards till they faces touch they asses
Mail em off to Paraguay and don't insure the package
Burned your vermin asses, learned your nervous habits
In turn my current status lefts serpents swervin backwards
I rock parties where half the crowd is rappers
And analyze my diction as if their opinion matters
I splatter patterns of poetic eloquence
Mutterin bone shudderin utterin sense, they fluter and twitch
The ironic part of it is, I ain't tryin to scare these kids
Just tryin to connect them to the heritage
Beneath the outer layer the train is black
You just don't disrespect the people that lay the tracks
You love this human expression and they gave you that
And so the least y'all can do is try and pay em back
I said beneath the outer layer the train is black
You just don't disrespect the people that lay the tracks
You love this human expression and they gave you that
And so the least y'all can do is try and pay em back
You ain't the first, you will not be the last
Contribute
Do your shit, step the fuck off
You're not half as important as you think you are
Blood on beats
Blood on beats",https://genius.com/Brother-ali-pay-them-back-lyrics
When the Beat Comes In,Shadows on the Sun,2003,"Open the doors, let the people in
Turn up the mics, let me speak to them
Victorious when the evening ends
It all starts when the beat begins

You're now fuckin with the show stopper
A-l-i the Brother, since ""'89's the number""
Fuck ""another summer,"" I'm the world's most accurate
Take the roughest cats and get em passionate
Shake awake the walking dead Lazarus
With off-the-head narratives, it's embarrassing
I mean, I'm the albino but y'all pale in comparison
I'm not arrogant, oh shit, well yeah, I'm arrogant
Grab the microphone out your arm so fast I tear a limb
Roman fashion, give yo soul a spasm
If you don't know find someone that knows and ask him
I'm right in front of ya, tight muthafuckin mic muzzler
Who might struggle ya, my shit's wild like that
There's 8 million ways to stretch words around beats
And 6 million rappers be sharin the same three
But me takin the time to be creative with mine
Touch your soul till I see it in your face when I rhyme
And in the two or three seconds it may take to rewind
I hold a rapper to the flames until I make him resign
Want nobody hold your place in this rhyme, you find a space to recline
You're dead, got to stay breakin your spine

Every father, mother, son and daughter send em to me
Do not approach the ock without bendin your knees
I might be on the stage but my head's in the streets
We settle the beef (when the beats commence)

Ladies and gentlemen, Brother Ali bare the resemblence
Of Moses freein y'all with sentences, vocabulary venomous
Telling domestic horror stories
Non-fiction with the majestic oratory
Instead of concentratin on strippin the youth naked
I give em the truth naked, livin proof for the sacred
Unless I'm mistaken there's like three kind of people
Black people and white people and my people
I blister MC's and twist the debris
I got a funny knack for bringin kids to their knees
Y'all got Christopher Reeve-sized bravery tryin to play with me
Have you in fetal positions shoutin ""Get away from me!""
Every day I see rappers I wanna slap or strangle
Around they neck disaster dangles, so that's the angle
Next millennium, same percentage of em are weak
Y'all thinkin y'all can rhyme, don't even come from the streets
You got any sense at all, you mean-mug and retreat
Or end up a human pinada hung from your feet
When I told you you were tight I had my tongue in my cheek
And you ain't lookin at my team, buddy, our huddle is deep
Born to hustle on beats, I just have it within
If I had any more potential I would have to be twins
Cackle and grin when rappers begin to babble and spin away
Y'all should pick a day, to it-gay, the off the ick-day


I'm a desperado, but I guess that y'all know that already
My stick-and-move flow pattern steady
The Bro has already dissed rappers of every race
Got em together for a ""We Are the World"" remake
If Ali's fake please take this opportunity to tell he
To his face, get your infrastructure erased
When I flip damn it I'm fly, kick sand in your eye
And tell your record company to eat a shit sandwich and die
Ali's a big teddybear
Till they scream, ""Stop slammin the car door, that's my fuckin head in there!""
Your teeth are everywhere, I serve your family
And write about it in my journal like I'm Mister Belvedere
I seldom stare in the sky, only at nighttime
Envision endin your mission when I write rhymes
History's never witnessed a legacy quite like mine
And the more they try to extinguish it, the more the light shines",https://genius.com/Brother-ali-when-the-beat-comes-in-lyrics
Victory! (Come Forward),Shadows on the Sun,2003,"Victory
Ours are the cries that breathe life in the concrete
Victory
Ours are the tears that splash genius at God's feet
Victory
Ours are the prayers that weave poetry through drum beats
Victory

Step inside the mind of a soon-to-be legendary
Straight paramilitary
Brother Ali exist to read the scripture, it's never read
Whoever said this underground hip-hop shit is dead
Must have fell and hit his head
Spent my lifetime buildin
Writin rhymes I remind rappers of everything that scared them as children
They call me show stopper
No opera singer has hit the exact pitch, I spit my flow out of
Taught directly by the source of all knowledge
You don't affect me till you're forced to draw powers
Respect me as a voice amongst scholars
Who speak deep to thee, move the sleep from your eye lids
Make your lungs flutter
Get it right, my inner light cast shadows on the sun, brother
I'm where the rubber meets the concrete
It's a cold world, not sayin bring your your own heat
I'm just sayin don't sleep
I'm walkin with Allah until the day that I die
And the pens have been lifted and the pages have dried
And a thick smoke screen wrote my name in the sky
Politickin with the angels knowin they would reply
Got the lungs of a cyclone, tongue of a python
The reason why your favorite MC sleep with the lights on
Right on, brother, we def as fuck
Not 'deaf' like (What?) but 'def' like (WHAT!)
From the depths around the planet where my name's spoken
We here to get our brains open and our chains broken
Watch me walk around the planet with the same notion
His adversaries thought the pain broke him
But we run up in a stadium with diagnostics
Two tables and a mic and take a crowd hostage
And the very first item on my list of demands
Is that all these freedom fighters start liftin they hands

To my freedom fighters and the graffiti writers
And the people like us - come forward
And to the torch carriers speakin Arabic
Ridin on your chariots - come forward
To my political prisoners, individual listeners
Who feelin this - come forward
And to the bone shakers and the home makers
Raisin our own saviors - come forward

Me and my people are signed, sealed, delivered, incorporated
Brought to you by Rhymesayers Entertainment
You got to face it, we not complacent
We came via the basement and left your face bent
And me, mister Brother Ali is the stomp-down-beat-kicker
Who walkin the streets with the so real philosophy
Until I fulfill prophecy there's no real stoppin me
Obviously I'm the bomb, believe me
Opponents come up missin and they all beneath me
I know my soldiers need me, they call and beep me
I walk the streets freely with chalk beneath me, boy
We stays gettin it on
Act hard and I probably make you strip to your thong
Dissin your song and feel you mouth to fist when you yawn
Nibblin on a rapper till the gristle is gone
I stand and sing from atop my minaret
I am a king, just ain't got my kingdom yet
And my anthem ring from the Congo to your set
I'm Alfred Hitchcock with my silhouette
Pourin Blood On Beats 
till the trumpet is blown
Coffins, I release em when I'm up in the zone
Fortune favors the brave
 and press on is the motto
Cast shadows on the sun with my bravado",https://genius.com/Brother-ali-victory-come-forward-lyrics
Bitchslap!,Shadows on the Sun,2003,"Yo Ant, kick the beat you just kicked a little while ago...

I bitchslap rappers so hard it give em whiplash
You fuckin with sleeveless t-shirts, where your tricks at?
Look left, look right, wait, where your chick at?
She findin out she walk and talk white but ride dick black
I'm a big baller, shot caller, all a y'all are runnin laps
Let me tell you little fuckers a story walkin out
You probably think you're somebody big talkin loud
You're transparent, I been starin through your Karl Kani
Art imitates life imitates art
Get it straight, slice through the mic, pourin out my heart
When it's late night we litter the landscape
Animate our dead opposition to get one last phoney handshake
I read a lot and write a lot, empty my pockets at the giro shop
Hit the cash machine for some green, maybe a ten spot
I said giro cause my Greek's a little broken
But my four-letter French works fine if you're provokin

And we killers in the morning, killers in the evening
Wake up and we yawnin, happy we still breathin
Got one longin, that's to keep eatin
We here to stay and we ain't leavin
(Rock y'all)
(Everything gonna be alright)

I'm a cross between John Gotti and Mahatma Gandhi
Look between pimp and square, you probably find me
There, in vain I solemnly swear
I'm a Guardian Angel with gang signs in the air
I spent too much time fuckin with sorry sobs
Treatin beats like bitches, flippin ménage à trois's
You ain't tryin to see us angry, pop, we already hard
Fuckin with the diplomats'll get you horribly scarred
From the cat behind the wall who play handball in the yard
To the one that run the block as head baller in charge
To the brothers with the kufis on that walk with their God
Mission Hill, Caprini Green, all ghetto scenery
Every city got us beaten up, down-trodden, creepin up
Soundbombing people, what? Till we get a equal cut
We come through straight smashin on the haters
Witness the world, the Rhymesayers


Often the brain runs
And expresses itself in words, sometimes profane ones
That's when it first occurred to me where the pain comes
From, page one in my rhyme book
If you listen closely you can picture how my line looks
You presently pressed to be restin next to me
The best of me molestin destiny wrestlin with ecstacy
The recipe for immoratlity
Flows actually be on the malls and factories
Of urban life with the laws of gravity
Audacity, you got a lot of it
Common sense should tell you not to rap against
My obvious dominance
My real life size is bigger than your confidence
Man, fuck ya'll",https://genius.com/Brother-ali-bitchslap-lyrics
