title,album,year,lyrics,urls
Caught Up,Rapmasters 7: The Best of the Laughs ,UnKnown,"Well I'm nimble
And I'm nice like Kris Kringle
But Joe I got caught, caught, got swindled
Me and a couple of boys at Kings Plaza
Walkin' through the mall to see if they had a
Couple of shirts, a few pants
Just out of the blue, went, took a glance
In front of Macy's I seen two girly-girlies
One looked def, the other looked like Mr. Furley
With my ego trip, my Wilson flip
I used my lip to get both on the sneak tip
Then I sicced it
Kicked it to the ugly one
Souped her up, I called her Lipton and honey one
Things like that, gibberish and crap
She's a skeezer, there's no need for chit or chat
Her body looks , kinda good, yeah, but
As for her face, Jabba The Hut
I shoulda played Michael Jackson, told her to beat it
I said, what the heck, I got a condom, freak it
Her nickname now is Mona the rover
She looks like a dog so I dogged it on the sofa
Some dumb reason though, it was fun
Now she's looking good to me, I'm caught up part one

I'm in love with an ugly girl, but hey
I'm gonna kick it to the pretty one today
She seems nice and she's a fly cutie
Called her up I said, ""Hi my name is Chubbs,"" her name was Judy
I don't have to tell you guys the rest
But I asked her to go out, she said yes
Took her to the movies and then to my house
Led the girl straight to the couch
Like a game, I have to score
Dim the lights, get the two-ply condom from the drawer
Took off her shirt and only then I asked the question
Yo? who broke wind? something smells bad, dang
It won't let up!
It was Judy, the cutie! yo, word up!
So now I got an ugly girl and one with the smell
But which one should I choose? oh well
I'm caught up

I know I'm hard, 'cause I'm Chubb Rock
But even to my chest I got a soft spot
That could easily be ripped apart
I'm hard like the Tin Man but I got a heart
Every night it seems I stay home sick
Trying to figure out which girl will I pick
Ripping my heart, damaging my soul
All these problems because of a little hole
And recreation in a bed
But Mona and Judy are getting me fed
Up to the point I couldn't even hold my own
I was like E.T., I had to phone home
To ask my mom a question she always knows
She says Chubby, follow your heart and your nose
Be celibate, no girl, be a loner
But I picked the ugly girl yeah, I picked Mona",https://genius.com/Chubb-rock-caught-up-lyrics
Beef,The Mind,1997,"Here we go
I arrive from the steps of Sinai cause I'm fly
When you're high from the lye
You see me mingle in the sky
The dim light superceeds the street cock fight
Straight heterosex, but I still Dick Van, your dyke
From the mic flip, metronome time skip, who will high-ship
The Brooklyn-based scholar and them niggas past Islip
And ooh-ooh, I curse you with that Fugee-la voo doo
Will do you like Italian deli kids slicing prosciutto
I barb you like Bobbito, the airport, right through Heathrow
Release murder niggas like Ito
Pure hatred, cause he picked who he picked to mate with
Then laced it, bourgeois player two-faced it
Hey, revamp the swing to parlay
How black power went sour, where's Brother Jay
Where's the pink Cadillacs protected by whoever
The red and the black, green, Hilfiger nigga
Indians wanna protect the Lone Howling Chief
So kids create beef

Back in the days when we had nothin but beef
At the end you may lose nothin but teeth
That's fly
But nowadays ask kids when they have beef, you might die
Why

While niggas beef about this and biggedy-beef about that
I'm with my soldiers in the Rover, never sober, fuck that
Yo dun, I run with wild Crooklyn niggas with gats
Pigged-push wigs back on corner spots full of criggedy-crack
My niggas click back kid, that's why we hold something
And break your punk ass down just like you stole something
When I rock with Chubb your block show me love
Nigga what, want beef, we drawing first blood

Well, it's the riggedy-rhyme dropper, the hip-hopper, you know the name
I ciggedy-can't explain (why niggas beefing in the game)
You see, I niggedy-never get shocked when a nigga get wet
Tiggedy-talk that shit, I guess you're bound to get hit
The rap zone's now a war zone, we fight on sight
We wiggedy-wildin out, proving all these white folks right
We like some crabs in a barrel tryin to get on top
The Hit Squad, Chubb Rock represent hip-hop
So kill the beef


Well, when I first dropped the bait back in 1988
I couldn't wait to get straight and dominate state to state
Went to feud, bullshit evil, exterminating flows
Check your grip, don't slip or get a dose on how it goes
Jealous niggas, gun triggers, fucking up the game
But me you can't tame an outlaw like Jesse James
We got east versus west, bullet-proof tef' vest
Who's the best, but let it rest because there's no contest
Temptation, accusations need to stop
Unify hip-hop, PMD, Chubb Rock

Now - I will come back to the groove
Now my man Common on wax slayin Ice Cube, anyway, that's cool
That nigga somewhere higher learning
And of course there's that famous beef between Parrish and Sermon
And that's cool, both those niggas killed Jane
And now there's Nice without Smooth, that's insane
And I heard they squashed that and that shit should cease
Cause black mutha-uckas shouldn't beef",https://genius.com/Chubb-rock-beef-lyrics
Life,The Mind,1997,"Yeah, it's like this..
Chubb Rid-dock, nine-seven on lid-dock
Son, rock..

Do you know, where you're goin to?
Do you like the things that life is showin you?
Where are you goin to?
Do you know, what you're lookin for?
Do you like the things that life has in store?
Chubb holds it down for sure..

Ever since mom kissed me and said, ""Seek life!""
My mind had an idea like that kid with the kite
No 'caine slingin, strong-arm bringin check my eyes
Redness done, so I can script ""My Life"" like Mary Blige
I've, been around the world in 90 days, pro-rated
Like Prince no shame for that past few Sheila's I've dated
Made it, with only one but I'm foreshadowing the rhyme
Like a nice Pirollo(?) wine, life takes time
I'm, one of two and to see it a one who's part of many
The quarters of my thoughts will cost more than a damn penny
Any debate we can correlate as to my release date
A nine-seven slate, New York state will have to check me
It's been some time since the break of the dawn
The genre has definitely changed since I've been gone
Whether, bad or good the flow remain tight
So I can come and drop my li-ight, li-ight


Well in the past black men used to work for (?)
My age group was plotting to obtain Dead Nixons
The plot, had three vectors for young prospectors
School, entertain, or become Hannibal Lectors
Stressors, used to stress the best, cess wine
But at that particular time I chose to use my mind
Goody too, size twelve shoe the Troy Ave grew
Waited 'til, after eighteen to introduce the brew
Downed the suds and gave a street buzz
High in the +Forrest+ but stupid is as, stupid does
And, that's all I have to say about that
Flipped a Pulitzer prize script and started rap
Simplistic at first, and the knowledge came later
Rob-ski, Dave Wit, and Swanny on the fader
The struggle was on but the fame was in sight
And the tunnel had a light that distinguished my life


The low point was mad low when I lost James Los
Spent eighteen years livin next to this high-pro bro
And that's all I got to say, about that
While I give thanks to the man that my brother and I'm back
Onward, to the medals while the boys aged the mix
To the mental utopia, so walk past the six
And the rhyme and the flow, must stay real tight
Like it's always been in my li-i-ife, my life",https://genius.com/Chubb-rock-life-lyrics
I Am What I Am,The Mind,1997,"Here we go, ha ha
Thou shalt not have no other great one but me
Transcribin my lyrics is the C-H-U-B
The lyrics that you hear is not his but mine
While, biblical words don't need to ra-hyme
I said, ""Let there be a light,"" and there was light
And the breeze (?), like that kid who made ""I-Ight""
But men took mad dominion, over men
Hard bondage with backs and, knees that must bend
But only in prayer, I make your head need Ibuprof'/Bayer
Call me, the number one player
But hey.. the one pharoahes, parlayed
In the land of Egypt, when that slave shit behaved
Bythia(?) drew me, from the Nile to smile on the people
After me there will be a sequel
And I'll praise my name, in the jam
Call me what you want, but I am what I am

Hehe, I live in the souls of men, and women
And pilgrims and children who wiggle, to the rhythm
Just go, the people have corrupted themselves
They toke the devil's smoke, puffing their L's
I'll send, my only son down, to bless you
And observe how you know him, and that will test you
Years, of sufferation, will burn the nation
With adultery, skirt-chasin and crotch-blazin
You never learn - look how many times I kilt ya
I burnt ya, I drowned ya, I froze ya
I stripped your land and destroyed ya culture
Next time you better give me some
R-E-S-P-E (C-T) now hold ya but I love ya
I invented AIDS but also, invented the rubber
Each one teach one brother
Take my name in vain and you're gone like damn
Call me what you want, but I am what I am

Ha ha
Now you got light skin, dark skin, East coast, West coast
Old school, new school, dumb-ass fools
One land, one people, I am the one
Figure you disobeyed so I made the word ""nigga""
You can change the diction, but can't change what I'm writin
I script those Pulitzer books for that kid, Michael Crichton
Like {*tch tch tch*} I am the hi-hat
I am the M-I-C, I am Easy Mo Bee
And Easy Mo is me, he gets down when I want him to get down
I put the heights in the crown
I wrote the dead sea scrolls, I'm ""Strictly Business""
I made Erick and Parrish go gold
My crew is tan, darker than tan, I made the Ku Klux Klan
I made Rush +Def+ but, able to +Jam+
I'm flam, and I'm intricate
You must and should be a fan and I am what I am

The praise of the ""Goodfella"" is long past done
DeNiro's an actor, on cue, totin a gun
ACTION! Forty-five colt bolt, it gets messy
Then copycat murders flow to Joe Schmoe Pesci
Then the ladies, sex, to the break of dawn and
Another quaalude, and she'll love me in the mornin
Fast pace, ""Scarface,"" you can't win, God's race
When you're sparkin Noah's Ark, and you're in God's place
Baby - cock up your foot and you act crazy
Every ""Distinguished Gentleman"" wants a lady
You can't bug, when you wanna play real life cocoa
When you're ""Down and Out in Beverly Hills"" with Oprah
""Mi Vida Loca,"" and then it turns to weed smokers
Then you're dead, dealin with them kids from +cosa nostra+
But no autographs you must, already be a fan
I am what I am and that's all that I am",https://genius.com/Chubb-rock-i-am-what-i-am-lyrics
I Will Survive,The Mind,1997,"{You know you ought to, slow down..}
""Nine to five is how you survive, I ain't tryin to survive"" -] Jay-Z
{You know you ought to, slow down..}
""What I do for mine, I knew the time was gonna come"" -] Chubb Rock

For my, introduction in eighty-six I was lethal
Rockin for the grassroots and up keep the people
The movement of the bowel from that lay shit of the vowel
Mad share yeah, from Mr. Mufasa with the growl
The party's mad dead until I care to appear
Kids wanna know where the hell I been for the past year
No beer or no parka Nike gear no wear or tear
The new mic holder who causes, any fair
Some max and relax then mellow then strive
Shock-value MC's goin platinums with lies
The neophytic critics, who need big bats to hit it
They zone with the metronome clone to dome split it
When I joke around like Zog, rename them is like fog
I can flow digital, though my style is analog
I, base my career upon these years of how I've strived
Three years gone but I will survive, ha
{You know you ought to, slow down..}
""Nine to five is how you survive, I ain't tryin to survive"" -] Jay-Z
{You know you ought to, slow down..}
""Nine to five is how you survive, I ain't tryin to survive"" -] Jay-Z
{You know you ought to, slow down..}
""Nine to five is how you survive, I ain't tryin to survive"" -] Jay-Z
{You know you ought to, slow down..}
""What I do for mine, I knew the time was gonna come"" -] Chubb Rock

Ha ha, ha ha
Now this ""East vs. West,"" one contest was a taste
""Crooklyn Dodgers"" and that libation, touched the fan base
A little, always scared in the place I scare any new rival
Past years missin dissin scripting up this new bible
I'm your idol, the highest title, numero uno
I'm not a Puerto Rican or some black nigga who's peakin
The lyrics are abundant, dirty fat blue beats are pungent
And now we gotta see how hot, will the son get
I'm a lyrical defamer, like Gloria I'm a Gaynor
In the music biz I opened up more doors than Kramer
My anthology's available, so buy up the archive
Three years gone but I will survive
{You know you ought to, slow down..}
""Nine to five is how you survive, I ain't tryin to survive"" -] Jay-Z
{You know you ought to, slow down..}
""Nine to five is how you survive, I ain't tryin to survive"" -] Jay-Z
{You know you ought to, slow down..}
""Nine to five is how you survive, I ain't tryin to survive"" -] Jay-Z
{You know you ought to, slow down..}
""M-O (??) B-L-U-E"" -] ??

For the duration..
Overzealous inhabitants flock with abundance
Paying tribute, to the one the circumfrence
Of the stadium, is paying homage, to my cranium
The sea of heads doesn't seem to hide the lady
In the back row, waving her hands for the ohh
The usual crowd rock line for a show
And I dispense with the usu-al, and keep it coastin
To boom up the set my advice is take a motion
Before you walk through the door, of a Chubb Rock tour
Buy the anthology in any store
Frontin, now we'll have ya, tougher than mutton
If I touch your button you'll start kick like Charles Dutton
Lyrics persevere and you really must strive
Three years gone but I will survive
I.. I.. I will will, survive, now ho!
{You know you ought to, slow down..}
""Nine to five is how you survive, I ain't tryin to survive"" -] Jay-Z
{You know you ought to, slow down..}
""Nine to five is how you survive, I ain't tryin to survive"" -] Jay-Z
{You know you ought to, slow down..}
""Nine to five is how you survive, I ain't tryin to survive"" -] Jay-Z
{You know you ought to, slow down..}
""What I do for mine, I knew the time was gonna come"" -] Chubb Rock
{You know you ought to, slow down..}
""Nine to five is how you survive, I ain't tryin to survive"" -] Jay-Z
{You know you ought to, slow down..}",https://genius.com/Chubb-rock-i-will-survive-lyrics
Reputation,The Mind,1997,"Can we hear the track please..
BLAOW! Who are we? (We..) {Reputation!}
Who are we? (We..) {Reputation!}
Only the best touch the microphone
(One two, check one two) You know whassup
Chubb Rock, KRS-One, get 'cha mind blown
Now we gon' talk about.. {Reputation!}
.. your reputation
(It's about to blow.. shit's about to blow big)
Reputation {Reputation!}
(Mental countdown) {Reputation!}
Lyrical skills we bring for the nation
(We have liftoff) Chubb Rock come down!

I am the big time figure, the bass drum hitter
The I am what I am rogueish nigga
A flow like lava, to heat up the chatta
Heat up ya mat'ta, then go stick her daughter
I oughta, 
Joe Cocker your opera
Crowd rock ya, I make you scream ""Oooh ah ah!""
I, indubital mental big head
Praying for a battle if ya battle, you're dead
Get diesel, I do ya like they did Bugsy Siegal
I'm on the mic and Kris is really on the me-tal
Cuttin, backspinnin and recuttin
Your english bugged so you can't do me nuttin
Laced up lyrics and the beat real tight
Your song is wrong and I get focused right
With the EQ, be who, be you
When you're trying to be me, you and your crew
Just stop, before the shit gets too hot
You need respect - just to get a rep

Tra la la la la la la la lay
We the freshest deejay in America today, hey hey!
Tra la la la la la la la lay
We the freshest deejay, in America today - hey hey!

Well the lyrics of my peers have changed course here's
Platinum LP's, the subject is to swear, yeah!
And who wears what and what, fashion is up
And which designer cut is more corrupt
It's an open and shut case, no ill look is on my face
While the bass growls, profound nouns buy a vowel
I'm concerned because, ""You Must Learn""
Before you croak, I've been dope since I was sperm
Sellin records, but of course with no return
On the mic you know I burn baby {*inhales*}
With your beats you know you have no respect
Kids haven't walked wild since ""Go Stet""
And I bet when they stage rock they get booed
They need qualuudes to get crude and extra rude
The spirits have haunted your lyrics so I slept
Got nuff Z's, tryin to get a rep

If you thinkin that it's KRS you wanna take out
You better reroute quick you got it, all wrong
See when I grab the microphone career is finished
You better reroute quick you got it, all wrong
I do not mean to diss you but we simply are the best ones
And you can call him Chubb or you can call me KRS-One
Either way you'll get done, anywhere, any one
Me and lyrics one ton, straighten up and choose one SON
In nineteen-ninety-sess, KRS is in his peak'n
You will weaken and collapse like Michael at the Beacon
You talk more ish than a senator
You can't last, just call me enema, cause I'll be in that
Ass-teroid, heaven to merkatroid
I'm that 6L microphone holdin humanoid
Psychological like Sigmund Freud
But I get annoyed, cause these rappers have no brain
These hardcore rappers crack me up like cocaine
They got no skill or game
They sound like that commercial that be sayin
""Ask for Minoxonil, with Rogaine""
True skills I will explain
The T'Cha breaks the campaign down plain
{People always talk about..}
Complete blowout, complete blowout {Reputation!}
Check, complete blowout {Reputation!}
{People always talk about..}
""Now I understand what they're talkin about"" {Reputation!}
""Now I understand what they're talkin about"" {Reputation!}
""Now I understand what they're talkin about""",https://genius.com/Chubb-rock-reputation-lyrics
Games We Play,The Mind,1997,"All attention to all of the, lyrical swigs
Whether you studio switch or you're, synching a gig
Yes! I address to all the known known factors
Where you slave to the rhythm of con-troling the masters
I. Smythe, whether you drive a Benz or a bike
Whether you straight hit or you go strictly Dyke
Dick Van, no drugs I only snort Dristan
And I point to the sister, and yes I can can
A, gangsta lean get funky like a latrine and
Lyrics scream deep into the +Roots+ like Ben Vereen
Rockin, the Apple, since the Mayor were (?)
I smacked double platinum, or hit gold watch
I'll achieve, notoriety just like (?)
Squad squeeze, but they can mingle with the breeze
But hey, parlay - you don't know my way
These are the games we play..

Hey, hey, hey (hey hey)
These are the games we play
""I don't know what else to say"" -] Biggie Smalls


Journalists script shit, that gets me kind of pissed
No real award given to the, funkiest hits and
Lyrics get prolific and, kids start to sip it
Esophagus start bulge, specific and centrific
Get a dollar, if I sell more than the group Abba
The Source critics still want to diss my yabba, dabba-da-doo
The pulse that revived the crash crew
If I'm rockin, on the ra-a-adio eww
Why they, can't downgrade but if they try
I rock from Brooklyn to that Crooked-Letter-I
I, my temper, I remember starts to boil
The (? ?) but happy that the heads stayed loyal
The groove hits the ground from the maker of ""Get Down""
Peace love and all that shit plus five pound
Buy hey, parlay - you don't know my way
These are the games we play..


Mo hits the beat then Chubb handles the rappin
The un-thinkable flow is fly plus extra napkins
And the girls 'pon Flatbush look stush without my googles
And look as they squint then I blink push up the throttle
I, meet this to eat this I, leave this to Beavis
If I wanna smoke ya spliff I might get, stiffer than penis
Oooh, I had to go and rip your whole crew
With freeze love ran land butt rub and blue ooh
Dippi - dippi dip on you
With all my niggas and squads and the, funkiest jew
Ar-tistic lift it start the trend to the phonics
And, funk all pure lyrics that turn to alcoholics
Ghetto tales, start to prevail the shit
Whether you're East West Miami bass Blood or Crip
But hey, hey, you don't know my way
These are the games we play..
 - 4X",https://genius.com/Chubb-rock-games-we-play-lyrics
The Mind,The Mind,1997,"""Your nine spray, my mind spray"" -] Jeru {*repeat 3X*}

I can taste your sex appeal, ready for the sweet sperm'n
Bank accounts all full, love interest be earnin
Ben Franklins determine, if you get that higher learnin
The Million Man March, starrin Mark Furhman (it can happen)
Lyrical Don is the charm for the rappin
Give spliff aromas cause many fetal comas
No blood donors, I credit diabetics who drink sodas
While in the pens lie the ruffneck soldiers, what happened?
Niggas must have NAPPED!
What happened to all of that Malcolm X shit before he got trapped?
Before he got capped? When I mean CAPPED
When they put his name on all those cute little Spike Lee hats
And then they say ""Black is back""
For when, niggas now only care about the rent
And how to pay rent, and how they trife squad spend
Black powder nose Landcruise or Range Rove'
Why you runnin for when you forerunnin nigga who drove
Your mind
""Your nine spray, my mind spray"" -] Jeru
The mind!
""Your nine spray, my mind spray"" -] Jeru
My mind!
""Your nine spray, my mind spray"" -] Jeru
The mind!
""Your nine spray, my mind spray"" -] Jeru
Yes, haha
From the inner sanctum, that embruised my medulla
You can praise buddha, or you can hail Don Shula
You can change a, religious title, or go praise gold idols
No sloth, just go read your bible
I'll insinuate the hate that made the, hate kids fight
Whether you're Muslim, Christian, or Israelite
We monitor, who really praise Hannukah
The power that I am will make you blow your yarmulke
To all ya, don't let me scream up, to call ya
My Flatbush dushies, or the kids down in Somal-ia
While we're up here tryin to wiggle to ""Boombastic""
You get, hemmed up and cut down in +Park Jurassic+
You're crazed, from that beer juice
Acute angles become, obtuse
Four white kids, was the first rock group - NOT!
Rabble rousing, in with the chime
Laced with the fat rhyme tunneled through my mind
""Your nine spray, my mind spray"" -] Jeru
The mind!
""Your nine spray, my mind spray"" -] Jeru
The mind!
""Your nine spray, my mind spray"" -] Jeru
The MIND!
""Your nine spray, my mind spray"" -] Jeru
Ha ha
Now from the minds of Minolta, from the nickel-plate poster
From the average jack wack crackheads with Oprah
As with safe sex with rubbers, as with rappers turnin mothers
As for 2Pac's on the covers, as for Million March brothers
In ninety-six, while we pinpoint the ""Crooklyn"" spike joint
Three kings of the break of dawn become vocal pawns
The circumfrence of the Bedouins, or is it the thespians
For the past three years, I've been eatin more than lesbians
Lyricists, get fists, twists, careers become tears
Easy gold records, but with no, publishing shares
When I BELLOW, over a hardcore track with a cello
Lyrical structure, basting from a fellow, hello
Street nucks can't knuckle, Billboard chart bullets be chuckle
A&R stars become bouregoises, but subtle
Why is it the master can't behave with the slave chime
Or is it over the domes of weak minds?
The mind
""Your nine spray, my mind spray"" -] Jeru
The mind!
""Your nine spray, my mind spray"" -] Jeru
The MIND!
""Your nine spray, my mind spray"" -] Jeru
MY MIND!!
""Your nine spray, my mind spray"" -] Jeru
The mind!
My mind!!
The mind..
MY MIND!!! Ha ha! Ahhh, AHHH! AHHHHH!",https://genius.com/Chubb-rock-the-mind-lyrics
