title,album,year,lyrics,urls
New Wave,Electric Circus,2002.0,"You! Yeah
The war is on, who you fighting for?

It's like funk to rhythm and punk to rock
Loud like shot that come from a Glock
Pick up your mind, run from the spot
Revolution jumping in the parking lot
Shit is so hot, that the sun watch
Children by the window with the gun cocked
They cooking the raw to start to lump knots
Monkeys dance around for MTV spots
I lock into a- (
scratches
)
Rock into a rhythm of street and ancient wisdom
Experiment in stereo loud
 so crank the system
For the humble on the path, I paint a vision
How far will a nigga go just for attention
And to be remembered? You forgot the mission
Listen!
[Hook: Laetitia Sadier & 
Common
]
All traces of life, in our guts we carry
That's used to dress humanity (
it's a new wave, come on!
)
All things I yearn for, you need per sanity
That reflex loves reality (
it's the new wave, dig it!
)
Clean up the choirs, tell me they shouldn't be
The times are reaching to the end (
it's a new wave, come on!
)
This life is precious, it's goddamn marvelous
Before it likely ever ends (
come on, come on!
)

I lay terror in this era like Che Guevera
For the people to make or wait is better
In a room called real, I stay forever
Everyday I lose something, I gain forever
Meditate on how I can change the weather
My brainstorm for some is like planes, umbrella
Where bullets and lies both spray together
My mind scream like Al Green ""Let's Stay Together""
How could a nigga be so scared of change?
That's what you hustle for, for the currency exchange
Y'all rich, we could beef curry in the game
Out your mouth, ain't nobody hurrying my name
You seen what happened when the Com go bang
Wouldn't have a shot, even at a gun range
Seen hype become fame against the grain become main
Stream, it all seems mundane in the scope of thangs
[Hook: Laetitia Sadier & 
Common
]
All traces of life, in our guts we carry
That's used to dress humanity (
it's a new wave, come on!
)
All things I yearn for, you need per sanity
That reflex loves reality (
it's the new wave, dig it!
)
Clean up the choirs, tell me they shouldn't be
The times are reaching to the end (
it's a new wave, come on!
)
This life is precious, it's goddamn marvelous
Before it likely ever ends (
come on, come on!
)

From a land of shit talk, porn stars and pitchforks
Didn't really see white until I went North
Getting bent off in backyards
Wishing in the air for a black god
Where the people fix cars and clap hard
And look to the stars for rap jobs
I walk through the black fog with reflectors on my boots
Smelling war near, I'm connected with the troops
That master anger, it ain't afraid to shoot
Through poured liquor, fallen angels they salute
(Whew! Whew!) Feel the wind blow
A new wave, people with they hair trimmed low
It's two ways living in this world of techno
This new age can't really save the ghetto
I pause for the rebels, who rock heavy metals
And tell them that they pharaoh so let go
Come on!
[Hook: Laetitia Sadier & 
Common
]
All traces of life, in our guts we carry
That's used to dress humanity (
it's a new wave, come on!
)
All things I yearn for, you need per sanity
That reflex loves reality (
it's the new wave, dig it!
)
Clean up the choirs, tell me they shouldn't be
The times are reaching to the end (
it's a new wave, come on!
)
This life is precious, it's goddamn marvelous
Before it likely ever ends (
it's the new wave, come on!
)

Come on!
Come on!
Come on!
Come on!",https://genius.com/Common-new-wave-lyrics
God Is Freedom,Def Poetry Jam,UnKnown,"I feel rugged, I am rugged, damn rugged
I walk on the carpet of the universe
Keep on
And speak on shit most are scared or unprepared
But I fled for my people
So keep on
Beyond space I look for a place to put hurt
I gotta work
Keep on
Dreams of Black roads, of Black souls that act holistic
It's realistic
Keep on
Pharoah of the sun looking down the barrel of a gun
Y’all know where I’m from
Keep on
Niggas at the crib saying Rash look weird
From myself I never hid
Keep on
Niggas at the crib say for them I never did
30 year old kids, shit boy
Keep on
Any means necessarian, vegetarian
I be missin' chicken
Keep on
Request for another Resurrection
The way I rhyme before progression
This ain’t ’94
Keep on
Chat room geeks critique my B-Boy physique
Who the fuck made you Hip Hop police?
Keep on
Journalist who never had their turn at this
If it's fresh, who are you to determine this, groupie?
Keep on
You here to show truth or expose your cooch?
You know I know reek from the roots
Girl, keep on
Disease man made to reproduce, we afraid
A cure, magic got AIDS
Keep on
Supporting two homes paying back school loans
Like the NBA I’m in a new zone
Keep on
Got married and you carry the weight it take to not get your freak on
Keep on
Fuck shrooms and ecstasy
I’m consumed with a recipe
To get my blood to the highest destiny
Keep on
The blackest of rappers, I ain’t doing no namin'
Go to Europe and start O’Jayin'
Keep on
Whether chopping the raw or studying for the bar
We all children of Allah
Keep on
Flyer say Free Mumia on my freezer
I’m holding still mixing Echinacea and Golden Seal
Keep on
Is it just an illusion?
It’s many levels to it
It’s rebel music
So keep on",https://genius.com/Common-god-is-freedom-lyrics
Freestyle Acapella w/ Hot 93.7 Morning Crew,UnKnown,UnKnown,"It's Com Sense, y'all
 -- you know I'm rhyming in heaven
Come to rock it at Hot 93 point 7
You know how it goes, the way I spark words
In Connecticut, yo, I'm in Hartford
Down the street, y'all, understand I'm colder than winter
I could go after this, then go to Sportscenter
Go to the campus
, Com Sense'll be on the canvas to paint it
They say ain't it
That boy from Chicago, you could follow
Me on Twitter -- yo, your babysitter
Better get a new one, cause I be the through one
Coming through some different type of things
I got many dreams
The Dreamer and Believer
Get you open like a wide receiver
I'm a high achiever
I know they came down, I came to jam
They said I should have came to the Jingle Jam
I am that brother that went to FAMU
Never getting stuck, chilling with Nance and Buck
And this is how it goes, yo, I always kick flows
Next year I'm coming to the Jingle Jam shows
Or maybe we could do it in the spring or the summer
When it comes to this, I came from the ground under
And now it's going on, we keep going on
I came to Hartford so I could film Pawn
Pawn, yo, Com Sense
I got wits for acres like Forest Whitaker
The money maker, rhyme shaker
Let you know I got the odor
Funky like that, 
I did a film with Ray Liotta
And I could keep turning it over and over and over with flows
They seen me earlier at Mo's
Getting a little breakfast
Yo, you could check this
That girl said, I got things that's on your checklist
And yeah, it's all good when I come down
Went to the mall, I didn't stall and
Never will I fall so
I will ball like the brothers do in Paris
When it come to this, 
Com Sense got will just like a Ferris
Yo, I keep going hard and hard
When it come to this, emcees, they getting scarred
I get right here on this old-school beat
They keep asking me who I'm talking 'bout in ""Sweet""
Is it that guy or this guy?
 This is just, just shy
When it come to this, Com Sense, I guess I get high
High off the style like Wiz Khalifa
Look for the album, The Dreamer and Believer",https://genius.com/Common-freestyle-acapella-w-hot-937-morning-crew-lyrics
Like They Used to Say,Beats for Insomniacs,UnKnown,"""Like they used to say"" *repeated in background*

We dealin wit some very critical and crucial times
Some of the most critical and crucial times I've ever seen
I was on Stoney Island with my guy
He was tryin to tell me about the S-I-E experience
Tried to tell him about the C-S-E experience, you know?
Yo I'm the rap profession, I go the session
Study MC's like a god do lessons
Mic testin in the rain, I brainstorm
You feelin me out nigga? We got the same form
I drop heavy in spots you scared to put your weight
There's only so much ice you can skate on
Shit cats write for you, you say wrong
No time to debate on, who's your pop and who's not
Or who shot Big and 2Pac
Or who this stud fuckin or how much this crew got
That's ho shit
That ain't me or the type of niggas I roll wit
I Cold Get Dumb, like a brother in prison
Who hasn't had a chance to hold his son
Sacrificin like Abe did his oldest son
Tryin to hold my come, I think of raps
Seen the BDP cover and I start thinkin back to
* ""Silly Hoes"" sample* say what? ""Like they used to say""
""Kool G Rap and Polo, back again""
 
Yeah ""Like they used to say""
* ""Ain't No Half-Steppin"" sample* yeah ""Like they used to say""
(Dig it, like they used to say) *Biz Markie sample* ""Like they used to say""

I walk through triple darkness wit a childproof lighter
All your homeboys are biters, so what's up wit that?
Your producer pumped the track
Told him, ""Naw, I can't fuck wit that""
Nice way of sayin ""Big, bring a rougher track""
My boy in my ear said ""Enough of that humble rap""
Now every single you drop I'mma double that
Jigga-jigga Joe cut the record down to
My sound surround you like racism, you feel it all around you
I go into a soundproof booth and change flows
Track the strange hoes wit headwraps and Bangles
Hip-hop is gettin strangled by this Puff Combs syndrome
Niggas Been Around The World actin like they never been home
I ain't hatin cuz I can only love niggas
It's just outta the game, I wanna sub niggas
I be dub figure rusty to adjust the in-dustry
And speak up, like when my homey's musty
Here we go yeah * ""Roxanne Roxanne"" sample* yeah, dig it
""Like they used to say""
""You don't want it""  ""Like they used to say""
""F-R-E-S-H""  ""Like they used to say""
""My Adidas, walk through concrete doors and broke"" 
""Like they used to say""

Yo *repeating ""zen zen zen zen"" for about 20 sec.*
""Like they used to say"" 3x
Yo yo check it
Appreciate the art that came through Puerto Ricans and Blacks
Speakin the facts, the sound is much deeper than wax
Dug Inf, the Lumberjack
 I'm keepin the axe
Layin on passed out nights wakin up reekin wit raps
Geek like the Fat Boys ?produce the feeb? in fat
In shows I get more 
hoes/holes than a seam in the matt
Raps develop like film (so what?) so call me Instant Common
This business of pimps and hoes, I stick out like Bishop Juan
Talk to my nigga Ron about openin shops
Holdin up cops, I'm from the 'Go, it don't stop
Contract ain't show enough options, it's time to pop guns
It's gon' be some Shook, Lost and popped Ones
Askin How Come like Wyclef, they'll be Gone before November (yeah)
Name'll be in sentences wit the word ""remember""
Wrote a letter to '88, let's get back, love me tender
The letter came back three days later, return to sender
Damn!
""Like they used to say""
""Hot damn ho here we go again""  ""Like they used to say""
""I want it like that, I got it like that, I have it like that"" 
""Like they used to say""
""You gots to chill""  ""Like they used to say""
""Boyz in the hood are always hard""  ""Like they used to say""
""One for all and all""  ""Like they used to say""
""Zoom zoom zoom, zoom zoom zoom zoo zoom"" 
""Like they used to say""
""I get money, money I got""  ""Like they used to say""
""Plug one, plug two""  ""Like they used to say""
""For all the pioneers, I'm goin way back""  ""Like they used to say""
""I think that's about as far back as we can go"" 
""Like they used to say"" 3x
""Yo what happened to the beats"" 
""Like they used to say""
PEACE!!! ""Like they used to say"" ""Like they used to say""",https://genius.com/Common-like-they-used-to-say-lyrics
LUV (Excerpt),UnKnown,UnKnown,"Woody:
 I'm really tired, I'm going home
Vincent: 
We ain't got no home man......
Your grandmother can't take care of you......I'm all you got.
Woody: well if you're all I got, then why you hit me...and put me thru all this today?
Vincent: 
Cause I ain't got nobody either...people I thought I trusted...I can't trust...I don't know what they were doing ...man I'm just telling you I don't know.
Woody: and why did you say that about my mother
Vincent: I love your mother...I love you too man...Wood I love you Bruh...Im gonna take care of you...
I just need this money...I need it...I need this money...(softly) I need it.
 I promise I'll take you to North Carolina...
Woody: Tonight...
Vincent: Tonight.",https://genius.com/Common-luv-excerpt-annotated
Introspective,One Day It’ll All Make Sense,1997.0,"I like to welcome everybody to the LP, 
One Day It'll All Make Sense
, by me. What I want to do to you... nah, really it's for you, is open my mental window, hoping that you would climb in, or if not, at least look in. I want to take you to places that I have been and to the places that I want to go. I mean this music, it ain't all that I got, but it does mean a lot to me, I injected my whole being into it, and I've been doing it for a while, it's like my whole life has become a style. I want to get into it... yeah",https://genius.com/Common-introspective-lyrics
Blows to the Temple,Can I Borrow a Dollar?,1992.0,"Check it
We can go, toe to toe, with the blows to the temple (NOT)
Not the Temple of Doom, so make room
For the Unamerican Caravan (who you down with?)
The B-Boys, Immenslope, Twilite Tone, Derrick and then some
I don't get rid of some faces
While marks be lookin hard, and they be beggin bases
They have too many cases, 
and now they got courage
Sorta like Goldilocks, tryin to take Pop's porridge
But I got, the story straight
Plus the name, I got rep, don't dare sleep
Slept and got, crept
An AC/DC spider went up the wall we mount
Now came down the Common the Common Sense, and now the spider out
(BOOM) A blackout, power failure
I ain't the Burger King, but I got a whale of blows
Uppercuts jabs hits and hey niggas
Cause I'm weird they call me Lemonhead, but I'm a Jawbreaker
And I break a Bean, but I'm not from Boston
I'm stronger, and faster, than Steve Austin
Common'll keep the camera movin -- I'm kinda fast!
I'm from a town called FRESH OFF A NIGGAZ ASS
And I'm about to go on like Stephanie Mills
YOU MUST be poppin pills, tryin to step to me
Cause to the left of me, WE got the U-A-C (whattup)
And comin up to the right of me, WE got the U-A-C (come on)
And in back of me, yo WE got the U-A-C
And in front of me (BAW!) is a dead man G!
We hit em hard!
..
Kick it
A duck tried to buck, but the vic got vicked
So I picked him, he's another victim of a circumstance
He did a dance like Ali (SAY WHAT?)
But he floated like a waterfly and stung like a C
Ya see, I ain't out here, tryin to be a bully
Nor am I pretendin to be a two-shoes goodie
(WORD IS BOND) that I got big balls homes
And if a player try to press me, I gotta break the zone
Here to stage a, OOH SHIT, up in the sky
You better watch out, I'm tellin you why
Common Sense is breaking, marks down, ah-follow-me-now
Yo Common Sense is breaking, marks down
Uhh, check it, check it, check it
I huff and I puff and I blow (WHAT?)
The motherfuckin house down, I guess you didn't know!
Homeskillet, WHERE YA BEEN? Are you the boy in the plastic bubble?
Ooh you in trouble!
A tisket a tasket, you're gonna get your ass kicked
You better know what's in my jacket, fuck the basket
Oh, God damn CHILD, I mean it's drastic
You end up on a stretched cause I stretch you like Plastikman
Fuck with me (""you end up the in the cas-ket"")
You flow ass pussy nigga, sucker duck bastard
(Yo Common calm down, you gots to calm down!)
This Grape tried to step to me, with his arms down
Lesson number one - when you're ready to throw
Never step up talkin - that's like tryin to pitch, but you're balkin
And I'mma steal first, not the base, but your face
You can call me Pencil Petey cause the marks I ERASE
In case of emergency, it's urgent see, that you see a doctor
You tried to 
Gamble, but I'm the Proctor
I knock that ass, bringin it down and then slash
Tried to play me with a skit, but now you got a gash
You character, for ya inherit a, neck brace
Makin ya thousand deaths times worser than a Screwface
But they call me Screwneck and I do wreck shit
So next time he push up in the jam, BOY YOU BETTER EXIT
Late Show in the house
U-A-C in the house
7-D in the house
R-T-A in the house
True B-Boys in the house
Dem Dere Dyslexics in the house
And we gonna fuckin blow the house down
Check it, hit em with a
Blood clot boy, you get bucked, tryin to fuck with the
Mario, Super Super Brothers like Mario
Here the Common, sucker clucks (what we do?)
Mission upon the loves, gettin kisses, and hugs
But then we runnin to a scrub that tried to bug
He's out to get some what they call em stunts because we bunt
(WHAT?) But I don't bug, I just slide her, and hit her
Some be rumpy chump, with the chat chat chitter
Yo we did her but I betcha know I'm better on it
Now you got a 100 percent beef, it's just a beatdown
(UH UH AHH!) Too late to try to be down
Brother your best bet, is to cover your eyes, like Dee Brown
(Cause it's a bum bum bum, bum-rush)
And if I ask who popped shit, the Caravan gotta bus
Sing it (""on that defense"")
But our bumrush is well done, not medium rare
It's rare to see, an enemy within play
True indeed a lot of shit, is over he say she say
Me say, Warriors come out and play
And I'mma tear shit up and leave it like the day, after
And after we go around, and you hit the ground
Then you know I'm down with the Blows to the Temple
* shout outs *",https://genius.com/Common-blows-to-the-temple-lyrics
The Light ’08 (It’s Love),UnKnown,UnKnown,"Shout outs to J Dilla
Just Blaze...
It's love...Common...

I never knew a love, love, a love like this
It's sorta like the love that's played in tennis
Limitless, when intimate friends express it
I talked to the Most, and I know he blessed it
The cadence of destiny, patience, and ecstasy
We can be fresh on the cover of Ebony
But this is somethin' special we ain't tryna exploit
With a couple actresses, now I'm in the tabloids
Like bad boys, real love moves in silence
About out bih'ness, family bih'ness stay private
Don't sweat the small stuff, girl, cause we both giants
I looked into your eye's and I see divine vibrance
The way that Prince, Minnie Rip' and Joni Mitch' described it
A beautiful package, what's even better is inside it
Alive with the feelings that I'm feelin' with you
Forever became real, but even realer with you - it's love

It's love, it's love every time I think about your smile
Anytime I need you by my side, you were there for me
'Cause you are the light that shines
And I want the world to see that you are the light
That shines, you are my life
Love...

It's important we communicate
And watch this relationship illuminate the world
Black pearl in you is a lover and friend
Picture how your name will sound with the last name Lynn
Put a prayer in the air, that it never'll end
And if so, when we come back, it'll be better again
I will be by your side through the smile & laughs
The child we have, even when the clouds is bad
I know your heart had been broken by a love that pass
And when you're not lookin', that's when love can grab
Sometimes you gotta ask, ""Are we movin' too fast?""
Ain't no limit to a love, that's given from above
Mean fish, collard greens, corn bread, you be rockin' it
Similar values, though in many ways we opposite
Attracted to your 'uh', and the way that you be poppin' it
Brighten my life reminded me to stay positive - it's love

It's love, it's love every time I think about your smile
Anytime I need you by my side, you were there for me
'Cause you are the light that shines
And I want the world to see that you are the light
That shines, you are my life
Love...

It's kinda fresh you listen to more than hip-hop
Pop, rock, and Green Day, respectin' what the King say
For me to give a ring, hey, only a queen may
Invites to loved ones, imagine a dream day
Walkin' down the aisles sayin' vows, us eternal
Til thus do us, for now, we stay fertile
Chicka-uh, chicka-uh, chicka-chicka-ta uh
Let's keep creatin', baby, what we makin' is love

Love is like a melody
Looked into her eyes and see
A night that shines as bright as day
All my troubles drift away
The light, the light, the light
(Looked into her eyes and see)
The light, the light, the li-hi-hi-light

It's love, it's love every time I think about your smile
Anytime I need you by my side, you were there for me
Cause you are the light, that shines
And I want the world to see, that you are the light
That shines, you are my life
Love...

""Once again, it's the light!""

You have somebody...don't be embarrassed, don't be afraid
Put 'em close, let em know...
You might not get another chance, trust!
(There is a light, that shines...oh who-whoa...)",https://genius.com/Common-the-light-08-its-love-lyrics
