title,album,year,lyrics,urls
Raw (How You Like It),The Dreamer/The Believer,2011.0,"Bow! Bow! 
I came through the door
With the raw Martin Margiela
Superstar status, everything stellar
With some bad bitches and some ex-drugs sellers
Niggas already jealous
We in this joint like Bob Marley and The Wailers
She already wanna pick, bitch don't be so over zealous
Go to the bar to get around like a propeller
The barmaid's name is Stella
I'm so appalled like McCartney that you would card me
Am I really mad? Hardly, I'm here to party
Wanting y'all to give me body like Lati-fah
Niggas in the corner smoking that ree-fah
Seen a girl she had bottom like a spea-kah
Wanna put some hands on her like a prea-cha
Hmmmm!
 Well let me take my time
She ordered Bacardi, getting twisted in the limelight
Seen that ass cause I got hindsight
She was lit shining bright in a fit that was tight
'Bout to get that invite to a night over Egypt
She said ""You rap?"" Yea mummy
I'm Tutankhamun kicking and spending this rap money

Feels so good
I wanna touch somebody
So let's go, go
Wanna feel you close, keep touching
Feels so good
I wanna touch somebody
So let's go, go
Wanna feel you close, keep touching

La la la la la, how you like it
La la la la la, how you like it
La la la la la, how you like it
La la la la la, how you like it

She was all couture, in a Tom Ford
Security guard let me in 
cause I'm lord
Of finesse, the under,
 
the rings,
 the dress
Code is to always stay fresh
Aware of a chest cause I stay abreast
She was extra cold, I'm here to de-congest
This nigga next to us was slopped and made a mess
Knocking over bar stools, I hoped that he carpooled
I'm locked into my mood, 
long as dude don't disturb my groove
I won't have to take it back to high school
Rewind! 
No need to take me back in time
Keep my mind on the grind and the great feline
Cause what's in front of me is this behind
Up north, she's thick; down south she's fine
Tuned in to what I'm doing
I'm so unassuming when I'm pursuing
The ladies, the ladies, 
a soldier of love like Sade
Showing love to this lady when this nigga tried to play me
Saw me talking to slim and started acting shady
Dude got foul like crack in the 80s
Uh, uh, uh, uh! You don't wanna test this yo
You never know who got a Tec up in the disco
""You Hollywood."" Nah nigga, I'm Chicago
So I cracked his head with a motherfucking bottle

Feels so good
I wanna touch somebody
So let's go, go
Wanna feel you close, keep touching
Feels so good
I wanna touch somebody
So let's go, go
Wanna feel you close, keep touching

La la la la la, how you like it
La la la la la, how you like it
La la la la la, how you like it
La la la la la, how you like it",https://genius.com/Common-raw-how-you-like-it-lyrics
Nag Champa (Afrodisiac for the World),Like Water for Chocolate,2000.0,"Excite-ting, enlight-ning, invite-ing
I'm writing shit that I feel
Raps are black steel in the hour of commotion
The motion of Com is like that of a ocean
Devotion 'cause I'm the Earth, Wind, and Fire of hip-hop
By Rakim and Short, I've been inspired
My shit knocks environ...ments of cats with seventeen's
Tint, time is money, the mind is funny, how it's spent on getting it
I'm sitting with descendants of Abraham
Who say the jam is ""money, cash, hoes""
I went from bashful to asshole to international,
 lover of self
Word to the mother on my last record cover, it's felt
Now deal with it

I wanna get into it
Let’s do this
I wanna see you move it
So move it
So let’s just get into it
Let’s do this
Can you feel the music?
The music oh ah, can you feel the music, the music

In this never-ending battle to please
Niggas, magazine writers, emcees
Who request hot shit, I freeze
And tell them where I was rose, we always said cold
Hold your horses and your carriages
This never-went-gold nigga rocks shows carat-less
You not gon' respect self, at least respect the heritage
Affecting lives is where the wealth and the merit is
I realize what I portray day to day, I gotta carry this
And beats, rhymes and life is where the marriage is
Had dreams of fucking R&B broads, it came true
Journalist I wreck, shared the same view
Picked up a fallen angel on the path that I emcee
Familiar voice, come to find out the angel was me
Some say ""You changing, Rashid""
Times are, we still close
I rhyme far, away away away
From what you accustomed to hearing everyday, uh-ah
You know the dope-choppin, gun-poppin, homies dying
I'm amongst it, save the war stories for Private Ryan, INI

I wanna get into it
Let’s do this
I wanna see you move it
So move it
So let’s just get into it
Let’s do this
Can you feel the music?
The music oh ah, can you feel the music, the music

Women cry, children laugh, men dance
I refuse to lose self and try to win fans
Over
, weight on my shoulder fluctuates like Oprah's
My refrigerator poetry's magnetic like ultra
You couldn't hang if you was a poster
Posing like a bitch for exposure
It's rumors of gay emcees, just don't come around me with it
You still rockin hickies, don't let me find out he did it
Got my eyes on the tiger, eyes on the prize
Eyes on the thighs, of Mary J. Blige
Imagining how good the cat must be
Stop eatin meat, lost weight, but I still rap husky
My verse depth, is that of a baby's first step
Or the old lady who died and the nurse wept
I flow like cursive writing
, inviting you and yours to my openess
Shows allow me to cop range like a vocalist
But man does not live on bread alone
What good is a range when it's time to head home?

I wanna get into it
Let’s do this
I wanna see you move it
So move it
So let’s just get into it
Let’s do this
Can you feel the music?
The music oh ah, can you feel the music, the music
I wanna get into it
Let’s do this
I wanna see you move it
So move it
So let’s just get into it
Let’s do this
Can you feel the music?
The music oh ah, can you feel the music, the music

We be that, we be that
Afrodisiac, 'disiac
We be that, we be that
Afrodisiac, 'disiac
We be that, we be that
Afrodisiac, 'disiac
We be that, we be that
Afrodisiac, 'disiac
We be that, we be that
Afrodisiac, 'disiac
We be that, we be that
Afrodisiac, 'disiac",https://genius.com/Common-nag-champa-afrodisiac-for-the-world-lyrics
The Neighborhood,Nobody’s Smiling,2014.0,"Thousand lives ago, we were young and we didn't know
We were trading our crowns for our souls
Made the sacrifice, headed back to the light
But be careful don't drown in the gold
I know it glows but it's cold

I'm from the other side of town, out of bounds
To anybody who don't live around
I never learned to share or how to care
I never had no teachings about being fair

Have you ever heard of Black Stone around Black Stones?
And Four CHs, Vice Lords, Stony Island on Aces
The concrete matrix, street organizations
They gave violations, hood public relations
It was the basics to get big faces
Stay away from cases, bad broads, good graces
The hustlers was the taste makers and trend setters
They the ones that fed us hopin' that the feds don't get us
The era of Reagan,
 
the terror of Bush
Crack babies, momma's a push, we were the products of Bush
I'm wishin' for a Samurai Suzuki and a little Gucci
A bad ho to bee-bee-bee do me, you heard of Flukey
Stokes, it was folks and coke and dope
Fiends choked off of smoke, herringbones and rope
Rare jewels of a generation
Diamonds, blinding us of real shit we facin'
Forties wasted on 'ceased
, 
Dion makin' the beats
When they air it out on at the parties we escapin' the heat
I could break it down like whatever you need
He squinted his face and rolled the weed

You know they don't see sometimes that in the neighborhood, it's the exact same thing. It's the same thing over and over again. Feel me?

Have you ever heard of no limit, three hundred, six hundred?
Folly boy, O block, eastside
Where it ain't no conversation they just let them heats ride
Can't nobody stop the violence, why my city keep lyin'?
Niggas throw up peace signs but everybody keep dying
Used to post up on that strip, I look like a street sign
I've been out there three days and I got shot at three times
Felt like every bullet hit me when they flew out each nine
I be happy when I wake up and I have a free mind
I know haters wanna clap me up, watch the morgue grab me up
But they can catch me later, I been cool, chasin' paper
Where I come from ain't no hope if you was claimin' that was major
Small crib, big fam, mom was workin', granny raised us
No food in the refrigerator, I was bangin', pullin' capers, that's real shit
Same niggas from day one boy, yeah I'm still with
Better watch out for that jump shot cause they will hit
Homie take your shorty lunchbox, and won't feel shit
I came from a place where it's basic but you won't make it
Feds buildin' cases, judges who racist and full of hatred I mean
You ain't never seen the shit that I seen

Coming inbound, forty six minutes from 355. Jim Bryant's twenty eight out, thirty two in. Lake Shore Drive's heavy south. North Avenue to Chicago, jammed north through Grant Park. Tri State heavy south gulf to the Bensenville Bridge and St. Charles to the Stevenson Ramp. 
Get traffic and weather together on the 8's every ten minutes on News Radio, 780 and 105.9 F.M",https://genius.com/Common-the-neighborhood-lyrics
1999,Soundbombing II,1999.0,"""Still getting mine, in the 1 9 9 9""

Yo, just relax, take it easy, slow down
I had this—I had this friend of mine
Who, just, you know, he was moving too fast, you know what I'm sayin'?
I told him to slow down, he said the sun don't chill
I said, I said still, I said still, you gotta
Just appreciate life, sit back, don't let it fly right past you
No matter what go on I'm still gettin' mine
No matter the year, no matter the place, no matter the time

Check it
It's like I'm fighting for freedom, writing for freedom
These record company niggas I don't like when I see 'em
My ancestors, when I'm writing I see 'em and talk with 'em
Hoping in the promise land I can walk with 'em
Shitted on so many rappers it's like I'm in the stall with 'em
Molest concepts
, 
stalk rhythms
, 
paid dues, bought wisdom
As legends fall my godmother answer heaven's call
Preachers' daughters get fucked in the reverand's hall
MCs reckless eyeball, why y'all wanna go and do that?
Must've thought I was solo, the name just ain't the 
U-Ac
No mo', still together
Like in the ghetto 
photo with one nigga in the chair
Holding liquor in despair, gang signs in the air
I shine in spaces where time is just a glare
Hold the mic like a memory
Niggas say I'm nice with metaphors but these are similes
Street ministry
, 
my poetry's a penitentiary, track is visitation
Sentences is life,
 
I'm like chief up in this demonstration
Still...


You squirm with discomfort, wiggle and cough
Six days of madness and you might throw me off
On this great ball of stress that they call the earth
I'mma show y'all in rhyme just how much shit I been through
And all the places I went to, always played the low
It's like a competition, this mission here I'm telling you
Slip up and rhyme-ass niggas here is felling you
Crash courses, slow down you can't learn that quick
Cause I'm the dead eye, 
with the red eye
, from Chi to L-I
I thought y'all knew, every year I grew, I'm still growing
And in a year or two I hope my girl'll be showing
A male seed,
 
praise God I name him Moses
I lead people I want him to, that's why I chose this
Now is the glass half-full or half-empty
Common, why they tempt me
The 
king of the simply, bore in mic
I always stay on top cause I give niggas what they like
I know y'all hate that why I feel I owe y'all everyday
If y'all hear it a thousand times, it's gon' be the same way
The 'Dat-Father, go farther, why bother
Now I'm a peaceful man, I don't want no stress
You know I'm still...


Yo yo, some get Range Rovers, some religion change-over
Angel on my main shoulder telling me remain sober
Token nigga, game's over ain't no payola in freestyle
In battles, I'm warring like a G-Child
Searching for the child in me, this style in me
This release is like the piece that's now in me
They tried to 'sassinate me god, like Martin on the balcony
Lyrically I put a hit on 'em, cause I'm the style ""Nitti""
Catch a flick at the Liquid Kitty
Trying to get a chick to kick it with me 
till the tilt
Told her my chamber's like Wilt
Built with her for a sec, let her know I had respect
Less than a hour she was giving me neck
, yo I'm still getting mine",https://genius.com/Common-1999-lyrics
So Far to Go,Finding Forever,2007.0,"Ohhh, ohhhh
I wanna get closer to you, baby
Ohhhh, ohhhh, ohhhh
Ohhhh, ohhhh, ohhhh

You have come so far
You've got so far to go, yeah
Say it again
You have come so far
You've got so far to go, yeah

Sweetheart, you know that you most
Important, at least on the West Coast (Huh!)
I'm just trippin', it's somethin' about your throat
You think different and understand how I float
Got cribs on both Coasts
But, I'm a Chicago-getter
You get down, but you ain't a golddigger
You got the soul with the figure to match
Your girlfriend said, ""Yo, that dude is a catch!""
Creative with the gifts, plus he hit it from the back! (Ugh!)
And places we ain't supposed to
We make the music - baby, you on the vocals
International lover, I never stay local
Go to places that you never been
Beautiful outside, even better when it's in
You have arrived, girl - you can come again!
C'mon!

You have come so far
You've got so far to go
Say it again!
You have come so far
You've got so far to go
OHHHHHHHHHHH!

You sexy, I know brothers try to spit to you
But, I'm the only one that can get to you
Lifting you, my drive is shifting you
I opened you free, it's like a gift to you
I truly am thickly and thankful
And as long I'm in your town, I'mma stay
+Faithful+ (Heh!)
You know I can't escape you
No matter how far, you're still my star
You was there when the marks tried to steal my car
Snappin' with me, that's just how real you are
Sophisticated woman, you understand a man
You don't call all the time just to see where I am
Put a ""G"" in your hand, make sure you're livin' alright
Makin' love is me and I'mma give it all night
Turn over in the morning, make it warmer and better
Long as we can be, we can come together
C'mon!

You have come so far
You've got so far to go
I don't believe you heard me, baby!
You have come so far
You've got so far to go

Go on, go on then!
Go on - go on, girl!
Go on, go on - go on, baby!
Go on, baby!
Go on, girl!
Ahhhhhhhhhh!

You have come so far
You've got so far to go
You know what I mean, baby!
You have come so far
You've got so far to go
You have come so far
You've got so far to go
You have come so far
You've got so far to go",https://genius.com/Common-so-far-to-go-lyrics
Making a Name for Ourselves,One Day It’ll All Make Sense,1997,"Yeah, yeah, me and my man Common Sense
Rallying troops like Joseph Stalin
Where you at, yo?

I'm about to make the name Common Sense a name you fear
Y'all niggas is scared, I'm your worst nightmare squared
And I'm a make the name Canibus a name you fear
Y'all niggas is scared, I'm your worst nightmare squared
That's double for niggas who ain't mathematically aware
""Catch another sucker duck MC out there""

I can tell by how you write, you the type to run in a fight
I hold mics while you hold spite
Like a broken-hearted bitch, don't give no fuck who your team or who you started with
Cameoed or charted with, I house niggas like apartments with
Mic mechanisms, I dissect a rhythm
Move crowds with kinetic wisdom
It's like a Malcolm X-orcism, fuck the rhythm, I hit him
I want him got and I get him, auction his wack ass off, then bid him

I'm creating the ultimate verses with perfect lines
Putting together the web of my rhyme one thread at a time
So you niggas need to stop testing me
Because you know you can't ""F"" with me, stepping to me with insuperior weaponry
Exposing yourself to the verbal radiations
Saying you can defeat me is nothing but speculation
Lyrics unravel, faster than bullets travel through barrels
Niggas be digging my styles like fossils of pterodactyls
Who wanna battle? I'm bad to the bone marrow
The Earth got one sun, but I walk with three shadows
With Allah, my supernatural bodyguard
Niggas couldn't touch me if they gave me a massage
MC's will compete with lyrics and beats get crushed
I'll hit you in your chest so hard, your shoulders will touch
What?

""Stepping to me is like going to the county being a neutron""
""I ain't scared of no nigga""

I pursue sound fairs, relaxed like Dru Down's hair
Other nigga's rhymes are like gang signs, I throw down theirs
On knots, I landed, players get played like Hamlet
Supposedly nice, taken for granted like life
I write twice and drop singles in record pools
Niggas I'm dunking like when cops mingle
Fuck hip-hop jingles, rhyming big words and not saying shit
The clique that you came in with accent your flavor with
Like moose, I go to the caves and get niggas off all fours
I'm the shit that's uncalled for, the shit that you fall for
Far more advanced than a rapper whose career
You could only take a glance
Couldn't make the transition from B-boy to C-note stance
I stand in a circumference of humbleness
But in the Chi rumble it's
Mistaken as a weakness, when poetry's in motion
Like a picture, I'm the main feature
Amongst hard working teachers and corrupt preachers
I make my living off of singles like Latifah
In between sheets like reefer with blunted senses
You couldn't make a statement if you was from a sentence
I'm cold with numb intentions

""Fucking with Canibus""
""Fucking with Canibus""
""Fucking with Canibus""
""Fucking with Canibus""
""Yo, sick with it""

Yo, the Canibus is a animal with a mechanical mandible
Coming to damage you, spitting understandable slang at you
I be the all seeing lyrical, hammerhead shark peripheral
With three-hundred sixty degree visual
When the signal was given, MC's get bitten
With venom from a poisonous algorithm liable to kill 'em
My style will get in 'em, way up in 'em
My face don't belong in The Source, it belongs on the Shroud of Turin for certain
I grab mics and murder shit
It's wickeder than Satan worshipers going to Catholic church services
You heard of this, the lyrical verbalist slash herbalist
The wrath of my cold-blooded verses is merciless
Rap snap, get your ass cracked like bear traps
Contaminate your air sacs like tear gas
And I swear black, try to battle me, you won't last
I'll turn your ass into ""The Artist Formerly Known As""
You gay-ass fag, I'll blow you to ashes with tactics
Strip you naked, then make you hug a cactus, you bastard
So fat to be a rap star, taking pictures at music seminars
People know who you are
Now I got mad shorties that wanna call me because they saw me
Up in The Source chilling on page forty
Put this in your CD-ROM
WWW-dot-Canibus-dot-com
You can find me on the internet talking to chicks
That was sweating me off the ""Music Makes Me High"" remix
I be talking mad trash, trying to get 'em to laugh
See, if I click and drag long enough, I'll get the ass
Bring it back to the lab on Mount Prospect Ave
Let your chicken suck me off and send her home in a cab
You know how we do, liquid aluminum like the T2
Beasts from the East part two, coming to see you

It's time I made the name Common Sense a name y'all fear
Y'all niggas is scared, I'm your worst nightmare squared
Now that I made the name Canibus a name you fear
You still scared, I'm your worst nightmare squared
That's double for niggas who ain't mathematically aware
""Catch another sucker duck MC out there""
Since I made the name Common Sense a name y'all fear
Y'all niggas is scared, I'm your worst nightmare squared
And since I made the name Canibus a name you fear
Stay scared, I'm still your worst nightmare squared
That's double for niggas who ain't mathematically aware
""Catch another sucker duck MC out there""
""Catch another sucker duck MC out there""
""Catch another sucker duck MC out there""",https://genius.com/Common-making-a-name-for-ourselves-lyrics
Blak Majik,Nobody’s Smiling,2014.0,"Blak Majik (x 32)

Ooh that boy he radical
Talk that money talk emphatical
Who in the game had the baddest hoes
Niggas seen Badu's ass and said ""I seen what you was on""
Home grown with no home phone
From the city of wind nigga, win or go home
It's the Chi bullshit I'm on
Make a dome from a brick and a pocket full of stones
Hit them cones, clips and crones
I don't play away games, I got hitters at home
I'm a dime like six in the morn'
Me and Muhammad speak in similar tones
Go hard like pyramid stones
Stand the test of time cross the burning sands
With aggressive rhymes, I'm blessed to rhyme
I invest in time
Like Superman, stick out my chest and shine, I'm

Blak Majik (x16)

Yeah yeah, I'm black, I'm magical
I ride fun facts that's actual
Keep it one hunnid that's natural
To get them new blue hunnid niggas strapped with flow
Shout out to black and DC make it capital
I done made enough. I don't have to rap no more
Tell the truth, that ain't what I'm rapping fo'
Got a whole lot so we can have some mo'
So rosey go to red diamond make 'em clap some more
Clap clap, 
home of the original gang bangers,
 gun clappers, no lackers, rack stackers
Movie, we are black actors
Makin' somethin' out of nothin' blak majik
What I do, I own like magic
Status of the livest and established
Girl with the fattest, 
I'm givin' you the gladdest
Night you ever had this
Magic

Neewteb ni tsixe I ereh ton ma I
Maerd ruoy ni evah uoy suoicsnoc eht ma I

I am the matter that cannot be seen
I am the conscious you have in your dream
Do not be scared of my dark energy
I am not here I exist in between
Yeah that's me I'm magical
I'm black I'm strapped with magic bro
I'm nothing you have had before
I'm everything but nothing more",https://genius.com/Common-blak-majik-lyrics
Let It Lie,Smallfoot (Original Motion Picture Soundtrack) [Deluxe Edition],UnKnown,"Um, where are you takin' me?

Aha, so many questions. I think it's about time I give you some answers

Wow. What is this?

You see, Migo
There was a time when Yetis lived beneath the clouds
We were alive and we were thriving till we came across a crowd
Of 
Smallfoot
, 
that's right, we used to live down there
But there were actions we could not forgive down there
And though they used a different nomenclature
Man, or human, they showed us human nature
A dangerous species that we approached with wonder
They attacked with their spears and their 
smokin' sticks of thunder
They called us Sasquatch, they called us abominable
They chased 
us
, pursued us, their persistence indomitable
We had no choice but to run and hide
Otherwise, we surmised we were facin' genocide
So we climbed this mountain just to stay alive
You see, we knew that up here, Smallfoot cannot survive
So it was here the first law was written in stone
It was named and proclaimed as a truth to be known
Our world is an island, it floats on a sea of endless clouds
That's how it would be
And then we wrote more laws, more rules to obey
For the sake of us all, it was the only way
To protect us from all of the human ravages
Heaped upon us by those human savages
(Now you know, now you know, now you know)
(Now you know, now you know) And new rules apply
(Now you know, now you know, now you know)
So it's best just to 
let it lie
 (Let it lie)
(Now you know, now you know, now you know)
(Now you know, now you know) And you can't deny
(Now you know, now you know, now you know)
That it's best just to let it lie (Let it lie)

But my Smallfoot, he's not like that

They're all like that. Tell me, when you found him. Did he greet you with open arms?
They don't care about us. They don't care about anything but themselves. Which is why we must do the same if we care about our future

Wait, we're below the clouds

Or so it would seem, but look closer

Those aren't clouds, it's steam

The stones are working

The stones?

Every job and every task is pointless as it seems
All of it ensures that this important machine
Keeps turning and turning and spinnin' around
So those below don't look up and those above don't look down
And they'll look 'cause even if they hear of these atrocities
The only thing stronger than fear is curiosity
(Now you know, now you know, now you know)

Wait
 so, so none of those stones are true, they're all lies?
(Now you know, now you know, let it lie)

Good lies to protect our world
(Now you know, now you know, now you know)

But they need to know the 
truth

Oh, do they?
You feel emboldened by your noble quest to find the truth
I chalk it up to the naive innocence of youth
So let me share a secret that you'll learn as you grow older
What's true or not true is in the eye of the beholder
So do you wanna prevent our own annihilation? (Yes!)
Then our only goal should be to control the flow of information
Unless you wanna see the Smallfoot conquer and pillage (No!)
Then protect the lie and you protect the village
Lives are at stake, Migo. Your friends, your father, Meechee
She's curious and you know what they say: curiosity killed the yak

So what do you want me to do?

Tell everyone you were lying about the Smallfoot

But they've already seen it, they--they're not gonna believe me

You'll be surprised at what they'll believe
You think knowledge is power, Migo?
(Now you know, now you know, now you know)
(Now you know, now you know)
Question is
(Now you know, now you know, now you know)
What are you gonna do with that power?
(Hmm)",https://genius.com/Common-let-it-lie-lyrics
