title,album,year,lyrics,urls
Flava in Ya Ear,Project: Funk Da World,1994.0,"Yo, Mack, I don't even understand
How they didn't understand you in that Mary joint
(Yeah, I know, man)
Kick that old robotic, futuristic, George Jetson, crazy joint!

Just like Uniblab, robotic kicking flab
My flavor bidder badder chitter-chatter
Madder than the Mad Hatter
I bet you my shit come out phatter
I got the data to turn your body into anti-matter
And just like a piece of Sizzlean
You'll fit inside my stomach with the eggs and grits between
The king is what I mean, I mean
My man get a cup and put some change inside your hand
Now, hold up, let's make this official
Everybody let's agree that MC's need a tissue
The funk's my only issue
I bet your mama miss you
And I bet the Mack take off, like an MX missile
No more of your whinin' on the charts climbin'
As I make the funk kicking out more harder than a diamond
And if you didn't know who's rhymin'
I guess I'm gonna say ""Craig Mack"" with perfect timin'
You won't be around next year
My rap's too severe, kickin' mad flava in ya ear

Here comes the brand new flava in ya ear
Time for new flava in ya ear
I'm kickin' new flava in ya ear
Mack's the brand new flava in ya ear

Craig Mack, one thousand degrees
You'll be on your knees, and you'll be burning, begging please
Brother, freeze! This man's undisputed
In deep-rooted funk smoke that leaves your brains booted
This bad MC with stamina like Bruce Jenner
The winner, tasting MC's for dinner
You're crazy like that glue, to think that you could outdo my one-two that's sick like the flu
Boy, I flip, boy, all the time
‘Cause, boy, the rhyme you kickin' ain't worth a dime
Seems like there's no competition in this rap world expedition
You come around, I'll knock you out position
No flav could ever dig a grave, for the Mack
The power pack in black, making cement crack
And here comes the brand new flava in ya ear
Mack's the brand new flava in ya ear

Here comes the brand new flava in ya ear
Time for new flava in ya ear
I'm kickin' new flava in ya ear
Mack's the brand new flava in ya ear
Here comes the brand new flava in ya ear
Time for new flava in ya ear
I'm kickin' new flava in ya ear
Mack's the brand new flava in ya ear

Ha! The Mack's dope with more hope than your Pope
But for MC's more knots than rope
I'd like to break it down, down-breaking forsaken
Lords of MC's shakin' with this track that my man's makin'
MC's will run like a bomb threat
I bet, or better yet, make you sweat
Getting hotter than the sun get
Craig Mack is the flav that rocks from here to Tibet
I break all rules with my action
That the Mack sends to MC's, stop relaxin'
This brand new Sherrif that's in town
Getting down, leaving bodies buried in the ground
I set up rhymes for a decoy
Now I'm a Bad Boy, watch the MC's I destroy, and…

Here comes the brand new flava in ya ear
Time for new flava in ya ear
I'm kickin' new flava in ya ear
Mack's the brand new flava in ya ear
Here comes the brand new flava in ya ear
Time for new flava in ya ear
I'm kickin' new flava in ya ear
Mack's the brand new flava in ya ear",https://genius.com/Craig-mack-flava-in-ya-ear-lyrics
Get Down,Project: Funk Da World,1994.0,"And bass up the track a little bit
'Cause I wanna hear that ""boompsh, boompsh""
You know I'm sayin'?
Ahhh!

Now who got the flav' that comes a dime a dozen that keeps ‘em buzzin’
Thinking that they fat when they wasn't
Welcome to the world of Mack, or Mackman
Leave you small guys sayin', I eat MC's like Pac-Man
I'm incredible, better eats ya vegetables
'Cause, I does what I do you (Do it!)
I fake the roof off of soft suckers
Super smackin', mackin', full effect mike check one two
I'ma reign, reign forever
Rain like bad weather, reign like whoever, never
You can't bite my style
'Cause my style ain't a style that is a style so I can go buckwild
Bet you figured you got more funk for flow, it ain't so
Flava in Ya Ear letcha know
Now I'm about a second from the hook, dook
Scrap ya rap book, 'fore you get ya wet style shook

Can I get down?
Get on down, can I get down?
Can I get down?
Get on down, can I get down?
Can I get down?
Get on down, can I get down?
Can I get down?
Get on down, can I get down?

The Mack's like a superintendent
Burning MC's leaves a foul scent
See, I'm like what ya call, king of yes ya'll
My style's rick, sick, I mean real sick
Shit's thick, I come with the ammo
The real whammo-slammo stuff that I be droppin'
And I'll wake the great, let's warm up the hot plate
I'm changing fate from the neck I'ma castrate
My rap loves to alienate
Shake ya ass to 'til it stank, you stomp, I dominate
See, I ain't scared of you mothafuckas
To me ya all suckers 'cause I make the ruckus
Don't try to buck us, we roll bulletproof
No cooth, on the roof, 
bitin' like a sabertooth
I pound on the ground when I get down
So let me get down, let me get down

Can I get down?
Get on down, can I get down?
Can I get down?
Get on down, can I get down?
Can I get down?
Get on down, can I get down?
Can I get down?
Get on down, can I get down?

Can leap a tall building, crush the Earth for fun
But I'm sayin' ain't no fair, yo, when MC's run (Ain't no fair, ain't no fair)
The mic's now in the right hands
'Cause the Mack’s on the Earth just to spoil your plans
More pep than the pepper that's in ya pepper shaker
Ruff earthquaker, couldn't take me if ya mama make ya
I back up the funk that I bring with unknown to man slang
With bigger bite than the Devil fang
I ain't met who could hang, if ya testin' in ya lesson
Got me dressin' for ya funeral session
Man, it won't even matter no more
Craig in '94 just won the war
My style was definite to take ya over
Have ya sittin' lookin' over in a four door Chevy Nova (Why I oughta)
I figure its a slaughter
In the world of dollars, ya shit ain't nothing but a quarter
The name of the track is ""Get Down""
So let me get down and pound other MC's in the ground

Can I get down?
Get on down, can I get down?
Can I get down?
Get on down, can I get down?
Can I get down?
Get on down, can I get down?
Can I get down?
Get on down, can I get down?

Get down, boy (Down, down)
Can I get down? (Hah)
Can I get down? (Down, down)
Can I get down?",https://genius.com/Craig-mack-get-down-lyrics
Making Moves with Puff,Project: Funk Da World,1994,"Changed my mind man..

Gotta get the cash, gotta get the dough
Gotta keep my flow
Gotta get the cash, gotta get the dough
Gotta keep my flow
Gotta get the cash, gotta get the dough
Gotta keep my flow
Gotta get the cash, gotta get the dough (Y'know?)
Gotta keep my flow
Gotta get the cash, gotta get the dough
Gotta keep my flow
Gotta get the cash, gotta get the dough
Gotta keep my flow
Gotta get the cash, gotta get the dough
Gotta keep my flow
Gotta get the cash, gotta get the dough
Gotta keep my flow
Gotta get the cash, gotta get the dough
Gotta keep my flow

Peace to Brentwood Town Shipping
I'm smoother than that Lex your whipping
With the rack and pinion
And Pirelli tires that be gripping
Sometimes I wonder if MCs really know
Mack's eternal bought to burn you
While in ten feet, of snow
I grab the mic and turn into Ali Baba
With just a dabber, my rhymes are guaranteed to grab ya
I got funk with the bass and soul
Cause I've been rockin' on the mic since nine years old
And I can groove with that, stupid fat
Rhymers when you're soupin' that
MCs catch a headache
And find where some Nuprins at
I'm on the case like Magnum P.I., F.B.I
Lookin for a man with the reason why
And it'll cost more than Lee Majors
To fix MCs after I kicks my flavor
Puff and Puff and blow the House down
Is what the Mack do whenever I get down
Gettin' down, boy (get down)
One two, Mack man's in full effect

Gotta get the cash, gotta get the dough
Gotta keep my flow
Gotta get the cash, gotta get the dough
Gotta keep my flow
Gotta get the cash, gotta get the dough
Gotta keep my flow

I'm like the greatest rapper, known to man
Got MCs meltin' in mouth and not inside my hand (c'mon)
And you can try to, write a rhyme-a
But the pace that I race'll have you lookin' like a old timer (old timer)
Do you wanna pay a visit, to rhyme exquisite (aheh)
That'll leave you standin' colder than a winter blizzard (AHH)
Mack's engaging, extra blazin'
Who's you phasing?
Power Rangers ain't more amazin' (amazin')
Rhyme flipper, flip-a-rhyme=a-ripper (uh-huh, say what)
Rip-a-rhyme-double-dipper while you talkin' on my zipper
I wanna know who's been naughty or nice
With the device, turnin' grown men into mice (yeah)
I can flip funk back and forth, forth and back
Ride more super rhymes against the track, tell 'em Mack (tell em)
I got Bad Boy as my back (that's right)
As we kick on the funk called MC subtract
Got flow for days, got rhymes to amaze (uh-huh, c'mon)
Got the brand new funk, here's the brand new craze, boy
Mack the dope (one two)
We break all of the funk on down (yeah)
[Chorus: Diddy & 
Craig Mack
]
Gotta get the cash, gotta get the dough (
Mo Bee, make it..
)
Gotta keep my flow (
Bustin out, in the house
)
Gotta get the cash, gotta get the dough
Gotta keep my flow
Gotta get the cash, gotta get the dough
(
One two, as we get busier
)
Gotta keep my flow
Gotta get the cash, gotta get the dough (
We gon' get like this
)
Gotta keep my flow

Come on everybody, let's all get down
Got rhymes by the ton while you weighs a pound (Whoo)
Supercalifragilistic type of hyper MC
That be me, twenty-twenty could not see (Can't see)
I don't feel the pressure, of an MC aggressor
That I got a rhyme for in my top dresser
(in your top dresser) Craig Mack, 
Bad Boy representin
Fat Funkster be gettin', for Fat Funk be hittin' (C'mon)
It's this man's turn to earn
Since my birth, a penny now is MC's worth (C'mon)
And MC's are nuttin' but a joke-a take a toke-a
Smoke fatter than the Ayatollah
Can't nuttin' ever stop the Craig Mack plans
To grab MCs, and crush em in my hands (as we get busier)
Like I said before, here comes the Mack
Power-packed in black, to make you see mad graphics
As we get busier (As we get busier)
In nine-four with the funk that hits on the floor

Gotta get the cash, gotta get the dough
Gotta keep my flow
Gotta get the cash, gotta get the dough
Gotta keep my flow
Gotta get the cash, gotta get the dough
Gotta keep my flow
Gotta get the cash, gotta get the dough
Gotta keep my flow
Gotta get the cash, gotta get the dough
Gotta keep my flow
Gotta get the cash, gotta get the dough
Gotta keep my flow
Gotta get the cash, gotta get the dough
Gotta keep my flow
Gotta get the cash, gotta get the dough (rock on, rock on, rock on)
Gotta keep my flow
Gotta get the cash, gotta get the dough (rock on, rock on, rock on)
Gotta keep my flow",https://genius.com/Craig-mack-making-moves-with-puff-lyrics
When God Comes,Project: Funk Da World,1994.0,"What da fuck's going on inside the biz
Shit ain't raw no more
Fake is how it is
I hear brothers talking 'bout shooting and killing
Then going home and chilling
Frontin' like a villain
Let me tell you something real
Is how the Mack feel
I ain't no criminal and represent no steel
I tell you one thing though
MC's better walk slow the Mack's on the earth
To let you know
I'm on a mission from the kingdom of God
To do away with MC's dat represent nimrod
You MC's have been too bad
So where you go now ice ya gonna wish you had
When MC's disappear it's my fault
It's time to put all the madness to a flying halt
And radio ya need to be ashamed
For pumping murder, murder, murder all up in
Our brain
I'll tell ya now Big Poppa don't like it
Representing truth when the Mack
Starts to mike it
I hope the subject don't turn ya away
But the whole Hip-Hop generation need to pray
Chorus
Whatcha gon do when God comes
You can front now, but when God comes
You can't get strapped for when God comes
Cuz you won't know how to act, when God comes
Now we all established dat Mack's new king
And the king for his people has to represent the
Right thing
Brothers in the ghetto stop genociding
Cause same boat we riding, will do like the 
Poseidon
I watched the earth's cheese line get longer, I watch
Allegiance to Satan's army looking stronger
I watched drugs and guns take control
I even watched how the devil take the Black woman's soul
They ain't got respect no more
When your ass on the camera you ain't nothing but a whore
Ladies you need to help out your man
Instead of frontin' at the club with a drink in your hand
The Black family is now prehistoric
And we don't need psychic healing from Dionne Warwick
We all need to be down on our knees beggin' please
Lord help us shake this disease
And MC's don't take these rhymes for no joke
Craig Mack pen is mightier than the sword
You stroke
So take heed to the words that I send
Cause on Judgement Day everey man must attend
Chorus
All our Black leaders are throwing on they war paint
I ain't seen a saint that might make me faint
How long can we sing that song
Knowing that the shit ya kicking brother is dead wrong
And don't figure Mack new to get started
Cause flip out an old fat verse from get retarded
I'm talking from veteran chair prepare
MC's nightmare only there's no need to fear
Shape up ya Lord about to strike
With thunder claps that turn day into night
With something similar to Gabriel's horn
The first flag up my tribe of Judah's now been warn
Peace to Bad Boy for bring me here
People of the world presenting Mack this year
No need for fronting his time has almost came
And the last rhyme ya hear bears Craig Mack's name
Chorus",https://genius.com/Craig-mack-when-god-comes-lyrics
Jockin My Style,Operation: Get Down,1997.0,"Here comes a rhyme in your ear Craig Mack is here so have no fear
My rhymes push the hack to the rear
I'm severe rap pioneer with funk I steer now it's clear
Rhymes flow to the break of dawn
Exploring MC's I get silly on, like Ponce De Leon
Yet don't foget my style is a banger
MC's I deposit in the closet on a hanger
Mack chop your rhymes like I chop shop chop a Acc
Startin with the bones in your back
Whenever I attack it's like a blow from a axe
Sweet like sugar that be on Sugar Smacks
Facts is Mr. or Mrs
Can't another rapper see me when it's time for gettin biz
And the moral of the story as you will see
Is that from now on the greatest rapper is me
Chorus:
MC's you're jockin my style, you're jockin my style boy
You're jocking my style, MC's stop jockin my style
You know you can't touch the flav
MC's you're jockin my style, you're jockin my style boy
You're jocking my style, MC's stop jockin my style
Craig Mack has the phat funk flav
Now I'm sayin, rock funk to the Himalayan
No more delaying, MC's you decaying, I'm staying
Cause now I'm out my cage
And what I do for rap is gonna make front page
Remember back in the days I was just a tyke
I do a rhyme while I do a wheelie riding bike
But now I'm the man with the mic in my hand
Starving MC's like them kids from Siam
Breaker breaker, it's the funk rhyme shaker
Super duper superb slamming like a Laker
Swimmin on MC's like moray eels with mass appeal
Your rhymes are jokes like Dangerfield's
Boy, I'll tell ya, ain't no liver on this continent
I'm dope and you the opposite, the man when I be dropping shit
Raw, I give MC's a headache
Hit your ass so hard and kill your man by mistake
Youse a fake ladies and real niggas know
Non-stop rockin til it's time to go so bust the flow
I'm a be a round for a while
MC's stop jockin my style
Chorus
Now everybody put your hands in the air
Wave them shits like you just don't care, aiyyo
You could have a dollar or be a millonaire
Sometimes I think that Mack should be mayor
Now me, myself and I, we three bad motherfuckers
Here to eliminate suckers
I came to rock a party are you ready
Get your Aunt Millie's out eat MC's like spaghetti
Rap machete, I'll cut your ass like a sword
Into buying rhymes these rhymes you can't afford
I shine like jewelry, ain't nobody schoolin me
I battle anybody just point to who the fool be
Cause you and me, we ain't the same type of breed
I grab the mic and give the crowd what they need, and proceed
To rock the mic since a child
Get off my tip and stop jocking my style
Chorus",https://genius.com/Craig-mack-jockin-my-style-lyrics
The Wooden Horse,UnKnown,UnKnown,"So any time you're gettin low, 'stead of lettin go
Just remember that ant..
(Kids)

(Opps there goes another rubber tree)
(Opps there goes another rubber tree)
Now I came to rock, I came to move the crowd
I came screamin' out loud
No other choice is this bad new voice
Can't wait to sit in my new Rolls Royce
You soft and moist, sweet like cake
Don't be scared to lie down in the bed you make
And if you fake, I'm like Alexander the Great
A conquerer, stompin ya, for even steppin to the plate
Now you think I'm late but I'm right on time
You had your chance to do it now it's my turn to shine
Keep in mind, you ain't heard my flow in a while
And I still ain't heard nobody that can fuck with my style
Juliet child nigga cook MC's, Criag Mack baby 1000 degrees
Stand back nigga I'mma shake this place
And look just when you thought it was safe?


Now inside the streets Craig Mack's a living Legend
Nucular weapon better watch where you steppin'
Story at 6 and see the film at 11
You can be Kit but I'm like Frank Drebin
Mary Lou Retton, flippin on yall
You can use Motrin, Advil or Tylonol
Just to see me ball make your chick wanna follow
Rock the Meadowlands you got Boo-ed on Apollo
Real hard to swollow wanna know how come?
Cause I'm hot-dog probably buring meat off your tongue
So from now on till thy king-don-com
The sea-son has begun from my style to weigh a ton
Kill you for fun but I ain't playin no games (no games)
And I ain't sayin no names (uh-uh)
But next time you kill somebody make sure they dead
But wait, you can check this in-stead


I see you made it to the bonus round, see my crown?
Pretty, too bad you can't touch it
I'm like Pompeii first time it erupted
Chicks still call acting hungry as a buzzard
You can let your man dump it hug it and love it
Touch it and rub it, Mack nigga, that's why it sounds undiscoverd
Explode like L. Ron Hubbard, on the Dianetics Cover, smother a brother
Been ""Lethal"" for years ask Gibson and Glover
Your man be like ""Help!"", lying in the gutter
Just like that, ""Splash me the Cash""
Shit I'm like Duke Nukem get ready for combat
I now pronounce you man and wife
You may, kiss the coffin it's the end of your life Mr. Mack
And I know how to land this bird
Bet I see you 2000 nigga that's my word

So any time you're gettin low, 'stead of lettin go
Just remember that ant",https://genius.com/Craig-mack-the-wooden-horse-lyrics
Judgement Day,Project: Funk Da World,1994.0,"Hah!
My momma said back when I was born
That you was warned, so now your ass gets torn
(Wake it up Mack)
My style is bonafide
Fortified on my bad side, an MC on a high
Now we about to set this off
Bass and funk rattlin (one two) send MC's up North
I never had to fight with the mic
I make the funk so dynamite
So parasite MC's might wanna bite
Welcome to 1994 (welcome) beats that thump
Rhymes that's bumpin now at your backdoor
Never figured Mack got funk for days (what)
When ""Project: Funk Da World"" brought the brand new craze
(wake it up)
And MC's can't get one line
When the genuine take out deep max on your mind
I'mma hit you with the boom pow
Bolder than Moscow, MC's your judgment's now
Here it comes
MC's.. your judgment is.. now (now MC's)
MC's your judgment day is now (it's time, here it comes)
MC's.. your judgment is.. (hahhh) now
As we get down - MC's your judgment day is now
Here it comes, boyeee
Here comes the one they call King MC
If you're tired of those phony fake rhymes that be (fake)
I'm back with this deeper than Minds of Minolta
Preachin better than preacher up on an altar
(Amen boy)
I feel that I have pardoned, pardoned
No need for bad grammar startin in my MC garden
(chomp chomp)
And I'mma kinda hungry tonight
So I pulls out the ground a fat rhyme to recite
I don't means to boast but the most is me your host
On post, kickin flav til they ghost (ghost)
Craig Mack is here to stay
Rugged as a mountain bike on MC judgment day
(go ahead)
From now until the Earth's gone
In the chess game of rap, MC's ain't nothin but a pawn
(your move)
As the rap romps through your town (through your town)
And MC's around, time to put your panties down (put it down)
MC's.. your judgment is.. now (it's time)
MC's your judgement is now (MC's, check your clock, it's on)
MC's (MC's) your judgment is.. (hahhh) now (Mack the dope)
MC's your judgment day is now (with the flav, gettin down)
It was a rumble tumble, I put the bee inside the bumble
Kickin wicked type of hyper, won't never fumble (ahh)
I float like a tugboat do
Watch the virus, Mack the dope, start affectin you
Is rap real? You can't deal, what's the matter?
The badder the Don Dadda is still gettin fatter
You be lovin how it sound and shit
And have you dance when I battle for the sponsorin
And you can thank Bad Boy for that
A technique for layin MC's on the mat
Scat, scoot, pussy couldn't make a louder hoop
When I pollute, the world with funk to the roof
Mad rhymes we bust, in God we trust
And MC's don't discuss when ya turn back to dust
(Ashes to ashes)
Mark the year, 1994.. when MC's hit the floor
MC's.. your judgment is.. (hahhh) now
MC's your judgment is now (Final Call, MC's, we get down)
MC's.. your judgment is.. (here comes the Mack) now
(to clean house) MC's your judgment day is now, boyeee
(Here it comes boyee, it's time, hahhh.. ahahHHHHH, boyeee)",https://genius.com/Craig-mack-judgement-day-lyrics
Project: Funk Da World,Project: Funk Da World,1994.0,"From nowhere.. from nowhere.. from nowhere.. from nowhere..
From nowhere.. from nowhere.. from nowhere..
{*helicopter circling overhead*}
Okay everybody listen up okay?
Craig Mack's in the building alright?
He's on the premises, I need you three on the roof
You coordinate the left wing
He must not get into the terminal to access the ""Funk Da World"" secrets
I repeat, he must get into the terminal
I want him stopped I don't care what it takes alright?
Move out, now, c'mon let's go let's go let's go!
{*helicopter swoops down, then suddenly boots hitting ground*}
{*torch is fired up and starts cutting through something*}
Yo Mack! There's somebody on the roof man!
 Yeah I know man. Just another second man
C'mon man, we gotta do this shit!
 I know, I'm gettin the door open man!
 Come right now, come right now, come right now
 I swear, come right now - two more seconds, two more seconds
 Look look look look look
{*bolt or something metal hits the ground*} {*alarms go off*}
 Uhh!
Yeah son
 Shit, the 4-5 man. I ain't got the damn..
 I ain't got the fuckin modulation
Yeah you got it
 Control pads man
You got that
 Alright look - I need the voice modulation. {*typing*}
 Yo 4-5- do me a favor man, set the detonators man
 Let's get the fuck up outta here
Yeah yeah, I got that, I got that
 {*typing*} Denied
I set it up so that if ANYBODY gets up in here the whole shit blows
 {*typing fast*} Denied
 {*typing*} 4-5-76-0-2 look BANG!
""Access granted.""

Computer! How ya doin' bwoy?
This is the Mack in fullavicious funk flav bwoy, how we goin?
Initiate code sequence for ""Project: Funk Da World""
{*typing*} Dash oh-4-7, 6-9, zero-10
Coming out, ninety-four {*typing*} boom!
Hahh bwoy
Kickin' it Mack, bwoy
Nobody's rappin like me and that's clear
I got this mad style, beats from next year
The style, I bring, is shitting
Get used to the format cause old one's be quitting
Buckle in for the funk funk funk
And let the king of swingers drive Benz out the trunk
I'm the magnificent, roaster, who's the man?
Run down and low to the promised land
No compromise on my rise
Strappin' in mad biddly beats, nothin' capsized
So go on, wait 'til fuckin break of dawn
The new grip is here, Jig will tell you it's on
Mack's back, full effect
But this is my freestyle, so yo wait a sec (HAH)
Don't try to push or your fronts might feel it
And if you got size then I gots to reveal
Out comes the chrome and the shiny
With the tss- that thing's for your heiny (BLAOW!)
So meet the genuine, keep it on the hush hush
That slow flow ain't the only way I crush
I break it down to stone like Medusa
You lose ta what you ain't used ta
All aboard express train for pain
Bigger than membranes that leave you in stains
Now hang on cause my freestyle's a winner
The verse slayer, so say a prayer like your dinner
MC's all know that I'm a menace (I'm a menace my nigga)
And I won't finish.. until you finish (HAH)
I come from a life of a corner
Waitin' for my house fat pool plus a sauna
Craig Mack's the man 'cause I got it
And ain't a motherfuckin soul on top of 'em
(not a motherfucker bwoy)
Cause I'mma boom bash, crash, smash
Your whole program your program ain't worth a damn
The unquestionable, impressionable messiah
Like that John Sparks say, the world is on fire
So take your time cause your turn's gettin closer
The new world's now hell and Craig Mack's the host
Ghost (one..)
And now, ""Project: Funk Da World"" bwoy, hahhh!
Hahh, Mack-a-docious, presents..",https://genius.com/Craig-mack-project-funk-da-world-lyrics
