title,album,year,lyrics,urls
Please Listen To My Demo,UnKnown,UnKnown,"Ayo man, shit is crazy God (real crazy God)
I mean, being on top rockin' niggas, y'know
I had to walk through Hell, y'know
I made it out nigga
Southside Jamaica, Queens nigga what!
115 hahh

Ayo, what happened?
I was on the road to fame
King of New York, largest nigga in the game
Me and Biggie Smalls killin' it on Hot 97
Now Biggie Smalls' somewhere in heaven
And I'm down here in hell
With a story to tell
Praying to God that my new shit sell
I'm still confused
Still feel like I got used
Some niggas think I didn't pay dues
But dammit, I paid 'em
You jumped up when Funk played 'em
In The Tunnel and the radio station
No ultimatum nigga, ball or die
12 gauge on stage, seeing hands in the sky
No piece of pie
Goin' whole broke
Enough for a beef patty, Coke, a brand new smoke
These niggas rockin' Range Rovers, eating steak
While I'm cookin' leftovers, niggas is fake
Good thing the drug game kept a nigga alive
Southside Jamaica, Queens on a nigga to survive
When I arrive, vengeance is mine
And if I would've knew, I would've never fuckin' signed (word up)
And uh
Had dreams of fancy cars and limos
And all I wanted was somebody to listen to my demo

Please listen to my demo
Pl-pl-pl-pl please listen to my demo
Please listen to my demo
Pl-pl-pl-pl please listen to my demo

Uh huh, check it
Me and my man Bumpin' Boogie
We was stealing cars
Sometimes we got away
Sometimes we jabbers
Police bussin', handing off cars to my cousin
At the chop shop, poppin' that lock like it's nothing
Shot at Monroe, y'all ain't though
Y'all was fucking with this bitch on CasaCasco
The 4-4 waiting at the club front door
Niggas owe, niggas blow with the real c4
But the days of EPMD first CD with chesters on Jones Beach
With OPP
Selling drugs was my life support
Selling drugs had thugs scheming, but I ain't never get caught
In wine dance, some of y'all call it con dance
I call the place, ya ain't got a chance
I think back, I used to smuggle the crack n' juggling that
Thank God I'm bubbling back
And uh
Had dreams of fancy cars and limos
And all I wanted was somebody to listen to my demo

Please listen to my demo
Pl-pl-pl-pl please listen to my demo
Please listen to my demo
Pl-pl-pl-pl please listen to my demo
(Listen to my demo
Please listen up
Pl-pl-pl-pl please listen to my demo)

Here I am up at Espionage, building 3
Looking out on the terrace at NYC
Hear a knock on the door
Whispering and gun clickin'
It's some thugs outside thinking I'm easy pickin'
All I got is my Mossberg, so I cocked it
And a gun blast is all they heard
Hit the hallway 'cause niggas is still bussin'
Hit the doorway 'cause security's coming
Ayo jealous, living our life like GoodFellas
Niggas wanna see us out in the rain with no umbrellas
Rap's tryna sell us out, I remember the cops
Coming in my house fucking with my pops
It never stops
Got stoned out when I was young
Mom's cried so hard when she found that gun
On the run, you ain't the only one with stories like this
Nigga, my life is deep as the abyss
And uh
Had dreams of fancy cars and limos
And all I wanted was somebody to listen to my demo

Please listen to my demo
Pl-pl-pl-pl please listen to my demos
Please listen to my demo
Pl-pl-pl-pl please listen to my demo
Please listen to my demo
Pl-pl-pl-pl please

Now I'm lucky 'cause all my niggas is thorough
Talkin' 'bout all my niggas straight out in every borough
Been through some shit that some don't make it out
Been through some shit that send the flowers out
You heard about all the stories of drugs and killing
Who's dealing, blood spilling and drug dealin'
I know stories that live forever on those that died
But I'm here to sing a song that I'm glad I'm alive
Peace!
We rock on and
 rock the song and
Funk Flava visual Mack
Smack y'all niggas
'Tack y'all niggas
Uh huh

Please listen to my demo
Pl-pl-pl-pl please listen to my demo
Please listen to my demo
Pl-pl-pl-pl please listen to my demo
Please listen to my demo
Pl-pl-pl-pl please listen to my demo
Please listen to my demo
Pl-pl-pl-pl please listen to my demo

Funk Flav uh huh",https://genius.com/Craig-mack-please-listen-to-my-demo-lyrics
Shinika,B.I.G. Mack ,UnKnown,"Vocalicious funk flave 1-2 as we test this down
We get funk-stupid with this beat
Get stupid witht these rhymes I be bussin, yo
Yo 4-5 knahmsayin, yo, check it out
Y'knahmsayin, last night and shit, Friday
I was buggin out with the fellas
I caught up with this bitch n' shit right
I was like yo, check this out, so I started this
I said it's freaky-freaky Friday and I'm chillin on the corner
Hangin with my niggas makin figures that I'm gonna
Have the tunes blastin so fasten ya seat belt
Cuz AHHHH, blunted, I'm gonna make it melt
Had buddah in my head I musta smoked about a dime
When I seen this big behind, shakin like my rhyme, duke
I told my whole crew
I said ya busy hon but yo, yeah me too
I said my name is Mista Mack and I'm makin all the green
So honey you get vain and lets hit the scene
She said Mista Mack aiyyo Shinika's what they call me
Used to be from ?? but now I'm up in ??
I said Shinika, ya make my body weaker
You're boomin like L speaker and boy I'd love to freak ya
So I slipped my 20s to my man and hit the spot
Showed my knot, Shinika got hot
I opened up the door and yo in just a minute later
Had her snappin at my zipper like a hungry alligator
See, a sneaky-freaky MC is who I be
When it's time to step up inside a bitch's body
It's like that y'all as I kick back
On a funk track stupid phat plate y'all
1-2, Mack in the house
Testin one down with the funkalicious flave
Be bussin MCs like
Kickin wicked rhymes like Robitussin good for the throat
Cuz I hope ??? rhymes that I wrote
MCs clear quote
The funkalicious flave that I do with the 1-2
(ad-lib etc. til fade)",https://genius.com/Craig-mack-shinika-lyrics
