title,album,year,lyrics,urls
Real Raw,Project: Funk Da World,1994.0,"How many know what funk is? Raise your hands
You ready for this world?
""I can get real raw.."" plus my style is hardcore
I'm Craig Mack, comin in at your backdoor
My rhymes hit hard, no games like ping-pong
I'm strong (like who Craig?) Kong!
I'm flexin, what's next in, my funk track erection
My licks get the kicks like the Chinese connection
Like Damien, the Omen son, I won't run
I never ran, fryin MC's like the Sudan
Craig Mack is like a loaded four-five
Mothers get welfare, fathers won't survive
Yo who can get fierce as fierce can get, get set
I'm ready, to eat MC's like spaghetti
The C-R-A-I-G Mack is back
I've blown the world well known, the man's got it sewn
Zoom zoom zoom, zoom za-zoom za-zoom
Three years of waiting, now here comes kaboom
Back off the STEEL kid, let me get my dough
You're real slow, get the DICK like a homo
Got the name, no games, the outlaw
I'm real raw, plus my style is hardcore
""I can get real raw.."" plus my style is hardcore (4X)
Service with the wild style, freak a smile
I'm crazier than ever, PLEASE pull my lever
Oooh I can't wait, I'm paid, I see him
Brothers on my jock, a G for per diem
MC's that are down please stay down..
CRAIG MACK FOR PRESIDENT! Fuck around
My nature's to hate ya, my style of MC'in
To dust and crush I bust every human bein
Dig it, I'm cool but one rule, don't act fool
My four-fifth's a tool, I have aim
Hey, hush it down, quiet, I'm speakin
Unique technique and style that I am freakin
Peakin, speakin like a deacon or a pastor
The master, baby, death, okay G?
Let's get back to the issue with judicial
Weepin willow grab a pillow 'fore I have to diss you
I'm concrete, hard as the street, like pavement
Leavin heads bleedin, strictly in amazement
Surrender, with more 'ups than Alcindor
I'll bend ya, you're tender, next agenda
""I can get real raw.."" plus my style is hardcore (4X)
Yeah.. check this out
I belong in a hospital insane
Life fast lane on the brain like Bruce Wayne
A telltale won't fail or get stale
Cause I'm stuck like braille as I walk on a 3rd rail
Manson's my grandson, not so handsome
I'm grotesque -- FUCK IT -- girls still rub my chest
I'm G with James Brown, ""Give it Up or Turn Me Loose""
I'm terror on the red lines, prank phonin Zeus
Craig Mack's the brother that attacks at random
MC's I slammed em, cause I'm fat as Ralph Cramdem
Ras, bumba claat, boy I kill ya
MC's I'm a thriller, from here to Manilla
Lay down, nothin but facts, jacks
The blackjack ace to the beatdown max
Relax, this is just wax on my single
More chips on my shoulder than the chips made by Pringle
So how do you figure? I'm stronger than your liquor
Wild Irish Rose, huh, strike a pose
I'm death to an MC, below like Jack Dempsey
A shark feedin frenzy, on those that tempt me
One more score for the war, SEE-YA!
I'm real raw, plus my style is hardcore
""I can get real raw.."" plus my style is hardcore (4X)",https://genius.com/Craig-mack-real-raw-lyrics
Funk Wit Da Style,Project: Funk Da World,1994.0,"Aww shit, here come the man again
You know if you can't with the style that's goin on right now
Then you need to be sittin down
If MC's can't get with the style that's goin on
Then you need to sit down
Do your thing Mack, do it to 'em nigga! Ahh whassup?
What you don't know, what you don't know, kick 'em in the grill
""But anyway, I'd like to take this.. anyway, I'd
Anyway, I'd like to this time out to bother you""
Oh no no no no
No I don't think you can get liver than me G
So sit back, relax, Mack's about to attack
And turn your flav into Similac cause it's like that
I kick funk out the frame, make it insane
With all local stops set to crumble like a (?) train
My thickest format, my format's thicker all that
No comp for combat with bwoy like Supercat
Show you where my head's at I crack you with a bat
Where the funk? Hear the trunk a bit and fat knit(?)
Rearrange the skit make it fit so you can't sit
Now ain't that some shh.. I rip it
I snap a jaw, I stabba jab a dinosaur
Live from Creedmore under the floor
It's like the roughest of ruffnecks, wicked and (?)
Check the (?) MC and his project
All you brothers need to know doe
There's no more best MC cause that is now me
See, G, I am king MC
Once said from me can't another brother disagree
Got the funk bleedin all out your trunk
And there's all there is to it (that's all there is)

If you can't funk with the style that's goin on
Then you need to be sittin down

You must got no brains in ya head
I kill ya dead on the spot with the hits I got
Trust my flavor G, I make ya wanna pee-pee
I got what you can't see, somethin like a leprosy
I slow it dowwwwn, somethin like.. this
When it's time for me to stun 'em
MC's I warned them..
I'll put 'em on the moon without funk to listen to
Then again, my vibration
May give the sensation they're on vacation
Y'all brothers need a (?)
Real rugged alligator MC hater from the fader
You little tic-tac, tryin to act like a lumberjack
Sit back and watch how the earth crack
You funk around, you lay around, that's how it goes
And I suppose MC's still wanna try me
King of the mountain is a hard rock
Do you understand, smile and I'll take you out like the mob
Check it black, after the Mack there's no recoup
Not even soup, get out shake the hula hoop
Comin out the ground..
Gettin down..


Sometimes alone I be writin
Must be frightenin, to hear I'm on the air
But I don't care, (?) 'til I'll see you sick(?)
Son, grandson, no tellin when I'm done (no tellin baby)
I'm about do you and you on some new
Who has a date and thank you for waitin
There my bad, I thought you took a beatin in the brain
Then you learned from rap that rap's a mistake
You won't get a break
Big as a cake for me to make, and you bake
So, banzaii, here comes the flyest guy
That you ever heard in your lifetime (yup yup yup)
I do a behind..
And rewind, I wanna kick some more shit
Down your faucet, I pours it
Mighta lost it, but then I retrieve it
Believe it, I got this fat okey-dokey style for a while
Peace from the king
Peace from the king G, here it go
One time for your motherfunkin mind

Sittin down, bwoy
""Anyway I'd like to take this time out..""
""No more music by the suckers""",https://genius.com/Craig-mack-funk-wit-da-style-lyrics
Let Me Get Down (Original Version),Underground Airplay Vol. 3: Burdens of Prophets,UnKnown,"Produce, nigga
I'm high as a motherfucker
You ain't higher than me, nigga
No doubt nigga, I'm fucked up man
I'm fucked up
We out here
Lyrics, lyrics, more lyrics
Anyway, here comes the Mack back in full effect
My man Biggie Smalls in the shit, you know what I'm saying
He tryna hold me back, you know what I'm saying
And won't let me get down, but you know what? I'm getting down?

Let me get down, let me get down
Let me get down, let me get down
(I just wanna funk a little bit)
Let me get down, let me get down
Let me get down, let me get down
(I just wanna get a little bit)
Let me get down, let me get down
Let me get down, let me get down
(I just wanna funk a little bit)
Yo, let me get down, let me get down
Let me get down, let me get down

To my motherfuckin man 50 Grand, the alcoholic man (ahh!)
Inject a tall can in his bloodstream if he can
Biggie Smalls, the pussy stroker
MC provoker, chocolate thai smoker, huh?
I like to max in Maximas and Acuras (let me get down!)
Your girl buttcheeks I'm smackin', huh?
The raw rapper, spine snapper
With the little hookers on my lap-ah
You know the flavor Mack-uh (I know the flavor, yeah)
A shy nigga but I ain't your fuckin' comforter
And if I ever fall in love I bet I'm fuckin' her
Ask the hooker, if I didn't jook her
If she try to front, then I drop the Chucky Booker on her
""Why you wanna, play your games on me?""
Bitch, ya crazy?
Commitments, I'm Swayze, no time for the ill shit
Rest with the niggas on that real blood-spill shit (ah!)
My rappin' tactics are drastic
Stretchin' motherfuckers like Mr. Fantastic
So if you wanna see my pedigree (ahhh!)
You better be, filled with energy, niggas never gettin me (get down!)
So let me get down, let me get down, let me get down, let me get down! (Aaaah, ahh!)

Let me get down, let me get down
Let me get down, let me get down
(Let me get down, funk a little bit!)
Let me get down, let me get down
Let me get down, let me get down
(I just wanna funk a little bit, haaa!)
Let me get down, let me get down
Let me get down, let me get down
(I just wanna get a little, biiiit)
Yo, let me get down, let me get down
Let me get down, let me get down
(Here he come with)

'Cause the rhyme that I kick is called the MC stomp
Here comes the one they call king of the MCs
Shaking down enemies with rhymes like these, boy
I'm bad, bad to the bone
Freaking up styles, wickity wild
Pass the microphone
I tell you suckers strange, Biggie my man
I got MCs melting inside my mouth and not inside my hand
My species eliminates MCs
 with 3rd degrees
I bring the funk from the floors, MCs here
So from here to Warsaw I roar
The maclalicious, this nigga's vicious
MC from '94 leaves your ho making wishes
No saving MCs misbehavin'
I got the funk bleeding all out the trunk
Names all over, so I'm going for the pump
I come from the underground, so let me get down
Let him get down, let me get down

Let me get down, let me get down
Let me get down, let me get down
Let me get down, let me get down
Let me get down, let me get down
(I just wanna funk a little bit
Let me get down, let me get down
Let me get down, let me get down
(I just wanna go, haaa!)
Let me get down, let me get down
Let me get down, let me get down",https://genius.com/Craig-mack-let-me-get-down-original-version-lyrics
Mainline,Project: Funk Da World,1994,"Ahhh-hahh!
Let me get some volume, on my headphones, bwoy
Let me get some volume, can I get some volume
On my headphones, bwoy
Now raise up the funk, bwoy - ha ha, bwoy
Raise it up Mack, raise it up Mack
Now we about to bring all the funk to the mainline
You touch that line bwoy, the mainline
Now we about to bring all the funk to the mainline
Bring it back and catch wreck on the mainline
Here we go with all the funk boy, to the mainline
Helllohh - is this mic here on?
Cause I'm gone, cause now and forever are disbanded
The ""Poetic Justice"", more than Janet Jackson
Mack's in position to harm the planet
Realer than real, as Mack gets the steel
Funk appeal in my rhymes is gonna make a mill'
Fat shit is what you feel
I'm catchin hiccups and lyrics get caught in my esophagus
I'm bringin all the rap to the mainline
Some'll bring my funk on point like a porcupine
My sensei, say, the way, to make 'em pay
Is treat the motherfucker like a (?)
I pack my funk harder than a (?) do
To continue, you're soup on the menu bwoy
I can run any type of line
Send your smoke signals high, code red yo for mankind
Now we are on the mainline, gettin all wreck for the mainline
Hahh, bwoy, the mainline bwoy, on the mainline bringin all the funk
Now we about to bring all the funk to the mainline
Bout to catch wreck for the mainline
Buggin on the funk boy, to the mainline
MC's now realizin code red
My mac-11 dinosaur is gonna fill ya full of lead (wake 'em up Mack)
Some of y'all are better off dead
Cause it's gonna get hotter than the center of (?)
Maaaaan, you're stupid out the frame
To think to get sane, and gonna cause some pain
I'm the most incredible man ever seen
While ya might stand the (?) do your typical and ran
King Craig Mack now runs rap land
Makin you (?), and me as Japan
Uhh, shucks, wait a minute
I feel like gettin music introduced (?) MC
See, you can't see me
The funk continuously, I'm thicker than a oak tree
And smalltime my fists come equipped
For a lip with tighter grip than glue from a ship
And even if you're still brave believe
That Craig Mack's comin down with funk up the sleeve
It's the Mack on the mainline, all the wreck on the mainline
Now we about to bring all the funk to the mainline
Watch me catch wreck on the mainline
Bringin all the funk boy, to the main
On the mainline, bringin all the funk
Now we about to bring all the funk to the mainline
Watch me catch wreck on the mainline
Hahh bwoy, on the mainline, bringin all the funk
My rhymers come harder than a vault
MC's bein tasty is not my fault (no it's not)
More danger for metropolis we're droppin this
Funk weight that's greater than George Poppadopalous
Now even fools are better
Rap's new trendsetter, at makin MC's wetter
So plug in the mainline 'til ninety-nine
For funk the genuine now vote for mine (vote for Mack)
My voice be gettin hoarser and hoarser
From the way they take a picture MC (?) than a flyin saucer
Believe the hype
The Mack one that's tight but then I might (?) set rhyme I write
I come for you niggas in the grill
Just for thrills, Craig Mack, king of chill
It's the Mack bwoy, on the mainline
Catchin mad mad wreck on the mainline
Now we about to bring all the funk to the mainline
Watch me catch wreck on the mainline
Bringin all the funk bwoy
On the mainline, bringin all the funk
Now we about to bring all the funk to the mainline
Mack on the mainline
Get wreck on the mainline
On the mainline bringin all the funk bwoy
{*ad libs to the end*}",https://genius.com/Craig-mack-mainline-lyrics
Praise the Lord,UnKnown,2016.0,"Incredible Mack
Still recording
Uh-huh
When God comes down

Now I know, to the world, the rap I kick
Will make you think I'm a lunatic
Lost my mind, I'm mentally sick
But for all mankind, this is it
New kingdom on the earth where the devil don't fit
No more bad times and no more wars
New Jerusalem, the city with the gold on the floors
Righteous laws, a thousand year 
The earth rejuvenated, Christ illuminated
I fight for the cause, kick down doors
The devil set up and I'm about to erupt
Mack's a warrior, I wear the armor of God
Fix your face, raise the bass, and stop lookin' so hard
You see, praisin' the Lord is easy for me
Craig Mack's right where he's supposed to be
You not close to me, you foes to me
The saints praise God and the Pope praises rosary
See, we about to take it to the next millenium
On Judgement Day, I know where He sendin' 'em
The earth and God on one accord
And I'll be in the choir singin', ""Praise the Lord""

When God comes down, before He touch the ground
You better praise the Lord
It's all upside down before He turn it around
You better praise the Lord
When God comes down, before He touch the ground
You better praise the Lord
(Boyy)

Now y'all ask the question, ""Where's Craig Mack?""
Then you two played me at the Tabernac'
Jumpin' up and down with the Prophet of God
Givin' praise to my King 
who was bruised and scarred
Set me free, gave me a charge
A night to remember like El DeBarge
Gave away my cars, turned in all my guns
'Cause the Mack stayed with beef like hamburger buns
Sold my home, moved my family
South Carolina, y'all could stay mad at me
If I stayed in New York, it's just another tragedy
So God cleaned me up while y'all was still raggedy
Sore as a cavity, depravity, your face in calamity
Your ego on a high like we ain't got gravity
Your majesty, please forgive
This world gives you death, but I wanna live
What you gonna do When God Comes?
To me, the best song on the album
If you don't turn around, you know the outcome
'Cause Hell's a place that you ain't never comin' out from

When God comes down, before He touch the ground
You better praise the Lord
It's all upside down before He turn it around
You better praise the Lord
When God comes down, before He touch the ground
You better praise the Lord
One God, one Savior, one Lord, all aboard
Singin', ""Praise the Lord""
(Boyy, c'mon)

I mean, look at all this hate stuff and gay stuff
Men wearin' make-up
Sodomy and bodily parts that don't fit
Lesbians and thespians and sacred planetarians
Aquarians and Martians, and angels and guardians, they partyin'
Puttin' fake food in their body and they pottyin'
Head-choppin', nerve-droppin',  face cryin'
Terrorists is bombin' 'em and governments that's armin' 'em
These are the last days 
When God comes down to burn like sun rays
They got you thinkin' that it's just a phase
But Mack'll tell you now give God the praise
Skies full of  to change your brain waves
They want you in the zone, they'll call your cellphone
Put a camera on your home, you never alone
You gotta  with a chip in his bone
The earth moan and groan, waitin' for God to come
I'm not alone, but I can rap 'til my tongue gets numb
If you don't understand what I'm sayin' to you
There's nothing I'll be able to do in 16

When God comes down, before He touch the ground
You better praise the Lord
It's all upside down before He turn it around
You better praise the Lord
Jesus Christ is the only way you gonna be saved
You better praise the Lord
(Boyyy, haahh)",https://genius.com/Craig-mack-praise-the-lord-lyrics
On Da Run,Game Over II ,UnKnown,"Eh yo, god bless the dead, ya know?
And all my cats I know with the football jerseys on: dont have no regrets
Hold them numbers
Big up to the feds who tried to catch me in 88, nigga
Ha! Funk Flav, Mr. Mack
Eh yo, I can't face going to jail
Cuz my life is bullshit, man, nigga fuck paying bail
Shit is on the third rail
On my tail is the feds, baby, Frank ?? for club med
Niggas wanna kill me, god
Scared I might wrap these niggas
Entrap these niggas
If the feds wasn't watching I would clap these niggas
I mean put a bullet through the fuckin back of these niggas
Phone ringing off the hook, probably tapped my niggas
See the headlines now: ""Mack found in 5 rivers""
FDR, thinkin was it better when I didn't buy the car
Didn't cop the bar, didn't buy my girl mother a new jaguar
Shit, my moms got the Continental R with the backseat bar
Talkin about ""my sons a star""
Little do she know I'm Caesar and world ???
Crack is dead, I'm sellin X instead
Bitches in my bed will fill your ass with lead
Keep givin me head 'til the tip turns red
Sit back and watch me butter this bread

On the run
Best three words to describe my life, make the game my wife
On the run
Hustler, born and raised, in the streets where I spent my days

I told my main chick, pack your bags, She ain't listen
Chrome started whistling and turned her Christian
Blew up the whole house using nitro-glycerin
But the Expedition in the garage was missing
Moved the nannies and the kids to a new position
Intuition gave me suspicion
Shit is murder, do I kill myself and fuck them niggas' satisfaction
Or demand action, pull out toast and start blasting
Young niggas asking, wise cats only give a fraction
Streets is the young man's attraction
I dug myself into a hole
Into a world thats cold
Pimps, players, bitches, ballers, hustlers, drugs, guns and thugs
Million dollar homes, like Capone's, persian rugs
Gentlemen with fake hugs, turn to slugs
I'm a made man, paid man, show no love
Clock's ticking, plot thicken, probably written in a book somewhere
My fuckin life ain't fair
See either way, i'ma make it off this earth without a trace
So if I ever see the judge, i'ma spit in the bitch face


Eh yo, faggots
Nah i'm sayin, all you sweet cats, nahmean?
Real gentleman dont need it
Its strictly drive-thru window meals
Enemies lurking every crack and crevice, eating rocks for breakfast
No time for music, carry toast and use it
See your house and uz' it
Test your life and lose it
You heard Gotti, shit is all fucked up
His family didn't even wanna check him
Disrespect and neglect him
In a place to correct him
Disconnect him and stretch him
While the bull cop police protection
Shit is question
My suggestion in the game of deception
Is to reign with aggression
With the guns for collection
The whores you undressing, keep 'em inside the best western
You want a firm investment?
Nigga, go have a kid, and let him eat your steak
Dont make the same mistake
Hope the kid is strong, when i'm gone
You'll be like pop-duke was the man, but his life was wrong
Gunned down off the top like Kong


Mack!
Hustler, born and raised",https://genius.com/Craig-mack-on-da-run-lyrics
Wooden Horse,What’s the Worst That Could Happen? (Soundtrack),UnKnown,"So any time you're gettin low, 'stead of lettin go
Just remember that ant..

Oops there goes another rubber tree plant
(Oops there goes another rubber tree)
Oops there goes another rubber tree plant
(Oops there goes another rubber tree)

Now I came to rock, I came to move the crowd
I came screamin' out loud
No other choice is this bad new voice
Can't wait to sit in my new Rolls Royce
You soft and moist, sweet like cake
Don't be scared to lie down in the bed you make
And if you fake, I'm like Alexander the Great
A conqueror, stompin' ya, for even steppin' to the plate
Now you think I'm late but I'm right on time
You had your chance to do it now it's my turn to shine
Keep in mind, you ain't heard my flow in a while
And I still ain't heard nobody that can fuck with my style
Juliet child nigga cook MC's, Craig Mack baby 1000 degrees
Stand back nigga I'ma shake this place
And look just when you thought it was safe?


Now inside the streets Craig Mack's a living Legend
Nuclear weapon better watch where you steppin'
Story at 6 and see the film at 11
You can be Kit but I'm like Frank Drebin
Mary Lou Retton, flippin' on yall
You can use Motrin, Advil or Tylenol
Just to see me ball make your chick wanna follow
Rock the Meadowlands you got Boo-ed on Apollo
Real hard to swallow wanna know how come?
Cause I'm hot-dog probably burying meat off your tongue
So from now on till thy king-don-com
The sea-son has begun from my style to weigh a ton
Kill you for fun but I ain't playin no games (no games)
And I ain't sayin no names (uh-uh)
But next time you kill somebody make sure they dead
But wait, you can check this in-stead


I see you made it to the bonus round, see my crown?
Pretty, too bad you can't touch it
I'm like Pompeii first time it erupted
Chicks still call acting hungry as a buzzard
You can let your man dump it hug it and love it
Touch it and rub it, Mack nigga, that's why it sounds undiscovered
Explode like L. Ron Hubbard, on the Dianetics Cover, smother a brother
Been ""Lethal"" for years ask Gibson and Glover
Your man be like ""Help!"", lying in the gutter
Just like that, ""Splash me the Cash""
Shit I'm like Duke Nukem get ready for combat
I now pronounce you man and wife
You may, kiss the coffin it's the end of your life Mr. Mack
And I know how to land this bird
Bet I see you 2000 nigga that's my word

So any time you're gettin low, 'stead of lettin go
Just remember that ant",https://genius.com/Craig-mack-wooden-horse-lyrics
Do You Have What it Takes?,Street Fighter (All New Songs From the Motion Picture),UnKnown,"{*scratched: ""One by one I'm knockin you out"" - Schoolly D*}

Do... do you have it what it takes, to be a Street Fighter?
Street Fighter, Mackalicious fat funk flav'
For ya headphones, bwoiii
(LOOK!) I bet you thought you could beat Blanka
Mo' flav' than the chocolate made by Willy Wonka
Zangief'll hit you harder than a Tonka
Truck bet a buck USSR will stomp ya
Now M. Bison had this plan
And had the hostages inside the palm of his hand
Now we all know Dhal's the man
But in the world of rap Craig Mack'll turn ya into sand
Jane, haircut like she spent a summer at E. Honda's
Stomach wonder in four digit number (chomp, chomp chomp chomp)
I got Sagat on the spot just to rock your knot
He got kicks like I got rhymes to the sho' shot
A Street Fighter, funky rhymer, drop-a-dimer
Bound to action pack, yo Jack, greatest-of-all-timer
Here comes the hook again~!
Mackalicious that po' flav' will make your hair Ken

Do you have, what it takes, to be a Street Fighter?
{*""One by one I'm knockin you out""*}
I don't think you have what it takes to be a Street Fighter
{*""One by one I'm knockin you out""*}

Momma don't let your babies grow up to be MC's
Cause they'll freeze (freeze 'em up Mack)
I got this real strange disease
That makes knees bend like hurricanes do the palm trees
Now Dhalsim is slim hittin harder than a Timb
Whem the rubberband man gets in
Peace to Balrog as I kick the monologue
Thicker than fog and heavier than Boss Hog
I heard Vega got Spain locked down
With tournaments, with ornaments underground
And Chun-Li reportin, with real brain distortin
Kicks fix your back for back brace supportin
And knees bend for Ken, no pretend
From beginnin to the end, Mackalicious rhymes'll win (everytime)
And call yourself a fighter if you wanna
But you'll be a type of fighter lyin all up in the corner
Mack you can't bite-a, silly overnighter
Flake-ass rhyme writer, Mack's a Street Fighter (here it comes)
It's time bwoi (bwoi, as we get down)
As we bring the funk on down for Street Fighter


A Street Fighter, ain't just a game no more
Too raw, you'll get kicked out the back door
If fightin fo' position is your mission then keep on wishin
(Keep on wishin and hopin and prayin and..)
I mean this man on the mic got mo' flav' for days so listen
(So listen up with the funk)
I'm out with these be-about rhymes that the Mack'll shout
Punchin through bricks and turnin bodies out
A Street Fighter, is now in the house
Type of hype that will amaze, Street Fighter brand new craze
(Brand new craze~!) As we get on down
Street Fighter moves leave another fighter in the ground
 with ad libs

Ah hahhhh bwoi!
{*""knockin you out"" - scratched to fade*}",https://genius.com/Craig-mack-do-you-have-what-it-takes-lyrics
