title,album,year,lyrics,urls
Tarzan,Queen Elizabitch,2017.0,"I don't think motherfuckers understand
It's like this
Listen...

Drama free don't speak to me (hell nah), whatchu know about EBT?
I came from nothing no GED, now I got a article on MTV (I do)
Draw the line like yellow tape
Blowing up like overweight
That money talk that money talk
Like anything that Oprah say (that money!)
One second they T'd talking
Come across em they speed walking
Yeah the trigger, I squeeze off it
This the reason why we need coffins
Make it where you can't see straight
Known for the hands like a DJ (wassup?)
I'm only near if my money there or aw shit I'm a be late (busy)
Pull up with the guys, catch a nigga by surprise
Bet yo ass won't survive, I ain't letting shit slide
Choke a nigga with his tie, then I tell him ""nice try""
When I'm up to something I cause corruption
Get my hands dirty like construction
One bullet blow that nigga brains out
Make it where that nigga can't function (buh!)
We can meet inside no Ravioli
Waste time, rock him with the Rolly
Then the shotgun get rid of you
I'll stick it on you like Gorilla Glue (you know it)
Fuck out my face tryna bargain
It was days I was out here I was starving
I'm swinging and bringing  gorillas & killers
To charge in like I'm Tarzan
I'm a get it if I want it, CPD know me bitch I'm wanted (I'm wanted)
Fuck around, 'bout to get yo dough scammed
Y'all bitches slower than slow jams
House big like a factory, cannot keep track of me
Niggas came after me, I took they salary
Pull out the chopper then test out the acc'racy
Save yo memorial pic to my gallery
Wonder why they don't see me hardly
Getting more cheese than a pizza party
Damn, I missed your event? I'm sorry
I'm just out being that B like Cardi (bitch)
Thot hoes really need to die hard
Side bitches love to wear side parts
That's they logo and they motto
I then add that all up like a total
I'm so fucking ahead of the game
There's not one bitch that do it the same
Locking the safe then I'm back on a plane
If he come with baggage, then I cannot claim
Please stay the fuck away from me, gotta pay for me
Wanna see me on the show? Have 10K for me
Or, oh well, that's the end of that
I can make that shit up off the Internet
Spin around the block, waiting on a drop
Replace the bullets like outta stock
Let me see a opp, he gone need a doc
Cause I'm poking niggas, no polka dots
All I know is how to grip Glocks
Walk over niggas up in flip flops
I'm a get this money till old age
Make bitches madder than road rage
I'm juiced and I'm saucing
Don't clock in cause I'm bossing
Even crossing guards can't cross me
Bitch better wait 'til I'm crossing
Or it's gonna fuck around and be a issue
Like yo mama crying with the tissue
She got one time to say she miss you
And I'm a send that lil bitch with you
Bye!

Tarzan ,Tarzan (Woo)
Tarzan, Tarzan (Woo)
Tarzan,Tarzan (Woo)
Tarzan, Tarzan
Swinging and bringing gorillas & killers
To charge in like I'm Tarzan
I'm swinging and bringing gorillas & killers
To charge in like I'm Tarzan!
Tarzan ,Tarzan (Woo)
Tarzan, Tarzan (Woo)
Tarzan,Tarzan (Woo)
Tarzan, Tarzan
Swinging and bringing gorillas & killers
To charge in like I'm Tarzan
I'm swinging and bringing gorillas & killers
To charge in like I'm Tarzan!",https://genius.com/Cupcakke-tarzan-lyrics
Life,Cum Cake,2016.0,"La la la la
Blah blah blah

Don't smoke or drink so yeah I'm sober when I speak
This a trap house that gun better not look petite
Say the wrong thing I'm only gone say a beat
I'm knocking at yo door like, ""Hello trick or treat""
Go to the back and put it in the bag hurry up
Gold, change, credit cards and every last buck
I'm a give you five minutes to give it up in a rush
If he fuck up bullets hitting him in the gut
Holy shit maybe we should light a candle or two
Turn a fuck nigga to a bitch nigga like Bruce
I keep a shotgun that make that nigga lights go duce
And if I send him to my guys that nigga ain't getting loose
Of course I'm so motherfucking shallow
One of you niggas is finna die though
Carry the body up out the backdoor
Get rid of every witness since you was my own shadow
Never tell em how you got it coming in
Niggas can't hold water they could barely swim
I push the turf from the track to the rim
Keep a strong body of work and I ain't talking gym
Pussy ass bitch know my block ain't safe
You a hostage now that I'm surrounding yo place
30G Rolex so my time won't waste
Then I crack the iPhone so the cops can't trace

If I blast that shit tonight I'm a get life
If my money not looking right I'm a get life
If I blast that shit tonight I'm a get life
If my money not looking right I'm a get life

Lay him down in a blood bath I be cruising on my own path
Think before you ever tell me shit
Beat a bitch with a selfie stick really really not that innocent
Me and chopper we get ignorant
You starve us and we star bust and snatch up your cousin
Get the spear men done , make a nigga eat the cum
Bullets feel like the sun talking shit you get plunged
With another shot,  gun so big, we can hit you from the yacht
I ain't gotta plot, get you on the stop
Punch you like a clock do not let yo goons scare me
Knock every last  tooth out I'm the fucking tooth fairy
Better pray to Hail Mary got blood smelling up the room
Air it out with perfume you gone hear that ga- boom
And won't see that nigga soon!

If I blast that shit tonight I'm a get life
If my money not looking right I'm a get life
If I blast that shit tonight I'm a get life
If my money not looking right I'm a get life",https://genius.com/Cupcakke-life-lyrics
Cool Fuck,S.T.D (Shelters to Deltas),2016.0,"We got the freedom
Let's have a threesome
Don't get torn into porn cause you don't need em
Take yo time ain't no rushing
On the dick playing 21 questions
Like how do I feel on yo dick?
How do it feel when I lick
All on that cock do I get it on rock?
Can you sit yo ass down and let me finish on top?
It's not a sin its a blessing
You taught me my lesson
You ate all of my pussy and then you ask me for seconds
Wanna learn some shit just take classes
So cool with the shit I suck dick with sunglasses
Oh boy
Why play with dildos when you got a boy toy
You ain't gotta lie Craig I know you feeling this
Cause you got my legs twisted like some licorice
Lets go!",https://genius.com/Cupcakke-cool-fuck-lyrics
Interruption,S.T.D (Shelters to Deltas),2016.0,"I'll fuck around and throw hail it's not a empty clip I got shells
Won't be a epic fail sick of motherfuckers give me ginger ale
Shorty pump yo breaks fo' I jump that gate
So you should just pass the paper
That other shit we a tackle later
Only how you know you getting real money
When you pulling out a calculator just to add it up
Got him mad as fuck bitch dont act drunk
Mama raise no punk ,give a pair cause I'm finna get payback
You see me cover yo face like a Arab
Cause I'm at cho head brain cells finna spread
And my fist won't stop 'till this bitch turn red
These niggas so bitter they Debo on Twitter
Might lay a nigga down like he just ate dinner
One by one they keep dropping
Dont need no chair to get it rocking
Knock knock who's there? Better use a peephole as a option
Only if you wanna be safe so many guns I'm a disgrace
Keep it brief if the money ain't the case
But if it is throw it in a briefcase
Try angels if you trying to keep them squares out yo circles Thats three shapes, situation need to be addressed ?
Then I'm a show up to yo address
I play a heavy part in these streets, but no I'm not a actress Just hush get that ass rushed if you say too much
Now you getting touched, I carry bodies out like a clutch
But not going to no fucking brunch
Murder scene look so disgust, but I did it like its a must
Turned the body to a pile of dust because I let it burn like Ush
I get so much hate cause I got a lot on my plate
You can tell by my weight I went from shelters to flying delta
Now I'm on a stage in another state
I'm 100 that I'm past ready I'm sauced up no spaghetti
You hang in a clique that's dumb ass shit that's Ed, Edd, n Eddy
Y'all washed bro, just stop bro
Motherfuckers doubted me and now they shocked bro
Cause I kept giving them the unexpected
Like mother nature in Chicago
Stop trying to treat me like the outcast
When yall be watching me more than Comcast
Y'all old as hell and broke as hell
In the basement living with yo Mom ass
I get slut shamed for the sex songs
But yo nigga up my ass like wet thongs
I line the chopper up then mess yo lining up
Now everywhere you go you need a hat on
They like ""Oh my God, she should be ashamed""
But I'm on every bitch account like a username
Now y'all can get back to doing nothing
And I'm sorry for the interruption",https://genius.com/Cupcakke-interruption-lyrics
"Reality, Pt. 4",Queen Elizabitch,2017.0,"Times changed was dealing with so much pain
But at the same time it's alot that I overcame
Went from hungry last year now dressing in cashmeres
It's just a bag  I won't brag cause I struggled the past years
I had a empty fridge would eat me a stale bagel
Thanksgiving Day with only me at the table
No friends or family, demons surrounding me
Sometimes I had thoughts of jumping off the balcony
But um, I kept chewing on Doublemint bubblegum
Leftovers in my stomach more like pieces of crumbs
Around the wrong crowd they telling me ""hit the blunt""
My father don't want me like we don't want Donald Trump
I was tryna keep it cool for my mammy
Them long lines standing in that food pantry
Wasn't a joke, losing my hope
Got bags under my eyes looking like a wrinkled tote
It was no sleep at all pissed in the bushes, no stalls
Found a home then we was gone then more leaves than fall
On my mama this shit was trauma
Ain't have a solid number so how could we see a comma?
While I was sleep it was rats running over my mom feet
Just so she could work to get us something to eat
Lets get deep, I'm hurting as I speak
When life paid you dust just get a broom and sweep
At 11 who you telling everything was hand me downs
Jumped and stomped by 20 people while others stand around
Nobody helped, everyday I felt invisible
School so grimy the principal don't even got principles
Once I turned 12 it was all hell
Roaming the streets looking for D when I couldn't even spell
Fighting demons with a poker face like everything swell
Let's fast forward let me show you how my life has failed
Remember them nights with no lights or gas?
Washing up at the sink tryna clean my ass with cold water
My entire body was freezing best believe it
Jesus put me here for a reason
15, fucking on a man that's 35 good in the beginning
Then ate my soul alive fooled myself thinking its love
The way he layed with me
But all we ever did was fuck and went to KFC
It's sad, I degraded myself hated myself
All this because I wasn't raised with a belt
I know mama I hurt you staying out pass curfew
You deserve to sit back but I overworked you
Remember when my music got 11 plays?
Mama we here now these the better days
So I'll be damned if I let a nigga take it away
They body dropping in a instant like they break & escape
Never going back to them old days of seeing them low plays
So I entertain these niggas like I'm giving them roleplay
The greatest things comes to the ones that waited gotta be patient
It's about organization all my albums got my wallet on Fat Albert
I donate to the shelters money, toys, and flowers
We was in it more than hours the feeling was sour
300 people in one household using the same shower
People got some fucking nerve to be mad that they rent due
When people out here on the curb with covers and ripped shoes
The homeless be the ones with good hearts I feel bad
Cause they put everyone first by giving away they last
Think about it!",https://genius.com/Cupcakke-reality-pt-4-lyrics
Birth Mark,Audacious,2016.0,"Couldn't get no sleep last night (
not at all
)
Throwing up like I'm dizzy from a flight (
I'm sick as fuck
)
Mom bugging for nothing, she so uptight
She said, ""It gotta go if you staying here for the night"" (
What?
)
""It's important, abort it,"" that's what they all said
Rubbing my stomach to feel it
Don't wanna kill it, that's dead
Will I still go to heaven?
Will I still get my blessings?
When I leave the doctor's office, would I feel like a felon?
I'm kinda aggy
Shame I got a fucked up baby daddy
Would have been a good mother
To love her 'til I'm wrinkled and saggy
Like a test, I'm stressed and hella naggy
'Cause this shit cut deep, like it stab me
The nurse under my skirt looking for the body parts
This vacuum hurt, I just hope it don't leave scars
In the mirror, I'm staring, I'm so embarrassed
Feel like my soul selling quicker than clothes up on the fucking clearance

Wish I would have borned you on this Earth (
Lord knows
)
I'm not alive inside, I feel the worst (
Lord knows
)
I'm torn about my unborn, and it hurts hard (
hurts hard
)
Now I'm scarred for life, just like a birthmark (
birthmark
)
Wish I would have borned you on this Earth (
Lord knows
)
I'm not alive inside, I feel the worst (
Lord knows
)
I'm torn about my unborn, and it hurts hard (
hurts hard
)
Now I'm scarred for life, just like a birthmark (
birthmark
)

Can't buy no baby clothes, can't feed her SpaghettiO's
Can't squeeze her fat cheeks or kiss her baby rolls
Clean her toes even when it's gross
Can't be there when she grow up
Receive her first rose from her first crush or buy her first clutch
But instead, I'm in the hospital bed and doing no such (
nah
)
Yeah, that nigga fucked me, but he don't give no fuck (
nah
)
So much baby weight, I can't even do a toe-touch
Made this decision 'cause I'm not ready
On minimum wage and ain't no gas in the Chevy (
I need help
)
My family and friends shame me, ain't that petty?
Got me sleeping with one eye open, like I'm Fetty
'Cause at the moment they can't stand me (
gave up
)
Didn't wanna have it by a deadbeat (
I didn't
)
Damn, if only I had a plan B
My baby father only offered me a Plan B (
fucked up
)

Wish I would have borned you on this Earth (
Lord knows
)
I'm not alive inside, I feel the worst (
Lord knows
)
I'm torn about my unborn, and it hurts hard (
hurts hard
)
Now I'm scarred for life, just like a birthmark (
birthmark
)
Wish I would have borned you on this Earth (
Lord knows
)
I'm not alive inside, I feel the worst (
Lord knows
)
I'm torn about my unborn, and it hurts hard (
hurts hard
)
Now I'm scarred for life, just like a birthmark (
birthmark
)",https://genius.com/Cupcakke-birth-mark-lyrics
Furniture,Cum Cake,2016.0,"I'm calling and calling, this nigga got me sitting in the fucking crib
I can't believe this shit man, like a piece of fucking furniture?
(huh) Never again

I came across a nigga online that wanted my time
Thought  it was different but it was just  the same pickup line
He said before just to score trying to get my lingerie to hit the floor
Buff tough and rough he had my trust
Until his story got old and started to collect dust
The tea start spilling only two weeks in and got to replace him like a fill in
Screenshot is my witness he text me ""Good morning""
But also forward it to six other bitches
Yo bullshit I can't believe it
Dishing it out to me so get ready to receive it
This not a one way street
We argue over little shit like a link or a tweet
It start out sweet until he feel like you weak
Niggas always think that they smarter than Akeelah and the Bee
But they not , they really not
My position ain't to be in competition for the number one spot
Currently in shock while I'm watching the clock
Feeling like furniture in the house of a thot
Supposed to be my spouse should never have to ask you to take me out
Are you embarrassed cause I got stretch marks?
But I thought love sparks deeper than appearance
I wanna hit yo ass with my knuckles we a couple
But you got a couple Blacks and Jamaicans
Asians and Caucasians you dress like its a special occasion
I wanna go but the car seats is taken
That mean it just seem like a vacation
I'm yo bitch, but I'm sitting in the basement?

Apparently you busy it's driving me dizzy
Turn yo back on me then you turn to her
You don't take  me out you just leave me in the house
Sitting there like a piece of furniture what
Furniture furniture furniture what
Furniture furniture furniture what
Furniture furniture furniture
Furniture furniture furniture
Apparently you busy it's driving me dizzy
Turn yo back on me then you turn to her
You don't take me out you just leave me in the house
Sitting there like a piece of furniture what
Furniture furniture furniture what
Furniture furniture furniture what
Furniture furniture furniture
Furniture furniture furniture",https://genius.com/Cupcakke-furniture-lyrics
Darling,Cum Cake,2016.0,"This for all they ladies who love they guy
And you ain't gotta spy on that nigga
Cause you know where he at, yeah

There's this guy the limit ain't the sky
He gets more high when I'm with him every time
He shows me off, he makes me soft, he bless my sneezes and all my flaws
That's my dream boy (he is)
If you play me like a toy or take away my joy
(know what he'll do?)
He'll fuck you up like Floyd
The feeling when you found your soulmate
The feeling when you out with the homies
The feeling when you don't feel lonely
The feeling when you just wanna obey anything he say or do
Cause you know he in love with you (he is)
When you know his size to get him a gift or a prize
Know the brands he love and know his favorite shoe
I know he real and not acting (nope)
He takes away my pain like a Aspirin (yup)
Riding through traffic while I be in action can't live without him Like half of a fraction meanwhile if shit get wild
He the number one person on speed dial
I'm amazed how he keep the glaze on me
Never switch up his ways on me

He got jokes like his name Martin
He a feed me when I'm starving
He not out cheating with Charlin
Why? Cause that's my darling
He got jokes like his name Martin
He a feed me when I'm starving
He not out cheating with Charlin
Why? Cause that's my darling
That's my D-A-R-L-I-N-G
He makes me feel so damn free
D-A-R-L-I-N-G
He makes me feel so damn free

This nigga so worth this stronger than perfect
He never fails me the shit he tells me it comes from the heart
I can tell cause I never really heard it
Found a man that's not sneaky hella freaky
And he could get sweeter than kiwi
Ten times more times than a TV
See eye to eye like we watching 3D
What's good? Nigga come straight from the hood
Pants sag to grab the dust but he could anytime you ask
His hat cocked, on the block , but never puts me last
I'm impressed damn near blessed
He knows how to bring out the best, never play me like chess Call even when he busy working at the desk
How we manage, repairing my damage
I can bring him around my girlfriends
And he'll never try to take advantage (I love him)
Cause I'm the only lover I'm his phone cover
Show his true colors made it through the summer
Holds me like no other queens me like his mother
Say were not another were meant for each other

He got jokes like his name Martin
He a feed me when I'm starving
He not out cheating with Charlin
Why? Cause that's my darling
He got jokes like his name Martin
He a feed me when I'm starving
He not out cheating with Charlin
Why? Cause that's my darling
That's my D-A-R-L-I-N-G
He makes me feel so damn free
D-A-R-L-I-N-G
He makes me feel so damn free
(It's amazing)",https://genius.com/Cupcakke-darling-lyrics
No Beat Necessary (Freestyle),UnKnown,UnKnown,"So you niggas yall know yall can't rap right?
So I'm a, I'm a break it down for yall
Punchline to punchline and teach yall niggas how to really rap
So niggas tryna make peace so let me send yo ass to heaven
And it's ya lucky night cause my bullets running out seven
Fuck you up with 3 up in your front 4 up in ya back
I'm like a Russian coming to America ready to attack
I ain't playing with no bitch no nigga no tranny no granny
No Jennifer Hudson but bitch I spray the whole fucking family
I'm presidental talk to me with manners, ""yes mammy""
Hit a stain, smack grandma with the cane
Until she tell me where's Uncle Sammy
I don't study no bitch, bitch I barely read books
I shoot your fucking hand off
Leave you looking like Captain Hook
I stay working like I'm starving cause I'm my own damn cook
And if you witness me to a murder
Ray Charles should of warned you not to look
Cause I don't like no witness or bitches who run they mouth
Cause if you talk that slang shit
Than yo ass getting beat like you from down south
Bitches chasing niggas with the cheese
Like they related to a fucking mouse
And I ain't talking House of Payne but we be deep up in this trap house
I give it to you like  a candy store do you want it Now or Later
I ain't shaving or cutting shit but I keep the razor and taser
When I say fax me that info that mean send me my paper
I'm a ask you what you want and how you want it
Like I'm yo motherfucking waitor
Niggas gone need eyes in the back of they head to know when I'm coming
Knock yo head back with one hit dislocate it and I dont do no tumbling
I spit that crack to kill careers and I ain't talking Whitney
Bitches be so old news like I'm watching the channel Disney
Where yo goons at man? I never heard of them
My niggas killing niggas dead on site like we in Ferguson
I swear to God I be hurting em
I pull up in yo hood blowing the snipe or rifle disturbing em
Bitches pussies having bad hair days put a hat on that shit
Like a abusive ass nigga bet yo nigga still hit
And I'm a break everything on him
Ain't talking skeletons but I'm a try to bone him
I'm taking niggas spots without asking niggas
Man my tampons getting more pussy than half these niggas
Young nigga don't be hiding in the car
Go take yo ass under a rock like that nigga Patrick the Star
And I could give a fuck about how a bitch feeling
Cause I'm shit and you hate it damn I'm something like chitlins
I keep my shells blowing slower than turtles
They think my bars be rehearsal cause when I spit it be hurtful
Got bigger eyes than Urkel I do construction
Bitch I be fucking drilling I'm in a foreign doing bout a 100 miles
Wack a bitch and never go to trail and if I do show up
Man I don't blow up put the left hand up
And feed the judge with about 100 smiles
Like a fucking street sign I'm posted up on every block
I been trapping and rapping since 15
And I ain't taking no fucking stops
I don't want him ain't cuffing no nigga
Leave the shit up to the cops wait, lets not speak of cops
Cause cops getting dropped like they the opps
People say they tired of hearing rappers
Rapping about killing niggas well close your ears and act deaf
Cause I'm definitely finna kill a nigga
Cause I ain't going I ain't going I ain't going nigga
Alter ego alter ego what I'm showing niggas",https://genius.com/Cupcakke-no-beat-necessary-freestyle-lyrics
Civilized,Queen Elizabitch,2017.0,"Please understand that I don't want you to stand back (Come here baby)
Every time I walked away from this, nigga you ran back (Ran back, ran back)
And I swear to God, that's what I love about you
Question myself every time I doubt you
Cause I know that you care, breath of fresh air
I get bubbly inside every time that you stare
You love me even when I'm ugly
Make love to me, don't fuck me
Gotta make me feel so lovely
With a long grandma hug or don't touch me
Ignore them hoes when the phone run
So yeah, you in it for the long run
You mine now through thick or thin
So if she gave you brain, tell her think again

Won me like a prize (A prize)
Never tell me lies (No lies)
When you on me side (Me side)
I feel civilized (Yeah, yeah)
Won me like a prize
Never tell me lies (No, no)
When you on me side
I feel civilized (Yeah, yeah)

Lit like a candle
Love how you handle every little thing that I throw your way
Give you a sample of some of my flaws
But through it all, man I know you gon' stay
We poppin' like a two liter
I think I found myself a keeper
Telling you secrets knowin' you'll keep it
Never put me on blast like a speaker
Cause we so tight, it feels so right
Booty rubs through the night
Just take the stress away from a heavy day
Let's live a stress free life
Don't make me walk to the corner store by myself
Cause you gone have these niggas thinking I'm by myself
Want you around me all day like a Hermes belt
To avoid the past boys and the hurt I felt

Won me like a prize (A prize)
Never tell me lies (No lies)
When you on me side (Me side)
I feel civilized (Yeah, yeah)
Won me like a prize
Never tell me lies (No, no)
When you on me side
I feel civilized (Yeah, yeah)
Won me like a prize (A prize)
Never tell me lies (No lies)
When you on me side (Me side)
I feel civilized (Yeah, yeah)
Won me like a prize
Never tell me lies (No, no)
When you on me side
I feel civilized (Yeah, yeah)
Won me like a prize (A prize)
Never tell me lies (No lies)
When you on me side (Me side)
I feel civilized (Yeah, yeah)
Won me like a prize
Never tell me lies (No, no)
When you on me side
I feel civilized (Yeah, yeah)

Won me won me won me won me won me like a prize (No, no)
Never never never never never tell me lies (Yeah, yeah)
Won me won me won me won me won me like a prize (No, no)
Never never never never never tell me lies (Yeah, yeah)
Won me won me won me won me won me like a prize (No, no)
Never never never never never tell me lies (Yeah, yeah)
Won me won me won me won me won me like a prize (No, no)
Never never never never never tell me lies (Yeah, yeah)
Won me won me won me won me won me like a prize (No, no)
Never never never never never tell me lies (Yeah, yeah)
Won me won me won me won me won me like a prize (No, no)
Never never never never never tell me lies (Yeah, yeah)",https://genius.com/Cupcakke-civilized-lyrics
