title,album,year,lyrics,urls
Insane OG,Elephants on Acid,2018.0,"See I started as a soldier in our culture, in the shadows
My approach with every note is like I'm copin' with the battle
Every move is calculated, celebrated, no more lessons
Hit you quick, I don't get caught, I got no time for no confessions
Never move in one direction, no detection, I ain't slippin'
If you question where I'm headed, then your body comes up missin'
Bullets hissin', bodies twistin', in the ground you will get buried
Mercenary, visionary, don't become my adversary
Took the dare, I'm in a trance, when I advance the seal is broken
Send you dancin' with the Devil, holdin' metal, barrel smokin'
Hand of God, I am the rod, I am the staff that keeps you humble
I'm the hunter that you run from, I'm the lion in the jungle

I got my hand upon the gun, I'm on the run, they'll never catch me
I'm the one and only one under the sun who keeps you guessing
With my finger on the trigger, heavy hitter got you stressing
Got your blessing in my weapon, look into my Smith & Wesson
Got my hand upon the gun, I'm on the run, they'll never catch me
I'm the one and only one under the sun who keeps you guessing
With my finger on the trigger, heavy hitter got you stressing
Got your blessing in my weapon, look into my Smith & Wesson",https://genius.com/Cypress-hill-insane-og-lyrics
Another Victory,Skull & Bones,2000.0,"Get ready motherfuckers!

You can't fuck with the steezo
Please no interruptions
Your crew pull up guns get waxed in the sun
Like my rag top six-five
Smash you with the switches
The hitch is, you're gettin too big for your britches
Why you runnin like bitches
With your tail up, I'm the thug pirate
Put the sail up - your whole crew frail, what
You want this joint, suck it inhale nut
Niggas are feelin' this track in Braile, huh
We're grade A while you motherfuckers fail, what
You understand, immitators gotta bail up
To all the males and females gangin' up
All on my cell phone talkin' shit, hangin' up
I gotta show you how a nigga bang it up
Slangin' cuts

Your squad against mine
You're minor leagues with major
Detail the plans like verse
Hit hard, catch you off guard
Another Victory
Your squad against mine
You're minor leagues with major
Detail the plans like verse
Hit hard, catch you off guard
Another Victory

I slay rappers with precision
I got vision like Anakin
You panicin' I'm leavin you stiffer than a mannequin
My high lyrics constantly brain damagin'
Brandishin' a fire arm, still managin'
Hurt niggas, bandagin' who give my lyrics
That play like a mandalin
I hold my mic like my dick, but you handlin'
I kill flows on tracks who abandonin'
I eat you like pussy, then take a sample
Then spit fire in the places you standin' in
I take a fool to the Hill
Light a candle then you in the dark stuck part in the scandalin'
Now I see your whole brain's scramblin'
Don't like what you hear, change the channel then nigga

Your squad against mine
You're minor leagues with major
Detail the plans like verse
Hit hard, catch you off guard
Another Victory
Your squad against mine
You're minor leagues with major
Detail the plans like verse
Hit hard, catch you off guard
Another Victory

I spark cells of a rhythm
You best listen, get it over with
Stolen shit, rollin it, Cypress ownin' it
Bitin' niggas clonin it
I got a dog got a bone to pick, you holdin' it
Suck it hard swallow easy, put a soul in it
Your body's on the floor, head got a hole in it
The weed master, rhyme killer, mic controllin' it
You still fuckin' but your wack, ain't throwin' it
Stepped in shit, now your chillin' all alone in it
Head full of hair, still ain't combin' it
Five child in the world who's ropin' it
Never know if i'm high or i'm throwin' shit
I got you stuck in the Twilight Zone on shit
I'm the owner of the fat joint you rollin' with, bitch

Your squad against mine
You're minor leagues with major
Detail the plans like verse
Hit hard, catch you off guard
Another Victory
Your squad against mine
You're minor leagues with major
Detail the plans like verse
Hit hard, catch you off guard
Another Victory",https://genius.com/Cypress-hill-another-victory-lyrics
Lowrider (Spanish Version),UnKnown,UnKnown,"Yendo por ahi es Cypress Hill en un low low
Con la rumba que te tumba pandillero loco
Somos negros callejeros jugando juego en la calle
Sesenta y cuatro va a brincando desde aqui hasta el valle
Si vas conmigo dame un grito pon tu clica en el cielo
Rompemos todo lo que vemos mamas sueltate un pedo
Negro haz lo que quieras pa' sentirte bien
Toma algo quema algo y a freakiar tambien

Cuando la gente termine de gozar ya vez
Que olvidas a todos los demas despues
Por años conoces mi familia chacho
Yo paso por calles pare darte un brazo
Pero yo quiero quemar seguro si es microfono no
Mota no le hace el tiempo es duro
Pensaste que no pude por di­as pero sabes que entrastes
A mi casa pero no tienes fe, si no los ojos bien
Porque nunca sabes cuando me encabrono y te dejo vigilando
Quemo palabras como hierba que te fumas, oidos explotan
Como pulmones pa la mota, deje que seque, se mete, se crece
Todas mis palabras en tu mente, tienes bronca yo te dejo chueco
Y tu vida mijo no vale un peso

Yendo por ahi es Cypress Hill en un low low
Con la rumba que te tumba pandillero loco
Somos negros callejeros jugando juego en la calle
Sesenta y cuatro va a brincando desde aqui hasta el valle
Si vas conmigo dame un grito pon tu clica en el cielo
Rompemos todo lo que vemos mamas sueltate un pedo
Negro haz lo que quieras pa' sentirte bien
Toma algo quema algo y a freakiar tambien

Porque somos Cypress Hill ven a fumar loco
Metete adentro vamos ir y a pistear un poco
Ponte de lado, con tu gorra, pon tu asiento pa tras
No juegues güey con la mota dame esa mata

Yo soy el vato con Sofia Vergara en mi ranfla
Siempre con mi clica en la calle estilo mafia
Pleito ten cuidado que no te coja si te crees demasiado
Ten cuidado lucha roja
Aqui no homies que sufrimos todo eso
Agarrando la feria, vendiendo estos quesos
Ya me conoces soy chingon de mi calle
Cypress Avenida y el puro desmadre
Ya tu sabes, no jugamos esa mierda
Cualquier pendejo le partimos una pierna
Quiubo ese tu clica que se llama
Ponla en el aire como si fuera nada
Manos en el aire con soritjas y
Soul asesinos corriendo todo aqui
A todos los vatos chequeen esto
En cada barrio tengo respeto

Yendo por ahi es Cypress Hill en un low low
Con la rumba que te tumba pandillero loco
Somos negros callejeros jugando juego en la calle
Sesenta y cuatro va a brincando desde aqui hasta el valle
Si vas conmigo dame un grito pon tu clica en el cielo
Rompemos todo lo que vemos mamas sueltate un pedo
Negro haz lo que quieras pa' sentirte bien
Toma algo quema algo y a freakiar tambien",https://genius.com/Cypress-hill-lowrider-spanish-version-lyrics
Ez Come Ez Go,Greatest Hits from the Bong,2006.0,"I'm in the city of sunshine
But don't be fooled!
They say it never rains
I can tell you: ""That ain't true.""
Cause when you hustle on the streets
So that you can feed your family
Depending on what you hustle
Niggas could just kill a man!
The game of life
I'm a full-time player!
Never settle for less I keep searching
For what's greater
Inspite of any hater portrayal
I keep it moving
Never fucked anyone over
Cause it comes back later!
At the dump it's a long fall
When you hit the bottom
People remember all the attitudes
You shot 'em!
The minute you fall
You're as good as forgotten!
Thought you had it all
But it all went rotten
But no many times I have failed
I've never let anything get in the way
Of my dreams and hot spells
I stay focussed with my mind on the price
And if you try to block me
Then we push you aside!

Yeah, that's right; yo!
Hip-Hop veteran!
Gon' tell you that we better than most of these fools out here!

Easy they come when you got the dough!
It's the Hill, baby! (it's the Hill, baby!)
It's the Hill, baby! (it's the Hill, baby!)
Easy they go when you got no mo'!
Spit it real, baby! (spit it real, baby!)
Spit it real, baby! (spit it real, baby!)
C'mon! (c'mon!)
Easy they come when they want your soul!
Shit is real crazy! (shit is real crazy!)
Shit is real crazy! (shit is real crazy!)
Easy they go when yo' shit gets old
Shit is real crazy! (shit is real crazy!)
The game is so shady lately! (the game is so shady lately!)

This business ain't nothing
But a series of comebacks (comebacks!)
Write you off as dead 'til you
Come back with a bomb track! (bomb track!)
Man you got to save food
Cause they said you washed-up (it was washed up!)
Even if your prays nothin'
All over your hot stuff! (all over your hot stuff!)
That's right I believe in myself and my talent (that's right!)
Skills have been diminshed; motherfucker
There you have it! (there you have it!)
You got to learn the game
Master every angle (master every angle!)
Like a zen master runnin'
The triangle! (runnin' the triangle!)
Just when they think
That you're all dried up (you're all dried up!)
Surprised that they asked when
The back don't cut! (when the back don't cut!)
All around the globe
Keep a silent fan base, (shut up!)
Hip-Hop icon -
Tell you what it takes! (tell you what it takes!)
Patience, persistence. -
Perseverance! (perseverance!)
Know it in your song, they gon' love it
When they hear it!
 the career been down
And  for years!
Nobody's takin' me out;
I'll decide when I'm outta here! (I'll decide when I'm outta here!)

That's right y'all!
EZ come EZ go!
 Cypress Hill, dog!
We takin' it forever, G!


I got love for every fan
Ever part of the plane
So while you can take some pictures
And sign some autographs
Share a couple of hits
Of my kush  is you should ask
But if you push!
Then I put my foot in your ass!
Not many in this game would
Last so long
So they can get what they can
Before the time is done
People are gona stay with you
But you must never mislead them
But if you treat them wrong
Lead them on they'll say: ""We don't need you!""
Then it's back to
The streets to square one
Now you're screaming:
""This ain't fair!"" Yeah
But nobody cares!
You had the money and the cars
Big house and pearls
Jewels and hot beats
So that you could spit out words!
So much time and emotion invested
From being on top;
Nigga, can't get arrested!
EZ come, EZ go;
When they forget who you are
Forget you were star
Forget you in every regard!

Yeah!
My maaan... still comin' at-chaaaaa!",https://genius.com/Cypress-hill-ez-come-ez-go-lyrics
Clash of the Titans,Cypress Hill IV,1998.0,"""Make certain that no stone stands
That no creature crawls
I command you to let lose the last of the Titans""
""It's time to strike!""

Let the rain pour down from God above
With the blood of my blade, no love, begin the flood
Open the gates, let the battle begin, wherein
With wind at our backs, ready for any attacks
Sound the horns, prepare for war, begin the storm
The flaming arrows hitting your body, keeping you warm
With the uniform of my sworn enemies
You raped and pillaged my city, and spread disease
Feel the sword of the warrior's wrath, the path you take
Can lead to the math that the master's break
The clash of the titans, are you frightened of loss
Fighting with the cause to free, you and yours, and God's law
Look in the stars, aligned with sign and Mars
Destruction, what's your function, you roll with God

""Attention""
""Attention""

The soul of the master's elements, disaster
Breaking ya faster, transmitting the broadcaster
The blade swings, slashing your throat
The vision's on the mission, seeking the note
Dropping the bomb, by remote
Load up the cavalry's, no salaries, the keys
The life's memories, strife bringing the thieves
Cut the heads off, hide in the loft, don't even cough
Or breath, pay the cost, moving your life's lost
Let the spirit reunite, with your weapon, you wanna fight
Hear the sound of the warriors stepping into the night
The eye in the sky, looking to punish ya, never hide
No cover to shelter your life, the souls begin to rise
And to clash

""Attention""
""Attention""

God's enemies, fall in upon, the knees crawling
Beheading the dead souls, who runaway from their calling
Behold, the white horse, remorse, never the case
Every corner of the world, the battle is taking place
Let the war drum set the pace, you face fire
Resume, from the Temple of Boom, and seek higher thought
Maybe you live, or maybe not, the blade's hot
Many renegades ready for battle, die on the spot
With one shot, one whole city becomes rocked
The clash rages on, people remain calm
Good, bad, all in the balance, you going mad
You can never tell, heaven or hell, the blood shed
And it's all around, you can't run, sit in the cell
When the war's over, the light will shine, covering the spell
Celebrate now, put the blades to rest
No wickedness, only the blessed will hold down

""Attention""
""You creating hysteria""
""Attention""
""Attention""",https://genius.com/Cypress-hill-clash-of-the-titans-lyrics
Another Body Drops,Till Death Do Us Part,2004.0,"You ready holmie?
Yup

My first mission runnin' through the head to smoke jack
With memories poppin' in my head recall that
Late night creepin' through the alley with six deuce
Strapped up everybody focused no mixed views
A sawed off pumped in my hand with two shells
The other four holmies on the scene with cocktails
One nigga lookin' for popos and foes hell
Someone lookin' through windows the door bells
Goes off followed by the punk you gas bomb
Adrenaline pumped up still I remain calm
House lit up you could see it for eight blocks
Runnin' through the hood run in front of the fade cops
The game chase but they couldn't cover the streets up
Rolled out ran into the spot to meet up
Strapped down covered up the tracks and back home
Laid low earned me a stripe perfect no

Shoot 'em up
Bang bang
Another body dropped
You can't stop the head nod
Soot 'em up
Bang bang
Another body dropped
You can't stop the hip-hop
Shoot 'em up
Bang bang
Another body dropped
You can't stop the head nod
Shoot 'em up
Bang bang
Another body dropped
You can't stop the gunshots

Yeah I'll hit your block up better lock up
Fuck the gang and shit don't stop uh
A mad dog with a bob in the reagle
Go into mode and just kill all your people
Coast to coast ain't a nigga more evil
Now made me act a lot and call Sen Diesel
Rock the block with the M one six
.44 mag like a east war fit
This here granadilla break you off right quick
Be prayin' up to Jesus and all that shit
Uh niggas be jackin' when they see my bucket
Roll down they block they hide and say fuck it
Come back in form of an assassin
Three hundred yards with the infrared action
Troop is the layer black Doc Holiday
Cuancho raider the modern day huh

Shoot 'em up
Bang bang
Another body dropped
You can't stop the head nod
Soot 'em up
Bang bang
Another body dropped
You can't stop the hip-hop
Shoot 'em up
Bang bang
Another body dropped
You can't stop the head nod
Shoot 'em up
Bang bang
Another body dropped
You can't stop the gunshots
Yeah, now shooting up your town. Them bad ass assassins, boy. Thought you knew. Check this out, you better be packin', fool. Hyeah

I manned all missions when I was a youth so thoughtless
G ride no fingerprints it's spotless
Six bows hittin' all the Gs and we got this
Rag top down like a stripper that's topless
See me hittin' the corner you meltdown
Slugs fly thugs die moment ya fell down
Somebody's screamin' you hangin' the hell down
I'm certified nigga when you're sittin' there spellbound
No thoughts barkin' just hearin' the hellhounds
Burn you with the heaters spittin' out twelve rounds
It's life in the hood no escapin' the gunplay
Buy one day I'm out gotta figure out some way
Rats in the park all scatter when guns spray
Got you locked in now where do the slugs stray
I found ways out but the street be one way
Got a dark mind no thoughts blacker than Sunday

Shoot 'em up
Bang bang
Another body dropped
You can't stop the head nod
Soot 'em up
Bang bang
Another body dropped
You can't stop the hip-hop
Shoot 'em up
Bang bang
Another body dropped
You can't stop the head nod
Shoot 'em up
Bang bang
Another body dropped
You can't stop the gunshots",https://genius.com/Cypress-hill-another-body-drops-lyrics
Can’t Keep Me Down,Cypress x Rusko EP,UnKnown,"(Intro)
Cigarette is banned from these premises
But don't be afraid to smoke the high grade
(Rusko)
Now where was written that I would be another killa spitting
That I was born to be the Buddha king and your my witness
We blow trees better believe we taking care of business
Hit the kush, brains mushed tastes so exquisite
I pay a visit within sub-conscience*
Thoughts and listen
You see a vision collect your nine times optimistic
Medicate don't hesitate form n twist it
But if ya try to send my sock boy we go ballistic
They call me Doctor the party rocker the scientific
Warlock with a tigers blood I fuckin mystic
Animalistic with beautiful minds self admitted
Fathered a style then so many bitches counterfeit it
20 years grindin it out blood, sweat and tears
I was supposed to be the lost one but had no fears
Hit the gas, taking lanes then switching gears
Whatever the path is concentrate on what you hear
I live amongst the clouds
Only the most high is above me
No One Can Keep Me Down
My roots are in the streets
An the streets will always love me
So No One Can Keep Me Down
(Cypress Hill)
It was written
The dogs gonna go the distance
Off the leash
Terrorising the streets
Your styles bitten so stop the counterfeiting
We the first ones that rapped for that marijuana leaf
Your staring at your feet
While im staring at defeat
Ride in its sides it's success or demise
I keep Cypress Avenue fresh on the mind
You know I made it out the ghetto one step at a time
I live amongst the clouds
Only the most high is above me
No One Can Keep Me Down
My roots are in the streets
An the streets will always love me
So No One Can Keep Me Down
(Rusko)
Cross the line in the town to be
Cypress Hill keeps it incase they fail to see
Big guns and bullets
We pulled in to spray
Then smoke a big ass joint and call it a day
That's how the dog roll leavin haters jaw throwed
Violators get rolled
Kush and jack yeh that's a killa combo
Messed up side show tripping up the room doors
I live amongst the clouds
Only the most high is above me
No One Can Keep Me Down
My roots are in the streets
An the streets will always love me
So No One Can Keep Me Down",https://genius.com/Cypress-hill-cant-keep-me-down-lyrics
Dead Men Tell No Tales,Cypress Hill IV,1998.0,"Pam pa ra ra
Pam pa ra ra
Pam pa ra ra
Pam pa ra ra

Any die, if the beholder the soldier begins to bore
Four score, seven bullets (Yeah hit the floor nigga!)
Take you outdoor, darkness frightens you even more
I'm here to enlighten you, with the hardcore
Bring it raw, like the red, dead meat, in your plate
And I'll fill you up with the energy the Hill create
I gets sticky, like a green bag of the bomb diggy
Now I'm fuckin with your head, and you realize that it's tricky
Got you paranoid, feeling the void, you can't take it
The reward bein destroyed, freakazoid toy
With ya mind, all styles deployed, you find danger
In the stranger's eye, the killin comes second nature
Your battle filled up the mind it's fallin out, hear you callin out
For help, and all the fuckin yellin to is yourself
Crawlin and beggin for mercy means nothing when you bluffin
I'm pushin the button
And straight dumpin on fools frontin

Boo-yah!... come on, motherfucker

Pam pa ra ra
Pam pa ra ra
Pam pa ra ra
Pam pa ra ra

War pigs, you dig, see kickin out Mr. Big
Take a sip of wine, engage in a battle of the mind (Checkmate motherfucker!)
You feelin the force, meant for remorse, right from the source
Your head is, gettin fucked and I'm skippin the intercourse
Behold, the Mic Horse, you're takin a loss nigga
Got the Nina Ross, don't need no cross, my fuckin paper
Chaser green bag gladiator, terminator weed germaniator
The greater the risk you fuckin hater
Hit you with the pyscho beta, clickin the fader slow
With the Hi-Lo, servin the blow, who got the glow
Dead men tale no tales
, you fail to see the reason
I'm easing to squeeze the trigger, go figure, it's killin season

Nighty-night, mothafucka

Pam pa ra ra
Pam pa ra ra
Pam pa ra ra
Pam pa ra ra
Pam pa ra ra
Pam pa ra ra
Pam pa ra ra",https://genius.com/Cypress-hill-dead-men-tell-no-tales-lyrics
Red Light Visions,Cypress Hill III: Temples of Boom,1995.0,"""(Inhales) Break that shit off nigga""

Look at all the M.C.'s trying to get down
But all you get is a peeled back, dome cap
I'm not the one to be having that shit
All these punk niggas better bow down and submit
Niggas don't know how to ""keep it real""
Only if you niggas know the real deal
Fuck all the bullshit, Cypress Hill
Comes raining on your brain
Bringing the blood stains
Smeared on the sidewalk, one mark dome
Of the prejudiced skull, hanging in my home

""Straight to you dome sucker
So what you wanna do fool""

The Big Game hunter, fucking shit up
Get your ass back while the Hill's on the cut
Who'll get in the circle, let's see if you're raw
Hardcore, last vato might hit the fucking floor
Glocks and sigs and M1 clips
For any buster who wanna flip
Fat ese ring shining in your eye
Soul of an Assassin, until I die (Por vida ese!)
Red light visions in your dome piece
Nightmares running through your head, won't cease
Look at you now, broke down and done
No competition can ever get none

""Straight flip-flop, nigga, flip-flop
On your punk ass until you drop
(Cypress Hill, coming at your grill)
You're nothing but a motherfucking time clock
Cypress motherfucking Hill
(Fuck how you feel)
It ain't but another piece to the puzzle fool!""",https://genius.com/Cypress-hill-red-light-visions-lyrics
The Funky Cypress Hill Shit,Cypress Hill,1991.0,"I came to introduce a new type of juice
Stuff I invents to make you feel real loose
No you don't drink it, just let it sink it
Then start feelin' it (The Funky Cypress Hill Shit!)
People ask, ""Why do you sound so funny?""
They must be talkin' bout my funky nasal vocal money
I take control, no need to blow my nose
Just click on the chumpy and feel the funky flows
For you and your bros, him and his ho's
You don't like it? Here's my dick— bite it
There's nuttin you can do about the real one
It's a ill sum with the ill juice, I'm The Phuncky Feel One
Sen'll Psycobeta, blast ya if he hasta
Tell em Sen (I'm the Psycobeta master!)
Strikin' ya (hittin' ya) buckin' ya (fuckin' ya)
Like my buddha plant boy, I'm gonna keep pluckin' ya
Pickin' ya, then I'm gonna roll you up and light ya
Despite your fool ya sight to take my joint
To get to my point, I'm talkin' about a ill trip
The Funky Cypress Hill Shit

 The Funky Cypress Hill Shit!
 The Funky Cypress Hill Shit!
 The Funky Cypress Hill Shit!
 The Funky Cypress Hill Shit!

Let me tell you what happens when you squeeze, you're juiceless
You can't get loose, so now you're useless
Can't feel the funk so I guess I'll pump the wrist
How bout this ma kiss my blunt?
Right into ya, now you're feelin', the chemicals vibin'
Are you realizin', that it's gettin' better?
Surprisin' you, whether or not, your shit's together
From the high-pitched levels (comin' from my ""huevos"")
Cypress Hill imported it, boiled it in steam
But yo everything ain't what it seems
Cause the Cypress Hill material luxurious superior
Glory or memorial, historical physical
Ingredients, gettin' that immediate blend
Yo Sen take aim, and let the juice now extend
(Yeah I'm still comin' atcha, but you don't need to duck down
Cause this is somethin' different than a Psychobetabuckdown!)

 The Funky Cypress Hill Shit!
 The Funky Cypress Hill Shit!
 The Funky Cypress Hill Shit!
 The Funky Cypress Hill Shit!

 Kick that shit B-Real!

Intellect filthy en lingo
Dissed you, I control elements, suck on slow
(to get you all jazzed) from here to Tallahassee
This ain't Florida, so put away the O.J
Never in your life will you wet this
This crazy business, now you're thinkin' ay que pinga
Tremenda, re cinda it's good like some cheeba
The formula will run ya I'll start takin' up a list
So you can get blitzed and you feel your head's twisted
Now insisted, you fill it to the brim
Yo I ain't him, I could never be them
This ain't poison, so let's go out on a limb
For the boys and girls who haven't had it yet
If you get too much, and roll it too straight, oh
It's a fatal blow, somethin' like a K.O
Yeah it'll sting ya fria cojones
See ya, I'm on it, somethin' for the blunted
Just what you wanted, so you can feel the high
Smokin' the buddha thai
Lungs expandin' and now you're feelin' it
Yeah, the funky cypress hill shit!

 The Funky Cypress Hill Shit!
 The Funky Cypress Hill Shit!
 The Funky Cypress Hill Shit!
 The Funky Cypress Hill Shit!",https://genius.com/Cypress-hill-the-funky-cypress-hill-shit-lyrics
Ultraviolet Dreams,Cypress Hill,1991.0,"Ultraviolet dreams
Take a hit of that stuff
Ultraviolet dreams
That's some good shit man!
Stuff should light now
Oh that shit's good man!
Ultraviolet dreams
It's like the biggest joint man
(Oh no!)
That's the hook up!
Ultraviolet dreams
Hook up, this is!
(Pass that shit homie)
Pass it around
(That stuff right there)
Ultraviolet dreams
Órale!, hey I'm holdin' it
Let me see that
Ultraviolet dreams
That's some good shit man!
God damn!
Feed me
That's some good shit
*inhales, exhales*",https://genius.com/Cypress-hill-ultraviolet-dreams-lyrics
