title,album,year,lyrics,urls
Ready to Die,UnKnown,UnKnown,"Are you ready to die, ready to die, tell me
I see your look in your eye and its deadly
Better pray to the sky and get ready
When you decide come on tell me

You got a choice in life with a fork in the road
Got your back turned with your eyes closed with a blindfold
When you open them up there's a signpost
Enter at your own risk better find out where your home is
Some chose the streets livin a life outlawed
Doubt you'll see me spittin'my game southpole
Careful with the choices you make
You gotta live with them, can't you hear the voices you hate
How do you deal with them
Some took another path felt they own wrath add drugs to the math
Cut the life spans in half from deaths to cold sweats
To soul lets go into the abbys
We are gonna miss you yo


I put my fist up I ain't gonna hit you nigga
I got no regrets I ain't gonna diss you nigga
I just pray for you even though you're hard headed
You made your own bed and I hope you don't get wetted
I took the wrongsteps too but I learned from them
I drew heat from my niggas like the burning sun
But like all lessons I need a self check I still got my strap
But now I use my brain as a weapon
Could have stood left chose death no bread underfed
All these niggas spraying lead pushing on me laying dead
This ain't gonna happen yet bitches I'm a fucking vet
If you're coming for my head you can get a slug instead
Every nigga something something dues are they even fucking paid up
What do you say to all the haters writing in the fukin papers
Homie wake up or we take up all the ground that you can't make up",https://genius.com/Cypress-hill-ready-to-die-lyrics
Marijuana Locos [Spanish] by Cypress Hill,UnKnown,UnKnown,"Uno pal cerro
Ocho pal maton
Siete pa tu muerte
Por k el sur es el mas chingon
No dejo de cargar mi fusca
Donde sea que yo voy
Por que me kieren quebrar
Soy el vato mas conocido
Nacido vandido
Sede no te metas conmigo
Solo ven si quieres pleito
Los putos nunca vienen
Nomas hablan detras de las espaldas
Saco el cuete por que hablas chingaderas
He se te acabo todo ese
Un vato muere y si tu
Que eres pedo por lo mismo quedaras en el ataul
Y que te queda
La fusca te lleva
A la muerte mas rapido si eres leva
Una vez ese
Cypress hill
Que lo vaz a hacer
Ja! (2)
Cypress hill te arrevata feria
Quita feria
Viajando directo en avion a sudaamerica
Respirando marijuana
A doce mil pies me eleva
A cuarentamil
Donde estamos aterrizando
En un lago escondido y alejado
Directos al estadio ullendo
De lugar en lugar destrullendo
Una vez ese
Cypress hill
Que lo vaz a hacer
Ja!
Donce que este es el que sigue
Pachele se enciende
Y dile de cual eres
Dejan a la clika seria
Quebran perros ustedes lokos en miseria
Seria mucho decidir
Komos en el pecho
Y me vo a morir
Putos descansen en violencia
Eternidad solo va a parar
Una vez ese
Cypress hill
Que lo vaz a hacer
Ja! (4)
---
.",https://genius.com/Cypress-hill-marijuana-locos-spanish-by-cypress-hill-lyrics
Armed & Dangerous,Rise Up,2010.0,"Ready? set, go! I'm ready to run
Steady we get though, under the sun
About to let go, show me respect though
It's gon' be a fat joint. - Soul - in your mental
We came from the bottom and rose to the top
Like the cream in your coffee - burning hot
Climbing the Billboard for the number one spot
King of the block - stop for a second to watch
Look and learn and loose your knot
No more bottles to pop, no birds in the drop
But - we still rollin'! (we still rollin'!) - Pocket's swollen. (pockets swollen!)
We're locked and loaded, then the scene exploded
We solid as ever on any endeavour
Cypress Hill forever, doesn't get any better!
We - came and saw. - And conquered it all
We're hungry for more like the kids in Darfur

We live hard, still armed and dangerous
We young love, be alarmed, don't play with us
Play the song, gotta bounce just to stay with us
Come along, hit the bong and blaze with us

I'm the dog and I'm undisputed and you've been recruited
I'm the general that your boy saluted
Give you a minute to see how we do it
You've never seen such finesse cause you're so polluted
I'm the king in this area hombre
Knocked 'em out the park when I'm standing on home plate. (c'mon!)
So many years of blood sweat and tears
Without me the dogs stay switching the gears
But I'm still the same man from back in the day
And I'm still gettin' luck from Africa to L.A
.Jake One hit play; burst started to sway
Every time I leave the city fools want me to stay
'Cause they stay loyal, so it's harder to go
And like the lights. - I got's to grow
That means I'll roll (I'll roll!) but I'll return later
Give props to my peop (le), and buckshots to haters (buck, buck)

We live hard, still armed and dangerous
We young love, be alarmed, don't play with us
Play the song, gotta bounce just to stay with us
Come along, hit the bong and blaze with us
We live hard, still armed and dangerous
We young love, be alarmed, don't play with us
Play the song, gotta bounce just to stay with us
Come along, hit the bong and blaze with us

Raise your hands in the air like you're supposed to
And everybody scream like you're on a rollercoaster
We're down - with the Costra Nostra
We smashing! - We sick jackin' and the Soul Assassins
The Hip-hop culture - we fuck you both
Just as you caught in the rapture. - All I hear is laughter
In a year's time some of you punks, won't matter!
Let's see - if you can hang if you can climb the ladder
You ain't a rapper, you're a fucking joke
A one-shock hack on a track, get your pass revoked
I got keys to the city and we locking you out
We come hard for the paint and I'm blocking you out
So run for the hills and hide in the can
We just put the mic down and be that fan
With your petty hands outside the lobby
I'm a pro, get my signature, this ain't no hobby

We live hard, still armed and dangerous
We young love, be alarmed, don't play with us
Play the song, gotta bounce just to stay with us
Come along, hit the bong and blaze with us
We live hard, still armed and dangerous
We young love, be alarmed, don't play with us
Play the song, gotta bounce just to stay with us
Come along, hit the bong and blaze with us",https://genius.com/Cypress-hill-armed-and-dangerous-lyrics
Jack You Back,Skull & Bones,2000.0,"(*Yes y'all - cut and scratched*)
(B-Real)
You're a lost soul rollin down the street
Hustlin, scramblin, money you eat
You wanna jack somebody, never look at me
Cause I'm like you when I'm holdin heat
You don't want to think about re-percussions
Cause you don't give a fuck about who you rushin
So what you gonna do when the blood is gushin?
You're playin Roulette without the Russian
The stakes are high; can you feel the pressure?
Lookin at the club on top of your dresser
Born for the big bank robbin your own
Thinkin your stone but your weak ass throne
Bitches like you ain't got no heart
Paranoid, you're settin in, fallin apart
How many times will you take to see it?
You fallin away, but you don't believe it
(Chorus: B-Real & Sen Dog)
Jack me and you'll never go back
Jack me and I'll jack you back
Where y'all bitches got the scheme or the stack?
Jack me and I'll jump to attack
Tell me what started a scheme at ya lap
Jack me and I'll jump to attack
Jack me and I'll jack you back
Jack me and I'll jack you back
(Sen Dog)
Clothes are settin off from the start
I'm crazy as fuck just like 2 Pac
Mash on Cypress Hill in a Catalac truck
Steels all gone, so I gotta play it ruff
Got hate for do out there, I ain't jokin
Can't hold me back these days, I'm out smokin
And I still see myself as Enforcer
Knock em in their face if they dedicate closer
A Cuban massive man (Spanish)
With real attack touch straight, from the ghetto
Walk for a twenty all day like a (Spanish)
Spit ball; lick all rhymes just like (Spanish)
I run over fools like Dorsey Leathers
And murder antiques like J-Rhyme I kill peasants
Take over ships like Female Kastro
Do anything that a nigga HAS TO
(Chorus: B-Real & Sen Dog)
Jack me and you'll never go back
Jack me and I'll jack you back
Where y'all bitches got the scheme or the stack?
Jack me and I'll jump to attack
Tell me what started a scheme at ya lap
Jack me and I'll jump to attack
Jack me and I'll jack you back
Jack me and I'll jack you back
(Jack you back, jack you back)
(B-Real)
Lights are fucked up it's confusin
Look at you now what road you choosin
You'll never be a part of the revolution
You fuck with me, feel the retribution
Punk bitches can never deal with the real
Cause you weak motherfuckers can't decide what you feel
Always poppin shit and hide from the Hill
Comin out where you reside for the kill
(Sen Dog)
Knocked out Pluto, Super Hill thriller
Verbal assault, Soul Assassin killer
Real master Mic, ca, sex come iller
Stoned is a waste over, what you feeler
Can't make moves so you go ask Chiller
Try the Real Estate trust centipede riller
Bet your ass that I'm bangin to the fullest
And don't get in my way punk ass, not a Buddhist
(Chorus: B-Real & Sen Dog)
Jack me and you'll never go back
Jack me and I'll jack you back
Where y'all bitches got the scheme or the stack?
Jack me and I'll jump to attack
Tell me what started a scheme at ya lap
Jack me and I'll jump to attack
Jack me and I'll jack you back
Jack me and I'll jack you back",https://genius.com/Cypress-hill-jack-you-back-lyrics
Catastrophe,Stoned Raiders,2001.0,"(B-Real)
I slay punks who don't know their own identity
You spit my name and use it like an obscenity
You got more skulls in your closet than a Kennedy
You on my nuts so you better hold tenderly
I can tell you what's crackin' and done get splitten
You corrosin' on the floor, shaken and snake bitten
You in a cold sweat like James of the names you knew
Don't mean shit to me and you ain't got a clue
Of what's about to happen - interaction
Two worlds collide - one survives the reaction
Hold tight, keep yourself together
Cause we're about to storm you like shitty weather
(Chorus: B-Real & Sen Dog)
(B-Real)
I can see what you see what you asked for it has to be
You set yourself up for catastrophe
(Sen Dog)
Set yourself up for catastrophe and that's the only way that is has to be
The whole damn world is mad at me
But I don't give a damn, I'm just glad to be
All pain and the fame a society, actuality, it's a formality
How can I say: ""You ain't shit to me""
Without you takin' it personally
(Sen Dog)
Ten, proper years of bringin' funk
I, still count mine, it's hella gettin' over the hump
I got the loads on the skull, I got my hand on the pump
Still got the boss to go nutty on you punks (yeah!)
I don't wanna be the King of the Sing
Just a Soul Assassin for the Cypress Team
I rhyme and sing and make bitches scream
They love that old South Side gangsta lean
Call the Psycobeta, I guess you're crackin'
Turn into Mad Dog when I start rappin'
Look at hostile - ah, damn wild
Shake you up in a hurry from the voodoo child
Don't get caught up hangin' on the mortar
Hold on and I'll turn y'all punks all wild
(Chorus: B-Real & Sen Dog)
(B-Real)
I can see what you see what you asked for it has to be
You set yourself up for catastrophe
(Sen Dog)
Set yourself up for catastrophe and that's the only way that is has to be
The whole damn world is mad at me
But I don't give a damn, I'm just glad to be
All pain and the fame a society, actuality, it's a formality
How can I say: ""You ain't shit to me""
Without you takin' it personally
(10, 9, 8, 7, 6, 5, 4, 3, 2, 1, come on!)
(B-Real)
I'm tired of whack rappers and fame seekers
Like you know the deal to be in my same sneakers
I don't mind exposin' you hollow bitches
I got the medicine over the swallow bitches
You play roles like an actor but get no oscar
Gun spray, gunned away, cut from the roster
You're just an imposter, you lost your composure
Respect your exposure to bring you to your closure
But you're in denial and still remain vile
In a place within last style and senseless wild
I take you down the long trail you failed to keep up
That's when you get introduced to the street sweeper
(Chorus: B-Real & Sen Dog)
(B-Real)
I can see what you see what you asked for it has to be
You set yourself up for catastrophe
I can see what you see what you asked for it has to be
You set yourself up for catastrophe
I can see what you see what you asked for it has to be
You set yourself up for catastrophe
I can see what you see what you asked for it has to be
You set yourself UP FOR CATASTROPHE!!!
(Sen Dog)
Set yourself up for catastrophe and that's the only way that is has to be
The whole damn world is mad at me
But I don't give a damn, I'm just glad to be
All pain and the fame a society, actuality, it's a formality
How can I say: ""You ain't shit to me""
WITHOUT YOU TAKIN' IT PERSONALLY...",https://genius.com/Cypress-hill-catastrophe-lyrics
Clash of the Titans / Dust,UnKnown,UnKnown,"Zeus:) Make certain that no stone stands
That no creature crawls
I command you to let lose the last of the Titans
It's time to strike!
(B-Real)
Let the rain pour down from God above
With the blood of my blade, no love, begin the flood
Open the gates, let the battle begin, wherein
With wind at our backs, ready for any attacks
Sound the horns, prepare for war, begin the storm
The flaming arrows hitting your body, keeping you warm
With the uniform of my sworn enemies
You raped and pillaged my city, and spread disease
Feel the sword of the warrior's wrath, the path you take
Can lead to the math that the master's break
The clash of the titans, are you frightened of loss
Fighting with the cause to free, you and yours, and God's law
Look in the stars, aligned with sign and Mars
Destruction, what's your function, you roll with God
Attention (2x)
(B-Real)
The soul of the master's elements, disaster
Breaking ya faster, transmitting the broadcaster
The blade swings, slashing your throat
The vision's on the mission, seeking the note
Dropping the bomb, by remote
Load up the cavalry's, no salaries, the keys
The life's memories, strife bringing the thieves
Cut the heads off, hide in the loft, don't even cough
Or breath, pay the cost, moving your life's lost
Let the spirit reunite, with your weapon, you wanna fight
Hear the sound of the warriors stepping into the night
The eye in the sky, looking to punish ya, never hide
No cover to shelter your life, the souls begin to rise
And to clash
Attention (2x)
(B-Real)
God's enemies, fall in upon, the knees crawling
Beheading the dead souls, who runaway from their calling
Behold, the white horse, remorse, never the case
Every corner of the world, the battle is taking place
Let the war drum set the pace, you face fire
Resume, from the Temple of Boom, and seek higher thought
Maybe you live, or maybe not, the blade's hot
Many renegades ready for battle, die on the spot
With one shot, one whole city becomes rocked
The clash rages on, people remain calm
Good, bad, all in the balance, you going mad
You can never tell, heaven or hell, the blood shed
And it's all around, you can't run, sit in the cell
When the war's over, the light will shine, covering the spell
Celebrate now, put the blades to rest
No wickedness, only the blessed will hold down
Attention
You creating hysteria
Attention (2x)
(Dust)
When people stare at the scene like a machine of the team
Looking for theme between cracks searching for cream
Physical image can never be lost
Never be cleverly read or took on into the search of your own
Suckers are looking for treasures and pleasures endeavours images of plastic
Material whenever your ready your steady rolling with deadly and friendly
Territorial glorious story you've heard nothing but bull for me
Coming from ghetto the güero the heart in the metal
Settle for gas as we passing you fast in the pedal
Head to the floor and the horror is starting to pour
Everything I just threatened your blood you can't take it no more
Why did you try to forget it I said it to FUCK OFF!!
Now you'll be headed said I'm making you try to do laws
That's what you get for faking it hot and no more
Living I'm sucker I'm pushing the bomb
(Chorus:)
Do what you want do what you need the hardcore
Breaking the law the new seed yes they want more
Cypress Hill Soul Assasins we smokin 420 all day
We ain't joking serve it up oh yes and the hard stuff
Excess of the zes make it sound right beat it up all you want
It's a damn right get up in my way I'll cross your ass like dust
???? is loaded with snakes serpents who come and they take
Pieces of those who they break bodies are found in the lake
Only the victims its pass you thought that you gonna last
Pockets all over the cash now that you're actually grass
High kids taking and sliping away
Look at you tricking and sipping its clicking the trigger
And so is your place
Only the strong will survive hoping to keep 'em alive
I'll never be denied watch on who you can find
People around and they're proud looking for those
Who obye dying like these killas defy so I keep up the withdrawl
Join fucking with the pace your just a waste in my face
Hit you in base in your case if all you want is a taste
Even the lemo the rebel bringing the metal in temple
So many rebels incredible time we battle
Looking for action don't judge us avenge us redempt us
Don't give me negligence your all though in time no revenges
(Chorus:)
Do what you want do what you need the hardcore
Breaking the law the new seed yes they want more
Cypress Hill Soul Assasins we smokin 420 all day
We ain't joking serve it up oh yes and the hard stuff
Excess of the zes make it sound right beat it up all you want
It's a damn right get up in my way I'll cross your ass like dust
Under the heavens we representing directions of flesh and feeling the heat
The tension now dissin' we stressin'
Life is a battle to the cattle you gonna die
Just how that'll just suffer your glad you built up your high
And go up the chain the pages keep turning and burning
The rage is concerning the day is becomming disarming
Searching for harmony you wanna be balling me
But you never get no where cause I'm killing your whole philosophy
Robbing like temperature I signal your flow when we just clowning
Just tell me just pass me watch me I'm truly tampering y'all
Must be simple delinquent to try to get what the sick is
So leave the hard is to limp it and only the thrill will we get it?
I'm an assasin of soul out of control when I roll
You better hide in your hole I got your name on my skull
There ain't no running from me assasin of hunees you see
Blastin at those who obye blasting at last at the weak!
(Chorus:)
Do what you want do what you need the hardcore
Breaking the law the new seed yes they want more
Cypress Hill Soul Assasins we smokin 420 all day
We ain't joking serve it up oh yes and the hard stuff
Excess of the zes make it sound right beat it up all you want it's a damn
Right get up in my way I'll cross your ass like dust",https://genius.com/Cypress-hill-clash-of-the-titans-dust-lyrics
Rise Like Smoke,Rise Up,2010,"I'm a go hardcore what I believe in
And NO! - I'm not gonna slow down!
They try tell me what it is what I can or can't be
I gotta family that I gotta hold down!

So I'm gonna rise like - smoke!
So I'm gonna rise like - smoke!
So I'm gonna rise like - smoke!
'Till the day they put me underground!

I gotta break these chains. - Take these reins!
Ignore these pains; no pain, no gain!
I gotta hard move like like a muscle car
Get ahead of the pack. - Hit like a double-R!
I never loose sight, only to too tight!
Only to get away - too many will lose right
Kill right now you got your head in the clouds
Screaming your name! - Nothing can bring you down!
Everybody got a dream; hurry up and go get it!
'Till it gone;  and gone!
You singing the same song. - You ain't in tune!
Tellin' yourself - ""I'm gonna get mine, soon!
It's a race to the limelight - and the pack is running
Can you keep up and tell us that you want it!
When you get it tell us what you're gonna do with it (do with it!)
'Cause I got mine, I'm a show you how to move with it!



Still lookin' for the gusto, desirin' to hustle!
Deep on the street with Soul Assassin muscle!
Still motivated! (MOTIVATED!) - Still upgraded! (STILL UPGRADED!)
Still updated and always on fated! (AND ALWAYS ON FATED!)
Thought we come again? - Watch we roll up
With the real channel 13 stone us!
Never rest! - Gotta keep moving!
Anything less put my shoe in it!
What you want holmes? - Yeah, we got some!
Best believe it's the motherfuckin' box, son!
I'm still hungry but that's the sex!
Ain't done yet like broadway brick!
Ain't no question, that's why I'm a threat! (I'm A THREAT!)
I'm getto raised right out the projects! (PROJECTS!)
Now you know that I'll be done when I wanna go (WANNA GO!)
And for real until that Death thing come and go! (COME AND GO!)




When the lights go on and the mic turns on!
Find someone it's so live, it's wrong!
You wanted more then your typical common hit
Feels good when the fans bounces kinky shit!
Right after the show, after the flow
On the grounds in the back then get out the door!
Look the shorty is! - She wanna ride with the band!
She screamin': ""Guys I'm your biggest fan! ""
Runnin' through. - Whatever she can
And she's - lookin' at you like a bride in day
She's - sweatin' hard, she won't resist
When you ask: ""Why? "" She plays just like this:

I'm a go hardcore what I believe in
And NO! - I'm not gonna slow down!
They try tell me what it is what I can or can't be
I gotta family that I gotta hold down!

So I'm gonna rise like - smoke!
So I'm gonna rise like - smoke!
So I'm gonna rise like - smoke!",https://genius.com/Cypress-hill-rise-like-smoke-lyrics
No Pierdo Nada (Nothin’ To Lose),Los Grandes Éxitos en Español,1999,"Cypress Hill feat. Mellow Man Ace
Miscellaneous
No Pierdo Nada (Nothin' To Lose)
Cypress Hill feat. Mellow Man Ace
No Pierdo Nada (Nothin' To Lose)
Juega con las reglas o si no te rompo
Bien apretado estas en mi luz
Si vienen los puercos te pongo en una cruz
Nada que hacer nomas esconderte
Entraste, tu pacas siendo tu viente
Cuando conviene esto me da sabor
Si estas en mi camino te enseño mi calor (ahh!)
La pongo en la mesa laten las tijeras
Raperos son esclavos de compañia disquera
No puedes perder, nomas escoje
Un grupo de matones que no son ladrones
Has lo que tiene que ser y no te rompas
Cuida la salud y comparte con las compas (compa)
Ten cuidado, con la pista
Si estas en la loma usa tu vista (vista)
Que se cuenta? que soy cuento...

Te doy mi todo, no pierdo nada
Pasa que ayer, el tiempo se acaba...

Te doy mi todo, sabes como soy
Me meto a tu cabeza, te destruyo hoy
Agarro mi pluma la meto en tu cerebro
No voy a parar hasta que quedes muerto
Estoy en mi zona corro y te destuerco
Pongo en un palo a cocinar, dia de puercos
Yo soy el loco, agarro una foto
Entiende la foto me importa poco
Me llamo Sr. Trueno Tremendo
Y no entiendo como sigue mordiendo
Sigo escribiendo, yo me defiendo
Mi rima y estilo son pingareños
Tengo mi puesto, yo lo manifiesto
Te doy mi todo y siempre te afecto...


Rompo pescuezo eso es lo que hago
Estilo mafioso, te tiro en un lago
Ay por Dios, Mellow Man que quieres mas?
Esto es una guerra aqui no hay paz
Represento, soy ejemplo
De raperos en la casa que rompen campamento
Ay quien puede con Mellow y Cypress Hill?
Cuando saca esto va haber tremendo lio
3 cañones, somos 3 leones
Quien quiere un pedacito, le parto los riñones
Pzz pzz pzz! piñiazo en la frente
Que nunca te entre, va pa ya mi gente
Yo lo empece, Cypress lo siguio
El mejor grupo de este siglo
Date cuenta, no eres competicion
Mordiste el estilo, so eres un ladron...",https://genius.com/Cypress-hill-no-pierdo-nada-nothin-to-lose-lyrics
Lil Putos,UnKnown,UnKnown,"""Live and direct""
One little two little three little putos
Tried to jack me they got the boot-o
Taking no shit when push comes to shove
'Cause the niggas showed me no love
Step back punk 'cause I'm a Latino
What I bring you is the hardcore lingo
Funky, but ya don't understand
Now I gotta stand with the Glock in my hand
No scope
And there's no hope
'Cause I'm dishin'
Out my. 45 slug and it ain't missin'
Here it comes hissin'
Here it comes hummin' at ya
Now the slug is comin' at ya
One little two little three hoodlums
Gotta hit the ground 'cause here the slug comes
What do you know, click clack goes the gun
Make 'em run boy, make 'em run boy, make 'em run
Cuando entro, loonie es el fuerte
Speakin' to the gente
'Cause I'm insane in the mente
Movin' em back, click-click goes the gun
Make 'em run boy, make 'em run boy, make 'em run
It's no fun
When I got to break you off some
Of the psycobeta beatdown, boy you get done
Serio
Here we go
Off for the muchacho
Come if you really want some of the chingazo
Me caso you don't hear this little lazo
Cypress Hill, breaking you off a pedazo
Humming at ya
Don't make me come gatt ya
Punk 'cause I still will be comin' at ya
One little two little three hoodlums
Gotta hit the ground 'cause here the slug comes
What do you know, click clack goes the gun
Make 'em run boy, make 'em run boy, make 'em run
When I come in, kickin' with a vengeance
Swift of the engines
Coming like the three little indians
Stompin' around on the ground on the plains
'Cause a nigga like me is goin' insane
In the brain
So I gotta maintain
My direction
What I mighta gained
Without my protection
Not a damn thing
So when I come just bring
That new style, break ya off like a chicken wing
Buckooock!!
So you can just suck my c***
Like a fat blunt, stoned is the way of the walk
When I'm peepin'
Checkin' out the punk-ass creepin'
I let the dogs loose then I let the dogs sick 'em
Graaah! Nigga don't make me catch ya
Punk 'cause I still will be comin' at ya
One little two little three hoodlums
Gotta hit the ground 'cause here the slug comes
What do you know, click clack goes the gun
Make 'em run boy, make 'em run boy, make 'em run",https://genius.com/Cypress-hill-lil-putos-lyrics
