title,album,year,lyrics,urls
Smoke Weed by Cypress Hill,UnKnown,UnKnown,"Weweweweweeeeeeed (smoke weed)
Blazin up on them indo, for my, khmai empire to ride
Spit my rhyme about my life on this M.I.C. tonight
Rippin through this show you know
Til all of your speakers blow
Bass stickin up so high like me
We need time to smoke the seed 
Blazin up on this buddha leaves
When you get ready to blow
Im about to start this shit off
Lettin all you suckas know
When i'm comin down with the green and shock my own Khmai yeah we roll
Fo sho we the braziest Khmai pride up inside Chi-town say ho
When I bust my flow, I let it off on a roll, fo sho
We the truest blooded khmai pride up inside yo studio
Creepin fo my enemy, you know what I really need
Bust them fo, get high, my seed, my game is about the red and green
We cruisin up and down the street, hittin up on some grubs to eat
Rollin up the windows, so the weeeed, will proceed
Keep kick inside my mind, every..time I wanna breathe
Fallin back up on the seat, no one made much plans for weed
Let my peeps go up in smoke, took me seven years to choke
My rhymes comin up tonight, my homeboy Mecc right by my side
Remind me of the time when we was, up on the roof
Blazin up on them leaves blowin back and forth, proceed
My homeboy smokin a big ol' blunt, me and Mecc went ridin crunk
Weeeeed, up on in the trunk, blazin up on this flamin blunt
Happy anniversary, my true Khmai Empirety
We gettin messed up tonite, thats right, dont wanna fight, lets ride
Later up the side, gettin, radiator all the night
The partys jumpin up and down Mothina nigga u gettin high
My homegirl Jenny makes me laugh, when I'm feelin low thats right
I wanna give you sumthin, but ill wait til after the show tonight
Blazin up on them indo, for my, khmai empire to ride
Spit my rhyme about my life on this M.I.C. tonight
Rippin through this show you know
Til all of your speakers blow
Bass stickin up so high like weed
We need time to smoke the seed 
Keep my game, one time, my rhyme, my lyrics explode
To the end of time my skills will never end until the world is rewind
Re-incarnation sends me back to live this life
When my rhymes explodes 3 universe, then I shall die
The kingdom of Cambodia, my peeps im really feelin ya
The pain remains, but time won't stay, so best be on yo way today
Move up on the head and get the rights a client needed
Play along wit the game of the world and then you proceed
To smoke weeeeeeed
Blazin up on them indo, for my, khmai empire to ride
Spit my rhyme about my life on this M.I.C. tonight
Rippin through this show you know
Til all of your speakers blow
Bass stickin up so high like weed
We need time to smoke the seed 
Weeeeeeeeeed  
Blazin up on them indo, for my, khmai empire to ride
Spit my rhyme about my life on this M.I.C. tonight
Rippin through this show you know
Til all of your speakers blow
Bass stickin up so high like weed
We need time to smoke the seed 
Weeeeeeeeeed smoke 
---
.",https://genius.com/Cypress-hill-smoke-weed-by-cypress-hill-lyrics
High Times,Cypress Hill IV,1998.0,"Now this some baaad weeed...

The very first time I hit the weed I was young
Coughin up a lung, high strung, back in '81
Goin to school, hittin the buddah behind the bleachers
Comin to class high, sellin the lie to the teachers
Nickel bag, nickel bag, dime to a nickel
Sellin joints to the honeys suck it like an icicle
Others wanted the 40 but I wanted the weed
While everybody was runnin out, I was plantin my seeds
Homegrown, backyard boogie, I'm still stoned
Got my weed plants taller than your telephone's pole
I can remember when I could only get ses in those days
Now I'm rockin that chocolate thai, skunk and the haze
Roll a fat one, pass it to the left don't front
But I hate it when they don't take the seeds out the blunt
A bunch of blunt-rollers are like rookies on the field
Spillin the weed plant fuckin dookies with no skill
I should write a book, how to roll it then pass it
Light it, grow it, sell it and then divide it
Mr. Greenthumb, Dr. Weed, I proceed to give the herb man what they need
True indeed, blow your fuckin smoke up in the sky
And get high with your bong or your Phillie or 
Dutches
, give me a light

Grab the weed up, pack it in, put it in the pipe
Light it up, smoke a bowl, we puffin the lye right
Put your finger on the hole and hold it in brother
Take a puff, that's enough, and pass it to another

Get the weed sack, 
smoke it up, til it's all gone
No roaches up in the ashtray, smoke up all the bomb
I used to spend money but now I'm growin the crops
But I hate it when the pigs throw a raid on the spot
It was once said I smoke so much weed, by a brother
That I look like the nigga on the zig-zag cover
Maybe I used to look like that way back when
When my nigga Sen Dog was around sippin on the 
Hen
Let the fly rhymes smother you with the scent of the skunk
We got the High Times cover shows you how to roll a blunt
Quarter pound, quarter pound, pound to a quarter
Makin trips to Mexico runnin down to the border
Long hairs, bald heads, dreads and punk rocks
Kids of all colors be puffin it down the block
I got the weed on lock with all the hydro methods
Call me Puffy cause I makin and takin a hit record
Blow your fuckin smoke up in the sky and get high
With the bong, Phillie or 
Dutches
, give me the light

Grab the weed up, pack it in, put it in the pipe
Light it up, smoke a bowl, we puffin the lye right
Put your finger on the hole and hold it in brother
Take a puff, that's enough, and pass it to another",https://genius.com/Cypress-hill-high-times-lyrics
Rise Up,Rise Up,2010.0,"Since  the Watts riot of 1965 has the city seemed so out of control. Los Angeles is still on the edge

Living in the big city, the American dream
Is far roaming in the streets of greed
Everywhere I turn I'm on a mission for more
But I ain't selling my soul
With the dope there's no girl
I'm on a one way box to the top
Hitting the strip but got a sound that would rally the block
I'm in the fast lane and I won't stop
You ain't nothing but talk
You couldn't hang on the rope by ball

This life that I live, it ain't for the weak
I'm a roddy ass gangster that came off the street
I'm trying to keep the peace, but I gotta keep my peace
Got these drunk police want me all rappy
And I'm searching for the higher ground
I want my head in the sky
So high that I can't come down
Leave your lies in every town across the nation
'Cause you can never stop to play

Gotta Rise up (to the top, to the top)
Can't stop (How high can you get?)
Gotta rise up (to the top, to the top)
Can't stop (How high can you get?)
'Cause what goes up must come down
So we gotta rise up to the higher ground
Rise up (Rise up)
Rise Up (Rise Up)
Rise Up (Rise Up)
How high can you get?

Cruising in the drop Chevy
Got my foot on the floor
I'm hitting switches and my brain is heavy
You wanna look inside and see who's crossing the brine
Curiosity is killing you with stick in the prime
I get high from the brim in the set
Never gripping the script
But all you haters couldn't hold my dick
Don't need a clip for my nine is straight
You should leave it alone
And check your toe 'cause my line will spit

This right here's as high as it gets
Somebody likes the split the hell
Cause you stepped on the sex
But guess who will show you, you gotta pass the check
Got my clock on deck and my custom vest streets
You came, for me I'm the best
And you can keep the dress
'Cause I'm smoke at the less
Turn a step back I'm tired of getting pushed

Gotta rise up to the top (to the top)
Can't stop (How high can you get?)
Gotta rise up to the top (to the top)
Can't stop (How high can you get?)
'Cause what goes up must come down
So we gotta rise up to the Higher ground
Rise up (rise up)
Rise up (rise up)
Rise up (rise up)
How high can you get?

I go psycho, crazy Michael Myers
I set the stage on fire, go higher
'Cause when my name's on the flyer
There's so much more to make the whole city rise
This defines a man to get the whole world lifted
One man trying to make a land with a mission
There's no way you can stand in this position
You can't take the heat, get the fuck up out the kitchen

Born with the will to hustle, see we hittin' the floor
You'll never stop it, you ain't got the muscle
We're on the world tour, homeboy, this is for sure
We got a tour, blow the stage up, we out the door
Sometimes we all need an escape, so when we fall off track
You get your mind while we make a stack
I made a pack with a crew on the hill
We continue to build with all the people who believe their bill

We gotta rise up (to the top, to the top)
Can't stop (How high can you get?)
Gotta rise up (to the top, to the top)
Can't stop (How high can you get?)
'Cause what goes up must come down
So we gotta rise up to the higher ground
Rise up (rise up)
Rise up (rise up)
Rise up (rise up)
How high can you get?",https://genius.com/Cypress-hill-rise-up-lyrics
Siempre Peligroso,Los Grandes Éxitos en Español,1999.0,"Yo te meto en candela, prende la vela pa' la pelea
Cuando crees que tu ganas yo mato a quien sea
Cypress Hill son asesinos
Yo fumo mota con todos mis vecinos
Abre tus ojos si tu quieres entender
Yo te enseno todo porque tengo el poder
Te llevo a la loma pa' tirarte en el hueco
Puto yo te mojo y me quedo bien seco
Dios me perdona porque no estabas listo
Tu sangre en el piso y Cypress Hill lo hizo

Caminando por la calle siempre peligroso
(Siempre peligroso)
Corriendo en el pleito mueren los mocosos
(Mueren los mocosos)

Hijo no te pierdas porque voy a comenzar
A quemar mis enemigos que me vienen a matar
Yo no me escondo, tengo familia grande
Si tu quieres un pedazo, sigue ven pa' 'lante
Puto

Ah, mira
Una vez mas y por segunda ocasión
El poder de la yerba abre la mente
Y ahora en español mira, já
Ta ta ta ta taa!
Como el profesor Jirafalez dando su lección
Aquí estoy listo y preparado para la ocasión
Mira, mis instintos me van guiando, tropiezo menos
Pues no doy ningún paso en falso, así he representado
Artillería Pesada presentando, Fermin IV
Capitán, piloto, aviador de la bala de plata
Siempre cumplo lo que prometo
Por eso ahora siento que voy creciendo sin miedo
Agarro el micrófono como el machete que va abriendo
Los caminos y las veredas aquí en la tierra
A 33 1/3 revoluciones me mantengo
Ahora si, tratando de llevar el ritmo perfecto

Caminando por la calle siempre peligroso
(Siempre peligroso)
Corriendo en el pleito mueren los mocosos
(Mueren los mocosos)
Caminando por la calle siempre peligroso
(Siempre peligroso)
Corriendo en el pleito mueren los mocosos
(Mueren los mocosos)

Mi nombre es el Perro, ¡Grraw!, cuando ladro
No hay problema, cuando empiezo, te desmadro
Si soy cubiche sos y tengo mi machete
En la tronca de la ranfla y jeta de los cuetes
¿Que tu le que, le que? Ven pa'ca yo te la quito
La mando pa' San Juan, encuentrala en Puerto Rico
Te jodo chico, nada suave como rico
Soy el pingu, tremendo peligroso tipo
Cuidado con mis cañones, me roncan los cojones
Dile al tipo de la estación que limpia todas las maldiciones
Empuja los botones, antes que tu la pones
Mis palabras son el humo que te rompe los pulmones
Hace de que bola, ¿Que se dice?, ¿Que se cuenta?
Vente compra el disco porque ahora está a la venta
Hay que pagar la renta, corre pa' la tienda
Y oye como Sen y el Machete representa

Caminando por la calle siempre peligroso
(Siempre peligroso)
Corriendo en el pleito mueren los mocosos
(Mueren los mocosos)
Caminando por la calle siempre peligroso
(Siempre peligroso)
Corriendo en el pleito mueren los mocosos
(Mueren los mocosos)
 - this goes with the chorus
Mira...
Cypress Hill, diremos algo
Pero nosotros, el Machete, aquí rondando
Con los grandes, representando, mira
Ah ah!
Desde Monterrey, el Cerro De La Silla
Nos los llevamos a Los Angeles
Colocando nada mas así ah ah
Transportamos por todos lados a donde vamos mira
Ah el Control Machete ah
Artillería Pesada, ah
Cypress Hill, Mellow Man Ace, mira
Ah ah AH! AH! AH!...
Asi es",https://genius.com/Cypress-hill-siempre-peligroso-lyrics
Pass the Knife,Elephants on Acid,2018.0,"Na-na-na-na-na-na, na-na-na-na-na-na-na-na-na
Na-na-na-na-na-na, na-na-na-na-na-na-na-na-na
Na-na-na-na-na-na, na-na-na-na-na-na-na-na-na
Na-na-na-na-na-na, na-na-na-na-na-na-na-na-na
Cypress, Cypress, Cypress, Cypress
Cypress, Cypress, Cypress, Cypress
Cypress, Cypress, Cypress, Cypress
Cypress, Cypress, Cypress, Cypress (Bloaw, bloaw)
Cypress, Cypress, Cypress, Cypress (Bloaw, bloaw)
Cypress, Cypress, Cypress, Cypress
(Na-na-na-na-na-na, na-na-na-na-na-na-na-na-na)
Cypress, Cypress, Cypress, Cypress
(Na-na-na-na-na-na, na-na-na-na-na-na-na-na-na)
Cypress, Cypress, Cypress, Cypress (Bloaw, bloaw)
Cypress, Cypress, Cypress, Cypress (Bloaw, bloaw)
Cypress, Cypress, Cypress, Cypress (Na-na-na-na-na-na)
Cypress, Cypress, Cypress, Cypress
Cypress, Cypress, Cypress, Cypress
Cypress, Cypress, Cypress, Cypress
Cypress, Cypress, Cypress, Cypress
Cypress, Cypress, Cypress, Cypress
Cypress, Cypress, Cypress, Cypress
Cypress, Cypress, Cypress, Cypress

Pass the knife, I'ma take a life
Seems I'm on a bad one, every night
More attention to the light
Burning up at the very touch, runaway train
I perform the ritual, take away all the pain
Free you from this life, from my hands I release you
If the end is what you pray for more than women to appease you
Another chapter starts and more darkness fills the ages
And another stage is set for many names upon the pages
I can sing you all the lullaby and nullify the threat to me
Then disappear, no one knows my whereabouts, presently
Blend in with the masses, now I'm fittin' in society
Hide behind the mask, overwhelmed by the anxiety

In the middle of the street and I got me a pistol
If you wanna see more, all I gotta do is whistle
Ah shit, now you looking at a bloodbath
But queued motherfuckers is the one who had to have that

Hit the floor, better hit the floor, better hit the floor
Better, better, better hit the floor, better hit the floor
Better, better hit the floor, better hit the floor
Better, better, better hit the floor when you hear the sound
Better hit the floor, better hit the floor
Better, better hit the floor, better hit the floor
Better, better hit the floor, better hit the floor
Better hit the floor when you hear the sound

Rolling stone
Everywhere I roam, I can call it home
I've adapted to the elements and set the tone
Set the bar high, stars in your eyes
Far as I can see, I can see those little scars that you hide
You one of the rock gods
This is only the beginning
'Cause the ghost is in the shadow
And this patience slowly thinnin'
Sweat drippin' down my face
As I'm waitin' for the moment
When the metal's flyin' blind
There's no chances for atonement
It's my life and I own it
Inside my sleeve and I've shown it
I have skill to survive
All my life I have known it
I'm the one you should look to
If your enemy shook you
I have the skill if you need it
My name, don't even repeat it

In the middle of the street, and I got me a pistol
If you wanna see more all I gotta do is whistle
Ah shit, now you looking at a bloodbath
But queued motherfuckers is the one who had to have that

Hit the floor, better hit the floor, better hit the floor
Better, better, better hit the floor, better hit the floor
Better, better hit the floor, better hit the floor
Better hit the floor when you hear the sound",https://genius.com/Cypress-hill-pass-the-knife-lyrics
Trouble,Stoned Raiders,2001.0,"It's been awhile now, been around the block many miles
Many faces, many places, that I found friends
Places where I spend time, places where my mind roam
Places I could call home, places I could get stoned
I just wanna be alone when I'm feelin' in my zone
People want to knock me down, 'cause they never have their own
They won't get the best of me, but they try hopelessly
Why you wanna fuck wit' me? I'm not, what you 'posed to be?
Used to not give a damn, coulda just killed a man
Sawed-off in my hand, but I had to kill the plan
Think I've found my peace of mind, feet planted on the ground
I just had to redefine, what I thought to myself
It all goes around me and others who would down me
Who I don't give a fuck about, trouble always found me
I know used to welcome it with my arms open wide
Trouble's hand's on the door, but it can't come inside
[Chorus: B Real + 
Sen
]
NOOOOOOOOOOOOOOOOO
TROUBLE'S AT MY DOOOOOOOOOOR!
You want trouble, c'mon, you want trouble?
You want trouble, c'mon, you want trouble?
NOOOOOOOOOOOOOOOOO
TROUBLE'S AT MY DOOOOOOOOOOR!
You want trouble, c'mon, you want trouble?
You want trouble, c'mon, you want trouble?

Trouble on the line, all the fuckin' time
Got me contemplatin' the solution, the fusion my wicked mind
Got suckers that hate me but it don't really matter
I'm like a gat when I bust, niggas run and scatter
Movin' in circles, throwin' elbows and fists
You got to be a real nigga in the Cypress Hill pit
Like the critics talkin' shit, but I'm not concerned
A hundred G's for sixty minutes is the bank I earn
I try to put it to you bluntly so you bitches can learn
That nobody get tired when it's time to burn
With so many phonies out there lot of you have been fooled
Into actually believin' that some shit is cool
Take the blinders off and go look for yourself
Fuck hearin' about shit from somebody else
I'm down for myself, I back up myself
Put in all on the line make sure that I'm felt
[Chorus: B Real + 
Sen
]
NOOOOOOOOOOOOOOOOO
TROUBLE'S AT MY DOOOOOOOOOOR!
You want trouble, c'mon, you want trouble?
You want trouble, c'mon, you want trouble?
NOOOOOOOOOOOOOOOOO
TROUBLE'S AT MY DOOOOOOOOOOR!
You want trouble, c'mon, you want trouble?
You want trouble, c'mon, you want trouble?
 Nooooo!
*scratching interlude*

Felt the walls closin' in, and my shoe's wearin' thin
Had to be the biggest clown, man you couldn't comprehend
Some hated on my game, said I wouldn't be the same
Called me ""Rock Superstar"", ""Insane In The Brain""
But I know I haven't changed, so I brush you to the side
Trouble's knockin' on the door, anxious just to come inside
'times I gotta block it out, no one likes to talk it out
Trouble keeps comin' and I can't seem to lock it out
Got my hands on the phone, I don't wanna have to talk
If you're feelin froggy, son, then I guess you gotta jump
I can see it in your eyes, you don't seem to recognise
I wouldn't fall into your trap, for many lives to compromise
I'm not fallin' for your shit, you ain't gonna take me there
You can talk all you want, but I don't got your weight to bear
[Chorus: B Real + 
Sen
]
NOOOOOOOOOOOOOOOOO
TROUBLE'S AT MY DOOOOOOOOOOR!
You want trouble, c'mon, you want trouble?
You want trouble, c'mon, you want trouble?
NOOOOOOOOOOOOOOOOO
TROUBLE'S AT MY DOOOOOOOOOOR!
You want trouble, c'mon, you want trouble?
You want trouble, c'mon, you want trouble?

You want trouble, c'mon, you want trouble?
You want trouble, c'mon, you want trouble?
You want trouble, c'mon, you want trouble?
You want trouble, c'mon, you want trouble?",https://genius.com/Cypress-hill-trouble-lyrics
Latin Thugs,Till Death Do Us Part,2004.0,"Don't be like, uh, a Cubano
Be like ? stoned marijuano
Esta capitan pingolete
Swing is here with the force of a machete
Kick mad lingo from Spain to Tijuana
Real hijo de puta homeboy ask yo mama
No me importa pinga mi niña
All I wanna know 
que 'ta bueno chinga
Don't be scared echate pa' ca
What's the play dog homeboy goin' on
Niggas O.G. straight veterano
Master the Spanglish style encojonao
Y'all fools know aqui no se juega
Don't act a fool 
y no rompa las reglas
We bien crazy ass asesino
Get your guns ready aqui viene peligro
Salte con Tego
Llegaron los mero mero
Cuba, Borinquen, Mexico entero
Los Angeles, como arriba, andale
Prende la mota, pero lo que quiero es cule
Salte con Tego
Llegaron los mero mero
Cuba, Borinquen, Mexico entero
Los Angeles
They call me papi chulo
You know I'm puro
I never fade away
You see me comin' get your ass runnin I know you hate away
Hit the le?o harder than most niggas you idolize
Get it started quicker and hit you before you try to hide
Latin thug roll deep pandillero
Puro Los Angeles South side ghetto
Carpet, car black y perro loco
Keep an eye on that fiend, porque yo me la cojo
'E pingado, poca lita
Saco mi pinga y me singo la pista
Can't get enough of them L.A. skonka
Get a little wild y me como la chocha
Listen up compa the big cypress loma
Still right here y todavia te controla
This ain't no Telemundo special
The homies that I roll with for real will come wet you
Salte con tego
Llegaron los mero mero
Cuba, Borinquen, Mexico entero
Los Angeles, como arriba, andale
Prende la mota, pero lo que quiero es cule
Salte con tego
Llegaron los mero mero
Cuba, Borinquen, Mexico entero
Los Angeles
Hey who the fuck is that
Otro negro loco, daddy
Y necolado, uno de lo pato malo
Mucha mucha bala pa' los raton e desmaya
Que moriran seguro sin faya
I ain't neva scared you heard
Otro bobo, esta jodienda yo la controlo
Vete manso, vete easy, quedate vivo
Como quiera que te ponga lo que hay es castigo
Soy vivo latino, pistola, cuchillo
Pa' defendenlo de los enemigos
Esto son maligno, no tienen tiqueta ni singo
Pero to dicen lo mismo
Siiiimon, Tegon, el de pajon, ese si que un cabron
Un majon, blastin' all these motherfuckers
Envidiosos, sapos y chotas
Tirale pa' la cabeza, si se va, no regresa
Eh pa' que suban y ja sepa
Otro mas, de circulacion se va papa
Y no lloro y ni la mama",https://genius.com/Cypress-hill-latin-thugs-lyrics
No Entiendes La Onda (How I Could Just Kill A Man),Los Grandes Éxitos en Español,1999.0,"Esto es un poquito del poder del grupo Cypress Hill
¿Sabes lo que te digo?
Te voy a dar un poquito sabor
¡Y empieza así!

Hey, corre ese, borrate
Por que viene la hoota, siempre carga fusca
Buscando a la más filosa clica
La famosa Cypress Hill rifa
Todos los vatos salen, están en la calle
Tírense cabrones, si me ven manejar
Con los que me junto
Con un Magnum quebrando unos putos
Puro cholo loco, empaca cromo
Y te llenamos el saco de plomo
¿Como te puedo hacer entender?
(How I could just kill a man?)

¿Como te puedo hacer entender?
(How I could just kill a man?)
¿Como te puedo hacer entender?
(How I could just kill a man?)
¿Como te puedo hacer entender?
(How I could just kill a man?)
¿Como te puedo hacer entender?

No le pongo mente a estos pendejos
No voy a gastar tiempo
Yo te dejo, yo no doy hueco
Mira mis dos cañones
¡Tumbo los cabrones!

Tráiganme la acción, yo les traigo a tragazon
Mis palabras son ataques sin razón
Va tu satélite de visión
Enseñaste un violenta ciclón
Hago un ejemplo de todos los pendejos
(¡Y te dejo todo chueco!)
La chota entro a mí cantón
Un matón, narco, pistolón
Cúbrete, guey o te mato
Porque siempre quiebra al más macizo vato
No quisiera matarlo, pero si lo hizo
Cuerpo en el piso
(¡Te dejo todo chueco!)

¿Como te puedo hacer entender?
(How I could just kill a man?)
¿Como te puedo hacer entender?
(How I could just kill a man?)
¿Como te puedo hacer entender?
(How I could just kill a man?)
¿Como te puedo hacer entender?
(How I could just kill a man?)


Chingón el tiempo para que te rinden
Las misiones que establecí
Empiece, me fumo hierba verde
Aveces tumbo gente
Vi que un maníaco quería tu carro
¿Crees que la chota te va hacer un paro?
No, creo que te vas a parar
Y comenzar a cuetear, disparar
Mueve puro fierro
Y te deja todo chueco
¿Como me vas a entender si balazos no te ha llovido?
¿Entiendes lo que digo?
Cuando 'ta de matón, cierro tu cantón
Por aquí se pone cabrón
Por el dinero, barrio peleonero
Muchas veces robos dejan entierros

¿Como te puedo hacer entender?
(How I could just kill a man?)
¿Como te puedo hacer entender?
(How I could just kill a man?)
¿Como te puedo hacer entender?
(How I could just kill a man?)
¿Como te puedo hacer entender?
(How I could just kill a man?)
¿Como te puedo hacer entender?

All I wanted was a Pepsi",https://genius.com/Cypress-hill-no-entiendes-la-onda-how-i-could-just-kill-a-man-lyrics
