title,album,year,lyrics,urls
I Wouldn’t Know,Church Clothes 3,2016.0,"I'm livin' like you should wanna know what I know
Remember this, you will always reap what you sow
Gotta keep it real, hold it down on the low
Never been fearin', nah, nah, nah, nah
So I wouldn't know, I wouldn't know
I wouldn't know, I wouldn't know

They say I'm goin' out my head right now
They say I'm gon' fail right now
Maybe you was countin' bands all night
You trappin' out the bando now?
I wouldn't know
You ain't runnin' the streets, you just runnin' your mouth
I don't hear what they speak
I just walk like I talk, got that light to my path
And that lamp to my feet
But the feelin' so sweet, got me feelin' like a beast
A sickness and God as my witness
Boy, the foreign car makin' my pockets pretentious, Lord
Somebody help me
I done seen things I don't wanna see
I'm out runnin' through the streets
Heard somebody callin' me and sayin' we should meet
But I wouldn't know
Yeah, they probably talkin' 'bout me
Probably plenty of 'em sayin' that they doubt me
Keep them folk from  'round me
Father, keep me grounded
I wouldn't know cause I never be around them, no
20, 50, 100's, stuntin', stuntin', stuntin'
Look what we becomin'
Heard that reaper coming but this what you wanted
So I wouldn’t know

I'm livin' like you should wanna know what I know
Remember this, you will always reap what you sow
Gotta keep it real, hold it down on the low
Never been fearin', nah, nah, nah, nah
So I wouldn't know, I wouldn't know
I wouldn't know, I wouldn't know

Hundred bands, you got a hundred grand, hundred grand
That is easily a scholarship
You'd rather go the club and blow all of it
I don't wanna judge, but you won't get your honor, yeah
We don't care what you did on the 'gram
Boy, you aborted the mission and I got the sonogram
Haven't you, haven't you noticed
Rappers they flex on the place where they come from
They brag that they eatin' while we got no groceries
American dreams
Barely Americans really do dream
That couldn't leave heritage, we marry codeine
Start from the bottom and never do leave, geez
I am for the people, you are for the paper
Breakin' cycles, make disciples that's all that I know
Made it out to make a route
Hate about us makin' clout
Racin' 'bout what faith endowed
See amazin' grace, invading spaces, changin' places
Now

I'm livin' like you should wanna know what I know
I know nothing else
Remember this, you will always reap what you sow
Gotta keep it real, hold it down on the low
Never been fearin', nah, nah, nah, nah
So I wouldn't know, I wouldn't know
I wouldn't know, I wouldn't know",https://genius.com/Lecrae-i-wouldnt-know-lyrics
Come and Get Me,All Things Work Together,2017.0,"Aye Biz, let it drop right here

You better tell me if you with me
I know the Devil tryna stop me
Got these people out here wishin' they could pop me
If they want me, come and get me!
Man, I ain't scared of none of y'all
The only thing I fear are the IRS and God
If you wanna go against me
Nah, they prolly better think twice
Got angels over my head, war on my mind
If ya' want me, come and get me!
Well, y'all might as well go ahead
I'm prolly more of a threat to y'all when I'm dead, though

Twenty-four years old, my momma brought me to the globe
Tried to tell me it was cold and taught me how to keep the coat
Now, now, now she told me to go to school and get my education
But remember there's a bias to them books that they be makin'
Gave me, Soul on Ice and taught me
'Bout the Middle Passage, told me
God ain't white and that there's
More to life than rap and I
Expressed my opinions, my faith, and my views
If they wanna keep me quiet, tell 'em, ""Do it!""

You better tell me if you with me
I know the Devil tryna stop me
Got these people out here wishin' they could pop me
If they want me, come and get me!
Man, I ain't scared of none of y'all
The only thing I fear are the IRS and God
If you wanna go against me
Nah, they prolly better think twice
Got angels over my head, war on my mind
If they want me, come and get me!
Well, y'all might as well go ahead
I'm prolly more of a threat to y'all when I'm dead, though

Huh, once upon a time, God opened up my mind
And He showed me I don't have to be a product people buy
With this God-given wisdom, I can climb out the holes
Stay up out the system 'cause the system never let you go
Speak the Truth without no fear
It's gon' ruin in my career
I've been a mascot for too long
I ain't come here for no cheers
First of all, let me be clear one time
Let me be real one time
If you want a religious puppet you gon' have to hang this guy
I've been around the world and seen pretty girls get caged up like sex slaves
Crooked cops done pulled me over, treated me like I ain't made
In the image of God and that's so odd
I'm at Sunday service with a snapback
And if ya' hatin' on me go and hate
But if you gon' ride

You better tell me if you with me
I know the Devil tryna stop me
Got these people out here wishin' they could pop me
If they want me, come and get me!
Man, I ain't scared of none of y'all
The only thing I fear are the IRS and God
If you wanna go against me
Nah, they prolly better think twice
Got angels over my head, war on my mind
If they want me, come and get me!
Well, y'all might as well go ahead
I'm prolly more of a threat to y'all while I'm dead, though

Ahem, well, um, the sky ain't the limit
To me it's a limitation in a planetary on my navigation
You can follow me to every destination, come on
Let me make it plain, look, I'm just tryna fly withcha
Let me tell it, man look, I ain't never lied to you
I'ma keep it real, I'ma ride withcha, get the Key & Peele
If you gettin' money like you kin to Will, go and fill up banks, go and make a mill'
If you hatin' on me, then you speak in tongues, get a translator (oh yeah)
If you flakin' on me go and let it snow, I got plans later
Look, I've been tryna tell 'em since '04-'05 (that's Real Talk)
Still, you know these people doubt me every time
Had an alter ego, but my ego altered at the altar call
Looked up at the ceiling and I heard the angels talkin', y'all
What'd they say? They said
I was made in His image, in His likeness
Bite this if you don't like this, herbs and spices is righteous
Nothin' in the world quite like this, hold on to it with a tight fist
Prototype this, no matter what yo' type is

You better tell me if you with me
I know the Devil tryna stop me
Got these people out here wishin' they could pop me
If they want me, come and get me!
Man, I ain't scared of none of y'all
The only thing I fear are the IRS and God
If you wanna go against me
Nah, they prolly better think twice
Got angels over my head, war on my mind
If they want me, come and get me!
Well, y'all might as well go ahead
I'm prolly more of a threat to y'all while I'm dead, though, ha",https://genius.com/Lecrae-come-and-get-me-lyrics
Wish You the Best,All Things Work Together,2017.0,"Listen, look, I see you on IG
Your little man so big now
See you move to the west coast, and you done copped yourself a crib now
I'm sure by now you've moved on
I mean it's been some years since I left you in your bedroom wiping tears
I disappeared after I had met your momma now
And you met all my family too
They told us ""love was complicated""
We told them ""we gon' make it through""
But I blew it, I missed it, I didn't make you Mrs., I just made you miss us
I didn't put no ring on yo finger, but I did put you through the ringer
Yeah, I own that
Wish I could go back
Treat you right and take my wrongs back
But you should know that I

I wish you all the love you could imagine
And I wish you everything that never happened

I wish you luck
I wish you love
I wish you everything, everything that you ever dreamed of
I wish you life
I wish you joy
I wish you everything, everything a girl would want
I wish you the best
I know I'm the worst
You deserve the best
That's what you deserve

Yeah, yeah, now how we get this far?
Everything escalated
Late nights talkin' on the phone
Even with my situation, I'm so taken
But either way, I called you when you hit back
And we talked through all my dark times and you told me to just kick back
Lay on your shoulders
Know we friends but we closer
Thought that this could never work but I kept on walking that road
Maybe reconsider everything
Tell my girl we'll prolly never make it to the wedding day
I might not be ready, man
Oh, left her at the altar
Pretty sure I scarred her
And I hope that Heaven caught her
And I wish I never falter

And I wish her every joy she could imagine
And I wish you everything that never happened

I wish you luck
I wish you love
I wish you everything, everything that you ever dreamed of
I wish you life
I wish you joy
I wish you everything, everything a girl would want
I wish you the best
I know I'm the worst
You deserve the best
That's what you deserve

I know, I know I'm the reason you stopped believin' in love
'Cause the man I was that left you needin' more than I could ever be then
Crazy how everything's changed
Married now, I'm in a new space
And I heard you moved upstate
Well, I wish you the best always

I wish you luck
I wish you love
I wish you everything, everything that you ever dreamed of
I wish you life
I wish you joy
I wish you everything, everything a girl would want
I wish you the best",https://genius.com/Lecrae-wish-you-the-best-lyrics
It Is What It Is,Church Clothes 3,2016.0,"I’m hearin’ screams and they sayin’ we sold out
But I’m hearin’ screams from the stands cause we souled out, it’s so loud
I got one life so I spend time tryna live 'til the next one
If you don’t like it, cool
It is what it is, it is what it is
It is what it is, it is what it is
My plate too full to sample that dish
It is what it is, it is what it is
I’m handlin' biz, it is what it is
It is what it is, it is what it is

Some like, “I ain’t really feelin' that bruh
I ain’t with religious rap, bruh”
Some sayin' it is devil rap
Illuminati-on-another-level rap
Fell flat from heaven went to hell and back, huh?
A lot of radio ain’t givin' no play, but it’s ok
Cause my day one's been A-1
Before the co-signs and the pros came
Where you been, been boy, boy?
You ain’t been keepin' up
Church Clothes 1 and 2, then Anomaly
You probably need to turn your speakers up
And now I’m on my third tape
And I just might drop it on a Thursday
So tell the industry and my enemy
That your man wouldn’t follow in they rules in the first place
Thirty plus in the residential
In the truck feelin’ presidential
With my girl lookin’ detrimental
Killin' anything tryna to be a side piece out my mental
Outta your mind
You thinkin’ I’m leavin’ my baby by marchin’ for dimes?
You'll get that curve, you way out of line
Gave her that rock, I’m stayin’ with mine
I keep the huddle mad tight, too many players I don’t trust now
You wasn’t with me on the 4th down, huh?
Then you can miss me when I touchdown
And that’s no shade, no shade
It’s just those games, I don’t play
I’m gettin’ wiser with more age
And realizin’ some gonna hate
And that’s ok

I’m hearin’ screams and they sayin’ we sold out
But I’m hearin’ screams from the stands cause we souled out, it’s so loud
I got one life so I spend time tryna live 'til the next one
If you don’t like it, cool
It is what it is, it is what it is
It is what it is, it is what it is
My plate too full to sample that dish
It is what it is, it is what it is
I’m handlin' biz, it is what it is
It is what it is, it is what it is

Hold up
Let me get a minute from the flexin’
Foreign cars and the million dollar jets
Futuristic clothes, feelin’ like a Jetson
Cause keep it trill, it ain’t really that impressive
Blessed, but I ain’t frontin’ with the Grammys or the fame
I’m just stuntin’ with my family unashamed
And cats say, Crae, you done got it all
In the gym workin' hard, you should show it off!
Nah, that ain’t never been my forte
Pride come before the fall, what the Word say
And I’ve been eatin’ off the wordplay
Working hard on the lyrics that the world play
Remember where I came from in the first place
It’s all a gift, every breath is a birthday
So I spend time tryna find all of these souls lost
Cause it’s a wasted time if I got it all and they souls lost
I ain’t tryna to ball
If that’s what you feel then your goals off
It’s a different game tryna get this truth
Put you on and then go off
So, yeah, I may swag at award shows
Get some jet lag from a tour show
Keep a couple abs on my torso
But none of that is gon' matter when the horn blow
I ain’t tryna front for them flashin’ lights
Man they had us, life is a gift
So if last night was my last night, them I’m good
It is what it is

I’m hearin’ screams and they sayin’ we sold out
But I’m hearin’ screams from the stands cause we souled out, it’s so loud
I got one life so I spend time tryna live 'til the next one
If you don’t like it, cool
It is what it is, it is what it is
It is what it is, it is what it is
My plate too full to sample that dish
It is what it is, it is what it is
I’m handlin' biz, it is what it is
It is what it is, it is what it is",https://genius.com/Lecrae-it-is-what-it-is-lyrics
Anomaly,Anomaly ,2014.0,"I never fit in I was a outcast
In grade school out blasting my Outkast
And I'll pass on running to catch a route pass
Gimme a pen and a pad I'm tryna outlast
All of my idols, American and the foreign-ers
Before the foreign cars & the boring bars
Money, money, money, sex, drugs and the coroners
All this killin' but where the bodies at
All this money where the Bugattis at
But dig a lil deeper
And you'll find another insecure man sittin' in a 2 seater
The same little boy that got beat up
Plenty pains in his past you could bring up
Nobody ever told him he could be more than he is
But inside he's a leader
I didn't know who was inside me either
Striving to be a captain
Hopin' I could date a cheerleader
Tryna get me a throne of my own so I could put my feet up
Thank God my kingdom was overthrown by the soul redeemer

Yeah, anomaly
Deviation from the common rule
Something or somebody that’s abnormal
That doesn’t fit in
I say that’s exactly what we are
We are the odd, the outcasts, the peculiar, the strangers
And they say we don’t fit in
But I say we are exactly who God created us to be
Anomalies
The system didn't plan for this
(Anomalies)
(Anomalies)
(Anomalies)",https://genius.com/Lecrae-anomaly-lyrics
Messengers,Anomaly ,2014.0,"Calling all the messengers
Calling all the messengers
Calling all the messengers (Can you hear it?)
Oh, oh, oh, oh, hey
Oh, oh, oh, oh, hey
Oh, oh, oh, oh, hey
Oh, oh, oh, oh, hey

We've been given a call
Been forgiven, risen, we livin' to give him our all
Rise up from your past it's holding you down
This moment is all that matters the future is now
How will the people know if we don't tell 'em if we fail 'em
They stumblin' in the dark but the light is what we carry
Yeah, don't have to wonder your purpose or what you here for
Reflect His image and show the world what he cares for

And I know it's alright
And you know it's your life
And we know, we know that time's running out
Can't wait around cause
The time is now

Calling all the messengers
Calling all the messengers
Calling all the messengers (Can you hear it?)
Oh, oh, oh, oh, hey
Oh, oh, oh, oh, hey
Oh, oh, oh, oh, hey
Oh, oh, oh, oh, hey

I've been a lot of places where the scene ain't pretty
I've seen plenty of hatred, death, and destruction where ignorance kills many
The blind leading the blind we turning a blind eye
That alone is a crime we got the power of life
I know that we make mistakes don't let 'em keep you away
Mercy love and His grace is the reason we move ahead
Speak out though we never been qualified to do it
I ain't earned it, I was loved into it I'm brand new - yea

And I know it's alright
And you know it's your life
And we know, we know that time's running out
Can't wait around cause
The time is now

Calling all the messengers
Calling all the messengers
Calling all the messengers (Can you hear it?)
Oh, oh, oh, oh, hey
Oh, oh, oh, oh, hey
Oh, oh, oh, oh, hey
Oh, oh, oh, oh, hey
Oh, oh, oh, oh, hey
Oh, oh, oh, oh, hey

Calling all the messengers
Calling all the messengers
Calling all the messengers

Calling all the messengers
Calling all the messengers
Calling all the messengers (Can you hear it?)
Oh, oh, oh, oh, hey
Oh, oh, oh, oh, hey
Oh, oh, oh, oh, hey
Oh, oh, oh, oh, hey (Can you hear it?)

Oh, oh, oh, oh, hey
Oh, oh, oh, oh, hey
Oh, oh, oh, oh, hey
Oh, oh, oh, oh, hey (Can you hear it?)
Calling all the messengers
Calling all the messengers
Calling all the messengers (Can you hear it?)
Calling all the messengers
Calling all the messengers
Calling all the messengers (Can you hear it?)",https://genius.com/Lecrae-messengers-lyrics
Lucked Up,All Things Work Together,2017.0,"You lucked up on a real one, real one
Keep it one million, yeah
I'm only 'bout you, yeah you
Lucked up on a real one, we just chillin'
Put you on a different feelin', one in a million, yeah
I'm only 'bout you, you

I lucked up on a real one
I lucked up and found real love
You been in it, you deserve to win it
I be curvin' women, I don't feel 'em
Ayy, I was trippin' on the road
I was 'bout to let it go
I got respect and now I'ma have to let 'em know
Girl, you water to my soul
Yeah, yeah, wooh
And catchin' plays is not an option
No discussion, change the topic
And you the first round draft
You the whole franchise and the top pick
Baby, I know that you know that I know you the truth (you know that, you know that, you know that)
And I can't believe that we done it the way that we do
Yeah, yeah, yeah

Bet' be glad you lucked up on a real one, real one
Keep it one million, yeah
I'm only 'bout you, yeah you
Lucked up on the real one, we just chillin'
Put you on a different feelin', one in a million, yeah
I'm only 'bout you, you

Yeah, yeah
You the one for me, I promise, took ya home to mama, she said you the realest
All my partners say be honest, keep it real, don't let her get away, she kill it
You been around, down, down, way before they put me in the game
Look, I was ridin' pine on the sidelines
 and not a dollar to my name (not a dollar to my name)
They say that money make a changeup (changeup)
I done went and got my change up (yeah)
All I need is you and all I want is what I got, it's easy as a layup
And now we far away, on the white sands, later
Sippin' something with a little grin if they ain't what a winnin' team made of

You lucked up on a real one, real one
Keep it one million, yeah
I'm only 'bout you, yeah you
Lucked up on a real one, we just chillin'
Put you on a different feelin', one in a million, yeah
I'm only 'bout you, you

And when you call
I give you this work
Oh, yeah, it don't matter at all
Baby, you come first
Yeah, we be lit every night
Yeah, we be up every night
Yeah, I need you by my side
Baby, yeah, you the apple of my eye
Can't you tell I'm all about you, you, yeah, yeah, yeah, yeah
And baby, no, we won't ever stop
This love, you a rider
You know that I'm all about you, only 'bout you, you
Only 'bout you

I lucked up on a real one, real one
One in a million, yeah
I'm only 'bout you, yeah you",https://genius.com/Lecrae-lucked-up-lyrics
Fakin’,Gravity,2012.0,"I'm riding round and I’m getting’ it; they riding round pretendin’
I been had it, I been done, I promise that it's all empty
They say they ridin’ Bugatti's, man
Put some babies through college
Quit tryna’ act like the trap is cool
‘Cause we tired hearin’ that garbage
Hey, bags of white, pints of lean
I been on dope boys since a teen
But this ain't what we meant to be
And y'all don't make no sense to me
You pump fakin’, ain't shootin’, ain't killin, ain't doin’
Half them thangs you say you doin’, but 116 we stay true an’
Ain't dope dealin’, ain't Po pimpin’, talkin’ ‘bout my own folk killin’
We on that Jesus soul healin’, so serious, gorillas
Wild ain’t we, can't tame us, been changed, can’t change us
1:16 – You can’t shame us. Live that truth; you can't blame us

I heard him say he bought the block (Fakin!)
In his song he say he gansta’ but he not (Fakin!)
Say he makin’ money, cashin’ big checks (Fakin!)
While his chain leavin’ green on his neck (Fakin!)
I’m not impressed
So I guess that make you, yes that make you
That make you a faker!
So I guess that make you, yes that make you
That make you a faker!
So I guess that make you, yes that make you
That make you a faker!
So I guess that make you, yes that make you
That make you a faker!

He was all juiced up, thought he was 2Pac
‘Til ‘dem boys caught him, hit him with them two shots
Now, he in the station singin’ like he T-Pain
The bullets made him lean, now I guess he’s 2 Chainz
He bought that bentley kit, and wrapped it ‘round a 300
Now matter how you put it, boy, that’s still a 300
Stop that fakin’ and the flatchin’ dawg cut it off
Frontin’ like your paper longer than the Power Ball
He think he Scarface, guess he ain’t seen the movie
Keep on fakin’ ‘til you face down in a Jacuzzi
With some killas in you room with some real guns
That don’t make noise when they blast it but they real guns

I heard him say he bought the block (Fakin!)
In his song he say he gansta’ but he not (Fakin!)
Say he makin’ money, cashin’ big checks (Fakin!)
While his chain leavin’ green on his neck (Fakin!)
I’m not impressed
So I guess that make you, yes that make you
That make you a faker!
So I guess that make you, yes that make you
That make you a faker!
So I guess that make you, yes that make you
That make you a faker!
So I guess that make you, yes that make you
That make you a faker!

Real recognize real; introduce ya’ self
Careful with that cannon boy; you might just shoot ya’ self
Somebody wake em’, tell em’ to stop fakin’
Before they end up lyin’ in the woods buck naked
These killas fulla’ them demons, while you pretendin’ you Scarface
You ain't really no ghetto boy, why you fakin’ that hard face?
That just made him furious; somebody call Fishburne
Tell these boys in the hood 40 cal hits burn
And hell burns hotter, I turn to the Father
I prayin’, “Lord forgive em’ ‘cause they lyin’ like Mufasa
They got these eight’ graders with they eyes on a choppa
I pray the Lord save ‘em ‘fo He drop ‘em and make ‘em stop it

I heard him say he bought the block (Fakin!)
In his song he say he gansta’ but he not (Fakin!)
Say he makin’ money, cashin’ big checks (Fakin!)
While his chain leavin’ green on his neck (Fakin!)
I’m not impressed
So I guess that make you, yes that make you
That make you a faker!
So I guess that make you, yes that make you
That make you a faker!
So I guess that make you, yes that make you
That make you a faker!
So I guess that make you, yes that make you
That make you a faker!
Fakin!
Oooh (Fakin!)
Oooh (Fakin!)
Oooh (Fakin!)
Oooh (Fakin!)
Oooh (Fakin!)",https://genius.com/Lecrae-fakin-lyrics
Can’t Do You,Church Clothes 3,2016.0,"Never been no one to waste time
Beat that beat up like a drummer on a bass line
Lil' momma tryna hit me with the waistline
She don't see I got my lady on FaceTime
I'm unashamed, can't stop that
You feelin' like a hater, stop that
They told me, ""Hold up 'fore you drop that""
I'ma do it, pull the top back
'06, top down
Four fours, block now
I'ma do me, let the critics go on talk now
Right hand don't even know what the left hand doin'
How I'm gon' be worried 'bout what the next man doin'?

Like I'm in the coupe and I'm too gone
Headed to the sky where I'm gon' go
They throwin' shade but it's cool though
I'ma do me and we on the same team
Yeah, watch how I'm doin' me
I can't do you, 'cause I'm doin' me
Yeah, I know they feel how I'm doin' me
But they gon' get a thrill how I'm doin' me

They call me E-40 but not the Sigma brush
Got my name from drinkin' 40's
, used to rush
Cars cookin', cookin' them jelly jars
Yeah you a Jedi charge it up for a hover ride
Now I'm getting microphone profit
Look like I got sandbags in my pocket
Baby on my boots but it's too late
She hungry to her I look like a plate
Let me be straight up
You need to get your weight up
Stop worryin' about the next put your hate up
When my money was low I stayed high
With my chin in the sky, do or die

Like I'm in the coupe and I'm too gone
Headed to the sky where I'm gon' go
They throwin' shade but it's cool though
I'ma do me and we on the same team
Yeah, watch how I'm doin' me
I can't do you, 'cause I'm doin' me
Yeah, I know they feel how I'm doin' me
But they gon' get a thrill how I'm doin' me

They hopin' I keep it cookin' and keep it poppin'
The studio, the kitchen
We mixin' up the product
Got a lot of haters, couple critics, and a stalker
Me and God be talkin', He told me not to bother
I got a master plan from the Master
So let 'em talk about me while I'm lookin' crazy dancin'
My clothes don't match and my holes got a pants
Wait, I think I may have said it backwards
It's cool though, how you do that there?
Actin' like nobody know what you do back there
I hear that hate a mile away, I notice you back there
I ain't dwellin' on it, I ain't tryna do that there

Like I'm in the coupe and I'm too gone
Headed to the sky where I'm gon' go
They throwin' shade but it's cool though
I'ma do me and we on the same team
Yeah, watch how I'm doin' me
I can't do you, 'cause I'm doin' me
Yeah, I know they feel how I'm doin' me
But they gon' get a thrill how I'm doin' me

I can't do it like you, no, no
Yeah, 'cause I'm doin' me",https://genius.com/Lecrae-cant-do-you-lyrics
