title,album,year,lyrics,urls
Sunday Morning,Restoration,2020.0,"I been messed up (Yeah)
Stressed out with no luck (Yeah)
But every time I wake up (Yeah)
I get a chance to wake up (Yeah)
Thank God I got a chance to wake up
Wake up, another day to get my cake up, cake up (Yeah)
'Cause every time I wake up (Yeah)
I get a chance to wake up (Yeah)
Wake up, wake up

Wake up lil' slick, get up outta bed
You was like a couple steps away from being out of here
Thank you from my Granny prayers
Thank you for my potna 'n 'dem
I thought I was finished here
Jesus told me, ""Start again""
I would party sundown 'til days end
Makin' money that I can't spend
I had a failing marriage and some fake friends
I had to doubt my doubts and let faith in
I was broken, God done brought me out like I was Moses
I'm chosen, woke up Sunday morning feeling focused
Funny actin', swipe left, that's on momma's
Always cappin', swipe left, yeah, no more drama
Mhm-mhm-mhm-mhm-mhm-mhm, boy, you know you blessed
Last night was a mess, God just hit refresh

I been messed up (Yeah)
Stressed out with no luck (Yeah)
But every time I wake up (Yeah)
I get a chance to wake up (Yeah)
Thank God I got a chance to wake up
Wake up, another day to get my cake up, cake up (Yeah)
'Cause every time I wake up (Yeah)
I get a chance to wake up (Yeah)
Wake up, wake up

Woke up in the new diablo
Father stretch me like I'm Pablo (Preach)
Sunday service on the front stoop
With a cup of tea in the condo
Tony Evans kicking convo'
Walking me through my storm
And I ain't grow up hearin' gospel
But I got it playing this morn'
I done been through this a time or two
I keep going back but now I'm finally through
I'm like ""If I was God, I'd be tired of you""
But He be open arms like He desire you
I'm like wow, smokin', sippin', slippin', thought I lost my grip in, wow
Pulled me back and told me I'm forgiven

I woke up Sunday morning weight up on my chest (Yeah)
Had to remind myself that every day I'm blessed (Yeah)
'Cause every time I wake up (Yeah)
I get a chance to wake up (Yeah)
Thank God I got a chance to wake up
Wake up, another day to get my cake up, cake up (Yeah)
'Cause every time I wake up (Yeah)
I get a chance to wake up (Yeah)
Wake up, wake up (Yeah, yeah, yeah, yeah)

Yeah, yeah, yeah (Ooh-ooh-ooh-ooh-ooh-ooh-ooh-ooh)
Seasons change the colors so quickly
It's hard to keep up with the leaves
'Cause everybody leaves
On my birthday, Kobe, Gigi and seven souls remind me
That the tree of life is so uncertain
And tomorrow has unpredictabilities as colorful as the smiles that took off that day
May that Sunday morning resonate past trophies and trinkets and the ongoing pursuit of more
To sober us but the humbling truth
My life and your life, is just a vapor
And if what you see is all you see
Then you do not see all there is to be seen
Quickly
We leave",https://genius.com/Lecrae-sunday-morning-lyrics
40 Deep,Rehab,2010.0,"All s-
All s-
(The boy is dangerous)
All saved, all serious
All saved, all serious
All saved, all s-
All saved, all s-
All saved, all serious

Yo cliqued up 40 deep in the street you can find us
Ya we on theology but we be on the grind ya
When we was a youngers only had 2 place to run to
One become an animal, two get out the jungle
So we got our lion on the line bro, that’s what we do
Run up on you and your crew and tell ya’ll Jesus is the truth
Open air evangelists, relationships, we do it all
Backpack still full of tracts with a Johnny Mac
Hats to the back and our backs to the wall
Plus I got some homies out there who gon’ rep the rock
If you wanna make them stop, you gon’ have to bring a choppa
If they get martyred, then we gon’ go harder
Share the gospel on death row and let ‘em know that they been pardoned
You don’t wanna get it started, this is what we do, who we are
1-1-6 to the day we die, ain’t tryin to be no superstars
Chicks to the click that’ll pull your car?
Usin’ the street like cops in cars?
You ain’t hear the truth today, I promise we’ll be back tomorrow

Clicked up 40 deep, all saved, all serious
Clicked up 40 deep, hey holla at us if you curious
Clicked up 40 deep, we all saved, all serious
Clicked up 40 deep, come holla at us if you curious
Clicked up 40 deep, all saved, all serious (Yah)
Clicked up 40 deep, all saved, all serious (Yah, it’s community baby, haha)
Clicked up 40 deep, all saved, all serious (Let’s take it back, Creezie, let’s talk about it)
Clicked up 40 deep, all saved, all serious (Let me show you Tedashii’s style, baby)

To the streets, like 'Crae
Clicked up 40 deep, all day
Backpacks they strap ‘em Johnny Mac and tracts to play for me this morning to label the streets, all day (okay)
1-1-6 for your boy, man this more than just some artistry
Cliqued up in community, baby, this here the heart of me
I get every thinking body you gon have to pardon me
Wanna know the truth brought a partner this here was stallin me
Real talk, real talk, before it was the real talk
I was in community just trying to have a real walk
Looking for direction but at times that I would feel lost
What's accountability? Your boy was prone to be alone
Folk making war within the stars; Han Solo
God used somebody to wake me minus the NoDoz
We do the plumb line I can see myself like a photo
He made us for community, another way's a no-go

Clicked up 40 deep, all saved, all serious
Clicked up 40 deep, hey holla at us if you curious
Clicked up 40 deep, we all saved, all serious
Clicked up 40 deep, come holla at us if you curious
Clicked up 40 deep, all saved, all serious (Yah)
Clicked up 40 deep, all saved, all serious (Yah, it’s community baby, haha)
Clicked up 40 deep, all saved, all serious (Let’s take it back, Creezie, let’s talk about it)
Clicked up 40 deep, all saved, all serious (Let me show you Tedashii’s style, baby)

A clique of us is shining rhyming walking talking sharing Christ, very hype
Find us hiding behind him all prepared to fight, very tight
Fighting trying to share the cross. He spared of life
We’re living by the blood like we’re parasites, get it right
My team carries bunch of high beam blaring lights
Might seem scary but we nice, see we carry life
Light is seen clearly man we’re glaring very bright
Check the fleet man we deep so we might seem Barry White
Ever since we heard about the murder how they buried Christ
Eyes upon the cross even though that is a scary sight
But that was the merger we converted now we very tight
He died for His bride homie, How you like the married life?
Christ the name we calling on
Can't wait until He calls us home
You know we be falling often we can't walk it all alone
My crew's always rhyming like some stalkers we ain't stalkin' homes
Started with the cross and we continue with the cross alone

Clicked up 40 deep, all saved, all serious
Clicked up 40 deep, hey holla at us if you curious
Clicked up 40 deep, we all saved, all serious
Clicked up 40 deep, come holla at us if you curious
Clicked up 40 deep, all saved, all serious (Yah)
Clicked up 40 deep, all saved, all serious (Yah, it’s community baby, haha)
Clicked up 40 deep, all saved, all serious (Let’s take it back, Creezie, let’s talk about it)
Clicked up 40 deep, all saved, all serious (Let me show you Tedashii’s style, baby)",https://genius.com/Lecrae-40-deep-lyrics
I Know,Gravity,2012.0,"I know, I know
I know, I know
I know, I know
(I know)
I know, I know
(I know)
I know, I know
(I know)
I know, I know
(Yeah, I know)
(I know)
I know, I know
(I know)

Boy I lost and I'm foolish, running off at the two lips
Prolly wooing all the cruellest persecutors to fool us
Catch me hanging with shooters rumored to strew your medulla
My momma told me they would screw us but I already knew it
Who gon give 'em peace of mind? They can have piece of mine
Know they thinkin' I'm blind, but I just pay them no mind
Yeah I know they be lyin', they misquoting my lines
They like what you think you doin' putting hope in your rhymes?
You would think I'm shooting folk or putting coke in my rhymes
I just give them bass for free and push the dopest of lines
Boy you trippin' (I know)
'Crae you slippin' (I know)
I done heard this all before just sit back enjoy the show
Yeah I know they gon' hate us, type they blogs up debate us
They be fishin' for attention but don't know how to bait us
Keep that hate on hiatus
Big ups to my Creator
No big bang just a banger, so tell that DJ to bang it!

I know, I know, I know, I know
I know, I know, I know, I know
I know what they sayin' but I promise that I'm cool though
I know what they sayin' but I promise that I'm cool though
I know what they sayin' I ain't trippin' on it man
I just came to do my thing, something different for a change

Listen, I kno, they tryin' to find out my MO
I tell them God sent me they probably ain't get the memo (I know)
I can't say that cause Jesus Walks, they don't play that (I know)
Shouldn't be here cause people rollin' they trees here (I know)
You can't help em, no strippers and killers welcome (I know)
You can't hear it, no ignorance in my lyrics
Boy they swear I went loco, 116 still my logo
Catch us rollin' in that Volvo, gon snap you a photo
Maybe Andy or Pro though, might see Trip in De Soto
Maybe KB, maybe T-Dot, yeah I know you don't know though
Yeah I know they don't like me, cause I be on my Spike Lee
Even when I do the right thing, they still wanna fight me
IRS want they taxes, police stop us in traffic
Plus my girl be on my back, she say my life is so hectic
Crae they watchin (I know), Ay they takin (I know)
I done seen this before, this just part of the show, let's go

I know, I know, I know, I know
I know, I know, I know, I know
I know what they sayin' but I promise that I'm cool though (I know) I know what they sayin' but I promise that I'm cool though (I know)
I know what they sayin' I ain't trippin' on it mane
I just came to do my thing, something different for a change
I know, I know, I know, I know
I know, I know, I know, I know",https://genius.com/Lecrae-i-know-lyrics
Self Discovery,Restoration,2020.0,"He was a smart kid, it was always about Lecrae 'cause he was the baby
We knew he had somethin' in him, we never expected this though

Now, grandma said we came from Jamaica
Crossed the ocean, 'til we made it
And my DNA tested said the Westside of the motherland is where they take us from
Um, never met my daddy's side so I couldn't tell y'all if I'm Zulu or Xhosa
Couldn't tell y'all how I be courtside
Or made it this far without a cosign
Of course, I struggled a lot and stayed prayed, prayin'
Unforgettable, Swae Lee, Swae Lee, demons Achilles, KD, KD
Now I'm up, it's a real life
And when it get real I can feel Christ
Heal this branch on the family tree that was here for me
Man, the roots so deep

Self-discovery (Self-discovery)
Self discover me (Self discover me)
Help uncover me (Help uncover me)
Help me to understand who I'm supposed to be
Not just a wannabe

It's dangerous over here, this is a dangerous area
Give me money, fool!

I've seen big pain, big loss, but still been big blessed (Blessed)
All that cap big, big, big, big, big, big, big stress (Stress)
All y'all want big house, big car, big ice, big checks (Checks)
Man, I wish y'all did, did, did, did, did that less

You ain't gonna be nothin', your daddy wasn't, you ain't gonna be
I know that he always had, uh, something in him

My little cousin was hittin' me up, man, I changed all my numbers I never knew
Crazy how digits were causing division, can't nobody get at the revenue
Seven numbers on a smartphone
Equal cash app the lights on
I get royalties, but I got loyalties, so send a bill, I'll go half on it
Half black, half unknown
Are we Cherokee or Seminole?
I got PTSD runnin' through me from my kinfolk
Stress had me going AWOL
Sin got me actin' Adolf
I'm like ""Aye y'all, I need days off, I'm depressed, having brain fog""
It's obvious, I'm highly blessed
I finally get to understand what a man is when he at his godliest
To get there I was highly stretched and I was highly stressed

I gotta deal with Bloods and Crips, Calvinists and charismatics, black, white, red, brown, y'all ain't gon' stress me out

I've seen big pain, big loss, but still been big blessed (Blessed)
All that cap big, big, big, big, big, big, big stress (Stress)
All y'all want big house, big car, big ice, big checks (Checks)
Man I wish y'all did, did, did, did, did that less",https://genius.com/Lecrae-self-discovery-lyrics
Only Human,Restoration,2020.0,"Da-da
Da-da-da, da

Please forgive me if I mess up
Knowing that you watch is so much pressure
Still God I thank, I'll never let up (Let up)
So every day when I see the sun come up, I'ma say, let's get it
Get it done, every day
Provin' that I'm still Your son
If You hear me and You're with me
Heaven not too far, far as I can tell
You just gotta go through a little Hell

Ain't no prescription for my brokenness, no pills for hopelessness
I still pop them tryna cope with it, I cry from loneliness
Devil played his part and played me, I'm foolish, grew too lazy
God say, ""Take heed lest you fall,"" but I'm such an October baby
Need you to hold me down (
Down
)
World tryna slow me down (
Down
), know me now
Know my vices, kryptonites, they entice me 'til I slowly drown
Now I'm on holy ground
Can't fight these battles alone, they after my home
They after my mind, they after my time
You said, ""I'm an heir"" they after the throne
I thought I was running from demons, but maybe I'm running from me and my tether is roamin', running from clones
We talking 'bout running the city, but most of us running from home
Running from trauma and poverty, I hit the lottery, I thought they'd leave me alone
Look at me, richer than ever, but poor as a beggar when you look inside of my soul
Broke the sacred rules and paid a lot of dues on my soul (Soul, soul, soul, soul, soul, soul)
Almost lost my family, drank the Devil's juice on my soul (Soul, soul, soul, soul, soul, soul)
Thought I was immune a superhuman, fool on my soul (Soul, soul, soul, soul, soul, soul)
If I lose my life somehow, I still don't lose on my soul (Soul)

Please forgive me if I mess up
Knowing that you watch is so much pressure
Still God I thank, I'll never let up (Let up)
So every day when I see the sun come up, I'ma say, let's get it
Get it done, every day
Provin' that I'm still Your son
If You hear me and You're with me
Heaven not too far, far as I can tell
You just gotta through a little Hell

Oh my God, how I beat the odds? How I beat the charge?
Oh my God, how You make the moon? How You speak the stars?
Oh my God, when they see my flaws, they gon' call me fraud
I was lost, blinded by applause, now I know my calling
Said I admit it, I'm countin' the minutes
They comin' to get it, go tell 'em I'm with it
They killed the Messiah, they don't have no limits
So what they gon' do to me? Give me my sentence
Or hit me with venom, I don't have opinions
All I got is patience and a couple pennies
I ain't independent, leanin' on the spirit
I know we gon' win it, so go hang the pennants
I was in a mansion goin' out my mind
Had the doctors on the line
Wifey cryin', momma cryin', we'll be fine, know I'm lyin'
I ain't wanna live, my babies need me live
Come too far to shut my eyes
But all this pain, I can't survive
But God said ""Hol' up, I got it, I do this"" (Yeah, yeah)
He lifted my head up then helped me get to it
He gave me the beauty for ashes, I blew it (Yeah, yeah)
I thought I was ruined, He started renewin'
I look at my life, I'm like, ""What is You doin'?"" (Yeah, yeah)
He look at my life, He like, ""Already knew it""
And yet I still love you, I'm walking you through it (Yeah, yeah)
Your actions are foolish but I know you human (Human, human)

Please forgive me if I mess up
Knowing that you watch is so much pressure
Still God I thank, I'll never let up (Let up)
So everyday when I see the sun come up, I'ma say, let's get it
Get it done, every day
Provin' that I'm still Your son
If You hear me and You're with me
Heaven not too far, far as I can tell
You just gotta through a little Hell",https://genius.com/Lecrae-only-human-lyrics
Welcome to H-Town,Church Clothes,2011.0,"Welcome to H-Town, yeah
Welcome to H-Town, whoa
They say them boy's riding clean
But without the King, what does it really mean
Cup full of lean, got a sweet for the green
Wake up, boy this ain't a dream
Welcome to H-Town

Fell in love with a harsh road at my auntie house
Dipping with my kin folks, them spoke, okay I
Candy paint, sexy as we tipping from the city lights
Got them boys flexing, baby, every time we pimp the ride
Gripping wood grain, always sipping good, man
I was down for whatever, wished somebody would mayne
Enticing with them vices, yeah mayne, looking pretty like a bad yellow bone
While I'm dipping through the city. Th-Th-Throwed in the game it's going down, I'm yelling mayday!
It's like the world stood still when we bought them gray tapes
Ch-chop chopped screwed, outchea act a fool
It's got me wondering what's next, baby, when this life is through

I was born in H-Town, starched down way back
When the slabs in the city beat that screw off in the back
Poking eye, keep them spinners, eating Frenchy's chicken dinner
Family came from 3rd Ward Scott Street on up to Ennis
Hanging out on Sunnyside with my cousin Corel
They was on that purple Sprite,
 
I was still sipping 40s
Keke's
 still pimping stories as I'm passing by Yates next
Stop and wonder if I'll enter heaven's gates
I told my cousin D at TSU
 ""I smoke trees
I think the Lord is calling me, both of us agree""
And, man, I love the city of my birth, that's why I plea
That God will change the H the same way He's changing me!
Cause all I cared about was riding clean
A pocket full of green, and find a bad yellow
I can put up on my team
My bros riding dirty, know your soul ain't clean
And gon' let the Lord intervene!

Welcome to H-Town, yeah
Welcome to H-Town, whoa
I'm praying for H-Town, yeah yeah
Welcome to H-Town, whoa, yeah

I had a dream on the plane that I was sitting in the slabs
Seat back, bass up, 
chunking deuce and giving dap
Talking to my partners 'bout these plans that I have
When I told them ""Oklahoma"" made them boys just laugh, like
""Where there at, folk? "" ""man, stop the joking"" ""yeah, you hood, but you ain't dat dope""
It's like they couldn't understand me having that hope, trying to serve God
They want me serving things with that dope, but that's when we flat broke
Pass the kill. And as I got higher, death is what I started to feel ""dog, we smokin' kill""
I backed away from the killer, He picked up my life and my vision got clearer
Destiny is screamin' it's faint, but I hear that things are bad right now
But the man in the mirror is trying to make a change,
 rearrange some things
H-Town, I still love you, hold up, man

Uh now what y'all know about them Texas boys
Uh now what y'all know about them Texas boys
Uh now what y'all know about them Texas boys
Uh now what y'all know about them Texas boys
Now what y'all know about them Texas boys",https://genius.com/Lecrae-welcome-to-h-town-lyrics
The Price of Life,Church Clothes,2013.0,"Yeah, fake hair, fake nails, fake pearls
Call herself a Barbie, wanna be a fake girl
She can't even see, she Stevie Wonder at night time
Too busy trying to get them red bottoms the right size
Tell her that you love her and she gonna call you a liar
(Whatever, you don't really love me, you just wanna give me the lie)
On the bet, but the fact is she deals with fools
That see women as garden tools, never treated them cool
She said that suckers and brothers always makin' her sick
So she gave up on em now she's just attracted to chicks
But she never seen a man with a soul as clean
He fightin' to be whatever God made him be
Don't want to manipulate her, date her, lay her, then shake her
Wanna give his life to her followin' his creator
Maybe she gonna see he ain't crazy and start wondering
""God, what's the reason you made me? ""
Maybe it ain't to be physically attractive just so you can trap and capture
A man, that'd be superficially happy. Nah, you're worth more than that, yeah

Beautiful lies, yeah, I know they ain't right
But I bought it, but that's the price of life

Yeah, look
I wanted the girl that was super official
I found my standard superficial
Cause behind the glamour was some super issues
And I ain't trying to shoot to diss you, I'm just sayin'
Everybody gotta look fly, call em planes
And you don't wanna step outside, lookin' plain
They call it running game, everybody playn'
Dang, that's trinity the word 'play'
Sephora made you make up your mind
Coach bags made you feel first class this whole time
And them Nike kicks running your life
Your ambition been driven by them cars that you like
I know some girls that's faster than Tech N9ne
Self esteem as low as they neck-line
Cause they don't know whose image they reflect, went to bed to find love, woke up with regrets
This is a matter of heart, kid
Gimme a second, let me show you
If you own something you can't depart with
You probably don't own it, it own you
Man, tell me what's the price of life
Too much to find peace, so what's your release
Yeah, there's much more, believe me
Than living for the things that your leaving
Preach


She camouflage her insecurity in Jimmy Choo's
High heels but the mountain's top she'll never choose
She'll set up for a dude & precious medals
A slave to his money by his chains you can tell it
Page to embellish the life that you really live
Them nice clothes cover up, how you really feel
When your eye liner off and you've been revealed
Trapped in a prison with multiple life sentences
55 life times as infinity, you don't wanna pray your middle fingers to Divinity
You ever stop and think about what the incentive is
Livin for their approval has got it's benefits
They special cause they don't live like you
But they die and their blood bleeds red like you
Truth is they depressed, takin' meds like you
They ain't livin' it up, they're dead like you

But you can live, uh
If you know the price of life",https://genius.com/Lecrae-the-price-of-life-lyrics
