title,album,year,lyrics,urls
Long Time Coming,Church Clothes,2012.0,"I've been treating this part of life like a dance floor
Side stepping all the things I've made plans for
And I ain't acting when I'm taking on a man's role
Chance to enhance the fam can be a handful
I rather have my hands full than be empty-handed
Travel all around the planets till I have it planted
Firm roots like great grand pap, married 65 years, 20 kids, same family
Strong as an ox and I'm from the same stock
So I won't be hanging out 'till I see the sun-o'clock
It's been a long time coming but I'm coming at a decent hour
Everything I have is ours start the wedding shower
Teeball games in the summer ballet in the winter
And I ain't scrolling through my twitter while we having dinner
Time to grow up, done drinkin I throw up
Neglected little man from my plans, try'n to blow up
Some people are so focused on the road to success
They don't see their whole family laying dead on the tracks
I rather cease to have my lyrics read over tracks
And put some family photos on the walls instead of plaques

It's been a long time coming, but we're here now
Unashamed

Look
I remember watching videos by Hype Will
Thinking I could do that if I had a nice deal
But the precedent is MC's dead believe
They take the same exit that Mason Betha did
Cause when you're talking steal then ya sound hard
But they let you out ya deal when you found God
Back to watching Hype Will, think about how I feel
Wishin spitting Christian wasn't God's will
It's been a long time running, long time wondering
Long time humming stupid songs that I hated
From a rapper that I felt was overrated
Cause I knew that he was faking but he everybody's favorite
Coming with that same hi hat and 808 hit
Bricks that they weight lift, chicks that is naked
I'm in my house studyin' the scripts that is sacred
If this a success recipe I ain't gonna make it
So many reasons not to
I only graduated high school
I'm from a small little city that they fly through but never fly to
Just a plain town tryin' to be fly too
Ak-town rapper, we backed down never
So I'm finna to take my hood up like Trayvon
Finna hold my hood down like your favorite mob
Finna mix some hood nouns with the Pharaoh Monch
Walking with the King, boy, watch the Pharaoh march
Red Sea is my favorite part
The Lord opened up a new avenue
Industry got the wrong awards and we passin through
Church clothes on the mic spitting what your pastor do
Looking at the world through our Master's view
Offer you the optic codes, keep this glasses, too
On fire for the king, but we're cold rappers, dude
It's been a long time coming",https://genius.com/Lecrae-long-time-coming-lyrics
Wait,Real Talk,2004.0,"That man don't love you like he need to
If he ain't following Christ
He can't lead you
I ain't tryin to deceive you
I know he look better than most men
But without Christ
Looks are no reason for bragging and boasting
You got your heart on him
Now you can't depart from him
You knew from the beginning not to even start on him
Compromising your faith for sex
Hurting yourself and God
Cause you outside of marital context
What's next?
Mami show respect for your body
Instead of getting naked and naughty
Like sex is a hobby
You know what you supposed to do
Let him loose and cling to the God
That wants to get close to you
You've been blessed as the chosen few
Mami if he ain't rolling with Christ
Then don't let him roll with you
Cause you've been blessed as the chosen few
And if he ain't rolling with God
Then don't let him roll with you
Wait

Ready to go (wait)
Can't take no more (wait)
I know it's hard but God is never late
Don't follow your feelings (wait)
Just follow His will (wait)
Girl serve the Lord and don't anticipate
Wait

I know you the apple of momma's eye
A star in your daddy's sky
But God knows you living a lie
You giving a guy
Everything your husband deserves
It's absurd
Don't follow your feelings
Just follow the word
You wanna be in a relationship
Well you can give him your all
But how deep can the relations get
If your God's on the sidelines
You won't be happy I promise
Until you understand that God is the lifeline
He ain't pleased with lust
So even if it feels right. remember
He ain't pleased with us, when we
Let our emotions loose without a ring on the finger
It's only gonna come back to sting ya
Don't let the singers sing you sweet lullabies
Without giving the King, a King's sweet love a try
It ain't nothing better
Who else you know would up and
Give up his life just to love you forever
Wait

Ready to go (wait)
Can't take no more (wait)
I know it's hard but God is never late
Don't follow your feelings (wait)
Just follow His will (wait)
Girl serve the Lord and don't anticipate
Wait

I know you thought that y'all could win together
Y'all been together
But all y'all do is sin together
You wasting your own time
You keep deceiving your mind
Saying that this is part of God's design
Knowing he treating you good
Know his ways is nice
But he can't love you like he should
He's not engaged to Christ
And you know this ain't the man for you
But you hold on like God ain't got better plans for you
The whole worlds says you should be dating
God says you should be serving Him while you patiently waiting
Everybody rushin and racing
Hugging and kissing and holding hands
All before the days end
I know it's hard, but trust
I wouldn't waste my breath on this song if it wasn't a must
The same God that made you
The same God that died for your sins and saved you
He ain't trying to play you
Wait

Ready to go (wait)
Can't take no more (wait)
I know it's hard but God is never late
Don't follow your feelings (wait)
Just follow His will (wait)
Girl serve the Lord and don't anticipate
Wait",https://genius.com/Lecrae-wait-lyrics
Crossover,Real Talk,2004.0,"You can find me in the Church
Focused and alert
No suit and tie
Jeans and a t-shirt
I'm into praising God
'Cause He made us out of dirt
And plus He gave His life
For this world's evil works
So flirt with that
Most of y'all can't jerk with that
Cause it ain't no benefits and no perks with that
Still gotta live your life on this earth with that
But we live eternally and I can work with that (holla)
Yeah I cheated, yeah I lust within
But guess what, that's why I trust in Him
See you thinking that you ain't that bad
You just lying to yourself playboy
You better check your health
While you all about the cash and ice
Hope you ready for change
You just broke the first commandment twice
And I know that you done stole before
If it wasn't a gun, it was some gum from the grocery store
It's all sin to God, man look into God
You guilty, you ain't even a friend to God
Sin gotta high price, it'll cost your life
But God fit that bill on the cross with Christ so

Crossover
From death to life
What's the hold up
Accept the Christ
We flex the mic to rep for Christ
So we can put your soul at rest tonight
Crossover
From death to life
What's the hold up
Accept the Christ
We flex the mic to rep for Christ
So we can put your soul at rest tonight

I don't catch the Spirit, I'm all filled up
I can't lose it either, I'm all sealed up
And you can bet your life, I'ma rep for Christ
One taste, He'll get you right
Folks is, thinking they Christian, but when they sinning they don't Feel the conviction that the, Spirit is giving, and they
Keep living life like, that's cool with me
, y'all people ain't fooling me
Try to play me to the left like I'm trying to get deep on em
This is real talk dawg, you better peep something
This ain't that philosophic rap like homonym
, 
and I ain't talking about the God you heard about from mom and them
Put that blunt out dawg, put down that Heineken
Man God understands, what? Come again?
I guess you think that God is kinda like yo momma huh?
Like He ain't even tripping on your sinning and your drama

Crossover
From death to life
What's the hold up
Accept the Christ
We flex the mic to rep for Christ
So we can put your soul at rest tonight
Crossover
From death to life
What's the hold up
Accept the Christ
We flex the mic to rep for Christ
So we can put your soul at rest tonight

Life's way more then ice and rims
And you don't make enough to pay the price of sin
And God's gon judge you dawg, that's reality
Saying you don't believe is like saying there ain't no gravity
Then running off to go jump a cliff
And when you hit the ground tell me what you get?
Why you running from the freedom of the gospel?
You hostile
, 
you looking like you're Lucifer's apostle
But God got you, and though we all deserve death
He still keep putting breath in your nostrils
But you treat Him like an obstacle
See Him come at your convenience like a Stop-N-Go
Waiting for a sweeter deal or a sign or something
Like God ain't come down and die or something
Trust me dawg, God wants the best for you
That's why the gospel of Christ is addressed to you

Crossover
From death to life
What's the hold up
Accept the Christ
We flex the mic to rep for Christ
So we can put your soul at rest tonight
Crossover
From death to life
What's the hold up
Accept the Christ
We flex the mic to rep for Christ
So we can put your soul at rest tonight
Crossover
From death to life
What's the hold up
Accept the Christ
We flex the mic to rep for Christ
So we can put your soul at rest tonight
Crossover
From death to life
What's the hold up
Accept the Christ
We flex the mic to rep for Christ
So we can put your soul at rest tonight
Crossover",https://genius.com/Lecrae-crossover-lyrics
Check In,Rehab,2010.0,"Yo, check me in
Ch-ch-ch-ch-ch-check me in now
Ch-ch-ch-ch-ch-check me in now
Ch-ch-ch-ch-ch-check me in now

Check me in
I know I’m sick and my addiction got me itchin’
Everyday I need a fixin’
I ain’t quittin’ till it kill me
Ya hear me, I like the feel but hate the taste of the product
Like the numb on the tongue when you taste narcotics
The bass gets to bumpin’
You can feel what I’m drummin’
Death is comin’, I’m tryna warn ‘em
That’s why I was summoned
I know that they don’t want it, they want what they can’t have
Euphoria come and go but it’s something you can’t grasp
Yeah, we’re grasping for the emptiness, hoping we can catch something
Hand full of scars, cuts, burns, as the flesh wants
Verge of insanity, stop me ‘for I’m gone
I say I’m gon’ quit but I’m at it in the morn’
It goes on and on and on and now I’m used to it
This a lifestyle now and I don’t know what else to do
Got a war inside my soul and it’s wantin’ to break through
I’m ready for Rehab, jus’ do what ya gon’ do

Rehab, rehab, reha-ha-hab, ready for rehab
Rehab, rehab, reha-ha-hab, ready for rehab
Rehab, rehab, reha-ha-hab, ready for rehab
Rehab, rehab, reha-ha-hab, ready for rehab
Rehab
Aye, aye, aye, aye
Yo, check me in
Ch-ch-ch-ch-ch-check me in now
Ch-ch-ch-ch-ch-check me in now
Ch-ch-ch-ch-ch-check me in now

Rehab, rehab, reha-ha-hab, ready for rehab
Rehab, rehab, reha-ha-hab, ready for rehab
Rehab, rehab, reha-ha-hab, ready for rehab
Rehab, rehab, reha-ha-hab, ready for rehab
Rehab
Aye, aye, aye, aye",https://genius.com/Lecrae-check-in-lyrics
We Don’t,Real Talk,2004.0,"I ain't the standard at all • and wouldn't claim to be • but since Christ snatched me up • there's been a lot of change in me • I done got my worldview corrected • I see things eternal • yeah I got a whole new perspective • and I don't use drugs or sell • keep accountabilty • cause my flesh yeah It love to fail • I don't go where I used to go • I got my number changed twice for the girls that I used to know • and I don't trip when I pass the cops • cause I'm not making assists you know • trying to pass the rock • I don't live life scared of death • cause when I take my last breath • the next step • is there in Text • I'm not a legalist and I ain't hating • but there's things I don't and won't do man I read Galatians • and I keep reading Ephesians • if it's Christ we believe in we shouldn't be confused with the heathens

You gon ride with us? Nah I don't do that there
You getting high with us? Nah I don't do that there
You wanna hit a lick? Nah I don't do that there
Get a couple chicks? Uh-uh I don't do that there
You gon roll with us? Nah I don't do that there
You getting throwed with us? Nah I don't do that there
I know you gon hit it right? Nah I don't do that there
C'mon I know you with it right? Uh-uh I don't do that there

Man I don't trip on copping whips • if it ain't a DVD • you won't catch me popping clips • I don't trip on chains and shoes • my God thinking bout whether to change the city sky from greys to blues • I don't chase love up in the club • I chase thugs with a great love sent from the heavens above • I don't care about the famous names • cause when Christ come back a lot of folks gone be nameless mayne • and I ain't worried bout speaking His name • if it wasn't for Christ • yeah we'd all be sinking in flames • and I don't even wanna change the game • your favorite rapper got saved last night • yeah that's the aim • the world we living in is simply tempting • so I quit consenting • to my flesh when it tries to pimp me • till I die or God come to get me • I ain't doing what this world wanna do • now is ya with me?


I'ma keep it short simple and plain • I used to fiend for the pimp game but got with Christ and switched my aim • flipped my pain to a burden • to grab Hip-Hop His name and merge it • with His word as the plate then serve it • cats like who you serve kid? • man it's gotta be Him • who wiped my sin • slate clean like Oxy-10 • I rock Christ from PA to Dallas • R-Swift and Lecrae walk in the Spirit till our feet ache with callous • nah I'm buggin but for real my point is • without Christ life is pointless • this joint is • for the prisoners trapped on the block • we're blasting shots • cause cats to drop like temperatures • without Christ and His restoration • your chance of making it is slimmer than Blacks getting reparation • Jesus Christ man the Ancient of Days • get with Him for eternal life and pass the phrase


(You gon ride with us?)
Nah player, I don't even get down like that no more
(You getting high with us?)
I ain't even tryin' to do that man
(You wanna hit a lick?)
(Get a couple chicks?)
Nah man, I can't even do it
(You gon roll with us?)
Y'all rollin out?
Yeah go and do that
(You getting throwed with us?)
I can't even move with you no more man
(I know you gon hit it right?)
I know Christ man, that's all I know now
(C'mon I know you with it right?)
I'm sayin I'm not the same
I'm a new creature
A whole new creation
A whole new mentality
I can't get down with it
Know what I'm sayin?
It's real life
Real talk
I can't do it",https://genius.com/Lecrae-we-dont-lyrics
Walking On Water,Rehab,2010.0,"So I’m walkin’ on water
So I’m walkin’ on water
So I’m walkin’ on water
So I’m walkin’ on water

Yeah, go ‘head, ask me how I do it, bruh
The sky falling, but I’m still flyin’ through-and-through
Hey this ain’t willpower, it’s wheel power
With God at the wheel, now that’s some real power
I feel power, so I’ma trust that
That’s how I persevere, that’s how I jump back
Yeah, the hurricanes never go away
So I’ma stand firm, tell ‘em I don’t blow away

I bet’cha never see me with my head hung low
I bet’cha never see me with my eyes to the floor
I bet the boys can’t hold me back no more
Ain’t no lookin’ back, letting everything go
When I see a problem, when it get tough
I don’t get soft, man, I ain’t givin’ up
There’s no turnin’ back, man, I will stay strong
It’s time to go hard or it’s time to go home
So I’m walkin’ on water, hey
So I’m walkin’ on water, hey
So I’m walkin’ on water, hey
So I’m walkin’ on water, hey

I know it’s all good, when it’s all bad
There’s somethin’ workin’ in me, hey what ya call that?
Some call it perseverance, some people say endurance
But I know for sure it, it’s got me so secure
Yeah, I got faith, that’s why I hold on
‘Cause I’m an alien, I’m ‘bout to phone home
I’ll be long gone, see you hard times
Hello joy, love, peace and a sound mind

I bet’cha never see me with my head hung low
I bet’cha never see me with my eyes to the floor
I bet the boys can’t hold me back no more
Ain’t no lookin’ back, letting everything go
When I see a problem, when it get tough
I don’t get soft, man, I ain’t givin’ up
There’s no turnin’ back, man, I will stay strong
It’s time to go hard or it’s time to go home
So I’m walkin’ on water, hey
So I’m walkin’ on water, hey
So I’m walkin’ on water, hey
So I’m walkin’ on water, hey

I spit the Word any time you hear ya boy flowin’
So please plagiarize me, take my word for it
Hey I’m Lecrae, but you can call me ""Crayola""
Not because I’m in the kitchen whippin’ up the soda
But because I’m here to paint a vivid picture for ya
I know the truth’s hittin’ by the way I pitch it for ya
You’re fightin’ for attention, I’ve got the riddlin’
I’ve got the hope, boy, I’m the middle-man
Let me show you my Supplier, yeah you need to know him (Christ)
He got me walking on the water when the wind’s blowin’
And when the storm’s brewin’, and when the tide’s high
That’s when I lean into the truth that I abide by

I bet’cha never see me with my head hung low
I bet’cha never see me with my eyes to the floor
I bet the boys can’t hold me back no more
Ain’t no lookin’ back, letting everything go
When I see a problem, when it get tough
I don’t get soft, man, I ain’t givin’ up
There’s no turnin’ back, man, I will stay strong
It’s time to go hard or it’s time to go home
So I’m walkin’ on water, hey
So I’m walkin’ on water, hey
So I’m walkin’ on water, hey
So I’m walkin’ on water, hey",https://genius.com/Lecrae-walking-on-water-lyrics
The Bride,Rebel,2008.0,"A building of beings being constructed
Christ is the cornerstone, foundation build on another and you's a goner holmes
She' built on em, supported by him, conformed to him, now she's a body of bodies who transform through him
A temple that breathes we are the halls
We are the floor board or more we are the walls
Manifold wisdom of God no longer a mystery
The church is the pinnacle of our salvific history
One flesh union homie
The Tri-union is glorified through our corporatized communion
Still the present reality is she was born a casualty though she's made alive
She's affected by depravity
Once lived in sin and enslaved by her lust and
Folks catch her slippin and they turn away disgusted
She's a work in progress Christ is the head of her
And He wash her clean with the words that he done said to her
She's already pretty but she's really not dressed and sometimes she look silly but she's far from a mess
Yes, please so don't be dissin cause Jesus done paid grip an
And if you didn't then should caller her Misses. I'm talking bout the church

Yeah she may look gritty
When her man come back she gone look so pretty - She the Church
You might see her acting crazy, be patient with her tho cause she still God's baby - She the Church
Before you dis her get to know her, Jesus got a thing fo her and died just to show her - She the Church
She ain't bricks and buildings
She all of God's people Men women and children

Her name is ecclesia meaning the the assembly
Bows to (the Trinity) No other Divinity
A body family and community she is all one
But on earth you see her in congregational small ones
A microcosm or a small scale example
But yes it is the church even though it's just a sample
Invisible spiritual
Physical visible
Not a brick temple never that simple
This a not a building
She is not bricks
She's a world changer but ain't bout getting rich
Perpetrating fakes cause a lot of folks to hate
Plus her hands get dirty and her feet get scraped
And sometimes her body parts start acting outa place
Legs tryna be arms
Arms thinking they the face
But she'll never be replaced with a one man band or a small Taliban with no body in command

Yeah she may look gritty
When her man come back she gone look so pretty - She the Church
You might see her acting crazy, be patient with her tho cause she still God's baby - She the Church
Before you dis her get to know her, Jesus got a thing fo her and died just to show her - She the Church
She ain't bricks and buildings
She all of God's people Men women and children

Some don't get it so they hate
They say she's on a paper chase they say she's really fake
So they go start a ministry so they can do the work
But they don't understand how Jesus feel about His church
And yeah they make disciples
They got plenty conversions
They take care of the widows and the orphans they be workin
But none of them are churchin
No church structure
No elders and no discipline
They don't have a conductor
And they so they don't submit
But quite a few of them baptize
People how I pray that you'd look at this thing from God's eyes
Take responsibility inside the whole council not just the area where you might have a mouthful
Who should folks submit to
Who will conduct the discipline
If excommunicated what body will they be missing then
Look at Ephesians 4 where Paul gets practical
1st Timothy and Titus if you thinking I'm irrational
Homie that's the church

Yeah she may look gritty
When her man come back she gone look so pretty - She the Church
You might see her acting crazy, be patient with her tho cause she still God's baby - She the Church
Before you dis her get to know her, Jesus got a thing fo her and died just to show her - She the Church
She ain't bricks and buildings
She all of God's people Men women and children",https://genius.com/Lecrae-the-bride-lyrics
