title,album,year,lyrics,urls
Three’s Company (Feat. Big Daddy Kane),UnKnown,UnKnown,"Big Daddy Kane:
Uh
Ayy yo marley man
‘member that shit from bK and what not?
Yeah they was real stuck up actin when everyone was tryin to holla at ya, ya know?
Now I got that uh, I got ahead of it the other day man
On top of wildness playa check this
We checkin out some kung-foo flicks and my man grippin madena
I think we seen her
Jackie Chan and feelin Syeena
Shame is from all the crew
Actin out of order too
Realize we short a boo
Down to the last quarter too
The thought “to do”
Send some of my people to the store
Said the PlayStation broke
Everybody bum rush for the door
We all together deep
Warriors that never sleep
Up the street
Here come that that QB don’t ever sleep
Well now today we making Eye-contact
Looking all flamboyant
Nipples at a straight point
She stopped and said “hi”
Told me I be looking fly
She like the way I coordinate my timbs and DKNY
“thank you”
I said I thought you had a real stuck up attitude
Cuz I ain’t never seen ya kicking it with without a dude
When told me why there ain’t no man do you know
The answer almost made my head stand up like Coolio
Whoa
She said it ain’t about that high post earl
But I ain’t like most girls I like the best of both worlds
Hope ya comprehend cuz that’s the way I’m living
To many dogs for men
Don’t want my heart broke again
Chorus: x2
(Jay-z)
Ménage á trios with
Big Daddy Kane:
I’m trying to make this thing threes company hello
(Verse 2: Big Daddy Kane)
I said that’s gravy baby
Matter of fact I mean a privilege
I should have been to knowledge when you said you hang out in the village
Don’t underestimate things we can do
I can get bent up with you like one of my niggas in the crew
To many things you eliminate when you discriminate
Passing up the meal before you see what’s on the dinner plate
Vibe with me
And try to describe to me
What you’ve been deprived to see and what you want a man to be
Maybe I can teach you something about mankind
Cuz rubbing belly to belly pressing skin to skin
Bodies fucking like here one ain’t a damn thing going in?
Uh uh I know there’s got to be a better way
I ain't trying to let you get away
Preferably
High heels and tight dresses would be first nominee
But gangsta bitches never fear
I bone thugz in harmony
If we got the same taste maybe we can work together
Where’s your girlfriend because I’m down for whatever
And maybe we can be some sort of a three some
You me and she some
I’m feelin jack tripped up by myself
Chorus: 2x
Verse 3: Big Daddy Kane
She said I ain’t the crew type
But I got a girl that you’d like
Right there a dime in carrot tights with the blue stripe
Remember her or not
Guess by now you forgot
But she said you hit it back when “get the job done” was hot
Oh word?
Aight so school her on a mission
Im wishing on her vision of becoming the third edition
Make her make the right decision towards this whole proposition
Listen this rendition involves a lot more than just kissing
Cuz I’m not the type to disturb the groove
Ill let you first make your move
Before I start operation smooth
Go ahead and getcha
Groove going in with her
Did I hitchya?
The only thing that’s missing from this picture
Shit have us looking like a game of twister
I ain’t got nothing against your sexual preference
If that’s the way you get down
Then that’s how you get down
But when you need the helping hand I’m around how that sound?
Hehehehe
(Chorus) X4",https://genius.com/Marley-marl-threes-company-feat-big-daddy-kane-lyrics
Wack Itt,"In Control, Volume 1",1988.0,"Wack itt, wack itt, wack itt...
Now this is called the Wack Itt, and I do it all the time
Choose the wackest, wackest beats, and add the wackest, wackest rhymes
The wacky, wacky, wacky voice, which I really shouldn't say, is wacky
Some people say it's wack, but it's not, it's just cracky
This is how I do it, some people just can't hack it
If it's cold outside, then go on and put on a jacket
But now I'm here to tell you. and we know this for a fact
This record's just like crack, you know what it is? It's wack
Wack itt
I mean you're goin out the whole nine yards
Now I'm sittin in my room tryin to guess just what to do
So I decided to get wacky, cause you know, yo, that's true
So we turned on to a track that had to be super wack
And yo, guess what we came up - somethin like that
I was really thinkin about some things that make me mad
How could you get a gold record when you sound like J.J. Fad?
I mean come on, let's be for real, I mean I didn't wanna say it
But their shit was so wack, yo, this one I know you'll play it
It's record
A wacky record
Now just jump up and down, spin your head from left to right
Then just move a little bit, get real close, but not too tight
Let me see you throw your hands up in the air like you don't care
And that's called the wackest dance, and we'll call it the Underwear
It's a record
A wacky record
(Go on, girl)
Now my name is Shanté, not Wanda Wah-Wah
And I'm here to make a record, and some people say I'm a star
I say: Yeah, I do agree, but you have to think real close
I mean, when it comes to bein wacky, J.J. Fad, yo, they're the most
It's a wack itt
Wack itt, wack itt, wack itt...
Now if you want a example, let me tell you what makes me mad
Did you ever hear Supersonic that was by J.J. Fad?
Listen close to what I'm sayin, cause it went somethin like this
(La-la-la-la-la-la-la...)
Or you can say I missed, I really can't resist
To come to someone, up to their face. and then give them a diss
I do it all the time, everytime I say a rhyme
People jump, yeah, all on mines, cause you know they're out of line
I tell them to step right back, cause you know the record's wack
If you do not like the record, yo - I got it like that
I can make rhymes up just like this
Make the people not wanna resist
They listen to the beat and start to dance
And then they start to jump up in their pants
Now I told you how to do the dance
Get on the floor and take a chance
Now this is known as a matter of fact
Yo, stop the track, let's get wack
Wack
Wack
Wack
Wack

Yo yo
Wait a minute
Wait a minute
My ears
What you're doin, baby
Stop playin
Stop
Stop
Stop
My God
Wack itt, wack itt, wack it…
Ah-ha
Wack wack
Now sittin in my room tryin to guess just what to do
So I decided to get wacky, cause you know, yo, that's true
So we turned on to a track that had to be super wack
And yo, guess what we came up - somethin like that
Now get offa my tip
Ha-ha-ha-ha
Now who would believe...
See this - this here happens to be a fad or a faze or a style
That the party people happen to be going through
And I'm in this to win this
And I'm here to get paid, so I figured I might as well get wack too
I mean come on
They might even tell me that the record is
DYNAMITE!!!
Now wasn't that cute
But anyway
Wish I get some respect after this one
Wack itt
Wack itt
Wacky wack itt
Wack itt
Wack itt",https://genius.com/Marley-marl-wack-itt-lyrics
Keep Your Eye On The Prize,"In Control, Volume 1 (2009 Special Double Disc Edition)",1988,"(feat. Master Ace)
To get where you wanna be
You have to set a goal
And keep your eyes on the prize
Yeah

Now let me take a second, just so I can beckon
And call out an all-out rush just like wreckin
Your brain as you strain to maintain, sustain
The way you felt because I dealt you pain
And pleasure, in every single measure
You miss being kissed by this lyrical treasure
Enjoy it at your leisure, cause it's gonna please ya
Master Ace and Action again is here to ease ya
Spirit, cause all you have to do is hear it
And you'll catch a stroke
And say, ""Damn, that brother broke!""
Now I'm about to get off another funky hit off
And if you think you're hangin, yo, I think you bit off
More than you can chew, now how you gonna swallow it?
Check the technique, see if you can follow it
Like a path or a road made of yellow bricks
Yo Steady Pace, go 'head and bust the mellow mix


So keep your eyes on the prize
Keep your eyes on the prize
Keep your eyes on the prize
Keep your eyes on the prize
And keep your eyes on the prize

Now I'm the capital A and what I'm sayin is conveyin
That I romp, stomp and jump on any competition
That's opposed to me, they can't get close to me
You say that goes to see, what's that supposed to be?
Some kind of challenge? I take you head up
Beat up and eat up punks and won't let up
But not with my fist or even with a deadly weapon
But with my lyrics, yeah, that's how I'm steppin
On all those that doubt me or my race is won
And you critics are hopin that the Ace is done
But now consider, this here little bit of
Super commentary for those that are very
Misdirected and lookin for some kinda angle
Censorship is their attempt to strangle
The Master, they know that my words can motivate
And set straight the crooked from their fate
Don't you understand that rap is like a tool to me
You're sellin what? You're actin likea fool to me
Go get a job or maybe go and learn a trade
And make the grade, that's how you get paid
Steady's on the cut and Action is the posse
Open your eyes and you'll see what I see
Brothers are fallin, homegirls are callin
Themselves independent, but yo, we're all in
The same boat together, it doesn't matter whether
You disagree, it's still reality - see


Now where're we goin, where are we goin, which direction?
Look at your reflection, now someone praise the resurrection
Of a people many years considered kin
To an animal, unlike those with lighter skin
But that's the past and many knew it couldn't last
By peaceful means or either by a rifle blast
Or whatever, better late than never
We finally arrived and yo, the dream has survived
But many died tryin and they're the ones that paved the way
Real live supermen and -women save the day
So that we can live our life without ?????
Racial oppression, mental anguish through aggression
So realize what it took for us to rise
And don't sleep but reap and keep your eyes on the prize


Sing a song of six pence, a pocket full of crack
Think you're sayin somethin, you ain't sayin jack
Now tell me, what is goin on these days?
From what I'm seein lately I'd say crime pays
Cause somebody is gettin paid
I think it's time to sprinkle some rain on the parade
Now listen, take this as a word from the wise
I'm not a prophet or a preacher, just a man with eyes
And I've been witnessed the fitness of a neighborhood worsen
You oughta hold a person-to-person
Discussion with those who rose from that level
Usin a broom or a mop or a shovel
Not on the corner waitin for the big pay-off
It's not comin, so why not stay off
The streets, believe me it beats bein sent up-
State on a date with the man and bein pinned up
In solitary, take advantage of your freedom
I'm givin helpful hands cause you need em
It's not all about the cash you make
Sellin poison to boys and girls - you're a fake
So what you got a cable, so what you got a BM?
You love when the girls go, ""Ooh, did you see him!""
So what your pocket's filled with 20s and 10s
You're gonna find out just how fast that ends
Cause one day you'll be drivin round the way in your ride
There'll be a bullet with your name on the side
And if you don't believe what I'm tellin you, mack
When you're layin on the ground with a hole in your back
Lookin up at the sky, gettin closer to hell
Just remember Master Ace had a story to tell
Yeah
Yo
Keep your eyes on the prize 
Keep your eyes on the prize 

""P""
""R""
""I""
""Z""
""E""",https://genius.com/Marley-marl-keep-your-eye-on-the-prize-lyrics
Keep Control,"In Control, Vol. 2: For Your Steering Pleasure",UnKnown,"RISE. R-I-S-E. Rap Industry for Social Evolution. So you gotta understand something: it's hard to move as one, but it's easy to move as many
(Chorus)
Keep control...
(Tragedy the Intelligent Hoodlum)
When I made arrest the president, America ate me
Spoke the truth that the gov't hates me
They labeled me a prejudice poet
I'm speaking the truth as I know it
I hold on but it's hard for me to handle
Too much lies, corruption and scandal
Cops want to kill a brother or two
Who do you call when the gang wears blue
I ain't going out like an Uncle Tom man
My gun is loaded and I'm itching to pull the trigger
I'm marking for death as a funky rhyme sayer
Corruption flows from the cops to the mayor
Mali troops will run through your resident
In my hand will be the head of your president
All you fess that made a check to throwdown
Will rise up for a political showdown
Chorus
(King Tee)
Yo, King Tee stepping in on a dark tip
Open your eyes and your mind and get a grip
Of the ropes and chains that kept us
Since we were black they didn't want to except us
But it's ok, I got my own plan
Cause yo, I ain't down wit your program
The natives cook, wash and clean
Until the rebel stepped on the scene
M-A-N-D-E-L-A
Now you got a chance to hear what he say
Since they kept him locked up for so long
Cause his skin was black and his mind was strong
But we need to all stand together though
And let the red, black and green show
Become aware of yourself before it gets too late
Another message from King Tee the great
Chorus
(Grand Puba)
Yo bust it
Hun did the flip, got a doobie wig
Now she thinks she's all that shit, her man does hits
Hun livin' lovely, Miss Gucci
Even got a Benz when she drives around wit all her friends
Ugn, miss quick fast in a hurry
Speedy, speedy, speedy, the bitch is greedy
Spend so fast, she got caught wit 4 kids
And the man caught a nice thick bid
Now the bitch is on skid
Screaming how she hates her kids
The move for the bitch is a thing quick and easy
Think slick, she better get wit the WIC
Cause foul, foul, foul is your style
You tried to run the race but you lost by a mile
See it everyday, it's the same old sorry song
How long must this go on
Chorus
(Def Jef)
Power now or never, together forever
And ever, sever make it endever
To enlight your brother when
I recommend to extend a hand
Expand and then with strength defend
Black women and men from the white power structure
They sucked ya in, stoled your culture and fuked ya
And you gave birth to a nation
Your free labor laid America's economic foundation
Blood, sweat and tears and fear for years
But now here’s what appears to be the shift in the gears
The turn of the tables, knowledge enables
Us to escape the sterotype wit the labels
And years of classroom fables, fiction
Fallacies, falsehoods, and fabrications
Facades, even fronts
Star Spangled story, stigma and stunts
Chorus
(Chubb Rock)
I know this 11 year old kid named Jeffery Cowen
And knowing his father slowing
And his mother is hoeing
And now should he be growing
He's too young to be sewing
He should just chill and be flowing
I know he was being malested and sold
And his mom for being infected
Never check it, so I invested
My time and made sure little bro was looked at
Pops got evicted, bitch got a smack
Pumped his fists and being that I'm a pugilist
The bum got done by the one
And little Jeffery, no more tears left to drip
Mixed wit semen on his lip, emotional trip
It confuses and bent ill thoughts
In the soul of the youngster
Is daddy a monster
That raw creates lip sores and heartache pain
Dries and open your eyes for the insane
Chorus",https://genius.com/Marley-marl-keep-control-lyrics
America Eats the Young,"In Control, Vol. 2: For Your Steering Pleasure",UnKnown,"Here, where's the Black man in America mentally dead..

America eats the young
America eats the young
Yeah, Traged'
America eats the young
America eats the young
Yeah, come on

America eats the young, that's the title
Black-On-Black-Crime is suicidal
Racial outburst, killed in Bensonhurst
Now he's free in the universe
Killed the cop, he's unworthy
Murdered that poor black boy in Jersy
There's no sorrow, but you can borrow
America kills tommorrow
Get a grip and, time is slippin'
Howard Beach, Michael Griffin
To Halliburton, Larry Davis
These are the exemples America gave us
Pain inserter, Black converter
Mr. President, he's the murderer
Brothers waitin' for the Government to save them
Instead of usin' the minds the Lord gave them
High School drop out, now you clocked out ""come on""
Did a crime, got caught and you copped out
Incarcerated, you're just hate it
Made your bed, but you don't wanna lay in it
No probations, black and racin' ""come on""
My founation is the Nubian Nations ""let them know somethin""
Culture saker, political faker
Black raper, molder and maker ""Ugh""
Where is my mule and fourty eight acres? ""aiy""
Abraham Linclon, dead and stinkin'
Use your brain black men start thinkin' ""give it them""
I refuse to die 'til my job is done  ""give it them""
America eats the young

Give it to them
America eats the young
America eats the young
Give it to them now
America eats the young
America eats the young
Ugh, let them know somethin'
America eats the young
America eats the young
Tell them Traged'

You used to look so good, but now you don't
You used to work, but now you won't
Scotty got your body cracked out
Got so high one day, you blacked out
Sold your body to an old white waiter
Had a friend, nine months later
Abused the child cause you hate every bit of him
Sayin' the saga that you shouldn't have got with him
You ain't no mother, you're a monster
Killed the youngster, put him in the duster
Sounded mournin, cold and swollen
Out of control and, your soul is rollin'
You played the keeps for life got stolen
Cracked the pain, killed your brain
Now you're criminally insane
The judge gave a sentence to outlive ya ""Hay""
Now you're beggin' for God to forgive ya ""come on""
In a cell, is where you dwell   ""that's right""
You scream and yell, you tried to hail
Grabbed the rope cause you choked on your last breath
The only way out is death
From the cell you hung, your body is swung
Now justice is done

America eats the young
America eats the young
That's right Traged', tell him
America eats the young
America eats the young
Eats its young
America eats the young
America eats the young

Yo Traged, show them why you're the 
Intelligent Hoodlum
Let them know somethin, come on now

Give a black man a badge and a gun and he thinks he is bigger
Ugh, he ain't nothin' but a sell out nigga
Pay him off and he'll pull the trigger ""come on""
Just to do me in, cause I'm a Nubian ""right, right""
First he pulled me in, then he cued me in
Lights of Islam, drop the bomb
It's Tragedy, not Uncle Tom
Preacher practice, our blacklist
Black leaders, you lost your blackness ""let them know somethin""
I ain't Tobie, you can't mold me
FIGHT THE POWER, Chuckie told me
So I'm doin' this, you wanna ruin this
Keep your eyes on this, lyrical scientist
I'm aimin' a gun and I won't miss
Deeper dominant, poetical prominent ""word them up""
There's no stoppin' it, once I'm droppin' it ""yeah, Traged'""
I'm almost done, America eats the young

America eats the young
America eats the young
That's right Traged', kick it
America eats the young
America eats the young
Hey, ha ha
America eats the young
America eats the young
Yo, Marley Marl In Control
America eats the young
America eats the young

Yeah, that's right with soul
Turn table number one and Turn table number two
The Intelligent Hoodlum in full effect
Fightin' the Power for you and yours
Marley Marl In Control
Tragedy, that's right
Yo, you got pick up one
Yo, let them know somethin' Tragedy
We gon' kick it to you like this, come on
In control, with soul
In control, with soul
America eats its young
You're Goddamn right",https://genius.com/Marley-marl-america-eats-the-young-lyrics
The Symphony (Marley’s Symphony Scratch),"In Control, Volume 1 (2009 Special Double Disc Edition)",1988,"(feat. Master Ace, Craig G, Kool G Rap, Big Daddy Kane)

Listen closely, so your attention's undivided
Many in the past have tried to do what I did
Just the way I came off, man I'm gonna come off
Stronger and longer, even with the drum off
I keep on goin' and flowin' just like a river
I got a whole lot to give so I'm-a give a
Little at a time, new trails are blazin'
Action is in effect, and always stays in
Yeah, just like a shot from a cannon
I am the man in charge and I've been plannin'
A jam strong enough that it can life your soul
I'm the originator, and my rhymes are made of gold
Once you hear the capital ""A"" rap, it'll stay
With you for awhile, it won't go away
Unless you force it, because it stays with you, my friend
And if you toss it away, I'm-a hit ya again
I project my voice so it's right in the crowd
There's a sign at the door: no bitin' allowed
And if you didn't read it I suggest you do so
Or you'll be stranded, just like Caruso
Sleep if ya wanna, go 'head, get some shut-eye
A man broke his jaw tryin' to say what I
Say on the microphone, you shoulda left it alone
Just for the record, let it be known
That my ego's only partially grown
And never will I ever condone biting in any form, yo I'm only warm
That verse was the calm, now here's the storm...
Next up (Yo, I believe that's me). Craig G, light up the mic for the Symphony

This jam is dedicated to all un-optimistics
That though I wasn't coming out with some exquisite rhymes
But that's alright, cuz now I'm back
To kill all the rumors and straighten the facts of me
Not rockin' rhymes like I always used to
But you jumped on hte tip when you heard me and the Juice Crew
You said, ""Mmm mmm mmm, ain't that somethin?
Yo Craig, I head you in that jam, and it's pumpin'!
I apologize. Oh yeah, and uh, can I have your autograph for me and my grandma?""
That's how I'm livin': all surprise mode
Don't even sleep, try not to keep your eyes closed
Cuz if you do, when you awaken, your so-called spot will be taken
I'll take you over like a greedy executive, cuz on the mic my prospective is
To be the best in all rap events, and since I have a call, I call experience
Next up...(Yo, I believe that's me)
Kool G Rap, light up the mic for the Symphony...

Yo, Marley gives the slice, I get nice
And my voice is twice as horrifying as Vincent Price
Goes deep, till you fell in a spell of a sleep
And while I'm countin' the money, you count sheep
When G Rap strikes the mic, I recite the type of hype that you like
And make the people unite
I grip up hips and zip up lips, step on reps, you flip and wanna sip on my tip
Take a deep breath, because you don't have another left
Comin' back like I'm avengin' my brother's deat
Makin' veterans run for medicine
Cuz I put out more lights in a fight than ConEdison
Rip the damn cage like I'm on a rampage
And if you want rage, I'm-a make front page
Read the headlines, suckers, todays the deadline
Your head is way past bedtime
Can't kill though. Solo. Cuz you're still all...soft like a pillow
My rap is rougher than Brillo
So fear me, don't dare dare me
And don't compare me to him when you hear me
Talk about a battle but you ain't yet ready for war
Your metaphor sucks more than a whore
You can't replace me, ice me or ace me, bass me, face me, slice me or race me
Bite me or taste me -- I'll show you that I got force
My rap burns your mouth like hot sauce
Run for water while I break your tape recorder
Server-to-sucker: the order is manslaughter
Another rapper, G Rap wrecks, he's rated X, to mean the boy is sex. Next...
The amplifier gets used and abused. Pumps so loud, we might blow a fuse
This is anger, madness, ready to hang 'er
Rapper or singer: I'm puttin' up my middle finger
Next up... (I believe that's me)
Big Daddy Kane, get on the mic for the Symphony

Settin' it off, lettin' it off, beginnin'
Rough to the endin', you never been in
To move the groove with the smooth rap lord;
Like a bottle of juice, rhymes are being poured
Down your ear, crisp and clear
As I prepare to wear, tear and smear - then I'm outta here
With a mark left that you can all cling
Cuz rockin' a party? Yo, it's a small thing
I rip many places on regular basis, and broken down mics were the only traces
That I'd been there and there at the party
The mic had my prints, and on it was a body
So take caution. I'm not horsin' around in a throwdown, clown
I'm takin' yours son
So just acknowledge the way that I kick it
Cuz if rap was a house, you'd be evicted
And dismissed from the microphone, chokin' on a bone, cuz Daddy's home
And battlin' me is hazardous to health
So put a quarter in your ass, cuz ya played yourself
Like a game in the arcade. You need a far aid
I'm walkin' the path that Allah made
I'll attend and then begin to send a speech to reach and teach
So just say when
So I can let lyrics blast like a bullet
My mouth is the gun; on suckers I pull it
The trigger, ya figure, my pockets gettin' bigger
Cuz when it comes to money, yo, Grant's my nigga!
You've got the groove, MCs, freeze, stand still, nobody move
It's a sabotage, as I take charge. Don't barge, cuz gotdamn, I'm livin' large
Like a giant. You're nothin' but a midget, a small digit
You ain't hit it, forget it, quit it
I reign superior, always takin' care o'ya
No-frill rappers, you will evaporate, disintegrate, deflate to your fate
As the great will dominate straight to the state
Of reignin', gainin. So put Kane in, that category. Period. End of story...",https://genius.com/Marley-marl-the-symphony-marleys-symphony-scratch-lyrics
