title,album,year,lyrics,urls
The Symphony,"In Control, Volume 1",1988,"I don't care who's first or who last
But I know that y'all just better
Rock this at the drop of a dime baby
I don't know what y'all gon' do with this, but it got to be funky
It got to be funky if you're gonna be on it
I don't care who start
I don't care what y'all do
But you got to be finished
Before the music is through
Now who's first up to bat?

Listen closely, so your attention's undivided
Many in the past have tried to do what I did
But just the way I came off then, I'm gonna come off
Stronger and longer, even with the drum off
I keep on goin' and flowin' just like a river
I got a whole lot to give so I'mma give a
Little at a time, new trails are blazin'
Action is in effect, and always stays in
Yeah, just like a shot from a cannon
I am the man in charge and I've been plannin'
A jam strong enough that it can lift your soul
I'm the originator, and my rhymes are made of gold
Once you hear the capital ""A"" rap, it'll stay
With you for awhile, it won't go away
Unless you force it, because it stays with you, my friend
And if you toss it away, I'mma hit ya again
I project my voice so it's right in the crowd
There's a sign at the door: No bitin' allowed
And if you didn't read it, I suggest you do so
Or you'll be stranded, just like Crusoe
Sleep if ya wanna, go 'head, get some shut-eye
A man broke his jaw tryin' to say what I
Say on the microphone, you shoulda left it alone
Just for the record, let it be known
That my ego's only partially grown
And never will I ever condone bitin' in any form
Yo, I'm only warm
, that verse was the calm, now here's the storm

Next up... (Yo, I believe that's me)
Craig G, light up the mic for the Symphony

This jam is dedicated to all un-optimistics
That thought I wasn't comin' out with some exquisite rhymes
But that's alright, cuz now I'm back
To kill all the rumors and straighten the facts of me
Not rockin' rhymes like I always used to
But you jumped on the tip when you heard me and the Juice Crew
You said, ""Mmm mmm mmm, ain't that somethin'?
Yo, Craig, I heard you in that jam, and it's pumpin'!
I apologize, oh yeah, and uh
Can I have your autograph for me and my grandma?""
That's how I'm livin': on surprise mode
Don't even sleep, try not to keep your eyes closed
Cuz if you do, when you awaken, your so-called spot will be taken
I'll take you over like a greedy executive
Cuz on the mic, my prospective is
To be the best in all rap events
And since I have a call, I call experience

Next up... (Yo, I believe that's me)
Kool G Rap, light up the mic for the Symphony

Yo, Marley gives the slice,
 I get nice
And my voice is twice as horrifyin' as Vincent Price
Goes deep, till you fell in a spell of a sleep
And while I'm countin' the money, you count sheep
When G Rap strikes the mic, I recite the type of hype that you like
That make the people unite
I grip up hips and zip up lips
, step on reps
You flip and wanna sip on my tip
Take a deep breath, because you don't have another left
Comin' back like I'm avengin' my brother's death
Makin' veterans run for medicine
Cuz I put out more lights in a fight than Con Edison
Rip the damn cage like I'm on a rampage
So, if you want rage, I'mma make front page
Read the headlines, suckers, today's the deadline
Your head is way past bedtime
Can't kill, though, solo, cuz you're still all... soft like a pillow
My rap is rougher than Brillo
So, fear me, don't dare dare me
And don't compare me to him when you hear me
Talk about a battle but you ain't yet ready for war
Your metaphor sucks more than a whore
You can't replace me, ice me or ace me
Bass me, face me, slice me or race me
Bite me or taste me -- I'll show you that I got force
My rap burns your mouth like hot sauce
Run for water while I break your tape recorder
Serve the sucker, the order is manslaughter
Another rapper G Rap wrecks
He's rated X, that means the boy is sex, next
The amplifier gets used and abused
Pumps so loud, we might blow a fuse
This is anger, madness, ready to hang a rapper or singer
I'm puttin' up my middle finger

Next up... (I believe that's me)
Big Daddy Kane, get on the mic for the Symphony

Settin' it off, lettin' it off, beginnin'
Rough to the endin', you never been in
To move the groove with the smooth rap lord
Like a bottle of juice, rhymes are bein' poured
Down your ear, crisp and clear
As I prepare to wear, tear and smear -- then I'm outta here
With a mark left that you can all cling
'Cause rockin' a party? Yo, it's a small thing
I rip many places on regular basis
And broken down mics were the only trace is
That I'd been there and there at the party
The mic had my prints, and on it was a body
So, take caution, I'm not horsin' around
In a throwdown, clown, I'm takin' yours, son
So just acknowledge the way that I kicked it
'Cause if rap was a house, you'd be evicted
And dismissed from the microphone
Chokin' on a bone cause Daddy's home
And battlin' me is hazardous to your health
So, put a quarter in your ass cause ya played yourself
Like a game in the arcade,
 you need a far aid
I'm walkin' the path that Allah made
I'll attend and then begin to send a speech to reach and teach
So just say when
So I can let lyrics blast like a bullet
My mouth is the gun
; on suckers I pull it
The trigger, ya figure, my pockets gettin' bigger
'Cause when it comes to money, yo, Grant's my nigga!
You've got the groove, MC's, freeze, stand still, nobody move
It's a sabotage, as I take charge
Don't barge
'Cause goddamn, I'm livin' large
Like a giant, you're nothin' but a midget, a small digit
You ain't wit' it, forget it, quit it
I reign superior
, always takin' care o'ya
No-frill rappers, you will evaporate
Disintegrate, deflate to your fate
As the great will dominate straight to the state
Of reignin', gainin', so put Kane in
That category, period, end of story

Not in my book
Y'all are supposed to keep going until the end of the record
I still hear beats, what's wrong with you?
Yo, fellas y'all got to do somethin' on this them tracks
So let the track house you, what?
So let the track house you, what?
Yo, I can't believe it
I can't believe it
I can't believe it
I can't believe it",https://genius.com/Marley-marl-the-symphony-lyrics
Simon Says,"In Control, Volume 1",1988.0,"(Let's play a little game)
(Okay, I'm loosin up now)
(Aw - there it is!)
(I've waited long enough)
Bust a move, let's play a little Simon Says
So take your places and listen to the rhymin as
I like display a new style that just may
Leave suckers runnin for the door in total dismay
Yeah, by now, so you're startin to
Get a little hype, but first get a partner
And proceed full speed right to the dance arena
I really doubt it, but maybe by chance you seen a-
Nother brother more inclined to play the part of Simon
Than the Master Ace who knows the art of rhymin
Like a shark knows the finer points of swimmin
Like Steady Pace know the cuts and the fly women
And so before we start this game
Simon says: get up, and yo, I do the same
(Let's play a little game)
Now Simon says: look deep into your partner's eyes
(Let's play a little game)
Look at your partner from head to toe
(Let's play a little game)
And all those good parts in between, you know
(Let's play a little game)
Simon says: it gets badder, and you never had a
Beat that can heat your feet, and still add a
Theme with so much steam, it makes sweat pour
]From your faces, and the Ace is sure
Gonna do it, as you listen to it
See, I navigate ya straight to help through it
I'm Simon, rhymin, climbin on time, and
On a mission, that's the position that I'm in
Takin you there, makin you care
I'm achin to tear up the floor, but I don't dare
Leave the mic sittin, gettin cold without my hand on
Those that dance don't have a foot to stand on
And those that don't dance, yo, you oughta know
Simon says: wall flowers aren't allowed to grow
(Let's play a little game)
Now Simon says: close your eyes
And imagine your partner totally unclothed
(Let's play a little game)
Nude, in the butt, bare to the flesh
Now get as close as you can to your partner
And without touching him, move your body to the rhythm
(Let's play a little game)
Simon takes the stand, just as planned
And I display in a ray that's rather grand
Now I agree, there are many who said 'party's off'
But if one of them says, he drops arty soft
See to drop hard you must have the kind of mind
That's refined and artistically lined
Cause yo, it takes nack if you wanna attack
Attract with such skill, and still fit the bill
Ace and Action, few can come harder
Than we come, uhm - here's some, but only part of
The gift that can lift the myth that is swift
Only boast the most, yo, Simon says: if
If your partner's face is in place with your taste
Then haste, you better push up, no time to waste
So if you're with it, you better get it, don't try to sit it
On a chair and stare like a square, brother, quit it
There's no time for nerds and geeks, only freaks
With the sexy cheeks, as the Master speaks
And for weeks and weeks you will dance and prance
To the rhythm I enhance with my chants
So here's a glance at a jam that'll nullify
And fry all the rest, bust the color
Red, orange, yellow, green, blue, in the gold and violet
This jam is fly, and I'm the pilot
Flyin you straight to the end of the rainbow
Steady and I try to open your brain, so
You can accept what was carefully kept
Till the fun stops, then the party was pepped
Up, and if you stepped up, you couldn't hold your place in a chair
So hail Simon, the brother Master Ace in the rear
Simon says: yeeeaah...
(Let's play a little game)
Now Simon says: put your right hand on your partner's shoulder
And put your left hand on your partner's waist
(Let's play a little game)
Now move your hips rhythmatically
(Let's play a little game)
Now the climax...
Simon says: touch your partner's body
Touch your partner's body
In every way imaginable
Yeah
Do the nasty
(Let's play a little game)
I wanna say what's up to my DJ Steady Pace
Sha-Born the technician
Ray for real
Eye-Cu Rock and the rest of the Action Posse
Special thanks to DJ Marley Marl
And Tim Westwood rockin things out in U.K
(Okay, I'm loosin up now)
Peace, world
(Let's play a little game)
(Aw - there it is!)",https://genius.com/Marley-marl-simon-says-lyrics
The Symphony Part II,"In Control, Vol. 2: For Your Steering Pleasure",UnKnown,"I'm about to run, run a race with the rhythm
If you know the bass steps, dance, do it wit 'em
Gotta clock Gs, 'cause a G is worth a thousand
When I kick these types of rhymes I be housin'
All I wanna be, gonna be big shotties
Brothers ain't wit it then I do it for the hotties
But I know they wit it 'cause they know I ain't a phony
And it feels good like Tony! Toni! Toné!
And I like to kick a rhyme, rhyme for the people
Wanna reach the top? Climb, climb to the steeple
Top to high? Well, you best get a ladder
Say you're from the slum? Well, chum, it don't matter
Forget where you're from, it's all about where you're goin'
My name is Masta Ace and I don't tip-toe and
Never stall, fall, lose my grip or take a slip
Make a house call, hit a dip and then I skip
But not to my Lou, I never played hopscotch
Music man, baby, and the rhymes are top notch
Gotta try to uplift, lift the ghetto dweller
I try my best to never riff, riff wit' a fella
A brother sometimes tries to play it like tennis
Then it's time to pull teeth like a dentist
Oh, brother, brother, please don't play it
The rhyme is prime every time that I say it
Action's in effect, nothin' change but the weather
Juice Crew? Nah, but we still rock together
Craig G
(Yo, I believe that's me)
Aiyo, Craig G
(Yo, I believe that's me)
Aiyo, Craig G
(Yo, man, I believe that's me)
Kick it
1,2,3

Yo, once again, a brother's back to attract many age groups
Sportin' green and beige boots, poppin' like a hula hoop
You step to me and you'll be steppin' to a death wish
You probably thought I'm soft, of course you never met this
I'm not a crazy man, gun-totin' hooligan
But pass a mic to me and rappers I'll be doin' in
So, yo, uh, slide to the left a bit
'Cause I'm about to blow up in the '90s and I bet you get
Jelly and think of tryin' to do me
I work for my spot, so don't try to remove me
'Cause I can swing a rap like a batter hits a fast ball
Put on my track shoes and run right past all
Corny MC's and wannabes
Get played like a permanent crease in your Lees
So, next time the wizard gets you soft as a heart
Don't step to me because I rip the shit apart
Now, this ain't Mr. Rogers and I never play pretend
So, think about it, chump, if you step to me again
Yo, Big Daddy
(Yo, I believe that's me)
Aiyo, Big Daddy
(Yo, I believe that's me)
Big Daddy
(Oooh, I guess that's me)
1,2,3

Uhh, damn, it's true, I'm livin' mathematics
Asiatic, comin' up on the microphone just like an addict
Made to fit, 100% legit
As soon as I hit, ooooh, shit!
'Cause I'm gonna make the audience applaud me and support me
And award me when they saw me in action with my ???
Sharper than any other instrument
That archeologists can find, never known to mankind
'Cause I'm a rare species
And all you Filthy McNasty MC's can't even see me
You're too fragile to touch this mad style
Girls be runnin' up sayin', ""Oooh, you're too bad, child""
So, save your breath and exit stage left
Retreat before you meet defeat and greet death
You and any champion that even tries to touch this
Won't even get to keep his title long as Douglas
See, I'm the wrong one to fuck with
Oh, you still standin' there? (Yo, yo, look out, duck, kid)
I'm brashin' and bashin', crash and smash MC's
And enemies wit' these
'Cause I make sure everythin' comes out smooth

But you know your little brother must deserve his groove
Drop somethin', quick release a rhyme wit' quickness
To let MCs know about my existence
Any MC to last a minute is pure lucky
'Cause I'm the baddest kid that you seen since Chucky
Well, Kool G Rap
(Yo, I believe that's me)
So, G Rap
(Yo, I believe that's me)
So, Kool G Rap
(Yo, I believe that's me)
1,2,3

Yo, straight out the muthafuckin' gutter
I open my shutter to butt-ass brothers
And rip 'em up like a box cutter
You press up? I pull the trigger
I figured nobody could dig a Milli Vanilli-ass nigga
Prepare for shootin' fair, I'm knockin' boots daily
Fruits, I rip 'em out of their Roots like Alex Haley
Here I come straight to the mouth
I'm kickin' it slick, lyrics are harder than a dick inside a whore house
Your neighborhood hero's a zero
I'm sendin' muthafuckers on a Midnight Run like DeNiro
So, here goes a rappatittatackle
Feel a steel scalpel pressed up on your Adam's apple
Reach for the pistol and you're crazy
Try to blast and I'll be spinnin' that ass like Patrick Swayze
Said he was frightened when I rocked, they came in a flock
What is this shit, New Kids on the Cock?
Wanna battle? You need a paddle, 'cause shit creek's deep
But since you're ridin' on my dick, you need a saddle
No survivors, I spit 'em out just like saliva
Well, next stop ??? and I'm the driver
So, fake rappers try to diss, you're a little too proud
But niggas on white clouds are on my shit list
Do your ass in like Kennedy's assassin
Murder the whole mass and time for tresspassin'
I flow on notes like a sailor
Hoes are like clothes, I got they ass sewn up just like a tailor
Kool G Rap - one in a million
You're rollin' the dice to get sliced the fuck up like a Sicilian
A nigga can't do shit for me
G Rap and Marley Marl, I'm signin' out on The Symphony",https://genius.com/Marley-marl-the-symphony-part-ii-lyrics
Marley Marl Scratch,Street Jams: Hip-Hop From the Top Part 3,UnKnown,"All these beats and my rhymes attached
Form the new creation called the Marley Scratch
We're always steered in a positive course
His beats, my rhymes, combined make force
I say it's like a force cos the force is strong
And if you think we're weak I'd say you're wrong
All you other DJ's are a bunch of jerks
Marley give 'em an example how a DJ works

Since you just heard how a DJ sound
The name Marley Marl, I will break it down
The M is for Master of Scratch
And if the needle was to slip it's the needle he'll catch
The A is a letter that you set apart
I wouldn't call his beats music, I would call it Art
The R just stands for the way he Rock
Which is 24-oh-7 around the clock
The L is for Lyrics that I write
When put to his music sounds out of sight
The E is for Every beat he make
Which sucker DJ's persist to take
Don't play with the Y cos it isn't a game
You ax ""Why do you put the other DJ's to shame?""
After this there shouldn't be a story to tell
At the end of that is M-A-R-L
This paragraph here has come to a end
Marley, can we hear your funky fresh scratchin' again?

I never got caught in the game of Tag
My name is MC Shan, no need to brag
MC's brag about theirself all through their rhyme
You can see I got quality, won't waste my time
If I did not mean it, I wouldn't have said it
I'm gonna give the man behind the wheels some credit
I'm not tryna say that he can't be beat
But Marley Marl can stand on his own two feet
Since a DJ like him is so in demand
Marley won't you get on and show 'em where you stand

He can go on but I won't insist
How many fortunate MC's have a DJ like this
Every time I grab the mic I always have a plan
He's DJ Marley Marl and I am MC Shan
Combined we're fresh, this you must admit
Don't ever wanna hear you say we ain't worth jack
To be a DJ or an MC well it isn't no thing
If you ever wanna learn then just give us a ring
Like I just said, it wasn't no thing
You either have to be a ace, a jack, a queen or a king
When you're one of these, that means you're the best
And the people of today won't settle for less
We can be a jack or king, we can play the place
But we'd rather be a DJ and an MC ace

If you ever wanna battle, be at your best
Because a man like Marley just does not fess
In that battle you must give your all
Or just be prepared to take your fall
Cos a lotta DJ's already tried
There ain't been one yet that's qualified
To think you can beat him, you must be nuts
Just listen real close to his scratchin' cuts

The man Marley Marl can bring you to tears
He's not a new jack, he been down for years
On the two turntables I would say he's nice
Every cut he makes is so precise
When I said precise inside my rhyme
To put it to you straight that means right on time
Every jam he throws he always rocked
Don't refer to him as the neighbourhood jock
To all you DJ's who are always fessin'
From this man you can learn a lesson
You heard Dimples D when she took her stand
She said 
(Marley Marl is one hell of a man)
..
Gotta get it off my chest, to put my mind at ease
Since when you heard a DJ make cuts like these?",https://genius.com/Marley-marl-marley-marl-scratch-lyrics
Duck Alert,"In Control, Volume 1",1988.0,"(I don't even remember how this happened)
(The Crew will not understand it)
(Duck Alert)
(Yee-ee-aah)
(Duck Alert)
(Yee-ee-aah)
(The Crew will not understand it)

Yo, this jam is dedicated to you, boy, just listen
Take off your coat, get in a fit position
Cause I'm about to burn you at 450 Fahrenheit
You're jealous of the crew, that's why you're staring, right?
Forget the answer, the situation's obvious
When this is over, let's see who feels the sorriest
You'll be like, ""Damn Craig, why did you play me, yo?""
And then you realize we're top in rap radio
Cause it's no game, boy, you can't do work
Marley, please tell us his name (Duck Alert)
(Yee-ee-aah)
(Duck Alert)
(Duck Alert)
(Yee-ee-aah)
(Duck Alert)
(Has your crew suddenly become interested in promoting a war?)

Now our crew is broken down into a large amount of channels
And not one of us can you handle
On the mic Magic, on the tables Marley
And when it comes to bein dope, don't ask: are we?
Cause our style is different, or should I say irregular?
And if you wanna get all hype, I'll have to settle ya
By pulling out my 12-gauge shotgun
And if you wanna go rhyme for rhyme, I got some
Dope rhymes for sure, or should I say galore?
But I won't sound old-schoolish, in other words foolish
I have a question now: who feels hurt?
Marley, do you have the answer? (Duck Alert)
Thank (yee-ee-aah)
(Duck Alert)
(Yee-ee-aah)
(What happened between us, was for us alone)
(Yee-ee-aah)
(Duck Alert)
(I am speaking to you from the Bridge)
(Yee-ee-aah)
(Duck Alert)
(Yeeeeeeh)

After this, I hope you get someone to battle me
But make sure this person has originality
That's right, original, yeah, you heard me
I don't want his beats sounding like Hurby's
Oops -- I mean Marley, cause Hurb's a beat-biter
I don't know where the both of you get the right to
Come in the industry, steal someone's property
And some of you from it start clocking g's
Now that's not fair, Marley's the rightful owner
Yet you still treat him like he's a blood-donor
So now it's time to have revenge to all you jerks
Especially who, Marley? (Duck Alert)
That's right
(Yee-ee-aah)
(Duck Alert)
(I am speaking to you from the Bridge)
(Yee-ee-aah)
(Duck Alert)
(Yee-ee-aah)
(You're from where?)

Um - at the final stage, cut the scratches
Marley Marl? I think no one can match his
Cutting ability on the 1200s
And many listeners, they often wonder
(Yo man, was that a tape?!) Nah, never in a milion years
You see, the liveness gives us the feeling we're
Being accepted as true entertainers
And it will stay that way for the remainder
Of the century, that's how it's meant to be
You don't believe me? You will eventually
Because the situation, boy, you can't divert
Especially who, Marley? (Duck Alert)
Ah-ha",https://genius.com/Marley-marl-duck-alert-lyrics
Droppin’ Science,"In Control, Volume 1",1988.0,"(Get) (Get)
(Get)
(Get funky)
I'm droppin science

When I get stupid to the point that I'm mentally mad
My rhymes start to flow, so I simply must brag
About my style that makes you vibrant, I keep drivin
Until the song turns me to a hip-hop giant
Me and Marley Marl, we're goin one on one
For any sucker rapper that chooses to come
And for me Craig G a/k/a The Kingpin
I drop science, can't you tell how I'm singing?
They hate how I tie my mic cord to a whip
Suckers just have to flip cause I'm so hip
Craig G and Marley Marl, we form the ultimate alliance
No sucker can deal when I'm droppin science


Rappers: Ask yourself the same question
Why am I best in this profession?
Is it because you're scared to step to me, yo
Or the things Marley does in the studio?
I drop science as if I was Butterfingers
And I know there's not another singer
In this lifetime to kick the right rhyme
Cause there's not another rhyme quite like mine
And when it comes to havin showmanship
I really don't care who you go and get
Cause rappers hate me, I'm so defiant
And I can get stupid just by droppin science


Livin larger than life, and what this means is
We'll be the dopest duo comin outta Queensbridge
Now crews hate us cause we're extraordinaire
For you to beat us? Hm, I think that's sort of rare
These rhymes are dope, that's how I transmit
And sized perfectly, so that they can fit
You're steppin to us? You need traction
Or you'll be another sucker missin in action
You hate to hear it? You'll learn to love it
My smokin rhymes, you always think of it
I eat MC's up like a pack of hungry lions
So step out my way, I'm droppin science


The Vernon Posse along with me Craig G
Is gonna rock it till the crowd begs me
To kick the next verse, your context's worse
Like all the others, that's why I get respect first
And believe me, I'm never on on others
Cause as a member of Cold Chillin'/Warner Brothers
I do swear to uphold this
Title of rap to be the boldest
Among so many MC's
Yo Marley, yo we outta here?
(Yo money, let's breeze)
Alright",https://genius.com/Marley-marl-droppin-science-lyrics
