title,album,year,lyrics,urls
No Sense,Westend Mixtape Sessions,2005.0,"Now you know this just don't make no kind of sense
I'm still not yours and after all the time we spent
No sense
You say it makes no kind of sense
No sense
You say it makes
No kind of sense
No sense
You say it makes no kind of sense
No sense
You say it makes
No kind of sense
No sense
You say it makes no kind of sense
No sense
You say it makes
No kind of sense
When I first met you
You were my kind of guy
My heart would beat ten times too fast
Whenever you pass me by
But now you make me wonder
I just can't figure it out
I sensed a change in you
And of this I have no doubt
You hardly come to see me
And not like you used to do
And after all that's said and done
It seems that we are through
But when you add it up
And you see its incorrect
Although it makes no sense I guess
Its better to forget
No sense
You say it makes no kind of sense
No sense
You say it makes
No kind of sense
No sense
You say it makes no kind of sense
No sense
You say it makes
No kind of sense",https://genius.com/Marley-marl-no-sense-lyrics
Droppin’ Science (Hip Hop Version),"In Control, Volume 1 (2009 Special Double Disc Edition)",1988.0,"(feat. Craig G)
(Get) (Get)
(Get)
(Get funky)

When I get stupid to the point that I'm mentally mad
My rhymes start to flow, so I simply must brag
About my style that makes you vibrant, I keep drivin
Until the song turns me to a hip-hop giant
Me and Marley Marl, we're goin one on one
For any sucker rapper that chooses to come
And for me Craig G a/k/a The Kingpin
I drop science, can't you tell how I'm singing?
They hate how I tie my mic cord to a whip
Suckers just have to flip cause I'm so hip
Craig G and Marley Marl, we form the ultimate alliance
No sucker can deal when I'm droppin science
(Get)
(Get)
(Get funky)
I'm droppin science

Rappers: Ask yourself the same question
Why am I best in this profession?
Is it because you're scared to step to me, yo
Or the things Marley does in the studio?
I drop science as if I was Butterfingers
And I know there's not another singer
In this lifetime to kick the right rhyme
Cause there's not another rhyme quite like mine
And when it comes to havin showmanship
I really don't care who you go and get
Cause rappers hate me, I'm so defiant
And I can get stupid just by droppin science
(Get)
(Get)
(Get funky)
I'm droppin science

Livin larger than life, and what this means is
We'll be the dopest duo comin outta Queensbridge
Now crews hate us cause we're extraordinaire
For you to beat us? Hm, I think that's sort of rare
These rhymes are dope, that's how I transmit
And sized perfectly, so that they can fit
You're steppin to us? You need traction
Or you'll be another sucker missin in action
You hate to hear it? You'll learn to love it
My smokin rhymes, you always think of it
I eat MC's up like a pack of hungry lions
So step out my way, I'm droppin science
(Get)
(Get)
(Get funky)
I'm droppin science

The Vernon Posse along with me Craig G
Is gonna rock it till the crowd begs me
To kick the next verse, your context's worse
Like all the others, that's why I get respect first
And believe me, I'm never on on others
Cause as a member of Cold Chillin'/Warner Brothers
I do swear to uphold this
Title of rap to be the boldest
Among so many MC's
Yo Marley, yo we outta here?
(Yo money, let's breeze)
Alright
I'm droppin science",https://genius.com/Marley-marl-droppin-science-hip-hop-version-lyrics
Cheatin’ Days Are Over,"In Control, Vol. 2: For Your Steering Pleasure",UnKnown,"Verse 1
Al called me up about a quarter to six
Said Hey Nice, whats up with tricks
I got a cutie coming over, and she's bringing a friend
Why dont you keep her busy while I go and hit the skins
Now I know I wouldn't have called you if I knew you wouldn't do it
Besides she's cool and in an hour you can troop it
Thought to myself, I guess it sound cool
He said she had money was a scholar in school
I said OK cause see Al's my homie
Besides I don't front when it comes to tenderonies
Hung up the phone through on my dip wear
Had a half an hour before I had to be there
Got to his house he seemed surprised
Something was wrong and I could see it in his eyes
Stepped in the house and what did I see?
Her on a long couch sat Beauty and the Beast
Stepped to the cutie, Al said No
Trying not to laugh cause he knew it was her
He proceeded upstairs with the cutie on his arm
Said it with a smile, you can call that Yvonne
Chorus
My cheatin days are over 
Check it out
Verse 2
Well I told her my name, I didn't want to diss her
But I almost broke fool when she asked me to kiss her
I said lets leave take a ride or something
She said 100% I know a pump thats jumping
She took me to the Boonies, I met her friends and goonies
I saw a brother staring and growling looking loony
And Al told a lie see Vonne was broke
With a played out lease and that silver and gold rope
She must have got her hair on an ad on sale
Because she had a ballhead and with a pony tail
Man was I steaming just buying her drinks
Kept slamming them down everytime I blinked
She had a throat like a snake, hands like a rake
Eating and drinking, I had to put on her breaks
I said hey G you're getting hot on my collar
I'm not your damn mother and I'm sure not your father
If you bother with a man that's said he's had enough
You just might get snuffed
Chorus
Verse 3
After me digging and shooting the facts
She called me a bum I said I'm on to your trap
Since the night begins you've been burning more money
Now you're calling me a bum you know you're kin of funny
I think that you should wake up or use a different make up
You're really trying to play me and I'm really bout to smack up
Your grill kind of ill, hitting hard like Bruce Lee
I'm short like Spike Lee, Kick you in your right knee
Grab you round your neck stand you up on your feet
And take you out with the DDT
She was feeling real offended but I really didn't care
Called Al with the flavour then I drunk a few beers
I learned my lesson about trying to be your lover
That's why my cheating days are over
Chorus
Peace",https://genius.com/Marley-marl-cheatin-days-are-over-lyrics
Simon Says (feat. Masta Ace),UnKnown,UnKnown,"(feat. Master Ace)
(Let's play a little game)
(Okay, I'm loosin up now)
(Aw - there it is!)
(I've waited long enough)
Bust a move, let's play a little Simon Says
So take your places and listen to the rhymin as
I like display a new style that just may
Leave suckers runnin for the door in total dismay
Yeah, by now, so you're startin to
Get a little hype, but first get a partner
And proceed full speed right to the dance arena
I really doubt it, but maybe by chance you seen a-
Nother brother more inclined to play the part of Simon
Than the Master Ace who knows the art of rhymin
Like a shark knows the finer points of swimmin
Like Steady Pace know the cuts and the fly women
And so before we start this game
Simon says: get up, and yo, I do the same
(Let's play a little game)
Now Simon says: look deep into your partner's eyes
(Let's play a little game)
Look at your partner from head to toe
(Let's play a little game)
And all those good parts in between, you know
(Let's play a little game)
Simon says: it gets badder, and you never had a
Beat that can heat your feet, and still add a
Theme with so much steam, it makes sweat pour
From your faces, and the Ace is sure
Gonna do it, as you listen to it
See, I navigate ya straight to help through it
I'm Simon, rhymin, climbin on time, and
On a mission, that's the position that I'm in
Takin you there, makin you care
I'm achin to tear up the floor, but I don't dare
Leave the mic sittin, gettin cold without my hand on
Those that dance don't have a foot to stand on
And those that don't dance, yo, you oughta know
Simon says: wall flowers aren't allowed to grow
(Let's play a little game)
Now Simon says: close your eyes
And imagine your partner totally unclothed
(Let's play a little game)
Nude, in the butt, bare to the flesh
Now get as close as you can to your partner
And without touching him, move your body to the rhythm
(Let's play a little game)
Simon takes the stand, just as planned
And I display in a ray that's rather grand
Now I agree, there are many who said 'party's off'
But if one of them says, he drops arty soft
See to drop hard you must have the kind of mind
That's refined and artistically lined
Cause yo, it takes nack if you wanna attack
Attract with such skill, and still fit the bill
Ace and Action, few can come harder
Than we come, uhm - here's some, but only part of
The gift that can lift the myth that is swift
Only boast the most, yo, Simon says: if
If your partner's face is in place with your taste
Then haste, you better push up, no time to waste
So if you're with it, you better get it, don't try to sit it
On a chair and stare like a square, brother, quit it
There's no time for nerds and geeks, only freaks
With the sexy cheeks, as the Master speaks
And for weeks and weeks you will dance and prance
To the rhythm I enhance with my chants
So here's a glance at a jam that'll nullify
And fry all the rest, bust the color
Red, orange, yellow, green, blue, in the gold and violet
This jam is fly, and I'm the pilot
Flyin you straight to the end of the rainbow
Steady and I try to open your brain, so
You can accept what was carefully kept
Till the fun stops, then the party was pepped
Up, and if you stepped up, you couldn't hold your place in a chair
So hail Simon, the brother Master Ace in the rear
Simon says: yeeeaah...
(Let's play a little game)
Now Simon says: put your right hand on your partner's shoulder
And put your left hand on your partner's waist
(Let's play a little game)
Now move your hips rhythmatically
(Let's play a little game)
Now the climax...
Simon says: touch your partner's body
Touch your partner's body
In every way imaginable
Yeah
Do the nasty
(Let's play a little game)
I wanna say what's up to my DJ Steady Pace
Sha-Born the technician
Ray for real
Eye-Cu Rock and the rest of the Action Posse
Special thanks to DJ Marley Marl
And Tim Westwood rockin things out in U.K
(Okay, I'm loosin up now)
Peace, world
(Let's play a little game)
(Aw - there it is!)",https://genius.com/Marley-marl-simon-says-feat-masta-ace-lyrics
Buffalo Soldier (feat. MC Amazing),UnKnown,UnKnown,"Buffalo Soldier, Dreadlock Rasta
There was a Buffalo Soldier
In the heart of America
Stolen from Africa, brought to America
Fighting on arrival, fighting for survival
I mean it, when I analyse the stench
To me, it makes a lot of sense
How the dreadlock Rasta was the Buffalo Soldier
And he was taken from Africa, brought to America
Fighting on arrival, fighting for survival
Said he was a Buffalo Soldier, Dreadlock Rasta
Buffalo Soldier, in the heart of America
If you know your history
Then you would know where you coming from
Then you wouldn't have to ask me
Who the heck do I think I am
I'm just a Buffalo Soldier
In the heart of America
Stolen from Africa, brought to America
Said he was fighting on arrival
Fighting for survival
Said he was a Buffalo Soldier
Win the war for America
Dreadie, woe yoe yoe, woe yoe yoe
Woe yoe yoe, ya ya woe yo, woe yoe yoe
(repeat)
Buffalo Soldier, trodding through the land
Said he wanna ran, then you wanna hand
Trodding through the land, yea, yea
Sais he was a Buffalo Soldier
Win the was for America
Buffalo Soldier, Dreadlock Rasta
Fighting on arrival, fighting for survival
Driven from the mainland
To the heart of the Caribbean
Singing, woe yoe yoe, woe woe yoe yoe
Woe yow yoe yo, yo yo woe yo yoe
(repeat)
Trodding through San Juan
In the arms of America
Trodding hrough Jamaica , A Buffalo Soldier
Fighting on arrival, Fighting for survival
Buffalo Soldier, Dreadlock Rasta
Singing, woe yoe yoe, woe woe yoe yoe
Woe yoe yoe yo, yo yo woe yo,woe yo yoe",https://genius.com/Marley-marl-buffalo-soldier-feat-mc-amazing-lyrics
Freedom,"In Control, Volume 1 (2009 Special Double Disc Edition)",1988,"(feat. M.C. Shan)

It's Shan's what I'm called, I stand tall and brave
And me and Marley Marl is as close as a shave
My rhymes lock jaw like a pitbull bite
Suckers always try to sleep on me cause I look light
See, a lotta wack rappers try to rack their brains
To feel a style of MC, come on, break these chains
Speak now or hold your peace when I decide to pass it
But every rhyme you ever had could never surpass this
If rhymes were food, the main source for livin
You would swear that every line of my rhyme was thanksgiving
I don't bite styles, weak rhymes, I don't need em
Stop jockin me, boy, give me my freedom

I wanna break away clean, I mean virtually spotless
And all year long I been schemin and plottin this
If beats were cakes, then my rhymes'd get frosted
This is '88 and I still ain't lost it
For all of those who still got a doubt in their mind
There ain't a rapper livin bad enough to take mine
There ain't no studio-illusion and no scratch-syncin
Stop - if that's what you're thinkin
Write rhymes simultaneously, say em in pairs
And I would hate to have a rapper proclaim it theirs
Instead in comin in a limo, bring a casket and hearse
Before we speak we'll hear the preacher from the deacon first
We won't be gathered that day to unite no couple up
Marley, are we gettin this on tape? (Yup)
All you dirty low-down better slow down faster
Your technique isn't good enough to hang with the master
I don't bite styles, weak rhymes, I dont need em
Stop jockin me, boy, jockin me, son, jockin me, punk
Jockin me, kid, give me my, give me my, give me my freedom

I'm the opposite of what you say a slob is
Dumpin suckers off is exactly what my job is
I'm feared like Napoleon and blessed like Buddah
You couldn't face me solo, you'd have to bring your crew to
Dump me off, I don't recollect the mumble
I ain't soft, homeboy, and picture me crumble
And forget all of those that don't like my rap
I don't be kickin that old shooby-dooby-doo-wop crap
Rappers often brag about their bitin deejay
But they can't do Marley nothin, no how, so hey
It's clear to the ear what I'm sayin, son
That's why we feel like slaves on the freedom run
And each and every time a wack rapper walks by me
His head starts singin: Come on and fly me...
I don't bite styles, weak rhymes, I don't need em
Stop jockin me, boy, jockin me, son, jockin me, punk
Jockin me, kid, give me my freedom

We can do this like Brutus, I'm not mad, I'm pissed
This parade of mine I doubt that you can rain on this
You couldn't place my rhymes amongst mortal men
When I be rhymin on beats that set the hip-hop trend
I will always exist because I'm bein preserved
Don't agree to set me free, then you gotta be served
I earned a name amongst society as lyrically ill
But yet I'm loyal, see, cause marley hooks the beat up still
There's no way that you could say there's a day I'd fess
Hamana-hamana-nothin, you can kill that mess
My rhymes are ruthless, no heart, and totally wretched
And if they was to fall down then the beats would catch it
I don't bite styles, weak rhymes, I don't need em
Stop jockin me, boy, jockin me, son, jockin me, punk
Jockin me, kid, give me my, give me my, give me my freedom",https://genius.com/Marley-marl-freedom-lyrics
Easy Type Shit,Re-Entry,2001.0,"Make it ride y'all
Uh huh
We make it ride y'all
Get down, get down

Do do do do do do
All the ladies saying
Do do do do do do
Yeah
All the fellas saying
Do do do do do do
Yeah
And everybody saying
Do do do do do do

If you're driving
I know you're feeling this man
If you working
I'm really feeling you man
From the east to the west
North to south
God bless the words that come out my mouth
If you clubbing
I know you're feeling this shit
Hope you get some (?) before you're finished with it
Imma keep it real simple
Go and ball with your gang
Its that easy type shit, Seven Shawn is my name

Travel long distance, starting off the sentence
Spell it, speak it, and born it into existence
Story is told about me going overseas
Coming back
My paper be like right and exact
I don't know what they be talking about
Hustling crack
I don't know nothing, no convo
(?) John Doe
Yo what we did is on the low
I can't be spitting that thing over the radio yo
I don't know how they do it
Maybe they just don't
Lot of niggas talk
But Seven won't
Imma put this down for her and yours
Seven Shawn got body coming at your door

Do do do do do
Yeah
All the ladies saying
Do do do do do do

Hey yo we made our flow
Made our dough
Made our way
Made our pay
Copped that whip
Pushed that shit
Ain't it great, ain't it
Why you hate it
Do my thing
Roll head crack
(?) ace in the wrong place
Just in case
You thought a fella who still feel it
I know them niggas still feel it

Do do do do do do
All the ladies saying
Do do do do do do
Yeah
All the fellas saying
Do do do do do do
Yeah
And everybody saying
Do do do do do do

If you're driving
I know you're feeling this man
If you working
I'm really feeling you man
From the east to the west
North to south
God bless the words that come out my mouth
If you clubbing
I know you're feeling this shit
Hope you get some (?) before you're finished with it
Imma keep it real simple
Go and ball with your gang
Its that easy type shit, Seven Shawn is my name

Do do do do do do
All the ladies saying
Do do do do do do
Yeah
All the fellas saying
Do do do do do do
Yeah
And everybody saying
Do do do do do do
Yeah
Yeah
Yeah yeah
Uh

If you're driving
I know you're feeling this man
If you working
I'm really feeling you man
From the east to the west
North to south
God bless the words that come out my mouth
If you clubbing
I know you're feeling this shit
Hope you get some (?) before you're finished with it
Imma keep it real simple
Go and ball with your gang
Its that easy type shit, Seven Shawn is my name
La la
La la
La la
La la
La la
La la

If you're driving
I know you're feeling this man
I'm really feeling you man
From the east to the west
North to south
God bless the words that come out my mouth
If you clubbing
I know you're feeling this shit
Hope you get some (?) before you're finished with it
Imma keep it real simple
Go and ball with your gang
Its that easy type shit, Seven Shawn is my name
If you're driving
I know you're feeling this man
If you working
I'm really feeling you man
From the east to the west
North to south
God bless the words that come out my mouth
If you clubbing
I know you're feeling this shit
Hope you get some (?) before you're finished with it
Imma keep it real simple
Go and ball with your gang
Its that easy type shit, Seven Shawn is my name

C'mon play your  game
C'mon baby do your thing
C'mon
Everybody saying
Do do do do do do
Yeah yeah
C'mon
Easy, easy",https://genius.com/Marley-marl-easy-type-shit-lyrics
Freedom (feat. MC Shan),"In Control, Volume 1 (2009 Special Double Disc Edition)",1988,"(feat. M.C. Shan)

It's Shan's what I'm called, I stand tall and brave
And me and Marley Marl is as close as a shave
My rhymes lock jaw like a pitbull bite
Suckers always try to sleep on me cause I look light
See, a lotta wack rappers try to rack their brains
To feel a style of MC, come on, break these chains
Speak now or hold your peace when I decide to pass it
But every rhyme you ever had could never surpass this
If rhymes were food, the main source for livin
You would swear that every line of my rhyme was thanksgiving
I don't bite styles, weak rhymes, I don't need em
Stop jockin me, boy, give me my freedom

I wanna break away clean, I mean virtually spotless
And all year long I been schemin and plottin this
If beats were cakes, then my rhymes'd get frosted
This is '88 and I still ain't lost it
For all of those who still got a doubt in their mind
There ain't a rapper livin bad enough to take mine
There ain't no studio-illusion and no scratch-syncin
Stop - if that's what you're thinkin
Write rhymes simultaneously, say em in pairs
And I would hate to have a rapper proclaim it theirs
Instead in comin in a limo, bring a casket and hearse
Before we speak we'll hear the preacher from the deacon first
We won't be gathered that day to unite no couple up
Marley, are we gettin this on tape? (Yup)
All you dirty low-down better slow down faster
Your technique isn't good enough to hang with the master
I don't bite styles, weak rhymes, I dont need em
Stop jockin me, boy, jockin me, son, jockin me, punk
Jockin me, kid, give me my, give me my, give me my freedom

I'm the opposite of what you say a slob is
Dumpin suckers off is exactly what my job is
I'm feared like Napoleon and blessed like Buddah
You couldn't face me solo, you'd have to bring your crew to
Dump me off, I don't recollect the mumble
I ain't soft, homeboy, and picture me crumble
And forget all of those that don't like my rap
I don't be kickin that old shooby-dooby-doo-wop crap
Rappers often brag about their bitin deejay
But they can't do Marley nothin, no how, so hey
It's clear to the ear what I'm sayin, son
That's why we feel like slaves on the freedom run
And each and every time a wack rapper walks by me
His head starts singin: Come on and fly me...
I don't bite styles, weak rhymes, I don't need em
Stop jockin me, boy, jockin me, son, jockin me, punk
Jockin me, kid, give me my freedom

We can do this like Brutus, I'm not mad, I'm pissed
This parade of mine I doubt that you can rain on this
You couldn't place my rhymes amongst mortal men
When I be rhymin on beats that set the hip-hop trend
I will always exist because I'm bein preserved
Don't agree to set me free, then you gotta be served
I earned a name amongst society as lyrically ill
But yet I'm loyal, see, cause marley hooks the beat up still
There's no way that you could say there's a day I'd fess
Hamana-hamana-nothin, you can kill that mess
My rhymes are ruthless, no heart, and totally wretched
And if they was to fall down then the beats would catch it
I don't bite styles, weak rhymes, I don't need em
Stop jockin me, boy, jockin me, son, jockin me, punk
Jockin me, kid, give me my, give me my, give me my freedom",https://genius.com/Marley-marl-freedom-feat-mc-shan-lyrics
