title,album,year,lyrics,urls
The Rebel,"In Control, Volume 1",1988,"I'm here to bust your shit, the mastermind of manuscripts
The force of extremity, my rhymes are the remedy
You can't deal with the T-R-A-G
Rap annihilist flowing like Pegasus
Rhyming this easily as the obvious
I bust your head pulsating rotating
This jam is generating with the motion I'm creating
I'm the boy wonder, Tragic super duper
Raised in the Bridge, cause I'm a Queensbridge trooper
The rebel of the treble, the ebony prince
'88 is on the way, I make a big difference
I make it visual and intellectually clear
(Tragedy) the Rebel is here


Because I massacrate kids turning flesh to dust
And knocking all boots is a definite must
Cause I'm Havoc, Trag, Tragedy, Tragic
There are many ways to explain my magic
The explanatory category best fits me
Cause my lyrics are called sweet poetry
And I'm sick of b-boys just hipping and hopping it
I have you sayin, ""Damn boy, shorty be dropping it""
Back in the '60s to know is to know it
And I'm the last remaining of the world's last poets
Talkologist, infinity from when I begin
And to disapprove the Trag is a mortal sin
Diabolical gangster, hoodlum and genius
I write poetry when I find it convenient
Snap a stage in half like a polar bear
(Your Tragedy) the Rebel is here


I drop words you won't find in a dictionary
I write rhymes to improve my vocabulary
Drama, Art, English education
And I'm the man, I design the animation
Mentally and with jock control
The equalizer rises up on your FM mode
In which I use with telepath
And it's (Tragedy) who's on your phonograph
I confuse your conscience, and boggle your brain
You may think that I'm sick, but I'm perfectly sane
I design my rhymes with architectural construction
But that's another story, a different function
You see, it's mandatory to invoke fear
(Tragedy) the Rebel is here


The rap automatical, the rhymatical
Forget ill, I get illmatical
Biceps pulsating in my lungs
Queensbridge Projects is where I'm from
Wicked like a witch doing sorcery
With a book and a pen, and my M-I-C
The outstanding ovation when things get drastic
You keep fantasizing while I'm fantastic
Black magic flowing smooth but strong
And I'll have you rocking and shocking


Swing this episode to the 
Cormega Posse
My man from Uptown
Joe the Boss down with the Mutant Posse
To my right-hand MC, MC Cor
To Big Daddy Kane
My man Nut and Cool Cecil
Down with the Supreme Team in Jamaica
Can't forget the 40 Busters
My man Darryl gettin paid on the dime",https://genius.com/Marley-marl-the-rebel-lyrics
Keep Your Eyes on the Prize,"In Control, Volume 1",1988.0,"To get where you wanna be
You have to set a goal
And keep your eyes on the prize
Yeah

Now let me take a second, just so I can beckon
And call out an all-out rush just like wreckin
Your brain as you strain to maintain, sustain
The way you felt because I dealt you pain
And pleasure, in every single measure
You miss being kissed by this lyrical treasure
Enjoy it at your leisure, cause it's gonna please ya
Master Ace and Action again is here to ease ya
Spirit, cause all you have to do is hear it
And you'll catch a stroke
And say, ""Damn, that brother broke!""
Now I'm about to get off another funky hit off
And if you think you're hangin, yo, I think you bit off
More than you can chew, now how you gonna swallow it?
Check the technique, see if you can follow it
Like a path or a road made of yellow bricks
Yo Steady Pace, go 'head and bust the mellow mix


So keep your eyes on the prize
Keep your eyes on the prize
Keep your eyes on the prize
Keep your eyes on the prize
And keep your eyes on the prize

Now I'm the capital A and what I'm sayin is conveyin
That I romp, stomp and jump on any competition
That's opposed to me, they can't get close to me
You say that goes to see, what's that supposed to be?
Some kind of challenge? I take you head up
Beat up and eat up punks and won't let up
But not with my fist or even with a deadly weapon
But with my lyrics, yeah, that's how I'm steppin
On all those that doubt me or my race is won
And you critics are hopin that the Ace is done
But now consider, this here little bit of
Super commentary for those that are very
Misdirected and lookin for some kinda angle
Censorship is their attempt to strangle
The Master, they know that my words can motivate
And set straight the crooked from their fate
Don't you understand that rap is like a tool to me
You're sellin what? You're actin likea fool to me
Go get a job or maybe go and learn a trade
And make the grade, that's how you get paid
Steady's on the cut and Action is the posse
Open your eyes and you'll see what I see
Brothers are fallin, homegirls are callin
Themselves independent, but yo, we're all in
The same boat together, it doesn't matter whether
You disagree, it's still reality - see


Now where're we goin, where are we goin, which direction?
Look at your reflection, now someone praise the resurrection
Of a people many years considered kin
To an animal, unlike those with lighter
 skin
But that's the past and many knew it couldn't last
By peaceful means or either by a rifle blast
Or whatever, better late than never
We finally arrived and yo, the dream has survived
But many died tryin and they're the ones that paved the way
Real live supermen and -women save the day
So that we can live our life without ?????
Racial oppression, mental anguish through aggression
So realize what it took for us to rise
And don't sleep but reap and keep your eyes on the prize


Sing a song of six pence, a pocket full of crack
Think you're sayin somethin, you ain't sayin jack
Now tell me, what is goin on these days?
From what I'm seein lately I'd say crime pays
Cause somebody is gettin paid
I think it's time to sprinkle some rain on the parade
Now listen, take this as a word from the wise
I'm not a prophet or a preacher, just a man with eyes
And I've been witnessed the fitness of a neighborhood worsen
You oughta hold a person-to-person
Discussion with those who rose from that level
Usin a broom or a mop or a shovel
Not on the corner waitin for the big pay-off
It's not comin, so why not stay off
The streets, believe me it beats bein sent up-
State on a date with the man and bein pinned up
In solitary, take advantage of your freedom
I'm givin helpful hands cause you need em
It's not all about the cash you make
Sellin poison to boys and girls - you're a fake
So what you got a cable, so what you got a BM?
You love when the girls go, ""Ooh, did you see him!""
So what your pocket's filled with 20s and 10s
You're gonna find out just how fast that ends
Cause one day you'll be drivin round the way in your ride
There'll be a bullet with your name on the side
And if you don't believe what I'm tellin you, mack
When you're layin on the ground with a hole in your back
Lookin up at the sky, gettin closer to hell
Just remember Master Ace had a story to tell
Yeah
Yo
Keep your eyes on the prize (5X)
Keep your eyes on the prize (5X)

""P""
""R""
""I""
""Z""
""E""",https://genius.com/Marley-marl-keep-your-eyes-on-the-prize-lyrics
We Write the Songs,"In Control, Volume 1",1988.0,"Give me the beat boy
 this is funky
Yo it just me and Heavy D in the house
I can't forget my man Marley Marl
Hey, I got Keith and Shawn right next to me 
I'd like to send this out to my man, Cool V
Who you wanna send out to?
DJ Eddie F, Trouble T-Roy, and my man G-Wiz up in the money 
I can't forget Big Daddy Kane, and my whole crew
Cool Joe Brown from Centereach
And we gon' do a little something like this
Like what?

I'm the original B-I-Z Mark
Buyin' a record like collecting put ya body in the park
This is a little something for the Juice Crew
From Hev and the boyz and Biz the DJ that's won two
This is a little something from Biz Markie
That make you get up and D-A-N-C-E
That's why I made this one just for you
To do the Heavy D shaking and Biz dance too
Now I'ma get deep like Jacques Cousteau
And the stuff that I be saying is always thorough
That's why I made a introducing due to death rap
To make your hands clapped, feet tapped
I'm like the diabolical scientist, Mr. Far
To send extra crazy super like funky vibes
'Cause I always come with stuff nobody else does
That's why they call me The Inhuman Orchestra
The Heavy D, say hi
Hey yo what you wanna know?
I wanna know if you can rock the disco show

Now yes, on the smooth tip, the Overweight Lover
I'm on your radio and your magazine cover
I drink Coca-Colo, remain the rhyme solo
Always wear Nike but, once in awhile I sport polo
Before I go to bed, I drink my milk and eat cookies
Never like school, so I used to play hookie
New jacks of rap, I choose to call 'em rookie
Your choice is the Heavy D voice, now you can boogie
Emcees think I'm new to this, they must be dizzy
'Cause on the microphone Heva keep the crowd busy
Nothing in the world could ever stop my groove
The Overweight Lover's in the house, and I can get smooth

We write the songs that make the whole world sing
We write the songs to all the crazy things
We write the songs that make the emcees cry
Me and Heavy D, we write the songs, we write the songs

So party people in the place, without further adieu
The S-K B-I-Z M-A-R-K-I-E is for you
Well I'm Long Island's number one with the rhymes I invent
Say or spit a story up to all you ladies in the gym
 number one master afro from all you ladies
Guaranteed to rock the mic and take out all your emcees
That's why you hear me rockin' as one of the best
I come first place and, end ya contest
With the bass in your face that you'll appreciate
I'm known as the living legend and the all time great
You know the emcees on a hell of a predicament
They go against the S-K-B Markie in this tournament
I go to a party, I am a spectator
When you battle me, I am Darth Vader
 in the place for a testing
Know you be chilling in the mo for the money you're spending
I came here to rap beats for your satisfaction
Biz Markie and Heavy D is the special attraction
When I came to the door you pay ten duckets
If you battle me I take you out to
 rockin' off for any kinda rap
To get the girl so hot, they want to get naked
I'm super duper emcee and I'm educated
1982, the year I graduated
Heavy D, say hi
Yo, what you wanna know?
I wanna know if you, I wanna know if you, I wanna know if you can rock the show
Lord have mercy on those who cursed me

I wreck for respect but first me and Bizzie Markie's gonna dance a little
So meet your tender vittle, I mean your tricking little
Yo, can I get a little?
Microphone check one two, and three in
I am Heavy D and he's the B-I-Z-M-A-R-kie
For better for worse but not forgotten
Always fresh never stale or even rides
So Biz Markie, say hi
Hi
What you wanna know?
I wanna know if you can rock like The Disco show

We write the songs that make the whole world sing
We write the songs to 
We write the songs that make the emcees cry
We write the songs, we write the songs",https://genius.com/Marley-marl-we-write-the-songs-lyrics
Duck Alert (feat. Craig G),UnKnown,UnKnown,"(feat. Craig G)
(I don't even remember how this happened)
(The Crew will not understand it)
(Duck Alert)
(Yee-ee-aah)
(Duck Alert)
(Yee-ee-aah)
(The Crew will not understand it)

Yo, this jam is dedicated to you, boy, just listen
Take off your coat, get in a fit position
Cause I'm about to burn you at 450 Fahrenheit
You're jealous of the crew, that's why you're starin, right?
Forget the answer, the situation's obvious
When this is over, let's see who feels the sorriest
You'll be like, ""Damn Craig, why did you play me, yo?""
And then you realize we're toppin rap radio
Cause it's no game, boy, you can't do work
Marley, please tell us his name (Duck Alert)
(Yee-ee-aah)
(Duck Alert)
(Duck Alert)
(Yee-ee-aah)
(Duck Alert)
(Has your crew suddenly become interested in promoting a war?)

Now our crew is broken down into a large amount of channels
And not one of us can you handle
On the mic Magic, on the tables Marley
And when it comes to bein dope, don't ask: are we?
Cos our style is different, or should I say irregular?
And if you wanna get all hype, I'll have to settle ya
By pullin out my 12-gauge shotgun
And if you wanna go rhyme for rhyme, I got some
Dope rhymes for sure, or should I say galore?
But I won't sound old-schoolish, in other words foolish
I have a question now: who feels hurt?
Marley, do you have the answer? (Duck Alert)
Thank (yee-ee-aah)
(Duck Alert)
(Yee-ee-aah)
(What happened between us, was for us alone)
(Yee-ee-aah)
(Duck Alert)
(I am speaking to you from the Bridge)
(Yee-ee-aah)
(Duck Alert)
(Yeeeeeeh)

After this, I hope you get someone to battle me
But make sure this person has originality
That's right, original, yeah, you heard me
I don't want his beats soundin like Hurby's
Oops - I mean Marley, cause Hurb's a beat-biter
I don't know where the both of you get the right to
Come in the industry, steal someone's property
And some of you, forbid, start clocking's
Now that's not fair, Marley's the rightful owner
Yet you still treat him like he's a blood-doner
So now it's time to have revenge to all you jerks
Especially who, Marley? (Duck Alert)
That's right
(Yee-ee-aah)
(Duck Alert)
(I am speaking to you from the Bridge)
(Yee-ee-aah)
(Duck Alert)
(Yee-ee-aah)
(You're from where?)

Ehm - at the final stage, cut the scratches
Marley Marl? I think no one can match his
Cuttin ability on the 1200s
And many listeners, they often wonder
(Yo man, was that a tape?!) Nah, never in a milion years
You see, the liveness gives us the feelin we're
Bein accepted as true entertainers
And it will stay that way for the remainder
Of the century, that's how it's meant to be
You don't believe me? You will eventually
Because the situation, boy, you can't divert
Escpecially who, Marley? (Duck Alert)
Ah-ha
(Yee-ee-aah)
(Duck Alert)
(Yee-ee-aah)
(Duck Alert)
(Duck Alert)
(Yee-ee-aah)
(Duck Alert)
(Duck Alert)
(Yee-ee-aah)
(Duck Alert)
(Duck Alert)
(Yee-ee-aah)
(Duck Alert)
(Duck Alert)
(Yee-ee-aah)
(Eat your ass up)
(I don't even remember how this happened)
(Eat your ass up like a steak ???)
(The Crew will not understand it)
(Eat your ass up like a steak ???)
(The Crew will not understand it)
(Eat your ass up like a steak ???)
(Has your crew suddenly become interesed in promoting a war?)
(Eat your ass up)
(Eat your ass up)
(What happened between us, was for us alone)
(Eat your ass up)
(Eat your ass up like a steak ???)
(I am speaking to you from the Bridge)
(Eat your ass up)
(I am speaking to you from the Bridge)
(Eat your ass up like a steak ???)
(From where?
From the Bridge)",https://genius.com/Marley-marl-duck-alert-feat-craig-g-lyrics
Freedom / Give Me My Freedom,"In Control, Volume 1",1988.0,"It's Shan's what I'm called, I stand tall and brave
And me and Marley Marl is as close as a shave
My rhymes lock jaw like a pitbull bite
Suckers always try to sleep on me cause I look light
See, a lotta wack rappers try to rack their brains
To feel a style of MC, come on, break these chains
Speak now or hold your peace when I decide to pass it
But every rhyme you ever had could never surpass this
If rhymes were food, the main source for livin
You would swear that every line of my rhyme was thanksgiving
I don't bite styles, weak rhymes, I don't need em
Stop jockin me, boy, give me my freedom

I wanna break away clean, I mean virtually spotless
And all year long I been schemin and plottin this
If beats were cakes, then my rhymes'd get frosted
This is '88 and I still ain't lost it
For all of those who still got a doubt in their mind
There ain't a rapper livin bad enough to take mine
There ain't no studio-illusion and no scratch-syncin
Stop - if that's what you're thinkin
Write rhymes simultaneously, say em in pairs
And I would hate to have a rapper proclaim it theirs
Instead in comin in a limo, bring a casket and hearse
Before we speak we'll hear the preacher from the deacon first
We won't be gathered that day to unite no couple up
Marley, are we gettin this on tape? (Yup)
All you dirty low-down better slow down faster
Your technique isn't good enough to hang with the master
I don't bite styles, weak rhymes, I dont need em
Stop jockin me, boy, jockin me, son, jockin me, punk
Jockin me, kid, give me my, give me my, give me my freedom

I'm the opposite of what you say a slob is
Dumpin suckers off is exactly what my job is
I'm feared like Napoleon and blessed like Buddah
You couldn't face me solo, you'd have to bring your crew to
Dump me off, I don't recollect the mumble
I ain't soft, homeboy, and picture me crumble
And forget all of those that don't like my rap
I don't be kickin that old shooby-dooby-doo-wop crap
Rappers often brag about their bitin deejay
But they can't do Marley nothin, no how, so hey
It's clear to the ear what I'm sayin, son
That's why we feel like slaves on the freedom run
And each and every time a wack rapper walks by me
His head starts singin: Come on and fly me...
I don't bite styles, weak rhymes, I don't need em
Stop jockin me, boy, jockin me, son, jockin me, punk
Jockin me, kid, give me my freedom

We can do this like Brutus, I'm not mad, I'm pissed
This parade of mine I doubt that you can rain on this
You couldn't place my rhymes amongst mortal men
When I be rhymin on beats that set the hip-hop trend
I will always exist because I'm bein preserved
Don't agree to set me free, then you gotta be served
I earned a name amongst society as lyrically ill
But yet I'm loyal, see, cause marley hooks the beat up still
There's no way that you could say there's a day I'd fess
Hamana-hamana-nothin, you can kill that mess
My rhymes are ruthless, no heart, and totally wretched
And if they was to fall down then the beats would catch it
I don't bite styles, weak rhymes, I don't need em
Stop jockin me, boy, jockin me, son, jockin me, punk
Jockin me, kid, give me my, give me my, give me my freedom",https://genius.com/Marley-marl-freedom-give-me-my-freedom-lyrics
The Symphony (feat. The Juice Crew),UnKnown,UnKnown,"(feat. Master Ace, Craig G, Kool G Rap, Big Daddy Kane)

Listen closely, so your attention's undivided
Many in the past have tried to do what I did
Just the way I came off, man I'm gonna come off
Stronger and longer, even with the drum off
I keep on goin' and flowin' just like a river
I got a whole lot to give so I'm-a give a
Little at a time, new trails are blazin'
Action is in effect, and always stays in
Yeah, just like a shot from a cannon
I am the man in charge and I've been plannin'
A jam strong enough that it can life your soul
I'm the originator, and my rhymes are made of gold
Once you hear the capital ""A"" rap, it'll stay
With you for awhile, it won't go away
Unless you force it, because it stays with you, my friend
And if you toss it away, I'm-a hit ya again
I project my voice so it's right in the crowd
There's a sign at the door: no bitin' allowed
And if you didn't read it I suggest you do so
Or you'll be stranded, just like Caruso
Sleep if ya wanna, go 'head, get some shut-eye
A man broke his jaw tryin' to say what I
Say on the microphone, you shoulda left it alone
Just for the record, let it be known
That my ego's only partially grown
And never will I ever condone biting in any form, yo I'm only warm
That verse was the calm, now here's the storm...
Next up (Yo, I believe that's me). Craig G, light up the mic for the Symphony

This jam is dedicated to all un-optimistics
That though I wasn't coming out with some exquisite rhymes
But that's alright, cuz now I'm back
To kill all the rumors and straighten the facts of me
Not rockin' rhymes like I always used to
But you jumped on hte tip when you heard me and the Juice Crew
You said, ""Mmm mmm mmm, ain't that somethin?
Yo Craig, I head you in that jam, and it's pumpin'!
I apologize. Oh yeah, and uh, can I have your autograph for me and my grandma?""
That's how I'm livin': all surprise mode
Don't even sleep, try not to keep your eyes closed
Cuz if you do, when you awaken, your so-called spot will be taken
I'll take you over like a greedy executive, cuz on the mic my prospective is
To be the best in all rap events, and since I have a call, I call experience
Next up...(Yo, I believe that's me)
Kool G Rap, light up the mic for the Symphony...

Yo, Marley gives the slice, I get nice
And my voice is twice as horrifying as Vincent Price
Goes deep, till you fell in a spell of a sleep
And while I'm countin' the money, you count sheep
When G Rap strikes the mic, I recite the type of hype that you like
And make the people unite
I grip up hips and zip up lips, step on reps, you flip and wanna sip on my tip
Take a deep breath, because you don't have another left
Comin' back like I'm avengin' my brother's deat
Makin' veterans run for medicine
Cuz I put out more lights in a fight than ConEdison
Rip the damn cage like I'm on a rampage
And if you want rage, I'm-a make front page
Read the headlines, suckers, todays the deadline
Your head is way past bedtime
Can't kill though. Solo. Cuz you're still all...soft like a pillow
My rap is rougher than Brillo
So fear me, don't dare dare me
And don't compare me to him when you hear me
Talk about a battle but you ain't yet ready for war
Your metaphor sucks more than a whore
You can't replace me, ice me or ace me, bass me, face me, slice me or race me
Bite me or taste me -- I'll show you that I got force
My rap burns your mouth like hot sauce
Run for water while I break your tape recorder
Server-to-sucker: the order is manslaughter
Another rapper, G Rap wrecks, he's rated X, to mean the boy is sex. Next...
The amplifier gets used and abused. Pumps so loud, we might blow a fuse
This is anger, madness, ready to hang 'er
Rapper or singer: I'm puttin' up my middle finger
Next up... (I believe that's me)
Big Daddy Kane, get on the mic for the Symphony

Settin' it off, lettin' it off, beginnin'
Rough to the endin', you never been in
To move the groove with the smooth rap lord;
Like a bottle of juice, rhymes are being poured
Down your ear, crisp and clear
As I prepare to wear, tear and smear - then I'm outta here
With a mark left that you can all cling
Cuz rockin' a party? Yo, it's a small thing
I rip many places on regular basis, and broken down mics were the only traces
That I'd been there and there at the party
The mic had my prints, and on it was a body
So take caution. I'm not horsin' around in a throwdown, clown
I'm takin' yours son
So just acknowledge the way that I kick it
Cuz if rap was a house, you'd be evicted
And dismissed from the microphone, chokin' on a bone, cuz Daddy's home
And battlin' me is hazardous to health
So put a quarter in your ass, cuz ya played yourself
Like a game in the arcade. You need a far aid
I'm walkin' the path that Allah made
I'll attend and then begin to send a speech to reach and teach
So just say when
So I can let lyrics blast like a bullet
My mouth is the gun; on suckers I pull it
The trigger, ya figure, my pockets gettin' bigger
Cuz when it comes to money, yo, Grant's my nigga!
You've got the groove, MCs, freeze, stand still, nobody move
It's a sabotage, as I take charge. Don't barge, cuz gotdamn, I'm livin' large
Like a giant. You're nothin' but a midget, a small digit
You ain't hit it, forget it, quit it
I reign superior, always takin' care o'ya
No-frill rappers, you will evaporate, disintegrate, deflate to your fate
As the great will dominate straight to the state
Of reignin', gainin. So put Kane in, that category. Period. End of story...",https://genius.com/Marley-marl-the-symphony-feat-the-juice-crew-lyrics
Hummin’,Re-Entry,2001.0,"Humming in the sun
Sure 'nuff fun for everyone
Humming in the sun
Sure 'nuff fun for everyone
I'm humming in the sun
Fun for everyone
I'm laying here
Grooving

Humming in the sun
Sure 'nuff fun for everyone
Humming in the sun
Sure 'nuff fun for everyone
All I really need
Is lazy time
I can feel the sun
And its all mine

Humming in the sun
Sure 'nuff fun for everyone
Humming in the sun
Sure 'nuff fun for everyone
I'm humming
On (?) vibe
I'm humming
On (?) vibe
I'm humming
On (?) vibe
Mmmmmm
Humming in the sun
I'm humming in the sun
Mmmmm mmmmm
Mmmmm mmmmm
Mmmmm mmmmm
Mmmmm mmmmm
Mmmmm mmmmm
Mmmmm mmmmm

Humming in the sun
Sure 'nuff fun for everyone
Humming in the sun
Sure 'nuff fun for everyone
Humming in the sun
Sure 'nuff fun for everyone
Humming in the sun
Sure 'nuff fun for everyone
I'm humming, humming
I'm humming in the sun
Sure 'nuff fun for everyone
I'm lying here, yes I am
I'm just grooving
Everybody, everybody
Everybody hum
Hum mmmm
Hum mmmm",https://genius.com/Marley-marl-hummin-lyrics
