title,album,year,lyrics,urls
Juice Crew Law,Born to Be Wild,1988,"What's wrong with you, man?
You crazy!
Highly acclaimed that's Shan the epitome of rhymes
Can't dance so you can't get rid of me
Line after line there's cause and effect
But I first test the mic with the 1-2 check
The Hip Hop world made the Juice Crew orphans
Gained our respect sealing up much coffins
We're all obligated to Juice Crew Laws
You'se a perk if you let a man take yours
Number 2 is not to follow, yo, you must set trends
And if you ain't down with us, you can't be friends
Many of my so-called boys just flip
But the thrill of it all - you're on the tip
You should be glad there is no tricks
On ours so hard we wrote your name on our...
Mix after mix every record we make
Don't compare or scare, so I dare you to take
Any part of the rhyme or the 
kick drum sound
I be meeting you, defeating you and beating you down
My name rings bells and make rappers petro
God help you, kid, when I get upset, yo
The bass starts to roll bid your fans farewell
Cause the chance of you winning is like snowing in hell
My rhymes say more than a tasket, a tisket
Too clever, yo, I never go out like a biscuit
Don't try to take my spot and not be legit
Try to fit my shoes and your feet won't fit
You're good, but compared to me you're not nearly
You think you can serve me? Come on, really
Til I can't breathe, yo, I'mma be with it
When I hear three words, you got it, I get it
My style is wild but strong and you're temporary
Violate the Juice Crew Laws and I bury
Send you to the land of peace and tranquility
Suckers have the knack but they lack my ability
Those who tried to dis in the days behind us
Back on the dick since the brothers signed us
Make the mistake and I'm breaking your jaw
So don't ever dare violate Juice Crew Law
Never too alert but I'm always cautious
And a few of 'em own a few Mercedes and Porsches
Suckers get paid by means of extortion
My rhymes take your mind by means of abortion
Rhymes create wings that time can't fly on
The mic that you bring on stage you'll die on
Sit back and watch your life get jettisoned
If rhymes were juice I'd be Con Edison
Do as we say, not as we do, as a custom
A sucker tried to snatch my chain and I bust him
I didn't cuff him and read him no rights
I knocked out his service and turned out his lights
Be a fool if you want and let your boys divert you
Soup you up to battle me, kid, and I'll hurt you
Superior intellect made me a phenomenon
And I can go on and on and on and on
You can be blind but my rhymes still focus
A sucker tried to violate law and I broke his
Albums and tapes and his compact discs
And his boys stood around and said (yo, he dissed you, Kris)
Straight up not split by a hyphen
Cut you to pieces without putting a knife in
You won't bleed but you feel just the same
Now answer me right, boy, what's my name?
(Shan) These words are are small innuendo
Guaranteed to decipher the mice from the men though
Now that I have the power make a refinement
Revealing the snakes is my next assignment
Make the mistake and I'm breaking your jaw
So don't ever dare violate Juice Crew Law
For those who betrayed me picture being afraid of me
A few I know wish they woulda never come played me
Though I'm decked in my suit you can't play me like rummy
Teach you how to rhyme, say Kris, dummy
The same theory if the words don't fit
Got the nerve to get on stage and wanna sing that...
Wait a minute, wait just a second
You know that's not my style - sorry, just checking
But don't it make you sick when they be kicking la-di-da-di
But I got what it take to make you wanna cold rock a party
Too hot to touch, too cold to hold ????? sadness
Junk you pop gets you dropped, stop the madness
My style is wild, my son, my child, selective
Built to stay tough, written rough and effective
I tangle ya, mangle ya, strangle ya and then maul ya
This goes for you and you and you and all ya
Make the mistake and I'm breaking your jaw
So don't ever dare violate Juice Crew Law",https://genius.com/Mc-shan-juice-crew-law-lyrics
Born to Be Wild,Born to Be Wild,1988,"(Cut it nice)
(Get ready to get busy)

It's been so long and I paid my dues
And with rhymes like these, yo, Shan can't lose
You won't believe the strange thought that ocurred to me
So intense, it absolutely startled me
I knew that I was buggin when I stopped walkin:
""I think that you should hear me, I'm your conscience talkin
If you don't wanna listen, hey, it ain't no thing
You rap for a living, but you wish you could sing
You think your life is complete, there's a lot that you're missing
You enjoy making music for the people to listen
Hip-hop is your life, by oath you've sworn
Now it's time to start the mission for which you were born
You've acquired a rep, now you're labelled a villain
But I don't really care, Shan'll always be chillin
That's why I'm tryin to say, that's just part of your style
You were (born to be) wild, wild""
(Born to be) wild, wild
(Born to be) wild, wild
(Born to be) wild, wild
(Born to be)	--] Steppenwolf
(Cut it nice)
(Get ready to get busy)

I couldn't forget, no matter how I tried
But my conscience just wouldn't let a day go by
All day long I watched and observed
No, I gotta be jokin, that's word to Herb
I can take a lickin and keep on smilin
Who needs a license to ill, I was born to be wildin
Rhymes sweeter than a premium vintage grape
]From the paper I knew it'd sound dope on tape
Never in a rush, I'm Cold Chillin'
And the next perpetrator I find, I'm killin
Just ask your boys how many heads I flew
And that's why I roll with the Juice Crew
That voice in my mind taught me one lesson
I was born to be wild, and only suckers be fessin
I knew I had a purpose since the days of a child
I was (born to be) wild, wild
(Born to be) wild, wild
(Born to be) wild, wild
(Born to be) wild, wild
(Born to be)
(Cut it nice)
(Get ready to get busy)

The meaning of 'wild' is not screaming and yelling
It's 'bout showing and proving and not showing and telling
All you counterfeit rappers, you might as well quit
You'll never hear me say I'm bad, bein wild is the shit
Rap symbol, and never been defeated yet
If rap is a crime, how much time I get?
The best impersonator couldn't copy my style
And even if he did, you know what I'd do, I'll -
As a matter of fact, it's what I already did
I pulled out a rhyme and cold blasted his lip
Most opponents get on, they're guilty as tried
They're diggin and stripped of whole manhood and pride
Don't be brave and save yourself half of the bill
You can't chop me with a saw cause your ass should chill
When they're slippin on the cuts I gracefully smile
Cause I was (born to be) wild, wild
(Born to be) wild, wild
(Born to be) wild, wild
(Born to be) wild, wild
(Born to be)
(Cut it nice)
(Get ready to get busy)

Born to be wild, I'm takin command
While you're performin people screamin out: ""We want Shan!""
I'm colder than ice and hot as a flame
And my rhymes are always clever, but they're never the same
What's wrong with your girl? Somebody ought to stop her
For bein in the presence of a low-life rapper
This rhymin was pressed as a special edition
I was born to be wild and you're the one on a mission
Allow me to say that I weaken resistance
Makin examples just to prove my mortal existence
Born to be wild means a prototype
And the roar of the crowd increases the hype
You have to be bold to try and steal my rhyme
Or even to dis cause you think that I'm
A sucker, a softie, or even a child
But I was (born to be) wild, wild
(Born to be) wild, wild
(Born to be) wild, wild
(Born to be) wild, wild
(Born to be)
(Cut it nice)
(Get ready to get busy)",https://genius.com/Mc-shan-born-to-be-wild-lyrics
Give Me My Freedom,Born to Be Wild,1988,"M.C. Shan's what I'm called, I stand tall and brave
And me and Marley Marl is as close as a shave
My rhymes lock jaw like a pitbull bite
Suckers always try to sleep on me cause I look light
See, a lotta wack rappers try to rack their brains
To feel a style of MC, come on, break these chains
Speak now or hold your peace when I decide to pass this
But every rhyme you ever had could never surpass this
If rhymes were food, the main source for livin
You would swear that every line of my rhyme was Thanksgiving
I don't bite styles, weak rhymes, I don't need em
Stop jockin me, boy - give me my freedom

I wanna break away clean, I mean virtually spotless
And all year long I been schemin and plottin this
If beats were cakes, then my rhymes'd get frosted
This is '88 and I still ain't lost it
For all of those who still got a doubt in their mind
There ain't a rapper livin bad enough to take mine
There ain't no studio-illusion and no scratch-syncin
Stop - if that's what you're thinkin
Write rhymes simultaneously, say em in pairs
And I would hate to have a rapper proclaim they're theirs
Instead in comin in a limo, bring a casket and hearse
Before we speak we'll hear the preacher from the deacon first
We won't be gathered that day to unite no couple up
Marley, are we gettin this on tape? (Yup)
All you dirty low-down better slow down faster
Your technique isn't good enough to hang with the master
I don't bite styles, weak rhymes, I dont need em
Stop jockin me, boy
Jockin me, son
Jockin me, punk
Jockin me, kid
Give me my
Give me my
Give me my freedom

I'm the opposite of what you say a slob is
Dumpin suckers off is exactly what my job is
I'm feared like Napoleon and blessed like Buddah
You couldn't face me solo, you'd have to bring your crew to
Dump me off, I don't recollect the mumble
I ain't soft, homeboy, and picture me crumble
And forget all of those that don't like my rap
I don't be kickin that old shooby-dooby-doo-wop crap
Rappers often brag about their bitin deejay
But they can't do Marley nothin, no how, so hey
It's clear to the ear what I'm sayin, son
That's why we feel like slaves on the freedom run
And each and every time a wack rapper walks by me
His head starts singin: Come on and fly me...
I don't bite styles, weak rhymes, I don't need em
Stop jockin me, boy
Jockin me, son
Jockin me, punk
Jockin me, kid
Give me my freedom

We can do this like Brutus, I'm not mad, I'm pissed
This parade of mine I doubt that you can rain on this
You couldn't place my rhymes amongst mortal men
When I be rhymin on beats that set the hip-hop trend
I will always exist because I'm bein preserved
Don't agree to set me free, then you gotta be served
I earned a name amongst society as lyrically ill
But yet I'm loyal, see, cause Marley hooks the beat up still
There's no way that you could say there's a day I'd fess
Hamana-hamana-nothin, you can kill that mess
My rhymes are ruthless, no heart, and totally wretched
And if they was to fall down, then the beats would catch it
I don't bite styles, weak rhymes, I don't need em
Stop jockin me, boy
Jockin me, son
Jockin me, punk
Jockin me, kid
Give me my
Give me my
Give me my freedom
Give me my freedom or not
I DON'T GIVE A F-
You don't wanna play this?
Suck my -
Fuck off, muthafuckas
You don't like this?
I don't give a fuck
Just gimme my muthafuckin freedom
Goddamn!",https://genius.com/Mc-shan-give-me-my-freedom-lyrics
MC Space,Down By Law,1987.0,"( *sounds of a spaceship landing* )

You have completed...
Enter identification code
...information...

Where I come from, we never heard of bite
We can write the freshest rhymes at the speed of light
All my planet, we're the real McCoy
And it's you Earth MC's that I wish to destroy
When I rhyme I'm never out of place
I take you on a voyage through outer space
Every rap I make, you know it always sells
I fly the galaxy wearin laser Cazals
I can fly from place to place quicker than you can snap
I'm known as the space wizard of rap
Depend on how I feel, if it's only for fun
I take my mic off of 'kill' and I set it to 'stun'
Sometimes my rhymes do inflict pain
Sends electrical impulses through your brain
In your Earthling ears my rhymes are caught
Transmitted to your brain is what's known as thought
I can see the devastation as I look in your face
Listen to how the deejays rock up in space

To call yourself MC, are you out of your mind?
You have to have a golden voice similar to mine
But when you have a jam that is cold set
You play the same old records, one right after the next
For you to win the battle, Earth will have no chance
With the spinning of two records, and you call that advanced?
To do that on my planet you'd be taking a risk
Because the beats we play out live, and that's not on a disc
The first time that they see it, they might be amazed
And say, ""Why should we commit ourselves to permanent waste?""
That's why it is impossible for us to lose
Plug in the microchip of any beat that we choose
One thing where Earth and my people might match
That is the similarity and sound of the scratch
We have stamina, and also have poise
The only difference is our scratch is no sonic noise
To take Earth MC's out is what I wish to achieve
Once this is accomplished I be destined to leave
When I leave they'll call me an ace
That cool MC from outer space

Although my color just might be green
I'm the flyest space MC that you ever seen
It might be in your future cause it can't be your past
But the reign of Earth MC's don't have too long to last
All you fresh MC's, you should feel ashamed
The wack around the world, you put em down with the game
They get on the mic and be coppin a plead
About how good they rock on the m-i-c
On my planet you must take a test
I'm at the top of my class because I'm the best
I use my rhyming skills for what it is worth
That's why I'm here to battle all MC's of Earth
If you take me out which ain't been done before
You might just start a interplanetary war
The war won't be to kill John and Steven
The whole point of it is to get even
The war's to get even, I will say indeed
And I will come back every year till the day I succeed
I hope I didn't stand here and offend you too much
If you ever wanna battle, then get in touch
So I can come back and dis your face
Pick up the telephone and dial MC Space",https://genius.com/Mc-shan-mc-space-lyrics
She’s Gone,Born to Be Wild,1988,"(She's gone)
You know, even though we're far apart so many miles away
My love for you grew stronger with each passing day
And it seems just like yesterday, baby, since I met you
And from the moment I seen you, I knew I had to get you
You know, cause sweet girls, they're one of a kind
And you just simply blew my mind
And a love like ours, yo, that wasn't easy to find
And yet I bless the day she was born
But I just can't face the fact that (she's gone)
You know, I cherished every moment we spent
Wishin it would never end
Just when I had told myself
That damn, I'll never fall in love again
Cause love can lead you blind
See, it snuck me up from behind
And before I knew girl, I was yours and you were mine
Our love had a value that love just couldn't buy
And I knew that you were true just by that twinkle inside your eye
And yet I bless the day she was born
But I still can't face the fact that (she's gone)
You know, I met many girls around the nation
But see, I just knew that you were there, and I wanted to share my relations
And I loved you like I do for so many reasons
And since you been gone ain't really nothin changed but the seasons
Things are different without you but I can tell you are still the same
I wake up and find myself screamin out your name
But yet I bless the day she was born
But I just can't face the fact that (she's gone)
You know, just to be close to you, that all that I miss
You know, I used to get chills up and down my spine each time we kissed
And how much it thrills me just to talk to you on the phone
Next best thing to being there but I still feel alone
You know, it had to be love, at least it was in my case
Cause every time I close my eyes, damn, I still see your face
But yet I bless the day she was born
But I just can't face the fact that (she's gone)
I did every thing that I could just to make you happy, and Lord knows I tried
I'm in so much pain my boys can still see it in my eyes
You know, I crossed through mountains, travelled over the great divide
Just to show and prove to you all the love that I held inside
You know, you gave me love, you know, more happiness that a man could find
And yo, and forever I woulda been yours if forever you woulda been mine
But yet I bless the day she was born
But I just can't face the fact that (she's gone)
Yo, ain't nothin like the good old days, the good old days
You know
Just can't face the fact that you're gone, sweetheart
Why?
Why?
Did everything that I could
Keep you happy
And all that, you know?
But everything I did musta not been good enough for you
You still wanted more
And I mean, hey, what more can you have?
To me, love is everything
Everything is love
And I was giving you all of mine and I expected the same in return
And I got shitted on
Youknowmsayin?
But it's alright though sweetheart
It don't matter
Life goes on, everything goes the same
But still and all I still can't the fact that she's gone",https://genius.com/Mc-shan-shes-gone-lyrics
Back To The Basics,Born to Be Wild,1988.0,"It might've took a while
But you knew I had to hit you with a brand new funky rhyme
Guess you already know, so I'm ready to go
Marlon, hit me with the beat one time
Right now I'm gonna introduce myself
So y'all know just who I be
All you suckers in the house stay quiet as a mouse
Instead of Shan call me Mr. MC
I'm goin back to the basics
When I was just a young boy, who ever would've thought
I'd grow up to be an MC
But my rhymes are so nice that they paid my price
Because fortune and fame ain't free
These words I'm recitin are written in a style
That you ain't heard in a long time
And a song like this'll make a rapper reminisce
About the days when he was in his prime
I ain't never lost no battles yet
What made you think I would?
How many times does it take, all the rappers I break
And you still don't think I'm good
This girl in my class tried to move too fast
When she tried to pull down my zipper
Well, things got strange when the whole scene changed
And I all out tried to strip her
Teacher stepped in between, sent me straight to the Dean
That's where I thought my journey ended
Call your moms up to school, are you some fool?
And forget about bein suspended
You went back to the basics
Here's the story on how I got started
Yes, way back in the day
With my man Infinite, Jazzy , Akim
And fly girl Roxanne Shant
People used to hear that our crew was nice
But rappers just had to be convinced
And those who walked through 12th Street tried to say a rhyme
You seen or heard from em since
We sent em back to the basics
Yes yes y'all, it's like this y'all
MC Shan with a brand new twist y'all
One day when me and Marley Marl was playin in a ditch
We made this jam that we knew would slam
And some day it would make us rich
Marley Marl had B-36 bass bottoms
And he cut you up on the spot
And with my rhymes combined all the papers got signed
And 'The B-B-B-B-Bridge' got dropped
We went back to the basics",https://genius.com/Mc-shan-back-to-the-basics-lyrics
Another One to Get Jealous Of,Down By Law,1987.0,"Me and Marley Marl, we are resented, ya know?
Because of the beats and the rhymes we invented
To cold dis another's a thing that we love
So here's another one to get jealous of
Do it ya
Do it ya
MC's that I battled are the MC's I defeat
Now you say you took me out, now how that sound?
Do it ya
Kazookie-zang
Kazookie-zang
Kazookie-zang-bong-baga-dung-dang	(2x)
Once I'm done puttin heads to rest
I sit back and puff a spliff of buddha bless
See, in days of old mi rhyme went gold
The music, it wasn't recommended
Man used to sit on seat and tap out a beat
And went away feeling relieved
Hey ya
But soon after our rhyme is invented
And put together, it sound contented
And rhymin a-fi work
I tell you rhymin, yes it a-fi work
Bang-dang-dilli-dilli-dilli
MC's, dem like to bite the things you say
Others come along and like the beats you play
You know that's cold considered a dissin of work, ya know?
I don't deal with negativity and thing and thing
I'm the MC, and I'm also cool
Jacuzzi in my crib size of your pool
Sent di butler for my midnight treat
Rug so plush ya can't see ya feet
If ya come and visit if you choose
It's a must at the door that you leave your shoes
Don't obey and you'll have to go
Some didn't listen till my gun went bo!
Rock the house a little bit
Rub-a-dub
Michigan and Smiley
And di Yellowman
And MC Shan and Marley
Ya know
The house is packed every place I play
But let me tell ya bout this jam one day
]From the very first time I walked through the door
I see the people rub-a-dubbin on the floor
Played the wall, a man came past
Oh my God, dem puttin fire to glass!
I dipped, I bobbed, I weaved, I shook
I hear ya puff it one time and from there you're hooked
It make you sell your car, your house, your ring
Have you flying through the clouds and you don't have wings!
He passed it to me, I said, ""No,"" him said, ""Why?""
My boy jumped up and said, ""I'll give it a try""
]From the very first time he ignited the flame
My homeboy wasn't actin da same
I tapped him on the shoulder and I said, ""Let's go""
He looked at me and replied with, ""No""
I said, ""Fuck it,"" and left him there
The torch, the pipe, the base, the chair
I came back five days from then
To my surprise I seen my friend
To let you know what this thing does
He was sitting in the very same spot he was
I walked over, ""Want more?"" he said
Pipin hot my man dropped dead
His head hit the table, the pipe hit the floor
But I'll mention that di man won't base no more!
Bo!
Kazookie-zang
Kazookie-zang
Kazookie-zang-bong-baga-dung-dang
Hey man, let me tell ya, man
True story, no bloodclot
Man fall and when his head hit the floor, man (unintelligible)... bass pipe
Everyone cried for the coroner
Go and pick up him pipe and said
""Man, dem leave em on the floor just like he lay, ya know?""
Picked up da crumb and put it in di pipe and he fuckin bliss off da ting off, man
Oh my God, bloodclot!
Man puttin fire to di glass thing, man
And say, ""Scotty! Scotty! Where ya at, Scotty?""
To the transporter room, ya know?
""Beam me! Beam me!
Beam me, blood!
Beam me, bloodclot!""",https://genius.com/Mc-shan-another-one-to-get-jealous-of-lyrics
