title,album,year,lyrics,urls
Hip Hop Roughneck,UnKnown,UnKnown,"That damn OJ
Tellin me my joint ain't comin out till '94?
OJ gotta be out of his mind, man
I'm tellin you, I'ma blow up in '93, man
They can't stop me
You crazy?
Word up
Tellin you
Yeah boy
Back in '93
To blow up once again on the hip hop scene
You know who it is, the one with the choice voice

Watch me rip up shop
Cause I'm the type of rapper you despise risin to the top
Ryhmin with the force that's knockin down barricades
Callin Mr. Loverman singin girls serenades
Try to lay low - unfamiliar
Just like smokin I'm bad for your health, I could kill ya
Think I'm bluffin, wanna find out?
Then I pull the trigger to the nine and blow your muthafuckin mind out
A murder I slay, so don't sleep
The mic leave threads across your face like thee tracks from a jeep
Your coffin is your final refuge
Your death is gonna have to be revenged by your nieces and nephews
Beat you like Tyson, slice you like a butcher
Six feet underground's most likely where I put ya
I get the place in an uproar
Make you wonder what you got your little weak wack ass up for
Rhymes, I got em in excess
And I got the beats that you pump in your Jeeps and your Lexus
Lyrically I boast and I swagger
Words pierce your mind, after a while starts feelin like a steel dagger
Slice, slice, slice, dice, dice, chop, chop, chop
Look like maintenance got another mess to mop
It's '93 and I gets nuff respect
Cause I ain't nothin but a hip hop roughneck

Nobody bring your firearm
You can't do no harm
Nobody can try to come test we
Nobody bring your firearm
You can't do no harm
Don't flex with MC Shan, ya can't test we

(So whutcha want nigga, so whutcha want nigga?)
Boy, you better slow down or get your life wrecked
(So whutcha want nigga, so whutcha want nigga?)
Tryin to mess around with the hip hop roughneck
(So whutcha want nigga, so whutcha want nigga?)
Boy, you better back up or get your life wrecked
(So whutcha want nigga, so whutcha want nigga?)
Cause ain't nobody that can win me in my neck of the woods
(So whutcha want nigga, so whutcha want?)

Shan was dead, but now I got reanimated
Had the buttons to push, but didn't know how to operate it
I'm in control of the ship now, captain
Boy, you wanna walk up and see yo what's happenin?
Some rappers think they're vicious
But at the end of it all they probably wind up doin dirty dishes
I'm risin up on an incline
And if your ass was that dope, then muthafucka, your ass woulda been signed
Ain't no goin by the book
You be just another wack muthafucka bout to get his shit took
Don't let the temper start to flare up
Cause that's when I start lookin around for shit that I can tear up
See, you don't pose a threat
Boy, we can go a few rounds, this ain't as rough as it can get
Adversaries avoid me
Many have approached, but never has one destroyed me
I'm not a force to be reckoned with
1-2, 1-2, then I start wreckin shiiieeet
I got nice, but it wasn't by accident
Necks were broke, boy, you wanna get your back bent?
Even though I'm not a girl you a-fi respect me
If you think I'm wrong, then come and correct me
It's '93 and I gets nuff respect
Cause I ain't nothin but a hip hop roughneck


Psych - I don't need you to proof-read
Ak is on the bassline givin me the lead (indeed)
Tip-tip-toein through the tulips as I follow
Blast a hole in your chest, now the shit's hollow
I drop knowledge but I also kick ballistics
I be kickin the funky lines that mystify the mystics
Won't think twice just to send a nigga the lullaby
The next nigga that steps might get bust in the eye
I stopped spreadin hookers like mayonnaise
Cause there's a lot of things that you can catch out there in this day and age
I'm not down with the homo clique
But I'll jump inside a nigga's ass quick
Fee-fee-fi-fiddy-fo-fiddy-fum
Laugh now nigga, you used to call me bum
Now I'm buried under money
Your girl's comin to see me on the side and I'm dippin in your honey
Knockin off heads in the game like a gladiator
Records so hot, they give heat like a radiator
Assume position cause you know the proceedure
Need somebody to follow? Then let me lead ya
Now it's time to rejoice
Cause now you got another funky record that's kickin with the Shan's voice
It's '93 and I get nuff respect
Cause I ain't nothin but a hip hop roughneck

Word",https://genius.com/Mc-shan-hip-hop-roughneck-lyrics
Time for Us to Defend Ourselves,"Play it Again, Shan",1990.0,"Tales from the rhymeside, fact or fiction?
I look at justice as pain infliction
Sit back, relax while I bust this
There's a big loophole in justice
Law enforcement to serve and protect
But in my neighborhood they break your neck
Police are ruthless-minded, wicked and villainous
But not just I see you're killin us
What about the parents of the kid y'all killin'?
Better yet that's blood you're spillin'
Not doin' anythin' wrong, so catch me
Sellin' dope records? Boy, snatch me
Sunny days, my dark clouds lifted
You fail to understand that I'm poetically gifted
Knowledge ain't nuthin' but a book on your shelf
With justice in mind think deep to yourself
(If the government has refused to defend the negro)
(The descendants of slaves)
(It's time for us to do whatever is necessary to defend ourselves)
(But you're advocating violence?)
(Time for us to do whatever is necessary to defend ourselves)
(If the government has refused to defend the negro)
(Time) (Time for us to) (defend ourselves)

Contra's a code for police in the projects
Ready, to fly that head like an object
""Shan, you're makin' records, why you wanna stay there?""
That's where I was raised, and my son's gonna play there
Let me tell you what justice did
For a close friend of mine named Rich Kid
They ran a worn-out line that he snuffed 'em
Then he beat 'em down he and cuffed him
A gun and a badge gives a feeling of toughness
After subdued they continue with roughness
According to the laws of the land we're defenseless
Thinkin' that their jobs are beatin' you senseless
Takin' the names of fairytale props
There's one silly sucker called Robocop
The media skipped right past it
Robocop just put Rich in his casket
The bottom line: he wasn't under arrest
He needed ambulatory assistance for pains in his chest
If not for justice he would be in good health
May he rest in peace and think deep to yourself
(It's time for us to do whatever is necessary to defend ourselves)
(If the government has refused to defend the negro)
(Time) (Time for us to) (defend ourselves)
(If the government has refused to defend the negro)
(The descendants of slaves)
(It's time for us to do whatever is necessary to defend ourselves)
(But you're advocating violence?)
(Time for us to do whatever is necessary to defend ourselves)

We all live with police brutality
They say it's false - no, it's reality
Not just a storyboard 'cause I live it
All I gotta say is somethin' must be done with it
See the cops, are sort of deranged
Think every fly car means drug change
They pull me over for a routine, check me
What he has in mind is to disrespect me
""Where'd you get the money for a fancy car?""
Got you sucker, what you know about rap, huh?
I'm just a young man tryin' to make it
Remember the name and don't ever mistake it
All you could say was when I passed by
Is, ""That's MC Shan, don't he look fly?""
Although you thought that civil rights died
You need to wake up and see it from the brightside

(If the government has refused to defend the negro)
(The descendants of slaves)
(It's time for us to do whatever is necessary to defend ourselves)
(But you're advocating violence?)
(Time for us to do whatever is necessary to defend ourselves)
(If the government has refused to defend the negro)
(Time) (Time for us to) (defend ourselves)",https://genius.com/Mc-shan-time-for-us-to-defend-ourselves-lyrics
I Ran the Game,"Play it Again, Shan",1990,"A lil' lil' to make the ladies scream
This story is all about a tag team
The plot of the game was to jerk me
One would wind me, and the other would work me
These two were livin life triflin
To the point you would wanna get a rifle and
Blast their brains all the way to oblivion
Sweet Polly Pure and her homegirl Vivian
I first met em in the state of Wisconscin
When I caught ol' Vivy sneakin a peek at my Johnson
You could see that shine on my fronts
I said, 'Go for it, pal, cause you only live once'
I threw a quick glance at ol' Vivy
And she gave the eye that everything was splivy
The moment had arrived, I didn't wanna waste it
All choked up cause my eyes were pasted
On the bumps between her neck and her waistline
And I knew I had to hit her with a bassline
I said, ""I'd like to introduce me""
But I wasn't about to let ol' Polly and Vivy juice me
She said, ""I seen you clockin us
And I bet that you were thinkin 'bout knockin us
But if you had the chance, now would you?
Better yet, my man, now could you?
I said, ""I'ma tell ya, no sense lyin
I be damned if I didn't die tryin""
She said, ""I'm just kiddin, and we don't do that""
And I said, ""Sure, what train runs through that?""
Like a prospector stakin his claim
You mighta been dealin, but I ran the game
(Yo, yo, place your bets
Word up, I got the bank, yo
He-he-he, word to mother)
(Place your bets)
(Place your bets)
(Place your bets)
You mighta been dealin, but I ran game	(2x)

Now Polly wasn't into any regular ritz
With that big bold ass and them rhinestone tits
Just lookin at Vivy had me comin in excess
All I seen was horses on the plains of Texas
I asked them if they knew a place that I could rest at
Kinda hopin they would suggest that
But I still had doubts
And they said, ""Come on over to our house""
""Then it's to your place we step to
Here comes my ride, yo James, what kept you?""
I can still see the faces like a snap shot
Like they musta hit the jackpot
I could see em just sneakin and canivin it
The car was borrowed and my homeboy's drivin it
Some freaks, me and James drived past them
I was surprised how quick that gased em
""Before you put up the glass to divide, Sir
Are you planning to ride her?""
""Do we have to go through it?
Put the pedal to the metal, James, now do it""
Vivy sittin with her legs all cocked
I said, 'Goddamn, she gotta get her boots knocked'
Polly asked me where the bar was
And what else this car does
This car is boring and restless
Pussy invitations, I was now on the guest list
They made a few ice teas from Long Island
You're talkin 'bout a brother that's smilin
Like a prospector stakin his claim
You mighta been dealin, but I ran the game
(Yo, yo, place your bets
Word up, I got the bank, yo
He-he-he, word to mother)
(Place your bets)
(Place your bets)
(Place your bets)
You mighta been dealin, but I ran game	(2x)

Now Vivy had my limb hard as a bark
I was ready, I was set, and I was on my mark
Like a thoroughbred she was the gait
I yelled, ""Time, hold up, wait!""
Before I take my iron and I brand em and bond em
I revealed my super lubricated sensitive condom
She yelled out, ""Timber!"", and I said, ""Fall""
Damn, what the hell James gotta ring the phone for?
Just like a sucker he said he would bust me
""Chill, you're with it, homeboy, trust me""
Turned my back to fix the blind up
And in a glance they both were lined up
I had the whole world in the palm of my hand
And more pussy than a man could stand
Mile after mile I was stickin ol' Vivy
Polly on the side sayin, ""Gimme, gimme, gimme""
Up and down, doin it to death
Y'all better hold on, there's a lot more left
There I was, drivin it deeply
The tag was made and Polly yelled, ""Freak me!""
So I sent her on a far out trip
Kicked that 'don't you ever leave me on the lonely' tip
I had Polly and Vivy pinned to the mat
1-2-3, and they was out like that
They thought I was a sucker, Mr. Lollypop Man
On the bumps they would always say, ""Shan! Shan!""
They were probably thinkin Grants and Franklins
I'm surprised they didn't hear the change shanklin
Since they didn't, that's too bad
About 89 cents, and that was all I had
Now as for Polly and Vivy and their big-time talk
I left them drunk bitches on the sidewalk
Just like a prospector stakin his claim
You mighta been dealin, but I ran the game
(Place your bets)
(Place your bets)
(Place your bets)
You mighta been dealin, but I ran game	(2x)",https://genius.com/Mc-shan-i-ran-the-game-lyrics
The Bridge (Bladerunners Dub),Down By Law,1987,"MC Shan - The Bridge LYRICS
Lyrics | Search | LyricsBox | Chart |LinkUs | Contact
Artist Title Album Lyrics Text
Artists archive
A b c d e
F g h i j
K l m n o
P q r s t
U v w x y
Z
. : mc shan : 
Translated title:
MC Shan - The Bridge Letras
MC Shan - The Bridge Song lyrics
MC Shan - The Bridge Song texte
MC Shan - The Bridge paroles
MC Shan - The Bridge testo
. : MC Shan - The Bridge : 
Send mc shan ringtones to your cellphone
M TOP - MAX... - MC Shan Lyrics - The Bridge Lyrics
Amazing!
Young and Sexy
After Shower Thoughts
Pen Spinning
Ladies and Gentleman
We got MC Shan and Marley Marl in the house tonight
They just came from off tour and they wanna tell you a little story
About where they come from
The Bridge(scratched) (3X)
Queensbridge
You love to hear the story again and again
Of how it all got started way back when
The monument is right in your face
Sit and listen for a while to the name of the place
The Bridge(scratched) (3X)
Queensbridge
Hip hop was set out in the dark
They used to do it out in the park
Every place they said his name it rang an alarm
Otherwise known as Mean Teen Tom
A brother whose known for his rap
Jabby Jack, Larry Laughter and least not last
A cool brother by the name of Gas
These brothers made you get loose
They was down with a brother called Cousin Bruce
They used to jam in the center
You had to pay so you could enter
Go to the door
Get frisked
Just in order to get in
And if you wasn't from this town
Then you couldn't fight and win
But everytime they had a jam
They couldn't get no peace
So that's why the jam's out there
And the parks they had to cease cause you was in
The Bridge(scratched) (4X)
Queensbridge
Why don't you wise up
Show all the people in the place that you are bright
Make this here one jam that you do not start no fight
Cause that is one thing that we all must see done
And if you start some shit you're ass had better run
Cause you're in
The Bridge(scratched) (4X)
Queensbridge
Dimples be the girl, she was great
Her and Marley Marl went and cut a plate
They used to rock it out in the place
And the title of it was sucker dj's
And then he strolled along one day
And then he walked into a girl named Shante
Third in line you know its me
MC Shan ha ha in the place to be
MC Man he made them beg
He is the man who is known as Craig
The newest member out to get loose
Now he is down with us and he got the juice
This is the place where stars are born
And we are the only ones that can't be worn
Out
By any place any part of the world
And while i'm out on tour keep your hand off my girl
When she's in
The Bridge(scratched) (8X)
Queensbridge
Dead dreams, bought and sold
You gotta try and receive your goal
However you do it however you're made
Don't ever listen to what ? say
Cause I will tell you the deal
You gotta go by what your heart feel
Cause if you don't you'll be misled
By stupid little things put inside your head
Or someone else that you will see
Their trying to live your destiny
By the time you think about it your grown
And then you gotta say god damn I gotta leave my home
Grab hold of your heavy chain
Rich people always pullin always trying to restrain
You heard just what I said
They're always pullin ya back when you wanna get ahead
They pull you back cause their not wit it
You're talking about school
Their talking about quit it
Soon you'll see that time just fly
Cause you spent most of it out gettin high
Thought about it much, much later
Could've went to school and been much greater
But you chose to lead that fate
Now you're sucking on a bone when it should've been steak
The whole purpose of the story I told
Was mainly to inspire you to reach your goals
Stop walking through life as if you are blind
You should reach for your goal cause i'm reaching for mine
And i'm from
The Bridge(scratched) (4X)
Queensbridge
Keep on rockin
The bridge
Will keep rockin
If the beat stop rockin
The bridge will keep rockin
If the beat stop rockin
The bridge will keep-a rockin
Till the beat stop rockin
The bridge will keep-a rockin
Till the bridge stop rockin
The kids will keep-a rockin
When the bridge stop rockin
The bridge will keep-a rockin
If the kids stop rockin
The bridge will keep-a rockin
Till the beat stop rockin
The bridge will keep rockin
Ladies and Gentleman
We got MC Shan and Marley Marl in the house tonight
Ladies and Gentleman
We got MC Shan and Marley Marl in the house tonight
They just came from off tour and they wanna tell you a little story
About where they come from
They just came from off tour and they wanna tell you a little story
About where they come from
(Music plays until end)
Replay Video | Share Video | More Videos
The NEW lyrics box for your site! It's free!
PUT THIS LYRICS INTO YOUR SITE! choose from 90 available styles
. : for you blog : 
Put lyricsbox in your website! search results will be showed on clear popup... try it!
Lyrics Search
Artist Title
Click here to view
More searchbox styles
Link sample:
HTML code for the link:
Link sample:
HTML code for the link:
Back to - MC Shan Lyrics
Charts | Top artists | Top titles | Full Archive:-- 0 A B C D E F G H I J K L M N O P Q R S T U V W X Y Z
Welcome to MC Shan Lyrics all the MC Shan Lyrics in this site are the property of MC Shan Lyrics or/and respective authors, artists and labels and provided just for study purpose. If you want to use MC Shan Lyrics, Please contact the authors, artists or labs of MC Shan Lyrics
Boobs Bouncing
Sizzlin Hot!
Britney Spears Drunk or Stoned?
She Sleeps Naked
Absolutely Beautiful!",https://genius.com/Mc-shan-the-bridge-bladerunners-dub-lyrics
Never Rock a Party,Born to Be Wild,1988,"Self-preservation, no warning alliance
And my rhymes are mainly based on mathematical science
I drink Moët on the rocks, Harvey's with Bristol
All about money and mics made out of crystal
My name will be praised, body preserved as a relic
More girlies than Bond, chillin harder than Selleck
Wanna live in a castle, with girls for romancin
Feedin me grapes while they're fanin me dancin
Crispy and fresh, never get spoiled
I'm takin a vow to be honest and loyal
I'm happy to announce me and rap are now wedded
And breakin the vow's a ground for bein beheaded
People travel for miles to get where I'm playin
I hate to disappoint em, homes, dig what I'm sayin?
I'm a knight in shinin armor, I rhyme, not joust
And I never rock a party, when I play, I house

Some rappers are wack and takin the credit
You knew who you are just as soon as I said it
On your burial grounds I'll inscribe my initials
This is what you get for tryin to pay the officials
MC's are like cards, they want you to play em
I like dungeons & dragons cause the plot is to slay em
My name'll carry on just like a tradition
My sons will be housin when I'm retired and fishin
I love to recite, say a rhyme and then spin it
Take it as a joke, but I'm in it to win it
Highly fortified, balanced, efficient
Never said a rhyme that wasn't sufficient
Biters nowadays, watch what you tell em
They might just take your rhyme, wanna rob you and sell em
I'm a knight in shinin armor, I rhyme, not joust
And I never rock a party, when I play, I house

I settle for tops, not takin no middles
Dope lines cause my mind's just as fit as a fiddle
MC destroyer, rulin the nation
Excuse me baby, would you like to take a dication?
So let it be said, so shall it be noted
I like to thank the fans that faithfully voted
I truthfully swear I'll never be lettin
Suckers keep rockin if I don't think they be jettin
Stripped to the bone, bare to the gristle
Worse than death, serve eternal dismissal
Never incited by slander or disses
Leave a blank for my name, I send plenty of kisses
Bound to go far, travel ??????
Debate Aristotle, question theories of Plato
Rappin is witty, the journey is rough
And categorized as simple teenage stuff
Achievin my goal, do better than rockin
With light in my eyes I can see who be clockin
I'm a knight in shinin armor, I rhyme, not joust
And I never rock a party, when I play, I house

Live in the jungle, survivin the boonies
The number of fans is even double the monies
My rhymes is devine, pure and untampered
No longer expect to be spoiled and pampered
You be cast in a bondage, emprisoned in cages
Not to be seen or even heard of for ages
Offenders remanded on dates of arraingment
A law for the rock house and that's entertainment
Rodents and rats, reptiles and lizards
MC's who proclaim to have the knowledge of wizards
All of the lowest hunted as pheasants
Like it or not, have to bow in my presence
I'll never be outwitted at the games I play
Took a break but you knew I'd be back someday
But truthfully you know it wasn't all that long
But knew my next jam had to be super strong
Dope rhymes are the reason that others hate me
That's why they make records tryin to down and degrade me
But nothin I can say, that's how it goes
They just better hope we never have no shows
I'm a knight in shinin armor, I rhyme, not joust
And I never rock a party, when I play, I house",https://genius.com/Mc-shan-never-rock-a-party-lyrics
So Def,Born to Be Wild,1988,"(So fresh)-- Roxanne Shant
I'm on the list and, my rhymes are crisp and
Me and rhymes are like a nose and Dristan
Without fail, everytime I
Get a dope idea for a rhyme I
Choose to save it or scrap it
See Marley for a beat and then rap it
I'm blessed by buddah, I'm not new ta
And sayin rhymes is what I do ta
Pass some of my free time away
Ask me why, and I'ma say
My nickname's MC Brutus
Cause I'm quick to pick up the mic and say, ""Yo, let's do this""
The world of hip-hop is so demandin
I lead the pack because I write the funky rhymes that are so
(So fresh)
You're too smart to bite a part two
But if you ever get the nerve or heart to
When I find our behind, forget it
If it's a battle you want, I'm with it
1-2-3-4, Marley Marl, a-hi-hit me
Since when a beat he made not fit me
It's a fact too that I attract to
These beats I'm about to get back to
Girls I scoop, parties that I hoop
And I doubt with your rhymes you can hang with me, troop
Even though I, am a pro I
Grab the mic now and then to show I
Have the skill to, plus the will to
Make the jams you can sit back and chill to
I think about the rhymes, then write em
The first chance that you get, you go bite em
The world of hip-hop is so demandin
I lead the pack because I write the funky rhymes that are so
(So fresh)
In the, beginning of
Around the time when they thought about the spinning of
Records on two turntables
Before they started callin dookie ropes cables
Even today I, you know the way I
Come across with dope rhymes I say, I
First suggest them, then manifest them
Go to Marley's house and Warner Bros. presses em
We had a touch of, but not much of
The def beats that we now have a clutch of
Understand me, we don't plan, we
And might I say myself, goddamn we
Hate to make a jam that ain't slammin
We make the jams that you wanna keep jammin
The world of hip-hop is so demandin
I lead the pack because I write the funky rhymes that are so
(So fresh)
I lead the pack because I write the funky rhymes that are so
(So fresh)",https://genius.com/Mc-shan-so-def-lyrics
