title,album,year,lyrics,urls
Words of a Freestyle,Born to Be Wild,1988,"The microphone stand is where I make my escape
Out of the blue I see some dope rhymes that I shoulda take
I used to say em off the top of my head, man, could I drop a
Megaton bomb that was odd to stop, a
Movin train, hope I don't have to explain
That any rapper step in my way, he's bound to be slain
The stage is the court, I'm the judge and the juror
And when rappers pass me by they should Heil to the Führer
Although you may hate me and down to degrade me
There's some suckers walkin 'round tryin to cold imitate me
Never cursin or rehearsin cause I'm so versatile
And you can tell by these words it's a freestyle

MC's I wipe out and rub them, don't care if you love them
And I wish you placed my name ?that flies? way up above them
Each and every show I do ends with applause
Here's lookin at you, kid, now go for yours
And if you choose not to, then I'm gonna take it
A night you'll never forget: it's just what I make it
And it won't take long for me to sing a new song
Because the key to gettin paid is you should never prolong
See my mind is set to automatically jet
You can't name the day you seen me let a mic pass yet
Once the microphone is mine I start by thankin you greatly
And you haven't heard of anybody duffin us lately
Never cursin or rehearsin cause I'm so versatile
You can tell by these words it's a freestyle

Just take another look at this one tough cookie
And could never be duffed by a new jack rookie
See, before I came with an MC name
And I feel sorry for the rapper that tries to proclaim
Because you won't have a chance and you will need advancin
Marley hasn't made a beat yet that wasn't enhancin
As a matter of fact I keep my rhymes intact
Severly's how you get served for callin me wack
Never again, I'm reminiscin
Last rapper in the world you should think about dissin
Cause my lyrics are burnin, Marley's tables are turnin
And ?sufficiant? we give suckers are watchin and learnin
MC Shan and Marley Marl and we're respected so greatly
And you haven't heard of anybody duffin us lately
Never cursin or rehearsin cause I'm so versatile
And you can tell by these words it's a freestyle

I come runnin when the microphone calls
Say a few ???, say ???, say ho and yes yes y'all
It gotta be ill cause I don't write no frill
You used to love to hear the story and you always will
We put the B, the B, the Bridge on p-plastic
??? like ???
But the ??? made the jivva-jivva-jam c-classic
Come to think about it, we're respected so greatly
And you haven't heard of anybody duffin us lately
Never cursin or rehearsin, I'm so versatile
And you can tell by these words it's a freestyle",https://genius.com/Mc-shan-words-of-a-freestyle-lyrics
Living in the World of Hip-Hop,Down By Law,1987.0,"Hip-hop
Hip-hop
Hip-hop
Hip-hip-hop	(2x)
There is no implication hip-hop is wrong
Beats tapped out, played back in songs
Consider hip-hop as a verbal sport
It brings pleasure while expressin one frame of thought
Those that don't like it, then you're psychotic
To my point of view hip-hop's exotic
Rhymes being written everytime you blink
With no vital signs of becoming extinct
Try to demolish, it will not be worth
Killing all hip-hop fans on earth
Don't try to compare it, there's no relative
The word to describe hip-hop: creative
Once you're at a party you're in hip-hop's lair
To downgrade art, how could one dare?
Once upon a time they used to play soul
From there they went to rock 'n roll
Rock died down, then along came pop
Now you're livin in the world of hip-hop
Hip-hop
Hip-hop
Hip-hop
Hip-hip-hop	(2x)
I am the creator of my hip-hop style
With a level of college understood by child
Hip-hop is being moved on a one-way course
Up and being led by an unseen force
You try to hold it down, won't be no good
The more it gets exposed, the more it gets understood
It's all fantasy, yet all realistic
Often complicated, other times simplistic
Lyrics so sharp, they can cut like a knife
I'm sworn by oath to the hip-hop life
Less live drums, less guitar strumming
Hip-hop is the life of the up and coming
Not by force, by one's own choice
Persuaded by the beat and the MC voice
There are people who love it across the land
And there are those that think that it should be banned
Well I say I love it, it comes from my heart
Very thankful for the day that it got its start
Now that it got started, you see it won't stop
And you'll be livin in the world of hip-hop
Hip-hop
Hip-hop
Hip-hop
Hip-hip-hop	(2x)
(Super sperm)
Hip-hop
Hip-hop
Hip-hop
Hip-hip-hop
The only thing you could do that would make me mad
Is take away my pen and my hip-hop pad
Take that away, I have nothing left
So let it go free or sentence me to death
I know you had troubles with your moms and dad
When you were growin up goin through your childhood fad
Some parents think that hip-hop means
Wearin fat shoe laces and name brand jeans
It really doesn't matter just what you say
Hip-hop will be around till you're old and grey
They're just all lies created by nerds
You think that I'm playin, you mark my words
Just like man sends rockets to Mars
Hip-hop living is ascending to stars
The more it gets accepted, you'll see it won't drop
And you'll be livin in the world of hip-hop
Runnin neck to neck in the music world race
You don't have to listen if it isn't your taste
It's becoming worldwide, internationally known
Have you ever heard the saying 'to each his own'?
People like jazz, cause that's their taste
I prefer crisp highs with an earthquake bass
There are hip-hop songs that make you tense
And then there are those not worth 2 cents
But still hip-hop's gonna make its mark
Cause you used to only hear it in your neighborhood park
To all non-believers, you should know your name
Since the parks, don't you see how far the hip-hop came?
It's been around for years, and you ask yourself how?
For the very same reason that you're listening now
You might have been hooked from the very first line
Cause raps like these cultivate one's mind
One day your resistance level might drop
And you'll admit: it's a world of hip-hop
Hip-hop
Hip-hop
Hip-hop
Hip-hip-hop	(2x)
Straight from the MC's mouth you heard it
You have to bear witness cause you can't convert it
It's based on a beat with a real slight dip
Kool Herc came along and said, ""That's hip""
Heads started bobbin, he began to hop
And he said, ""Let's call this hip-hop""
Hip-hop
Hip-hop
Hip-hop
Hip-hip-hop	(5x)",https://genius.com/Mc-shan-living-in-the-world-of-hip-hop-lyrics
"Jane, Stop This Crazy Thing!",Down By Law,1987,"(Jane, stop this crazy thing!)	(2x)
She was this girl that I know named Jane
She used to be cool, now the girl's insane
Now all Jane does is walk around all day
Sayin, ""Beam me up, Scotty, take me away!""
Now I remember Jane from back in the day
When she used to go to school, get all straight A's
Now you see Jane on the street corner
Stoppin every car anytime she wanna
Whatever went wrong, the facts remain
But who could think this woulda happen to sweet old Jane
(Jane, stop this crazy thing!)	(2x)
Jane's life story was a tragic one
She started gettin high, cause she said it was fun
There was no party, just a meeting of friends
And then the question arose: who got ends?
It went around, they had 300 in all
Somebody yelled out: ""We're gonna have a ball!""
Steve grabbed the money and ran down the block
Came back and said, ""Y'all, take a look at this rock!""
Jane was gettin into somethin heavy that night
""Hurry up quick, somebody give me a light!""
 said ""Hold it!"", he was pullin too fast
But Jane was amused by the smoke in the glass
She was tickled to death at the faces they made
""Puttin fire to the glass, don't you think it won't break?""
In a flick of a flash the torch was lit
She put it to her mouth, and she took a hit
Smoke rushed from her lungs and up to her brain
This was the beginning of the end of Jane
(Jane, stop this crazy thing!)	(2x)
Jane got weak, and the bass got strong
What she used to do right, Jane now does wrong
I walked past one day, called my man Jack
She almost broke her neck cause she thought I said ""crack""
It had to be a week since I seen her that day
But the body that she had just wasted away
When she used to walk by, we used to say she looked chill
But now as she passes, everybody go (ill!)
The girlie we saw hop off Mercedes Benz
She was on it so hard, she started stealin from friends
To all the drug dealers she was so in debt
That she sold her VCR and her TV set
Jane used to live the life as the storybook tells
Now everything she gets, she eventually sells
Sneak around the corner when you see Jane comin
She'll be touchin on your clothes, the girl be crumbin
(Jane, stop this crazy thing!)	(2x)
If you know a girl who was the quiet type
Who acts kinda funny and a bit too hype
These kinda actions only mean one thing
She's only buggin like that cause she's suckin the thing
Not only the girls, it can happen to guys
But the fellas try to beat you, then they greet you with lies
One day Jane coulda been my honey
I just couldn't wait till the girl made 20
I see her nowadays, and all I do is sing
(Jane, stop this crazy thing!)
(Jane, stop this crazy thing!)	(3x)",https://genius.com/Mc-shan-jane-stop-this-crazy-thing-lyrics
Project Ho,Down By Law,1987,"Listen close to the story I'm about to tell
It will never be repeated, so listen well
And if you been around the way, some of you might know
This girl we label as the project ho
If you look half decent and if you kick it right
She was bound to be yours for at least a night
See, I was introduced to her by my cuz
But that was before he told me who or what she was
Me not knowing about this freak
Pulled her off to the side and began to speak
She had jet-black hair, big brown eyes
She seemed to be smart conversation-wise
I said, ""You look so good, as a matter of fact
Here's my number, I ain't home, baby, call me back""
I didn't know if she was poor or filthy rich
Cause my cousin didn't tell me nothing 'bout the bitch
One thing I did know, I'm gonna get my thrill
Then I cold stepped off, and said, ""Baby, you chill""
You know that old saying if you're slow you blow?
She was fast, so they labelled her the project ho
I heard stories on the things that they said she'd do
But when I seen her, I said, ""Nah, it can't be true""
She was fair game, so I thought I'd play
And never in my life will I forget this day
I was chilling one night, I was all alone
Nodding off but awakened by the ring of the phone
To protect the guilty party cause they might have been stemmed
We won't say her name, so we'll just say Kim
When I heard her, goose-pimples ran up my skin
I said, ""Hi, how you're doing and how have you been?""
She said, ""I'm doing fine, I hope you're doing the same
Do you know who I am?"", ""Yeah, I remember your name""
I thought deep down that I peeped the card
Kept saying to myself she was on it hard
I tried to be nice, tried to treat her kind
But she had only one thing on her mind
It always happens, well, wouldn't you know
She said, ""I see you later, cause I got to go""
My cousin came home and said, ""Are you some fool?
Being seen in the streets with a garden tool""
I loooked up at him, cause I did not know
He said, ""Kim, that skeezer, she's the project ho""
Me myself thought homie was dissin'
Despite all that I did not listen
Wouldn't you believe it, she called me again
And this was the line that I kicked her then:
""I'd love to see you, girl, and I don't know why
Don't try to play post, cause you know you're fly
So I'd like to come and see you if I may""
I was surprised as you when she said, ""Okay""
Now that that part was over and done
""Baby, what do you do at times to have fun?""
""Depending on the weather and my mood that day
Sip Dom Perrignon at a Broadway play""
The other things are not good to mention
Like coming to my crib and relieve my tension
I told her I was in love from the day we met
After talking for hours Kim said, ""Bet""
I had to let her go just to clear my line
""So I'll see you on Friday, let's say about 9""
From the things she said, why didn't I know
The girl on my line was the project ho
I took her out - fine's how it went
But I better get something for the dough I spent
Turned on the radio and heard (a world premiere)
Turned to her and said, ""Where we go from here?""
The best part of it all, the thing that made it so treach
The colors we wore were the same as the stretch
I recognized the look that was on her face
And I yelled to the driver, ""Homeboy, my place""
We made it there in at least a half
I got a choice of wines and a jaccuzzi bath
You'll scream when I tell you what homegirl said
""Show me to the room with the king-sized bed""
I was rested real well, so I felt strong
I knocked those boots that whole night long
Right after she left, I started to itch
Then I thought of what happened, then I said, ""That bitch!""
I went to see the doctor later on that day
Cause when something is wrong, Jack, I don't play
The doctor came over, this is what he said:
""You can't cure it with soup or laying up in your bed
You're lucky that you came to see me early, my man
Cause I guess that you know that you got it, Shan""
I said, ""Well, my man, that only goes to show
Believe 'em when they tell you she's the project ho""",https://genius.com/Mc-shan-project-ho-lyrics
Down By Law,Down By Law,1987.0,"My name is MC Shan, my destiny is the stars
Being driven around in the freshest cars
All his beats and my rhymes are chill
Now I'm back once again ready to get ill
The beat's not fake, the rhyme's hardcore
My name is MC Shan and I'm down by law
There's been this rumor going around
About low life crabs saying I ain't down
But all MC's will feel my wrath
The system is my power the mic is my staff
I have the power of command, the power of lust
After battles all papers read
(Another one bites the dust)
All across the country I know I'm hated
Not only by crews I've devastated
Don't ask how I know, I just can tell
By the tone of your voice as you wish me well
Filled with so much envy that your face turns green
Cause my name rings bells on the Hip Hop scene
So pull out a bottle let the champagne pour
Fly rhymes so that makes me down by law
(Another one bites the dust)
Creeping across the nation like a midnight storm
Always rock a jam every time I perform
Records I make are not distorted
Made in New York and not imported
Have never been known to make an error
Crews see me coming, their heart fill with terror
Dip out the back when I step on the scene
Watch the back door, you'll see what I mean
I love to rock a party every time I can
My DJ's Marley Marl and I am MC Shan
We make the freshest jams that you've ever heard
Marlon ain't we down?
(Word!)
Now that we've come to the very end
His beats my rhymes are a perfect blend
We are the ones all others admire
To be like us is their desire
Never get angry always stay calm
Yet do as much damage as a nuclear bomb
Do or say anything we may
We destroy all objects in our way
As expensive as diamonds, precious as pearls
Rap so strong, take all y'all girls
Make cold cash money, do much much more
My name is MC Shan and I'm down by law",https://genius.com/Mc-shan-down-by-law-lyrics
Cocaine,UnKnown,UnKnown,"Now, this is what happened but I wasn’t upset
See, it all started with this girlie I met
I really liked this girl, but she made me sad
‘Cause she almost made me trick off every dime I had
Now listen to this story that I have in store
‘Cause it talks about this girl you mighta met before
See, I was chillin’ at a party, I was out gettin’ loose
When me and this young lady was first introduced
She was lookin’ so sweet, a glitter came to my eye
They said they’d call sucker if I let her pass by
What I felt inside from that very first night
We were a perfect couple ‘cause she made me feel right
From that day, all my hopes and dreams were lost
The more she came around, the more she started to cost
Then she got me to the point, I feel so down
Each and every time that she wasn’t around
Well, lotsa times when she’s around, I often sigh
‘Cause she had me in control and I didn’t know why
I shoulda cut her off, that woulda been smart
But I found it really hard for us to part
With a heart as cold as mine, I feel that’s a shame
Every time I turn my back on her, she called my name
(Shan) (repeated a bunch of times)
I would always regret the first day we met
I wanted her so bad, she had me dripping with sweat
Every time I came home, she had me tricking my pay
And when I told her that I love her, she had nothing to say
She drove me so crazy, stone outta my mind
She beat me so bad, my rent was months behind
I finally see she had me caught in her own little way
So I tried to get her back just by staying away
But when I used to feel good, she had me singing her chant
See, I tried to stay away but I found that I can’t
I went to see her, copped a plea, why I don’t have a friend
You do me right, my love, that’s why I’m back to see you again
All the days that I was gone, I was going through hell
My heart was beating so fast, my head started to swell
When I was by her side, I felt so secure
When I met this young lady, she was nice and pure
I don’t know what her reaction was on some
But when I kissed this girl, my mouth went numb
Now, from that point, I should have known
But my love for this girl since the day has grown
Girls like this are one of a kind
She’ll free your soul and clear your mind
Stay away from this girl, take my advice
She’s as pure as snow, her heart is cold as ice
I was under spell, she had my brain
Don’t you know by now that her name was cocaine
Stay away from this girl if you wanna stay sane
She’ll pick your pockets and damage your brain
Girls like this really ain’t no joke
She’ll only be yours ‘til the day you go broke
If you see her on the streets, don’t give her a grin
‘Cause it won’t be long before she sucks you in
So before you have a problem that you can’t solve
With tricky girls like this, don’t you get involved
‘Cause it will be a short time and you will be through
There’s no tellin’ what reaction she could have on you
To some, this girl is just a passing phase
And she’s even made some cold change their ways
From doctors, studying the medical books
Into big time liars and petty cash crooks
She doesn’t know when to stop, she'll take things too far
You’ll be pawning your gold as well as selling your car
She’ll be your friend, oh me, oh my
Up until the day that the well runs dry
That’s right, you heard just what I said
‘Til the well runs dry or your ass drops dead
She’ll change your life, you’ll say ‘dag-nab-it’
She’ll just turn out to be another bad habit
So please take heed to the things I’ve said
And never let this girl mess with your head
Stay away from this girl if you wanna stay sane
She’ll pick your pockets and damage your brain
Girls like this really ain’t no joke
She’ll only be yours ‘til the day you go broke",https://genius.com/Mc-shan-cocaine-lyrics
Go For Yours (’Cause I’m Gonna Get Mine),Born to Be Wild,1988.0,"I'm myself called a hood because I walk with a limp
Would you believe they even call my boy a hip-hop pimp?
Like Dr. King I had a dream, I couldn't sleep too long
If I had to stand alone, I'd still be strong
Men are all equal, we're the Father's creation
What used to be the distant land is now my nation
How long will it be, how many suckers must die?
There's only one answer to the question why
My knowledge is the sun and it will always shine
You better go for yours, 'cause I'ma get mine

Unalike's attract and a-alike's repel
And if you buy dead dreams I got plenty to sell
All the money in the world couldn't buy my knowledge
My teacher was experience, the streets was college
It's a shame that many had to learn this way
So I never take the word of what the next man say
Head-a-arm-arm-a-leg-a-leg-a
Supreme High Being, Sole Controller, not a beggar
My true manifestation of Shan
I never fell, I held my destiny within my hand
On the day that I was born I received strike one
Because my culture was an Asiatic native son
My knowledge is the sun and it will always shine
You better go for yours, cause I'ma get mine

My foundation is strong, so I had to destroy
Do y'all remember Cheetah, that was Tarzan's boy
My main motto is self-satisfaction
Life's a movie with no cuts, all straight up action
If you roll as a sucker, then a sucker you die
And six feet up above you is the heavenly sky
I haven't heard of any comin' back to tell
Dyin' must be heaven, cause livin' is hell
You sit around and wait for your wish to be granted
And the next thing you know you're being buried and planted
Your body is the temple, the brain is the center
A door to explore, but you're scared to enter
Mind means many in need of direction
And the dictionary listed in the poverty section
You're nothin' but a novel on a bookstore shelf
And see the title of mine reads: ""Think for Self""
My knowledge is the sun and it will always shine
You better go for yours, cause I'ma get mine

You say you're sick and tired of bein' rejected
And you think you do better bein' crime-connected
Just for example let's say that you're twenty
Got a Benz, fly girls and doo-doo money
Moms ask: ""Where you get it?"" What you gonna tell her?
You dropped out of school, became a drug seller
You say you knew what you were doin', you say you were smart
Next week they beat you down and bust a cap in your heart
Your knowledge is the sun, you better let it shine
No matter what you do with yours, I'ma teach mine",https://genius.com/Mc-shan-go-for-yours-cause-im-gonna-get-mine-lyrics
A Mind is a Terrible Thing to Waste,Colors (Original Motion Picture Soundtrack),UnKnown,"Gangs usually roll as a savage pack
Once sworn in, there's no turnin back
Initiation, manhoods are tested
Do crime, you'll fail by becoming arrested
Get beat down the line, cautiously steppin
Always watchin your back with your hand on your weapon
You blink for a minute and get brutally beaten
Every time you diss the colors it will keep on repeatin
When you say you knew somebody that was a gang member
You can't say you know him, you can only remember
You have to live life all nervous and worried
But joinin a gang means you wanna be buried
It's either that or jail cause there's no other place
And a mind is a terrible thing to waste
Just a walk on the block, they tell you it costs
Willingly pay - or be forced
Once your color is set you gotta be stern
A bad influence for the young that are eager to learn
The rules of a gang is fightin and killin
Did you ever stop to think that was blood you were spillin?
Duckin from the cops most the time
Because you live life devoted to crime
Gangs are mainly based on colors and races
Not everywhere, just in particular places
Hang on the corner or on the stoop
Fightin people lookin just like a terrorist group
Gangs give a rank at society level
Wear a tatoo skull with the mark of the devil
You have to live life all nervous and worried
But joinin a gang means you wanna be buried
It's either that or jail cause there's no other place
And a mind is a terrible thing to waste
No turnin back 
Had many bad dreams, nights stayin awake
Joinin a gang was the fatal mistake
Just to fill your head with knowledge till your mind goes blank
And rumble with boys and dispose of the shank
GANG can be spelled with capital letters
Yo, while you're sweepin the streets, does it make you feel better?
Some gangs lack action, they're basically talk
Until their brains get scattered on the sidewalk
Your obligation is to serve as a marionette
And by society you're treated like a homeless pet
You wanna live the life of crime doin negative things
When Al Capone died, so did gangster kings
To live the life of a gangster is all out of place
Because a mind is a terrible thing to waste
Gangs are always violent but jail is rough
You go a man and you may leave a cream puff
You say you do crime cause you're poverty stricken
And so is everybody that you're robbin and vickin
Gangs ain't gonna be around much longer
If 5 out of 10 become mentally stronger
My mother said bein in a gang ain't nothin
I didn't listen to her cause I thought she was bluffin
I thank her from my heart that she stayed on my case
Made sure my mind didn't just become another waste",https://genius.com/Mc-shan-a-mind-is-a-terrible-thing-to-waste-lyrics
