title,album,year,lyrics,urls
Dirty Cops,Wakedafucup,2014,"The old neighborhood screamin out dirty cops
Cause they up to no good, fuck the dirty cops
Wanna slam me on the hood, dirty cops
Tried to rob me for my rights but I know
I know my rights I know I know I know I know

I'm on the block with a couple racks on me
Dirty cop tried to put a couple packs on me
Use his 
knife stick
 to fuckin beat the black off me
Then I ran, bumped him made him spill his black coffee
Better back the fuck off me, I know my rights
Sais
 the kid had a gun and ya know that's hype
Tried to throw me on the ground on a cold ass night
But fuck a dirty, cop you know that's right
They only make like twenty three a hour
At the chinese spot, always eatin sweet and sour
This where you find the cops, in hot pursuit
Late night tryin to find a prostitute


Dirty cops is good if you pay 'em off
Cause they could kill a nigga they won't even lay him off
Tryin to plant drugs so they could send them way up north
Keep the money comin in it's like sprayin off
Cause you see, police won't bug a nigga
Won't fuck with me but put the drugs on another nigga
But miss a payment, then find yo' ass up the river
Keep my dirty cops paid off like whattup my nigga?!
If it's there word against yours, then dead it
Now you got a felony and a court case schedule
Get a good lawyer my nigga is what you better do
Should've paid the dirty cop now you in federal


Yo you dirty cops on the block watchin with binoculars
Wanna talk to us well piggy we ain't tryin to talk to ya
It's obvious you really got the low low on my shirt
Actin like you tough cause you know your a homo when it hurts
See you robbin drugs at work so you could sling 'em on the side
Pull me over with no warrant to investigate my ride
But I know my fuckin rights so I ain't lettin you inside
Every time you write a statement yo I'm bettin it you lied
You the, only motherfucker let you serve and protect
Walkin with your chest out like you deserve the respect
All the laws that you push you got the nerve to forget
Tried to arrest me for this verse cause every word is a threat
Bitch!

1 2 3",https://genius.com/Onyx-dirty-cops-lyrics
The Realest,Wakedafucup,2014," 
Who's the realest, is it you? (Yeah, yeah!)
Who's the illest, is it you? (Yeah, yeah!)

Who's the illest in here?

It’s that time we about to licked off
Let off the ratchets, full metal jackets
Blow your head off backwards, attack with everything
Get that Mac and let it ring like bill collectors
I'm a mass murderer what a killed the records
With a 
fifty round trump
 feel what did It dump dumbs
Every nigga on the run in the city that I'm from
We catchin' wreck on wreck through rush hour
You don't want niggas like us to get power
We rush cowards in the back, with crushed flowers
United we stand, divided we fall
Hammers a draw, man down, man on the floor
 
Who's the realest, is it you? (Yeah, yeah!)
Who's the illest, is it you? (Yeah, yeah!)

Who's the illest in here?

Sippin' ""Louis XIII"" make me feel like a king
We wearing brass knuckles like a four finger ring
Got goons on deck to take one for the team
Stick you for everything nigga, even in your dreams
Wanna know who’s the illest? Take a look in my eyes
When you wake up with nothing don't be surprised
Rather hate you for the truth than love you for the lies
I'll take you to 
the booth
, that's where everybody dies
There’s so much dirt I get waste to dripping mud
In the hood niggas grimey money thicker than blood
Get murked over pennies, nickels, and dubs
I’m Bogart in the game we the illest niggas alive!
 
Who's the realest, is it you? (Yeah, yeah!)
Who's the illest, is it you? (Yeah, yeah!)

Who's the illest in here?",https://genius.com/Onyx-the-realest-lyrics
Take That,Shut ’Em Down,1998.0,"Seem like the only thoughts that's good be negative
A shit I never give, I need a sedative
I'mma forever live, the one and only, murder rap
Defeat, I never heard of that
Push ya head further back kid and that's word to gat
The most quotable, a number two of niggas when there's a show to do
You know the truth, Official Nast niggas, I blow a hole in you
I'm sellin tracks not cracks, you buyin or what?
Cuz I could be in your crib right now, tyin you up
Cold ramshack ya house, put the gun in your spouse mouth
And clean the place, kill the kids too they seen my face
It's the cream I chase, anything get in my way bein erased
We the ministers who raise the most hell
Onyx in the Bible, Genesis 2, verse 12
And uh, that's the life that I lead
Niggas walk around town like they can't bleed
So take that, where your heart is at
So take that, yeah, what
Take that and that and that and that and that and that",https://genius.com/Onyx-take-that-lyrics
Hustlin’ Hours,Wakedafucup,2014,"Hustle hard
Get ya hustle on, go 'head
Get ya hustle on, y'all go 'head
Late night hustling, Im caught up in the hustle

Three a.m. - hustling hours
You better get your money, you ain't fucking with ours
We built it up from the ground up, like the towers
Keep it uncut, we don't fuck with the flour
Late night dope sales, open door sales
Homes in the hotel, cope with cartels
Oh well, the feds ridin' my coattails
Throw away the key, throwing me in the cold cell
United States Ghetto getting money out the state
First week strong, a hundred thousand at the gate
Ain't no love in the street, my thugs throwing slugs where you sleep
And niggas pull the rug from your feet
South side, nigga, from the heart like, 'what up?'
Dark side, one thirsty first so blood up
Homie got sent to the isle up north
Bet it ends up being no talking, head up and shut up

Get ya hustle on (Hustlin hours)
Go 'head, get your hustle on (Hustlin hours)
Get ya hustle on (Hustlin hours)
Better get your money, you ain't touching ours
Hustle hard
Get ya hustle on (Hustlin hours)
Go 'head, get your hustle on (Hustlin hours)
Hustle hard
Get ya hustle on (Hustlin hours)
Better get your money, you ain't touching ours

All I sell is cocaine, I'm a drug dealer
Nah for real, I'm a motherfucking drug dealer
By my work soft, cook that up
You need a nine, straight drop, I hook that up
I gotta streets keep calling, it's off to me to quit
Just when I think I'm out, they need a brick
Back to the hood again, all black hood again
When I'm round the fiends, know the coke good again
My hours is from twelve to twelve and
365, 24/7 I'm selling
I get a rush just bagging that cane
Smoking Mary Jane, packing that thing
All I do is hustle, fuck a 9 to 5
Start at 9, make 6 by 5
It's an all day process, even on a Sunday
Koran on the dashboard, bring you what you ask for


Niggas got shooters, got hoes, got hammers for sale
Got coke, got weed, got grams and scale
Got anything you need, ain't no way in hell
There's something money can't buy even in jail
In these streets i'm the landlord, niggas gotta pay rent
Live on the top floor but came from the basement
Niggas try to come at me, foul, catch a flagrant
Hustle so hard I don't know where the day went
Move work turn bricks to bags, get fixed for cash
Even did some licks for laughs
Chicks on smash, selling pussy, pimp that ass
Kids with masks demanding where you hid the stash",https://genius.com/Onyx-hustlin-hours-lyrics
Stik ‘N’ Muve,Bacdafucup,1993.0,"[Intro: Sonee Seeza, 
Sticky Fingaz
, (Fredro Star)]
Oh, shit!
Yo, y’knahmsayin?
That shit just shot duke in the face
(That nigga right there!)
Nigga gotta be dead
Fuck that then, let’s rob that nigga, man
Take that nigga watch and get the fuck out of here
Fuck him!
(Aiyo, young brothers out there)
(Shouldn't be sticking up people y’know?)

Gimme the money, gimme the money
Here comes Sonee the greaser
Seize the hostages
My conscience keeps tellin’ me I should just
Hit ’em high, hit ’em low
Everywhere I go there’s no
Coppers could stop us
The pros, our motto is

Stik ‘n’ move, stik ‘n’ move
Stik ‘n’ move, stik ‘n’ move

8 o’clock in the morning time to wake up
Another brother getting paid in a way it’s a stick up
No time to even take a bath
Strictly cash tax free quick fast
Grab my Polo, jumped in the Timberland boots
I got Audi, time to get rowdy
Shiftee, low down gritty and grimy
I guess I got to find my crimey
Sticky Fingaz, yo, that Sticky Fingaz
Jetted to the ave in a half of a second
He wasn’t at the spot so the stop I was checkin’
Met him on the way, tucked away was the weapon

Stik ‘n’ move, stik ‘n’ move
Stik ‘n’ move, stik ‘n’ move

Single handed me and Mickey Billy took a trip to Linden
Picked up some cheeba and brew, yo what else we need? (Nothin’)
Now we on the E-train back to Archer and (Sutphin)
Oops, it’s our stop, the 40-deuce get loose
See three other trooper and they tried to call a truce
One had a link, the other a goose
You know what we took and you know what we left
But the third one played a punk, he dissed his posse and stepped
With Sticky on the loose there was nothing he could do
So I pulled out the old taped-up .22
But that was only petty, skills a Philly get ready

Stik ‘n’ move, stik ‘n’ move
Stik ‘n’ move, stik ‘n’ move

Yeah-yeah, hand over the money
Don’t get like “doc, what’s up, doc?” This is Muggs Bunny
Ain’t nuttin’ funny, ha it’s a stick up
Sticky got sticky and tricky with the wallet
But this ain’t El Segundo
It’s just the four, bad, brothers from the ghetto

Stik ‘n’ move, stik ‘n’ move
Stik ‘n’ move, stik ‘n’ move

We had an option after 12 in the city
Man, we gonna roll on some Chez Whitey nitty
But first we got trips because the man got geased
Yo mister I just got robbed, have you seen the police?
(Nah, none over here) Good, so run all your gear
Rolex watch, rings, the Gucci underwear
You might think I’m sorta outta order but I’ll rob you for a quarter
Chez Whitey you’s a goner
You’s a gonna wanna call the pork
Pig, ya dig, police, peace

Stik ‘n’ move (Stik-stik-stick)
Stik ‘n’ move (Stik ‘n’ move, stik ‘n’ move)
Stik ‘n’ move (Stik-stik-stick)
Stik ‘n’ move

Aiyyo, young brothers out here
Shouldn’t be stickin’ up people y’know?
(That’s a no-no)
This is a story about Sticky Fingaz and Mickey Billy’s show
And there was a…
(Stik ‘n’ move, stik ‘n’ move)
(Stik ‘n’ move, stik ‘n’ move)
(Stik ‘n’ move, stik ‘n’ move)
(Stik ‘n’ move, stik ‘n’ move)
(Stik ‘n’ move, stik ‘n’ move)
(Stik ‘n’ move, stik ‘n’ mooooove)
(Stik ‘n’ move!)
Yeah-yeah, hand over the money
Yeah-yeah
(Gimme the money, gimme the money)
Yeah-yeah, hand over the money
Yeah-yeah
(Gimme the money, gimme the money)
(Hit 'em high, hit 'em low)
(Gimme the money, gimme the money)
(Hit 'em high, hit 'em low)
(Gimme the money, gimme the money)
(Hit 'em high, hit 'em low)
(Gimme the money, gimme the money)
(Hit 'em high, hit 'em low)
(Gimme the money, gimme the money)
Yeah yeah, hand over the money",https://genius.com/Onyx-stik-n-muve-lyrics
Boom!!,Wakedafucup,2014,"Aiyyo, we're coming in
You could feel the place rumbling
Got it tumbling
We 'gon back it up, make it come again
We're coming in
You can feel the bass rumbling
Got it tumbling
Niggas jumping up, we got it dumb again
Time to throw your guns again
Shots for the dead and gone
Niggas dead wrong took your chain
You got deaded on
Broke killers, dope dealers, what I'm repping for
Them broke niggas, that's why I keep a weapon for
I keep repping 'til I get reprimanded
Way I shoot with the left, niggas think I'm left-handed
Niggas get left stranded with the TEC-9
When I connect 9, leave your body laying to collect time
Never let nobody disrespect mine
Watch the way you walk, when you hit me on direct lines
Cause anything you say, can and will be used against you
And this that gangsta shit, that you don't wanna get into

Powerful impact, b-b-boom-b-b-boom-b-b-b-b-b-b-boom (Busta Rhymes)
Powerful impact-i-i-i-impact, boom-b-b-b-b-b-b-b-b-b-boom (Busta Rhymes)

Fuck all this rhetoric
Gunshots let it rip
A steel plated point blank
Vest is what you better get
Death is how we settle it, fuck your confederate
20 years later same nigga, just a better whip
Y'all niggas delicate, one hit your head a split
I don't work for peanuts
I'm a tiger, not an elephant!
But for nothing I set it quick just for the hell of it!
Just to beat your ass is worse than out-of-court settlement
Ain't nothing changed but the Glock and the caliber
You funny ass niggas is not in my caliber
Coming at me crazy you get popped in the cabbage, bruh
Niggas need to stop, before I ""cock back"" the hammer, BUCK!
I scream so much, I type in all caps
You couldn't fuck with me, if I was writing your raps
You wouldn't know gangsta shit if it fell right in your lap
Sticky Fingaz get niggas hype and all out!!!!

Powerful impact, b-b-boom-b-b-boom-b-b-b-b-b-b-boom (Busta Rhymes)
Powerful impact. boom-b-b-b-b-b-b-b-b-b-boom (Busta Rhymes)

B-B-B-B-B-B-B-B-B-Boom (Busta Rhymes)
B-B-B-B-B-B-B-B-B-B-B-B-B-B-Boom (Busta Rhymes)
B-B-B-B-B-B-B-B-B-Boom (Busta Rhymes)
B-B-B-B-B-B-B-B-B-B-B-B-B-B-Boom (Busta Rhymes)
B-B-B-B-B-B-B-B-B-Boom (Busta Rhymes)
B-B-B-B-B-B-B-B-B-B-B-B-B-B-Boom (Busta Rhymes)
B-B-B-B-B-B-B-B-B-Boom (Busta Rhymes)
B-B-B-B-B-B-B-B-B-B-B-B-B-B-Boom (Busta Rhymes)",https://genius.com/Onyx-boom-lyrics
Against All Authorities,Against All Authorities (EP),2015.0,"I wouldn’t go to Syria, I wouldn’t go to Iraq
I wouldn’t go to Afghanistan, I wouldn’t go to Yemen
I wouldn’t go to Tunisia, I wouldn’t go to Lebanon
I wouldn’t go to Jordan – I would do it right here!
Nobody from ISIS ever terrorized us
As a people as the police do daily

Ayo the world’s in a crisis, ISIS
Shit is cold as ice is, where the fuck Christ is?
Political activists like Mark Dice’s
We law breakin’, run in the stores takin’
TV’s and playstation, a slave nation
We doom on the bloomberg, we’re just the bullies
We’re the Giuliani, we get no respect
They put guns in the hood, what you expect
Like a pack of cigarettes, I can get me a Tec
And a four fifth, they don’t wanna go to war with
Rap music, what we bangin’ at the law with
So keep your Glocks high, aim for the ceilin’
Here comes them villains, gotta stop police killin’
So pardon me, as I blast this, fuck throwing a black fist
To the cops be target practice

It should be against the law
Fuck authorities, against them all
Cuz niggas ride away, don’t trust the cops
If you down for the cause, we brought shots, nigga
It should be against the law
Fuck authorities, against them all
Cuz niggas ride away, don’t trust the cops
If you down for the cause, we brought shots, nigga

I said move steady, I’m getting the troops ready
Gun store robberies, the armory is heavy
All-black Chevy, hood military
I'll start the revolution right now if you tell me
I'm a convict believe me you’re one too
We convicts, can't leave unless your passport approved
Who is you, fuck the rules, fuck the news, it’s a lie
If you’re ready to make your move let out two in the sky
They gon’ have to call the national guard
Smashin’ ’em hard, you gon’ get sent back to your god
Can’t let these motherfuckers send me back to the yard
If I got a hundred million niggas with me, that could be hard
Cuz I just gotta pick the guns up, to make ’em put the guns down
Enough is enough is enough, black kids gettin’ gunned down
Wherever is your son now, the system corrupt
And when the sun down, you know that the shit gon’ erupt

It should be against the law
Fuck authorities, against them all
Cuz niggas ride away, don’t trust the cops
If you down for the cause, we brought shots, nigga
It should be against the law
Fuck authorities, against them all
Cuz niggas ride away, don’t trust the cops
If you down for the cause, we brought shots, nigga",https://genius.com/Onyx-against-all-authorities-lyrics
Look Like a Criminal,Against All Authorities (EP),2015.0,"Motherfucking police
Always be fucking with me
Everywhere that I go
Motherfucking police
Always be fucking with me
Everywhere that I go

Do I look
Like a criminal, criminal, criminal
Criminal? What the fuck? Do I look
Like a criminal, criminal, criminal
Criminal? What the fuck? Do I look
Like a criminal?

Police wanna hella sweat
Cuz I keep a hoodie on, Bill Belichick
Every night I’m gettin’ stop-and-frisk
When I walk in the drugstore they think I’m here to shoplift
I’m just pickin’ up Percocet prescriptions
Cops always tell me that I fit the descriptions
So what, I got prior convictions
And can’t leave the house less it’s under conditions
In other words, I’m a changed man, but they think
I’m doin’ crime every time money exchanges hands
I’ve never been on Gangland, got tats on my neck
And they think i’m in a gang, damn!
So what I got on blue laces? And I’m fightin’
For my life, cuz a nigga got two cases
I guess I got these crackers shook
They scared to death when they see me

What the fuck? Do I look
Like a criminal, criminal, criminal
Criminal? What the fuck? Do I look
Like a criminal, criminal, criminal
Criminal? What the fuck? Do I look
Like a criminal, criminal, criminal
Criminal? What the fuck? Do I look
Like a criminal?

Hundred mad motherfucker
These tattoos got them thinking I’m bad news
I’m the reason their kids like to listen to rap tunes
But cash rules, my face covered in scars
Cops is on me cuz they think I’m trynna run from a charge
Man it’s bad, I can’t even hit the mall in peace
The second the public see me they just call the police
I keep my third eye open when I walk these streets
They don’t wanna give me chances all they want is the beef
And I know I did some real wild shit in my past
So they test me by telling me I gotta piss in this glass
This shit isn’t right, I ask them what they talking about
Cuz I see them them out my window when they watching my house
I swear to god they better not step foot on my yard
I’ll start jumping at these suckers, have them look at their god
Fuck a stereotype, you better take it back bitch
I wasn’t born this way, the cops made me like this
I ain’t a…

…criminal, criminal, criminal
Criminal? What the fuck? Do I look
Like a criminal, criminal, criminal
Criminal? What the fuck? Do I look
Like a criminal, criminal, criminal
Criminal? What the fuck? Do I look
Like a criminal?

Do I look like a criminal? Cuz my pants be saggin’?
Red box scissors and my drawers are slaggin’
They say that my facials look so violent
What the fuck? That’s racial profilin’
Pull me over like my tag is expired and shit
Like there’s no way that’s his, he hot-wired that shit
Gun registered, still trynna hide that shit
Till this day they can’t believe they let me buy that shit
I come to visit, you think i’m scopin’ out your spot
They takin’ pictures, you takin’ this for my mugshot?
They’ve callin’ me a criminal for so damn long
I start to believe they right and
You gon’ make do somethin’ wrong
You see me in the hood, you think i’m trynna rob you
I’m just talkin’ to you, when you think i’m trynna con you
No matter what, they gon’ call me a crook
So you think I give a fuck if I look like a motherfuckin’…

…criminal, criminal, criminal
Criminal? What the fuck? Do I look
Like a criminal, criminal, criminal
Criminal? What the fuck? Do I look
Like a criminal, criminal, criminal
Criminal? What the fuck? Do I look
Like a criminal?",https://genius.com/Onyx-look-like-a-criminal-lyrics
"Ah, And We Do It Like This",Giant Single: The Profile Records Rap Anthology,1990.0,"Ah, and we do it like this
Ah, and we do it like this
Ah, and we do it like this
Ah, and we do it like this

Days like scenery rap in our radar
Got no time, my problem is debater
Due to circumstances my mind trip
Grab a stage and puff, puff that spliff
Dance with the ladies, fellas and kin
The one who claims is not your friend
To be concerned of taking a earn
No use in cheating, and don’t you act stern
Mindless brother going to rot
A freshly dip from that old rap pot
The big bang theory marching our theory
A mother's heart is a heart that's weary
All show-stoppers, national known
Better hold yours cause I'm holding my own

Some say Ty, some say Tyrone


Well, here's a little something for you all to learn
Money to make, cheeba to burn
First you feel the high then you feel the low
Down on your luck and you know how it goes
Now you sitting down at home watching cartoons
Fred Flinstone, Tom & Jerry too
Had three kids and a beautiful wife
But then you went crazy and stabbed them with a knife
Now you sitting in a jail sitting in a cell
Feeling fired up, but you going through hell
Oh, I'm that brother that makes you all shiver
I'm the MC that always deliver


I’m a smooth fellow, back is not yellow
Playing it safe like a game of othello
Mellow as a cello, never bulges like Jello
Papa got a 40, I sip on my mellow
Put it in a order,  slaughter
Jimmy had a nickel, Fredro had a quarter
Start moving, rappers is improving
Party so loud the mannequins start moving
People are enjoying jiving around
A country sound that’ll make you get down


Check me out to distinguish, all the time genius
Hit 
suave
 

Tryna get small
Better dress warm cause a brother like me takes the place by storm
Leaving no ends for brothers I doubt
Not a creature was stirring, not even a mouse
Should respect like the Pope and leave your mouth open
Pull the biggest drive cause I got the longest rope in


Check it out everybody, a new fly tune

People, people jumping around
People, people getting down
But all they hearing is my high tune sounds
Back in the days, people used to say
That's the crew was lazy
But then he got a gun, had him on the run
Now they calling him crazy


Check one, we don't care how we gon' slay it
What to learn and what to obey
How to feel great when you’re feeling blue
What to do when your day is through
My nigga make, make things to get
Yeah, it’s time to get righ, it’s time to get nice
You gotta get ready for the sacrifice
Ain’t no half stepping, ain’t no weapon
 gets all the respect


Cool Suave and I’m on the mic
Kick fly raps cause you know I’m like
I’m hyper, this the cat that’s best to go sniper
And I’mma have to get piper
Just like a typer, coon kind of brother
Cool Suave is the late night lover


What’s a man to do after living in fear
Reach for a gun at 20 years in life
Shit, can’t see his wife
She gets caught for trying to slip in a knife
That’s not for me as you can all see
So ain’t no gun around that table
But I’m barely here living and able
Throw up your fist, shall get bliss
Blast, now you in a body cast


Smooth as ballet on a warm sunny day
Smooth operator like Sade would say
Hit the bass in your voice, tone like 
Get on the mic, put on your dance shoes
Quest for the fire burns my desire
Like a baritone in ya damn church choir",https://genius.com/Onyx-ah-and-we-do-it-like-this-lyrics
