title,album,year,lyrics,urls
Slam,Bacdafucup,1993.0,"Slam, da duh duh, da duh duh
Let the boys be boys
Slam, da duh duh, da duh duh
Make noise b-boys

Well it’s another one, in the gutter one, ghetto running em
Troublesome, extra double dumb, I come to beat em
Defeat em and mistreat em, so what if that I’m cheating
Now everybody wanna sound grimey (yeah I know)
I’ma show ya how, come on, all in together now
Yeah oh yeah yeah that’s how it gotta be
So stop trying to be loud as me cause you can't do that
Think about it; playing Russian roulette with an automatic
I bet my ass against the line the last bullet’s first on line
Stab and step and repping and run, packing a weapon is wild
Peace to the brothers on Rikers Isle
Tough enough and trembling, blend in like a chameleon
Buck, bye tough guy, oh my god I’m so high
Cause they say I rhyme, they say I look like a gremlin
But what does it take to make a kid make a million children SLAM

Slam, da duh duh, da duh duh
Let the boys be boys
Slam, da duh duh, da duh duh
Make noise b-boys
Slam, da duh duh, da duh duh
Let the boys be boys
Slam, da duh duh, da duh duh
Make noise b-boys

I’m the nitty, nasty, gritty smashing, never slow gassing
Strictly swift blast of the raspy-rasp fashion
That I provide, I abide the 
U.S.G
Besides the ghetto vibe, make me flip like Jekyll and Hyde
Of course, I come across with the pure for sure unadulterated uncut raw
Disgusted, busted, you wanna touch it, too hot
You forgot, you’re not ready, your head could get ruptured
Hit between the eyes, I plan to vandalize
I supply the static, I run with the bad guys
The villains, crooks, highlighters and the fighters
See the big black picture if you look inside of my mind
It’s graphic, expressed it drastic
So kill the copycat act kid, it’s all mastered
Directed it, when y'all least expected it
And thought it was safe, Onyx hit you in the face so SLAM

Slam, da duh duh, da duh duh
Let the boys be boys
Slam, da duh duh, da duh duh
Make noise b-boys
Slam, da duh duh, da duh duh
Let the boys be boys
Slam, da duh duh, da duh duh
Make noise b-boys

I’m a b-boy, standing in my b-boy stance
Hurry up and give me the microphone before I bust in my pants
The mad author of anguish, my language polluted
Onyx is heavyweight and still undisputed
You took the words right out my mouth now walk a mile in my shoes
I paid so many dues, I feel used and abused and I’m so confused
Excuse me, for example I’m an inspiration of a whole generation
And unless you got ten sticky fingers it’s an imitation
A figment of your imagination
Bu-bu-bu-but wait it gets worse
I’m not watered down so I’m dying of thirst
Coming through with a scam, foolproof plan
B-boys make some noise, and just, just SLAM

Slam, da duh duh, da duh duh
Let the boys be boys
Slam, da duh duh, da duh duh
Make noise b-boys
Slam, da duh duh, da duh duh
Let the boys be boys
Slam, da duh duh, da duh duh
Make noise b-boys

Slam, da duh duh, da duh duh
Let the boys be boys
Slam, da duh duh, da duh duh
Make noise b-boys
Let the boys be boys
Slam, da duh duh, da duh duh
Make noise b-boys
Slam!",https://genius.com/Onyx-slam-lyrics
Last Dayz,All We Got Iz Us,1995.0,"South suicide Queens, all niggas
Gather up all your arms
And get ready for this New World Order
Shit is about to change, motherfucker!

I’m America’s nightmare
Young, black and just don’t give a fuck
I just wanna get high and live it up
So fuck a 9-to-5! And whitey tryin' to slave us
With minimum wages, slammin' my niggas up in cages
Changin their behavior to spittin' razors, that's outrageous
Smokin' roaches is hopeless
We want lazy sofas and sculptures
Lady chauffeurs who fuck us, full house and royal flushes
Roll with the rush, it's that Afficial Nast
Got bitches with pistols and cash, we livin' in the last
My theory is ""fuck it,"" sexy niggas get abducted
My corrupted is conducted, through ghettos, sippin' Amaretto
Hand on the metal, foot on the pedal, never settle
He wore Carolina Herrera, dirty Donna Karan sweaters
Ralph Lauren leathers and suedes
Gold plated guns and grenades
To blow up; I got news from the informers
I'm trapped in corners, bustin' shots at Time-Warner's

My man big Ty, he know how to get by
Get high, do a jix, then be fixed to be fly
Some mid, cross and up and downtown action
And when he stick he keep a grip and move with traction
Keep mad alibis, a plan to stay wise
And wide-eyed, livin' in the state of Southside
Crooked jakes and fakes, snake niggas all out for papes
All who wanna overtake, you leave them with drapes
The white sheet covers, this heat smothers
The street, eat brothers, six shots rang, duke got banged
We all ready for these wars
We all want more, these the last days—get yours!

32 shots inserted in Glock's, you heard it for blocks
The murderer who gots convertible drops
Livin' life on the edge, a dangerous way of livin'
Never givin' a shit, ‘cause we livin' in it
‘Cause it be off the hook, crooks, crack
Cheeba spots, and sellin' rocks
The cops around the clock, it’s hot
Livin' life on the edge, a dangerous way of livin'
Never givin' a shit, ‘cause we livin' in it

Thinkin' about takin' my own life, I might as well
Except they might not sell weed in hell
And that’s where I’m goin', ‘cause the Devil’s inside of me
He make me rob from my own nationality
That’s kind of ignorant, but yo, I gotta pay the rent
So, yeah, I'll stick a nigga most definite
A degenerate, if I get caught I'm innocent
‘Cause I don't leave no sticky fingerprints
For the cops, they only good if they dead
And all that badge and the gun shit be goin’ to their head
To make bread I gotta steal for sport
So I stole the show and made some pennies for my thoughts
And if this fuckin' rap shit don't pay
I'ma start sellin' drugs around my way
Killin' my own people in the USG
Shit, they gonna get it from somebody, I'd rather it be me
Besides, you can't tax dirty money
And you can't trust nobody (Nobody!)
No one (No one!), I'm a scorpion
And I'll probably bite the bullet, ‘cause I live by the gun

Big heavy-hitters, 25-to-life bidders who just came out
And pullin' flame out, take aim, blow your brains out
It’s life on the edge, a dangerous way of livin'
Never givin' a shit, ‘cause we livin' in it
In South suicide Queens where niggas act up
Nigga, back up, Afficial Nast, throw your fuckin' gats up!
It’s life on the edge, a dangerous way of livin'
Never givin' a shit, ‘cause we livin' in it
We never givin' a shit, ‘cause we livin' in it
Afficial Nast motherfuckers don't give a shit—word up!",https://genius.com/Onyx-last-dayz-lyrics
Wakedafucup,Wakedafucup,2014.0,"Niggas sleeping, better wake the fuck up!
Cause we ain't having it straight the fuck up!
Bloody murder, you get taped the fuck up!
Your whole crew, we will break the fuck up!

Who better than us? The fuck will spark the East coast up
Aaah shit, the fucking beast woke up
From out of the deep sleep, niggas is boring
Fucking all these weak beast, the beast was snoring
Now the beast is hungry, stomach is growling
Nigga ribs is touching now they stuck in the island
Motherfuckers is smiling but nobody smiling
‘Cause where I'm from, motherfucking niggas be wilding
And the wolves be howling, minds be rolling
Cars be stolen, we're coming out the gutter
Like fucking we bowling, the shit that I’m holding
Niggas talk shit, put the fifth to your colon

Niggas sleeping, better wake the fuck up!
Cause we ain't having it straight the fuck up!
Bloody murder, you get taped the fuck up!
Your whole crew, we will break the fuck up!
Niggas sleeping, better wake the fuck up!
Cause we ain't having it straight the fuck up!
Bloody murder, you get taped the fuck up!
Your whole crew, we will break the fuck up!

Aaaah shit, you done woke up the monster
I smell rappers, no wonder
It's obvious, y'all have got too comfortable
And all these rappers nowadays is bullshit
You colorful like a bitch
Lala you signing and dancing, you bitch!
You need to loosen up your clothes nigga
And leave the dancing to them hoes nigga
Hip Hop started out on the block
I fell asleep at the wheel, the shit crashed into Pop
When I speak, the hood got the ears up, Spock
And I’ma leave my mark and you gotta get hit with the Onyx
Nigga you know, nigga you know, nigga you know
Am I wrong? Hip Hop need a face lift
And what better face than the mad face to get?

Niggas sleeping, better wake the fuck up!
Cause we ain't having it straight the fuck up!
Bloody murder, you get taped the fuck up!
Your whole crew, we will break the fuck up!
Niggas sleeping, better wake the fuck up!
Cause we ain't having it straight the fuck up!
Bloody murder, you get taped the fuck up!
Your whole crew, we will break the fuck up!

Blades and nunchucks, brazing gun shots
When I’m done they can rake their guts up (motherfucker)
This heat turns your face to slush pup
Ride to Hell, this is Satan’s bus stop
Got a hot bitch cuffed up
Take the drugs, love, you get raped and butt fucked
I snort speed then I Wakedafucup
Kinda of off topic but hey
I’m somewhat crazed and drunk off Jamaican rum shots
(White noise) White boy’s cables cut off
Angels dust drops, how that taste?
D.O.D. mad face, closed case

Niggas got no taste, but when I look at them fuckers, it figures
We hard body karate, Killuminati niggas
I’m Picasso, an apostle, Hip Hop deliver
Y'all niggas Pop so I'm popping shots in your liver
Try and copy what I got and I’ll copy your chopper
Niggas claiming they heartless, we'll put 2 in yo mama
Brains leaking and your head leave you looking like pasta
Ain’t speaking cause you dead on the floor, an imposter
See I’m obsessed with this sport, lesson, I’m core
Repping with the Onyx, niggas back with the force
We back in this war, we back in, of course
So all y'all boot-legged niggas, get yo' ass to the store

Niggas sleeping, better wake the fuck up!
Cause we ain't having it straight the fuck up!
Bloody murder, you get taped the fuck up!
Your whole crew, we will break the fuck up!
Niggas sleeping, better wake the fuck up!
Cause we ain't having it straight the fuck up!
Bloody murder, you get taped the fuck up!
Your whole crew, we will break the fuck up!

Keep sleeping, beds is burning
Keep sleeping, beds is burning
Keep sleeping, beds is burning
Keep sleeping, keep sleeping
Keep sleeping, beds is burning
Keep sleeping, beds is burning
Keep sleeping, beds is burning
Keep sleeping, keep sleeping

Niggas sleeping, better wake the fuck up!
Cause we ain't having it straight the fuck up!
Bloody murder, you get taped the fuck up!
Your whole crew, we will break the fuck up!
Niggas sleeping, better wake the fuck up!
Cause we ain't having it straight the fuck up!
Bloody murder, you get taped the fuck up!
Your whole crew, we will break the fuck up!",https://genius.com/Onyx-wakedafucup-lyrics
Throw Ya Gunz,Bacdafucup,1992.0,"Take ’em up, take ’em out, bring ’em out dead
Shine ’em up, shine ’em up, shine a bald head
One gun, two gun, three gun, four
You’re mine, it’s all about crime
Onyx! Onyx!

It’s time to get live, live, live like a wire
I set a whole choir on fire (Uh!)
Well done on the grill, Chyskillz kills
The no frills that try to diss me, they get crispy
(Ha, ha-ha-ha, and we do it like this)
And that, get back I attack tracks
Cause they can burn in hell shit for all that I care (Yeah!)
Beware the bald heads, the dreads dead if they there (Ooh!)
Stick ups assassin,’ tracks a new reaction
(These fuckin’ niggas shoulda made the All-Madden)
Onyx is wreckin’ shit, slip slide step quick
Super on the tenant, the kids crash like a rented
The shit they write is black and white, well mine’s got
Mad color, ain’t that right my blunt brother?
(Word up! Raze it up!
We do it with the crew that don’t give a fuck!)

So throw ya gunz in the air
Throw ya gunz in the air
Buck buck like ya don’t care

Uh oh, heads up! Cause we droppin’ some shit on ya now
Chyskillz, Onyx, Tec-9 for a while
Keep ya eyes open in a fight, I’m a swell ’em
The hardcore style, rowdy and wild hits I’ma sell ’em (Sell ’em!)
To all competition slide back then listen
I’m kickin’ all that shit to the doormat
Claimin’ this domain, cause mad pains
Blood stains, long range (Got gats!)
Crazy clips, I sink ships, cut faces like a pirate
I’ve never caught a slug for the mad shit that I did
(Heard?) You got the word so observe
I shatter and splatter bodies and bones and bust nerves
(Open!) I always leave my barrel smokin’

Throw ya gunz in the air
And buck buck like ya just don’t care
Just throw ya gunz in the air
And buck buck like ya just don’t care
Just throw ya gunz in the air
And buck buck like ya just don’t care
Just throw ya gunz in the air
And buck buck like ya just don’t care

I hate your fuckin’ guts, and I hope that you die (Uh!)
Sticky Fingaz’ name and my life is a lie
Plus I’m havin’ a bad day so stay outta my way
(And what the pistol packin’ people say ya better obey)
Just in the nick of time, I commit the perfect crime
Rip my heart out my chest, put it right into a rhyme (Yeah!)
I don’t feel pain cause it's all in the mind
And what’s mines is mines, and yours is mine
Don’t fuckin’ blink or I’mma rob yo’ ass blind
Onyx, is rippin’ shit, I got the Tec-9
So what the bumba clot, boy, buck-buck, buck-buck
It’s a ca– tastrophe, fuckin’ with me G
I’m a bald head with a knife
I want your money or your life
So, so, so, so

Throw ya gunz in the air
And buck-buck like ya just don’t care
Just throw ya gunz in the air
And buck-buck like ya just don’t care
Just throw ya gunz in the air
And buck-buck like ya just don’t care
Just throw ya gunz in the air
And buck-buck like ya just don’t care
[Outro: 
Sticky Fingaz
, (Suavé), Fredro Starr]
We the motherfuckin’ Onyx!
(And we don't give a flying motherfuckin’ fuck)
Ayyo, DS, man, we gonna
Come get you out of jail man, fuck that
(Ayyo, Big DS, we comin,’ man, we comin’)
We got the bail! We got the bail!
We gonna break you out man, fuck that
(Yeah!) We the fuck up out of this piece",https://genius.com/Onyx-throw-ya-gunz-lyrics
Shut ’Em Down,Shut ’Em Down,1998.0,"[Intro: Sticky Fingaz, (Fredro Starr), 
Sonee Seeza
]
Straight up nigga
Motherfuckin' Southside nigga
(Word up)
Brooklyn, what?
We gonna do it just like this man
Straight to your whole area
(Yeah!) 
Word up!
 (Yeah!) 
Word up!
You know what we fin' to do
(Shut 'em down, shut 'em down)
(Yeah, yo! Word up, yo!)
It's time to take over the world!

Shut 'em down! Shut 'em down, shut 'em down! (Yeah)
Shut 'em down! Shut 'em down, shut 'em down! (What!)
Shut 'em down! Shut 'em down, shut 'em down! (Official Nast')
Shut 'em down! Shut 'em down, shut 'em down! (Yo, yo, yo)

Shut 'em down, start the violence we wildin' wildin'
Slain rapper's body found washed up, on Coney Island
When I rolled up, this nigga heart slowed up, that “killa” froze up
When I pulled up, jumped out with the pump-pump 32 shots and ducked out
Then I broke out, left that cat for dead his body smoked out
Cause when I fall out, y'all killas got kill me kid I'm goin' all out
Life's a bitch, fuck it! Got a gun, bust it!
The gameplay, gotta play by the rules of your own cannot be trusted
Don't try to test, abide your chest, put five inside your vest
Have you layin' where the dead rest
Shoulda known when you was lookin in the eyes of Death
Ask
 the Lord for forgiveness, when I did this, there was not no witness
But he should understand, cause even God got a shit list

Yo it's beatdowns anonymous, I spits like a shiny silver nine'll bust
Niggas fine to bust, we the kind that rush
Those that, hold back, taking your whole stack
Grimy street cats, niggas baldhead, like Kojak
Go gat for gat, quote that, in fact, you can smoke that
Uncut black dust, making your whole, fucking skull crack
Better know me, one-three, one and only
Could be never phony in any ceremony, I'll tear you homey
(Shut 'em down!) Sonsee's taking your time, making your mind
Baddest nigga on the low defecatin with rhymes
Breakin your spine, got you movin from the flurry time to worry
I'ma bury the bullshit, feel my full clip!

Shut 'em down! Shut 'em down, shut 'em down! (Uhh!)
Shut 'em down! Shut 'em down, shut 'em down! (What!)
Shut 'em down! Shut 'em down, shut 'em down! (Uhh!)
Shut 'em down! Shut 'em down, shut 'em down! (Uhh, uhh)

Aiyyo I bet you this motherfuckin' double barrel'll blast this face
Be on the lookout for a basketcase
Niggas pumped you up to watch you get beat, had you thinkin' shit is sweet
Now you up shit's creek, cause your shit's weak
How much is your life worth to someone important, cause I be extortin'
Kidnappin' for ransom is some shit that you don't want to get caught in
From back in the days of Gorton, niggas was gettin' robbed
The guy from Yonkers High stayed on his job, with his own little mob
Was it worth goin' back to the Earth so soon? Worth makin my shit go boom
'Til your own doom, fill them graveyards, til there's no room?
Fuck you know about a pine box? Money goin out with nine Glocks
Autops' between that same nigga, when they pull out spray nine shots
Feel like killin' for your crew? I ain't gon' rest, it don't take a whole lot to fill up your vest
Then watch your lungs as they spill out your chest
You best get on some, act your age shit, you a little kid
That run for faces, more niggas get killed like that than a little bit

Ayy man Sticky! F–I–N–G–A–Z the crazy cajun
Blazin' bullets for days and days and grazin' amazin' I'm the guy that's lacin'
Purple Hazin, hard to be phasin' LORD all this hell that I'm raisin'
God of the Underground, I'm gunnin em down with a thunder pound
We gonna (Shut 'em down!) We turn shit dumb quick when the gun click
Lyin' in ya rhymes is worse then lyin on your dick
In the morgue admit it dogs I'm the Rottweiler my Glock holla
Fuck cocaine killa I sniff gunpowder
So all you real Willies throw your Roley's in the sky
Now all my crooks, rob them players outside!
I'm so hype, I'll take yo' life, better have my dough right
And fuck Five Mics, I don't need no mic!
What?! Bring it! Shut 'em down!

Shut 'em down! Shut 'em down, shut 'em down! (Yeah!)
Shut 'em down! Shut 'em down, shut 'em down! (What! What!)
Shut 'em down! Shut 'em down, shut 'em down! (Shut 'em down! Shut 'em down!)
Shut 'em down! Shut 'em down, shut 'em down!
Shut 'em down! Shut 'em down, shut 'em down! (What!)
Shut 'em down! Shut 'em down, shut 'em down! (Bring it!)
Shut 'em down! Shut 'em down, shut 'em down! (What!)
Shut 'em down! Shut 'em down, shut 'em down! (Official Nast'! Shut 'em down!)

Word up boy! 'Bout to shut down the whole industry. Official Nast', DMX. We wreckin' ery'thing! So shut up! Or you get shut down! Like the rest of them! Pussy!",https://genius.com/Onyx-shut-em-down-lyrics
The Worst,Shut ’Em Down,1997.0,"Wu! Tang! Wu! Tang! Onyx! Onyx!
Wu! Tang! Wu! Tang! Onyx! Onyx!

Aiyyo, staircase to stage now, major waves
Tanktop Nautica, flippin your daughter thirty ways
Yeah who want mine? Bent outta shape, one time
Play the mall, starin at your bird of all sunshine
Watch my shit shift, niggas in the back, wigs lift
You know the stats God, don't even ask pa, back slit
Raw drug raps, thug hats and mob hats, spit on that cat
This yellow love nigga fuckin with a rich cat
My shit bad, 5 feet 6, with a crisp hat plush
Throwin down on thirty bricks, niggas is with that
Though, federados locked my man yo, hit lotto
Three-hundred thousand dollars in the bottle
Bitch snack is Heiml technique, rover in the robe, gold link
You know the code 'Rique, suitcase money, stow heat
Rock Navi's dough, hundred dollar bags valet
That nigga crabbed me, gamin himself, like Milton Bradley
[Verse 2: Fredro Starr, 
X-1
]
Yo the semi-automatic Glock this, unlock this
The weed spots get knocked, it's so hot chicks is topless
Whips are spotless, chrome rims spend obnoxious
You can't knock this, bust a shot you better not miss
X-1 wild out, and make you watch this
'til your eyes turn red with blotches, eatin scraps out the garbage
Unload a cartridge, and bust a cap
X could never trust a cat, Onyx is as hot as it gets
Bitches fuckin for free, is outta the quest'
Blow blood outta your flesh, your body outta your vest
I toss the heat from across the street
Fly you up off your feet, you die livin soft and sweet
Street crime, time is money, nigga don't waste mine
Expose my 9, throwin your shine, your froze in time
Lookin at death, holdin your breath, laid out
On the dance floor, blood and Moet, I'm blowin your set
Trick twenty G's, no sweat, your goin in debt
I'm goin for broke, I'm blowin out smoke, you catch a stroke
Wu-Tang and Baldhedz, Swiss foreheads, leave you all red
X-Milli-1, fully armed, illest beyond your realest form
Bringin' the storm, forseein' you warned
Nuttin keepin' me calm but heat in my palm
Sleep and you gone, you see what I'm on? Creepin' outta the dark
Scatter your parts from here to Battery Park

First things first man, you're *fuckin’* with the worst
First things first man, you're *fuckin’* with the worst
First things first man, you're *fuckin’* with the worst
You can't slam, don't let me get fool on a man!

Steel master, grab half the cash fast and bash
And splash yo' class, mash your staff, What?!
Nigga get smacked, you ain't worth a punch, hurt your bunch
Get murked, you front in the wrong circle punk!
Mack clever niggas dat regulate
Catch you on the d-lo in Mecca and Etch-a-Sketch ya
Shake and erase, vacatin your space, breakin your face
Straighten your waist, twist you, and won't miss you
Official Nast 
and Killa Bee, full blast, get off smash
Pull fast for your stash
Long as the war last, foot up in your ass
Tryin to count more math, bring in the hardcore rap

Yo; we be the mainstream
Supreme rhyme top of the line cuisine fiends
Number one love for thugs queens schemin on cream
My whole team love, the E-cup bras and mobb cars
Killa Sin known for makin niggas reach for the stars
The terrorist lyricist in the midst of the abyss
We cannabis evangelists, iron palms with metal fists
Wu build, like construction and bang, like percussion
All the Planet Battery packs combust and malfunction, what kid?

First things first man, you're *fuckin’* with the worst
First things first man, you're *fuckin’* with the worst
First things first man, you're *fuckin’* with the worst
You can't slam, don't let me get fool on a man!
[Verse 5: Sticky Fingaz, 
Method Man
]
Holy shit!! Who the fuck is dat?
It’s John-John.
 Sticky Fingaz, kid, you got my back?
I got your back cousin.
 I got the mack-dozen
And when them niggas start jumpin, bust back cousin
Cause it's a new year, time for some new shit
Nowadays rappers dyin’ over music
Dead on arrival, we raised in the ghetto singin’ songs
For survival, duckin’ homicidal, you r
ob them
Yeah yeah! Onyx, Wu-Tang, on tracks we gangbang
Chitty-bang-bang. 
Chitty-chitty-bang-bang
Hot Nix' spit flame, lava pump through my veins
Caught in the zone, home on the range
Aiyyo you rang on ferocious, atrocious
We got that supercalifragalisticexpiala… 
Dope shit!
Eight ball in the corner pocket.
 
We snatch wallets
Off the white collared. The Big Apple forever rotted
Narcotics hunt the hard target, Hot Nix’
So what the bumbaclot?! 
Pop shit, we do the knowledge
To shark niggas, once bitten, major swingers heavy hittin’
Poly your kitten, throw up your mittens
Stop bitchin’, no slippin’, no pot to piss in
The meltin’ pot's boilin hot now in Hell’s Kitchen
Yo, yo, Sticky Fingaz, one of the illest motherfuckers
Belive Dat! My moms don’t raise no suckers
I slap rappers, turn ’em into singers
Touch somethin’ of mine and you’ll have Nine fingaz!
Enough said, let's paint this whole fuckin’ town red
And RIP… Their whole crew to a shred!
I got cold blood. 
I pull yo’ plug.
 I hold, bust!
Show no love.
 I’m so bugged. 
Shoot yo’ home up
And shoot up the whole club. 
We throw slugs
You ain’t no thug! I earned every God damn penny
That I got son. I’m rollin’ shotgun in the convertible
I wish a nigga w-w-would try to fuckin’ jack me
I'll murder you!

First things first man, you're *fuckin’* with the worst
First things first man, you're *fuckin’* with the worst
First things first man, you're *fuckin’* with the worst
You can't slam, don't let me get fool on a man!

Wu! Tang! Wu! Tang! Onyx! Onyx!
Wu! Tang! Wu! Tang! Onyx! Onyx!",https://genius.com/Onyx-the-worst-lyrics
