title,album,year,lyrics,urls
Black Hoodie Rap,UnKnown,UnKnown,"Black hoodie rap, black hoodie rap
Black hoodie rap, black, black hoodie rap
This is black hoodie rap, black hoodie rap
Black hoodie rap, hoodie, hoodie, hoodie rap
 (x4)

When I die, fuck it I wanna go to hell
Cause I'm a hundred mad, it ain't hard to fucking tell
It don't make sense, going to heaven with the goodie-goodies
Dressed in white, I like black Tims and black hoodies
Get me through the night, lookin like a grim reaper
Shut a nigga lights out, put'em in the sleeper
Plus I crypt keepers, graveyard shift like killa
And you can see murdas, just like Steve Miller
My backstreet killaz, South Side is a ghost town
Niggas try to play me, them niggas is ghost now
This is how it goes down, with black hoodie rap
We stick you up, you gotta pay to get your goodies back
This is where the hood is at, 
like Pac we hit'em up
 (hit em up) with one touch of the fully mac
Index on the hair pin trigga, go be the next nigga, 
back to the hook Jigga

Black hoodie rap, black hoodie rap
Black hoodie rap, black, black hoodie rap
This is black hoodie rap, black hoodie rap
Black hoodie rap, hoodie, hoodie, hoodie rap (x2)

Fuck that pop shit, fuck with me you get popped quick
My guns give you a sex change, you turn to a bitch
And I don't wear skinny jeans cuz my Glocks don't fit
Fuck around try to pull out, and blow off my dick
This that shit, make you mad squinch on ya'face
How you tie niggas up try to get in their safe
Either rap too soft, or we too hard
It's that jailhouse music bang that shit in your yard
All that internet gangstas, that's the problem
Talking 'bout shooting while they're just fast in bloggin'
In the streets getting cream like Baskin-Robbins
, even it mean I gotta start blastin' and robbin'
Goin' to jail for criminals like going to school, you come out a little better at the crimes you do
And when I die, don't dress me up in the suit
It's A1s, hard denim, black hoodies, I'm cool

Black hoodie rap, black hoodie rap
Black hoodie rap, black, black hoodie rap
This is black hoodie rap, black hoodie rap
Black hoodie rap, hoodie, hoodie, hoodie rap (x2)

Keep a black hoodie for the strong armrobbery
Me and my gun close, that's comradery
Cold blood it runs through my vains
Fuck ya'll I know thugs, that'll run through your game
My niggas bang, on site in broad daylight, walk by and take a nigga life
See the hoodie cover my face, no need for mask, 
shades for the green eyes
, pussy nigga I need mine
You need time, and clock's still ticking 3, 2, 1 I'mma load up my gun
Boom! Nigga face down, hands behind your back, that's some police shit, you don't know me bitch
You ever heard of 
Rob & Vic
?
Well I'm just like them, in a form what I got is sin
Shells longer than a q-tip fuck talkin' it out, throw my hoodie on and walk in ya house, nigga

Black hoodie rap, black hoodie rap
Black hoodie rap, black, black hoodie rap
This is black hoodie rap, black hoodie rap
Black hoodie rap, hoodie, hoodie, hoodie rap (x2)",https://genius.com/Onyx-black-hoodie-rap-lyrics
Rob and Vic,Shut ’Em Down,1998.0,"It's a story about two brothers, Rob and Vic
Grew up in the world alone
God forgot about them, hmm
Forced to fend for themselves
In the Rotten Apples of New York City
This story takes place, in 1993
[Verse 1: Sticky Fingaz, 
X-1
]
How many vigs did we get so far?
I couldn't care to count, just snatch 'em up quick
If he scream, I'mma put him out
I put the heat to his face to shut him up
So I can dig him out, went in his pockets
And got the cash in some big amounts
I looked him dead cold in his eyes without carin'
If money speak, that explain the voices I've been hearin'
You ain't really have to kill him
Yo God he moved, but I lied
Damn, there's our sixth stick-up turned homicide
So? That's the way our momma died
Is you with me? I'mma slide

So we slid, had to get our gameplan together
Cause this little bit of stickup loot ain't lastin us forever
Desperate, on the edge with no place to go
We can't go back to the hood we stuck up everyone we know

For the love of money!
People will rob from each other
For the love of money!
People will steal from their mother
For the love of money!
People will kill their own brother
[Verse 2: Sticky Fingaz, 
X-1
]
Now everytime I hear a fuckin siren, my heart skip a beat
I'm paranoid, every face I see I think he after me
Supposedly
We was supposed to be gettin work from this large cat
But since we know where he rest at. We goin' Bogart!
Son frontin' so hard
Heard he had a hundred G's alone on his Gold Card
His crab wife showed me mad cash in her blouse
She said he the mad stash at the house
Couldn't pass up a jooks like this anyday
Anyway
On our way there I'm feelin' bad vibes
Yo kid don't say that
That's when we bumped heads
With vicks that we stuck from way back, up on Atlantic
The way them niggas lookin' God they drivin' mad frantic
Yo don't panic, trust me, I jump back and bust 
three
Shots through they windshield, they ain't wearin' shields
Hit the kid behind the steering wheel it's the way I feel
In a state to kill I wanna watch him die
Wait and chill, we got bigger fish to fry, two L’s later
In a Bed-Stuy elevator, got off the fifth floor
Water hit the skull, ready kick the door
Off the hinges
Bust shots by entrance
Only thing I saw was a nigga four-four
His gun jammed!
He tried to run and
Reach for a knife, shot him in the leg
So think about your life
And tell me where the loot's at
He said, “I'll tell you just don't shoot black!”
With the sight of fear, dragged him down six flight of stairs
To the basement, and in someway, he had a trap door in the pavement
Smacked him with the gun, kicked him out the way
Had to be at least five hundred K
Now hear come the bitch, talkin bout her share of the wealth
So we put her and the husband out and we went for self

For the love of money!
People will rob from each other
For the love of money!
People will steal from their mother
For the love of money!
People will kill their own brother
[Verse 3: Sticky Fingaz, 
X-1
]
Yo, we fuckin came off! The plan was splendid
'Cept we got all this money, and can't even spend it
Shh, let's disappear and be outta this place
So much dirt and shit we did it's hard to show our face
So we bounced out of town and went down to Miami
Cause most those cats we crabbed was like family
Now me and you beefin', nah it can't be true
It all started when all we had was just me and you
Now a whole different person is what I'm startin' to see in you
'Member when we had the new Lex
With the two Techs,
 rollin' to the duplex, drinkin' Stout
Thinkin bout, what we gonna do next, we used to work tight
Half-assed cars, down to dirt bikes
Hopin everything will go right, with the snow white
And in number spots that flow all night
Up to this day it was all tight
Man, fuck that!
You my little brother and we came out the same pussy
But I'mma kill you, you dummy, you fucked up my money!
Nah, the money fucked you up
Tryin to say the money changed me?!
What you think, I'm your brother, you got a gun in my face see
How can one tiny mistake, make you wanna erase me
Fuck that! You cut a side deal, that's why they raided the block
Now how the fuck I'm 'sposed to know the undercover was a cop
Son you been fuckin' with them niggas!
Look just put down the gun and let this bullshit slide
Nigga I ain't puttin down shit
I'm tellin' you let's just chill man
Fuck that nigga!
It don't gotta be this way man!
What nigga?! It gotta be this way!
It don't gotta be like this man!
It gotta be nigga!
Then go ahead and pull the trigger!
Think I won't?! Fuck you!
You know you ain't gon' do it!
Fuck you!

No! No-o-o-o-o!
For the love of money!
People will rob from each other
For the love of money!
People will steal from their mother
For the love of money!
People will kill their own brother

Don't let money change you!",https://genius.com/Onyx-rob-and-vic-lyrics
Bichasniguz,Bacdafucup,1993.0,"If the heat is on I gotta freeze a frontin’ nigga
Shit’ll hit the fan from the hand squeeze the trigger
Attack of the bald heads, sleep if ya wanna
Beds is burned, ya step to this you’ll be a goner
Bitch ass niggas not respected but neglected
Move on ‘em, move on ‘em things’ll get hectic
So watch ya pockets, hold ya, ho
Ya get hurt up, that’s the word up, fuckin’ with Fredro
Understand god damn, who the hell is that little ass man?
The kid with the scams for all the tight jams
Shootin’ at the stands, sometimes I grease the fans
Ain’t nothin’ worse than a bitch ass
Or which ass nigga that’s fakin,’ lies for attention'
Try to ride a nut for a scratch so stop itchin’
Wishin’ perhaps I play the right guard
Tryin’ to gain yards but I’ma hit ya with sacks
Two to the temple straight to the brain
So simple and plain, ain’t a mother fuckin’ thing change
But a hole in ya motherfuckin tank
I would like to thank my nigga
My nigga, my nigga
My nigga, nigga-nigga-nigga

Bichasniguz, I’mma have to pull ya skirt up
Bichasniguz, I’mma have to pull ya skirt up
Bichasniguz, I’mma have to pull ya skirt up
That’s da word up, you get hurt up
Bichasniguz, I’mma have to pull ya skirt up
Bichasniguz, I’mma have to pull ya skirt up
Bichasniguz, I’mma have to pull ya skirt up
That’s da word up, you get hurt up

Big DS, I’ll put a hole in ya chest
Grab ya by the neck, I hit you with the tek
Onyx in effect, we always come correct
Smack the taste out ya motherfuckin’ mouth
Big DS, I show ya what it’s all about
Danger-danger, danger-danger
It’s all about anger, the nigga bitch banger

Bichasniguz, I’mma have to pull ya skirt up
Bichasniguz, I’mma have to pull ya skirt up
Bichasniguz, I’mma have to pull ya skirt up
That’s da word up, you get hurt up
Bichasniguz, I’mma have to pull ya skirt up
Bichasniguz, I’mma have to pull ya skirt up
Bichasniguz, I’mma have to pull ya skirt up
That’s da word up…

I be with the crazy criminals from the pistol projects
Beatin ‘em down, who we suspect to fake moves
They play the bitch ass
Your choice is dead or death you choose
Make a bitch nigga silent as a bad case of strep throat
Wild crazy klepto keepin’ ‘em all petro
Duck kids on the block gettin’ hot with the rocks
When the time hit the clock I knock ‘em right out they Reeboks
That’s my word
I hit a slick city kid or a herb from the suburbs
Bullets can’t discriminate so I won’t either
Make you holier than a bible if you not a believer
This ya worst dream when ya face my team
Bend a bitch nigga over like the house of pain make ‘em scream
When I get you I say “Gimme that bitch ass
Slice ya throat with glass, get you a cast or a ditch fast”

Ain’t nuthin’ worse than a bitch ass nigga
Ain’t nuthin’ worse than a bitch ass nigga

Move back motherfuckers, the Onyx is here
My name is Sticky Fingaz, I’m the nigga in your nightmare
Forget the crowd cheers, I live off fears
It’s the beast in me, even the music couldn’t sooth me
It’ll take more than U-Haul if ya tryin’ to move me
Ya see I wrote the rhyme, but it’s the weed talkin’
(All ya bitch ass niggas best just keep walkin’)
Before I spit in ya face, Onyx is the master race
Ain’t nothing sweet about me G so stay in a child’s place
With God as my witness, I broke the law
And had bitch ass niggas in jail washin’ my drawers
Hit the floors and do crazy calisthenics
Then when they try to flip they take a trip to the paramedics
(Cause ain’t nuthin’ worse than a bitch ass nigga)
Talk a lot of shit, throw a punch and run
I have blood on my knife and a body on my gun
So listen up, son, don’t act wild
Or I’ll cramp ya style with a bullet and a smile

Cause ain’t nuthin’ worse than a bichasnigga
(Ain’t nuthin’ worse than a bichasnigga)
(Ain’t nuthin’ worse than a bichasnigga)
(Ain’t nuthin’ worse than a bichasnigga)
(Ain’t nuthin’ worse than a bichasnigga)
That’s the word up, you get hurt up!",https://genius.com/Onyx-bichasniguz-lyrics
Conspiracy,Shut ’Em Down,1998.0," Yo, yo but that shit ain't mine nigga
 You know what? Get on the floor alright
 Yo man get the fuck off me
 Get down on the ground, and spread em out alright
 Yo, aight aight man!
 Get the fuck down on the ground man!
 Aight man!
 Now keep your ass on the floor..
 Yo who the fuck can I trust man?
 You can trust me man
 Everywhere I turn there's danger God!
 Ah-hahahaha
 Yo I feel like the walls is closin in on me man!
 Ay, I am Stress
 Buggin man.. ARRRRGH!
 Yeah, I got you where I want you
 Word up man
 Hehehe
 Ain't got nowhere to go Son
 No you don't
Yo

These streets is tryin to kill me
My best friend, could be my worst enemy, this game is deadly
This ghetto might murder me, or lock me up
Twenty-five to life, throw the key

You know what happens in the actions of the inner city tale
When your thoughts fail and have you scared to death
Biting off your fingernails, not enough, numbers on the weight scale
Got, niggas cuttin throat just to make sales
Even if it take the last of me I'mma fill my pockets to capacity
Anything that takes cash, fuck job huntin
Put on a face mask kid, I'm out to rob sum'in
If you home or not, I put the chrome to your knot
One shot to the side of your face, let me up inside of your place
Gimme the funds up out of the safe
Hit the fire escape, high-divin gates
Flyin from Jakes, I'm dyin for paint

These streets is tryin to kill me
My best friend, could be my worst enemy, this game is deadly
This ghetto might murder me, or lock me up
Twenty-five to life, throw the key

Yo, I'm caught up, stuck in the tangled web
Where they'd love to see me dead, mail my mom's my head
So the tricolored silenced Rugar stay off safe
To take off a face, just in case, a quiet lace
Plottin, for your knot-and, your spot-and, your block-and
Anything else, you got-ten, hopefully you stinkin' rotten
So eyes open, don't sleep
Cause once you do you goin deep, mo' money mo' heat
Police, wanna brutalize me to death
And my foes wanna see me lose all my breath
Maybe friends, come wanna merk me for my beans
And bitches that gave me skins, wanna watch my end
Cut open my chest, and see my heart
Pump the last ounce of life -- for livin, it's a price
Til then, when it's over, kamikaze
Strictly, I'm takin all you motherfuckers with me!

These streets is tryin to kill me
My best friend, could be my worst enemy, this game is deadly
This ghetto might murder me, or lock me up
Twenty-five to life, throw the key

When I die, I don't want none of my niggas to cry
Just dress me in a black suit, and a black tie
Pass me by to the darkest cloud in the sky
No time to waste, we got the drugs in the briefcase
We stickin up the whorehouse, we takin everything
We want the pussies to the diamond rings
You want the sun to shine? We want the rain to pour
Official Nast' to put your body on the floor
*BLAM BLAM* *BLAM*

OH SHIT I'm HIT! I'm HIT! They just shot me in the stomach!
UNNNGGGGGGHHHHH! *BLAM BLAM BLAM* *BLAM BLAM* Who want it who want it?
Niggas trying to kill me, and they caught me by surprise
That's when I blacked out, my life flashed before my eyes *glass breaking*

My whole life I ain't never give a shit
My mentality was *clip cocked into gun* get shot or gimme a Gam
If the gun ain't jam, I woulda bust you
I don't trust my own mother, how the FUCK I'mma trust you?
I did some things that I sorta regret
But I can't bring them niggas back kid they already wet
As a kid I went to jail cause I sold crack
I'm holdin trial in the streets cause I ain't tryin to go back

Oh SHIT! What happened?! Wait, now I 'member!
And where my gun??! I musta dropped it when I jumped out that window
*broken glass* Ahh, my stomach, where them niggas I don't see em
I gotta make it to the B-M, and try to stop this bleeding
I ain't trying to die, I got mad blood spilt
(""Aiyyo there that nigga go! Kill him!"") Oh shit! *BLAM*

I left behind a widow and a bastard kid
The streets was tryin to kill me, and it did

These streets is tryin to kill me
That's why I keep a Mac-Mil this shit is real to me
This shit is deadly, this ghetto might murder me
Or lock me up for twenty five to life throw the key, I'm low key
So niggas don't notice me, a half a key is worth
More than a pound of weed, I die for my seed
Kill for my family, fuck this world
Cause this world don't understand me, I'm sick mentally
I'm drinkin Hennessy, mixed with Tennessee
Shit is stressing me, niggas praying for the death of me
But til they bury me
When sixteen shots enter me
Remember me your worst enemy
Motherfuckers!",https://genius.com/Onyx-conspiracy-lyrics
Slam Harder,Bacdafucup Part II,2002,"Who'd have thought they'd lead ya
(Who'd have thought they'd lead ya)
Back here where we need ya
(Back here where we need ya)
Yeah we tease him a lot 'cause we got him on the spot
Welcome back, welcome back, welcome back, welcome back

What! What! What! What!
Yeah! (What!) Yeah! (What!)
Yeah! (What!) Yeah! (C’mon)
What! What! What! What!
Yeah! (What!) Yeah! (What!)
Yeah! (What!) Yeah! (C’mon)

Aiyyo, whose slam harder? Onyx, or Vince Carter?
(Onyx!)
All my thugs gettin’ dollars (Uh-Oh! Uh-Oh!)
All my ladies just holla (Uh-Oh! Uh-Oh! Uh-Oh!)
It's time to get live!
Aiyyo, whose slam harder? Onyx, or Vince Carter?
(Onyx!)
All my thugs gettin’ dollars (Uh-Oh! Uh-Oh!)
All my ladies just holla (Uh-Oh! Uh-Oh! Uh-Oh!)
It's time to get live!

What! What! What! What!
Yeah! (What!) Yeah! (What!)
Yeah! (What!) Yeah! (C’mon)

Aiyyo we back in the Izzay, the game is over
It’s a rap, it’s a ree-zay, straight like dat
It’s a good look, we put hardcore on the map
Ten years to be exact, still throwin’ up gats
See a thug on the TV, and chicks dig that
But we rap for them streets where them thugs play at
So “Bacdafucup,” comin’ through, comin’ through, get ya “Slam” on
Y’all the hardest niggas in rap? Ya dead wrong
Y’all the niggas sittin’ on 20’s with no gas money
Y’all niggas think you shinin’ like Puff? Who got money?
Like you really pop shots in the club? You only pop bottles of bub’
Y'all ain’t got no real street love
To the death, to the ghetto, my kids with heavy metal
On the everyday hustle, never ready to settle, uh
Back together, with the, classic terror, Onyx
Back forever, bustin’, gats together, what!

What! What! What! What!
Yeah! (What!) Yeah! (What!)
Yeah! (What!) Yeah! (C’mon)

Aiyyo, whose slam harder? Onyx, or Vince Carter?
(Onyx!)
All my thugs gettin’ dollars (Uh-Oh! Uh-Oh!)
All my ladies just holla (Uh-Oh! Uh-Oh! Uh-Oh!)
It's time to get live!
Aiyyo, whose slam harder? Onyx, or Vince Carter?
(Onyx!)
All my thugs gettin’ dollars (Uh-Oh! Uh-Oh!)
All my ladies just holla (Uh-Oh! Uh-Oh! Uh-Oh!)
It's time to get live!

What! What! What! What!
Yeah! (What!) Yeah! (What!)
Yeah! (What!) Yeah! (C’mon)

It's locked now, we here, same as before
Plaques and stacks of their dough on our living room floor
From that project heat sick ridiculous flow
For my One-Stop niguz y'all know the M.O
Been giving the streets anthems you're stealin the flow
Reppin’ ""Other People's Money"" and we takin’ your dough
My killuz the grimiest we keep it the Gullyest
We leave you the bloodiest, cause we be the hungriest
(Grrrrr!) Hear that hunger pains?
Got some things that'll numb your brains, run your change
It's not a threat, it’s a promise
I even got my St Louis niguz slamming haters off of Onyx! What!

What! What! What! What!
Yeah! (What!) Yeah! (What!)
Yeah! (What!) Yeah! (C’mon)

Aiyyo, whose slam harder? Onyx, or Vince Carter?
(Onyx!)
All my thugs gettin’ dollars (Uh-Oh! Uh-Oh!)
All my ladies just holla (Uh-Oh! Uh-Oh! Uh-Oh!)
It's time to get live!
Aiyyo, whose slam harder? Onyx, or Vince Carter?
(Onyx!)
All my thugs gettin’ dollars (Uh-Oh! Uh-Oh!)
All my ladies just holla (Uh-Oh! Uh-Oh! Uh-Oh!)
It's time to get live!

What! What! What! What!
Yeah! (What!) Yeah! (What!)
Yeah! (What!) Yeah! (C’mon)

You wanna know the truth? Take a look in my eye
I’m like BIG’s first album, I’m Ready to Die
It’s Sticky Fingaz, if you didn’t already know who I am
The minute I reached out and touched the whole hood with no hands
Cause in the streets I live through it, it’s more than music
Whatever I’m spittin’ on, I put my life into it
Got a reputation on the streets of keepin’ it rough
There’s just too many of us, you get rushed, you get bust
What! Big trucks, chrome rims spinnin’
The mad faced niggas got money so now we grinnin’
Pull your sticks out, we the group you listen to, kid!
Niggas told me my music helped ’em do a bid
I’m the voice of the ghetto, the heart of New York
A fiend will give his last hit, just to hear me talk
Niggas paid for their mistakes, death is the price
That’s right motherfucka, Onyx for life!

What! What! What! What!
Yeah! (What!) Yeah! (What!)
Yeah! (What!) Yeah! (C’mon)

Aiyyo, whose slam harder? Onyx, or Vince Carter?
(Onyx!)
All my thugs gettin’ dollars (Uh-Oh! Uh-Oh!)
All my ladies just holla (Uh-Oh! Uh-Oh! Uh-Oh!)
It's time to get live!
Aiyyo, whose slam harder? Onyx, or Vince Carter?
(Onyx!)
All my thugs gettin’ dollars (Uh-Oh! Uh-Oh!)
All my ladies just holla (Uh-Oh! Uh-Oh! Uh-Oh!)
It's time to get live!

What! What! What! What!
Yeah! (What!) Yeah! (What!)
Yeah! (What!) Yeah! (C’mon)
What! What! What! What!
Yeah! (What!) Yeah! (What!)
Yeah! (What!) Yeah! (C’mon)",https://genius.com/Onyx-slam-harder-lyrics
Atak of da Bal-Hedz,Bacdafucup,1993.0,"""It's the beginning of a new and excitingly different story!""
""Aight listen"" - Rakim
{*needle rips across a record*}

What’s the matter with my brain?
I can’t think clear, oh it’s the hair
Run and get the razor gotta make it disappear
There, now I got an open mind, plus some grease to give it shine

Bald heads and hoodies, black jeans and boots scuffed
Move by the millions and children stay rough for the
One for the road, sell outs 
get wetted
Wild to rip and conflicts get deaded
Gats and backwards baseball caps
When I react I set traps, no haps they get jacked

It's attack of the bald heads
Attack of the bald heads
Attack of the bald heads (attack!)
Attack of the bald heads (attack!)
Attack of the bald heads (attack!)

Most times I get dirty, down low
Scandalous, crazy conniving, wild, suckers know I’ll smoke em like the bloody buddah
Bless bald head style, 
triple zero
 against ya grain I shaved em close and nicked em
Cause it’s just another victim

Shhh, what, what’s up? Listen do you hear what I hear? 
Sounds like an intruder comin in the rear
 nah I wanna kick em
I got the Glock cocked I’m with it, now they gonna get it

I got ‘em, I shot ‘em, he hit rock bottom
I flip it, get wicked and wild when I spot em
DS knows best, yep I pack a heater
Twenty bags of cheeba, slow up ya damn speeder
 We rush on 'em hard (Bring 'em out dead!)
 Onyx rush on 'em hard (Bring 'em out dead!)
 Bald heads rush on 'em hard (Bring 'em out dead!)
 Stinkin, what the hell was they thinkin?

The bald heads..
Attack of the bald heads (attack, attack!)
Attack of the bald heads (attack, attack!)
Attack of the bald heads (attack!)
Attack of the bald heads (attack!)
.. bald headz, ATTACK!

I got news now,  for crews  no way no how
(So GIVE IT AWAY, GIVE IT AWAY, GIVE IT AWAY NOW!)
Smooth as a baby’s ass, headed for the body blast buddy
Escaping through the ghetto, 
kicks muddy
Wilder than Wolverine, run with the scheme team, meaner than Mean Gene
Obscene and heads clean, so well aware, farewell
There goes the big bell, and that means see ya hate to be ya

My clean bean production, so damn disgusting
In the cut bust ya gut and head bustin
Ain’t no escapin the madface invasion
Hot ice and cold steel pressin up in your grill
Word to God I get odd, and even
Leave a punk dead out
Slice up the scalp, man I’ll leave ya head in shreds
Attack of the bald heads, attack of the bald heads

AIYYO!!! What's goin on with the world?
Yesterday, seen a bald head girl
WHAT? MOVE!! You heard what I said
I wouldn't be caught dead without a bald head
Make one false move and I'mma fill ya with lead
Cause there's enough dum-dum bullets for ya whole bum bum-rush crew, who should I do?
Attack of the bald heads, WE COMIN THROUGH!

Attack of the bald heads
Attack of the bald heads
Attack of the bald heads (attack, attack!)
Attack of the bald heads
Attack of the bald heads (attack, attack!)
Attack of the bald heads
Attack of the bald heads (attack!)
Attack of the bald heads (attack!)

(I GOT NEWS!) Attack of the bald heads!
The Onyx; rippin it.. from '93 to the year 2000!
WORRRRRRRRRRD THE FUCK UP!!

Cut ya hair we still never STOP!!!",https://genius.com/Onyx-atak-of-da-bal-hedz-lyrics
