title,album,year,lyrics,urls
Overshine,Shut ’Em Down,1998.0,"* hidden track after ""The Worst""

Follow my footsteps, used to ante up for a nickel sack
From Vange Hill to Moon, you touch me, I got to get you back
Roll in the stolen V's with he-ho chase you
Cop a six months time, and 3 years probation
Repeat offender, bender, no retreat, no surrender
I'm the number one contender
I got a new game plan, strictly sportin name brand
Layin in the pound hunted, floatin through your town blunted
On some shit that give you burnt throats
Amputated all the turn coats, and get cremated
Never been B-rated, my 5 plated, is how I dead fights
I have your family driving in the daytime wit they head lights

(Keep Shinin)I'm daily thinkin of a life gleamin
That life we in, how to obtain, and what's the meanin
(Keep on Shinin)The fact that cash rules, these last days
We the last crews, my present wars and my past crews
(Keep Shinin)True soldier, no matter the goal
We gettin closer, for bitch ass niggas, it's just about over
I'm in it for the long haul, this goes out
(Keep on Shinin)To all my true livin dogs and my 'so-called'

Don't talk about it, make it happ'
Don't fake it chap
The Hennessy act, got you light gat
You wanna block, trying to hold a nine
Son you livin on my time, don't try to Overshine
Play your p, play your position
I stay with G, stay on a mission
Precisely, good, wit game I'm nicely
Shifftee son, still shiesty
You in your eight fifty, 
ridin shotgun
If you can count your money, you ain't got none
And bitches beat they game tight
Baby, get the name right, see G. comin, like a train light
And niggas be don pretending
But I'm armed and bendin, so they can get the John Lennon
Hundred dollar gator players
Silk shirts and champagne
, don't know a thing about the damn game


My artistic creation, or decoration will set the nation
With infestation of lyric lacin, for all occasions
Engagements and events, for big dollars and cents
Makin niggas past tense, it's consequence
All I see around me, makes up the place
But if you don't hold down your space, you quickly get erased
Don't waste a thought, thinkin I ain't
Gon' be bringin the goods and grands home
Till my body's dead and stinkin
Watch as I back draft, on the last class, I trap, crash
Catch the hash flash, when I puff the black wrath
Learn the slicks of the trade, to be self made
Those who slept, stay where they started and got played",https://genius.com/Onyx-overshine-lyrics
Broke Willies,Shut ’Em Down,1998,"To all you rappers out there (With money and fame)
Rockin' a foreign car (Everything brand name)
Broke Willies with no money (Keep runnin' yo game)
Can't forget all our thugs that's locked in chains

We ain't have shit growin' up, now we blowin' up
Hundred G's a show, price low enough
Ghetto struck, layin' in the cut with the metal mack 11
No cup, sippin' amaretto 7-up
The wet life, shit is liquid, my wife trippin'
My whole clique got shit to whip it, last switchin'
(Benz to Benz skippin', superstar hittin'
Your whole world is ice rippin, you nice living
You like shittin', tricks trickin'
Rolly with the inscription, watch a rich nigga glazing)
From New York to LA! (Same shit, different day
Mad cash to play) When I walk my chains swing
(I drew swing hevily ill) From Beverly Hills
(I paid 20 g's) Damn son it better be real
(We holdin' your deals, its 70 mils) Eaten meals
Of Beverly pills (Now watch how the bubbly spills)

To all you rappers out there (With money and fame)
Rockin' a foreign car (Everything brand name)
Broke Willies with no money (Keep runnin' yo game)
Can't forget all our thugs that's locked in chains
To all you rappers out there (With money and fame)
Rockin' a foreign car (Everything brand name)
Broke Willies with no money (Keep runnin' yo game)
Can't forget all our thugs that's locked in chains

I grew up in the PJ's and wore the same gear for three days
Sit to get a blunk out I wanna blew a mill in the month
I'm a ""Lo-Life"", when I go shopping, I'm not worried about no price
{I wear the same clothes TWICE!} Fuck the PO-LICE!
{Its hydro stuff L’s, six plus sells
Stones heavy on the scales themselves, XL
Strait G's, moneys and properties
Black F-G 15‘s, weightin' trees and OC‘s}
We old g’s always OT-in on a low-key
Spit more game than goldie, your bitch chose me
{Suppose WE most-LY, do em slow-LY
We play 'em close-LY, stayed on city cakes} They get erase them!
A sucker for a pretty face, with a twenty waist
Whos Benz I hit two twins in a blue Ventz
{And we're in destroy deals, a house flow for reals}
Cause white-collar crimes equal dolla' dolla' sign!

To all you rappers out there (With money and fame)
Rockin' a foreign car (Everything brand name)
Broke Willies with no money (Keep runnin' yo game)
Can't forget all our thugs that's locked in chains
To all you rappers out there (With money and fame)
Rockin' a foreign car (Everything brand name)
Broke Willies with no money (Keep runnin' yo game)
Can't forget all our thugs that's locked in chains

Yo we went from rags to riches (And get pitches)
With mad bitches (Yo!) You can get a autograph
Or one shot, from the semi-auto pass
(Rap niggas flippin more then halfs
Livin' it up, takin' all the cash) Givin' it up!
{We set it up, on a low tilt it up
In the black quest, pass sex to the extress}
From out the blackness, straight on the boulevard
Lookin' for somethin' to get my hands in a strippers dancin' in the mansion
Word up, that's how we operate (Uncut n raw)
{The players copping} Fake cokies stepped on twice
(Put your money on the street niggas under the light) And hold your money tight
(Kids to die) {Raze 'em up} And roll 'em twice
(Even rich nigga ass better so trife)
We'll gamble mo off yo life true I couldn't see well
Flip my P12 Rover key to the e-mail
Wish a hundred tell, g'd out. I walk the hog, I beat jail
{Yall gotta each tell, kick back, relax, word up
Nigga laid up, bills paid up}
(Shit is all sunny when he pulled up in a 4:20)
We throw these cats on the sideline, lookin' all funny
(Gettin' no money, cause they every day clownin'
We play around with thousands) A hundred g's where we countin'
(A hundred G's a show, here we're out kid)
Word! Word! Word!

To all you rappers out there (With money and fame)
Rockin' a foreign car (Everything brand name)
Broke Willies with no money (Keep runnin' yo game)
Can't forget all our thugs that's locked in chains
To all you rappers out there (With money and fame)
Rockin' a foreign car (Everything brand name)
Broke Willies with no money (Keep runnin' yo game)
Can't forget all our thugs that's locked in chains",https://genius.com/Onyx-broke-willies-lyrics
Black Rock,Black Rock,2018.0,"Black rock! Black rock, black rock, black rock
Three, two

KRS-One, he explained black cop
We mix it with guitars and we made it “Black Rock”
We slam in the club and you can still get shot
I’m on my Diddy bop, lemonade and Ciroc
I jump off the stage with my chain and my watch
Get back on stage with my chain and my watch
Where New York at? Damn, we miss Big Pop?
Got West Coast love, wish I could bring back Pac
I’m in the back drop, the haters gotta love
I keep a Glock in my “Rock & Republic”, make me pop off in public
Broad day people watch and do nothing
They stop and start running and gunning, then cock it and dump it
Now niggas wanna change the topic or subject
Hip-hop ain’t dead yet, it just got shot in the stomach
They throw their gats like us, when they act like us
But nobody on the corner got ratchets like us

Black rock! Black rock, black rock, black rock
Black rock! Black rock *Whatcha*
Black rock! Black rock, black rock, black rock
*Get the fuck outta* Black rock! Black rock
Three, two

Yo I’m Black Rock, i'm all skull and bones
I'm heavy metal mostly the lead and chrome
I'm coming back from hell and I’m headed home
You're nobody till they kill you and you're dead and gone
My niguh Dro got tats I only got scars
My skateboards is luxury cars
See women are from Venus and men are from Mars
I shot for a sky, missed, now I'm amongst the stars
And I ain’t no alkie, I know my limit
Shit, I always stop drinking when the room starts spinning
When I’m up in the spot I command attention
My name’s Sticky Fingaz but my hands be itching
From Carhartt to Chrome watch surprised i'm breathing
I sleep with the sunrise and wake up in the evening
I'm on the prowl like I never say vows I’m too wild

Black rock! Black rock, black rock, black rock
Black rock! Black rock
Black rock! Black rock, black rock, black rock
*Get the fuck outta* Black rock! Black rock

*Get the fuck outta*",https://genius.com/Onyx-black-rock-lyrics
Thangz Changed,Sunset Park (Soundtrack) ,1996.0,"Official Nast'! Word is bond
Yeah - yeah yeah - you know the real deal boy
Word up, Official, Official, Official, Official
Word up, check me, I'm the Official, Nastee
It's like that, yeah it's like this
Son hold up, what up what up
We gonna rhyme right now, word is bond
Give it all we got, c'mon yo, c'mon..

A lot of things have changed since I grown up
Half my brothers got locked, half got blown UP!
From playin ""two hand touch"" and the games in the street
But the games ain't the same, now we playin with heat
SEE THERE'S DANGER, in my buildin, they rollin dice there
Ain't nuttin nice there, who dare to wear ice there?!
My hallway is like Rahway, to the thugs in the doorway
Peace, kid I'm out, NO DOUBT!
We just hangin on the corner, puffin trees just
Tryin to stay warm, sippin Easy Jesus!
Problems after problems, it keeps revolvin
They got us starvin, that's why we out robbin (knahmsayin?)
There's days I can't remember like the 6th of December
I think it was September nah, maybe it was November (what?!)
This kid got rocked, just for steppin on some sneakers
Heard from Tomica, he's gettin buried in a speaker
Cause his mom's was on that *inhaling*, gettin laced
She not SMOKIN IT! She took one bad hit
Chorus: repeat 2X
Aiyyo (YO!) can't escape the ghetto
Hell no, it's everywhere you go!
Aiyyo (YO!) can't escape the ghetto
Hell no, it's everywhere you go!

I'm not your role model, I'll drink the whole bottle
Don't follow, nobody cause you never know tomorrow
Just look around, EVERYWHERE, it's despair
It ain't no care here, and good times is rare
Or seldom last long, they always fadin
When my fam is dyin over money and gettin incarcerated (yeah)
Just to be a statistic, it's sadistic
Too realistic, we goin this QUICK!
The other night kids got bad (Word, T-N-T ran out?)
Got them kids Bill and Ted, they called the law news spread
Last week they was blazin on the corner, bullets ricochet
Hit somebody's baby, and they kid may be dead
Resultin from the ill {shit}, to say the least
Livin in the ghetto... rest in peace!

Yo.. HEY!
Cause where I'm from, the good die young
The sky is grey, we never see the sun
The ghetto life, is live and let live
On the day to day..

It all began when Shorty Rock took the law in his own hand
Sick of seein his moms gettin beat up by his old man
So he did what any kid woulda done
Went into the closet, got his pop's gun
Who need enemy when you got family?
It's hard to get a job when you look like me (WORD UP!)
See people don't just rob cause they on unemployment
Some do it for the pure satisfaction enjoyment
Brrrr, it's cold, this world is freezin
Folks gettin murdered over no apparent reason (NO!)
Packin they bags, talkin bout they leavin
But where you gonna go? You can't escape THE GHETTO!
You see more when you HIGH, even less when you LOW
You can't run from your own shadow
Chorus
{*scratches ""my little man, 
shorty doo wop
""*}
 In every ghetto, we packin heavy metal (repeat 4X)
{*ad libs and ""Official Nast'!"" to fade*}",https://genius.com/Onyx-thangz-changed-lyrics
Gun Clap Music,Triggernometry,UnKnown,"Walkin' down the street with my, Glock in my hand
No safety, you know it and our guns don't jam
Keep one in the hand and no need for cockin'
When niggas start the poppin' them shells get to droppin'

Fuck rap music, this is gun clap music
Fuck rap music, this is gun clap music
Fuck rap music, this is gun clap music
Load it up, cock it back and blast to it
Fuck rap music, this is gun clap music
Fuck rap music, this is gun clap music
Fuck rap music, this is gun clap music
Load it up, cock it back and blast to it

Yo, who shot ya?  It's too late to try to operate
Hard escape through New York State
It's on killa, fuck all the niggas that hate
I can feel ya shook when ya walk through the gate
Your heartbeat break like a Kay Slay tape
Bust guns to this, raisin the crime rate
Niggas better blast when it's time to shoot
Niggas on the roof tryna blast at you
See me in the six coupe, twins engine
Skiddin, murder scene left, God ridden
New guns, old guns, need to test those
I burn, baby, burn like sniffin asbestos
Bust low, reload and stay low
I twist more caps than the 40 oco
Bitches know, could tell by the look on the thug face
The way they play it in the club, it ain't safe

Fuck rap music, this is gun clap music
Fuck rap music, this is gun clap music
Fuck rap music, this is gun clap music
Load it up, cock it back and blast to it
Fuck rap music, this is gun clap music
Fuck rap music, this is gun clap music
Fuck rap music, this is gun clap music
Load it up, cock it back and blast to it

A'yo I'm still not a hater but the heat'll spray ya
Say hello to the bad guy, meet your creator
Your gone, locked down streets in blocks down east
Hopped out jeeps, knocked out teeth and chopped down beef
With the boxpound heat, it's your option to die
Poppin the nine at ten, then guns in the sky
Grew up in the Stuy, peace to every ghetto
Up in the x-sincos with my niggas from Queens wit heavy metal
Drug raps through the PJ's, ki's and trees, now we payin DA's
Gettin paid from three ways
Who wanna die?  It won't cost you a dollar
Get your boys to follow of course you still gonna holla
Money I'm sick, keep puttin clips in them rugers
And spit, you couldn't measure my fifth with six rulers
Hold up killer, I'm all about gettin loot
And when I cock back duke I'm givin Glock tattoo

Fuck rap music, this is gun clap music
Fuck rap music, this is gun clap music
Fuck rap music, this is gun clap music
Load it up, cock it back and blast to it
Fuck rap music, this is gun clap music
Fuck rap music, this is gun clap music
Fuck rap music, this is gun clap music
Load it up, cock it back and blast to it

Some say the bigger the gun, the more damage it do
I say the smaller the pistol, the better it shoot
I give a holla to my niggas in warfare
Sticky don't care, if don't nobody else care
And um, I'm always quick to reach for the Glock
So if you run up in my spot motherfuckers get shot
In these streets niggas drivin fives gettin set up
Forgive but don't forget your benz'll get wet up
Niggas come around frontin, don't believe 'em
You ain't no killer you be layin there bleedin
Cause nigga you know me
Don't make me blast you up and snatch your ass out the b
And bitch niggas don't blast back
They like ladies, they take their ice chains to the casket
And since we all came from the hood
Got our name from the hood and our game from the hood
I think it's time to kill for our good, time to heal our hood
Be real to our hood
And if we don't we'll have a race of babies
That'll take 380's to school and get crazy
And to my sons tryna make ones
Sellin cracks on the blocks, watch out when the jake comes
And to my real thugs get up, I know you fed up niggas
But keep ya guns up

Fuck rap music, this is gun clap music
Fuck rap music, this is gun clap music
Fuck rap music, this is gun clap music
Load it up, cock it back and blast to it
Fuck rap music, this is gun clap music
Fuck rap music, this is gun clap music
Fuck rap music, this is gun clap music
Load it up, cock it back and blast to it",https://genius.com/Onyx-gun-clap-music-lyrics
Feel Me,Bacdafucup Part II,2002.0,"Just to let you know this is recorded 9/11/2001
The day the World Trade Center blows up
Shit is real, son. Shit hit home, kid, word up
Uh, yeah, hope you can feel this

Hope you can feel me
So much pain inside
Hope you can hear me
I’m cryin’ through my heart

When I first heard the track it made me cry
Brought tears to my eyes and I don’t even know why
My life ain’t nothing but anger and pain
Tatoos on the back of my arm should explain
Blood, sweat and tears, ten years in the game
So many times all alone with the gat to my brain
It’s 
Me Against the World
 nigga, I feel the same nigga
I’m 
Ready to Die
 too BIG, I feel the same
I’m America’s nightmare – young, black and rich
Man, I’m paranoid, make me wanna clap my bitch
A hundred miles an hour, wanna rap my whip
Asking God “Shit, where we going after this?”
I’ma thug, a thug til heart be stop
Til they pick me off the street nigga, murdered a shot
My wars, my words, the only thing that I got
And I live by the gun and I die by the Glock
Sixteen shots, fuck that I’m takin’ them all
I’d rather die on my feet then live and crawl
My gun got powers like the 48 Lords
The “Ghetto Superstar” die see my face on the wall
And don’t forget me

Hope you can feel me
So much pain inside
Hope you can hear me
I’m cryin’ through my heart

Growin’ up in Brooklyn, times was rough cuz
Poor as we was it couldn’t get no tougher
On my ave. most of us was not blood
But as kids we shared that block love
But that faded, when my brother’s got arrested
They thugged on the block to hard, we was ejected
To the creator: was it you that made moms pick Queens?
So her baby son could race the world, when he created things?
Why her elders always heard the sounds of sirens?
Plus they ignored the divine guidance
Why was the time I was born 9/16?
Turn it upside down it’s the same thing
Why do I have a M-16, and the 9?
Will I have to go out, blazing one at a time?
When you took moms baby carriage, in the early stage
Was he too ill for this world, and you made a mistake?
Did he come back as me, to do something great?
To keep the fam strong and straight, help my brother’s escape?
And have baby sis and us, living on an estate
Do it big or die tryin’, is that my fate?

Hope you can feel me
So much pain inside
Hope you can hear me
I’m cryin’ through my heart

Who really cares, what the world think about me?
If I die right now, is you comin’ with me?
When I’m broke, who the hell got money for me?
Can’t even trust half the team runnin’ with me
I only know three people that’d kill for me
Break the 6th commandment, make blood spill for me
Life and death the only thing that’s real for me
Cuz I was born into the world with a guilty plea
Now shit hit the fan, is you ridin’ with me?
When the whole world watchin’, 
All Eyez on Me
Swear on a stack of Bibles, testify for me
Look the judge dead in the face and lie for me
If I go to prison, who gon do my time for me?
Start the revolution, get the chair, fry with me
Go out in a blaze of glory, guns to the sky with me
I’m all alone in this world, all I got is me

Hope you can feel me
So much pain inside
Hope you can hear me
I’m cryin’ through my heart
Hope you can feel me
So much pain inside
Hope you can hear me
I’m cryin’ through my heart
Hope you can feel me
So much pain inside
Hope you can hear me
I’m cryin’ through my heart",https://genius.com/Onyx-feel-me-lyrics
Belly of the Beast,Turndafucup,2012.0,"I'm a product of my environment
OG's going into early retirements
This is the art of war, black diamonds in the Audemars
Shit I talk might start a war
Dro Starr the golden child De La Hoya
Some might stick for the bread Stella D'oro
Public announcements for public houses
Playing with their freedom, touching thousands
Rich folks send their kids off to Yale
Poor folks send their kids off to jail
So fuck taking lemons and making lemonade
We can take a half an ounce, turn it to a 28th
My bitch can't dress and never less than Ralph Lauren
A nigga can't drive a whip unless the whip's foreign
We in the club, throwing tax free hundreds
20 niggas jumping out of three black Hummers
Stop putting fake grilles on a whack three hundreds (Chrysler 300)
Niggas ain't trying to see Max B numbers
Hold your head, son, this murder Redrum

One for the struggle, two for the pain
Three for the kids out mugging for change
Cause the bills don't stop, the bills don't stop
It's the belly of the beast and we hungry

It's Sticky Fingaz, you know I'm bout to black out
I never go to sleep, nigga, I pass out
And I don't wake up, I come to
I'm scared to death cause everything I think come true
I got a lot of things, but no sympathy
I keep the ratchet pockets never on empty
I'm in that Bentley, please don't tempt me
High powered lawyers, I beat an attempt B
Look at my face, do it look like I'm joking?
It beat them nosey niguhz, get they nose broken
Sometimes the hardest niguh be the most soft-spoken
Pop off guns, get thrown in the ocean
I'm not a gambler, a hustle nigga cashed out
Before I'm broke, I pull that guns and that mask out
As a kid, I was raised in the traphouse
Like a rat throwing rocks throw a glass house",https://genius.com/Onyx-belly-of-the-beast-lyrics
Getdafucout,Bacdafucup,1993.0,"Ay yo man fuck that man, yo fuckin' word up
Damn
Punkass
Bacdafucup
This nigga's a pussy man
What?
Yo, fuck that man show them how mutherfuckin' Brookland rolls
What did that Nigga say?
Fuck that shit
Who the fuck was that? What the fuck'd that nigga say?
We gotta get together
Fucking said?
Mothafuckin' South side
That nigga ain't said shit
Shit, fuck all of 'em up man
That's it man, yo fuck that
Haa hahah

I got some bad news! Due to the fact we got some Bal-hed motherfuckers outside, they out there throwing bottles and flippin' over cars and shit
Yo! Them nigga's burning buildings and buckin', yo they fucked it up, for everybody! So all ya'll motherfuckers, ya gotta get the FUCK OUT! It's over! Leave! Fuck that! Get the fuck outta here! Fuckin' Bichasniguh
Hey cut that shit off, man
Turn that shit the fuck off! Now! Turn it OFF!",https://genius.com/Onyx-getdafucout-lyrics
Bring ’Em Out Dead,Bacdafucup Part II,2002.0,"Where my wolves at?
Yeah, put your hoodies on
Keep your face down low
Anything shinin’, take that shit
Give a fuck, we in the bar
Niggas, bitches, let's go!

Aiyyo, set it off, let it off, get it off (Yeah!)
Get this shit wild like thugs from up north (Yeah!)
Fights in the crowd, the shots’ll jump off (Yeah!)
Body’s on the floor, blood on the dance floor
Get stuck at the bar, get robbed at the door
Cracked off at the coat tag door, take it off
Get down, face down to the ground
Kill ’em for their dough like Po from uptown (Yeah!)
Cut your finger off, send it to your moms house (Yeah!)
Never testify no matter how it goes down (Yeah!)
When I bark shots you niggas’ll duck down (What!)
Run up on your block, you niggas get shut down (Yeah!)
Give it up, you don’t want to try to resist
Before I hit you off, you don’t wanna die for this
Un-unh, so we gon' load our guns to this
Black mask, face down, motherfuckers gettin robbed to this

Take ’em out, bring ’em out dead
Take ’em out, bring ’em out dead
Take ’em out, bring ’em out dead
One gun, two gun, three to the head
Take ’em out, bring ’em out dead
Take ’em out, bring ’em out dead
Take ’em out, bring ’em out dead
One gun, two gun, three to the head

Shots’ll spill, niggas think it’s not for real (Huh?!)
Make your body disappear like Copperfield (Yeah!)
No funeral’s, no wake, no doctor bills (Uhn uhn)
A lot of niggas ain’t kickin’ shit I can feel (C'mon!)
We gettin’ it down real big, that’s what we doin’
Give ’em the most raw, that’s what we doin’
The game gon' understand, the world gon' understand
These niggas is gun in hand, you die for these grand
Shot’s from the mac ugh, killin’ he got swag
You got it back, stab ya, with your own dagger
My sons take your six,  you in   (What hot one’s?)
The one's that probably even pump the cops 
We got ’em strung with the drugs that we dealin’
Or peelin’, some loud niggas, thugs can feel it
And my Brooklyn killers, and my project niggas
And my brother’s locked down in the jails can feel it

Take ’em out, bring ’em out dead
Take ’em out, bring ’em out dead
Take ’em out, bring ’em out dead
One gun, two gun, three to the head
Take ’em out, bring ’em out dead
Take ’em out, bring ’em out dead
Take ’em out, bring ’em out dead
One gun, two gun, three to the head

If I don’t eat, fuck that, everybody starve
Takin’ 'ery plate like it’s fonk time in Oz
Motherfucker, I kidnap all your kids
Before I had a record deal, what you thought I did?
Last job that I had I was punchin’ a clock
Last niggas that I tied up was up at Koch
I ain’t even need a mask, I ain’t bust one shot
Made ’em wire me my money right there on the spot
That’s a Cartier watch? Nigga take that off
That’s a iced out cross? What? Take that off
Know what’d happen to your daughter, I don’t make that call?
Better take me to the bank or get your face plucked off
Hottest nigga in the club cause I got the heat
So what boy, wan' gun box with me?
Then step up young’n, show me what you gon do?
We got big guns nigga that go “Boom! Boom! Boom!”

Take ’em out, bring ’em out dead
Take ’em out, bring ’em out dead
Take ’em out, bring ’em out dead
One gun, two gun, three to the head
Take ’em out, bring ’em out dead
Take ’em out, bring ’em out dead
Take ’em out, bring ’em out dead
One gun, two gun, three to the head
Take ’em out, bring ’em out dead
Take ’em out, bring ’em out dead
Take ’em out, bring ’em out dead
One gun, two gun, three to the head
Take ’em out, bring ’em out dead
Take ’em out, bring ’em out dead
Take ’em out, bring ’em out dead
One gun, two gun, three to the head",https://genius.com/Onyx-bring-em-out-dead-lyrics
