title,album,year,lyrics,urls
Practice,Everything Sucks,2020.0,"Blogs, Vogue
Front row show
Campaign, let's go
Politics, no-no
Hip-hop, high school
Rap game, shit show
People don't give me my props
Fuck, I don't like them big opps

It's a success when I big drop
Rush to the store when they big cop
I don't believe in flop
Underground, mainstream
I brought punk to hip-hop
I brought weird to the block
No major deals, but I finesse Coachella
Bitches with clout love to think that they better
Accomplished shit that you bitches could never
Who cares if you bad 'cause I'm smart and I'm clever
Act nice just to get by
Deep down, I hate you guys
You guys are not my type
Don't fuck with your dumb hype
19, savage
Last year, that was practice
New new, action
Fuck the game, I got passion
Glowing up, satisfaction
New year, reaction
Been down, it was tragic
Now I go hard like it's madness
I'm a rockstar, I like fashion

Glove off, mask off
Real soft, me
Glove off, mask off
Real soft, me
Glove off, mask off
Real soft, me, me, me, me

You know Princess be the mood board
You know Princess be the mood for
Industry bitches who wanna be different
You still selling pop, who the fuck is you kidding?
But they copy and paste, but they can't erase
My right or my place, I show them my face
I give them the eye, people said I was a witch
Now I'm taking what's mine
I'm that little witch girl with your name in the pot
People wanna do me evil, now you see what I got
Now I'm flying on my broom, going straight to the top

Blogs, Vogue
Front row show
Campaign, let's go
Politics, no-no
Hip-hop, high school
Rap game, shit show
People don't give me my props
Fuck, I don't like them big opps",https://genius.com/Princess-nokia-practice-lyrics
Anomaly,Metallic Butterfly,2014.0,"Insects crawlin' on my window
On my jacket too
Fishnet stockings ripped real thin
Dirty sneakers too
Graveyard girl, I'm your leader
Walk around with me
See the weirdo things I'm into
Things that's make believe
The anomaly, 21st century
All the space between
Paved, the streets are mean
People got their agendas
That's okay with me
They're all hooked up to their programs
But I will be set free

I've got space and time on my mind
I've got bigger things to do
I've got voices in my head
They're exploding with the truth
The anomaly, oh, oh, oh
The anomaly, oh, oh
The anomaly, anomaly, anomaly
Oh, oh, the anomaly, anomaly, anomaly
Oh, oh, oh

Listen, I don't get political
Government reform, that'll be a miracle
Bloody hands of the government
I think it's time that they get a punishment
Walkin' 'round like zombies
Stitches in their face
Walkin' 'round with ya head cut off
But I know my place
See, I know your secrets
Which ones will I tell?
Tried to hold me in a cage
I'm bound to expel

I've got space and time on my mind
I've got bigger things to do
I've got voices in my head
They're exploding with the truth
The anomaly, oh, oh, oh
The anomaly, oh, oh
The anomaly, anomaly, anomaly
Oh, oh, the anomaly, anomaly, anomaly
Oh, oh",https://genius.com/Princess-nokia-anomaly-lyrics
Biohazard Butterfly,Metallic Butterfly (Mixtape Version),2014,"She's like a biohazard and you have to have her
And you try to snatch her but you can't even catch her
Butterfly, butter-butterfly
You can't contain her so you try to break her
But you cannot shake her, she ain't no faker
She don't wear no chain, play no game
Refuse to be a slave to a romance rage

Biohazard butterfly
Flying through polluted sky
Flying through space and time
Biohazard butterfly
Flying through polluted sky
Flying through space and time

Don't abuse the muse, 'cause art the one they use
The butterfly's too good
And she deserves better, and when you did her wrong
You started off the ticking bomb
She's young in age but knows her sage
She knows a page or two from the book of the luck
Destroy even the baddest hook
She puts a good fight, escaping in the night to do what's right
Sweet little child, who daydreams of suicide
Don't cry a little, gumdrop eyes
You'd be surprised who will demise
The chosen poison, she's sweet when she's unnoticed
To the sky, she is the closest
She don't consort with mortals
She don't consort with mortals

Biohazard butterfly
Flying through polluted sky
Flying through space and time
Biohazard butterfly
Flying through polluted sky
Flying through space and time",https://genius.com/Princess-nokia-biohazard-butterfly-annotated
Crazy House,Everything Sucks,2020.0,"Mm, dah-dah-dah, mm, dah
Mm, dah-dah-dah, mm, dah
Mm, dah-dah-dah, mm, dah, ah

Pretty little psycho, I get down with the payroll
I'm a fallen angel and I hit you with my halo
Smiling in your face 'cause I'm mentally unstable
Yes, I got that juice, got that blueberry Faygo
Call me 7:30 with that dirty, I'm so crazy
Ain't no motherfucker that could ever say they made me
What they say, bro? I don't care what they say, bro
Fallen angel, everything is painful

I came here to party, to bring destruction and violence
My body started a riot and now the children can't fight it
No, I will never be silent, I'm equal raver and tyrant
I fuck with clowns and them pirates, that freaky shit got me smiling

Let me out of the crazy house
Let me out of the crazy house, let me out
Let me out of the crazy house
Let me out of the crazy house, let me out
Let me out of the crazy house
Let me out of the crazy house, let me out
Mm, dah-dah-dah, mm, dah
Mm, dah-dah-dah, mm
Let me out of the crazy house
Let me out of the crazy house, let me out
Let me out of the crazy house
Let me out of the crazy house, let me out
Let me out of the crazy house
Let me out of the crazy house, let me out
Mm, dah-dah-dah, mm, dah
Mm, dah-dah-dah, mm

Rotten fruits and severed heads
I'm the monster under your bed
I'm the goblin from the dead
I'm the witch up in the lead
Pussy popping in the dungeon
Throw your man up in this cauldron
Let me sacrifice you, baby
Got his dick up in a coffin
I'm the young Lorena Bobbitt
If I want it, I'ma cop it
If I hate it, I'ma chop it
I'm a psychotic hottie
Gothic bitch, just like a thottie
Santa's list, I'm always naughty
Ripping hearts just like a hobby
I'm sadistic and I'm sloppy

I came here to party to bring destruction and violence
My body started a riot and now the children can't fight it
No, I will never be silent, I'm equal raver and tyrant
I fuck with clowns and them pirates, that freaky shit got me smiling

Let me out of the crazy house
Let me out of the crazy house, let me out
Let me out of the crazy house
Let me out of the crazy house, let me out
Let me out of the crazy house
Let me out of the crazy house, let me out
Mm, dah-dah-dah, mm, dah
Mm, dah-dah-dah, mm
Let me out of the crazy house
Let me out of the crazy house, let me out
Let me out of the crazy house
Let me out of the crazy house, let me out
Let me out of the crazy house
Let me out of the crazy house, let me out
Mm, dah-dah-dah, mm, dah
Mm, dah-dah-dah, mm",https://genius.com/Princess-nokia-crazy-house-lyrics
Green Eggs & Ham,Everything is Beautiful,2020.0,"Green eggs & ham
Sam, I am
I'm the man
With the plan
Toast and jam
Sunny D
You and me
Socks on feet

Love my inner child, Kool-Aid smile
I been like this for a while
Going into town, gonna find a crowd
Right by the kids in the park with the style
Swing 'til it's dark, hit the block
Run from cops, don't get knocked
By these opps, fuck these cops
Fuck these cops, fuck these cops
Looking for the fun, can you blame me?
Like to make jokes, but they think that I'm crazy
I know that I'm perfect the way God had made me
And I thank my parents for the life they gave me
Have you told your parents that you loved them lately?
I look like my mama in the 1980's
If I been bad, well, please forgive me
I remember when my granny used to hit me
Public school and two Thanksgivings
Purple corduroys with the matching ribbon
Lil' puffy jacket and the T-shirt gilded

Wake up in the morning
Look into the fridge
Grab some eggs out
Breakfast it is
I'm still a kid, but kids are fun
Nice cup of OJ, orange and sun

Frying pan in my hand
Green eggs and some ham
Yes, I'm Sam, I am
Yes, I'm Sam, I am",https://genius.com/Princess-nokia-green-eggs-and-ham-lyrics
Hands Up,Metallic Butterfly (Mixtape Version),2014.0,"Hands up
Baby boy, you got this
I don't wanna fight now
We don't speak the same language
You left me with my heart broke
Body full of anguish
Now we gettin' violent
I'm cursing out in Spanish
I'm trying really hard, see
To finish what we had started
You see, I had some plans now
Don't want to be departed
But you and me are stubborn
Try to outdo one another
Fighting with each other
When we should love one another

Hands up
Hands up
Hands up
Hands up",https://genius.com/Princess-nokia-hands-up-lyrics
Tweety Bird Freestyle,1992,2016.0,"The Tweety Bird
The avarix
The apex
Niggas know I get money, and I get checks
Leather mami to 6 bound, my life a movie
All the people ain't fuck with me gon' say they knew me
Many maps, the gold chain, the blow pops
I get high off of my own hustle, it don't stop
Long braids and baby hairs, I'm so fine
Gettin pretty with age, baby, I'm like wine
When you see me, I'm gonna get, jus give it time
Anything I put focus to is all mine
The hood bitch, the big bitch, the cash flow
The lil fairy, the nympho, the indigo
The long nails, the pigtails, I'm Wavy Spice
The North Face, the Last , the big type
Bart Simpson, a real fuck up, that's no lie
I'm jus firing my own shit, baby, that's no lie
Not cool an outcast out Tel Aviv
New York and Tompkins
Just like the movie Kids, real slick, the slickest, the hustler
Harlem live in my veins, I swear to god, I was born a fuck up
Jet beauty, Puerto Rican cutie
On the floor tryna do all I can do and-and do some more
Ha, ha, ha!

The lil kitty, the lil bitty, the mouth flute
Ain't no time for your bullshit now deuce deuce
I'm bothered, I'm a real nigga
Full endorsements, I make big figures
Nokia, she a go-getter
This baseball, she a big hitter
Three hits, I'ma strike out
Surfboard, I wipe out
Psycho, headcount, Bellevue, I'ma break out
Baseball, I'm a short stop
Pitch hard with a big cock
Real quick, I'ma strike out
Homerun with the lights out
Batter up, first in it
In the lead and it's jus beginning
Home team and I'm still winning
Big dreams and I'm still living
I just take what I was given
Pray to God that I'm forgiven
Noki",https://genius.com/Princess-nokia-tweety-bird-freestyle-lyrics
Welcome to the Circus,Everything Sucks,2020.0,"Welcome to the circus
Welcome to the world that makes me nervous
This is for the people with the purpose
Tryna fight the evil and the burden
I am for the children and for learning
Open up your mind instead of hurting
Break out of the matrix, live the moment
Look up from your phone and stop the moaning
Everybody complains, but they going
Welcome to the rave, we came to have fun
Take off all your clothes and start the action
I'ma give you fun and satisfaction
A little bit of chaos and some madness
I hate squares with a big passion
Come to the party but you not dancing
Time to let go and get relaxin'

Bitch, it's me
I am the monster right under your sheets
I am the name that be stuck in your teeth
Everyone here still be talking 'bout me
I don't got time 'cause I'm rollin' on E
I am the show, yes, I'm something to see
Everyone paid and they came to see me
You on the couch, bitch, you is a flea
I hear them talking and walking on me
Bitches is jealous, they got a disease
Hope you get better, no, hope that you die
Hope that you're swallowed and eaten alive
I am so sick of the fraudulent lies
I came to find you, but you ran and hide
Bitches is dumb and I don't got the time
Bitches is dumb and I don't got the time
Bitches is dumb and I don't got the time

Everybody here's your family
Everybody here's your friend
And with me you're never alone",https://genius.com/Princess-nokia-welcome-to-the-circus-lyrics
Bikini Weather / Corazon en Afrika,Metallic Butterfly (Mixtape Version),2014.0,"Que bonita bandera, que bonita bandera
Que bonita bandera, que bonita bandera
Que bonita bandera, que bonita bandera
Que bonita bandera, que bonita bandera
Que bonita bandera, que bonita bandera
Que bonita bandera, que bonita bandera
Que bonita bandera, que bonita bandera
Que bonita bandera, que bonita bandera
(Que bonita bandera, que bonita bandera
Que bonita bandera, que bonita bandera)

Air force drummer, beat to the mind
Money in pocket, poor girls get to fly
Air force drummer, beat to the mind
Money in pocket, poor girls get to fly
Air force drummer, beat to the mind
Money in pocket, poor girls get to fly
Air force drummer, beat to the mind
Money in pocket, poor girls get to fly
Animation, simulation
I'm getting off, on my stimulation
High vibration of my nation
Just in time for the annihilation
Boom, hiyah, go, go
You don't wanna fuck with Prince Nokio
Or Princess Nokia when I'm wearing a dress
Or Princess Nokia when I'm doing my best
Like I said, don't waste my time
Just want a beat, a mic, and a rhyme
I did my time, looking fly
And now it's my time to go speak my mind

Mi corazón en afrika
Mi gente que me 
llaman
Yo sabe in my sangre
Que yo soy un yorubana
La baila de mi gente
Se tiene spirtualgual
Yo siento en mi alma
Que era la verdad
Mi corazón en afrika
Mi corazón en afrika
Mi corazón en afrika
Mi corazón en afrika
La sangre que pasando
Resonando en mi cuerpo
Yo mantenga la magia
De todo de mi pueblo
Cojen la espirtu
Y hablan de lo santo
Gente que me llaman
Magia resonando
Mi corazón en afrika",https://genius.com/Princess-nokia-bikini-weather-corazon-en-afrika-lyrics
Happy Place,Everything is Beautiful,2020.0,"I'm cold, they hot, I'm everything they not
Ain't worried 'bout no spot, 'cause when I drop, the whole world stop
I got the music locked, for girls in twisted locs
Who like they body hair and buy consignment shop
Art thot, that's me, I dance, I rap, I sing
I do so many things, I move around these P's
I like to move with ease, I'm staying drama-free
Get to that happy peak, get to that happy peak
Crop you out the picture, I ain't fucking with ya
Listening to SZA, Hennessy in my pitcher
Power my liver, get the food delivered
Cold like a shiver, cake, I'll take a sliver
Vegan, please, get the cheese, got my ex on his knees
Might just say he hate me, but he come right back to me
I'm not like them kids, they cool and I'm not
Ten chains full of bling, one nose full with snot
I got my happy place, and it's all in my head
And when I close my eyes, I go to it instead
I'm getting Wonder Bread, I keep that lettuce fresh
I'm writing from my bed, this joy will never end

I see they mad 'cause I'm a lady
They rolling Backwoods, I roll Mercedes
I'm never mad, that's why they hate me
Sheneneh Jenkins, don't you try to play me

You acting outta pocket, well, bitch, you need to stop it
'Cause everything you doing is fully microscopic
Your name is not the topic, and you gets no attention
I'm Snow White in the forest, and the dwarves is my henchmen
Petty's never cute, growing up is cool
Bitches still be acting like they fighting after school
Fighting is your mood, hungry, you need food
I'm out here cool as shit, dressed like I'm in Krush Groove",https://genius.com/Princess-nokia-happy-place-lyrics
Fee Fi Foe,Everything Sucks,2020.0,"Fee fi foe, catch a boy by his toe
And if I see his bitch, I'ma never let her know
'Cause I'm a freaky bitch and I keep it on the low
Hood boys love me, from the Brims to the Locs

I'm in my own lane
This shit the whole same
Something's just have to change
I'ma shake up this whole damn thang
I read on my contract
So nobody trap me
If I gotta be up on my own
Well fuck it baby, I'ma just have to be
This shit empowers me
To make all my power moves
I'm focused on bettering me
You just focus on bettering you
I never signed a deal
I gotta keep it real
I really made a mill'
Off of these rapping skills
Off of my talent
I bring the action
I love this rap shit
Straight with a passion
Jackie Joyner-Kersee, damn, I run the limit
I got a hunnid bands and you know I'm gonna spend it
I took a little break, you ain't see me in a minute
Well bitch, I'm back and I'm all way in it
These bitches in my business they gossiping 'bout my riches
They nosy endless, endless, why do they not get the message?
My legacy relentless, I'm pushing it to the limit
I'm playing with no scrimmage, they cheering up on my image
The buzzer, I gotta hit it, I been talking to the spirits
Traveling through the dimensions, I can see right through your gimmick

God, grant me the serenity
To accept the things that I cannot change
The courage to change the things I can
And the wisdom to know the difference
Living one day at a time
Enjoying one moment at a time
Accepting hardships as a pathway to peace
Taking, as Jesus did
This sinful world as it is
Not as I would have it
Trusting that You will make all things right
If I surrender to Your will
So that I may be reasonably happy in this life
And supremely happy with You forever in the next
Amen",https://genius.com/Princess-nokia-fee-fi-foe-lyrics
Heart,Everything is Beautiful,2020.0,"I'm not like those baddies that you see on Instagram (Preach it)
I'm not like those girls that be on Kanye ""Workout Plan""
I'm a little artsy and I know I'm kinda smart (Church it)
I may not have clout, but I've got a lot of heart (Say what)
I don't do no flexing, I don't do it for the 'Gram
I don't need approval, not from you or any man
I don't need attention, I don't care if I look broke
Inside I am beautiful, and that is all I know (Preach it)
Even when I'm confident, I'm kind of insecure
Use a lot of filters when I'm not feeling for sure (Church it)
Compare myself to other girls, the pressure got me stressed
I hate social media, I wish it all would end (Say what)
I'm not like those other girls, in fact, I'm fucking worse
I like being different, wouldn't change it for the world (Go 'head)
Everything I'm not makes me everything I am
Inside I am beautiful, and this is who I am (On God)",https://genius.com/Princess-nokia-heart-lyrics
Wavy,Everything is Beautiful,2020.0,"Splish-splash, double bubble bath
Riff raff, double C's on the dash
Big bands, got the P's and the cash
New dance, baby, lead me by the hand
Drip-drop, wavy like a mermaid
Take a sip now, 'cause these bitches actin' thirsty
I'm special, you ain't on my level
Looking back now, we could never be together

Hey, bitch, I'm wavy
Bitch, I'm wavy
Hey, bitch, I'm wavy
Bitch, I'm wavy
Hey, bitch, I'm wavy
Bitch, I'm wavy
Hey, bitch, I'm wavy
Bitch, I'm wavy

I'm boasy, yeah, I'm the shit
I'm a pimp and a ho, I could take your bitch
So what? I got an attitude, now fuck what you think
That's a neck roll, and a hair toss, bitch, I'm stank
I'm a whole mood
Yeah, I'm a vibe
I'm a 10, babe
Right there you a five
And what's my type now?
Don't you ask me
I'm expensive
Bitch, I'm fancy

Hey, bitch, I'm wavy
Bitch, I'm wavy
Hey, bitch, I'm wavy
Bitch, I'm wavy
Hey, bitch, I'm wavy
Bitch, I'm wavy
Hey, bitch, I'm wavy
Bitch, I'm wavy

You see, I got that tsunami, and I'm watching Toonami
And I'm eating wasabi with a side of umami
It's a lot of anime, Hayao Miyazaki
Papi looking Dominican, man, he got the salami
Now he calling me, ""Mami"", and he giving me toppy
I'm surpassing your ass, and I know that you saw me
Climbing up on the ladder, see my ass getting fatter
Getting bigger and better, go tell your friends that you had her

Hey, bitch, I'm wavy
Bitch, I'm wavy
Hey, bitch, I'm wavy
Bitch, I'm wavy
Hey, bitch, I'm wavy (You can't fuck with me)
Bitch, I'm wavy
Hey, bitch, I'm wavy (You can't fuck with me)
Bitch, I'm wavy

You can't fuck with me",https://genius.com/Princess-nokia-wavy-lyrics
Sunday Best,Everything is Beautiful,2020.0,"Couple Sunday dresses, it's a holy Sunday best
Witches get the brunching, rep that five upon the chest
Penetrate my coven, guaranteed you will be vexed
VIP to Heaven, Yemaya upon the breast
Mother love, sister love
Daughter love, all the love
Conjure love and give me love
God's love, super love
Yeah, Gaia love, all love
Yeah, we holding all the love

Repping 256
Osunfikayo, really do this shit
Oloyi Ayo Ore Yeye ooo
Our mother, source of our creative flow
Uh, we are Divine Feminine
The ancient waters that exist within
Don't forget your truth, melanin
All you got to do is look within
Then you'll recollect where you begin

And we pray everyday
Osetura, yeah, we got that Ase
Put respect on the name
Iya, Nana, Bruja, best in the game

For my santeras with candelas
Taking baths with la canela
Oshun make things better
For my brujas, sucia women who don't fold
Head wrapped in cotton and covered with gold
I run with wolves, leader of the pack
I frolic in the woods with the Stevie Nicks hat
Yo, Nokia that's a fact
Hunnid goons on my back
And they really pave ways
Put my prayers on wax
Eleyeleye aro, lo dega
I bet y'all want to meet my mom
But you can't yet, yeah
Sorry, had to raincheck
Had to freeze the time, read your mind
I ain't brain dead
I can feel your vibe, and it's toxic and hateful
Low frequency, bottom of the basement
I can transmute you, I can make you fruitful
I could fill your cup, mami got that omi tutu
See you in a rut, baby, come here, let me soothe you
I could build a trust, send you blessings on the Bluetooth
That juju
I'm a white witch and I wear a lot of black
It's a full moon and I'm praying back-to-back
Use my intuition, set my new intention
My future's abundant, joyful, pleasant
Bohemian boricua, Gypsy señorita
Jíbara of the finca, bonita 'e la isla
Like Stevie Nicks, I got a hat full of tricks
You would think I move bricks from the money that I get

Let the river flow, hey
If you feel the soul (Feel the soul)
This is spiritual (This is spiritual)

But don't get it fucked up
You could get fucked up
I'll defend my family and my spirit 'til I'm done up
This the revolution like a Panther with her gun up
I don't endorse the violence, but you ain't about to son us
I promise
Omosun, omo awo
On the high road
Walk through all the right doors
Crown to the floor
I make ose on tour
I inspire young girls
All around the world

If you ain't 'bout it
You can miss me with the bullsh—
Oshun and Nokia, we really do this
Me and my blood with the blueprint
If you ain't 'bout it
You can miss me w the bullsh—
Oshun and Nokia, we really do this
Me and my blood with the blueprint",https://genius.com/Princess-nokia-sunday-best-lyrics
Soul Food y Adobo,Everything is Beautiful,2020.0,"You need to season your chicken
We ain't like them folks in here
Sometimes you fight with the Bible
Sometimes it's cowrie and shells
This family kicking up bells
I celebrate 'cause I'm well
I thank the Lord 'cause it's sunny
And I wish enemies well

I love that soul food, adobo
A little mixed with sancocho
That mashed up plantain mofongo
That arroz, chicken, and pollo
I pour libations in soil
It's three leches and Goya
It's the leftovers in Tupperware
And the plates left in foil

That cuchifrito papito
That styrofoam with the juice
I pass that Leo 150
That cha-cha, Timbaland boot
I'm in the Bronx with the mamis
That's wearing Chanel, Versace
They carry bags, Tamagotchi
And everybody a chapi
That salsa music be blastin'
That Orchard Beach with the nutty
Bacardi mixed with the rum
That barbecue come with Henny
And City Island for seafood
You crack a 'Wood in the whip
You grab a piña colada
You take a number and sit
You hit the park in the summer
That public pool in July
You bring your lock and your towel
And Vaseline if you fight
I came with my family
My cousins, uncles, and aunts
The sun had set 'cross the sun
We made it back to the block
That colored syrup that's red
That sugar cane and that ice
That fake and sugary blue
The taste of liquid, that's nice
That gold chain necklace and hoop
That messy bun with the swoop
That baby hair on ya shorty
The prettiest girl in school
That Café Bustelo
With milk and sugar to mellow
Know some Caribbean fellows
That get you pregnant by hello
That baby shower, that party
That quinceañera get started
The titis got you, don't worry
So don't you leave in a hurry

I love that soul food, adobo
A little mixed with sancocho
That mashed up plantain mofongo
That arroz, chicken, and pollo
I pour libations in soil
It's three leches and Goya
It's the leftovers in Tupperware
And the plates left in foil",https://genius.com/Princess-nokia-soul-food-y-adobo-lyrics
Seraphims,Metallic Butterfly (Mixtape Version),2014.0,"Seraphims
 cover me with their night wings
Wonder why I must feel so complete
Feeling these angels all around me
Heaven on Earth is where you found me
Seraphims kiss the tip of my nose
All of the pain, I’ve seem to let go
I guess I'm gonna stay in your heavenly gaze

Angels kiss my face
Angels kiss my face

Time and time again
I started wars in the heads of men
I am a woman, I do not break, I bend
I'm sent to heal, angels are real
In a world of steel

Two butterflies sitting in my hair
Two butterflies sitting in my bed
Two butterflies sitting in my hair
Two butterflies sitting in my bed

Seraphims cover me with their night wings
Wonder why I must feel so complete
Feeling these angels all around me
Heaven on Earth is where you found me
Seraphims kiss the tip of my nose
All of the pain, I’ve seem to let go
I guess I'm gonna stay in your heavenly gaze

Time and time again
I started wars in the heads of men
I am a woman, I do not break, I bend
I'm sent to heal, angels are real
In a world of steel",https://genius.com/Princess-nokia-seraphims-lyrics
