title,album,year,lyrics,urls
Receipts,1992 Deluxe,2017.0,"No, I am not that hoe
20K, first class for a one day show
And I made so much back with the merch I sold
I am a business man, I'm no average hoe
I am the headliner, not the support, bro
I think you got it twisted, let me show you though
I am a rockstar and I'm twice as cold
These little doo-doo boys they could get up and go
I took this shit hostage and I won't let go
I am the real deal, not some SoundCloud hoe
Oh you really doin' numbers? Ask about me though
Oh you think you're hot? Let me prove you cold
Little boys, oh you think you got toys?
Little boys, oh you think you make the noise?
Little boys, oh you think you got the heat?
Little boys, oh you think you from the street?
Nah bro, shut your dumbass up
Y'all them goofy hypebeasts with your double cups
Everybody in your squad, but it's just three blunts
Oh you waitin' on that sour, boy you fuckin' up
Pay attention, pay attention when a grown up talk
You are not fuckin' rich and you don't hold no work
All your music's fuckin' corny and it sound the same
Let me guess, you just waited to put on your team
I am sorry, I am sorry, I am not this mean
All you circulation cuttin' off them skinny jeans
You're all the court jesters and I am the queen
All y'all do is walk SoHo and y'all act like fiends

Double XL done featured me, well
How the fuck does that feel? No you don't wish me well
No, you hope that I fail, but I won't 'cause I can't
It's 
Return of the Mack
 and I'm lit to the max
And I really count stacks, this a tour back to back
And I got a catalogue, it's iconic as fuck
Three albums in three years, damn I'm good as fuck
It's 2017 and you out of luck
This is Princess Nokia, I don't give no fucks
I just light my L and I do my work
Make a big exhale then I turn and burp
You don't like my style? Well okay, that's cool
'Cause my money real long and I am not like you
I'm an old school hoe with a new school flow
I refuse to be supportin', got my own damn show
I'm a headline that, that's my racks on racks
I'ma send it all out and I'mma make that bag
See a bill full of dudes, I don't play that shit
I'm a motherfuckin' superstar, you heard me bitch
I'm a motherfuckin' legend, not some lit rap bitch
And I refuse to open for a dude that really ain't shit

Laughin' at the rappers who got ego in they pocket
Always talkin' money but they never ever got it
They always gotta flex it, if you rich then you don't stress it
The less you show, the more you have and let that be a lesson",https://genius.com/Princess-nokia-receipts-lyrics
Look Up Kid,A Girl Cried Red,2018.0,"Smash my heart in pieces, it looks so good on the floor

Days slip into years of wounds that bleed fresh
Suffer in silence, is what you do best
You have no guidance, no person to tell
You're bleedin' on the inside but ain't nobody here can tell
Your smile is a mask, you wear it so well
The darkness you carry has given you hell
I know it gets scary but you will be fine
You won't have to deal with the voice in your mind

Look up kid
I see your face, you are going through something
Look up kid
It gets better but you won't even know it
Look up kid
I see your face, you are going through something
Look up kid

Don't forget the darkness always turns to light
You will have to fight for the sanity you find
Go and find a corner, a place where you can pray
And hope to God you'll make it, with every second that you make
Destiny's callin' and I call your bluff
Tell me you're tryin', you can't give up
Moments that count 'cause in the end
You'll say you made it, you'll say that you'll win

Look up kid
I see your face, you are going through something
Look up kid
It gets better but you won't even know it
Look up kid
I see your face, you are going through something
Look up kid

Don't hit the ground, don't turn around
I won't come back 'til you're safe and you're sound
Help you calm down, make you come 'round
I'll never leave you, I promise I'm down
If I'm out of town, if I'm out of bound
I will come get you sooner than now
I'm beggin' you now, I'm beggin' you now
(I'm beggin', I'm beggin', I'm beggin' you now)

Look up kid
I see your face, you are going through something
Look up kid
It gets better but you won't even know it
Look up kid
I see your face, you are going through something
Look up kid",https://genius.com/Princess-nokia-look-up-kid-lyrics
At the Top,A Girl Cried Red,2018.0,"Fuck a co-sign, doing mine, I was made to shine
Lights so bright, little bitch, and I could make you blind
Don't nobody care in this world, everything is cold
Like my heart in the morgue, everything's a tag a toe
I ain't suckin' dick for no play, must be out your mind
Gettin' on my knees, tryna please, must be suicide
We won't get along 'cause it's wrong, I'm not tryna change
They would do you dirty in a hurry, wouldn't have to wait
I don't want your clout or a pic that's a fuckin' joke
Some make me sick with the shit that they tryna smoke
You can play pretend with your friends that I ain't the shit
You can keep ignorin' all the facts and what I really did
You can try to front all my life that I came up
Million off a mixtape, that's a fact and I don't need to front
People think I'm wack, but they suckin' dick
The money I'm gettin' makes everyone sick

It get lonely at the top and I do it by myself
I got everything I want without anybody help
Do you think I give a fuck? Only care about myself
I'm a stone-cold killer, couple notches on my belt
It get lonely at the top and I do it by myself
I got everything I want without anybody help
Do you think I give a fuck? Only care about myself
I'm a stone-cold killer, couple notches on my belt

I don't front for the 'Gram, this is just who I am
I don't ride on no wave, I don't tag on no plan
I don't fuck for no clout, I don't beg for no man
I don't care about fame, I just care about bands
I came out of the mud and I smile 'cause I can
People look down on me, on account who I am
And they point and they judge, they do not understand
And they talking on me but I don't give a damn
Back to back tour, even more, I'm a superstar
Throwin' shots at me, bitch please, I see everything
Only problem now is your grind make you look weak
I am fuckin' grown, ain't no little girl in the street
I'm nice to all, I don't gotta beef
I just want the bag, and you can have the street

It get lonely at the top and I do it by myself
I got everything I want without anybody help
Do you think I give a fuck? Only care about myself
I'm a stone-cold killer, couple notches on my belt
It get lonely at the top and I do it by myself
I got everything I want without anybody help
Do you think I give a fuck? Only care about myself
I'm a stone-cold killer, couple notches on my belt",https://genius.com/Princess-nokia-at-the-top-lyrics
Flowers & Rope,A Girl Cried Red,2018.0,"It won't even hurt, I'm already dead (I'm already dead)
Voices in my head, monsters under my bed
I'm alone again, I lost all my friends
Wanna play pretend? Hope this never ends
Talkin' to myself, know I crashed and burned (I crashed and I burned)
Think they hate my guts, yeah, what I heard
Everything my fault, when will I learn?
Three days in the house, feelin' sick and disturbed

Bring me your flowers, I'll bring you my rope
Play all the records that we love the most
Bring me your flowers, I'll bring you my rope
Play all the records that we love the most

Fighting my demons, they keep tryna win
Life of a loner, I want it to end
Hurt myself and I gave it three nights
Told her I love her, I thought it'd be nice
It was my fault and I live with regret
She was a beauty and I paid my debts
Flowers and rope had appeared on her chest
Thought she was different but she's like the rest

Bring me your flowers, I'll bring you my rope
Play all the records that we love the most
Bring me your flowers, I'll bring you my rope
Play all the records that we love the most",https://genius.com/Princess-nokia-flowers-and-rope-lyrics
Chinese Slippers,1992 Deluxe,2017.0,"I'm hood as fuck in a bonnet outside
Ain't nobody got a car, ain't nobody fuckin' drive
So we all fuckin' fork, ain't nobody gotta lie
Ain't nobody tryna flex and ain't nobody tryna hide
Now we all from the hood and we all gonna die
So it just can't be fun and we just gettin' life
Couple neighbours in the front, couple neighbours to the side
Now the cops is on deck but we still getting' high
Yeah we still blowin' smoke
We just fuck with weed, we don't fuck with the coke
Couple cups of henney 'cause you know we all broke
It's a celebration and we happier than most

I'm a crazy hoe, you already know
Chinese slippers in this bitch, boutta make a show
Boutta light it up, and I'm high as fuck
Kentucky fried chicken and pizza hut...
Kentucky fried chicken and pizza hut!
Kentucky fried chicken and pizza hut!
Kentucky fried chicken and pizza hut!
McDonalds! McDonalds!

It's a block party, and we gettin' started
Everybody got a chair, flyer in the lobby
Gotta the speakers up, fire hydrant on
All the kids is actin' up, we just play along
Couple candles in the corner and an offer in the bread
Everybody pourin' liquor, showin' OG to the dead
We just wanna get ahead, we just out here tryna win
Everybody make a cross when they know they 'bout to sin
Couple shawties finna fight and they bout to get it in
Welcome to the block, here we go again!

I'm a crazy hoe, you already know
Chinese slippers in this bitch, boutta make a show
Boutta light it up, and I'm high as fuck
Kentucky fried chicken and pizza hut...
Kentucky fried chicken and pizza hut!
Kentucky fried chicken and pizza hut!
Kentucky fried chicken and pizza hut!
McDonalds! McDonalds!",https://genius.com/Princess-nokia-chinese-slippers-lyrics
Different,1992 Deluxe,2017.0,"Kill Bill in the Pussywagon
Roll the L, I'ma Puff the Dragon
4 bars, Wi Fi never laggin'
It's that tomboy and my pants saggin'
Tomboy and you know the deal
Independent, no takin' deals
Little girls, they be in the fields
They be so hungry, let me feed ya meals

I'm different, I'm different, I'm different, I'm different
I'm different, I'm different, I'm different
I'm different, I'm different, I'm different, I'm different
I'm different, I'm different, I'm different
I'm different, I'm different, I'm different, I'm different
I'm different, I'm different, I'm different
I'm different, I'm different, I'm different, I'm different
I'm different, I'm different, I'm different

Outcast but I will last, money long and I think fast
Love money so I get cash and I love shopping so I hit tags
Outcast, I was born different, dolo, I don’t got haters
Rap game is my only focus, been the same way since I was little
Outcast in a different way, most folk we are not the same
Most folk are so fuckin' lame, man, I can't stand them so I stay away
Real shit, I'm particular, got my money and my company
I know I got a good heart, tell a hating bitch stay away from me
OutKast, I'm like André, OutKast, I'm like Big Boi
Different man, I'm different man, no shooters man
Ain’t with the gram, stick to my plan
My palms itch so I scratch my hands, they called that the money man
Birdman and I rub my hands, big name, I got a lot of fans
Cult classic I can take a shit on anybody that's talkin' shit
Big league off the internet, make weight and invest that
They know I'm the best out with my little titties and my chest out
Massacre, hit count, born different, I'm born different

I'm different, I'm different, I'm different, I'm different
I'm different, I'm different, I'm different
I'm different, I'm different, I'm different, I'm different
I'm different, I'm different, I'm different
I'm different, I'm different, I'm different, I'm different
I'm different, I'm different, I'm different
I'm different, I'm different, I'm different, I'm different
I'm different, I'm different, I'm different

Fuck feelings, I just catch flights, Set it Off, Jada Pinkett type
Love girls and I love dykes, I'm in for a good night
Money lit like a rainbow, all white like an angel
Passed out in the Range Rover when I'm en route to the next show
Headliner 'cause I do that, big name 'cause that's all me
Real talk, I'm a hood rat and my name is Miss Destiny
Destiny, I'm a fuckin' child, big titties and a goofy smile
Some pray I will fall off, but I be here for a little while
Rap game, I'm just different man, rap game, we are not the same
Competition, I got none 'cause I made my own fuckin' lane
Rap shit, I'm so based man, I'll say what the fuck I want
Middle fingers to a schemin' hoe, I'm a superstar standin' in the front",https://genius.com/Princess-nokia-different-lyrics
Brick City,1992 Deluxe,2017.0,"It’s Benny Bandolero, I think they tienen miedo
I’m clockin’ with Gepeto and smelly blocks of cheese
Chop shooter gouda feta, ooh, baby probably
Time with me, charge a fee, commodity
So what, I am conceited, I got a lotta reasons
And not just what I look like, oh baby, how I’m eatin’
How I'm thinkin’, ow I'm movin’, ow I'm breathin’
I am conceited, stock risin’ every season
I’m a little kid with a big bank
Buildin' Legos up, Tonka Truck tank
Peso dollar yeah, I’m Frank, yeah, I’m Richie Rich
I talk a lot of shit, I am the illest chick
Bandanas and big clothes, Santana is my flow
Pajamas and big souls, got braids in tight twists
I'm slim with big hips, I'm brown with big lips
I'm little but real thick (real thick)

Brick city, new year, big moves, no fear
Big money, no care, I’m conceited, I swear
(Brick, brick, brick)
Brick city, new years, sixteen, my year
Seventeen, my year, I'ma do it every year

I’m in the New York brim, I got stiletto timb
Lip gloss poppin’ off, I’m lookin hella slim
In the Juicy suit, lookin’ hella cute
Little baby hairs, attitude is rude
I'm in the jersey dress, you know I'm never stressed
Side bun, name chain, lookin' hella blessed
I'm on my yellow ball, caramel the tone
Black pearl, latina, mira you 'ready no?

Boy, I'm gentle, baby
I'm your Baby Phat queen in a white Mercedes
In the white hooded fur lookin’ so so breezy
I mean, just look at me, you know they can't even take me

Brick city, new year, big moves, no fear
Big money, no care, I’m conceited, I swear
(Brick, brick, brick)
Brick city, new year, sixteen, my year
Seventeen, my year, I'ma do it every year
(Brick, brick, brick)
Brick city, new years, sixteen, my year
Seventeen, my year, I'ma do it every year",https://genius.com/Princess-nokia-brick-city-lyrics
Little Angel,A Girl Cried Red,2018.0,"Little boy with your glitter on, full of life and full of love
Tell a joke and I'd laugh along
Little boy with your glitter on, play a song and I’d sing along
Makeup done and your high heels on
And tell the world you didn’t give a fuck
No regrets doin' what you want
Give ‘em hell and you had your fun
And now you’re gone, and I miss you, friend
I’ll celebrate and I’ll play pretend
Because I know I will see you again

Little angel, what more else can I do
Little angel, there was so much to do

Golden boy with your golden hair, you ran around without a care
Your sister called and she needs you here
Golden boy with your golden hair, you ran around without a care
Your sister called and she needs you here
And we all miss you
We all miss you
God, we really miss you
We all miss you

Little angel, what more else can I do
Little angel, there was so much to do

Little boy with your glitter on, full of life and full of love
Tell a joke and I’d laugh along
Little boy with your glitter on, play a song and I’d sing along
Makeup done and your high heels on
And tell the world you didn’t give a fuck
No regret doing what you want
Give ‘em hell and you had your fun
And now you’re gone, and I miss you, friend
I’ll celebrate and I’ll play pretend
Because I know I will see you again",https://genius.com/Princess-nokia-little-angel-lyrics
Gross,Everything Sucks,2020.0,"Yeah, yeah, yeah, bitch, I'm gross (Bitch, I'm gross)
Yeah, I'm grosser then you hoes and it shows
I got stains on my teeth and my clothes (On my clothes)
I been sleep on the motherfucking floor
I been locked in the studio more
I been kicking my foot in the door
I been riding my wave to the core (Get it)
If you think you hate me, you gon' hate me more (What? What?)

All in my face like you know me
Bitches love beef like it's Kobe
New York, I am a OG
Everything 'bout me is holy
I am the last of the old me
I hear the rumors about me
I hear the people that doubt me
I think it's kind of arousing
I love the chatter that happens around me
Stick out my tongue like the people of Maori
Talking online, well, you are a coward
People see me and they already sour
I just got richer in less then an hour
No 50 Cent, but I got the power
Think that you smoking, but I got the louder
All of the boys want parts of my flowers
Rappers hit me up, I friend zone them all
I'm not the woman for your beck and call
I am a rapper, I'm not a groupie
I do campaigns, world tours, and the movies
Got every right in this world to be choosey
It's a new decade and I am blooming

Yeah, yeah, yeah, bitch, I'm gross (Bitch, I'm gross)
Yeah, I'm grosser then you hoes and it shows
I got stains on my teeth and my clothes (On my clothes)
I been sleep on the motherfucking floor
I been locked in the studio more
I been kicking my foot in the door
I been riding my wave to the core (Get it)
If you think you hate me, you gon' hate me more (What? What?)

This pussy hocus pocus
He want it but I'm focused
Plague with the locust
Parting waters like I'm Moses (Who?)
They say I am chosen
Baby, I'm a prophet
Got a lot of enemies
I keep garlic in my pocket
And if I'm being honest
I know you throwing evil
Put my name in the cauldron
But, I still can't see you
No, I do not fear you (On God)
I do not fear nothing (Oh, no)
God is my leader
I know the wrath is coming
Lemme call the corners (Go 'head)
Conquer all disorders
You be screaming bloody murder
While I drag you on the corner (Mmhm)
I'm fighting with my words
I think they call it spelling
I done called the Babalawo
The priestress and the reverend (That me, on me, on me)

Yeah, yeah, yeah, bitch, I'm gross (Bitch, I'm gross)
Yeah, I'm grosser then you hoes and it shows
I got stains on my teeth and my clothes (On my clothes)
I been sleep on the motherfucking floor
I been locked in the studio more
I been kicking my foot in the door
I been riding my wave to the core (Get it)
If you think you hate me, you gon' hate me more (What? What?)",https://genius.com/Princess-nokia-gross-lyrics
Cybiko,Metallic Butterfly (Mixtape Version),2014.0,"I'm the fantasy of reality
Click, click, click, do what I please
Hit me on my Sidekick, never been a side chick
Always been a wifey, never been a side bitch
Oh, it's a Princess ting
The age of 14, I was wearin' rings
Makin' Xanga things with my Dell PC
Memorizing codes was so amazing
HTML in my sleep
Binary codes, breakfast I eat
Poor and sexy girls are the dreams that I dream
And this is the life of 2014
Invisible cage of the MySpace age
Hooked on for hours, plays for plays
Digital rage is my digital sage
Digital junk go page for page

Confessions of a cyber girl
Escapin' out the Matrix world
It's a war and I'm winnin'
Let me live the life I did in the beginning
Confessions of a cyber girl
Escapin' out the Matrix world
It's a war and I'm winnin'
Let me live the life I did in the beginning
Let me live the life I did in the beginning
Let me live the life I did in the beginning
Let me live the life I did in the beginning
Let me live the life I did in the beginning
Let me live the life I did in the beginning
Let me live the life I did in the beginning

A little bitch, hella fuckin' weirdo
Awkward in the club and I whisper in your earlobe
Read my books, and I don't do drugs
Like a mother's love, I'm silly and disturbed
Thinking too much, and I live in the Matrix
Understand the truth and I see different phases
Dimensions that ain't even mentioned
I could fly to space anytime, no question
If I try hard, I can move it with my mind
Finna meditate until I gravitate
Get my living state into a higher place
Stay the fuck up and I think it's true
I'm still a little brat, sayin' ""Don't tell me what to do""
Boo, this is just my life
And what you went through, I been through it twice
I'm still doin' nice, I'll be the damn statistic

Givin' it my all, it's a gamble, I'ma risk it
(Gamble, I'ma risk it, gamble, I'ma risk it)
Givin' it my all, it's a gamble, I'ma risk it
(Gamble, I'ma risk it, gamble, I'ma risk it
Gamble, I'ma risk it, gamble, I'ma risk it
Gamble, I'ma risk it, gamble, I'ma risk it
Gamble, I'ma risk it, gamble, I'ma risk it
Gamble, I'ma risk it, gamble, I'ma risk it
Gamble, I'ma risk it, gamble, I'ma risk it
Gamble, I'ma risk it, gamble, I'ma risk it
Gamble, I'ma risk it, gamble, I'ma risk it)

Confessions of a cyber girl
Escapin' out the Matrix world
It's a war and I'm winnin'
Let me live the life I did in the beginning
Confessions of a cyber girl
Escapin' out the Matrix world
It's a war and I'm winnin'
Let me live the life I did in the beginning
Let me live the life I did in the beginning
Let me live the life I did in the beginning
Let me live the life I did in the beginning
Let me live the life I did in the beginning
Let me live the life I did in the beginning
Let me live the life I did in the beginning",https://genius.com/Princess-nokia-cybiko-lyrics
Harley Quinn,Everything Sucks,2020.0,"(One, two, three, go!)

Welcome to the circus, I'm causing a disturbance
I'm twisted in the head, I'm a little bit annoying
I'm gross, I'm sick, I'm too legit to quit
Got bitches showing tits and boys moshing in the pit
It's a rocket in my pocket and I'm not gonna stop it
And if I see a target guaranteed that I'ma knock it, bitch
Bitch, bitch
Bitch, bitch (Yeah, yeah)
My bitches came to rage, we do this every day
We're not in the same pace, so just stay up in your lane, bitch

Harley Quinn
Bitch, I've been
Goin' in
Yeah, yeah

Who that? Who that? Who that?
The bitch is back
Who that? Who that? Who that?
I will attack
Who that? Who that? Who that?
The bitch is back
Who that? Who that? Who that?
I will attack

I'm going crazy and dumb, I'm disrespectful as fuck
I heard they mad and they angry, their daddy ain't showed 'em love
I don't give no fucks, matter fact, not two
I'm disrespectful, offensive, and I've got nothing to prove
Fuck you, and fuck you
And fuck you, fuck you, we fuck you
Fuck you, fuck you
Fuck you, fuck you, we fuck you

Fuck your mama and daddy
Fuck your siblings too
Fuck your auntie and uncle
We fuck your cousins and crew
Fuck your ugly ass baby
Fuck these bitches that's hatin'
Fuck these stupid ass trolls
They don't wanna see me famous

Who that? Who that? Who that?
The bitch is back
Who that? Who that? Who that?
I will attack
Who that? Who that? Who that?
The bitch is back
Who that? Who that? Who that?
I will attack

Harley Quinn
Bitch, I've been
Goin' in
Yeah, yeah
Harley Quinn
Bitch, I've been
Goin' in
Yeah, y—",https://genius.com/Princess-nokia-harley-quinn-lyrics
Just a Kid,Everything Sucks,2020.0,"Got the beat by Powers and we just made a banger

Now damn, I'm just a kid
Thinking 'bout everything I ever done did
Things I wanna do and things I've done lived
Everything slow, but I really wanna live, now say
Damn, I'm just a kid
Thinking 'bout everything I wanna do and did
Thinking 'bout if I go far or go big
Thinking 'bout if I go dumb or go big

I'm a child just like no other
When I get scared I hide under covers
On a sad day, man, I really miss my mother
Only get one and you never get another
When I was a child, I was barely loved
Mommy passed away and my daddy was on drugs
Granny took me in with her 5 kids
And up until 8, that's where I always live
Granny got sick and then she passed away
And biggest heartbreak that I ever did take
Things were so good, man, things were so great
And then in one day, my whole life had changed
Suddenly, I'm out here adopted
No one from my family gave me the option
To live with my family or someone familiar
Gave me away to a person with hidden agendas
Passed to stranger who needed the money
She was a psycho, she never loved me
Damn, my whole life, everyone had to fuck me
Wow, I guess I'm just lucky

Now damn, I'm just a kid
Thinking 'bout everything I ever done did
Things I wanna do and things I've done lived
Everything slow, but I really wanna live, now say
Damn, I'm just a kid
Thinking 'bout everything I wanna do and did
Thinking 'bout if I go far or go big
Thinking 'bout if I go dumb or go big

I never mattered, nobody ever cared
Gave me to strangers who claimed me as theirs
I was abused and I was aware
She told me to lie and say that I had fell
Damn, I got marks on my face
Disassociate and my thoughts go erased
Numb in my soul, I feel so out of place
Long way from home, I need out of this place
I'm the sad kid and the bad kid
I'm a disappointment and I'm average
Never make her proud, all I do is damage
Called me a burden, but she took advantage

Now damn, I'm just a kid
Thinking 'bout everything I ever done did
Things I wanna do and things I've done lived
Everything slow, but I really wanna live, now say
Damn, I'm just a kid
Thinking 'bout everything I wanna do and did
Thinking 'bout if I go far or go big
Thinking 'bout if I go dumb or go big

She said she loved me, she didn't like me
I wasn't special and I wasn't likely
Wasn't that cute, no one would want me
Nobody cared, in that, I was forgotten
Left as an orphan, no other options
She hit me again and I want her to stop it
The place of my soul has grown microscopic
They take me on weekends and act like they care
I lived in fear, I was young, I was scared
The scars of my childhood have followed me here
The patterns repeat and they come back right here
The patterns repeat and they come back right here",https://genius.com/Princess-nokia-just-a-kid-lyrics
