title,album,year,lyrics,urls
The Rage of Roemello,A Dream Deferred,2012.0,"The rage of Roemello
My name tryna echo
Staring so long I swear the page saying hello
I'm hearing these songs but tryna change up the metro
It feel like he'ron the way I'm straining wit the let go
The rage of it all, I swear to God

Wrote it to make you call me dope man, dope man
Got y'all in tune but that tune got me moved so if I choose to let this go and
Bid this shit adieu, and your listening improves
At least there's packages left if you living in that mood
See we attract to the stretch, everything should flip in twos
And if not, we should stop, like we did all we could do
So I'm on my gracefully bow, and on my way to that bow
I leave it up to you to perform my grace for me now
I mean, hands folded, maybe the plans folded
Wasn't supposed to love it, they say that you can't show it
I mean, easier spoken of, see where this goes for us
Say its real or at least hope that the motive was
Never had a second thought, never asked, never once
Knee deep in it, fuck it, we ain't leaving it
Until it all goes and we go to get to reach for it
And shit is smoke and mirrors and we swinging tryna see through it
Stick and move, I'm liable to switch & shoot
Like I ain't here to play with this fog, let's get this through
And I ain't here to stay with these odds, so when in tune
I'm either tryna even these odds or hit a new
As far as I can remember, we'd idolize thru the winter
And rather be in the 4 like when Stoudemire's at center
I mean, GS 400's is all we wanted
However we do it, long as we done it, the rage of Roemello

Listening to Gloria's youngest, had us all in the running
To wanna be what they told us we wasn't
Like all we need is to kno if we running, its not in place
Cuz ambition is by the day, word to Wale
I mean, same scenery we was tryna believe to be
Had us counting wins before we had us an in
And sleeping is paper thin, no wonder why we don't do it much
Sheets barely used, tell em all of this is new to us, right?
And every dream that I dream is littered
With the fiends that I done seen while tryna leave these visions
And so to clear it, I wrote to wanna be like him wit it
I hope he hear it, cuz word to 
Chi Ali we did it
I hope he hear it, word to this blue Yank'
100 grey bottoms, these shits never lose rank
And agreeing that heavy is the fade under it, but for the love of it
They look to you to carry it and everything its bundled with
Sunrise open your eyes, no surprise
Made it off of living for doe or die
Now you in the back of the coupe, glaring, half of the stoop staring
To the point where you can give away packs like Snoop Pearson
Think about it, yea, THAT kinda rich
Sing songs for black hoodies and black violins, I mean
The swan song for the evening
Forgive me in advance for your grievings, the rage of Roemello",https://genius.com/Skyzoo-the-rage-of-roemello-lyrics
Finesse Everything,Peddler Themes,2017.0,"I sip the henny white, listen and write and share knowledge
And pour more cause I got a case in the spare closet
My talk walks all thru the tape of who sharing product
44s all on they waist, they here wilding
Their corridors turned to a range with spare mileage
The speakers in the door upgrade, you hear the pockets
Alhamdulillah all in my tape, I talk Godish
But still talk bitches and Bape and support thotting
Contradictions, and grew up with a couple pots to piss in
My parents was split so I was drifting
You drift to whatever you seen before, I drift over letters like Ouija boards
You thinking hasbro I'm thinking the back door, boarded when the fear come
And chris and snoop with a nail gun
Fear none, hear none worth fear being involved
They fear me like I'm Sheila Salaam
Seen it all, I mean, thank God for bank cards and crash readers
Knick game, all black sneakers
Yellow chain, floor seats, cameras on me and Bay Frazier
My Jordan 3s might break up a lay up
Still flourish like I'm starving, shuttlesworth stardom
I'm usually in the garden I ain't too hard to find
And know whenever you carving mine
A double entendre's a two part rewind, bet I finesse everything

Bet I finesse everything
Bet I finesse everything
Bet I finesse everything
Bet I finesse everything
Bet I finesse everything
Bet I finesse everything
Bet I finesse everything
Bet I finesse everything

(Who's world is this?)
Don't matter I can finesse it
'cause if they can't answer you that they outta the question
And if they can't hand you it back stop suggesting
Either that or they can get back to finding the exit
Sitting in the front of the plane
Ghostwriting for pick a name and another name, one in the same
And my OGs would give us jewelry under their rap sheet
And me and my wisdom blow jewelry money in patsys
Wisdom be leaking out my grapefruit troop
But it don't break thru to you until that pay shoot thru
'cause know that if I wasn't writing it for them you seen em sketch me
If I tell it then y'all bet it, I'm Ian Begley
Rap shit started at 9 on class walks
And now it's me and another 9 on the blackboard, ask for him
He can rhyme his ass off, he can rhyme off his ass
And Lex Steele it how he slide in the stash
Meanwhile me and A' debating on 
early Nas
And talking 'bout how we first linked like calling cards
Back when he called me over off the gold on my Nikes
Regretted letting me play, my crossover was nice
Chicken wings, fried rice like I'm still 16
And I don't get called for features cause I kill 16s
That's word to my man Joell, this rap shit's a bunch of ""oh wells""
Fuck whatever I don't sell, bet I finesse everything",https://genius.com/Skyzoo-finesse-everything-lyrics
The Opener,The Salvation,2009.0,"Jesus is the savior, tell him what you want
Call him on the main line, tell him what you want
Jesus is the savior, tell him what you want
What you want, what you want, what you want
If you want salvation, tell him what you want
Call him on the main line, tell him what you want
If you want salvation, tell him what you want
What you want, what you want, what you want

Twenty-four/seven, three sixty-five
Twenty-five years, embedded in these lines
If I push the pen past the margin on the side
You can feel the words and every part of 'em is I
Twenty-four/seven, three sixty-five
Twenty-five years, embedded in these lines
If I push the pen past the margin on the side
You can feel the words and every part of 'em is I
(Salvation)

So I push it to the far right
The bare minimum, overseein the far sight
I'm clear into 'em, no belief in the far height
Conversatin' with Lucifer under God's light
Low when I'm kickin it, caught myself whisperin
Coverin my mouth, so if you look you can't figure it
Knowin that he read it but I still be pretendin it
Knowin I regret it but I still put my fist in it
Waited on a long run
From the same places that they all from
First name basis with the wrong one
Still by the end of it, I back and forth wonder who be listenin
I don't second guess it, I'm just visionin
Pardon my inquisitive
Saw the other hand and wanted the upper hand but ain't agree with the grip on it
You see the hardest thing I ever had to do
Was determine what I could and what I couldn't tell to you
If it's worth it, then I'm good and I'm good to get it through
But if it's not, then I'm just workin to pursue a pedestal
And off top, I could show 'em the end reel
It's hard to really chill or sit still
Commit to the page
I write a rhyme, sometimes I won't finish for days
Cause before I get to finish, all the imagery change
But the game is the same along with the Bodeg'
Next to the liquor store where all of the hope lays
I mean, the Arthur Agees could bypass the baggies
But the common goal is drop hoops in broad day
So you play the hallway, with your heart on your sleeve
And the walls is like a car to the beat, follow leads
I mean, the temp got you walkin before you get up
And the wrath of it'll put you anywhere that you want
You see from behind the crowd
And even your dreams get to see from behind the clouds
But speakin is not allowed
Mama said peace when she see that you out of bounds
Her sight's good but her believin is by the ground
And so she kneeled down, hands folded in unison
Her cares in the air, tryin to follow the truth in it
+Tears For Fears+ and +The World+ He +Rulin+ In
Burner under the pillow, you don't sleep if you usin it
I call it like I see it
And if ever the call fails, I redial, call and hope you receive it
By unanimous decision, all of 'em's tellin me
That it's me that could paint true Brooklyn like Shelton Lee
I ain't aim to make a classic, I aim to state what happens
And if the outcome gets praised, then blame the havoc
If the outcome gets praised, then blame the tragic
Cause everything I pen is a mirror of your reactions
And everywhere I've been is mirrored within the absence
Where they four five through the static
They say that the habits is head strong
And the more that it's pressed on
The deeper you indulge and I could be dead wrong
But if I end up gettin any of this right
There shouldn't be anything left to write, right? So",https://genius.com/Skyzoo-the-opener-lyrics
Could’ve Struck The Lotto,The Great Debater,2011.0,"Killin' your idols one word at a time
When I was killin y'alls, I was also murderin' mine
Indeed I'm all it be, I squeeze accordingly
If a fave should get caught in between then all it means
Is meaning was never enough for me to wanna wish through
Fists full of dollars, ignorance is so blissful
Every part of me just wanna see how much the fists do
If this be a problem then I'm missing all the signals
You could miss me with the mistakes
Cause my realities is the meaning of missed plates
Kitchen tables need decorating, I'm decorated
The china be there but all the feelings is misplaced
And this may lead to a decay of beautiful sorts
If I could race through all the traits and the beautiful Porsche
Then I'll erase through the change they refuse to restore
And pitfalls in the poetry, truthfully yours
And monologues at a dollar store, invited to ride along
Parental advisory, all of it is how you thought
All that we In Search Of is to Fly Or Die
So to have you Seeing Sounds that's inside the Sky
Is Nothing I suppose, so if I was alone
Then them sounds that you seeing is all that I really know

For the all in the mall
And the rush to follow
That buck that bought a bottle
Could've struck the lotto
Say I'm on what I'm on trying to jump tomorrow
And I bought that boy a bottle
Could've struck the lotto, honestly

So that's 300 tickets that we could be comin' in with
That spade shit is pricey but we in love with the livin'
We in love with the life, lust, the pursuit
Promise not to forget how to adjust to the stoop
But if I'm away from whatever is made from
Know that I betrayed none, forever remained one
Forever embedded in the better of days come
The header on page one, my sketch is 
a ? run
Tootin' my own horn'll level the page some
And then the level gets lowered and I refrain from
Pennin' what the norm does, everything the norm was
Should've been the past but the future's like the norm's son
Tryna plan B that, pills in the sauce
Hope they smart enough to eat that and dumb enough to starve
So to summarize it all, this is more than what it seems
Fully loaded clouds, corner of your dreams
It's nothing I suppose, so if I was alone
Then them sounds that you seeing is all that I really know",https://genius.com/Skyzoo-couldve-struck-the-lotto-lyrics
Forever in a Day,In Celebration of Us,2018.0,"Infinitely caught in a weave of, 
Tryna dip around what they breed before you leave or, 
Climbing in and out of a scene they call elite or, 
Lining up whoever's between the world and me or, 
Me and the world, whichever first when pronouncing it, 
Taught us ""get enough for us all if you come out with it"", 
The background eat till it's gone if you all around with it, 
Tryna get a piece off the corner like quarter ouncing it, 
Caught up in the bounce of it, where loyalty is all that it oughta’ be
Like if I was to call and see if you down for it, 
Word to a dresser drawer burying what was found in it, 
Truly forever yours ever more if you doubted it, 
Ever more like more than you was ever surrounded with, 
To get involved makes you apart of the sound of it, 
No regret at the door and no announcing it, 
Fucking with whatever you about with it 

Forever in a day, forever in a day, 
100 on the line, and never will it stray, 
100 on the line, and never will it stray, 
100 on the line, however we should aim
Forever in a day

Forever ever, forever ever, 
With short change measures, in all day leathers, 
And honor's like forever ever, forever ever, 
Your alibi know to keep it Andre clever, 
And being on mean we ignored what all they left us, 
And it starts out being as on as Rae Sremmurd, 
Bare minimum, the feeling of ceilings that never left us, 
But the chicken box will kick off the top for whatever weather, 
For the win of it, corner get loud, they caught wind of it, 
And everybody caught in the sound that you was whispering, 
Send something flying around to help them get in it, 
Or how that's still yours if your name ain't on the end of it, 
Loyalty is priceless, jewelry isn't, 
Give or take, depending on what type of jewelry you're given, 
In a space, where the script is stuck to like a pivot, 
If you knew us then you knew we was with it when it’s 
Forever in a day 

Forever in a day, forever in a day, 
100 on the line, and never will it stray, 
100 on the line, and never will it stray, 
100 on the line, however we should aim
Forever in a day

Broad day like jumping out in the way 
When one is jumping up outta the front and finding it's aim, 
Or, divying a bag with who you're beside every day 
And splitting points like you dotted your name, 
'cause know that all of these green lives that used to be here, 
Matter like these black lives that these blue lives shoot outta fear, 
So all these green lives used over here, 
Was 'posed to set it where never would a second set of shooters appear, 
The first set is just the usual here, 
It makes sense as much as it kinda don't but that's new to who, where?, 
The prestige, of feeling like you're who they let breathe, 
Due to a bag that you shouldn't have, it just seems, 
Like more than they’re letting on to, 
Finger fucking money resorts to thinking that it adores you, 
Whatever you make of it, make it where it goes around with you, 
In light of where all these go arounds put you, forever in a day",https://genius.com/Skyzoo-forever-in-a-day-lyrics
The Definitive Prayer,The Great Debater,2011.0,"As soon as the drum rolls I’m picturing unloads
I’m picturing one show that gives them an unclosed
Description of one grown, and witnessing son grown
“That boy good, and to the greats, he the one chose”
As soon as the horns lift, I picture the cautious
Becoming beyond it from fear of the lost sense
I’m picturing all them that said he was awesome
Retracting their talking for fear an endorsement
May seal up their coffin, hammer to the nail
Metal to metal but he’s just planning to prevail
Ghetto to ghetto they say he handle what they rail
Echo the echoes, and if he handle what they rail
He’s never been settled so if your handling is frail
He let go the legos and tell you “catch ‘em if you will”
You catch like D-Will, well and good, have you riding for your team
Until you find out you traded off the bottom of your screen
Like “let me find out”, gave it every line of what I be
Until the time’s out, and this shit is just not what it should be
So every Glock that ever leans and every shot that ever leaves
From off the top of where that beam is red dotting where you breathe
Is in a box apparently waiting out to hear from me
They wait aloud to hear the screams and they about whatever needs
And their hearing’s well and good so if they think they heard a call
They tryna hop outta that box and make you sing the words along
Serenades warrant hearing aids, ringing murder ones
Blue and whites move alike if they should think they heard a drum
And they justifying justice, pulling triggers for the cause
I got a big enough applause off the strength of the allure
Saying this is what it was, 
well if this is what becomes
Then I became what they paint as the picture never hung
I became what they made as a glimpse of what was won
The W’s at The W, spilling off the hum
The one to do what they wanna do, in it for the run
’Til the tape’s broke in half and I’m praised off of laps
Call it A-side B-side, tape broke in half
And my A-side B-side was made to be exact
No 40 dollar replicas but all of my etcetera’s
Exemplified the inner sides of all that my forever does
Live or die, get us by, bigger signs, better runs
Bigger rides, get inside, visualize what never comes
Minimized inner highs, Phyllis Hy’, level one
Staring at a page and a pill with a heavy tongue
Say that I amaze but I still feel forever young
Heavy is the fade that should fill that New Era son
Imagine it in front of you, like packages that wanna move
So much so that they react without you running to
So running towards is all that you in it for
All the stones in that crown is all that it really was
All them stones on the ground is all that you penning off
From the pitching to the ditching, its more than they get to pump
So chorus them for the trunk, meaning sing for the drive
I’m still the peddlers theme, they say I sing for the drive
Now bring in the reprise, and let the beat breathe
I’ll let you comb through the poem and what’s beneath these
I’m on my throne, Pewter Foams 
and the seat reads
That “you should know you alone is what the need needs”
So on the low I know the code & how to debrief
But on the low I know the dough is where belief be
So all of my encouragement is pointed on hurrying
’Cause getting it don’t mean that you got it, so we gonn’ hurry this
And get it until each of us got it, you say you listening
I hope that when I speak in these pockets you get the gist of it
They open off of me in them boxes where they be signaling
Like “we see them a block away, so put all of that stock away!”
I come through, windows off, still knocking Rae’
The Hilfiger version, and I feel I’m in its purpose
So I wheeled ‘em where the words is, pedal to the predicate
For the love of money baby, decimals is delicate
For the love of money baby, settling we never did
They can’t fuck with where this effort is
See if I told you everything I ever wanted to say
You’d either nobel prize me or scurry away
And that nobel prize seat?, I’m one up away
“A Dream Deferred” will chauffeur me to one of them thangs
Either a plaque or a stat or a ribbon that’s attached
To a gold plated Alfred, in-scripted through the back
Homey this shit is a wrap, if you was bitching in the past
The future is more looted, baby get it how you ask
The truest to walk through it, so whoever yall spewing
To be that guy back slides, I fountain pen baptize
The same shit that I was with, I’m still in that mind
So never mind who on that side",https://genius.com/Skyzoo-the-definitive-prayer-lyrics
Under Pressure,The Salvation,2009.0,"If you see me walking down the street
And I start to cry, each time we meet
Walk on byyyyy

To my other half
To my other half, huh
 (Sample)
To my other half or what used to be, what I used to know
How it used to seem and however it used to go
Never foresaw change as an all and all
But now I'm all for change, baby call this off (if you see me)
See my intentions were good with tryin to be in this
But I tried seein it and couldn't find me in it
And I was IDin it, lookin for a reason to fall back
But still daydreamin of call backs (if you see me)
I guess it was denial, I gave up the fight
Hopin you could downplay the down plays of my life
I sang ""job well done"", holdin banners in the stands
'Til you switched, now when I think of handin you a hand (if you see me)
I get, a little less enthused
Cause everything should be the same if we've been true
But everything is rearranged and I'm lookin for a light switch
Wishin that I never had to write this
Knowin that (if you see me)
 - w/ ad libs
I'm tryin to be the best man that I can
But you fail to realize where I stand
And I'm, under pressure, the last thing I need
Is you tellin me, we can no longer be
Ma, I'm tryin to be the best man that I can
But you fail to realize where I stand
And I'm, under pressure and everything I do
I do for us two but you got me tryin to move
 (Sample)
They say you fear what you don't understand, try to bury it
And criticize the chances that you don't ever get
So from the outside scopin in
They look towards you to provide the hope for them (if you see me)
And they bein your friends, hate me yet again
But it's cool, cause none of them made me in the end
But as for you, I put you on a higher plane
So high it made it easier to fly away (if you see me)
See I ain't use no one opinion about you to out you
Never entertained a reason to ever doubt you
But leave it up to you to play follow along
They mad cause they don't have and you droppin it off (if you see me)
And the same ones callin you, sayin what you ought to do
Wasn't tryin to help you with everything that you thought you knew
And I felt for you, wishin I could be there
But no matter what I told you, you never really cared and (if you see me)
 - w/ ad libs
I'm tryin to be the best man that I can
But they fail to realize where I stand
And I'm, under pressure, the last thing I need
Is them tellin me, we can no longer be
Ma, I'm tryin to be the best man that I can
But they fail to realize where I stand
And I'm, under pressure and everything I do
I do for us two but they got me tryin to move
 (Sample)
He say, she say, they say, we say
Pointin fingers at anybody to earn leeway
All the things you didn't know but might've wondered
I was tryin to find an excuse to fight 'em under (if you see me)
I spent more time replyin instead of tryin
But could've spend half of that time and stopped lyin
Lyin to myself and tellin me what I wanna hear
Hopin it could erase the shit I've done in there (if you see me)
Heartbeat, runnin scared, outside, freezer box
Know I got the perfect but I still wanted to see what I could pull
So it was all tug a war
Missed calls replaced the rose petal covered floors (if you see me)
Miss Wrong, you was right and you deserve different
And yeah I work different but know that my hurt isn't
So no matter the weight, I'm willin to deal with it
And hopefully we still with it (if you see me)
 - w/ ad libs
Cause I'm just really tryin to be the best man that I can
But I failed to realize where I stand
And I'm, under pressure, the last thing I need
Is me tellin me, we can no longer be
Ma, I'm tryin to be the best man that I can
But I failed to realize where I stand
And I'm, under pressure and everything I do
I do for us two but I got me tryin to move
 (Sample)
(If you see me)
To my other half
To my other half
To my other half
To my other half
(If you see me)
(If you see me)",https://genius.com/Skyzoo-under-pressure-lyrics
