title,album,year,lyrics,urls
Along The Way,The Penny Freestyle Series Pt 2,2013.0,"The allure of just saying no more
Like I done said the most and if you waited too long
Then that's you, that's on you and the time that's in the air
But if you need what it be the rewind button is there
I tried rushing you here but you was kinda content
And now shit's getting thick and its you that's climbing the fence
I did it from day one, I never took off a night
I never shook off the light, in the midst of a great run
I told you what I was on and showed you double or nothing
The ones who really heard are the ones who cut the discussion
Like ""nah, Sky got it, there's nothing for him to prove
If he ever laced 'em up you'd be running outta ya shoes""
You being whoever,the name of them doesn't matter
They know I'm not for play, I'm raising them up as rappers
But the anger and the sorrow mixed up leads to mistrust
And then it gets tough to say I'm a fucking rapper
2 for 2 with the classics and got a 3rd coming
And I ain't drop one verse that didn't earth something
Even the throw always was shit you would go to play
And say that the only thing beside it that you kno is jay
The day ones, all of them know how me do
I'm pretty much Earl Manigault but no needles
So when you talking Kareem or Wilt or Connie Hawk
Remember who they was modeling when they stepped on the court
Stand for the city?, I done stood forever
Every record was Brooklyn bridge overlooking together
Every record was Southside or the X or Harlem
Or the islands, I was about 'em so I'm begging your pardon
But lets say I went and did it, brought him straight to the work
And at the end was an arrow to point him straight to a hearse
Would the power circle of the city stand tall
And recognize the real and how they handle support?
Doubt it, and I can jump for the bait that he leaves
I'm NY to the death when they was changing they teams
But they opened up the doors for him to say what he please
It don't help that the real king went and gave him the keys
Doing verses on a remix, shit why wouldn't he think he's it?
I would think the same with all them reach ins
Not a shot it's a drop of honesty
And if I pour the whole glass that's more that you gotta clean
So I'll leave it there and you know where I stand
Talking music for my friends and one love to my fans
So I'll leave it there and you know where I stand
Talking music for my friends and one love to my fans
Hook:
If you're with us along the way
Then act like you was with us along the way
(2x)",https://genius.com/Skyzoo-along-the-way-lyrics
Meeting the Presidents,UnKnown,UnKnown,"Who wanna bet us that we don’t touch lettuce
Stack cheddar forever
No treachery till they get to us
Doing what’s best for us is far today
But tomorrow will be tomorrow and tomorrow can wait
We need it now, need a sound that we can borrow or chase
To be around when we around it’s solely honest to trees
And you call it how you see it, we call it awake
Till we ignore the law being all in our face
Shit, you all for the taste and we wanted the recipe
Learn it and burn it before they get to reach
You feel me? Jealousy and slandered eyes wanted to kill me
Or at least spoke like it but no one approached like it
So yeah, and they stressin’ the air reason for them
But it’s more soul, my Morse code build it with them
We talk law and wardrobe built for the win
And the win ‘cause confetti could fall at any event
Hopes tell you get in, dreams tell you to stay and wow
If it all should fall apart before you take a bow
Then may the day be living proof that you made away
My O1 was a Sean Carter 88
I’m all for presidents to represent me
I’m all for presidents to represent me
I’m all for presidents to represent me
I’m all for dead fucking presidents to represent me
I’m all for presidents to represent me
I’m all for presidents to represent me
I’m all for presidents to represent me
And it’s dead fucking presidents I’m tryna meet
I want money like Cosby, who wouldn’t?
Or at least Raven Symone the way Raven Symone was cooking
May have been wrong or I may have mistook it
But my attention is to talk to you through song and sing how we looking
They showed us everything but looks deceive
They made a world of pain, a world where only crooks could breathe
Then they dare us to take a breath and they dare us to make a left
When the right after the lights is what they pushed beneath
You see? Shit I’m involved with got me pins and needles
‘Cause if this pin don’t push the needle where I need to it’ll be pens that bleed you
I’m here to tell, shorty, it ain’t all swell
There’s heaven then there’s hell to catch you when you fell, shorty
We all fall, it’s just about where we landing, they heroes on all fours like they forgot how to stand
The ones who stood all be the ones that raised us
Forgive us for being stubborn, the industry couldn’t change us
And well, if that should hinder us, I’m tryna get the digit up
And we’ll just take it back to what we know and what the ceiling does
Conflicts correspondent with my enemy, representing infinity for presidencies
You know
I’m all for presidents to represent me
I’m all for presidents to represent me
I’m all for presidents to represent me
I’m all for dead fucking presidents to represent me
I’m all for presidents to represent me
I’m all for presidents to represent me
I’m all for presidents to represent me
And it’s dead fucking presidents I’m tryna meet",https://genius.com/Skyzoo-meeting-the-presidents-lyrics
Know That Cash Rules,Theo vs J.J. (Dreams vs. Reality),2012.0,"Yea
It goes 1 for you
1 for me
2 for you
1-2 for me
You know how the rest go
Mad because I know that cash rules

Flash jewels
How they mad because I know that 
cash rules
Everything around me
Never let me down see
Never did
Tell em' to forever get from round me
If they ain't bout a win
Okay
Flash jewels
How they mad because I know that cash rules
Everything around me
Never let me down see
Never did
Tell em' to forever get from round me
If they ain't countin' in

Okay
Flash jewels
How they mad cause I know that the cash rules
We grew up on that tune
And you know me and that groove
I will seat it for what it gave us
And took the wheel when they
Stopped believing that money made us
Cause till they pay us
I promise to make em' fuckin hate us
Love us later but pay us now and be done with favors
Olympians and black fistin'
How the running made us
And bar none so clearly they wanna running mate us
Campaign for this bread
So when they underplayed us
My jewelry on so you can't deny me on what they gave us
Coupe dreaming that turns into coupe's leaning
Like God
Play the odds and I promise they shooting evens
And the rims got us hurrying
Looking for 24's
Like the 14th and the 30th
Damn I threw that high
My bad
I'm in the zone where they stand and shoot ya ride
And push you out of your doors
And then plan ya suicide
Double meaning ha


Condominium dreams and Range Rover fantasies
Can't be realized if you under ya canopy
From youngin I planned to be
Everything ya optic viewing
The big man in the center
That never got the Ewing's
That's why I cop the new ones in twosomes and foursomes
Rock em' once then give em' to an orphan
Shit is awesome
They call it flossin
I call it paying forward
For all the days of food stamps
I had to pay the store with
Notorious Tor been on tour
I tore it for 20 thousand
Used to talk in front of my building nigga
Public housing
In the Republic of China
I'm out in Beijing browsing
Far from my Banana Republic styling
The moral value
What the Lord allow you
Is what you should show of
Cause these niggas you liking on Facebook will show you no love
And all I know of
Is how to act cool
Blast tools at wack dudes
Rapping that fast food
Sky school em",https://genius.com/Skyzoo-know-that-cash-rules-lyrics
Kitchen Table,Live From the Tape Deck,2010.0,"Vowed to never live on my knees
Never beg, I'm never fed, off of 'gimme' or 'please'
I never bled off of crawlin'
So if I should bleed it's from my hands dry wallin'
Holdin' this shit is me
Every wall that I installed, every entrance you see
I drew it all and through it all, up to just what it be
Knew it all, true to all, movin' on, true to form
Forgiveness is at the end and I got endings to weave
Attaching 'em where they meet at
Back to where my lean at
Dreams got wings but they clippin' 'em where they breathe at
So fuck tryin' to sing I'm tryin' to swing where the seat's at
And know that anything that I bring, I'm tryin' to read that
I try to fight a feelin' but the feeling subsides
And the high that you've been given when you get to provide
Is to find the ambition that you wish to revive
Live and die, but while you livin', keep the kitchen in mind

And remember, the place mats is laid where they should be at
And everybody made they way to where they seats at
Feel like all eyes on me from how they need that
Can't be mad at 'em cause here is where they eat at
So me, I'm tryin' to decorate the kitchen table
And put enough around for everyone of them mouths
I mean, I'm just tryin' to decorate the kitchen table
And put enough around for everyone sittin' down
I mean...

The process of providin' and tryin' to find it
And words passin' the margin and contemplating consignment
And circle backwards and forwards and fallin' for the reminder
Then stressin' over these plates and the utensils that's beside 'em
You countin' three times and hopin' you counted wrong
Till all of the count is gone
And all that you counted on ain't on the table
And you was suppose to make sure that was decent
And now all this decorating is needed
Never waited to see it cause ain't nobody waitin' to be seated
And they ain't tryin' to change up how they eatin'
Man of the house entails bringin' home anything but a reason
Cause a reason can't clear away the grievance
So fuck all that
Before departin' I'll turn into 
G. Garvin
As long as the plate is straight I can deal with the deeper margins
Long as I'm 808 I can deal with being a target
Long as we ate today you can call it what you call it

But remember, the place mats is laid where they should be at
And everybody made they way to where they seats at
Feel like all eyes on me from how they need that
Can't be mad at 'em cause here is where they eat at
So me, I'm tryin' to decorate the kitchen table
And put enough around for everyone of them mouths
I mean, I'm just tryin' to decorate the kitchen table
And put enough around for everyone sittin' down
And remember, the place mats is laid where they should be at
And everybody made they way to where they seats at
Feel like all eyes on me from how they need that
Can't be mad at 'em cause here is where they eat at
So me, I'm tryin' to decorate the kitchen table
And put enough around for everyone of them mouths
I mean, I'm just tryin' to decorate the kitchen table
And put enough around for everyone sittin' down
I mean...",https://genius.com/Skyzoo-kitchen-table-lyrics
Let It Bang,The City’s Favorite,2007.0,"Yeah
Y'know what it is
SK
With 9th Wonder on the beat
Elliot Ness..
Custom Made, Bad Boy collabo (9th Wonder!)
We all about the cash flow

The bottom line is, me and mine are solidified
You little dudes run along, go and get a grind
I rock rubber bands, but not for fashion
I keep 'em cause I'm literally stacking
And I don't fuck with Visa or plastic, I just pull out a 
And wrap it with elastic, pillowcase stash it
Spit straight acid, the stars is lookin' in
I sit you on your ass, like your father should've did
Ladies and Gentlemen it's the world renowned
The city's favorite hustler I  up your town
Dude keep a bad one shot, wearing her out
Her deep throat so mean, she can't hear in her mouth???
Lot of clones out for the throne, that's trying to be me
Call this a mean sixteen, I call it easy
SK and Elliot Ness, the George Jefferson
Strollin' a hundred miles ahead of the rest
So fuck running...

From corner to corner, state to state
City to city, play this 'till you break the tape
Now let it bang worldwide, let it bang (Hey yo!)
Now let it bang worldwide, let it bang (Hey yo!)
Yeah

Two thousand and five version of the great George ??
Iceman with the nice tan, see me in person
So imperfect, spit when the shit wasn't worth it
Gang way deeper than what people see on the surface
And that gat, small on my back, is for a purpose
Them niggas tryn' run up on National Self Service
I'll never be a slave or servant to any man
I'm ridin' up slow and I'm letting the semi blam
Damn, another dead body on my belt
In a land down under where your mommy can't help
You behind on the rent? I'm something like a pimp
I grind overtime and bought the landlord a whip
Tales from the crib
, the bl* is on my hip
Black bulletproof vest, a book bag full of clips
That's deep shit, deeper than deep six
Deep as the bottomless pit, and even the abyss
Shit...


(Skyzoo)
I run the pen on the paper, on the strength of the way that the drums knock
I write whatever I feel, regardless if it gets me a deal
While these wannabes claiming they dumb hot
I treat it like him and him, you only get one shot
And if you spit one line, saying you slum rock
I'm walking away, and if you not say ""son stop""
I don't need that, and you ain't ever seen that
You need to try being a fan, and relax
(Elliot Ness)
I can tell when the cops is looking, crack heads
Smell what the block is cooking, and which rock they pushing
""off white"", strips stay open all night
Long like Lionel, got clientele
When my team surface, the fiends purchase
Run up in your crib, and rob all your workers
I ain't trying to get money, selling dummies
The only time y'all make the paper is the funnies",https://genius.com/Skyzoo-let-it-bang-lyrics
Mirror Mirror,Cloud 9: The 3 Day High,2006.0,"I figured before we close the curtains for the night
We end it off like this, woo!

Mirror, mirror, hanging on the wizz-all
These muthafuckas got no heart at izz-all
Copycatting a dude cuz they don't wanna fizzle
Flattered by your bitting but get off ma bizzos
Mirror, mirror, hanging on the wizz-all
These muthafuckas got no heart at izz-all
Copycatting a dude cuz they don't wanna fizzle
Flattered by your bitting but get off ma bizzos

Yo! I'm as cocky as they come, in every way possible
Knock me if you want, I gladly back it up
I'm like Rocky on the drums
Built but got a fetish for quiet bitches who get sloppy with the tongue
Get it S.K, hard flows and cold charms
I train in December, speed jog through snow storms
The game weak, I fall asleep in the fast lane
And turning everybody mixtape into ashtrays
There's too many that's not worth the time
I would name y'all, but why fame y'all, my work is fine
Real recognize real
I'm New York in the flesh, the rest of y'all just talk it to death, I live it
So why I ain't hearing what your mans be yelling
Talkin' an indictment shit. you can't even spell it
Dude you ain't sellin no gram stop saying you pushing
You a Jello brain, your heart made of pudding
Stop playing

Real talk there's too many of y'all talking too greasy
So for me y'all making these too easy

Mirror, mirror, hanging on the wizz-all
These muthafuckas got no heart at izz-all
Copycatting a dude cuz they don't wanna fizzle
Flattered by your bitting but get off ma bizzos
Mirror, mirror, hanging on the wizz-all
These muthafuckas got no heart at izz-all
Copycatting a dude cuz they don't wanna fizzle
Flattered by your bitting but get off ma bizzos
(Verse 2)
Fresh out the box like Japanese kicks, 3 tone G-shit
Enough to get your light bill paid and fix your jeep with
Star studded event, when S.K and leak shit
Inspiring your bitch to make Sky to want to creep with
Homey don't get offended, it's a part of how am living
The god is like a star when he park in front of the building
In the drop with your broad, and I'm the favorite topic of your discussion
I'm literally in and out of a job, I get it done
I've been in one for a lil' while
So fuck if you got a 16 with a lot of style
It means nada, S.K lean and not fly
Fresh tape up Evisu jeans and Prada's
But please don't get it twisted
I got some dudes behind me that they get offended
And they define grimey when they get horrendous
From the bottom of they feet where they finger tipsys
So act cool

Mayne you stay in your lane and do what you do
My lane is like a buck 50 and better
Catch up haters

Mirror, mirror, hanging on the wizz-all
These muthafuckas got no heart at izz-all
Copycatting a dude cuz they don't wanna fizzle
Flattered by your bitting but get off ma bizzos
Mirror, mirror, hanging on the wizz-all
These muthafuckas got no heart at izz-all
Copycatting a dude cuz they don't wanna fizzle
Flattered by your bitting but get off ma bizzos

Mirror, mirror, let me holla at you
A lot of muthafuckas want to copy the dude
I'm flattered and all that, but I ain't really feelin it
And I'mma change my tone unless you put and end to it
Mirror, mirror, let me holla at you
A lot of muthafuckas want to copy the dude
I'm flattered and all that, but I ain't really feelin it
And I'mma change my tone unless you put and end to it quick

Mirror, mirror, hanging on the wizz-all
These muthafuckas got no heart at izz-all
Copycatting a dude cuz they don't wanna fizzle
Flattered by your bitting but get off ma bizzos
Mirror, mirror, hanging on the wizz-all
These muthafuckas got no heart at izz-all
Copycatting a dude cuz they don't wanna fizzle
Flattered by your bitting but get off ma bizzos

Wooooo! Yeah, uh
You, you, you know my name right?
S-K-Y-Z-O-O, S-K-Y-Z-O-O
With Mr. 9th Wonderful Tunes
Yeah! Cloud 9 shit
That automatic, press rewind shit
Twelve joints in three days
Imagine if we had three months? Yeah!
Yo, 9th, ready to start part two?",https://genius.com/Skyzoo-mirror-mirror-lyrics
Praying Against D’evils,An Ode To Reasonable Doubt,2013.0,"1st verse:
This shit is wicked on these mean streets, but all of my friends speak
Cause we all that we got til these ends meet
Middle finger the rest though, cause if we ain't grow from the jump
Then you relating is done
And whoever said the speakers was the easy way out, couldn't understand the mechanics
And these faggot ass industry folk, granted
9 to 5 is how you survive
But my moms had 2 jobs so for her, 9 to 5 was 5 to 9
My spirit broke, and my vision altered
Cause you kno how visions go, it's either pray to God or Shawn Corey
That's just being honest and that's what was before us
And fuck if it's worth the risk cuz that's just what we wanted
I'd break bread with my day ones and school neighbors
All the ones who wound up on the front of your newspaper
Shit is dangerous, money and power is changing us
Blood on the steeple, praying against d'evils
Verse 2:
We all wanted the spotlight
And even if we're innocent we're scared of the cop lights
The irony right?, we saw the same things vying for life
It was either find a Dominican or find us a mic
Thinking back when we first learned to make a decision
And the thought of having to live with that as long as we're living
It was like, a hand around my collar, saying to breathe
And every time I'd attempt it would clench until I gave in
I tried to hear me out but wasn't convinced
And playing GQ made Bishop's of some of my friends
Who could ever foresee
We used to live for the night and now I'm paranoid tonight is my signal to leave
All the years we were brother like
Saw each other's mothers as the mother type and now you want my mother's light
Well none of that is meant at all, so my call
Is to guard her from that misery and make it yours, d'evils
Verse 3:
My flesh nobody can test, my soul is possessed
With this beautiful mess called success, and I guess
I'm at a point where I do shit off the lonely
Like ""stupid I know you know me and your whole word owe me, strip!""
Was thought to be a pleasant guy all my fucking life
And so my fans assume that I'm that fucking type
Low and behold I talk the shit that I know cause I know it
And my friends that's left are unloaders
And so, what all of this means
Is that they're ready to lick off if you should intervene
I can't be held accountable, d'evils keep me around dudes
That do whatever is needed for me to keep it how we seen it by the stoop
Don't test me, I never cower
But Ima brand so Paeso's will put you next to flowers
Do believe as a lesson learned for the less inclined
Raised as a Jehovah's Witness but might never get inside, d'evils",https://genius.com/Skyzoo-praying-against-devils-lyrics
Wikipedia Rap (Failure),Penny Series,UnKnown,"Yea
As we conclude it
Penny Series
Call it ""Wikipedia Rap""
Pull up another tab and get a Wikipedia page open
Yea
They said its comin' back around
Do it like this

They said it's comin' back around
It's boomerang'n
And I'll be Marcus Graham when I get through with cadence
How I peruse a way in
True to take it and just let it be
No Strange' and no Lady Eloise
Rest in peace Eartha
The lead worder
I lead worders
My speech murder
Screen blurrer
Indy eye's to breathe further
And as we get further along
The longer it takes for that pump to hurry you on
The longer you stays in that slump
Bury you all
I came to tuck away the top
Get my convertible on
Like yea
On the immediate
Folding up the ceilings
Meaning that ya fav will Strange'd the easiest
See how I tie it back to the previous
Previously tagged as body bags to be with him
So my carry on'll carry on an arm
Like I'm holdin' up the flight
Trynna stow away ya life
Live fast die young trynna blow the lights
Damier Louis belts she below the white
Got her here true to self she was so enticed
Powder there cue to help she below the white
White lines where they pitch at
Play your cards wit' playing cards the part where the mix at
And superhero baggies where you itch at
They say you die young unless you live that
Still wit me
Dream filthy
Woke up and still filthy
Seen Biggie
Broke luck and spilled Henny
And seein' Biggie everyday when I stepped on my stoop
Is the only way I can explain why I'm better than you
My jump shot is like a sling they set from the roof
They trynna sign me for the wing like I met the Maloofs
On my Jimmer
Mania through the winter
And tell em' king me like I'm playin Theo remember
Kitchen table author
For every kitchen table playin' part
In the paraphernalia they made a market
Word to every fitted I own
Like they designed a New Era store to resemble my home
Home grown on the easily defined
I'm easily aligned
With no one else proceeding up a rhyme
Let's get to the preceedings baby
Seek and you shall find
That nobody means more to a beat than brother Sky
Brother Mouzone
Guns wit' the pies
Feed you and leave like run to your demise
Demise for the trash
Survival for the dope
They turned the words back
And the ridin' for the slope
They put the dope in the back so we ridin' here alone
Like if dope was in the bag and we just trynna get us home
Damn
Too high
That was too high
I shoulda threw it lower
But Twitter be wantin' me to throw in two's like I'm Noah
So everything is double entendre's
Hold up
Corner store hold ups
Just trynna and fill a hole up
And everything is double entendre's
Hold up
Corner store hold ups
To try and fill a hole up
Catch that if you may
The levels I relay
Is like Oakland and Orlando
We headed for a trade
Me and Webber switchin' snap backs
Back track
June 30th 93'
Shit'll never be the same
Me and Webber switchin' snap backs
Back track
June 30th 93'
Shit'll never be the same

Shit'll never be the same ha
Never be the same ha
""Wikipedia Rap""
Wikipedia that uh huh
Yea
Penny Series
Conclusion
Yea",https://genius.com/Skyzoo-wikipedia-rap-failure-lyrics
