title,album,year,lyrics,urls
Let It Fly,Peddler Themes,2017.0,"The intro to Belly how we posted
100 on the table, I'm just drawing up the opus
16s like I'm in the stall Tryna load this
Working on a light show, clip full of glow sticks
I'm Sincere how I pens here
With all kinda Iceberg pulled outta thin air
Lil' bit of Murda like if Puff and his men's here
Room full of Inga's and Aaliyah's and Kim's here, you know how this goes
Doors off baby hold all your gold
I sit up inside the pocket like I'm throwing you stones
The doubles the only logic baby, low and behold
Roof tucked, wings up like it's flown off the stove, let it fly
I'm back on my never mind, like never mind these mufuckas they're letting by
Hands on whatever the moment we get inside
Winter's only so the summers can turn into better rides

Let it fly, (let it fly!)
Let it fly, (let it fly!)
Shit I ain't seen nobody else in my design
I ain't seen nobody up like me and mine
If you seen 'em point 'em out and let em try
Tell 'em let it fly
Let it fly, (let it fly!)
Let it fly, (let it fly!)
Shit I ain't seen nobody else in my design
I ain't seen nobody up like me and mine
If you seen 'em point 'em out and let em try
Tell 'em let it fly

You know I can't see less, than a ES, the GS' BS
And I'm from up out the Brook but my women from out the BX
Old habits is hard to die, you know how we get
The motto is a Rover but drop off in a Prius
All in the DNA, juggle a week a day
Music for the looters who perusing thru a B.O.A
Dump it in the Bape store, plug playing keep away
Cribs in Jamaica Estates, Kisha lead the way
Rope tied over the arm the way they rep in here
Pull em off of sweatsuits, call it Nike Tech affairs
Laced it with the Bombay, 6 TVs a system, knocking Conway, all day
And word is I'm long like the arms on Antetokounmpo
Your broad like God we prolly will sumo
Tag all over the walls like I was Hugo
I'm Scorsese off the arm, like let it shoot tho
Blaow!, the aim different
Came for the bag yo the rings came with it
Came for the bag yo the rings came with it
We winning out the bag, either way
Same difference, I tell 'em let it fly

Let it fly, (let it fly!)
Let it fly, (let it fly!)
Shit I ain't seen nobody else in my design
I ain't seen nobody up like me and mine
If you seen 'em point 'em out and let em try
Tell 'em let it fly
Let it fly, (let it fly!)
Let it fly, (let it fly!)
Shit I ain't seen nobody else in my design
I ain't seen nobody up like me and mine
If you seen 'em point 'em out and let em try
Tell 'em let it fly

Blaow!, uh, the aim different
Came for the bag yo the rings came with it
Came for the bag yo the rings came with it
We winning out the bag, either way
Same difference, I tell em let it fly

Let it fly, (let it fly!)
Let it fly, (let it fly!)
Shit I ain't seen nobody else in my design
I ain't seen nobody up like me and mine
If you seen 'em point 'em out and let em try
Tell 'em let it fly
Let it fly, (let it fly!)
Let it fly, (let it fly!)
Shit I ain't seen nobody else in my design
I ain't seen nobody up like me and mine
If you seen 'em point 'em out and let em try
Tell 'em let it fly",https://genius.com/Skyzoo-let-it-fly-lyrics
For The Sleepers,The Great Debater,2011.0,"The revisit of “For The Awake”
For all of them who seems to listen for long as it take
And all of them that seem to get it
And all of its traits
And never wanted me to differ or lower the stakes
I covered y’all on the before
Called for a detour
Time-time on the dash
But pardon if I reach off
Draw songs for the stash
And offer them to see raw
Eyes wide shut like the barbers on the Seymore
Call it like it be called or better yet wasn’t
Visionary beyond, but never left from it, the loneliest
Leroy Campbell when I Crayola this
, the loneliest
Paint staircases like a custodian
Kyrlon’d over them,
 
drawn my soliloquy
I Rain Man’d so none of them couldn’t mimic me
Jesus Christo forgive me for the interludes
I’m trying to get them to know what they wasn’t meant to knew
The past tense, the miss scenes we didn’t shoot
You asked them how missed me when I did for you
So forgive me for doing for I
And if you can’t, then fuck it I ain’t too much surprised
Respects showed me I’m designed to play the stand up part
The vets told me I could sell mine on grandpa’s art
But the hearts wasn’t out enough
Arms got the rounding up
Maybe they alarm wasn’t loud enough
 (x2)
So this is for the sleepers
The hard to be believers
Who couldn’t understand
Nose bargaining to see us
Took it underhand and the honor of the leaders
I just understand and I’m signed up as the speaker
This is for the sleepers...",https://genius.com/Skyzoo-for-the-sleepers-lyrics
Floor Seats With Young,Band Practice,2013.0,"Living better at the thought of living better
Living is carpe diem so I'm caught in this forever
The smell of YSL over teddy bear sweaters
Know when I got one on I never zip up my leather
Never did this to catch them, they wanted to catch me
Said I wrote like I have yet to know what a rap be
Meaning it's deeper than rap if you ask me
Or the subjects of the stories I told where the track be
Two classics and rolling on lap 3
My whip was 2 doors I drove from the back seat
I did it like who's y'all and know that on lap 3
I'm still clueless to y'all but I know where the track leads
Meaning all I see is lane and opportunity
Lil road kill, ID 'em by they jewelry
Know the flow still got 'em leaning out the coupe with me
Like ""son, do you hear what he saying, I mean truthfully""
Truthfully I'm just waiting for this to pass
This 5 year plan that I gave 'em is in the bag
The bag got monograms on it if you ask
And a space jam glow if you open it and grab
Just a dude from Brooklyn who had intentions
Of hoping that Jay is watching and saying ""Yeah, he gets it""
But hoping that Jay is watching is double edged and twisted
Like, ""Yeah, I'm still a fan but now I'm within the business""
The blinders is on but I get the urge lift 'em
I peak and leave it there, I out-swerve collisions
My peak is still in there, I'm nowhere in reach of it
Yet I sound like its a throne here that I'm leaning in
Critics say that my destiny's that guy
I'm just here to tell a story, if I ever sit that high
Then I'm playing follow the leader, applaud that as a given
Like ""I don't fuck with the nets but damn I fuck with his vision""
And I never been a follower but if I do follow
It'll be a 600 mill leader and a few bottles
My fan base is double knotted like an ascot
Half of 'em got degrees, half of 'em got stash spots
Half of 'em strip and half is contemplating
I see your vision mama
I put my money on the long shot, treat it like you Caine and Dog
With no prints to be rinsed and no names to recall
I mean, we out here in grind mode, caught up in a paper chase
I wanna fuck a fine ho and front row the fade aways
Madison square
Or Barclays whenever the boys from Madison Square is passing thru there
I'm in a blue and orange state, its only apathy here
I was raised on them colors, Jigga, that should be fair
But I still lift my hat at the achievement
Only it's blue and orange letters where the team is
If we can get past that and between this, uh, then this baton will be easy for me to leave with
Floor seat, suede Timbs where my feets is
Raised on what he wrote and who my team is...

I'm tryna get these floor seats wit young
Prolly make me take my hat off cause my team just won
Videos wit Spike Lee and my sneaks is dumb
Records wit Jill Scott, and if you be where I'm from that means the world",https://genius.com/Skyzoo-floor-seats-with-young-lyrics
Ever Loyal,Theo vs J.J. (Dreams vs. Reality),2012.0,"Ever loyal
Skating from Mrs. Westlake, but she bad
I should be laying with Mrs. Westlake, and we had
Copies of Shakespeare on vinyl
Magic Johnson posters but blue and orange idols
And through all of these haiku's
I'm back on my Michael
Which ever one, between '89 and '98
Providing it by the day and driven by being driven
Inspired to drive away in cars with less room
Either that or getting picked up in cars with stretched roofs
Where the only thing that's not in the car is the restroom
Cause when Jada said his car had everything but a bar
It inspired me to want refrigerators in the arm-rest
First half of the calm yet
Meaning that the storm should be coming like a cartridge blowing
Double meaning
Shit, to know him is to be him
Either that or at least see him
And he usually be at Farmer in the deli if you need him
You can tell him by his sneakers
Never tied and never kinds you can find in the retail
Fiends get excited outside when they see Mel
Meaning that the sneakers are shipping in
And whatever pair I got on I'll probably give to them
Stringing these together through loops like where the symbol is
If you could walk a day in my shoes then you can sit with them
That was kind of high, pardon me for throwing that up
I assumed that you would've knew and followed through with some backup
But my pocket is gorgeous like Lolo Jones
So even if you couldn't catch it you could go off flows, right?
Gordon Gartrells
 and Creed cologne
It cost a bottle a Spade, shit to each is own
I smell amazing
Ever Loyal, the perils of being Theo, we call it Ever Loyal
The perils of being Theo, we call it Ever Loyal",https://genius.com/Skyzoo-ever-loyal-lyrics
The Experience,Music For My Friends,2015.0,"Smothered chicken as far as breakfast goes
Shout out to the left overs that left us those
Cheese grits like a remix how we stretching those
In 9th grade Pierre would keep his weapon close
I still treat breakfast the same, my friends still catch wreck with their aim
I'm still henny and coke, and speaking of
We was surrounded by it
And ducking all the jewels from the users on that diet
And we ain't have the heart to try it but saw the brave ones
And looked at that as a jewel on how they became one
We all shared last names with them same ones
And Penny's where I learned my J from, I'm built how I'm built
Solo artist but I never had to sing alone
The scent Creed and the Timbs is never single sole
The whip was low enough for me to be low
But loud enough for you to be in the know
Know we salute to the experience

We were the loud ones with quiet souls
Intentions well and good but buried underneath over pricing
We wanted nothing more than everything, simply everything
Whatever that entails, we wanted it and still do
Still do we never sit still, as being settle is being settled
And we could never became that
And never will

Grew up with a bunch of Lenny Cooke's
May God bless 'em all like a Biggie hook
They hooked us early as far as the way these women look
And looking for 'em had us looking for a bigger push
Call it the laws of attraction baby
It's nothing more than a reaction baby, we push this to get you
Whatever ""this"" is, as long as what it gets is
All that we assumed but shit you know the way that ""this"" fits
In square trucks Tryna bring a couple models 'round
The same ones who brought your bottles down
I bottled up the ambition and passed it around the room
Til half us around the room know the logic now
And all of us ain't see the vision so some of us got left behind
But nothing could yet divide us from our calling now
Like how the call to the corner was as sweet as quarter water
All for you to wanna climb up on us now
Salute to the experience

Sweeter than sweet potato soufflé
Store runs for extra sugar and those runs showed us
More than those who sent us ever would've
Or as sweet as a scam that left our finger prints dirty
But our sneakers clean and our company cleaner
The taste of life in all its glory
Be it Harvard or heinous, we took it where none would take it
And poured Henny over it's glory

Back when me and Biz played the coupe
He showed me the lane, I showed him stoops
We showed each other money, and loyalty be everything it seems to
So lil Biz will be straight if you ever need dude
The same agenda applies to all of my friends who
Saw that coinciding was nothing coincidental
Never, it's just the way we're put together
And none of this shit could be any better
Salute to experience

A generation generating genius
Hard headed like the curb beneath us
They say in the absence of logic you search for motive
But really motive defines us based on being aware of logic
And aware of the dollars and yea ""mo' money mo' problems""
But no money no options, see the logic?
And for that, we salute to the experience",https://genius.com/Skyzoo-the-experience-lyrics
Phone Calls,Band Practice,2013,"On a winner's roll, for how the winners go
My life is a ""3 piece-free dinner roll""
I'm writing to see the seams where the middle's sewn
And rightfully be a fiend for a bigger stone
The irony in my neighbors feeling the same
How I'm looking for baguettes and they waiting to get a trade
Hoping it's 80-20, it's more 40-60
They can paint you the world when the talk is all whiskey
I'm in the same vision
They blind enough to let us
So if diamonds is forever
Then why not just chase prisms?
The hoodie black and the 'Brons is grey Prisms
The goal is to leave with your hearts and grey brim 'em
I'm dating all the broads they hiring for they vids
The money they paying them is the bottles that's in my crib
Encouraged to stay with em, but yo, I just be on my shit
Dying for the moment is dying enough to live
For the record, as true as the truest is
The dudes I grew up with is the dudes that's doing bids
So, with no big brother stretching his arm
Swear to God my co-sign is where the peddlers are
I mean, thirteen, writing rhymes on the step
Looking for a metronome and only sirens was left
So the verse was to the horn
And working in a song
Had me jumping to a trumpet full circle all along
And when them horns blow, they play what the vibe be
If motherfuckers wait, you'll be waiting to find reach
I mean, they said my mother got cancer in her breast
And my pops got cancer in his neck
It turned out my mother is straight, but my pops ain't as blessed
So he at a cancer center trying to rest
I pray to God the money I'm chasing is at least worth the journey
And the ones who lose lane is the ones who was trying to murk me
Cause good aim will have them hanging your jersey
Like, ""Son had good game, it's a shame to hang it early""
Early to the money and missing a phone call
I hope when I call back and get him, I don't bawl
Ivy League mind full of prodigal thoughts
And when he was fathering me, I was fathering y'all
One time..
One time for the phone call
Hoping when I call back, I don't bawl",https://genius.com/Skyzoo-phone-calls-lyrics
Get Him To The Greek,The Great Debater,2011.0,"She said to me Sky, life is for living
I get right to the living before the light of my ending shows
She said to me Sky, life is for living
I get right to the living before the light of my ending goes
Get him to the greek (x3)
Meaning me, I'll get me there
Get him to the greek (x3)
Meaning me

Any windows of middle men in between
Littering through the dreams of trying to get from this Z to this A
In them windows I'm literally on the lean
If I get to be seen I'm slipping up on my dean for this pay
I don't need no eyes to see no stride that we bow tied
So I'm hoping you closed yours if I should speak so wide
I hope you know the allure and why it seems so high
And I'm hoping that closed door behind me don't pry
I mean the booth is all I'm looking for
You and yours I look towards
Trying to build a bridge that I could uniform to push us off
Know me off a homie but to know me is to look beyond
Only for the lonely so I'm lonely if you put me on
Itching while I'm waiting patiently I'm impatient
But my mannerisms tell you I may be the one to trade with
Tell them I'll be back tomorrow my briefcase on the table
You can keep it, its more where they came from
If you play it, I mean


As I play the bench after this chess move is properly made
I see the middle disappearing if I lock this today
I see that middle interference that was blocking my lane
But coming clearly incoherent, they done dropped out the way
I mean I'm clearly in the clear, shake a hand out in this park
And I can hear what they don't hear so if you hear me where to start
Then I'll be there to play the rear, take a stand and say remarks
I won't remember a name, place my hand upon my heart
If underhanding is an art, you tell them I'm Kenneth Gatewood
But the forbidden innocence isn't anything they should reflect on
Or worry yourselves worries don't sell
If a word is to be uttered then we should worry for real
But in the mean time, we've lined ourselves with rewinds
Meaning I'm back as soon as I leave cause these fly
Meaning I'm back to pursing my lea, I see eye to eye with you
The mattress seem logical, but my sleep differ


Parallel to the she in question
And based on how she be dressing
I made this an easy catch and ironically
I'm caught in the same G I threw, lost between me and you
Call it the sweet pursue, but I'm trying to leave
And that I was hoping wouldn't pry
Is kissing my shoulders as I pushed to the other side
She kissing my motives as I'm looking under her eyes
I kissed her like fuck it
As long as I'm still alive, I'll do this to death


Scene from The Wire w/ Avon Barksdale and Marlow",https://genius.com/Skyzoo-get-him-to-the-greek-lyrics
For The Awake,The Great Debater,2011.0,"The revisited “The Don Cheadle Effect”
And the awards given off to the floor seats of the ‘jects
And them awards given off for seeing respect
To them all that’s involved that call me they connect
To the wall they was on the four seats of them steps
That’s beyond where that wall is drawing me to be next
So I talk what I talked and y’all seem to be left
They was lost and I crossed and all they see is a X
My honesty in a Tec in the hands of Ilena’s cousin
Yo mouth screaming to “duck”
While you be leaking from it
See all I be is the tuck, so if you keep me from it
They don’t need what they want or what they need is wanted
And wanting it lowered and trying talk them to know it
Cut the K and the W and maybe I shouldn’t throw this
Cut the K get a W I just toss them a notice
Let it play until it stuck and then you become the awoken
 (x2)
This is for the awake
Call it quarter to 8
Whatever they desired, I put it all on their plate
What ever I would scribe they take it all for the day
We on the same line as long as that line pays

This for the awake, first viewing of the body
Before the funeral numero uno with the shotty
Who could part this
Thank you for your listening and under-standing
Reprimanding when you was up in ya lunches
Arguing with niggas on ya solo against bunches
About Nas when they ain’t understanding his punches
Pizza getting cold you ain’t worried cause these dunces
Never stomached the real, it’s terrible that they crunches
Homie I be kicking the real, like Brazil
Without the ‘Z’ giving people something to feel
On every 1st listen they never knew nothing as ill
Because I’m king, they be Bishop like they running with Steele
Uh, let me get ya bitch that be something to kill
While I maneuver through the game and I’m getting my bills
Over saturation of rappers but we giving them skills
Through the flood they see the real
Niggas spitting with gills
 (x2)

When the comforter is in the same fold
It was in when you first left hearing them same clothes
And in the end you’ll be tying together to make bose
Get wind of when riding along to the same tone
Shit dims, lights get lower than save modes
And them rims on the tires is wired with payroll
But then again, if you ain’t get to touch that bed
Then you caught when I was running when I said
 (x2)
This is for the awake…",https://genius.com/Skyzoo-for-the-awake-lyrics
Easy to Fly,The Salvation,2009.0,"Shorty, I invite you
To get rid of that JetBlue dude
And jump on this G4 lifestyle
Get with the new, come on
 (Carlitta Durand)
(Fly away with you)
I could make it easy to fly
I could make it easy to fly
If you ain't scared of the sky
Baby, I could make it easy to fly, ya know
(Fly away with you)
Yeah, (you). yeah, (you), yeah, (you)
If you ain't scared of the sky
Baby, I could make it easy to fly, ya know
(Fly away with you)
Fly with me baby

Huh, higher than you ever been (ever been)
By a landslide baby, this a better win (better win)
And I can't lie baby, if I'm never in (never in)
I call it a day and we can start propellerin (woo!)
I'm talkin seven day weekends, same weather seasons
Pullin up in front of your crib like ""how you need it?"" (yeah)
Let you stretch out like you should
See I knew that you could
All you needed was a reason for good
And you can call me your reason, call me your favorite
Call me when you're through with your past and I'll erase it
And I know that you used to your past but shorty face it
You deserve different and me, I work different, so ride with me
Get high with me, is how it's supposed to be, when you rollin with G's
Let me Birkin your bag, Giuseppe your Nikes
And G4 you for the rest of your life, get it?


Look, look, when your phone rings and his name shows
Baby you supposed to be excited to say ""hello""
So if your phone rings and your mood drops
Then all that means is you should make a move ma
Cause see you could be bad dolo, what you got him at home fo'?
Let go of the baggage, what is you holdin on fo'?
Why run in place when you could just run away?
Meet me at the peek of your dreams and come and stay
Hope aboard the private, think of me as the pilot
Point where you wanna go and we can get to ridin
Mile high clubbin it, I can get to providin
And we can get to twistin the sheets like ""where the time went?"" (woo!)
They say life is what you make it, right?
So if he makin it dark, what ya days is like?
See if he makin it dark, you should break the night
Get ya passport and take this flight, fly with me

 (Carlitta Durand) - 2X
Baby we could fly, so sky high
That you could look down on your past like ""bye, bye"" (bye. bye)
You could look down on your man like ""bye, bye"" (bye, bye)
Look at 'em and say it's a wrap - ""bye, bye"" (bye, bye)

Uh, we so better now (yeah), we so whatever now (yeah)
Meanin whatever you want, we go and get it now (yeah)
We so in tune with the new in you now
And so used to the climax that you lose count (woo!)
You good so far, that wasn't so hard
Told you fill up your Goyard
And not look back
And you did it, now how real is that?
Huh? Yeah


Yeah, yeah
Come and G4 your lifestyle baby
I mean it's the better thing to do, ya know
It's the righteous way to go
Haha, yeah
And they call me S-K-Y-Z-O-O, S-K-Y-Z-O-O",https://genius.com/Skyzoo-easy-to-fly-lyrics
