title,album,year,lyrics,urls
Cinquième Soleil,Désobéissance,2008,"Mon espèce s'égare, l'esprit qui surchauffe
Les gens se détestent, la guerre des égos
XXIe siècle, cynisme et mépris
Non respect de la Terre, folie plein les tripes
Frontières, barricades, émeutes et matraques
Cris et bains de sang, bombes qui éclatent
Politique de la peur, science immorale
Insurrection d'un peuple, marché des armes
Nouvel Ordre Mondial, fusion de terreur
L'homme, l'animal le plus prédateur
Le système pue la mort, assassin de la vie
A tué la mémoire pour mieux tuer l'avenir
Des disquettes plein la tête, les sens nous trompent
3e œil ouvert car le cerveau nous ment
L'être humain s'est perdu, a oublié sa force
A oublié la lune, le soleil et l'atome
Inversion des pôles vers la haine se dirige
A perdu la raison pour une excuse qui divise
L’égoïsme en devise, époque misérable
Haine collective contre rage viscérale
Une lueur dans le cœur, une larme dans l’œil
Une prière dans la tête, une vieille douleur
Une vive rancœur, là ou meurt le pardon
Où même la voix prend peur, allez viens nous partons
Des lois faites pour le peuple et les rois tyrannisent
Confréries et business en haut de la pyramide
Ça sponsorise le sang, entre chars et uzis
Innocents dans un ciel aux couleurs des usines
Un silence de deuil, une balle perdue
Toute une famille en pleurs, un enfant abattu
Des milices de l'état, des paramilitaires
Des folies cérébrales, des peuples entiers à terre
Bidonvilles de misère à l'entrée des palaces
Liberté volée, synonyme de paperasse
Humanité troquée contre une vie illusoire
Entre stress du matin et angoisses du soir
Des névroses plein la tête les nerfs rompus
Caractérisent l'homme moderne, bien souvent corrompu
Et quand la ville s'endort, arrive tant de fois
Une mort silencieuse, un SDF dans le froid
Prison de ciment, derrière les œillères
Le combat est si long, pour un peu de lumière
Les famille se déchirent et les pères se font rares
Les enfant ne rient plus, se battissent des remparts
Les mères prennent sur elles, un jeune sur trois en taule
Toute cette merde est réelle, donc on se battra encore
C'est la ""malatripa"" qui nous bouffe les tripes
Une bouteille de vodka, quelques grammes de weed
Certains ne reviennent pas, le sevrage est violent
Subutex injecté dans une flaque de sang
Des enfants qui se battent, un coup de couteau en trop
Ce n'est plus à la baraque que les mômes rentrent tôt
Ils apprennent la ruse dans un verre de colère
Formatage de la rue, formatage scolaire
C'est chacun sa disquette, quand les mondes se rencontrent
C'est le choc des cultures, voir la haine de la honte
Les barrières sont là, dans nos têtes bien au chaud
Les plus durs craquent vite, c'est la loi du roseau
Non rien n'est rose ici, la grisaille demeure
Dans les cœurs meurtris qui à petit feu meurent
Ne pleure pas ma sœur car tu portes le monde
Noble est ton cœur, crois en toi et remonte
N'écoute pas les bâtards qui voudraient te voir triste
Même Terre-mère est malade, mais Terre-mère résiste
L'homme s'est construit son monde, apprenti créateur
Qui a tout déréglé, sanguinaire prédateur
Babylone est bien grande mais n'est rien dans le fond
Qu'une vulgaire mascarade au parfum d'illusion
Maîtresse de nos esprits, crédules et naïfs
Conditionnement massif, là ou les nerfs sont à vifs
Dans la marche et la rage, bastion des galériens
Ensemble nous sommes le monde et le système n'est rien
Prend conscience mon frère, reste près de ton cœur
Méfie-toi du système, assassin et menteur
Éloigne-toi de la haine qui nous saute tous aux bras
Humanité humaine, seul l'Amour nous sauvera
Écoute le silence quand ton âme est en paix
La lumière s'y trouve, la lumière est rentrée
Vérité en nous-même, fruit de la création
N'oublie pas ton histoire, n'oublie pas ta mission
Dernière génération à pouvoir tout changer
La vie est avec nous n'aies pas peur du danger
Alors levons nos voix, pour ne plus oublier
Bout de poussière d'étoile, qu'attends-tu pour briller ?
Tous frères et sœurs, reformons la chaine
Car nous ne sommes qu'un divisé dans la chaire
Retrouvons la joie, l'entraide qu'on s'élève
Une lueur suffit à faire fondre les ténèbres
S’essouffle ce temps, une odeur de souffre
La fin se ressent, la bête envoute la foule
Les symboles s'inversent se confondent les obsèques
L'étoile qui fait tourner la roue se rapproche de notre ciel
Terre à l'agonie, mal-être à l'honneur
Folie, calomnie peu de cœur à la bonne heure
Ignorance du bonheur, de la magie de la vie
Choqué par l'horreur, formé à la survie
L'époque, le pire, une part des conséquences
Le bien, le mal, aujourd'hui choisis ton camp
L'être humain s'est perdu trop centré sur l'avoir
Les étoiles se concertent pour nous ramener sur la voie
Quadrillage ficelé, mais passe la lumière
Aies confiance en la vie, en la force de tes rêves
Tous un ange à l'épaule, présent si tu le cherches
Quand le cœur ne fait qu'un, avec l'esprit et le geste
Le grand jour se prépare, ne vois-tu pas les signes ?
La mort n'existe pas, c'est juste la fin des cycles
Cette fin se dessine, l'humain se décime
Espoir indigo, les pléiades nous désignent
Lève ta tête et comprends, ressens la force en ton être
Dépasse Babylone, élucide le mystère
Rien ne se tire au sort, que le ciel te bénisse
Enfant du quinto sol, comprend entre les lignes

Comprends entre les lignes
Enfant du quinto sol
Le soleil est en toi
Fait briller ta lumière intérieure
Pour éclairer le chaos de leur monde
On est pas là par hasard
Les pléiades nous désignent
Lève ta tête, comprends entre les lignes (la vie est grande)
Écoute ton cœur
Désobéissance
Car la vérité est en nous
Car la solution est en nous
Parce que la vie est en nous

Paroles rédigées et expliquées par la communauté RapGenius France",https://genius.com/Keny-arkana-cinquieme-soleil-lyrics
Désobéissance civile,Désobéissance,2008,"Trop nombreux sont ceux qui ont oubliés le passé
L'histoire de l'homme : une honte, faut-il te le ressasser ?
Le monde 
une spirale
 ou les mêmes erreurs sont retracées
A force de côtoyer l'horreur, nos cœurs sont devenus glacés
Nous parlent que d'profits, la condition de l'homme effacé
Mondialisation et concurrence sont leurs uniques phrasés
Les peuples unilatéralement écrasés, la création menacée
Multinationales et croissance ont tracée leurs routes sur nos libertés
Ils ont juré, craché qu'rien n'entravera la leur à l'heure ou les
Dictatures sont cachées
A cause de leurs profits, immédiat l'avenir est gâché
Cette bande d'ingrats ont réduit la planète à un grand marché
La loi des plus riches et beaucoup crèvent avant d'être âgé
Protestations dîtes criminelles si tu les as outragés
Ils mentent lorsqu'ils disent que le mal-être n'est que passager
Puis s'étonnent quand la nature se rebelle comme un peuple enragé
Ils disent être transparent alors que de sang, leurs mains sont tachées
Déconseillent fortement d'avoir des idées trop engagées
Accélération d'leur plan depuis que des avions se sont crashés
Et toi, dis-moi dans quels sens au système es-tu attaché ?
Ils prêchent le blasphème et la vraie lumière se fait lyncher
Tous nés la corde au cou, dans certains pays elle a lâchée
Parlent de justice alors qu'à la racine ils l'ont arrachée
Les plus gros s'engraissent sur la tête de ceux qui n'ont rien à mâcher
Voila le monde d'aujourd'hui. Parait que leur plan a marché
Nous vantent un progrès technique mais dans le fond à tout saccager
Parle d'évolution quand notre humanité s'est fait hacher
Notre cœur ne bat plus vraiment et notre inconscient est fâché
Stress, angoisse, cancers, dépressions notre compte s'est chargé
Mais on ne cherche pas la cause et les effets qu'on aimerait chasser
""Philosophie fast-food"" pour que nos consciences soient terrassées
Au nom de la dignité humaine, nous avons dit assez
Désobéissance civile!..
Désobéissance civile! (x3)
Un peuple uni ne sera jamais vaincu ! (x4)
"" C'est une résistance , contre un système, qui crée le terreau favorable
A la haine de l'autre
Au racisme et au mépris ""
"" Le refus de coopérer avec l'autorité... ""
"" Et même si on marche séparément, on doit frapper ensemble...""
"" Y'a quelque chose, une injustice quelque part : On descend tous
Y'a un problème quelque-part ; On descend Tous ""
"" C'est de la désobéissance civile, c'est pas de la violence ,..""
"" Une place énorme, une responsabilité énorme, dans ce qui s'est joué, et ce qui se joue et va se jouer dans l'avenir""
 ( Daniel Cohn-Bendit? )",https://genius.com/Keny-arkana-desobeissance-civile-lyrics
Ordre Mondial,Désobéissance,2008,"Je suis là, partout, j'ai resserré les murs
J'ai imposé ma surveillance, caméra partout dans les rues
J'ai approfondi les frontières, un rempart pour le Tiers Monde
Un champs de tir
 pour les 
sans faf
, histoire que les affaires montent
Je ne défends pas l'être humain, je défends les capitaux
J'instaure les règles du commerce en faveur des occidentaux
Je suis l'art de piller, en faisant croire qu'on ne vole rien
Au service de la croissance, tes droits de l'Homme, j'en rigole bien !
Je me cache derrière des idéologies pour que l'opinion soit d'accord
J'ai imposé la biométrie sur vos passeports
J'ai fabriqué la peur, pour que tout le monde soit sur écoute
Car moi je veux tout répertorier, moi je veux des chiffres et des codes barre
Je contrôle vos esprits par le biais des médias, vous êtes à ma merci
Les pieds embourbés dans l'inertie
Car vous vous croyez libre, mais formatés depuis l'école
Pour vous apprendre la hiérarchie, à toujours obéir aux ordres

Je suis l'ordre mondial
L'ordre créé par les puissants
Confréries, chefs de multinationale
Politiques économiques, je suis la conjoncture
Imposée à la planète, j'ai instauré ma dictature

J'ai anéanti le pouvoir national, j'impose ma loi dans les pays
C'est le jeu de l'illusion que vous appelez ""démocratie""
Car l'ordre vient de moi, certainement pas d'un peuple
Je vous façonne à mes choix dès que vous tombez dans la peur
Je suis le produit des tyrans, la structure qui détruit
Au nom des valeurs marchandes, implantées jusqu'à vos esprits
Je pompe le sang du Tiers Monde,
 j'chope leur politique
Leur ordonne de nous vendre tous leurs services publics
Un peuple qui se lève ? Moi je lui couperai ses vivres
Pour mieux alimenter sa haine et l'emmener en guerre civile
Car y'a pas meilleur profit que le bizness de la mort
Destruction, reconstruction, investissement, marché des armes
Pro-guerre, prospère je fais monter la sauce
Vous monte les uns contre les autres, pour mieux alimenter ma force
Car mon règne prend son ampleur dans toutes vos divisions
Libéralement capitaliste, au service de vos illusions

Je suis l'ordre mondial
L'ordre créé par les puissants
Confréries, chefs de multinationale
Politiques économiques, je suis la conjoncture
Imposée à la planète, j'ai instauré ma dictature

Tout est profit, tout est marchandise telle est ma devise
J'ai inventé les classes pour que vous vous trompiez d'ennemi
Je vous ai donné des outils pour lutter contre moi
Des syndicats, quelques partis mais toujours cadrés par mes lois
Oui je détruis la Nature car ce qui m'importe, c'est la croissance
Votre planète, elle est devenue mon esclave
Je la nourris de déchets, la pollue jusqu'à la racine
Pendant que je me rassasie de nouvelles mesures assassines
J'empoisonne vos corps d'aliments trafiqués
Génétiquement modifiés car le mal çà fait du chiffre
J'ai déréglé le climat
, déshumanisé les Hommes
Dénaturé le vital, flingué l'espoir en plein essor
J'ai réussi à vous faire croire que la Vie se résumait à consommer, consommer
Consommer pour mieux construire mon empire
Je suis capable du pire, pour vous faire croire en ce qu'il faut
Si je contrôle vos esprits, c'est grâce à la culture du profit

Je suis l'ordre mondial
L'ordre créé par les puissants
Confréries, chefs de multinationale
Politiques économiques, je suis la conjoncture
Imposée à la planète, j'ai instauré ma dictature
Politiques économiques, je suis la conjoncture
Imposée à la planète, j'ai instauré ma dictature",https://genius.com/Keny-arkana-ordre-mondial-lyrics
Réveillez-vous,Désobéissance,2008,"Ca pue l’injustice, et la tempête est programmée
Tout va de plus en plus vite, oui la guerre est proclamée
Une guerre glaciale de moins en moins discrète
Qui s’attaque aux plus pauvres, et à ceux qui refusent d’intégrer la disquette
On divise la populace, instaure l’Etat policier
Sors des rangs tu mangeras la matraque de l’officier !
Nouvel Ordre OFFICIEUX, terrorisme OFFICIEL !
""Des gains multiples"" pour instaurer la surveillance et la peur
Eteins ta télé, et leurs émissions d’arriérés
Eteins ta télé, avant d’finir complètement aliéné !
Propagande de peur pour une soumission official
Métro boulot dodo, biométrie et fichage !
Hé ! Les rebelles croupissent en taule
Campagne de disparition marketing pour qu’on accepte les puces dans l’corps !
Faut qu’on s’réveille car demain sera pire encore
Les murs s’resserrent y’a de moins en moins d’espace 
Hé oh !

Réveillez vous, ils nous ont déclaré la guerre
Réveillez vous, 
peuple du monde et enfant de la terre
Réveillez vous avant le point de non-retour
On aura besoin de tout le monde tout le monde tout le monde !!
Réveillez vous, car demain sera pire encore
Réveillez-vous avant qu’ils nous mettent des puces dans l’corps !
Réveillez vous c’est toutes nos vies qui sont en jeu
Réveillez vous, RE-VEIL-LEZ VOUS !

Ca pue l’injustice, et la tempête est pour bientôt
Peuple aliéné, politiques qui nous mènent en bateau
Terrorisme d’état bien concis
Peuple exploité voué à consommer c’qu’ils construisent
Prisons à ciel ouvert dans le crime et la norme
Quand les frontières deviennent les barricades de la mort !
Méfie toi des miradors, des gardiens du désastre
Méfie toi, car les arrestations deviennent des rafles
Ils condamnent l’exclu, en propageant l’exclusion
Exploitent les plus pauvres avant la case Expulsion !
Font la chasse à l’enfant, des CRS dans les écoles
Wesh les voiles les dérangent mais pas les flics dans les écoles !
Si on était ensemble ils pourraient plus semer le chaos
Nous on croit pas en leur justice nous on croit en 
celle de Là-haut !
Mon frère, ne perds pas la foi toi qui n’y croit plus
On a besoin de toi, ma sœur on a besoin d’toi Hé oh !!!!

Réveillez vous, ils nous ont déclaré la guerre
Réveillez vous, peuple du monde et enfant de la terre
Réveillez vous avant le point de non-retour
On aura besoin de tout le monde tout le monde tout le monde !!
Réveillez vous, car demain sera pire encore
Réveillez-vous avant qu’ils nous mettent des puces dans l’corps !
Réveillez vous c’est toutes nos vies qui sont en jeu
Réveillez vous, RE-VEIL-LEZ VOUS !

Ca pue l’injustice et la tempête a commencé
Avant même le combat, trop de frères ont renoncé !
Dis moi qu’est ce qu’on attend pour construire sans eux
Que le soleil disparaisse ou que leurs armées soient des clones ?!
Energie nucléaire
, saccageant la création
Processus établi de déshumanisation
Esprit rempli de subliminal bombardement
Les plus gros médias appartiennent aux usines d’armement
Alors comprend dans quel monde nous vivons
Le savoir est une arme à l’heure où ils brevettent le vivant
La science et la recherche au service de la peur
Car un virus c’est mieux qu’une guerre pour exterminer un peuple !
N’ayons pas peur, ayons confiance en nous même
Même la vie est avec nous Oui la vie est avec nous !
Mon frère, ma sœur on est ensemble
Si Oui on meurt ensemble, allez on a plus l’temps Hé oh !

Réveillez vous, ils nous ont déclaré la guerre
Réveillez vous, peuple du monde et enfant de la terre
Réveillez vous avant le point de non-retour
On aura besoin de tout le monde tout le monde tout le monde !
Réveillez vous, car demain sera pire encore
Réveillez-vous avant qu’ils nous mettent des puces dans l’corps !
Réveillez vous c’est toutes nos vies qui sont en jeu
Réveillez vous, RE-VEIL-LEZ VOUS !

Perds pas la foi soeur on est nombreux
Perds pas la foi frère on est nombreux
Perds pas la foi soeur on est nombreux
Perds pas la foi frère on est nombreux

N’ayons pas peur car nous sommes le monde et le système n’est rien sans nous
À nous de reprendre l’espace public, de récupérer nos rues, de reprendre en main nos quartiers
On nique pas le système en voulant le détruire, on nique le système en construisant sans lui
Alors construisons, reprenons nos vies en mains, car les leurs sont pleins de sang…
Echangeons, on a tous quelque chose à apporter à l’autre
Et donnons plus nos compétences qu’à Babylone
Donnez les à la résistance qui est en route, On fait tous partie de la solution
N’oublions pas qu’on est le monde, même s’ils ont le chiffre on est plus fort on a le nombre !
Un peuple uni ne sera jamais vaincu",https://genius.com/Keny-arkana-reveillez-vous-lyrics
Les chemins du retour,Désobéissance,2008,"Prisonnier dans la peur qu'on nous inculque
Laisse-les nous mépriser nous appeler jeunes et incultes
C'est la maladie du siècle, dans le cœur : des surins
Les terriens sont en terreur, ont enterré ce qui faisait d'eux des humains
Ca fait un bail qu'on a tout balancé dans la fosse
Comment a-t-on pu zapper que l'amour était le moteur de notre propre force ?
On se renferme tous malheureux dans nos petites cases
La vie se cache dans chaque recoin même des plus petites phrases
Veille sur ton cœur, il peut vite glacer de froid
Il faut garder sa vigilance pour ne pas s'éloigner de soi
Chaque instant est une prière
Prends soin de tes pensées
Demeure-les sensées pour ne plus broyer de la pierre
Le système est un mirage, les barrières illusoires
Les angoisses sont des vibes auxquelles Babylone veut nous faire croire
Le cœur détaché tout commence dans la tête
La révolution totale n'est pas qu'un but c'est un chemin et une quête
~Refrain~
On doit redevenir humain. Whoo oye oye ! (x4)
Les barrières sont dans nos têtes, les limites dans nos cœurs
Le travail est profond pour s'émanciper de l'horreur
Après des siècles d'aliénation
Après des siècles d'aberration
On s'est construit nos propres prisons
Enfermés dans les forteresses de nos égos
La vie ne passe plus à travers ; on se sent mourir, on sort les crocs
On s'entretue et on s'oublie en accusant autrui
On brûle nos rêves de notre plein gré pour libérer nos cris
Demi-Hommes, on a des clous au bout de nos ailes
La vraie révolution sera le changement de nos êtres
La force est en nous-mêmes, secret de la création
Entends les anges à ton oreille te souffler la mission
Cherche la pureté en ton cœur vu que l'horreur nous encercle
Trésor enfoui, secret de nos ancêtres
Mémoire oubliée dans un coin d'évolution
Enfant de l'humanité on porte en nous la solution
~Refrain~
La machine nous a appris à ne pas sourire dans la rue
A ne pas voir le pauvre qui crève en demandant de l'aide
Elle nous a enseigné que l'amour était une faiblesse
Tout comme les larmes, les faiblesses
N'ont pas de place dans leur système
Violente elle nous a formé à encaisser les coups
Clamant le « Chacun pour soi et le diable pour tous »
Elle nous a appris à ne pas regarder son voisin
A part pour comparer et puis pour jalouser son pain
Elle nous a dénaturé jusqu'à ce qu'on banalise le mal
Qu'on glorifie le diable et qu'on en sous-estime le drame
Elle nous a convaincu que pour vivre à Babylone
Il ne fallait plus être humain mais être un robot ou un clone
Elle a fait de nous ses enfants
Redessinés à son image, aussi gris que l'ensemble de son rivage
Enfant de Dieu, l'amour et la mémoire seront nos armes
Sur le chemin du retour vers la vérité de nos âmes",https://genius.com/Keny-arkana-les-chemins-du-retour-lyrics
Terre Mère n’est pas à vendre,Désobéissance,2008,"Ils ont répandu le sang un peu partout sur ton sol
T’ont recouvert de ciment, jusqu’à étouffer ton sol
Te détruise pour du papier, pour souiller tes profondeurs
Pour nous faire croire en ton deuil, on ne portera pas ta tombe, car on veut te voir vivre
Ils t’ont séquestrée de leurs ombres, nous on veut te voir libre…

Tes enfants t’entendent crier, ressentent ta souffrance
Aujourd’hui sont prêts à se battre pour prendre ta défense
Les puissants te persécutent, comme ils nous persécutent
Tombés dans la démence, et charmés par Belzebuth
Après t’avoir pillée, fragmentée, bombardée, vidés de tes substances, tes richesses ils ont gardés !
Sans aucun respect, se sont approprié ta chair
Depuis des millénaires pour t’avoir se font la guerre
Pacha Mama, tes enfants sont toujours là
Eparpillés sur le globe le point levé pour le combat
Pacha Mama, c’est nos racines qui sont en toi, tout notre amour sera plus fort que notre désarroi
Pacha Mama, ton vase rempli à ras-bord
Ils t’ont condamnée à mort, ils nous ont condamnés à mort !
De toute part s’élève nos voix, allez leur dire d’avance
Que malgré leur mauvaise foi, Terre Mère n’est pas à vendre !

Terre Mère, Pacha Mama
 (X3)
Notre Terre n’est pas à vendre !

Tes enfants meurent avec toi, dans l’oubli de l’ignorance
Que l’homme moderne ne veut pas voir
Fatalité sublimée sous la flèche de Lucifer, civilisation suicidaire !
Les puissants se font la guerre, pour te voler tes richesses
T’ont mis à la vente, et brevettent chacune de tes espèces
Terre Mère, patrimoine ancestrale de vie
Considérée comme une vulgaire marchandise à leur service
Pacha Mama, on porte ta tristesse dans nos airs
Exploitée, comme nous autres, ta détresse est dans nos êtres
Pacha Mama, tu es le reflet de nos cœurs, torturée et meurtrie dans le siècle de l’horreur
Pacha Mama, ils ne voient pas ta souffrance
Encore moins ton amour ni le souffle d’une dernière chance
A tous les enfants de la Terre, le mot d’ordre est délivrance
Allez leur dire que notre Mère n’est pas à vendre !

Terre Mère, Pacha Mama (X3)
Notre Terre n’est pas à vendre !

Notre Mère qui est la Terre, que ton nom soit respecté
Que ton règne revienne, que tes enfants puissent t’aimer
Donne-nous aujourd’hui, la force d’y croire
Pardonne-nous notre rage, qu’on se nourrisse d’espoir
Ne nous soumet pas au cynisme que l’homme moderne cultive
Délivre-nous de la machine et de sa haine qui nous surine
Que ta force reprenne ses droits
Qu’on se rappelle que c’est toi qui reçoit la vie sous la lumière des étoiles !
Ils ont répandu le sang un peu partout sur ton sol
T’ont recouvert de ciment, jusqu’à étouffer ton sol
Ont empoisonné ton air, souillé tes océans
Tes rivières et tes mers et ont vampirisé ton sang
Ils ont fracassé tes saisons, déréglé ton climat
Ils ont coupés l’horizon avec du béton dégueulasse
Ils ont exterminés ta faune, racheté ta flore
Sous estimé ta force, pour nous condamner à mort Pacha Mama !

Terre Mère, Pacha Mama (X3)
Notre Terre n’est pas à vendre !",https://genius.com/Keny-arkana-terre-mere-nest-pas-a-vendre-lyrics
Alterlude : Pachamama,Désobéissance,2008,"Reçois l'Amour de tes enfants
Qui veulent retrouver ton sein
Qui viennent se connecter ensemble
Pour retrouver le grand Un
Qui ont conscience que nous sommes tout
Et qu'à la fois nous ne sommes rien
Qu'on te doit tout, chère Maman
Déjà mère de nos Anciens
Pardonne le monde et son égo
Bien trop ingrat pour voir le bien
Louons ta gloire et ta splendeur
Pour préparer le jour prochain
Tu es la reine, la mère chérie
Martyrisée par nos engins
Aux vibrations bien trop pures
Pour nos âmes de demi-humains
Reçoit l'amour de tes enfants
Qui ont conscience et intuition
Qui malgré les interférences
N'ont pas oubliés la mission
Chevalier dans la brume
Qui entend sonner le glas
Levant un sabre de feu
Devant un paradis de glace
Pardonne nous la division
Diablo à bien fait son travail
On a retrouvé ta chaleur
Sous leur béton et leurs gravas
Siècle charnier c'est le changement
Qui viens frapper à notre porte
Accueillons-le le cœur léger
Pour passer à une autre époque
Oh Pachamama
Oooh Pachamama
Oooh Pachamama
Oh Pachamama",https://genius.com/Keny-arkana-alterlude-pachamama-lyrics
