title,album,year,lyrics,urls
Le missile suit sa lancée,Entre ciment et belle étoile,2006,"Dis-leur que c'est l'heure, dis-leur que l'missile rentre dans la machine
Ma rage, sa maison mère, dis-leur qu'ils ne pourront pas fliquer mon anarchie
Dis-leur que j'suis trop à cran pour me formater, tu captes ?
Que j'suis pas une rappeuse mais une contestataire qui fait du rap
Dis-leur que ça vient du 13, M.A.R.S pour les villes en détresse
Anti-système, les miens m'ont dit: ""ma soeur, mais dis-leur qu'on les crève !""
Dis-leur que j'aurais le poing levé jusqu'a ce qu'on vienne m'abattre
Que c'est l'heure de choisir son camp, la liberté d'expression en cavale
Dis-leur que j'en ai rien à péter des stars !
Marginale à la plume énervée, s'te plait ne m'met pas sur un pied d'estale
Anonyme dans la masse avec un haut-parleur
Dis-leur qu'on croit en la justice du ciel et pas en la leur !
Dis-leur que j'suis pas de celles qui ne pensent qu'a rafler
J'essaye de filer d'la force par la foi pas facile avec un coeur balafré
Mon rap continue d'avancer sans une esquive
Le missile est lancé, ça j'te l'ai annoncé dans une esquisse
Dis-leur que le missile s'apprête à rentrer dans la matrice
Insurgé car leurs normes sont condamnatrices
Dis-leur que c'est le chant des oubliés, le coeur des opprimés
Dis-leur que c'est l'heure, dis-leur qu'on nous a trop endoctrinés
Dis-leur que le missile s'apprête à rentrer dans la matrice
Insurgé car leurs normes sont condamnatrices
Dis-leur que c'est le chant des oubliés qui ne veulent plus être passifs
Dis-leur que c'est l'heure, dis-l'heure car mon rap connaît sa cible
Dis-leur que mon rap est un appel à résister
Dis-leur que j'appartiens qu'a mes idées
Irrécupérable, c'est plus que décidé
Dis-leur que j'me fous de leurs médailles et d'leurs galons
Que mon rap est ma came seulement si mon coeur est mon garrot
Dis-leur que c'est trop tard pour désamorcer l'engin
Qu'il vole au-dessus de Babylone représentant la rage des soeurs et des frangins
La rage ! Tous les oubliés du monde tapant derrière les portes
Verrouillées, parfois l'envie de tout piller nous monte !
Dis-leur que le thermomètre à pété dans l'incendie
Elevés dans la violence du système , dis-leur qu'on l'a bien sentie
Dis-leur que mon rap est ma revanche
J'envoie le missile dans la machine
Avec la folie de croire qu'il lui explosera dans le ventre !
Dis-leur que c'est ma seule raison de sauter dans le vide
Ou que j'atterrisse ce sera avec la rage du peuple dans le bide
Dis-leur que j'm'en vais flinguer les sentinelles
Appelle-moi la marseillaise, plus révolutionnaire que ton chant sanguinaire !
Dis-leur que le missile s'apprête à rentrer dans la matrice
Insurgé car leurs normes sont condamnatrices
Dis-leur que c'est le chant des oubliés, le coeur des opprimés
Dis-leur que c'est l'heure, dis-leur qu'on nous a trop endoctrinés
Dis-leur que le missile s'apprête à rentrer dans la matrice
Insurgé car leurs normes sont condamnatrices
Dis-leur que c'est le chant des oubliés qui ne veulent plus être passifs
Dis-leur que c'est l'heure, dis-l'heure car mon rap connaît sa cible
Dis-leur que c'est sincère dès lors que ma plume s'exprime
Rage ancestrale, dis-leur que le rap a perdu ses esprits
(Dis-leur, j'me fou de la tendance et de ce que les gens disent, que j'me fou de leurs contrats, que j'reste libre comme l'air)
Dis-leur que c'est mes tripes que j'te sers avec du style
Que même signée en maison de disques j'aime tirer sur ton industrie !
(Dis-leur, j'fermerai pas ma gueule, dis-leur que j'oublie pas pourquoi jcause, ni pour qui encore moins contre qui)
Dis-leur que j'oublie rien, dis-leur que je reste sur ma rive
Heureuse de faire stresser les fils de chien qui insultent ma ville
(Dis-leur que j'oublierai jamais d'ou je viens, dis-leur peu importe c'qui m'attend, c'qui m'accueille j'marcherai vers ma vérité)
Dis-leur que si la vie me réserve la gloire, j'ai pas trop hâte
Laisse-moi dans mon maquis car le moove hip-hop est bien trop hype !
Dis-leur que j'avance là ou les traîtres rechignent
Si t'es down, fait tourner le son, moi j'cherche le nombre et pas le chiffre !
Dis-leur ..
J'reste fidèle à mes engagements
Dis-leur..
J'reste libre comme l'air
Dis-leur..
J'oublierai jamais d'ou je viens
Dis-leur
J'fermerai pas ma gueule
Dis-leur..
J'marcherai vers ma vérité",https://genius.com/Keny-arkana-le-missile-suit-sa-lancee-lyrics
Entre les mots : Enfant de la terre,Entre ciment et belle étoile,2006,"Les pieds bétonnés dans le ciment
Le regard vert l'infiniment grand
Siècle XXI, prison de peur et d'illusion
Ils aimeraient nous faire croire que nos vies ne valent rien
Enfants déracinés, enfants des grands ensembles
Elevés dans la violence du système aux rêves brisés sous le poids de leur schéma
Perdus au coeur de la machine, il nous reste cette flamme
Souffle de vie pour éclairer le chaos de leur monde
Parachuté dans l'histoire
Enfant de la terre, prisonnier du ciment, ne perd pas de vu les étoiles
Entre la rage et la foi
Entre la souffrance et l'espoir
Entre la haine et l'amour
Entre la rancoeur et le pardon
Entre le système et la vie
Entre nos peurs et nos aspirations
Entre la terre et le ciel...
Tiraillés dans une dualité permanente
Entre ciment et Belle étoile...",https://genius.com/Keny-arkana-entre-les-mots-enfant-de-la-terre-lyrics
Entre les mots : du local au global,Entre ciment et belle étoile,2006,"Les pieds bétonnés dans le ciment
Le regard vert l'infiniment grand
Siècle XXI
Prison de peur et d'illusion, ils aimeraient nous faire
Croire que nos vies ne valent rien
Enfant déraciné
Enfant des grands ensembles
Élevé dans la violence du système aux rêves brisés sous
Le poids de leurs schémas
Perdu au cœur de la machine, il nous reste cette flamme
Souffle de vie pour éclairer le chaos de leur monde
Parachutés dans l'histoire
Enfants de la terre, prisonnier du ciment, ne perd pas de vue
Les étoiles
Entre la rage et la Foi
Entre la souffrance et l'espoir
Entre la haine et l'amour
Entre la rancœur et le pardon
Entre le système et la vie
Entre nos peurs et nos inspirations
Entre la Terre et le ciel... Tiraillé dans une dualité
Permanente
Entre ciment et Belle étoile...",https://genius.com/Keny-arkana-entre-les-mots-du-local-au-global-lyrics
Ne t’inquiète pas,Etat d’Urgence,2016,"Ne t’inquiète pas, tout se dérègle, les eaux montent et l’air se réchauffe
Chaque jour, des espèces disparaissent
Mais bon, demain sort le dernier Smartphone, alors ne t’inquiète pas
Ne t’inquiète pas, non ne t’inquiète pas...
Ne t’inquiète pas...

Non, ne t’inquiète pas, on gère les choses, tu peux continuer à dormir
Du sang et des larmes sur la terre des hommes, 'faut bien vendre des missiles et de la torpille
Oui, ça fait un bail que la paix est morte, on manie les mots et les projets sordides
Nous sommes à la fois les pyromanes, les pompiers et on te vendra la porte de sortie
Oui, mais ne t’inquiète pas, si les armes se propagent à toute vitesse
Si la drogue assassine, c’est bon pour le business
Le gain ça se mesure, et pas la tristesse
Alors laisse, et ne t’inquiète pas... Lundi sort la nouvelle série 7
Tu vois, ne t’inquiète pas... et si tu as peur, il y a le 17
Alors ne t’inquiète pas, si la détresse enflamme la Terre
Jusqu’à voir des jeunes commettre l’impardonnable
Des familles innocentes sous les feux de la guerre
Et le nom de ton village ne sera même pas nommable
Des séreux en kalash' qui se cachent derrière Dieu contre la foi de l’autre
Des forces impérialistes qui bombardent des enfants, des vieux 
au nom des Droits de l’Homme
Mais ne t’inquiète pas…

Laisse-nous te bercer à voix basse
Laisse-nous te raconter des histoires
Laisse-nous réfléchir à ta place
Pendant que tu te divertiras...
Laisse-nous faire à huis clos, la tendance qui concerne ta planète
T’inquiète pas, demain sort le dernier Smartphone et tu pourras dormir avec…

Ne t’inquiète pas, si le ciel devient rouge, si les cœurs deviennent braises
Si pour des guerres d’égo, le sang coule, et si aucunes paroles ne se pèsent
Si partout sur le globe, l’injustice béante fait croître l’esprit de vengeance
L’amour est la lumière de l’âme, mais qui a conscience de ce que le manque d’amour engendre ?
Mais ne t’inquiète pas, le business est bon, on compte le monde en dix chiffres
Jouer à la guerre, c’est bon pour les comptes, et en temps de crises les riches s’enrichissent
Peu importe les cris de détresse, qu’on étouffe à coup de matraque, à coup de machette
Des femmes, des enfants, des dictat', des paramilitaires, des organes, ici-bas tout s’achète
Mais ne t’inquiète pas, si l’âme du monde crie de douleur
Le monde changera quand 51% de l’humanité incarnera l’amour de tout cœur
Pas un hasard, si hommes de pouvoir incitent implicitement à la haine de l’autre
Plus le mensonge est gros, plus il passe, mais qu’est ce qu’on inventerait pas pour dissimuler sa soif d’or noir ?
La culture de la violence se propage, elle fait des dégâts
De cause à effet, à quoi s’attend-on quand les armes et le sang inspirent l’art d’un peuple en général ?
Si tout ce qui est vénéré est tout sauf vénérable
Tout ce que ça peut générer dans un monde exécrable
Frustrés et excédés, facile de perdre l'éclat
De péter des câbles et d’un jour de rejoindre les cœurs de glace

Te demande pas pourquoi, on réfléchit pour toi...
Consomme sans voir que l’on fonce vers un trou noir...
L’âme du monde crie de douleur, personne ne veut voir...
Baisser la tête c’est un jour s’en mordre les doigts

Ne t’inquiète pas, si la plaie a le visage de l’indifférence
Si on crée des barreaux juste en légiférant
Aucune humanité, jusqu’à l’indigestion
Divertir rime avec diversion
La haine engendre la haine, le sang engendre le sang
Sécurité musclée pour instaurer la paix : difficile d’en comprendre le sens
Mais ne t’inquiète pas, si des monstres de verre s’érigent vers le ciel, comme pour surveiller nos vies
Nous cachent en plein jour l’horizon et l’soleil et nous lèvent les étoiles de nos nuits
Somnambules rigides, on se renferme sur nous-même, on se bloque, paradis des momies
Handicapés émotionnels, on s’brûle dans la colère, on s’brûle dans l’euphorie

Laisse-nous te bercer à voix basse
Laisse-nous te raconter des histoires
Laisse-nous réfléchir à ta place
Pendant que tu te divertiras...
Laisse-nous faire à huis clos, la tendance qui concerne ta planète
T’inquiète pas, demain sort le dernier Smartphone et tu pourras dormir avec…",https://genius.com/Keny-arkana-ne-tinquiete-pas-lyrics
L’histoire se répète,Etat d’Urgence,2016,"On a dit non à la guerre, personne n'écoute, personne n'entend
Avant tout enfant de la terre, les frontières ne sont qu'illusion
Une seule et même planète, une humanité aux mille facettes
Une humanité aux mille couleurs, une humanité qui meurt dans sa chair
On a dit non à la guerre, non à la famine, non à la peur de l'Autre
Non à obéir à la hiérarchie lorsqu'elle prononce des paroles de mort
Du Sud au Nord, qu'est-ce qu'on honore ? Quelles sont les valeurs ?
L'autre est ton miroir, frapper son reflet c'est s'frapper soi-même
Et l'briser c'est plus de 7 ans de malheur

Et l'histoire se répète... x4
On a dit non à la guerre, à la guerre, à la guerre... On a dit non ! x2

On a dit non à la guerre, non à la spirale meurtrière
C'est toujours les civils qui payent et toujours les mêmes erreurs qu'hier
Dis-moi qui a son cœur est fidèle ? Et je te dirai qui pense par lui-même
À l'ombre d'une querelle millénaire, il ne tient qu'à nous pour rejoindre la lumière
On a dit non à la mort de l'Autre, non à la haine, non aux rapports de forces
Non aux troupes armées d'une vengeance à vif
Dis, tes terroristes, qui leur vend leurs drogues ? Qui leur vend leurs armes ?
C'est bien plus rentable d'tirer des engins que de faire la paix
Trouver des ennemis, l'innocent meurtri le deviendra demain

Et l'histoire se répète... x4
On a dit non à la guerre, à la guerre, à la guerre... On a dit non ! x2

On a dit non à la guerre, non à la perte humaine que vous dîtes collatérale
Non à l'exploitation de la misère qui pousse à traiter les Hommes comme des rats
La tête sous l'eau avant de voir le danger, on l'perçoit à la forme des vagues
On ne résout rien à exprimer des pulsions à la force des flammes
On a dit non à la guerre depuis qu'on a l'âge de comprendre
Pars en prison pour une bagarre quand ton pays ne parle que de vengeance
De l'art d'être impitoyable, légitimise ses attaques
Avec des tas de palabres qui n'ont rien de vraies quand les bombes éclatent

Et l'histoire se répète... x4
On a dit non à la guerre, à la guerre, à la guerre... On a dit non ! x2",https://genius.com/Keny-arkana-lhistoire-se-repete-lyrics
Effort de Paix,Etat d’Urgence,2016,"Celui qui ne reconnaît pas ses erreurs
Est incapable de progresser
À l'échelle d'une société c'est pareil
Alors les mêmes seront oppressés
On brasse, on brasse beaucoup de vent
Trop, peut être à force d'être trop pressé
On érige des murs et des murs
On nous enseigne que s'enfermer c'est se protéger
Les prétextes sont démesurés
Et les arguments souvent trop légers
Des raccourcis islamophobes ici
Un réseau kamikaze sur l'autre chaîne
L'impétuosité politique extérieure
Louée dans le pays comme un beau projet
Et se répètent les mêmes erreurs
Spectateurs oui on pourra se le reprocher
Écoute et regarde ce qu'il se passe !
Quinze piges de guerres perfides
Ça dit défendre les droits de l'homme
Les avions prêts et pleins de missiles
Politique de la surenchère
Qui avec son verbe divise
Mais qui divise propage les graines
D'une future guerre civile
Messieurs je vous prie de remballer cet air cynique
Condescendance est plein de flamme
Veut imposer ses pleines limites
Chacun défend sa propagande
Plus rien n'est véridique
L'inquisiteur a toujours brûlé ce qui lui semblait hérétique
La même boucle se répète, chaque fois plus globale
Ne cherchez pas de prétextes, notre système n'a aucune morale
Basé sur le profit et la dette et une domination totale
Jusqu'au plus profond de nos imaginaires
Qui de nos rêves est l'architecte ?
Seuls les murs s'élargissent
Les peurs et les tas de chimères
Non y'a plus de démocratie, les gouvernements se fascisèrent
Où sont les armes de destructions massives, on n'oublie pas hier
Médias, complices du mensonge, à l'information arbitraire

Besoin d'un effort de paix
L'ennemi n'est pas l'autre
Le feu n'est pas un baume
Besoin de croire en l'humanité
Un peu de cœur entre les hommes
Ou le monde plongera dans l'horreur
On a besoin d'un effort de paix
Non l'ennemi n'est pas l'autre
Le feu n'est pas un baume
On a besoin d'un effort de paix
Quand nos médias ne sont que la peur et la haine
Car nos politiques ont mille raisons de faire la guerre

Celui qui ne voit jamais ses tords est incapable de voir juste
À l'échelle d'une nation c'est pareil
Sa propre limitation crée sa chute
Ici, ici les mots sont vides car les plus beaux
Ne sont que façades et parjures
À l'heure où les identitaires font froid dans le dos
À clamer leurs idées de race pure
Le manque d'amour partout
La peur ne se combat pas, elle se rassure
La haine est un poison, un nuage rouge sang envahissant le bleu azur
Sans compréhension mutuelle, la paix ne sera jamais plus qu'une statue
Parce que l'on n'a pas appris à se comprendre mais à juger
Le chemin sera long et abrupt
Encore faut-il savoir ce que l'on veut !
Oui est qu'est-ce  qu'on veut
La solution ou le problème ?
Boire la tasse à chaque vague parce que les coupes sont trop pleines
Si facile d'accuser l'autre de confondre les symptômes et les causes
Le biz de l'armement aura toujours le sang pour promesse !
L'or noir fait tourner le monde et agite les marionnettes
La pression monte, on s'habitue, peuvent  exploser les baromètres
Regarde dans ton miroir, y a pas que les médias qui ne sont pas honnêtes
Ne comprendra jamais l'autre celui qui n'a pas d'oreilles
Conquistadors acclamés comme un justicier
Terreur utilise Dieu ou sécurité pour se justifier
Légitime résistance amalgamée dans le tas
Peuples mutilés dont jamais le monde n'aura eu pitié
En repeat que retient-on des erreurs d'autrefois ?
Penser par soi-même, plus important que ce que les autres croient
Pas une menace mais un miroir, l'autre un autre soi
Qui sème la guerre la récolte comme l'écho de sa propre voix

On a besoin d'un effort de paix
Non l'ennemi n'est pas l'autre
Le feu n'est pas un baume
Besoin de croire en l'humanité
Un peu de cœur entre les hommes
Ou le monde plongera dans l'horreur
On a besoin d'un effort de paix
Non l'ennemi n'est pas l'autre
Le feu n'est pas un baume
Quand nos médias ne sont que la peur et la haine
Car nos politiques ont mille raisons de faire la guerre",https://genius.com/Keny-arkana-effort-de-paix-lyrics
Une seule Humanité,Etat d’Urgence,2016,"Tellement loin d’être en paix avec nous-mêmes
Comment être en paix avec les autres ?
Après tant de mauvais plis, faire preuve de bienveillance nous demandera des efforts
L’indifférence n’est pas la paix
La solution n’est pas dans la révolte
Sublime la sève, le combat ultime
Se jouera au dedans de nos écorces
Discerner ses travers et ses torts
Et pouvoir en accepter dès lors
L’chemin de la métamorphose, c’est dans le cœur de l’Homme
Que Dieu a caché ses trésors
À chacun sa couleur et ses forces
Étreindre la Vie dans toutes ses formes
Au bord du vide, il ne reste plus
Que la chute libre ou le plein essor

Alors redeviens léger
Comme un enfant, léger
Comme une plume, léger
Comme un souffle, léger
Une seule et même Humanité, on est ensemble !
On est ensemble !
On est ensemble !
On est ensemble !

La Lumière de l’Âme c’est l’Amour
Qu’elle nous bénisse là où nos pieds se poseront
Que la paix soit sur vous, sur nous
Sur nos morts, sur nos vivants, de la paix pour le monde
Dites aux grands de la Terre, si petits soient-ils
Que toute vie est sacrée pour de bon
Qu’aucun mur ne protège, on a le cœur pour refuge
Et les erreurs du passé pour leçon
Arrivera ce qui arrivera, mais c’est maintenant qu’on doit se poser les bonnes questions
Améliorer le monde c’est arrêter de faire de son petit ""moi-je"" une obsession
Faire la guerre est un échec, une insulte à la vie, qu’on ne se trompe pas d’oraison
On doit se réinventer, on a déjà trop expérimenté le stress et l’oppression

Alors redeviens léger
Comme l’insouciance, léger
Comme un souffle, léger
Une seule et même Humanité, on est ensemble !
On est ensemble !
On est ensemble !
On est ensemble !
 (x4)
C’est si simple la paix
Moi je veux bien commencer
Juste un sourire peut-être juste pour apaiser ta plaie
Un regard complice pour te rappeler l’Humanité
Nous voulons la paix !
C’est si simple la paix !",https://genius.com/Keny-arkana-une-seule-humanite-lyrics
De quoi es-tu si sûr ?,Etat d’Urgence,2016,"De quoi es-tu si sûr, la vie, la mort, le dilemme ?
Le souffle, l’Esprit de l’Homme, sa relation à lui-même ?
Les Forces qui le maintiennent, les Forces qui l’animèrent
Son rapport à l’animal, aux plantes et au petit règne
Sa place sur terre, sa difficulté à s’y faire
Ses désirs impossibles à satisfaire
Cette éternelle quête de bonheur
Ce besoin de chercher ailleurs
Quand la profondeur intérieure reste encore un mystère
De quoi es-tu si sûr, des limites et limitations ?
Droits, carrés, bien rangés d’une petite façon
Au rythme des vacances, des soldes, des liquidations
Est-ce que la vie active peut au final mener à l’inaction ?
J’nous le demande, j’ai encore plein de questions !
Non messieurs ! Les questions ça méritent pas d’objections
Qui a le courage de quitter ses schémas de protection ?
Et de fouiller derrière ses propres projections ?
Dis-moi qui ?

Mais où vas-tu avec tes suffisances ?
Même l’univers s’expand, chaque jour que Dieu fait !
Le soleil ne brille pas que dans un sens
Et ne se lève pas quand tu l’crois se lever
De quoi es-tu si sur, mon ami ?
De quoi es-tu si sur, mon ami ?

De quoi es-tu si sûr ?
Discernes-tu l’inconnu et l’absence ?
Le rêve et la réalité si tu fermes tes cinq sens ?
Fais-tu la différence entre attente et patience ?
Et entre manque d’audace et pas de chance ?
Arrives-tu à percevoir derrière les apparences
À distinguer le chemin entre le malaise et la carence ?
À écouter l’intuition jusqu’à sentir à l’avance
De ne pas faire tienne une vérité qui au fond de toi n’a pas de sens ?
De quoi es-tu si sûr ? De quoi as-tu si peur ?
Sais-tu te préserver des pressions extérieures ?
Face aux dogmes et aux passions pleines d’aigreur
Même face à la majorité, rester fidèle au sceau que porte ton cœur
Peux-tu te faire tes idées propres sans jamais t’enfermer dedans et tout en écoutant l’autre ?
Voir ce qui nous unit, plutôt que ce qui nous divise
À l’heure où on se demande qui est le plus humain entre l’animal et l’homme

Mais où vas-tu avec tes suffisances ?
Même l’univers s’expand, chaque jour que Dieu fait !
Le soleil ne brille pas que dans un sens
Et ne se lève pas quand tu l’crois se lever
De quoi es-tu si sur, mon ami ?
De quoi es-tu si sur, mon ami ?

De quoi es-tu si sûr ?
À quoi t’identifies-tu ?
Vois-tu qu’il y a autant de chemins qu’il y a d’individus ?
Tous les rayons mènent au soleil et les comparer serait trop bête, la Lumière est une et Indivisible
Pourquoi parler d’unité est bien difficile ?
À qui profite que tout le monde se divise, depuis quinze, dix piges ?
Les politiques de plus en plus insipides
Violents et sans limites souvent avec médias comme assise
Quelle liberté quand les choix sont minimes ?
On en est là ! À hésiter entre la peste et le choléra !
Sachant que les deux jouent des manigances les moins tolérables
Ce n’est pas à la guirlande, mais à ses fruits, que l’on reconnaît l’arbre !
Es-tu si sûr à t’y jeter corps et âme ?
Sais-tu prendre du recul même avec un cœur au bord des larmes ?
Discernes-tu la grandeur de l’humble ?
Passe la tornade, la ville trépasse mais le brin d’herbe est encore là !

Mais où vas-tu avec tes suffisances ?
Même l’univers s’expand, chaque jour que Dieu fait !
Le soleil ne brille pas que dans un sens
Et ne se lève pas quand tu l’crois se lever
De quoi es-tu si sur, mon ami ?
De quoi es-tu si sur, mon ami ?",https://genius.com/Keny-arkana-de-quoi-es-tu-si-sur-lyrics
Etat d’urgence,Etat d’Urgence,2016,"Extraits sonores :
Le gouvernement va demander aux parlementaires la prolongation de l'état d'urgence pendant trois mois. Mais le Président veut aussi modifier la Constitution pour donner une assise juridique à ces mesures exceptionnelles
317 personnes ont été placées en garde à vue pour une participation à une manifestation interdite
Les clients sont sommés de garder leurs mains à plats sur les tables. Les policiers entament alors une fouille musclée de l'établissement
Chez les maraîchers bio, en Dordogne, qui ont été perquisitionnés...
Des portes défoncées, des fouilles, des assignations à résidence. Mais tout cela est-il toujours justifié ?
Aujourd'hui, peut-être parce qu'ils ont manifestés contre Notre-Dame des Landes il y a trois ans, ils ont souffert d'une perquisition à domicile au petit matin
On a, dans les médias français, un alignement sur cette propagande
Si j'ai bien compris, l'état d'urgence, ça sert à se passer de l'avis du juge. Et l'inscrire dans la Constitution, ça sert à se passer de l'avis du Parlement
Il y a une erreur
Que les gens comprennent qu'avec cet état d'urgence, ils ne sont pas plus protégés, mais moins protégés
Un lycéen de 15 ans face à trois CRS
La France n'a jamais paru aussi divisée, écartelée
La population comme le monde politique ...

Samples de Keny Arkana (Version album) :
Comme si la répression avait la grâce d'apaiser le malaise
Modernes conquistadors
Quand la peur parle, le peuple acquiesce
Modernes conquistadors dans un spectacle médiatique
Eteins ta télé
Terrorisme d'Etat
Propagande de peur pour orienter l'opinion
Manigancer des drames
Racisme colonial
Nouvel ordre officieux
Mesdames et messieurs, veuillez ouvrir les yeux
Car le monde sera votre propre sort",https://genius.com/Keny-arkana-etat-durgence-lyrics
