title,album,year,lyrics,urls
Nature sauvage,L’Esquisse 2,2011,"Fluide comme l'eau, libre comme l'air
Comme l'éther, pur comme le feu et solide comme la terre...

A la mémoire des nôtres, de nos galères et des potes
Des coups de sang énormes et du poids sur les épaules
A la lumière de nos torts, de nos erreurs et des vôtres
A la folie de l'époque, à tous les fruits de nos révoltes
A nos rêves qui se vautrent, au monde qu'on nous a laissé
Aux idéaux qu'on porte, dans les tripes de nos âmes blessées
Aux nôtres qui s'endorment la haine au ventre
Nos rêves d'enfant, à l'air, au vent... A fond !

Voici que reviennent les sauvages, secouer ceux qui dorment
Dans leurs cages dorées, nous sommes venus briser vos idoles
Nous sommes ceux qu'on ne dompte pas, ceux qui viennent crier sur les toits
La digne liberté perdue, Que la nature reprenne ses droits !

Le vent effrite nos poids, souffle sur nos voiles
Les poumons plein de rêves, laissez passer les sauvages
Au delà de vos lois comme l'Amour, comme le temps
Comme la mort, comme le vent, comme la vie, comme le Grand
Bienvenue dans la création, sachez que ce n'est pas la vôtre
Libres enfants de Dieu, ce n'est pas votre veau d'or que l'on adore !
Sous les canons des ordures
Ils nous ont mis du plomb dans les ailes...
Alchimistes, on en a fait de l'or pur !
Dîtes-leur qu'on ne dort plus, que leur monde est tordu
Qu'on évite les torpilles de leurs psychiques tortures
Même si ça vous importune, on porte une cause
Ami d'infortune, déploie tes ailes, et deviens qui tu es, ose !",https://genius.com/Keny-arkana-nature-sauvage-lyrics
Marseille,L’Esquisse 2,2011,"Marseille,Marseille
Marseille,Marseille...
Marseille,Marseille
Marseille,Marseille...

Centre ville, M.A.R.S, pas besoin de présenter ma ville
Ça rappe depuis les premières heures
 microphone branché à vif
Ça rappe dans tous les coins, se rappelant du rap d'hier
3ème génération d'Mc's arrive déjà la 4ème
Identité Marseillaise, ni New York, ni Atlanta
Nous, on reste fidèle à nous mêmes on attend pas, nous on s'en bat
On garde l'honneur des gens d'en bas, énervés ou nonchalants
Trop sincère 
Le numéro 1 s'appelle à jamais Luciano
Marseille, Marseille, a toujours fait vibrer la France
Fut un temps où tout l'Hexagone rappait même avec l'accent
J'en place une pour les absents, puis une autre pour tous nos anciens
Tu dis qu'on chiale, toi ? Mais ferme-la, et colle ta tête aux enceintes!
Nous, on rappe avec des principes la main sur le coeur
Avec des principes et j'insiste, car dans dans ce biz, trop de frères qui vacillent
Faire le fou c'est facile, rester vrai c'est fragile
M.A.R.S c'est magique un peu de coeur qui enraye la machine

Tu verras pas venir le coup d'éclat
L'école du rap de Mars te fout des claques
Qui a dit que le rap du sud était mort? Ici le flux est énorme
1.3, centre ville, quartiers sud, quartiers nord

Marseille atterrit dans les charts, revoilà le vaisseau spatial
Ya ceux qui restent et ceux qui partent nous c'est du vrai son de spartiate
C'est notre Histoire qui parle d'elle même, bselmek
A vouloir faire du fric mon frère, on s'est foutu dans qu'elle merde ?
Des balles envoyées pêle-mêle, le son c'est la cour martiale
Les MC's cherchent la somme, la vie de rêve, le jeu du Barça
En face d'Alger et de Casa, de ceux que ceux qui gouvernent ignorent
Trafic et 
Western Union
, miracles et destins ignobles
Rien à prouver à personne, faut juste répéter les coups
Que ceux qui viennent pas nous péter les couilles!
Eh couz,micro ouvert, j'compte rester jusqu'à plus d'heure
Chez nous, même les voyous ont du respect et de la pudeur
Je suis de ceux qui boxent avec les crocs, comme monsieur bors avec les mots
J'traite pas avec les flûtes, avec les toxs, avec les faux
J'vide mon chargeur, vacciné et majeur
Marseillais et rajeul,de ceux qui savent rimer en levant le majeur


Tu peux pas test l'esprit rebelle, pour la ville nos écrits se lèvent
A l'heure où ceux qui touchent des primes se taisent fuck ceux qui méprisent le 13
J'dédie ce texte à la ville à part, cité marginale mise a part
Que de la ruse, elle est la capitale
Ma ville fout la haine aux normes attirante comme les phéromones
Bouillante comme le vélodrome et beaucoup plus ancienne que Rome
Sais-tu seulement d'où vient la dimension identitaire
De l'indépendance vécue à travers quelques millénaires
Une longue histoire d'immigration, un autre il sur l'horizon
Subissant intimidation, orgueil et trahison
A l'époque d'Hitler, ou à celle des rois tout rose
Elle a toujours levé un doigt aux bérets et aux couronnes
En ce moment ça part en couille, ça parle en douille dans la zone comme partout ça cartonne pour de la monnaie
Rout pour les grosses structures,rien pour le mystère
La 
capitale de la rupture, c'est pour 2013 !",https://genius.com/Keny-arkana-marseille-lyrics
Petit soldat,L’Esquisse 2,2011,"""Petit frère a déserté les terrains de jeux""

Petit soldat joue les durs, pas plus haut que 3 pommes
Déambule dans les rues, fume le shit et charbonne
Voudrait impressionner le monde, marche seul ou en bande
N'a pas l'audace dans sa poche et compte bien le faire entendre
Petit soldat cache son coeur et ses pleurs dans le vide
Il s'interdit d'avoir peur dans le meilleur ou dans le pire
A grandi si vite, qu'il en veut à la Terre entière
Petit soldat part en guerre et c'est ses rêves qu'il enterre
Petit soldat a quitté le banc scolaire et heures de colle
Les ordres des profs' pour se sentir honnête dans la déconne
Voudrait faire comme les grands, petit prince de la zone
Se foutent de tout sauf de la réputation qui se façonne
Petit soldat veut du biff et de la sape
Avance sur le fil du rasoir mais les risques, il aime ça
Lui qui est si friand de bagarre comme pour couronner le tout
Sa première garde à v', elle aura un goût de non retour

(Petit soldat)
Je rêve d'un monde sur une planète ronde
Où je pourrais être qui je suis
(Petit soldat)
Cité de béton qui m'entraîne vers le fond
Y a que la haine qui me suit
(Petit soldat)
J'en ai perdu mes rêves, avant j'avais des ailes
Leur système me scie
(Petit soldat)
Dedans on s'y perd, moi je fais tout pour qu'il pète
Ce soldat car ce monde est nocif

Petit soldat n'écoute que le rap, ni ses parents, ni la juge
De toute façon il s'en tape et est bien conscient de la chute
Il sait que ce monde est injuste, autant le niquer en beauté
Si t'es pas content, il t'injurie, tous ensemble allant rôder
Petit soldat est impulsif, forgé à la vie dure
A pris le destin à la gorge en lui riant à la figure
Planque sa peine sous sa casquette, il fume pour oublier
Il sait que ses parents s'inquiètent mais il s'est promis de tout payer
Petit soldat a des pincements là où son coeur se troue
Se sent si seul malgré la foule de sa troupe
Prêt à mourir pour les siens, oui sans un doute
Pas honnête mais loyal, donc solidaire quoi qu'il en coûte
Petit soldat n'aime pas perdre, a l'instinct des conquérants
Mauvais joueurs vaincus et cherchera la merde
Et confiant de sa poigne, de son équipe et de sa rue
Petit soldat a du zèle et de la ruse


Petit soldat ne sait plus, petit soldat à l'air triste
Il a perdu tant de plumes pour se prouver qu'il existe
Il s'est perdu dans un jeu où il ne peut démêler les fils
Petit soldat est anxieux et ne sait plus ce qu'il désire
Petit soldat est devenu grand et l'insouciance s'évade
Il découvre la peur devant la conscience de ses actes
Il change en silence mais reste prisonnier de son rôle
Baisser les armes c'est se rendre, c'est ce que dit le regard des autres
Petit soldat s'sent sale, a fait des trucs dans le passé
Pour se prouver qu'il pouvait le faire mais qu'il regrette d'avoir fait
On ne fait pas machine arrière, il sait bien que c'est trop tard
Et dans son lit, pleure des prières entre insomnie et cauchemar
Petit soldat pète les plombs, s'enfume pour fuir le monde
Entre les souvenirs de prison et de règlement de comptes
Dans le tourbillon de sa vie, a oublié qui il était
Petit soldat erre, petit soldat aimerait poser l'épée


Comme pour beaucoup de nos soldats, la fin de l'histoire est la même
Le passé te rattrape quand tu veux te sortir de la merde
A double tranchant, choisis la face de ton glaive
Et pour ne pas déraper, reste très près de ton rêve
Paix à tous nos soldats qui sont partis avant d'entendre à quel point on les aimait
Était-ce un rêve ou un cauchemar sous l’œil muet de la Lune
Car ce soir c'est trop tard, petit soldat ne se relèvera plus",https://genius.com/Keny-arkana-petit-soldat-lyrics
Freestyle Du Maquis,L’Esquisse 2,2011,"Loin de ton milieu, je rappe en direct de mon maquis
A la belle étoile, j'ai pas besoin de vos abris
Je suis l'ouragan qui ricane de toutes vos règles établies
Libre comme le vent, allez leur dire
Allez leur dire

Libre comme l'art, je me balade, fidèle à moi-même
Braque le rap à l'arrache, à la foi mène
Ma barque a la rage de ma voix, bats la race de ta loi et rien à battre de ta moyenne
Je viens de Mars' mais citoyenne de la planète
J'ai fait ma place, venant de là où y a rien de net
Je connais ma base, je m'en bats de tes paillettes
Je mange pas ton appât, voilà celle que rien n'arrête
Pour percer mon mal être, je n'ai que ma plume, je n'ai que ma tête
Enfant de la Lune, enfant de la Terre
Je marche dans la brume, dans la rue mais pas à la baguette
Mon rap aux couleurs d'alerte
Raisonne de Buenos Aires à Palerme
De ton bling-bling, on s'en balek
Instable et instinct maquisard, manie le mic comme une arbalète

Loin de ton milieu, je rappe en direct de mon maquis
A la belle étoile, j'ai pas besoin de vos abris
Je suis l'ouragan qui ricane de toutes vos règles établies
Libre comme le vent, allez leur dire
Allez leur dire

Libre comme le vent, me levant
Comme le jour, la rage dans le ventre
Comme toujours, je naquis de mes cendres
Je suis le Phénix que les chasseurs aimeraient descendre
""Libre"" écrit dans mon essence
En lettres de feu et dans tout les sens
Donc ingérable depuis la naissance
J'envoie la soumission en convalescence
Qui a cru que je n'avais pas d'aisance ?
Sur instru', mon rap n'est pas récent
Rap game indécent, m'en éloigne par méfiance
Paraissant sauvage mais je m'en bas les flancs
Car j'ai une cause à défendre
Avec une prose coupée à l'essence
Je suis juste une gosse qui remonte la descente
Qui cause et qui n'a jamais trouvé la gloire alléchante


Voici le pavé qui brise les carreaux
Le coup de cutter qui coupe les garrots
J'insiste car à cheval sur mes principes
Comme le naturel, je reviens au galop, je fascine
Coup de pied et ton escabeau vacille
T'as cru que j'avais un flow facile
J'avance debout sur un fil, c'est ainsi
Et j'en ai ras-le-bol de voir les khos assis
En guerre sans terre d'asile
Sur vos terres, je propage ma zik
Dans vos têtes, ma flamme s'agite
L'insurgée du rap a du message et de la magie
C'est la rage contre la machine
Y a ceux qui parlent et ceux qui agissent
Fragile, je te crache mon rap anarchiste
Ils ont beau tacler mais mes talons ne sont pas en argile


Loin de ton milieu, je rappe en direct de mon maquis
A la belle étoile, j'ai pas besoin de vos abris
Je suis l'ouragan qui ricane de toutes vos règles établies
Libre comme le vent, allez leur dire
Allez leur dire !",https://genius.com/Keny-arkana-freestyle-du-maquis-lyrics
J’arrive du monde de demain,L’Esquisse 2,2011,"Ouvre ton cœur et vois le monde
Vois le besoin et pas la demande
Les mains de lumière vient de l'ombre
Le monde s'écroule dans la torumente
Tous mentent et l'humain meurt doucment
Tout ce temps perdu pour que le sou rentre
Souvent on se perd, vie trop saoulante
On triomphera qu'en se soudant

Le jour où Babylone tombera
Ça sera le jour où je danserai
Flamme de Myriam de Magdala
Avec quelque chose de Florence Rey
Je triche pas mais transgresse
Et je retranscris et transmets
Et si les croisés nous transpercent
C'est pas de roses que je lancerais
Je cherche la paix au milieu de gladiatieurs
De fois je me dis que c'est comme chercher de l'humanité
Lorsqu'on t'attache au radiateur
Paradis des cœurs coupés à la peur
J'ai pris la plume comme on prend l'épée pour défendre une liberté qu'il n'y a plus
Contre leur folie qui fabule, leurs crimes et leurs abus
On pète les plombs parce qu'on sature
Ça fait combien de siècles que ça dure? Putain!
L'histoire de l'homme est son histoire
Il n'y a que lui qui puisse changer les dernières lettres de son grimoire
Passe de l'autre côté du miroir
Viens voir la vie de l'intérieur, ramène le cœur à la même couleur que l'ivoire
Chemin du retour, la mémoire nous revient comme la victoire
Le monde s'écroule mais on ne craindra pas demain parce qu'on y croit
 x2
Je viens du monde de demain
Des trucs venus lever les foules car le monde est fou
Un cri d'espoir qui vient de loin
Traversant les flammes, traversant la foudre
Issue d'une jeunesse qui en a plus rien à foutre

Génération est basta, civilisation bien fâchée
Rap poésie temascal. Salam, shalom, namasté
Écriture à l'instinct mais ne te fie pas à l'aspect
Apprends à regarder, et discerne le vrai, les bals masqués
La société, un carnaval, camarade
Où chacun danse avec le rôle qu'il s'est donné et elle commence tôt la parade
Endoctrinement, technique imparable
J'me suis cassé par là-bas. «Personne n'a vu passer la petite Arkana?»
Carnala, j'ai vu la merde donner naissance à des fleurs
Le pire frapper les hommes pour en faire jaillir le meilleur
La vérité terrasser le mensonge et l'intention de paix apaiser la peur
Y a qu'elle qui amortit le grand saut
Nous on veut vivre avec un grand V
Donc chacun sort son plan B
Dieu nous a donné la vie, il n'y a que Lui qui pourra nous l'enlever
Apaise ta peur et mets ton cœur hors danger
Ça sera peut-être l'heure d'enclencher
Venue avertir parce que
 x2

Société bétail, le tout transforme tout en détail
Venin dans les médias, les fils du diable ont des médailles
Un mic en guise de pétard, on a tous perdu les pédales
Une vrai rage, une tête de blédarde, sur la dalle où sous les Pléiades",https://genius.com/Keny-arkana-jarrive-du-monde-de-demain-lyrics
Elève-toi,L’Esquisse 2,2011,"Mesdames et messieurs bonsoir, les moutons noirs font leur entrée
Aucune d'vos manigances, ni propagandes peuvent nous déconcentrer
Afin qu'justice soit faite on crée notre code pénal sur un chant lyrical sans une fausse mise en scène
Pendant qu'certains agissent en traîtres, par-derrière nous visent en scred
Te parlent neutralité muni d'une éthique qui empeste
Mais si leur discours xénophobe t'agresse neutralise-le
T'as le bonjour de ma Suisse un doigt dans le boule cher monsieur Freysinger
Stop ! Pas plus de pub pour cette équipe de chiens
J'cogite bien plus sur mon avenir que sur Blocher et c'qu'il devient
Mais bon les faits sont al vente d'arme, faux sondages, scandales
Taux d'chômage, plans d'lâches, qu'on les condamne
Ici y'a plus l'temps pour les jérémiades
T'es d'ceux qui perdent et chialent, on est d'ceux qui s'relèvent et s'battent
J't'assure qu'on lâche pas l'steak même quand ça paraît dead
À chaque erreur j'écarte les dièzes on progresse à la Carpe Diem

Chaque échec fait partie d'une réussite
Récidive, l'important c'est d'être lucide, frérot stand up
Parce qu'on refuse d'être juste un chiffre
Leur mensonge n'a plus d'intrigue, oui ma sœur vas-y stand up
Élève-toi, relève-toi, garde la tête haute
J'suis en pleine jungle urbaine, au sein des fauves faut être aud-ch, united
Afin qu'le changement s'opère, j't'assure qu'on a b'soin d'tout le monde
La foule gronde, stand up

À l'heure où l'fascisme s'affiche sur les écrans des tas d'colons
L'Occident retombe dans ses vieux démons, dément ses vieux schémas d'antan
La peur a sonné le glas une fois de plus, c'est mort
Divisent la masse, la manipule par ses névroses
Société flippée, de plus en plus fliquée
En plein délire qui r'garde le monde par sa télé
Sans voir c'qui s'passe entre les lignes
L'étau se resserre partout c'est bien nos crânes au milieu faisant office de cible
Aux lois liberticides, comme Loppsi 2
Réveille-toi camarade, le monde t'attends
Élève-toi au-delà des clichés et des propagandes
Ils nous conditionnent le cerveau inventent des ennemis partout
Cultivent le germe de la haine, réservent un avenir hardcore
Mais qui voit ça ? Il n'y a pas de hasard
Relèves-toi de l'asphalte
Et vois qui se voile la face
La grande Europe sème ses lois crades
De plus en plus d'cynisme
21ème siècle gardes tes esprits
L'histoire n'est pas finie

Chaque échec fait partie d'une réussite
Récidive, l'important c'est d'être lucide, frérot stand up
Parce qu'on refuse d'être juste un chiffre
Leur mensonge n'a plus d'intrigue, oui ma sœur vas-y stand up
Élève-toi, relève-toi, garde la tête haute
J'suis en pleine jungle urbaine, au sein des fauves faut être aud-ch, united
Afin qu'le changement s'opère, j't'assure qu'on a b'soin d'tout le monde
La foule gronde, stand up

Je n'ai pas besoin d'être indien pour soutenir les zapatistes
Pas besoin d'être africaine, pour espérer voir l'Afrique libre
Une pensée aux clandos dans le désespoir qu'on rapatrie
C'est aux vibes d'unité et de paix que ma 'sique vibre
L'opinion publique se focalise sur Kadhafi pendant que les condés tapent l'affiche
On nous bassine avec la crise, mais saches qu'à leurs yeux nous ne sommes qu'un simple facteur économique
Manipulés par des bureaucrates qui jactent la peur au bide
Alors ma voix s'élève
Si tu baisses les bras c'est dead
J'lève mon regard vers le ciel
Pour retrouver l'extase
On n'est pas de ceux qui se taisent
Je refuse d'être admiré
Leur justice a deux vitesses
Je viens démêler c'drame
Le silence n'est plus cautionnable
Sans papiers ou Kosovars
J'm'en tape moi tant qu'on s'installe
Sachant qu'il y a deux classes de gens qui visent le sommet :
Ceux qui cherchent à y être vu et ceux qui montent pour mieux t'observer

Chaque échec fait partie d'une réussite
Récidive, l'important c'est d'être lucide, frérot stand up
Parce qu'on refuse d'être juste un chiffre
Leur mensonge n'a plus d'intrigue, oui ma sœur vas-y stand up
Élève-toi, relève-toi, garde la tête haute
J'suis en pleine jungle urbaine, au sein des fauves faut être aud-ch, united
Afin qu'le changement s'opère, j't'assure qu'on a b'soin d'tout le monde
La foule gronde, stand up
Paroles rédigées et expliquées par la communauté RapGenius France",https://genius.com/Keny-arkana-eleve-toi-lyrics
Hors Game,L’Esquisse 2,2011,"Je m'en bats la race depuis que j'suis môme, remballe tes codes et commercial
Sans un abri, j'ai traversé ma vie donc rentrer au bercail
J'sais pas trop ce que c'est, mais j'm'en tamponne, que la vibe t'emporte
Mon pote j'suis un coup de pied à la bonne conscience qui t'endort
Pudique et pourtant l'âme à l'air, à la rime j'ai taillé des mots dans ma galère
Les mêmes missiles dans la mallette, toujours...
Ca vient de Marseille, de terres colonisées
De manière plus subtile comme le départ de leur nouvelle odyssée
Ok. Pas là pour dire ce qu'ils veulent entendre
J'dirai même que comprendront seulement ceux qui doivent comprendre
Car le vrai est subtil, alors 
j'opère entre les lignes
Loin du cynisme, 
des disciples d'Iblis
, de leur élite
Fuck tes gourous dans le concept occidental
La Lumière est en nous, endoctrinés ça fait long time
Ta Vérité ne raisonne pas donc elle n'est pas pour mon âme
Venue réveiller les miens, avant de me barrer sur ma montagne...
Rien à foutre de vos règles
De votre titre, de votre jeu, de votre game
Pas de groupies, juste des soeurs et des frères
Être en vie c'est vouloir briser ses chaînes
Qu'elles soient en or ou en fer
Rien à foutre de vos règles
De votre titre, de votre jeu, de votre guerre
Pas de groupies, juste des soeurs et des frères
Être en vie c'est vouloir briser ses chaînes
Qu'elles soient en or ou en fer
Pas le temps pour la frime, t'façon j'ai jamais supporté les frimeurs
Clan des rimeurs, 
j'rappe depuis l'époque de la brigade des mineurs
Pas venue faire la star à la Lumière de la traîtrise
Moi j'fais ma life loin des projos, les vendus me trouvent intégriste
Les mêmes qui s'inclinent devant l'antéchrist et ses valeurs de merde
Tous formatés, et si j'suis libre c'est que j'ai pas peur de perdre
Mes convictions, j'les vis c'est tout ce qui importe
Le reste je m'en tape j'passe par la fenêtre quand tu m'attends par la porte
Fille du vent tu m'attraperas pas
Tralala invisible, j'arrive ici, tape dans la fourmillière, repars par là-bas
Authentique parmi les arnaques
N'accuse pas ta maison de disques
A part toi, personne n'a le pouvoir de formater ton art, man !
Fuck les mythos et leur mensonges qui beuglent
Tu sais que les vrais reconnaissent les vrais, donc les vrais reconnaissent les traîtres
Dieu m'a faite libre, 
ni gourou ni maître
Jets de lyrics taillés à brut, parfois sculptés au millimètre
Rien à foutre de vos règles
De votre titre, de votre jeu, de votre game
Pas de groupies, juste des soeurs et des frères
Être en vie c'est vouloir briser ses chaînes
Qu'elles soient en or ou en fer
Rien à foutre de vos règles
De votre titre, de votre jeu, de votre guerre
Pas de groupies, juste des soeurs et des frères
Être en vie c'est vouloir briser ses chaînes
Qu'elles soient en or ou en fer
Au mic, j'suis pas venue jouer à ""Qui veut gagner des millions ?""
Ni à la V.I.P sous les néons, 
j'suis comme Néo: mode rébellion
Tu captes pas ? On n’est pas du même monde, ton moule m'est trop étroit
Le coeur en fête et sans abri, tu vois, j’vois les Étoiles
Un oeil dans le rap, et les petites cases se cultivent
L'apologie du mal, et le diable est rendu sublime
Peu de courage, peu d'audacieux face aux fusils
Pour faire taire cette musique, quelques petites années ont suffi, tu suis?
Majeur en l'air, en paix quand les autres partent en guerre
Parce que combattre sans trêve c'est vaincre les marchands de rêves
Alors je parle d'entraide, vis à la mort
Il parait que j'suis wanted, que je porte un vase rempli à ras bord
Dans l'
under
 moi j'élabore, des rimes anti-collabos
Dîtes aux ragots, aux langues de pute et aux maquereaux
Que je les nargue au micro je m'en tape je ne m'incline que vers Là-haut
Scie mes propres barreaux, hermano t'as le salam de 
mi barrio
Rien à foutre de vos règles
De votre titre, de votre jeu, de votre game
Pas de groupies, juste des soeurs et des
Être en vie c'est vouloir briser ses chaînes
Qu'elles soient en or ou en fer
Rien à foutre de vos règles
De votre titre, de votre jeu, de votre guerre
Pas de groupies, juste des soeurs et des frères
Être en vie c'est vouloir briser ses chaînes
Qu'elles soient en or ou en fer",https://genius.com/Keny-arkana-hors-game-lyrics
Planquez-vous,L’Esquisse 2,2011,"Matraques et flingues les hyènes sont de sorties
Tolérance zéro les garde av' se remplissent
T'y as pas de faffes
T'y as du shit
Y'a les ""OUH OUH"" planquez vous!
T'y as pas de taff
T'y as du bif
Y'a les ""OUH OUH"" planquez vous!
Dur charbonneur, revendeur à la sauvette
Y'a les ""OUH OUH"" planquez vous!
Guetteur en scout ou marchand de fumette
Y'a les ""OUH OUH"" planquez vous!
Pas de carte de séjour
Y'a les ""OUH OUH"" planquez vous!
Tu traines en bas tout les jours
Y'a les ""OUH OUH"" planquez vous!

Y'a les (clic clic) planquez vous!
Y'a les (clic clic) planquez vous!
Y'a les (clic clic) planquez vous!!!
La police traine dans le secteur
Y'a les (clic clic) planquez vous!
Y'a les (clic clic) planquez vous!
Y'a les (clic clic) planquez vous!
La police traine dans le secteur

Cousins cousines, pied de biche organisé
Y'a les ""OUH OUH"" planquez vous!
Squatteur anarchiste marginalisé
Y'a les ""OUH OUH"" planquez vous!
Occupations illégales
Y'a les ""OUH OUH"" planquez vous!
Combat hors des syndicats
Y'a les ""OUH OUH"" planquez vous!
Vie à la vibe dans l'ombre est hors la loi
Y'a les ""OUH OUH"" planquez vous!
Pister de longues heures juste en bas de chez toi
Y'a les ""OUH OUH"" planquez vous!
Escaliers où on fume
Y'a les ""OUH OUH"" planquez vous!
Recherché ou en fugue
Y'a les ""OUH OUH"" planquez vous!


XXX on se couche, apéro dans la rue
Y'a les ""OUH OUH"" planquez vous!
T'y es fatigué t'y as la tête dans la brume
Y'a les ""OUH OUH"" planquez vous!
Ptite bouteille entre potes
Y'a les ""OUH OUH"" planquez vous!
Tu prend l'air, t'y es en fraude
Y'a les ""OUH OUH"" planquez vous!
T'y as pas baissé ton froc
Jeunes de quartiers ghetto-résidants
Aujourd'hui Sarko est président
Répression officielle
Y'a les ""OUH OUH"" planquez vous!
Tu vis dans la misère
Y'a les ""OUH OUH"" planquez vous!
Manifestants cagoulés dans la ville
Manifestants cagoulés dans la ville
Ciel Molotov éclairé dans la nuit
Ciel Molotov éclairé dans la nuit
Porte une cause légitime
Y'a les ""OUH OUH"" planquez vous!
Matraque fait des victimes
Y'a les ""OUH OUH"" planquez vous!
Ils sont couvert par l'état et sa mafia
(attention la police est là!)
Plus d'prévention: c'est répression à tout va
(attention la police est là!!)
Ils n'hésitent plus à tirer
(attention la police est là)
Trop d'abus policiers
Sarko est à la tête de l'état !",https://genius.com/Keny-arkana-planquez-vous-lyrics
