title,album,year,lyrics,urls
J’ai osé,Tout tourne autour du Soleil,2013,"J'ai toujours tout fait à ma sauce, j'ai pas écouté les médisants
J'ai quitté tôt les bancs de l'école qui me trouvaient trop épuisante
J'ai renié mon auréole quand mes plaies étaient trop vivantes
Contre les murs d'une cellule glauque ou sur le dos d'une étoile filante
Je suis partie loin de chez moi, ou m'a-t-on emmené de force ?
J'ai traversé mes peurs une à une de mon zen de gosse
J'ai soulevé des montagnes même sous le ricanement de l'autre
J'ai connu l'infernal et puis le rayonnement de l'aube
J'ai voulu comprendre qui avait décrété qu'ce monde pourri serait ainsi
Qu'on ne pourrait jamais rien y changer sans s'faire fracasser par ceux qui portaient l'insigne
J'ai écrit des milliers de rimes, puis j'ai sorti en m'écorchant les tripes
Gardez vos cases et vos titres sauvages, parmi les sauvages qui nagent en regardant les clips
Sans bouées de sauvetages, j'nage dans l'immensité de la life
Pente sèche ou sommet, sache que j'oublie pas d'où sont nées mes balafres
Si j'suis pas là c'est que je me balade
Feuille et stylo sur le champ de bataille
Fuck les mythos et leur plan de bâtard
Moi aussi Babylone m'a rendue malade

J'ai osé regarder mes torts (J'ai regardé mes torts)
Oui j'ai traversé des déserts (Et j'ai suivi l'étoile)
J'ai osé défier l'époque (J'ai défié l'époque)
Et j'ai osé croire en mes rêves (Sinon qui le fera pour moi ?)
Quand tous veulent te faire rentrer dans les normes (On ne rentre pas dans les normes)
Parce-qu'ils ont inventé les règles (Et prôné l'insoumission)
J'ai osé refuser les ordres (J'ai refusé les ordres)
Oui j'ai osé croire en moi-même (Chacun sa route et sa mission)

J'ai toujours été autonome, j'ai attendu après personne
J'trouvais la vie monotone, j'voulais pas connaître que la même zone
J'ai osé marcher sur le globe et dévier les codes
Pour dévisser les portes avec ma plume j'ai défié l'époque
J'ai dû affronter mes flips, mettre à l'épreuve ma foi
J'ai dû m'sortir d'la merde en rêvant d'faire entendre ma voix
Et à ceux qui prétendaient savoir, qui m'prédisaient le placard
P'tite fraudeuse au bout du monde presque reconnue à chaque gare
Donc j'démarre à fond, passe à l'action
Coup de pieds en boucle et fausse déclaration
Émanation de choses irréelles, BAM arrive et sort comme une déflagration
Jeune vagabonde qui quand la masse la prône fuit, amie de chaque bastion
Aux couleurs j'écris à la bombe les rêves sur les murs gris de la nation
Par effraction j'suis rentrée dans l'rap
J'prend c'que la vie me donnera
J'grandis chaque seconde
Et chaque seconde j'fais un doigt à vos codes barres
On m'a dit ""Laisse tomber c'est trop tard""
Mais j'ai foncé sourcils froncés
Jeune effrontée au front, j'ai osé défier l'empire


Si j'les avais écoutés j'serais devenue l'ombre de moi-même
Le coeur lourd l'âme étouffée j'avais aucune chance mais je l'ai prise quand même
J'serais devenue aigrie par l'manque d'audace de ma vie
A regarder les trains qui passent, les pieds cimentés sur l'parvis
J'aurais fini par rouiller dans sa routine et sa démence
A ne faire qu'le tour du quartier comme si tout était vide de sens
Alors j'ai sauté dans le vide, saut de l'Ange, dans le vide j'me lance
Et puis j'ai osé penser seule, oui, et j'ai osé dire c'que j'pense
J'ai osé pousser les limites, déplacer les montagnes
Braver les interdits à suivre les battements de mon âme
J'ai osé conjurer le sort et les schémas de longue date
Quitte à choquer ceux qui disent que ton passé te condamne",https://genius.com/Keny-arkana-jai-ose-lyrics
Entre les lignes #1: Nous sommes le monde,Tout tourne autour du Soleil,2012,"J'me sens impuissante
Petite goutte dans l'océan
Si vaste est l'espace, qu'on s'est comme perdu dans ses méandres
Aspirés par le néant
On a vu le poison se répandre
On l'a vu quand on était môme
Chez l'autre, l'incarne-t-on maintenant qu'on est grand?
Mélancolie des temps modernes
Y'a que des noeuds dans nos racines
Un pic, un vide éternel
Qui se donne raison à chaque fois que l'on vacille
Ils sont morts nos modèles
Qui croire? Depuis petit on nous bassine
Assis, ainsi sous le bucher de nos rêves
Balafrés car nos larmes sont de l'acide
Ne pleure pas le passé, non
L'éphémère est infime
S'accrocher à ce qui a été
Est ce qui nous a rendu infirme
Ils disent voir clair mais l'avenir a minci
Y'a plus de retour en arrière
Le château de sable ne tient qu'à un fil
Ils disent que la vie est une barrière
Même lorsque l'on insiste
Ils disent que je sacrifie ma carrière
Moi je dis que je préserve mes principes
Diront que l'oiseau n'a pas d'ailes
Aveugles jusqu'à être raciste
Clamant Dieu en incarnant son blasphème
Te répliquant que... 
Le monde est ainsi
Alors partout ça s'indigne
Hé rébellion
Comme un rayon de soleil qui nous crie
Qu'on est en vie et qu'on est des millions
L'esprit libre a surgit
Dans la ville pour sortir du silence
Munit du noble courage de celui qui n'a plus rien à perdre en criant délivrance
Petite Terre ou petite France
Tu es si belle quand tu défends
La liberté des plus faibles
Contre la violence des plus grands
Les plus grands veulent te convaincre
Mais ils t'écrasent lorsque tu trembles
Le soleil brille pour tous
Que les rois de ce monde en prennent l'exemple
La douleur nous éventre
Si on ne transmute rien
Le coeur
Devient puissant seulement s'il est relié au creux d'une main
Le vieux monde parti en cendre
Partira, je l'ai vu de loin
On enlèvera, nos pierres
De leur édifice et les pavés du chemin
La vie est un mouvement éternel
L'inertie, c'est la mort
Je vis chaque journée comme la dernière
Car chaque jour elle se rapproche
Enfant de la Terre Mère
Oui on vaincra le sale sort
En face de leur mensonge de pierre
De leur violence faudra que l'on soit fort
Car nous sommes le monde...",https://genius.com/Keny-arkana-entre-les-lignes-1-nous-sommes-le-monde-lyrics
Cherche en toi,Tout tourne autour du Soleil,2012,"Très tôt j'ai cherché à comprendre
De la maison à l'école
Les murs du quotidien serait-ce la vraie prison des hommes
La peur de ne pas être aimé
L'approbation des autres
Potentiel infini limité aux regards des normes
Ici c'est pensée unique, te la font apprendre à l'école
Refuse et ils te brisent avant de te foutre à la porte
En cours ça pue l'ennui, une peine de 15 ans de malheurs
Les yeux toujours rivés vers dehors à rêver d'ailleurs
A rêver d'aventures à l'air libre
Métro, boulot, dodo j'veux pas grandir le monde des adultes a l'air triste
Allergique à leur cadre et à leur morale à deux balles
Quel droit chemin ? Hein, d'abord répare le monde et on en reparle
Y'a pas d'exemple non, que des gens blasés
Qui ont embrassé le brasier, qui te diront soit les rangs soit les bracelets
Voulant tous te convaincre de force, tous te couler
Mais grâce à Dieu une petite voix en moi m'a toujours soufflé
 x2
Cherche en toi
Au fond de l'âme humaine
La force et la lumière
Peu importe l'endroit
Cherche en toi
Ta véritable amulette
Loin de la connerie du maître
Tout est entre tes doigts

Très tôt j'ai cherché à comprendre
Du foyer à la rue
Du tribunal à l'HP, de la cellule à la fugue
Pourquoi tant de gens sont rejetés on pourrait dire abattus
Est-ce les quotas de la société
Nous sur la rue des gosses perdus
A les entendre foutus d'avance, mauvaises graines au fleurs fanés
Neuroleptiques ou violence ils disent qu'il y'a que ça pour nous calmer
Combien ici veulent en finir là où frustration s'amplifie
Horizon no-futur ça frôle la mort pour se sentir vivre
De plus en plus dur quand y'a que la haine qui te fait chialer
Familiale rupture, la fugue et la fumette pour nous évader
Au fil du temps on se voit se dégrader
Casse-pipe mauvais casting
Juge, éduc' ont remplacé l'instit'
Pleure nos rêves derrière un spliff
Et ce que le temps passe vite
Nostalgie à chaque inspir'
Et la spirale nous aspire
Autorité arbitraire quand ces ordres veulent te briser
Oui solitaire dans rue déserte, une voix en moi me disait
 x2

Très tôt j'ai cherché à comprendre
De la famille à la zone
Faut rentrer dans le moule ou bien se fabriquer un rôle
Société est ingrate elle voudra que tu lui ressemble
Ou elle te rejettera violemment pour te faire payer pour ta différence
Elle te vendra son rêve en échange de ton âme
Ses idées seront tiennes, instaurées de longue date
Elle fabrique la haine et même le combat
Parce qu'on a tous en nous quelque chose de Columbine
Oui la masse fuit les remises en question
Kiffe-t-elle les fausses questions?
Instaure tout à l'oppression
Et même les relations humaines ne sont que possession
Tout s'énumère, se rémunère mais vit-on pour de bonnes raisons
On rit de la lumière dans l'obsession de l'obscure
Des vies entières à gamberge ou incarner que des postures
Société intolérante voudra besef te faire rentrer dans les rangs
Écoute ton cœur car il dit :
 x2",https://genius.com/Keny-arkana-cherche-en-toi-lyrics
Entre les lignes #2 : 20.12,Tout tourne autour du Soleil,2012,"Oui j’ai juré d’rester la même
Mais qui suis-je ?
Les hauts, les bas, montagnes russes affectives
Tensions internes mais je dois guérir
Sans ça, voué à périr avant la fin du périple
Dans ma dérive j’ai touché l’infinité
Je suis morte en silence et j’ai lutté dans la dignité
J’ai fait les choses par conscience, d’en bas
J’ai fait les choses par amour
Ce qui en découle ne m’appartient pas
Compte seulement l’instant présent
C‘est c’que la vie m’a enseigné
Oui demain c’est comme un autre monde
Demain rien n’est plus sûr
, le poids du monde sur les épaules
Une époque qui veut éradiquer le futur
Humanité du dernier round eu à l’usure
Alors c’est ça, que sont devenus les descendants des sages ?
Aveuglé par ce qui brille, on ne peut voir les présages
Peu Importe qu’on me comprenne ou pas je fais passer l’message
Le, le passé n’est plus, oui tout devient chimère
À la mémoire d’hier et de tous ceux qui nous quittèrent
J’ai dégringolé ravin un soir d’hiver
Depuis ne s’en libère que le parfum de mes prières
J’ai noirci des pages de griefs de larmes et de rages
Alarmes et société ou armée de lâches
Incarnée, j’ai voulu toucher les étoiles
J’étais pas prête et j’crois que j’me suis plus que brûler les doigts
Alors j’suis partie affronter mes peurs à la belle étoile
La nature m’a guérie parce que j’suis restée pieuse
Seule avec moi-même à regarder la danse des constellations
À méditer pour apaiser ma peine
Parce que société est perverse, t’écrasera si tu te perds
Te regardera de haut du haut de sa bassesse de merde
Mais où on va si même les gens qui s’aiment se taisent, se détestent
Se jugent et se vendraient contre un peu d’espèces ?
J’désespère pas je sais que tout part d'un éclat
Éclair de conscience, nan, j’obéis pas à un état
A l’heure où s’accélèrent les sortilèges des CRS
Qui fracasseraient même un cortège de veuves et d’orphelins
J’suis née dans ce monde, en le dénonçant je m’attire les foudres
Parce que je chante son effondrement un peu seule contre tous
J’suis née dans ce monde de béton, dans ce mitard
Née comme toi sous les néons glauques d’une salle d’hôpital
Bienvenue ici-bas, asile grandeur nature, communication hertzienne
Pour s’faire entendre faut brûler des voitures
Alors j’écris entre les lignes et les ratures
Entre la lumière et la brume, entre le soleil et la lune
Car j’ai grandi trop vite, je rejette la vie d’adulte
Et comme j’ai vu à qui profite la merde j’ai épousé la lutte
Toi qui es parti marcher tes rêves, je te salue
Éternel éphémère ce qui était ne sera plus
Sors de ta rue et vois le monde qui t’a vu naitre
La force est infinie comme l’univers ou l’âme humaine
Préserve ton esprit, les médias c’est l’arme du règne
Ceux qui accusent l’incendie sont souvent ceux qui l’allumèrent
Enfant de la lumière, sors de la cage intime
Aucune cause n’est perdue, aucune prière n’est indigne
Dans nos têtes, le monde s’imbibe et s’imbrique
Ça voyage en un clic, Babylone n’est qu’un crime
Ici tout à un prix, même ce qu’on n’achète pas
Frangin y’a pas qu’les stars, sens le malaise car on est esclave
La Terre est grande pourtant on n’a pas assez d’place
Monde bestial, alors on se noie en regardant l’espace
Car c’est carpe diem, au jour le jour car on ne sait pas
De quoi sera fait demain souvent les chemins se séparent
Héritiers du venin mais on ne souille pas le cristal quetzales
Nous sommes les plumes qui racontons une autre histoire
Héritiers d’une parole, d’un esprit ancestral
Malgré les interférences de l’époque
Non, on n’a pas toujours l’étoffe du message ni l’envergure
Mais on s’efforce de penser sage même dans l’amertume
Grandissant loin de la verdure mais connecté à la Terre
On a r’découvert ce qu’on croyait avoir perdu
Héritier d’une lignée rappelle-toi Babylone a plié
Nos ancêtres pour s’autoproclamer Roi
Tant de mal a été fait, peut-on soigner les plaies en les niant
Non, 
ton grand cœur
 émane des blessés
La guérison vient du pardon, oui c’est vrai
Mais pour pardonner faut aussi que chacun reconnaisse ses méfaits
Ici le tortionnaire te parle de haut, te Traite de fou
Insulte tes rêves et tes racines, s’acharne sur le peu qui reste debout
Interminable serait la liste, mais comprend le vrai problème
Guéris-toi d’abord car le monde est d’abord en nous-mêmes
C’est ce que la vie m’a enseigné dans mon calvaire
Planète bleue, arrivée un 20.12 oui j’ai pleuré la Terre
Dans des révélations, pourtant tout semble brouillé
Embourbé mais qui part en quête finira par trouver
Partout les mêmes masques sur les cœurs
C’est parce que ça aime trop sa coquille que ça refuse d’éclore
Eclore c’est douloureux mais l’ange m’a dit c’est pas trop tard
Dis-leur que petite graine deviendra baobab",https://genius.com/Keny-arkana-entre-les-lignes-2-2012-lyrics
Indignados,Tout tourne autour du Soleil,2012,"""Lorsqu’on s'aperçoit que la politique qui est menée par tel ou tel État, notamment par le nôtre propre, ne va pas vers la justice, vers la juste distribution des richesses alors la colère vient""
""Le mouvement des Indignés avait commencé à Madrid en Espagne, c'est désormais New-York  les indignés grecs  en Allemagne  à Londres ""
Indignados : vamos !

Il pleut des émeutes sur le globe
Oui la jeunesse est dans la ville
Police ne changera rien parce que l'opprimé nous habite
Parce qu'on a dit ""non"", que partout on se rallie
Au-delà des frontières et sans aucun parti
Allez leur dire !
Trop spontanée pour être encartée, pas civile
De la répression à la haine et frappe même les pacifistes
CRS acharnés, chiens d'un avenir qu'on falsifie
Fragilisée à l'heure ou la bonne foi est rarissime
Révolte se ramifie, sur chaque continent, c'est imminent
""Ingérables"" sera notre plus beau compliment
Incarnons le changement que l'on veut voir
Avant d'tomber dans un trou noir
Poussés par les chiens du pouvoir
Au jour le jour car demain n'est pas indiqué
Révolution par le bas car leur monde est mal imbriqué
Dites-leur que la rage du peuple est bien huilée
Printemps 2011 a vu fleurir des milliers d'indignés

La rue s'est soulevée à en faire trembler la machine
Indignados : vamos !
C'est l'humain qui s'est levé, mondialement et sans parti
Indignados : vamos !
Indigné lève-toi, anonyme, dans vos villes
Sous vos fenêtres on est des milliers
Tienes algo a la calle : es la rabia
Vamos ! Esperanza del mañana

Ciclo suicida
Como un grito de vida
Rebeldia unida como una suerte única
Ultima batalla : como podemos olvidar ?
Hay sangre en lágrimas sino desde ahorita
El humano salió el puño levantado
Indignados unidos con los pueblos de todos lados
Viejo mundo adios, no es que un sueño
Pero lo que llega si asustamos a los dueños
Porque somos juntos más allá de las fronteras
Levántate ! Levántate !
El mismo corazón para todos los hijos de la tierra
Levántate ! Levántate !
Los verdugos mataron la paz
Olvidaron la fuerza del amor
Acá los pueblos tienen la rabia
Pueblos unidos, vamos !


Arabe fut le printemps qui marquera l'histoire
Hacker anonyme qui fait trembler le pouvoir
La Grèce Antique, peut être fière de sa postérité
Luttant avec courage contre leurs mesures d'austérité
Indignados, s'est embrasé sur le globe
Partout a raisonné l'appel de la Puerta del Sol
Comme une trainée de poudre s'est propagée la révolte
Parce qu'au-delà de nos frontières on s'est reconnu dans l'autre
Une seule et même terre meurtrie
L'âme collective a le cœur triste
Écoute ! L'insurrection est de sortie
La rue s'est soulevée et même jusqu'aux pieds de Wall Street
Un même cœur aux milliers de racines
Comme politique fasciste, à l'heure où police assassine
Rien de facile précipice on a quitté la file
Y'a de l'espoir dans l'air écartez vous : les Indignés arrivent !",https://genius.com/Keny-arkana-indignados-lyrics
Le Syndrome de l’exclu,Tout tourne autour du Soleil,2012,"J'ai le syndrome de l'exclu
L'impression d'pas être à ma place
Mal jugée et mal vue
Depuis l'époque d'aller en classe
Dégaine de délinquante et je pue la zone à trois bornes
L'impression d'être zieutée même quand y'a dégun à bâbord
Ils nous prennent pour des primates
Ça met sur les nerfs
J'ai pas les mots, j'm'exprime mal
Et quand j'en ai plus, j'm'énerve!
Ouai je sais, c'est nul ça m'a causé des torts
Mais j'ai pas la patience de ceux qui sont restés à l'école
L'impression de déranger par ma simple présence
Quand j'suis loin du quartier et de mes gens
Je déstabilise, attise la vigilance
A faire flipper les mamies et faire stresser les vigiles
Je ressens la méfiance de l’autre comme un coup bas
Je paranoïe de ""sa"" parano' et j'me sens coupable
Depuis que j'suis môme j'en ai ras le bol
Je m'auto-exclue, car de l'exclu, j'ai le syndrome
 x2
J'ai le syndrome de l'exclu
J'cache mes blessures
Catégorie ""tête dure""
Et en manque d'air pur
J'ai le syndrome de l'exclu
Putain je gère plus
Dans ce système de lèches-culs
Qui assassine les vertus

Douleur infantile, sentiment d'exclusion alors j'foutais bordel quand j'étais petite, aucun respect pour la complaisance
Ni celle des petits, ni celle des grands, à force d’être vu comme le vilain petit canard, ça t'fait pousser les dents
Sentir la crainte c'est blessant, et petite ça m’a blessé
Alors tu deviens ce qu'ils dessinent dans leurs clichés
Une marginale qui en a plus rien à pisser
Une sauvage au royaume d'une peur trop civilisée
Tu sais, le syndrome est profond 
quand tu rentres pas dans leur format
Et que l’injustice est comme normale
Faut oser sinon t'es mort man
Que chacun de nous porte l'âme de qui il est, la vérité qu'on proclame
Prison de stéréotypes, j'suis coupable
Avec ma tête de crap's ; allez-vous en avant que j'pète un câble
Y'a que des figures hypocrites dans vos symboles
Laissez-moi dans mon coin car de l'exclu, j'ai le syndrome
 x2

Pourquoi j'me sens coupable s'il y a un vol dans l'assemblée ?
(C'est le syndrome de l'exclu)
Pourquoi la vendeuse me regarde et les vigiles commencent à trembler ?
(Le syndrome de l'exclu)
Pourquoi ceux qui me regardent de haut ne me regardent pas dans les yeux ?
Pourquoi les flics me tutoient ?
Pourquoi les bourges sont mal à l'aise ?
Pourquoi j'me sens jugée si je bouge de ma zone ?
Victime de leur clichés, dont leurs médias raffolent
 x2
(C'est le syndrome de l'exclu)
Qui m'a poussé à me battre
A être qui je suis, loin de leurs critères à deux balles
A m'en sortir par moi-même, à fuir de l'abattoir
(Exclu de leur monde)
J’accomplis ce qu’ils ne veulent pas croire
 x2",https://genius.com/Keny-arkana-le-syndrome-de-lexclu-lyrics
Cynisme vous a tué ?,Tout tourne autour du Soleil,2012,"L’ombre demeure dans les cœurs
Qui rient de la misère d’autrui
Se mentir est dans les mœurs d’un monde prétentieux qui a tout fait pour nous détruire

Cynisme a contaminé les cœurs
Il est le poison de l’homme
Il a rendu insensible à se moquer du malheur de l’autre
Distorsion intérieure c’est ces émotions qui se tordent
Comment peut on rire de l’enfant qui meurt de l’autre côté du globe ?
Mêlée à son égoïsme, intelligencia qui te snobe
Pour mieux s’acheter une bonne conscience prend la posture des philosophes
Messieurs vos théories sont glauques, penser n’est pas une fin
Mais un outil, tout comme l’argent, savez vous qu’est ce que tendre une main
Vous, connaissez vous l’humain ?
Vous, sa force sa lumière douce ?
Savez vous que malheur de l’un deviendra le malheur de tous
Deviendra le malheur des vôtres, de ceux qui se voilent la face
Car se démontera votre monde de glace et vos démons tenaces
Deviendra libre celui qui surmontera ses propres ombres
Pendant que d’autres font trembler ce monde sachez qu’on a le nombre
Sachez que la force est en nous, messieurs ne connaissent que le mental
Mais sans le cœur il est voué à rien comme votre monde lamentable

Cynisme a engourdi les cœurs, chassé la compassion
Rendu égoïste, voici l’homme et son poison
Il a profané la Terre, créant la misère du monde
En laissant les plus faibles par terre, Cynisme a l’odeur d’une tombe
Alors éloigne toi de lui, ne le nourris pas en toi
Il est l’antithèse de la vie et chasse la lumière qu’on a en soi
Alors éloigne toi de lui, ne le nourris pas en toi
Il est l’antithèse de la vie et chasse la lumière

Cynisme a envahi les foules même chez les fils des plus modestes
L’innocence fait bien rire la culpabilité de l’homme moderne
Pensée hautaine, c’est plus facile d’ironiser vos guerres
Que d’assumer les drames et les supplices sortis tout droit de vos têtes
Le petit écran et ses images ça parait loin même pas réel
Même pas choqué, habitué aux explosions hollywoodiennes
Humanité, six pieds sous terre, porte vos tyrans dans son cœur
Occident arrête de penser si ça ne te rend pas meilleur
Arrêtez de nourrir la terreur messieurs, 
partout ça meure d’ennui
Celui qui voit le diable partout porte certainement le diable en lui
Humanité meurtrie messieurs, et vos penseurs ne l’ont pas dit
Du haut de votre condescendance vous êtes devenu notre maladie
Cynisme a envahi la Terre, s’est refermé comme une volière
Elle crève à grand feu pendant que vous n’avez que la bourse à vos lèvres
Des tonnes et des tonnes de colère, partout on la parle couramment
On saigne mais 
qui sème la frustration récoltera l’ouragan
Et vous messieurs, vos cœurs battent ils encore ?
Connaissez-vous la force de vie qui se cache dans l’homme ?
On vous doit notre monde froid, cynique et glauque
Qui nous limite et nous humilie quand on rêve un peu trop fort
Savez vous qu’on voit ce que l’on croit non pas l’inverse
Et que chaque réalité à d’abord commencé par un rêve
Préviens les tiens le cynisme est le poison de l’âme
Large ennemi de la sagesse, il a déshumanisé l’homme
Cynisme a trompé l’œil en trompant le cœur de nos pères et de nos fils
La masse ensorcelée, la bêtise et la haine s’applaudissent
L’humanité ne cesse de régresser on le ressent dans nos vices
Quel bel exemple vous faites vous qui traitez compassion de sottise
Vous préférez le rapport de force, en vous cachant derrière police
Et police a bon dos vu que vous y êtes avec votre air poli
Avec vos bizs, lobbys
Vos hobbies malsains et vos combines paternalisme
A force d’être petit quand on pense
Ça donne le monde d’aujourd’hui
Ça donne des hommes plein de lâcheté
Des gosses qui crèvent aux yeux de monde
Là où tout le vivant peut s’acheter
Ça donne ce droit à l’oppresseur d’opprimer librement
Vos livres mentent, ne chantent que la victoire des vainqueurs de ce monde
Oui messieurs, c’est doucement qu’on s’est éteint à votre pensée
Et comme d’hab, vous remettre en cause nous qualifiera d’outranciers
Mais nous ne sommes pas des machines, l’amour de vivre nous rend vivant
On n’achète pas le bonheur et vos dollars ne pourront jamais stopper le temps

Messieurs vous n’êtes qu’une bande d’ingrats tellement haïs parmi les nôtres
La Terre donne à ses enfants jusqu’à ce que la Terre se révolte
Votre mental vous a coupé du cœur, vous n’êtes plus des hommes
Car la force de l’homme vient de l’intérieur et de l’amour qu’il porte
(X2)

L’ombre demeure dans les cœurs
Qui rient de la misère d’autrui
Se mentir est dans les mœurs d’un monde prétentieux qui a tout fait pour nous détruire",https://genius.com/Keny-arkana-cynisme-vous-a-tue-lyrics
