title,album,year,lyrics,urls
Pentacles et bougies,NQNT 3,2018,"La publicité m'a niqué la tête à coups de maillet
J'm'endors au volant d'ma Xantia, mon reuf est dans l'Cayenne
En PF sur la banquette arrière, dans les hanches d'Ayem
Mega sueur froide, putain d'sa mère, j'ai failli travailler

Mon équipe est gaie, mon équipe est gaie
Chaîne en or, chaîne en or, l'équipe gaie, 
j'suis sur Wikipédia
, faut qu'j'les baise encore
On est équipé gaie, toi ton équipe est gay
Fau-fau-faudrait les délivrer, hé, ils font leurs courses sur les galeries Lafayette
Pour la paix, y'a deux/trois fils de pute qu'il faut mitrailler
J'écris les textes du prochain album sur l'mont Sinaï
J'préfère la vie défoncé, gros, j'vais même pas pinailler
Hôtel, MD, la finale, blanc des yeux remplis d'grisaille
, que l'amour dans l'habitacle
La grand-mère du rap est née prisonnière dans une cave
Sa keu-schné bleue comme un ciel sans nuage, si la sacoche est vide, active le désembuage

La publicité m'a niqué la tête à coups de maillet
J'm'endors au volant d'ma Xantia, mon reuf est dans l'Cayenne
En PF sur la banquette arrière, dans les hanches d'Ayem
Mega sueur froide, putain d'sa mère, j'ai failli travailler

Pentacle et bougie
, j'entasse tes sous-fifres
En balle, ça fait pas mal de mourir, mon étendard est rouge vif
J'les té-ma d'en bas, d'en bas, ouais, mais quand bien même
Demain, c'est loin, moi qui suis loin, ça fait qu'demain c'est moi
Maudit sperme d'étuve, sois patient, un jour, t'auras des droits
Tasse-pé, m'permets-tu ? J'ai l'cœur et les flèches de Robin des Bois
Pose pas d'question, tu vas finir complotiste
Oublie tes contentieux ; 
le savoir, c'est l'plus puissant des couteaux suisses
Je renifle des saveurs qu'on trouve pas chez l'fleuriste, non
J'fais mon possible pour mon posse
J'suis dans cette bitch riche et hostile, la route est faite de virages qui s'négocient

La publicité m'a niqué la tête à coups de maillet
J'm'endors au volant d'ma Xantia, mon reuf est dans l'Cayenne
En PF sur la banquette arrière, dans les hanches d'Ayem
Mega sueur froide, putain d'sa mère, j'ai failli travailler

J'détiens la laisse du dragon, 
tu parles mais qu'est-ce tu racontes ?
Toujours que dalle sur ton compte, juste quelques gouttes sur le pompon
J'suis à l'avant du wagon, c'est moi qui ouvre le chemin
Mes doigts d'pieds dans le lagon, j'noircis quelques parchemins
J'suis loin devant, très largement, fais pas ta place très lâchement
N'aie pas la haine, et parles-en, on peut t'calmer très calmement

Tu bibis, tu détailles dans l'four
J'fais pipi, j'fais caca dans l'chour, mon kiki, mon doigt-doigt dans l'trou
Mon kiki, mon doigt-doigt dans l'trou, mon kiki, mon doigt-doigt dans l'trou
Mon kiki mon doigt-doigt, mon kiki mon doigt-doigt, mon kiki, mon kiki, mon doigt-doigt dans l'trou",https://genius.com/Vald-pentacles-et-bougies-lyrics
Symphonie,NQNT 3,2018,"*Rot*
V.A.L.D, frelon
Fonka, pétasse
Wesh

Que tous les grailleurs de verges m'appellent ""Myers, le vrai""
J'crame les tailleurs de près, tu fermes ta gueule, refrè
J'ai besoin d'mon backeur 
(Suik'on Blaze)
, d'une shneck et j'ai fait l'tour
Frustré, déchaîné fou, ça pue l'ter, c'est l'effet four
C'est vulgaire d'lécher mes boules, promis qu'ça passe le temps
Mon brolique tabasse le chanvre, vision : j'domine l'appartement
Profil de garnement, j'sodomise à balle de franges
Vomis ta carte membre, NQNT : l'appartenance
Et chaque matin, j'renfile l'armature et ça recommence
On devrait tuer les cons qui vé-trou leurs convenances désarçonnantes
J'ai l'bon plan, mes assonances font qu'les vagins transpirent
J'suis content, j'ai la semance sucé par un vampire
Enfin, une vampiresse ; la nuit, y'a mon gland qui reste
Dans l'encrier, ça retranscrit l'essentiel
Et y'a des gens qui rêvent d'errer dans l'ciel, chier sur les présidentielles
Tu rêves d'être célèbre comme un gentil gay
J'ai l'esprit torturé comme Voldo
, 
l'averse en pôle position
J'ai fait, dans mon enfance, rien d'trop folichon
Alors j'emmerde vos horizons, j'vais finir claustro' sinon
Bien trop superstitieux, j'parle pas aux los' moribonds
La fresque est grotesque, j'écarte ses grosses fesses
Elle m'dit qu'son cul efface les 'blèmes, j'aime les promesses
J'éclate ses prothèses avec les dents
, c'est l'projet par excellence
Et j'parle de déchéance, j'ai des proverbes sales et déments
C'est trop frais, 
ça les démange de comprendre Sullyvan
De fuir quand tu ris pas, c'est pire qu'une fusillade
Alors garde un œil sur tes couilles, ces vilaines s'égarent
Moi, j'connais la rue et la drogue chez I.N.C.H

Y'a pas d'mot pour décrire l'ampleur d'nos vies
La merde qui salit la blancheur d'nos nuits
Personne pense avec un trente feuilles d'olives
Personne pense avec un trente feuilles d'olives

J'ai pris des sacrées gifles, c'est pathétique, des fois, j'ai pris l'mort
Des bas-résilles fait qu'j'apprécie les soirées d'ivrognes
Quand j'r'-atterris, c'est facile, j'aime applaudir ma survie
Mec, j'ai résisté à tout, même aux hermaphrodites abrutis
Airbag horrible, à vue, j'ai foncé comme l'avant-dernier des cons
Salement, j'ai fait des bonds, attends, c'étaient des bons moments, ça
C'étaient des longs romans dans l'plein pays des grandes salopes
Avant d'les perdre, j'avais jamais détesté l'monde autant
Là, j'm'en vais rouler sans carrosse, fonce-dé dans la loge
J'suis pas certain d'avoir emprunté les bons chemins, perdu dans sa robe
Et nique sa mère, c'est bon, si j'me suis planté plus d'une fois
La de-mer fait un bon engrais, j'peux qu'évoluer sur du sale
Derrière toutes les déceptions, les doutes, sérieux, j'ai fait des rondes
Aux chiottes tous les fédérateurs, c'est pas mon truc d'lécher des joncs
C'est au moins ça d'sauver dans un passé pas si rose
Assez d'chasser la psychose à coup d'zbars et d'aléas d'cirrhose

Y'a pas d'mot pour décrire l'ampleur d'nos vies
La merde qui salit la blancheur d'nos nuits
Personne pense avec un trente feuilles d'olives
Personne pense avec un trente feuilles d'olives
Y'a pas d'mot pour décrire l'ampleur d'nos vies
La merde qui salit la blancheur d'nos nuits
Personne pense avec un trente feuilles d'olives
Personne pense avec un trente feuilles d'olives",https://genius.com/Vald-symphonie-lyrics
Maya,NQNT 3,2018,"J'lé-rou des grands tehs de chanvre, pas d'empressement
Pour ler-par sans qu'y ait de blanc, il nous faut cent verres de blanc
L'enfer me tente, 
j'les vois trembler devant, ils s'écoutent chanter le ventre
Font d'la merde dans les deux sens
, on t'la met sans perdre de temps
Le môme à l'air complètement loin d'mon malheur, j'y vais dès qu'j'ai du 'gent
Décomplexé comme Mulan, décompressé, j'ai plus l'temps, 
j'ai mon téflon exprès pour mutant
J'té-mon leur décès me séduisant, 
fleurs séchées me faisant du zèle
Putain ma vie c'est la troisième mi-temps, RDV dans l'fond du game, pour une fin appétissante

J'vais m'tatouer des hiéroglyphes mayas
La vie est cruelle, fait qu'j'ironise ma life, nan, j'ironise ta life, mes ennemis cavalent
Je sens des picotis anals lorsqu'on introduit la salle
T'avales tellement d'idioties ; moi, en CE1, je secondais Monsieur Laval
C'était le prof de maths à Savigny, Aulnay-sous-Bois
Quoi ? J'veux pas dessaouler, non, je n'veux pas voir la face de tous ces bâtards
J'déploie mes nageoires, pas l'temps pour s'asseoir
 ; iPhone en bluetooth
Car
 dans chaque main, 
j'ai hachoir
 ; tu suces ou tu t'barres, mais dis pas qu't'as pas l'choix
Y'a du pus dans l'plumard, j'ai vu l'tur-fu, dans l'tur-fu, j'ai plus mal
J'appelle Kukus alias ""Jafar""
, on concocte des brûlures fatales
Subu' sur la table
, pu-pute sur l'asphalte
Julius tient la cam'
, ça susurre que l'plus dur est fait
J'arrive pur sur l'Eden, 
je manipule FL 
(Studio)
J'veux pas vue sur Eiffel 
(Tower)
, 
j'prends le cavu du respect
J'entends l'murmure des anges entre les murs des gens
Quand la murge redescend, regarde-moi hurler, regarde-moi r'prendre de l'élan
Écoute l'impatience, dans mes paroles, qui s'immisce
J'veux faire partie des salopes qui dirigent
, 
j'vais rendre les allocs difficiles
Tu vas bouger ton cul
, pincement au cœur
Comme quand ils ont rendu l'alcool illicite, j'aborde le précipice

J'lé-rou des grands tehs de chanvre, pas d'empressement
Pour ler-par sans qu'y ait de blanc, il nous faut cent verres de blanc
L'enfer me tente j'les vois trembler devant, ils s'écoutent chanter le ventre
Font d'la merde dans les deux sens, on t'la met sans perdre de temps
Le môme m'a l'air complètement loin d'mon malheur, j'y vais dès qu'j'ai du 'gent
Décomplexé comme Mulan, décompressé, j'ai plus l'temps, j'ai mon téflon exprès pour mutant
J'té-mon leur décès me séduisant, fleurs séchées me faisant du zèle
Putain 
ma vie c'est la troisième mi-temps
, RDV dans l'fond du game, pour une fin appétissante

Ma petite, ma petite, petit à petit à petit, fais des clapotis, clapotis
Applaudis, applaudis-moi, plus j'avance, plus les autres rapetissent, rapetissent
Reptiles, reptiles veulent nous aveugler comme Daredevil, Daredevil
Sous flash de Lidl, je cale le viseur sur falsch leader, j'nargue le vide

J'nargue le vide, j'nargue le vide
Passe le shit, passe le shit
Passe-le, passe le shit
Passe le shit, passe le shit, NQNT",https://genius.com/Vald-maya-lyrics
Pas comme eux,NQNT 3,2018,"J'arrive propre comme une saloperie, vrai comme une cachotterie
Dis pas ""je t'aime"" comme une calomnie
J'm'attends pas au pire
J'm'attends à être riche, genre maçonnique
Fais pas l'fou, t'esquives pas les ""ich"" (ich)
J'suis dans l'four, lâchez-moi les miches
J'attire la fouffe comme chanteur R'n'B'
Si j'reste en bas, c'est une tragédie
Hey, oh, hey, oh
Si j't'ai fait du mal, j'suis déso'
Hey, oh, hey, oh
Ma bite rentre dans sa tête comme ""Réseaux""

J'l'ai tellement baisée (quoi ?), faut lui r'faire un clit'
À l'aise dans ma fripe, mal à l'aise quand j'arrive
J'suis jamais dans la street (never), jamais dans la street
J'la joue jamais d'la street, même pour un faire un clip
Salope qui m'aguiche, mon buzz ou ma quiche
J'trouve pas ça normiche, j'lâcherai une larmich'
Au chaud dans ma biche, en haut sur l'affiche
J'suis comme un sans abri, sans million, sans ami
J'fais toujours la Une ; comme moi, y'en a pas deux
Interview sur la 3 et l'samedi sur la 4
Pétasse, ferme ta chatte, j'ai quitté l'asphalte
V.A sur ma cape, c'est V.A sur la came
Ok, j'me fais du mal mais ça m'met bien un moment
J'suis à la r'cherche du Graal et de bonnes notes pour maman
Gros, j'm'ennuie tellement, j'pourrais faire un roman
Je suis dans les histoires si j'suis dans la romance
Quand je dis c'que j'pense, ils y voient d'l'insolence
Des fois, j'tends la main et ils y voient une offense
Faut qu'je roule un shit avant qu'la déprime commence
J'suis vraiment pas raciste, j'm'en fous d'sa provenance
Ah nan, tu veux un feat, ah nan, tu veux un hit
Ah nan, tu veux un prix, pour ça, maintenant, tu pries
Mais alors pourquoi tu cries, hein ? Parle-moi de la crise
T'as la chatte qui frise (merde) à la face d'Ibliss
J'parle qu'à des morts sans faire d'nécromancie, j'ai
La langue dans sa chatte donc j'ai l'nez romantique
Si t'en fais un, j'en génère au moins dix
J'en génère au moins six, j'en génère au moins l'double
Gros, j'ai l'pied au plancher et le nez au vent, oui
Aucun esprit revanchard pourrait m'rendre fou
Toi et tes frérots morts-saouls retrouvés en morceaux
Vous êtes pas morts dans l'film, vous faites la pub en-d'ssous

J'arrive propre comme une saloperie, vrai comme une cachotterie
Dis pas ""je t'aime"" comme une calomnie
J'm'attends pas au pire
J'm'attends à être riche, genre maçonnique
Fais pas l'fou, t'esquives pas les ""ich"" (ich)
J'suis dans l'four, lâchez-moi les miches
J'attire la fouffe comme chanteur R'n'B'
Si j'reste en bas, c'est une tragédie
Hey, oh, hey, oh
Si j't'ai fait du mal, j'suis déso'
Hey, oh, hey, oh
Ma bite rentre dans sa tête comme ""Réseaux""",https://genius.com/Vald-pas-comme-eux-lyrics
Baraccuda,NQNT 3,2018,"Fuck, it’s easy

Kamasutra sur ces rappeurs affublés comme barracuda
Si t'es rapta sous Jack, parle pas d'Allah, ça la fout mal
Flow comme Aquaboulevard, j'suis fonce-dé comme mon gars Bouddha
Faut d'la cougar et d'la mula, tout ça, tout ça, tout ça, tout ça
Kamasutra sur ces rappeurs affublés comme barracuda
Si t'es rapta sous Jack, parle pas d'Allah, ça la fout mal
Flow comme Aquaboulevard, j'suis fonce-dé comme mon gars Bouddha
Faut d'la cougar et d'la mula, tout ça, tout ça, tout ça, tout ça

J'veux tout, moi, pas ça ou ça
Petits yeux comme Yakuza, j'effrite dans la Laguna
Tu dis qu't'es pas là pour ça mais, bizarrement, t'as la bouya
La trouille peut faire cafouiller mais j'magouille plus pour faire mouiller, muah
Une vie pour un tempura, une vie pour raffler l'pouvoir
Une vie parsemée d'trous noirs, bitch, une vie sans trouver d'coupable
Le fils de pute qui coupe la beuh mérite l'Enfer
Que Jack Lang vienne et lui touche la beut
Crois pas qu'si tu fous la derme t'es courageux, j'suis pas fou, ma gueule
Je sais bien c'que cachent leurs bafouillages, gars, c'est clair
Que y'a nous, y'a eux, j'm'exerce à générer des éclairs
Dans leur trou d'balle, je touche à tout, j'veux monter tout là-haut
Pour voir tout l'monde sous ma queue, j'veux Subaru et tout d'balèze
Douze palais, ta carrière est sous l'balai, j'arrive : roue arrière
T'épouses la craie
...

Kamasutra sur ces rappeurs affublés comme barracuda
Si t'es khapta sous Jack, parle pas d'Allah, ça la fout mal
Flow comme Aquaboulevard, j'suis fonce-dé comme mon gars Bouddha
Faut d'la cougar et d'la mula, tout ça, tout ça, tout ça, tout ça
Kamasutra sur ces rappeurs affublés comme barracuda
Si t'es rapta sous Jack, parle pas d'Allah, ça la fout mal
Flow comme Aquaboulevard, j'suis fonce-dé comme mon gars Bouddha
Faut d'la cougar et d'la mula, tout ça, tout ça, tout ça, tout ça

La fin du monde attendue comme le week-end (comme le week-end)
Sale pute, la guerre au nom d'la paix : yes, we can (hé, yes, we can)
Des putes, des putes, des putes, des putes, des migraines (et des migraines)
J'ai bu, j'ai bu, j'ai bu, j'ai bu des dizaines (ouais, des dizaines)
Nez crochu cache le cracheux mais, quand il faut, crache le cash
La rage coupée au hash', corps de faucheux, propos fâcheux
La gouache pire que nois-chi, bronches noircies
Comme le tableau ta go caché comme le canon
Sully peut pro, l'horloge, bizarre, dehors, j'butine, je rote, j'm'endors, j'vis pas, j'me force
J'cuisine le boze, m'envole, j'hydrate le sol si noir de morts
Merci Richard et son fisheye, plus d'mille euros en poche
Bitch, I'm a boss, tire la tignasse fort

Kamasutra sur ces rappeurs affublés comme barracuda
Si t'es rapta sous Jack, parle pas d'Allah, ça la fout mal
Flow comme Aquaboulevard, j'suis fonce-dé comme mon gars Bouddha
Faut d'la cougar et d'la mula, tout ça, tout ça, tout ça, tout ça
Kamasutra sur ces rappeurs affublés comme barracuda
Si t'es rapta sous Jack, parle pas d'Allah, ça la fout mal
Flow comme Aquaboulevard, j'suis fonce-dé comme mon gars Bouddha
Faut d'la cougar et d'la mula, tout ça, tout ça, tout ça, tout ça",https://genius.com/Vald-baraccuda-lyrics
Possédé Framboise,NQNT 3,2018,"Un chez Dieu, très ingénieux
Vald aussi, check vodka à l'eau
Vodka framboise, framboise, framboise, framboise, framboise, framboise
Je suis dans l'noir, dans l'noir, dans l'noir, dans l'noir, dans l'noir
Inch, Inch, Inch, Inch, I.N.C.H
Vodka framboise, framboise, framboise

Comme Omar Sy, j'danse la samba, samba, samba
Six jeunes et j'arrive en balle, j'm'emballe, j'm'emballe, j'm'emballe, j'm'emballe
J'enlève même pas mes sandales, sandales, sandales, sandales (never)
J'te drague même pas, tu vaux même pas cent balles, cent balles, cent balles (rien)
J'te vise depuis les remparts, remparts
J't'écrase dans le cendar', cendar', cendar', je suis sensas', sensas', sensas' (sensas')
J'ai des groupies à la campagne, campagne, campagne
Quand j'gagne, j'pète la vodka framboise, pas le champagne, champagne, champagne, champagne

Vodka framboise, framboise, framboise, framboise, framboise
Vodka framboise, framboise, framboise, framboise, framboise
Une minute trente chez Hanouna en prime, en prime, en prime, en prime, en prime
Vodka framboise, framboise, framboise, framboise, framboise, vodka framboise, framboise

8K en trente minutes, en boîte, en boîte, en boîte
Pourquoi tu parles ? J't'emboîte, j't'emboîte, j't'emboîte, j't'emboîte
T'es H.S, t'es en panne, en panne, en panne, en panne
J'te défonce la membrane, membrane, membrane, membrane
J'ai les yeux en face des trous, t'es en vrac, en vrac, en vrac
Tu charbonnes, salope, tu pars en vacs, en vacs, en vacs, en vacs
Je chasse les reptiles et les francs-mac', francs-mac'
J'ai une fanbase dans le Cantal, Cantal, Cantal, Cantal
Arrête le rap, t'es pas rentable, rentable, rentable, rentable
Ta passion est trop lamentable-m’entable-m’entable-m’entable (c'est vrai)
J'sors un album, j'fais un attentat-ttentat-ttentat-ttentat
J'fais des trucs que tu comprends pas-prends pas-prends pas-prends pas
Drogue dure, je n'en prends pas, prends pas, sauf la molly dans mon Fanta, Fanta, Fanta
Pour un festoch, tu payes 30K,30K,30K,30K (30K)

Vodka framboise, framboise, framboise, framboise, framboise, framboise
Vodka framboise, framboise, framboise, framboise, framboise, framboise
Vodka framboise, framboise, framboise, framboise, framboise, framboise
Vodka framboise, framboise, framboise, framboise, framboise, framboise",https://genius.com/Vald-possede-framboise-lyrics
Trophée (Démo),NQNT 3,2018,"T'es gentille comme pain d'épice
Qui es-tu comme un Régis ?
J'fais de la musique de drogué car j'aime me droguer
Régis ? Même en redescente, j'suis sur la montée
Régis ?
V.A.L.D

Dès-dès-dès-dès-dès-dès que j'arrive, tu ne sais plus c'qui t'arrive
Tu la joues lascive mais, la flamme, je ravive
Je suis ton cadeau, la vie, ton anniv'
J'pourrais te faire rire comme une ado
Je crois en l'avenir, le passé pas trop, le passé pas drôle
Le pas, c'est pas ma cadence, salope, je galope
Je provoque avalanche
Tu croyais pouvoir me tester ? Ah bah nan
Je suis dans cette pute comme Kanye dans Kardashian
J'lui mets les menottes, j'suis attachant
Je sors les quenottes, j'suis pas patient
Je suis le médecin, j'suis pas patient
Elle me bouffe le fruit de la passion
Elle me touche, je m'enfuis d'un pas sûr en pantoufles, je suis dans l'patio
Tu pourras pas suivre sans cardio
J'écris des images comme sur les murs de Lascaux
Leur vision est trop étroite
Dans la vie, j'ai trempé l'doigt
Au Grand Journal en Trump, et toi ?
La tronche est pâle, la trompe est moite

Trophée, trophée
J'en ai trop fait
J'ai mon trophée
Trophée

J'leurs mets des crochets, V comme rocher sur la canette
J'ai des projets pour la planète, j'vais t'embrocher sur ma baguette
J'taffe comme chinois pour m'rapprocher de la stargate
J'donne le hoquet lorsque j'allaite
Je suis opé', tu es charrette
Quand tu commences, on t'dit : ""Arrête""
D'vant une barette, j'ai plus d'force
D'vant la malette, j'veux plus d'or
Laisse-moi tranquille, Merkus mord
Cherche pas d'problème, c'est juste mort
V.A.L.D Jedusor
Quand tu parles, tu t'fais du tort
Dans ton corps, on fait du sport
Tu fermes ta gueule et tu sors
Fers en l'air de l'escorte ; dans les airs, que des spores
Verre en l'air, on s'efforce d'être en paix, en pleine forme

Trophée
J'en ai trop fait
C'est mon trophée

Certains sont v'nu pour une durée provisoire
Pour s'faire baiser dans l'fumoir
Leurs éthiques sont trop bizarres
T'es pas très sûr, j'suis official
J'peux te shlasser au visage pour mettre sourire sur ton minoi
Je travaille ceinture d'explosifs, pas ceinture abdominale
Je cherche à être, pas à avoir
Ta mère et ta grand-mère à la fois
Mes lyrics ne sont pas rasoirs, par hasard
Vicieux comme Salazar dans Resident Evil
Mathafack, j'prends d'l'assurance comme calvitie d'résident sénile
Trophée",https://genius.com/Vald-trophee-demo-lyrics
Indescent (Extrait Instagram),NQNT 4,2020,"Ouh, ouh

Prada, Balenciaga
C'est la folie, j'ai mis un string dans un hoodie (ouh)
Été, automne, hiver",https://genius.com/Vald-indescent-extrait-instagram-lyrics
Cristallisé,NQNT 4,2020,"Le show doit continuer, tu connais l'adage
Casse pas les couilles, tu m'as déjà lassé
Mais le show doit continuer, tu connais l'adage
On compte pas sur toi, on s'rait pas dans la merde
J'suis dans une dimension, t'es pas dans la même
La vie est une pute et t'es pas dans la mienne
Je croque le monde et t'es pas dans l'assiette
Tu m'fais pas confiance et t'es partant après
Quand tout l'monde est qué-cho, t'es partant après
La vente, la tess et j'suis là dans la presse
C'est maintenant ou jamais, j'ai pas l'temps à perdre (nan)
Faut que go l'argent à balle dans la D
Faut que j'goal avant la balle dans l'année
Franchement, je suis pas mal quand j'arrive
Faire la promo, on rit plus à mes blagues (hey)
V.A.L.D comme un gramme dans la fête (wow)
V.A.L.D ne meurt pas quand j'arrête (wow)
Je monte en grade, je tue un lézard
On n'est pas des sauvages, juste qu'on a les armes
Je sors gentiment rentabilisé, mon char d'assaut sur les Champs-Élysées (wow)
Je pense à eux pour leur faire la misère (wow), et la misère on va l'égaliser (wow)
J'regarde les sorties de ce vendredi, j'me dis y'a que moi qui peut rivaliser
5-0,  et mon cœur est de glace, ne pleurez pas, ça va cristalliser (wow)
J'suis tellement profond, là j'ai touché une côte (ouh)
J'remplis le bédo, j'ai perdu mes ",https://genius.com/Vald-cristallise-lyrics
Psychose,NQNT 4,2020,"Y'aura pas mes sons dans le dico, toujours enfumé dans le Vito (wow)
Des corbeaux qui me suivent dans ma psychose
J'ai changé, je baise mieux qu'avant, NQNT 1 j'faisais 2:40
Dans la même année, j'fais un enfant
Est-ce que j'parle de ça dans l'morceau ""Bonjour"" ? (wow)
Rien qui cloche médicalement, pourtant H24 sous médicinale
Mais pourquoi tu t'baises aussi finalement ? T'aurais pu t'aimer, t'étais pas si mal
Tous ces albums j'me suis livré sans faire exprès comme la chatte d'Afida
A force de livrer, j'me suis délivré, de mes contrats, de mes démons",https://genius.com/Vald-psychose-lyrics
Triple Steak,NQNT 4,2020,"Triple steak, triple shneck, triple chèque (
hey, lourd
)
Dès qu'j'ouvre le chèque, je vise le pec, je fume le pet' (
hey, lourd
)
10 heures ten, 10 heures ten, 10 heures ten (
hey, lourd
)
Triple steak, Suiky V, triple tweh (
hey, lourd
)
, Jingles Bells, Jingle Bells
, j'suis dans l'top, chicken guette mon compte en banque",https://genius.com/Vald-triple-steak-lyrics
La vie de rêve,NQNT 4,2020,"Hey, hey

J'écris des images (
hey
), tu vois c’que j’veux dire (
wow
)
C’est quoi ces visages ? J’envisage le pire
Tu vois pas l’paysage (
nan
), j'envoie loin le tir (
pschh
)
On parle plus c’est bizarre (
hein
), ouais, des barres de rires (
hein
)
Un psychologue a dit que j'fais des sons sataniques
Qu'il suffit pas d'un dit, non, qu'il suffit pas des millions
""Trouve un truc qui t’animes, et ça compte pas le shit""
J'lui ait dit ""j’vais t’enculer jusqu’à la festi' d’Halloween""

Ah, la vie de rêve
Ah, la vie de rêve
Ah, la vie de rêve
Ah, la vie de rêve
Hey, la vie de rêve
Hey, la vie de rêve
C'est donc ça la vie de rêve
Je vole au-d'ssus des nuages où il n’y a pas de réseau, non
On pourrait se rapprocher mais je n'vois pas de raison, non
J’ai d’la flamme  sous mon étoile, , non",https://genius.com/Vald-la-vie-de-reve-lyrics
