title,album,year,lyrics,urls
Dragon,XEU,2018,"Et je suis un requin
Fuck it's easy
[Refrain 1 : Sofiane & 
Vald
]
Roule un dragon 
(roule un dragon)
, fume un dragon 
(fume un dragon)
Charge un dragon 
(charge un dragon)
, vise les tes-tê 
(tes-tê)
Roule un dragon 
(roule un dragon)
, fume un dragon 
(fume un dragon)
Charge un dragon 
(charge un dragon)
, vise les tes-tê
Et je roule un dragon, et je fume un dragon 
(et je fume un dragon)
Et je charge le dragon 
(et je charge le dragon)
, et je vise les tes-tê 
(han)
Et je roule un dragon, et je fume un dragon 
(et je fume un dragon)
Et je charge le dragon 
(et je charge le dragon)
, et je vise les tes-tê

Pilote un dragon 
(vroum, vroum)
, 
roule un dragonnet
 
(roule un dragonnet)
Presse le dragon
 
(bang, bang)
, flammes de dragon 
(flammes de dragon)
Rétro avant, rétro arrière, gyro-dragon 
(gyro-dragon)
Range le dragon, y'a les dragons 
(où ça ?, où ça ?)
Talons charogne 
(talons charogne)
, michto dragon 
(michto dragon)
Sur ma dragon daronne, tête de dragonne, queue de dragons 
(queues de dragons)
Bouteille de feu 
(bouteille de feu)
, Mathu-dragon 
(Mathu-dragon)
Violets dragons, charge un dragon, vise les dragons 
(vise les dragons)
Viens dans l'hall 
(viens dans l'hall)
, j'ai des Dragon Balls 
(j'ai des Dragon Balls)
Viens dans l'hall 
(viens dans l'hall)
, j'ai des Dragon Balls 
(j'ai des Dragon Balls)
Allez, viens dans l'hall 
(viens dans l'hall)
, j'ai des Dragon Balls 
(j'ai des Dragon Balls)
Je bicrave, tu pécho, y'a les dragons, c'est chaud mais c'est chacun son rôle
[Refrain 2 : Sofiane & 
Vald
]
Je charge et je fume et je roule un dragon 
(et je roule un dragon)
 et je fume un dragon 
(et je fume un dragon)
Charge un dragon 
(charge un dragon)
, vise les tes-tê
Et je roule un dragon, et je fume un dragon 
(et je fume un dragon)
Et je charge le dragon 
(et je charge le dragon)
, et je vise les tes-tê

Que de dragonnes, donc queue de dragons 
(hein)
Dragonne veut dragon, dans son dragon boule, j'ressors marron rouge
 
(wouhou, wouhou)
Polia dragons, galettes sur l'édredon, nuit de dragon
Vide le wagon, gros, j'allume un dragon, j'ai pas flow, j'ai lagon, j'ai gallon
J'ai nympho que j'galoche guère 
(jamais)
; écailles de dragon, je cherche
Nique tes darons de merde, vise le marmot de merde que t'es, suce un dragon 
(suce un dragon)
Fianso dragon, Sully poisson
 ; la concurrence : putréfaction
Chassant l'dragon, j'ai mon lasso, la fumée dragon sur le cerceau 
(cerceau)
J'ves-qui l'hall 
(j'ves-qui l'hall)
, tes dragons miaulent 
(tes dragons miaulent)
J'ves-qui l'hall, ma dragonne miaule dans ma piaule 
(dans ma piaule)
J'ves-qui l'hall 
(j'ves-qui l'hall)
, tes dragons miaulent 
(tes dragons miaulent)
Donc j'ves-qui le hall et j'insère dragon dans dragonne, 
c'est pas calé
[Refrain 3 : Sofiane & 
Vald
]
Mais je roule un dragon 
(mais je roule un dragon)
, et je fume un dragon 
(et je fume un dragon)
Charge un dragon 
(charge un dragon)
, vise les tes-tê 
(eh)
Et je roule un dragon, et je fume un dragon 
(et je fume un dragon)
Et je charge le dragon 
(et je charge le dragon)
, et je vise les tes-tê",https://genius.com/Vald-dragon-lyrics
Possédé,XEU,2018,"Gaffez quand je suis possédé (hey), gaffez quand je suis possédé (hey)
Gaffez quand je suis possédé (hey), gaffez quand je suis possédé
Défoncé comme ODB (hey), synthèse dans l'OCB (hey)
Le mélange a opéré (hey), j'connais tous les procédés
Gaffez quand je suis possédé (hey), gaffez quand je suis possédé (hey)
Gaffez quand je suis possédé (hey), gaffez quand je suis possédé
Défoncé comme ODB (hey), synthèse dans l'OCB (hey)
Le mélange a opéré (hey), j'connais tous les procédés

Aucun rapport protégé (jamais) ; pour faire la fête, faut des g (wow)
Ton mélange est trop léger, tu m'as pris pour un gros pédé
Dans la rue ou au QG, le sourire est lié au budget (hey)
Le Malin vient d'me posséder ; au Moyen-Âge j's'rais au bûcher
J'fais même pas de rimes parfaites ; dans les chiottes je pisse par terre
J'te connais pas nique ta mère ; des molécules vident ma tête
J'ai r'trouvé l'spliff de la veille, j'ai r'trouvé l'string de la vieille
Ouais j'm'en rappelle, elle m'cassait les couilles, pour que j'lui brise la schnek

J'peux faire le tour de la Terre, juste là au bout de ma tige
J'ai d'quoi faire mal aux ratiches, ché-ca dans l'double de la veste
J'ai sifflé toute la 'teille, j'appelle mon frérot ""mi amor""
Fais gaffe à qui t'ouvre la porte, on est venu foutre la merde

Gaffez quand je suis possédé (hey), gaffez quand je suis possédé (hey)
Gaffez quand je suis possédé (hey), gaffez quand je suis possédé
Défoncé comme ODB (hey), synthèse dans l'OCB (hey)
Le mélange a opéré (hey), j'connais tous les procédés
Gaffez quand je suis possédé (hey), gaffez quand je suis possédé (hey)
Gaffez quand je suis possédé (hey), gaffez quand je suis possédé
Défoncé comme ODB (hey), synthèse dans l'OCB (hey)
Le mélange a opéré (hey), j'connais tous les procédés

J'peux m'fonce-dé, j'fais des écus, faut pas qu'j'm'écarte de ma Sécu'
J'insulte tout l'monde de fils de pute, j'suis possédé par Belzébuth
Je flicka the flicka the wrist, tu flippes et tu flippes et t'urines (ah)
Je ris, ouais, je ris mais je risque l'O.D. avant redressement du fisc (wow)
Fixe-moi dans l'rouge des yeux, un spliff et y'a tout qui est mieux
Je bois l'élixir des dieux, le sol s'ouvre sous mes beujs
Ça part en blagues sur les f..., accord parental sur mes skeuds
On célèbre, on éclate un meuj ; on fait l'platine c'est vous les gueushs
Le livreur c'est mon ami (my friend) ; tous les jours c'est mon anniv' (birthday)
Une seule montée c'est rapide (rapide), et puis c'est très long la ie-v (wow)
Y'a longtemps qu'j'suis plus naïf, y'a longtemps qu'j'ai plus d'salive
Tout l'monde est d'accord, unanime, pas d'interférences sur la ligne (wow)

Dans ce vacarme je té-chan ; en redescente je déchante
Quand je blackout c'est chiant ; pardonne-moi si j'tais méchant
Moi j'suis un amour sans colère, mais quand j'suis trop pâle c'est mauvais
Quand j'suis un démon sans morale, c'est qu'j'ai changé d'dimension temporelle

Gaffez quand je suis possédé (hey), gaffez quand je suis possédé (hey)
Gaffez quand je suis possédé (hey), gaffez quand je suis possédé
Défoncé comme ODB (hey), synthèse dans l'OCB (hey)
Le mélange a opéré (hey), j'connais tous les procédés
Gaffez quand je suis possédé (hey), gaffez quand je suis possédé (hey)
Gaffez quand je suis possédé (hey), gaffez quand je suis possédé
Défoncé comme ODB (hey), synthèse dans l'OCB (hey)
Le mélange a opéré (hey), j'connais tous les procédés

Gaffez quand je suis possédé, gaffez quand je suis possédé
Gaffez quand je suis possédé, gaffez quand je suis possédé
Défoncé comme ODB, synthèse dans l'OCB
Le mélange a opéré",https://genius.com/Vald-possede-lyrics
Deviens génial,XEU,2018,"Deviens génial

Deviens génial, deviens génial
Tu n'sais pas encore l'enfer qui t'attend
Le regard des uns, le rejet des autres
Si t'es bizarre, si t'es pas marrant
Deviens génial, deviens génial
Deviens génial, deviens génial
Pourquoi t'aimeraient-ils seulement comme tu es ?
Si t'es pas comme eux quand t'es naturel

Deviens génial, deviens génial
Fais-les t'envier, fais-les t'regarder
Fais-les trembler, fais-les rêver
Que ça soit une chance de venir te parler
Deviens génial, deviens génial
S'ils peuvent pas t'utiliser, que vont-ils faire ?
T'laisser dans un coin, te regarder d'travers
Avec le temps, tu vas devenir amer
Pour l'unité, faut des ennemis communs
Une tête de turc pour se faire des copains
Faut bien rigoler, faut bien des potes, hein ?
J't'en prie, bébé, deviens pas un ennemi commun
J't'en prie, force-toi, fais-toi des copains
J't'en prie, bébé, ne fais pas les potins
Pour ça, pas l'choix, faut devenir génial
Deviens génial, deviens génial

Deviens génial, deviens génial
Tu n'sais pas encore l'enfer qui t'attend
Le regard des uns, le rejet des autres
Si t'es bizarre, si t'es pas marrant
Deviens génial, deviens génial
Deviens génial, deviens génial
Pourquoi t'aimeraient-ils seulement comme tu es ?
Si t'es pas comme eux quand t'es naturel

Deviens puissant et intelligent
Fais de l'argent, entre dans la danse
Grandis mais reste bon comme un enfant
Si t'as pas l'niveau, ils s'foutent de ta gueule
Faut être quelqu'un pour qu'on t'ouvre à l'accueil
Faut être quelqu'un pour qu'on t'ouvre son cœur
Et même si, un jour, tu trouves ta moitié
Tu l'empêcheras pas de s'demander
""Est-ce que j'mérite pas quelqu'un de plus génial ?
Hein ? Moi qui suis tellement génial""
Deviens génial, deviens génial
Y'a qu'moi qui t'aimera toujours sans condition
Les autres demanderont du rêve, du sexe, du 'seille
Ou juste que tu sois à leur disposition
Deviens génial, deviens génial

Deviens génial, deviens génial
Tu n'sais pas encore l'enfer qui t'attend
Le regard des uns, le rejet des autres
Si t'es bizarre, si t'es pas marrant
Deviens génial, deviens génial
Deviens génial, deviens génial
Pourquoi t'aimeraient-ils seulement comme tu es ?
Si t'es pas comme eux quand t'es naturel

Ne deviens pas comme eux mais reprends leurs gimmicks
Crois pas qu'je valide, c'est juste que j'anticipe, j'vais changer les règles mais tu grandis vite
Ne deviens pas comme eux mais reprends leurs gimmicks
Mets-toi à l'abri, fiston, faut qu't'anticipes, j'vais changer les règles mais tu grandis vite
Deviens génial, deviens génial
Deviens génial, deviens génial
Deviens génial, deviens génial
Deviens génial, deviens génial",https://genius.com/Vald-deviens-genial-lyrics
Primitif,XEU,2018,"Bénéfice, gang-gang, bénéfice
Première pensée : toujours primitive ; générer du bif', c'est pas difficile
Jour de paie, danse comme Billie Jean, hey, hey, plaisir illicite
Timide, j'deviens émotif, j'regarde le ciel, ses motifs, hey
À chaque instant c'est possible, mais à chaque instant, l'emoji pleure
Que d'la violence sur l'moniteur, ça touche les gosses comme les moniteurs
L'argent, ça démolit l'cœur ; quand ça manque, ça démolit l'cul
Suce pas pour plus de pécules, chie pas dans mes bottes, y'a plus de PQ, merde

Primitif, putain c'que j'suis primitif
Mort-vivant comme Lady Di, j'vais faire l'milliard, comme P. Diddy
Y'a qu'les nuages qui limitent, j'fais gaffe, y'a des gosses qui m'imitent
Enfoiré, t'es si fini, tu mérites la syphilis

Parle pas d'maléfice lorsque t'as merdé, lorsque l'mal est fait
Wesh le tavernier, j'vais prendre la Leffe jusqu'à m'flinguer la vessie
Arrêtez les larmes, c'est pathétique, arrêtez d'vivre dans une tragédie
Visez autre chose que les Assedics avec la conso' dans les Atemi
J'doggin' synthétique pute en jogging synthétique, ouais
Produit synthétique, faux cils synthétiques, tout de synthétique sauf mon profil atypique
Qu'importe le cas, je suis pacifique, suis-je le seul érudit du carré VIP ?
J'vois des rubis quand on s'affilie et le continent Mu dans l'Pacifique, wow
Ton cavu tourne comme un handspinner, j'écris mon destin sans ghostwriter
Ça bouchonne au drive quand la dope circule, je crache la fumée, ça fait des crop circles (ouh, ouh)
C'est quoi, c'monde qu'on laisse à nos p'tites sœurs ? Une grosse bite sur un Post-It
Et détournements d'fonds dans les gros titres ? Nan
J'suis d'la nouvelle civilisation, tu vas finir à la rue, c'est la meilleure intimidation
T'en oublierais ton élévation mais fuck cette merde, je vais bosser sec bien avant mes trente-sept piges
Je sois proche des maîtres avec une Breitling, je n'répète que la prophétie

Primitif, j'suis encore trop primitif, j'mange des animaux
Sur tes amigos, j'pisse comme un vrai parigot
Vodka-Paquito pour pas niquer ces clowns échappés du chapiteau
Glober des yeux comme Stabilo, ça gobe des queues comme Haribo

J'maîtrise la chimie ainsi qu'l'alchimie, j'suis dans l'sashimi
Suffit qu'je pense à ta minch et ça y est, vers moi ta minch achemine
J'tacle à la gorge, pas à la cheville, j'retourne ni ma veste ni ma chemise
J'peux pas lâcher tant qu'j'suis pas che-ri, je cours après l'temps, je marche vite (wow)
J'veux m'envoler, là, je vibre bas, je n'en veux à personne, c'est moi qui m'retarde
Soit je fais l'million et j'me tire de là, soit c'est la CIA qui me criblera
J'écris ce rap comme un cri de rage, ça sent la guerre dès la prise de voix
D't'façon, même quand j'veux donner d'l'amour, elle est prise de spasmes (spasmes, spasmes)

Primitif, j'suis encore trop primitif (j'suis encore trop primitif)
Primitif (primitif)
Primitif, j'suis encore trop primitif (j'suis encore trop primitif)
Primitif (primitif), primitif (primitif)",https://genius.com/Vald-primitif-lyrics
Seum,XEU,2018,"Fuck it's easy
Amen

J'aimerais tant faire la paix avec toi, avec moi
Ouais mais nan, ma bête noire me laisse pas assez d'espace
Je suis toi, tu es moi, je sors même de ta mère
On sort de la même merde et pourtant, tu m'agresses
J'vais t'faire fondre la graisse, je vais found ton adresse
Te montrer mon adresse quand je chante la messe
On dira dans la presse que c'est à cause de la hess
Qu'on était des sauvages, des otages du naufrage

Des ados sans repère, des adultes trop amers
On m'adule, c'est la fête, j'les insulte, c'est la merde
On m'a pris pour un clown, on m'a pris pour un fou
Pour info' : j'fais des sous plus que toi, ma nympho
Licence de maths-info m'sert à rien, je travaille pas
J'reste tranquille, je racaille pas, j'reste sous l'drap, comme KKK
Quand j'me lève, j'veux les uer-t, j'veux les ken dans la ruelle
Fuck un duel, j'vais leur chier d'ssus comme une mouette
J'vais les shlasser au Moët, exploser sur le bar, j'tire une barre
Et souris, j'ai l'cœur noir et pourri, j'aime le soir
Y'a moins d'monde, y'a ma beuh, y'a ma blonde, y'a ma queue
Y'a ma blonde, c'est Vald qu'a la bombe, bom-bom-bomb
Bah voyons, t'as pas d'chance : t'es pas beau, t'as pas d'argent
T'es en chien, t'es navrant, donc t'agis comme fils de pute
J'espère que tu pries Jésus quand l'maton te brise le cul
Sur ta tombe, je pisse dessus, croque-mort demande qui es-tu
J'ai le seum, j'apprends à l'assouvir, commence vite
À courir, à ton s'cours, personne va accourir

J'aimerais tant faire la paix avec toi, avec moi
Ouais mais nan, ma bête noire me laisse pas assez d'espace
Je suis toi, tu es moi, je sors même de ta mère
On sort de la même merde et, pourtant, tu m'agresses
J'vais t'faire fondre la graisse, je vais found ton adresse
Te montrer mon adresse quand je chante la messe
On dira dans la presse que c'est à cause de la hess
Qu'on était des sauvages, des otages du naufrage

(Des otages du naufrage, des otages du naufrage)
Ferme ta gueule, j'ai le seum, j'noie mon seum dans le seum
Dans le rhum, dans ta reum, dans les leumes, wesh le deum
J'ai le seum, j'ai le seum, j'ai le seum

Qu'est-ce tu crois ? J'vais pas lâcher ; sur la croix, j'serai kalaché
Chaud patate, j'suis arraché ; calme-toi, j'vais t'faire un chèque
Ou bien te raser la schnek, ou bien t'fracasser la tête
Pour t'abîmer, je m'affaire, j'me rhabille et j'me rappelle
Faut qu'j'retourne à mes affaires ; pour un billet, tu patines
Pour un billet, suce ma bite ; y'a qu'pour nier qu'tu t'appliques
Attends, j'ai un truc à dire : ""Je t'aime, salope, tu m'attires
J'ai toujours doigt sur ton clit', j'crois qu'ta chatte est pute à clics""
J'me réveille dans ma Xantia, pas dans nouvelle Bugatti
J'me rappelle d'eux à l'ancienne, quand, sourire, c'était plus facile
Quand mourir me faisait peur, quand Forrest Gump me brisait l'cœur
J'crois qu'j'vais prendre un rre-ve d'plus, j'en ai marre de rêver d'meurtre
J'ai le seum et l'aurai jusqu'à être libre, j'aurai l'seum jusqu'à être ivre
Demande-moi une garette-ci si tu veux disparaître vite

J'aimerais tant faire la paix avec toi, avec moi
Ouais mais nan, ma bête noire me laisse pas assez d'espace
Je suis toi, tu es moi, je sors même de ta mère
On sort de la même merde et, pourtant, tu m'agresses
J'vais t'faire fondre la graisse, je vais found ton adresse
Te montrer mon adresse quand je chante la messe
On dira dans la presse que c'est à cause de la hess
Qu'on était des sauvages, des otages du naufrage",https://genius.com/Vald-seum-lyrics
Offshore,XEU,2018,"Fuck it's easy

Hey, j'suis l'rappeur fétiche de V.A.L.D. 
(hey)
 ; si j'rentre dans l'game, il va m'câliner 
(hey)
J'crois qu'un d'ces quatre, je vais m'arrêter 
(hey)
, 
avant qu'le Sheitan vienne m'habiller 
(hey)
En Prada ou pas, c'est ça l'idée
 
(hey)
 ; avec qui faut-il s'allier ? 
(hey)
De toutes façons, j'ai les mains liées 
(hey)
, 
on m'considère comme un alien, Lezarman
Apocalypse en vue, tout l'monde va y passer : 
les Noirs, les Blancs, les Arabes
Partout, la bite dans l'fut' s'agite devant la dernière vidéo de Lisa Ann
La cocaïne dans l'cul, aucune chance que les forces de l'ordre ne les attrapent
À mon avis, Jean-Luc Delastreet n'avait pas idée d'la portée de ces matraques

Guette comment le monde est beau, petit, guette comment le monde est glauque
La voix du Diable à té-cô et à té-cô
 l'ange va ter-sau
Je n'ai que le talent des proses, j'ai besoin constamment des pauses clopes
J'suis comme une plateforme offshore, offshore, offshore

J'suis trop rapide, j'te fume comme Bale MC Gareth, t'es sympa
J'te montre ma bite, faut qu'tu la lèches ; MC, arrête, c'est l'Saint Graal
J'vaux plus qu'un SMIC, faut qu'je l'accepte, MC galère, 
j'ai bien mal
T'es Titanic, je suis iceberg
 ; 
j'ai trop d'inspi', faut qu'j'roule un teh
On essaye d'être au top de notre forme, 
il a pas fini sa thèse de doctor
C'est l'destin, Dieu soit loué, y'a du matos à louer pour la tournée du mois d'octobre
Pourquoi tu crois que j'nous compare à une plaque offshore ?
On puise à la base, tu penses qu'on connaît pas notre sport
Si t'as pas la foi, tu peux laisser ton âme au stock
Y'avait pas que le Sheitan présent à Woodstock

Guette comment le monde est beau, petit, guette comment le monde est glauque
La voix du Diable à té-cô et à té-cô
 l'ange va ter-sau
Je n'ai que le talent des proses, 
j'ai besoin constamment des pauses clopes
J'suis comme une plateforme offshore, offshore, offshore

J'crache du souffre et vomis du pétrole ; l'industrie voudrait m'forer, ça m'désole
Quand ils me parlent, 
j'me branle comme à l'école
 ; 
j'suis dans l'vaisseau, dans les airs, loin des Hommes
Gros, y'a tout d'artificiel, même la camisole, comme une main tendue par l'Crédit Agricole
Faut qu'j'arrête de cer-per parce que ça m'isole ;
 
mes seuls amis, ils travaillent à Capitol
 
(eh)
NQNT dans l'anus, ça picote 
(hey)
, 
sponsorisé Sanytol 
(hey)
Sans ça, y'a rien d'palpitant
, j'la baise alors qu'j'la trouve même pas mignonne
Cherche pas l'embrouille après quatre mignonnettes, 
ni l'amour dans une camionnette
, cachet additionnel 
(hmm cling)
Sang d'MC dans l'isotherme, 
la misère moins pénible sous ultraviolet
 
(les-Char)
Ton point d'vue est biaisé, Many, t'es pieds et mains liés, et baisé
Regarde saliver les requins à l'idée de t'câliner dans l'cabinet
, hey
Lezarman veut ton oseille et ton âme, tout ton buzz et ton couard, le labeur de ton taf, quoi d'autres ?
Ton malheur ne compte pas, ferme ta gueule et bonne-char, bonne chance pour gravir les montagnes
Prends l'micro et vends du rêve, pute ; sur scène, mets ton plus beau vêt-sur, va casser des plexus
À la mi-temps, on veut déjà sept buts
, j'sais qu'tu sais que tu es perdu mais on a investi
Donc ramène actus, 
on veut des capsules
, on veut des cartouches, 
qu'est-ce tu roules un cactus ?
Va pas jouer les artistes, salope, à quoi t'aspires ? Ma gueule, on t'arrache tout avant qu't'aies plus d'inspi'
Petite clope avec le Suikon 
(hey)
; 
deux mille dommages sur le futon 
(hey)
Rap français barjot comme glouton 
(hey)
 ; j'vois devant et derrière des moutons
AD et Sully, c'est bouillant : dis pas l'inverse, on va s'brouille-em
, 
le plus dur est fait en s'débrouillant
Bientôt les structures, tout ça sans culture, à part les bouillons

Guette comment le monde est beau, petit, guette comment le monde est glauque
La voix du Diable à té-cô et à té-cô
 l'ange va ter-sau
Je n'ai que le talent des proses, j'ai besoin constamment des pauses clopes
J'suis comme une plateforme offshore, offshore, offshore",https://genius.com/Vald-offshore-lyrics
Rituel,XEU,2018,"Fuck it's easy

Chaque mouv' est pensé pour qu'on s'écarte de là
J'voyage plus assez à chaque putain d'barre de hash'
T'en as pas marre de toi ?
 
J'marche dans des mares de toi
Chaque fois qu'tu l'ouvres, ça ne me marque pas
Ferme ta chatte, Lady Marmalade
J'ai plus de sortilèges que toi dans l'arsenal, oui
Brique ma bite comme un artefact, ma biche
Le prix d'ta vie, ça fait cinq lles-ba, prie
J'ai vis-à-vis sur l'enfer, j'vis ma vie sans m'en faire
J'sais qu'la suite c'est l'Eden, si-si-si-si
Sors la 
Belvedere
, 
dans la gloire ou l'échec
Six-six-six-six zéros sur les chèques
Snitch à la langue pendue
, nique ta maman
Mise à l'amende, enculé, 
j'suis à l'avant
, han
Suis la cadence, 
fuis la carence
J'suis d'apparence clean si tu vois qu'le dream, ça m'arrange mais
Tous les jours en vadrouille et pour des sous, faut magouiller
On démarre tous en bas, dans la merde, faut s'dépatouiller
Chimie dans mon verre, j'ai déjà touillé
Les menaces de mort, ils m'ont chatouillé 
(ahah)
Si j'te regarde dans les yeux, j'sais qu'tu vas mouiller
Lâchez-moi les couilles, on m'a d'jà fouillé
, jure pas la vie d'ta mère, tu vas bafouiller
Continuez à rouiller, tous les jours agenouillé
Le ventre est gargouillé, mes gars souillés, j'vais tout niquer

Han, han, tout niquer, pas b'soin d'sous-titrer
Jamjam moulinex, ta tête : tourniquet
Pan pan, calme-toi, bah quoi j'vous libère
Bats-toi, pussy ; hess : nan, nan
Laisse pas poussières, laisse-moi solitaire
J'suis habitué, j'sais pas simuler
J'prépare l'rituel, j't'ai dans l'visuel
J'vais t'rendre virtuel, gang gang

Ils écoutent le JT mais n'veulent pas croire à la magie
Enfant agité, Bricoman m'a pas assagi
J'entasse les feuillets, 
je traite le mal à la racine
Je fais mon pain seul, j'vais les rouler dans la farine
Putain, j'ai d'l'humour, encore aujourd'hui, c'est trop bien
J'fais ça pour l'amour,
 le turn up et puis les copains
J'suis gentil comme tout, j'fais même pas tourner les potins
J'suis gentil comme tout mais

J'fête pas les anniversaires, tu m'as pris pour qui, salope ?
Allez, va niquer ta mère, tu connais pas ma vie, nan
Théorème de Pythagore, vingt euros de l'heure
Pour mettre à niveau les gosses qui fumaient d'jà du shit
Aujourd'hui, c'est huit mille euros vingt minutes
 
; quoi ?
Comment ça, ""c'est trop"" ? Qu'est-ce que t'insinues, hein ? C'est toi qui les mérites ?
Pétasse envieuse, mets-la en veilleuse
Eh, r'garde-moi dans les yeuz, j'suis la voix des dieux, what, what, wha
J'suis à des lieues de ce milieu
J'veux mes milliers comme les piliers 'vec humilité
J'ai fils de pute de flow, t'as l'humidité
T'es qu'un fils de pute de trop sans utilité
J'ai plans sur la comète, t'as qu'une p'tite idée
J'refuse les sponsors, t'as qu'à nuditer
J'peux faire ça des heures mais tu vas t'suicider
D'ailleurs, on va t'oublier, j'vais ressusciter
""Bonjour"" incrusté sur la batte
J'pé-ra que des dingueries, ça les rassure de penser qu'j'suis rabat
Tout p'tit, j'me branlais sur la 4
Aujourd'hui encore, sur le plateau, je me branle sur la 4
V.A. est brodé sur la cape, 
mes doutes sur l'a cap'
Mes couilles sur la table
 
(wow)
Fuck être un oiseau dans l'trap, une perruche dans l'wrap
Fuck être un putain d'macaque

Han, han, tout niquer, pas b'soin d'sous-titrer
Jamjam moulinex, ta tête : tourniquet
Pan pan, calme-toi, bah quoi j'vous libère
Bats-toi, pussy ; hess : nan, nan
Laisse pas poussières, laisse-moi solitaire
J'suis habitué, j'sais pas simuler
J'prépare l'rituel, j't'ai dans l'visuel
J'vais t'rendre virtuel, gang gang

Ils écoutent le JT mais veulent pas croire à la magie
Éteins ton briquet, j'vois d'ici que l'sheitan s'agite
Besoin d'un conseil, j'appelle direct Jacques Attali
J'hésite pour la game entre Xin ou bien Akali

Parlez pas de pain, parlez pas de putes
J'veux voir toutes les mains, parlez pas le singe, j'parlais pas de 
*boum*
Parlez pas des pavés sous la place dépravée, graviers
Transforme tes vacances de golf en club de drogues, j'ai gravé
T'appuies pas la pisse sur l'bord du fairway
Tiens, goûte à la tise, y'a rien qui m'attriste, plus rien qui m'effraie
On t'fout à l'asile, on t'lapide après
J'fais du De Vinci, on t'coupe dans la scie, tes babines avec
J'arrive comme une étincelle dans la poudrière
Gros, si t'es à sec, j'en ai tout l'hiver
J'fais disparaître les corps, appelle-moi ""Houdini"" 
(Houdini)
Parle pas, ton haleine a le goût d'hier
Moins y'aura d'amis, plus y'aura des tonnes
Moins on s'fera la bise, moins y'aura des corps, moins y'aura des connes
Moins y'aura les cops, moins y'aura les porcs
Plus y'aura de coffres, moins y'aura de potes, plus y'aura de com'",https://genius.com/Vald-rituel-lyrics
