title,album,year,lyrics,urls
Spirale,Cours de rattrapage,2012,"Vous êtes-vous déjà demandé pourquoi y avait-il tant de pédophiles en politique ?
Et vous êtes-vous déjà demandé quand est-c'que vous allez enfin changer ?

Souvent j'me pose des questions, si j'ai les réponses est-ce qu'on
Peut changer les versions que j'puisse rester dans l'aversion ?
La ske-kon bouffe des passe-temps, ça m'fait tousser moins d'afghan
Alors, c'est décidé : j'arrêterai bien quand j'aurais pas l'temps
L'attente change rien, j'ai toujours la chance en latence
J'fais semblant d'me prendre en main, m'sentant si bien dans mon absence
Ça m'donne un aspect terre-à-terre d'avoir des problèmes et rien faire
De voir que tout va bien mais faire semblant qu'c'est l'inverse
Ok, c'est p't-être vraiment la merde mais tout dépend du point d'vue
Les joints m'font les yeux doux, c'est rude au mic au moins j'tue
Ma mère regrette mon BAC plus
, le sentiment d'être une raclure
J'abuse à vu d'la rue, j'avoue ça tue, j'ai bu trois futs
Elle m'dit qu'j'suis plus l'génie d'avant, j'm'en bats les steaks évidemment
Pour pas y penser, j'fais un tour dans l'tiroir des médicaments
Parce que j'reviens sur mes pas, j'me contredis
Frelon, j'me rassure des fois, 
mais qu'on se le dise, non, vous ne m'capturerez pas

Et même à tort, sans rancœur, j'me laisserai couler encore
Encore une cuite, un cône grillé, j'm'en fous des renforts
Personne à bord, j'me noie dans les mirages et m'emporte
Dans les spirales de l'amphore, j'arrive à zoner sans force
Et même à tort, sans rancœur, j'me laisserai couler encore
Encore une cuite, un cône grillé, j'm'en fous des renforts
Personne à bord, j'me noie dans les mirages et m'emporte
Dans les spirales de l'amphore, j'arrive à zoner sans force

J'ai beau sortir la tête de l'eau, c'est fou, j'replonge à chaque fois
J'regrette mes anciennes prises de tête, 
c'est flou l'époque des clac-doigt
Ça fait trois fois dans la même minute que j'guette mon tél'
Que j'délaisse mon frère, 
putain restons zen, c'est cette cruche à veston vert
Et qu'est-ce qu'on fait maintenant ?
J'dirais qu'on s'perd et qu'on s'permet d'entendre : ""Mec, ton sperme est d'enfer""
Alors j'avais juré que j'serais un bâtard malgré les sentiments
Mais j'ai l'air banal, affecté par l'affection
Ambiante et tant pis si l'envie d'Bambi m'enlise en vinant
Dans l'divan : mes histoires ennuyeuses deviennent enivrantes
Tranquillement, j'comprends quand j'ai tout, j'me lasse
Mais j'm'en fous, je m'bats, j'écarte toute menace, faut qu'ils me fasse des 'touse de 
On r'fait les mêmes choses : 
mêmes doses, même gros ter
Même avec le temps, j'fais les mêmes erreurs d'vant les mêmes problèmes
Parce que j'reviens sur mes pas, j'me contredis
Frelon, j'me rassure des fois, 
mais qu'on se le dise, non, vous ne m'capturerez pas

Et même à tort, sans rancœur, j'me laisserai couler encore
Encore une cuite, un cône grillé, j'm'en fous des renforts
Personne à bord, j'me noie dans les mirages et m'emporte
Dans les spirales de l'amphore, j'arrive à zoner sans force
Et même à tort, sans rancœur, j'me laisserai couler encore
Encore une cuite, un cône grillé, j'm'en fous des renforts
Personne à bord, j'me noie dans les mirages et m'emporte
Dans les spirales de l'amphore, j'arrive à zoner sans force

J'tourne en rond, m'enfonce en vain dans un trou sans fond
J'tourne en rond, m'enfonce en vain dans un trou sans fond
J'tourne en rond, m'enfonce en vain dans un trou sans fond
J'tourne en rond, m'enfonce en vain dans un trou sans fond

Ok, j'tourne en rond, m'enfonce en vain dans un trou sans fond
J'écoute sans l'son les conseils des autres qui seraient rien sans nous
J'sais qu'on s'embrouille, pour s'réconcilier avant qu'on r'parte en couille
Et j'pète une clope, fier de moi : V.A.L.D. bête de drogue
Allez hop, mes résolutions sont des anecdotes
Parlez-moi d'progrès, j'm'en bats tellement les yeuks que ça résonne
Putain, ça fait un bail que j't'avais pas vu l'ami, j'avais pas vu la diff'
Mais viens, on s'capte pour s'rappeller qu'ça tue la vie ?
Ça tu l'as dit, j'ai quelques doutes qui s'avèrent unanimes
J'vais rien faire, 
le buraliste sera mon unique sortie du mardi
Sorte d'humanisme, j'me touche quand ça pue la pisse
Les fétides activistes inactifs quand tu dilapides
Tellement naïf, que c'que j'fais d'mieux, c'est d'être insatisfait
Juste un gars qui s'tait, l'esprit torturé devant l'sablier
Parce que j'reviens sur mes pas, j'me contredis
Frelon, j'me rassure des fois, 
mais qu'on se le dise, non, vous ne m'capturerez pas

Et même à tort, sans rancœur, j'me laisserai couler encore
Encore une cuite, un cône grillé, j'm'en fous des renforts
Personne à bord, j'me noie dans les mirages et m'emporte
Dans les spirales de l'amphore, j'arrive à zoner sans force
Et même à tort, sans rancœur, j'me laisserai couler encore
Encore une cuite, un cône grillé, j'm'en fous des renforts
Personne à bord, j'me noie dans les mirages et m'emporte
Dans les spirales de l'amphore, j'arrive à zoner sans force

Ahahah, V.A.L.D. hein",https://genius.com/Vald-spirale-lyrics
John Doe,Cours de rattrapage,2012,"Dis-moi j'suis défini par quoi : par c'que j'fais
Par mon blaze, par qui m'suit, par qui m'suce, par ma Parkinson
C'est tiré par les cheveux, ça démêle rien
Et même si y'a du fond, j'suis l'seul qui l'interprète bien
Alors vient la question : à quoi bon parler si j'suis l'seul qui peut m'comprendre ?
J'en vois certains gratter, d'autres dans l'espoir d'une récompense
Mais allez viens on danse, qu'on oublie c'qu'on pense
Qu'on m'résume à une bite et du sang en abondance
Qui circule dedans, je suis la difficulté
Sampler le silence vous ridiculise sous petits tissus vous tremblez
Vous semblez croire que vous pouvez m'juger comme vous jugez les autres
Je vous planterai à mains nues, je m'suis bien affûté les os
Fixe-moi tu verras qu'un immense vide
À l'évidence ceux qui croient que j'suis fêlé quasiment prient
J'suis insaisissable comme le SIDA tapi dans l'fix
J'ai aucun blase, qui sait abritant qui
Car les soirs de pleine lune, je change
Le salon plein d'brume, je tremble
Vexé j'remplirai bien ton plexus de chancre
Mais c'est déjà l'cas
Parfois les malfrats sont vus comme des braves gars
Tu me comprendras jamais sans voir tous les fantômes qui parlent mal
Dans l'métro j'suis qu'un inconnu
Gentil devant les nymphos nues
Mon cœur s'en branle, ma tête veut des seins dodus
Perdu entre qui j'suis, qui j'veux être, et comment vous m'voyez
Mec j'suis pas schizophrène, mais j'vous ordonne de m'vouvoyer

M'voyez, voilez-vous la face
Écaillez-vous la masse où vous voulez pour roucouler
Toujours paresseux j'amasse les facettes de ma race
Pour refouler fourre des fours et toute ma life
Le flow écroulé sous la masse

Et si j't'insulte c'est pas forcément affectif
Ni agressif et j'm'en branle que t'en aie plein le cul
J'ai aucun point de vue comment tu peux me connaitre
Soyons honnête t'es qu'un intrus et c'est pas un truc que j'apprécie
Les gars s'excitent devant des clashs ou autre
Insulte, j'éclabousse vos injures sur tout un tas de sceptiques
Et un peu d'aspirine quand j'vois ces tass' qui miment
Quitte à séparer les vrais défauts des faux des fois j'm'insurge
Et alors? Personne m'entends car j'ai bouclé la porte
Tout ce que j'élabore n'a qu'un seul but: vous couper la gorge
La gestapo veut me faire la peau depuis que j'ai bouffé ma prof
Et j'm'accroche mais c'est dur car je vois que vous êtes tous démagos
Mais c'est pas grave faites comme si on était pas là
Ça me rend malade de voir ces bâtards trainer dans les parages
Et j'ai pas l'âge de dire que j'ai le vécu d'un ancien
Le discours au PQ de bambin qui me fait dire que j'vais te niquer ta race
Ou te piquer ta place, avec le temps j'm'inquiète pas
Un tel drame m'obligerait à briser la glace
Et j'ai cette visée macabre
J'trouve pas cette vie très attractive
Donc j'tire jusqu'à devenir très adroit
Puis j'ramène un tas d'délire pour voir vos pattes frémir
Vous êtes jeunes donc j'suis pas chaud pour vous biffler la face
C'est pas mal pénible de mastiquer de la chatte vernis
Pas terrible de s'astiquer alors que je pourrais finir premier de la classe

M'voyez, voilez-vous la face
Écaillez-vous la masse où vous voulez pour roucouler
Toujours paresseux j'amasse les facettes de ma race
Pour refouler fourre des fours et toute ma life
Le flow écroulé sous la masse
VALD et AD vous encule
NQNTMQMQMB2 bientôt dans vos culs",https://genius.com/Vald-john-doe-lyrics
Nique le bordel,Cours de rattrapage,2012,"Ceux qui, ceux qui, ceux qui sacrifient la liberté pour la sécurité n'en méritent aucune et perdront les deux

Poto, c'est ap' facile, le fond d'la sse-cla vanne l'instit'
Les faux yous-voy lâchent l'inspi', croient qu'la sère-mi cache un style
J'ai un hobby : c'est admirer quand les wacks s'agitent
Demande à ma bite si c'est pas Vald qui a les oidgts' magiques
Vas-y cette fois j'la dis, c'est V.A.L.D., ça s'voit qu'j'abîme
C'est aç ma vie, j'm'en bats les couilles, j'demande quand même c'est oiqu' la suite ?
Lâche la rue, c'est les cafards les vrais rois d'la ville
J'suis aussi fourbe qu'un vagin en feu dans des peu-sa de gamine
Ça part dans tout les sens comme un gang-bang inversé
Si souvent saoulé sans qu'l'éthanol soit versé
Est-ce à cause de Mario : j'pense à sauter sur tout c'qui bouge?
T'écoutes c'qui pousse de mon âme torturée comme une autopsie, couz'
MC Valentin, ça y est, j'me suis présenté
Si j'perce pas, j'ferai des meurtres dont parlera la presse anglaise
Putain, faut qu'j'arrête les livres sur les tueurs en série
Mixés aux prod', mes rêves sont des remakes de Resident Evil
C'est évident que j'étripe MC, t'es terrible en legging
J'esquive les pénitences et nique les fils de pélican
Tennis et jean ma délinquanc, Lanny Barbie ma délivrance
Niki' qui tape des bellydance m'excite mais façon terrifiante j'effrite l'esprit

Vas-y, j'ai pas l'temps pour ton peu-ra peu qualifié
Personne me sortira d'mon lit sauf une pétasse de qualité
J'joue un rôle tout seul, j'connais mes cinq vérités
Comme Valentin, j'me fous de ta gueule mais avec sincérité

Nique le bordel, nique, nique le bordel
Nique le bordel, j'ai dit nique le bordel
Nique le bordel, j'ai dit nique le bordel
Jean Coba, nique le bordel, Jean Coba, nique le bordel

Pas d'Louis Vuitton, non, j'suis sponso' par Air Max
Les bouffons s'en prennent au plus p'tit à trop té-ma terre-par
À proser ma lère-ga, j'ai atrophié ma belle bave
Mais rapprochez-moi des stars et j'raboterai des fesses falsh
Ok, j'ai pas qu'ça à foutre de faire des rimes vides
Nos amours sont fictives, ça galère donc essaie l'spliff
Nique sa mère aux effets de style, j'veux pas la jouer festif
Mes projets sont des esquisses, mes rendez-vous des esquives
Plaît-il ? J'nique le bordel ! Fixe le cortège, PCM nique le bordel
Et vas-y, dis qu'c'est mortel quand j'm'exprime tes portes saignent
Putain, nique le bordel, j't'ai dit nique le bordel
Belle famille, mes neveux s'écrient la se-ti berce Papa
Trop d'choses pour perdre la face, les histoires de fesses m'agacent
Et pendant qu'je cherche la faille, un boule d'vant moi, j'baisse la garde
Pourtant je l'aime, un jour faudrait qu'j'respecte ma femme
Check tahan, fallait qu'j'te l'dise, putain ça m'lasse la fac'
J'essaie d'faire comme je peux mais mon avenir me lâche la grappe
Parait qu'ça lâche la foie pour jacter sous pastaga
Mais poto, j'me casse la voix, bat les couilles, tu passes la douane
Suce-moi la bite ou graffe mon blaze, les stups à l'affiche des pierres tombales
Des putes dans la ville des cachetons man, y'a tout c'qu'on envie, les schlagues sont braves
Excuse mon ami d'jouer l'acrobate, plus d'mélodie, les boîtes s'en tapent
C'est grave et les grammes et les grammes s'entassent donc suce-moi la bite ou graffe mon blaze

PCM, PCM la concurrence est crispée
Personne peut lire dans mon veau-cer, Spankwire l'a crypté
Gaffé à ton bouc, j'horrifie les orifices
Bite vers le ciel appelez-moi Osiris, Osiris...

Nique le bordel, nique, nique le bordel
Nique le bordel, j'ai dit nique le bordel
Nique le bordel, j'ai dit nique le bordel
Jean Coba, nique le bordel, Jean Coba, nique le bordel",https://genius.com/Vald-nique-le-bordel-lyrics
Ass propos,Cours de rattrapage,2012,"J'suis né au Tibet près des moines Shaolin
J'agonise à chaque fois qu'mon acolyte sort des bails scatophiles
Des délires qui m'laissent perplexe et qui m'font vite fondre
Vers des bars d'alcooliques et ensuite, j'me gaze au shit
C'connard dégaine toute sorte de saloperies toutes 'core
J'ai mal au bide, j'perds toute forme de calories
Avec ses histoires de merde, de caisses, de fesses, de baise
Le mec se touche la verge en parlant d'Apophis
Faudrait qui s'taise, qui m'laisse car au final, j'écris des thèses où j'fais des rêves dans lesquelles je frappe son fils
Sérieux ? Qu'est-c'que j'en ai à foutre
C'est comme quand ma daronne me parle de son dé à coudre
J'suis pas à propos d'ça, de tous ces propos sales
J'suis plus jogging-baskets que gros costard
J'porte pas d'sac à dos, sale cabochard
Sinon j'mets ma flûte dedans à la manière d'un saltimbanque

- Nous on n'est pas prêt on l'est à propos d'ça
Vous vous êtes prêts mais à propos d'quoi
Mais dis-moi qui est prêt et à propos d'ça
Ou bien préparez-vous à être prêt à propos d'ça
- Mes propres propos sont à propos d'ça
- Mais à propos d'quoi ?
- À propos d'ça
- Mes propres propos proposent d'être à propos d'ça
- Mais à propos d'quoi, c'est quoi les bails ?

J'enfoncerais bien mon seize dans la gorge de ma responsable de cycle
En deux ans, j'ai fait qu'augmenter ma conso d'toncar et d'shit
De polémiques en boulimiques de politique
J'ai compris qu'jveux plus être Président, faut avaler bien trop d'pénis
Cousine, t'es chimique mais tu peux quand même baiser
Parce que les hommes restent des hommes même la tête baissée
Bref reparlons d'oim, d'ce salaud d'zouave aux propos barges
Mes potos savent que souvent, j'suis pas prêt toujours à propos d'ça
Ouais, ouais, j'm'envole dans les cieux
Plonge dans une chatte épaisse, sur un son d'Major Lazer
Frelon, j'm'en fous, j'rappe mes merdes, déclare mes bêtes de remords
Caresses mes fesses, c'est comment ? Putain, c'est vrai qu'c'est rrant-ma
Pas moins qu'les guerres de l'OTAN
Effarouché, j'arpentais des bars louches et j'marouflais d'la rousse
Eh mais tais-toi ou j'baise ce game ""Hadouken !""
Des tas rouspètent mais fais gaffe ou j'cesse de faire ma recette
Du rap conscient d'ma bite, c'est ma version la moins malhonnête

- Nous on n'est pas prêt on l'est à propos d'ça
Vous vous êtes prêts mais à propos d'quoi
Mais dis-moi qui est prêt et à propos d'ça
Ou bien préparez-vous à être prêt à propos d'ça
- Mes propres propos sont à propos d'ça
- Mais à propos d'quoi ?
- À propos d'ça
Mes propres propos proposent d'être à propos d'ça
- Mais à propos d'quoi, c'est quoi les bails ?

J'suis sous les projecteurs d'une famille qui vit dans l'ombre
C'est la r'connaissance, pas l'dentiste qui fait qu'on a les dents longues
Alors j'montre mon uc' sous les lumières divines
Mon air si triste fait taire Christine, j'me suis mis aux thèses mystiques
J'ai l'veau-cer si vif que j'guette six films en même temps
Et j'aime quand j'dégaine des textes si vite
J'suis à propos d'ça
Quand j'enchaîne mille rimes et qu'j'encaisse dix billets comme un clodo sale

Yo, même si je sais qu'l'odeur d'ta shnek soûle mes vieux
C'est pas grave si tu viens, j'en roulerais deux
Mes sincères amitiés à ton trou d'mes deux
C'est pas grave si mon sperme te touche les yeux
Toujours à propos d'ça, la purple dans la succursale
La popo dans un gros cul d'sale, déjanté flow futural
Et plus tu râles et plus j'enquille, admirez la chute du drame
Du THC dans les yeucs, mes conquêtes seront mes futurs schlags

- Nous on n'est pas prêt on l'est à propos d'ça
Vous vous êtes prêts mais à propos d'quoi
Mais dis-moi qui est prêt et à propos d'ça
Ou bien préparez-vous à être prêt à propos d'ça
- Mes propres propos sont à propos d'ça
- Mais à propos d'quoi ?
- À propos d'ça
Mes propres propos proposent d'être à propos d'ça
- Mais à propos d'quoi, c'est quoi les bails ?

C'est quoi les bails (C'est quoi les bails ?)
C'est quoi les bails ? C'est quoi les bails, bails, bails ?
C'est quoi les bails ? Bails, bails, bails, bails

- Nous on n'est pas prêt on l'est à propos d'ça
Vous vous êtes prêts mais à propos d'quoi
Mais dis-moi qui est prêt et à propos d'ça
Ou bien préparez-vous à être prêt à propos d'ça
- Mes propres propos sont à propos d'ça
- Mais à propos d'quoi ?
- À propos d'ça
Mes propres propos proposent d'être à propos d'ça
- Mais à propos d'quoi, c'est quoi les bails ?

Tu fermes ça, tu fermes ta gueule (ahah). Vous êtes des grands malades",https://genius.com/Vald-ass-propos-lyrics
Encore,Cours de rattrapage,2012,"Allez, allez, encore un son qui mènera nulle part
Fume, ça roule un bon stick et tape une barre
N'abuse pas ma puce
J'accumule un tas d'trucages, du grabuge dans mon fuselage
J'ai d'l'actu dans mon futal

Encore un matin pas si mal en tant qu'zigzag dans l'corridor
Encore une clope matinale, machinalement j'en rigole
On va m'demander si ça va et ça même sans qu'on s'connaisse
J'fais des chansons d'poètes, ah bon, c'est dans l'fond d'causette
Ça y est, maintenant c'est honnête, tu pourras dire que nan
Aucune envie d'me faire épauler par le fils de Kant
J't'assure qu'j'ai du sang d'philosophe, éduquant l'microphone en kimono
Vagin dans le ciboulot, j'collectionne les virus Microsoft
Encore un faux raccord dans l'corps-à-corps du RER
L'histoire dégénère et ça d'vient dérisoire que tout reste éphémère
Encore une fois : j'vais d'voir m'en battre les couilles
Le soir, reparler d'foufs, me gratter l'boule et puis m'en r'battre les couilles
Encore un conseil qu'ira finir dans mes chiottes
Et un Don Per' qui m'annihile sans effort, me fragilise l'encéphale
Ouais, c'est l'aspirine quand c'est flasque et les activistes Andémol
Viennent m'astiquer dans les loges et activer l'essuie-glace
Encore une suceuse à nibards payée pour sourire comme une conne
Pour courtiser l'audimat, arrache des soupirs aux lucioles
Et j'préfère mourir aussitôt que d'me soucier d'vos images
Même me pourrir au pinot et devenir soumis polygame
Encore une propagande de sexagénaire israélienne
Qui lavent à la main leurs casseroles pour que brille la vaisselle
C'pédé tise ma réserve, ça m'épuise
Parait-il que l'amnésie m'apprécie (Mais j'sais plus qui m'l'avait dit)
Pourtant à s'égosiller, j'ai fait les mêmes choses hier
Ce même air obstiné devant ces treize gros billets
Ces mêmes fesses tonifiées sur Internet pornifié
J'invente des mots et pour ma mère (J'ai eu la moyenne au lycée)
Encore un mec qui boit tout près d'Pigalle, s'met minable pour sa Festina
Qu'il estimera dans plusieurs périodes estivales
Des cavus, il s'égare dans des débats tous interminables
Des barres de rages intestinales, dégueule sur un insecte qui passe
Pas besoin d's'isoler des frères pour ciseler ses veines
Et rester prisonnier des fesses, j'fignole des mijaurées sévères
Et j'ai b'soin d'rigoler mes vers pour me sentir libre
Libre d'être un consommateur guidé par son chibre
Allez, allez, encore un son qui mènera nulle part
Encore cette sensation d'vivre pour donner son trou d'balle
J'avoue sans station digne de c'nom, j'écoute Vald
Et quand j'rêve de Tory Lane, j'lui mets des coups d'schlasse
Et tu vas jouir putain d'grosse pute
À voir les mêmes choses tous les jours, j'en deviens golbute
Mais tant qu'ça m'occupe, j'occulte les faux-culs cocus dodus
Les obus qu'on fume bossus et les ventes d'Hocus Pocus
Encore un focus dans l'calbare de V
Pendant que tu mates Master Chef, encore un wack martelé
Encore une 'tasse m'harcèle et j'en ai le braquemart fêlé, bâtards
Vous voulez du magma venez, l'slogan c'est : ""Val' casse des nez""
J'emmerde vos tas d'casses-dédi, dégaine le taga, j'l'effrite
Devant la saga d'Freddy, l'cerveau en pagaille, j'écris
Pendant qu'un petit pédé plein d'haine, un genre d'illettré sincère
Crois gêner la société lorsqu'il caillasse les flics
J'ai des messages farfelus, j'déboite des tas d'chattes velues
Venu d'ailleurs, y'a d'l'Absolut, j'm'en veux pas dans l'absolu
Mais j'en ai plein l'cul, ça va d'entendre ces quinze putes bavardes
Alors à l'insu d'la masse, j'te baise sur c't'instru d'malade
Encore une feuille qui tombe et une autre qui s'roule
Si t'as peur fiston, dis-toi qu'j'ai les fils qui s'touchent
Car le peura, ça rend cool c'que j'dis
Même si des fois, j'pars en couille, j'reste vrai, j'ai les pires discours

Allez, allez, encore un son qui mènera nulle part
Fume, ça roule un bon stick et tape une barre
N'abuse pas ma puce
J'accumule un tas d'trucages, du grabuge dans mon fuselage
J'ai d'l'actu dans mon futal, Sullyvan

Encore un matin où j'me réveille dans une mère solitaire à qui j'aurais pas dû percer l'hymen
NQNTMQMQB 2, bientôt dans...",https://genius.com/Vald-encore-lyrics
Adulez-moi,Cours de rattrapage,2012,"J'espère que vous êtes préparés
T'façon, toute votre vie ne vous aura jamais préparé pour c'qui va arriver
Vald, Vald, Vald...
Allez tous ensemble
Tout le monde, plus fort
Eh plus fort là oh !
Eh bâtard

Adulez-moi, adulez-moi
Adulez-moi, adulez-moi
Adulez-moi, adulez-moi
Adulez-moi, adulez-moi 
(vas-y, adule-moi, adule-moi)
Si tu te touches le soir, je suis là
Si t'as les cuisses moites, je suis là
Si t'as rien pour toi, je suis là
Demandez pas pourquoi je suis là
Mon jeu d'syllabes a je n'sais quoi
D'un jeune César, un peu d'pétard
Bande de pétasses, adulez-moi
Adulez-moi ça m'suffit moi

Tous à genoux d'vant V.A.L.D
Mouillez sur moi, sur c'que vous n'avez pas été
Oubliez tout l'reste, j'suis l'seul maître à vos yeux
Rangez les boules Quiès et caressez ma frange
J'suis trop fort, surtout tentez pas d'résister
Tentez pas d'esquiver quand j'suis là à réciter
Hey hey hey
Hey hey hey

Adulez-moi, adulez-moi
Adulez-moi, adulez-moi
Adulez-moi, adulez-moi
Adulez-moi, adulez-moi 
(vas-y, adule-moi, adule-moi)
Si tu te touches le soir, je suis là
Si t'as les cuisses moites, je suis là
Si t'as rien pour toi, je suis là
Demandez pas pourquoi je suis là
Mon jeu d'syllabes a je n'sais quoi
D'un jeune César, un peu d'pétard
Bande de pétasses, adulez-moi
Adulez-moi ça m'suffit moi

Et ça fait direct à genoux : graffe mon blaze
J'ai déjà dit, c'est moi l'monarque
Et tous les soirs, levez tous les verres au nom d'mon art
Au bout d'mon dard, j'ai douze mollards
Et j'ai fait tout c'qu'il fallait
Écrivez mon blaze et mon blaze apparaît
Hey hey hey
Hey hey hey

Adulez-moi, adulez-moi
Adulez-moi, adulez-moi
Adulez-moi, adulez-moi
Adulez-moi, adulez-moi 
(vas-y, adule-moi, adule-moi)
Si tu te touches le soir, je suis là
Si t'as les cuisses moites, je suis là
Si t'as rien pour toi, je suis là
Demandez pas pourquoi je suis là
Mon jeu d'syllabes a je n'sais quoi
D'un jeune César, un peu d'pétard
Bande de pétasses, adulez-moi
Adulez-moi ça m'suffit moi

Adulez-le, il adore ça, il adore ça, adulez-le
Adulez-le, il adore ça, adulez-le, il adore ça
Oui, oui, yes",https://genius.com/Vald-adulez-moi-lyrics
Que fait la police,Cours de rattrapage,2012,"Ma meuf m'a plaqué pour un blondinet
J'aurais du la troquer contre un robinet
La vendre pour des clopinettes
(Mais que fait la police?)
Si j'la bute c'est que j'suis trop fidèle
Car si je me souviens bien il me semble qu'elle avait de jolies fesses
Les grosses minettes s'étranglent quand AD débarque y'a danger
Ma petite je sais que t'es grande mais j'vais te raccourcir à l'Opinel
Amène donc ta copine laide
Avec son garss qu'on se libère
J'suis dans une sale phase j'crois que Celui Qu'on Blaze va flancher
Dites-moi tout, Nafissatou
(Que fait la police)
Diallo Sofi-téléphone, le p'tit babtou s'attire la foudre
J'ai trop misé des sommes astronomiques
J'ai écouté vos mystères et j'sens d'la gastrophobie
J'suis pas l'As au cro-mi mais j'éclate pas mal de vos rimes
J'ai pas le time de gol-ri j'ai plus de souffle qu'un saxophoniste
J'pourrais te parler d'astrologie mais j'ai pas l'âme d'un autiste
J'ai pas envie de parler de la place de Paname dans nos vies

Et quand AD rap (mais que fait la police)
Quand VALD rap (mais que fait la police)
Écartez les wack
 (que fait la police x3)

Écartez-vous j'arrive avec mon passé de taulard
J'ai fait du parquet j'ai gratter des murs, charmer des putes
Des faciès aux pattes faudra des bracelets
Pour ner-tour en rond sans rancune
Gros j'dégoute, enfonçant l'enclume dans l'cul ça rapporte grave
Y'a pas de blême la vie c'est pas qu'un maudit casse-tête
C'est vrai j'ai que de l'amour et un cerveau qu'appauvrie c't'aspect
En véritable offrande je pose mes boules sur le track
XXX d'
Eva Angelina
 je l'offense j'crois qu'on pourrait pas se comprendre
Gros j'déboule et comme un barjo j'bédave trop d'chanvre
Les fantômes dans la pièce que ça éclate XXX
Faut l'arrêter celui-là
S'écrient ces salopes en détresse
J'effrite là comme un XXX vous allez faire du jazz
Avec une trompette dans l'cul vous êtes complètement nul
J'ai du lub et des idées, des complexes en plus
Quand j'foncerai dans le mur j'matterais ma complaisance
Tu peux pas dompter c't'enflure danser et contrer, j't'encule",https://genius.com/Vald-que-fait-la-police-lyrics
