title,album,year,lyrics,urls
Iencli,93 Empire,2018,"Affranchis
Zeg P on the track bitch

J'pourrais jouer les cités mais nan, nan, nan, nan, la flemme
Venir d'Aulnay-sous-Bois, en vérité, j'm'en bats les c'
Pas d'quoi s'féliciter d'fréquenter des gangs pas nets
Sois juste content pour moi, j'ai ves-qui les trans-palettes
Iencli devenu grossiste
, 
va m'chercher une grande canette
J'ai fabriqué mes armes : des piles dans un gant d'toilette
Fausses Requins dans la tess, j'connais ce film d'épouvante
Elle est pas vraiment souriante quand tu vois les dents d'la mer

J'vais changer ça, j'vais l'installer dans une villa loin de la zone
C'est pas juste un rêve que j't'écris avec du shit dans la paume
Tolérant, j'aime toutes les couleurs même si j'préfère la mauve
J'm'en souviens, on était déjà déprimés quand j'étais pauvre
C'est soit j'te pèse ou bien j'te baise mais y'aura jamais d'ex-æquo
Tu peux ber-flam avec les autres, j'me curerai les dents 'vec tes os
Je n'oublie rien, j'sais d'où je viens, ouais, d'ASB, tu t'doutes bien
V.A.L.D, c'est l'fou, le prince, la reine, le roi, son coup de rein
Pas d'coup de main dans les cités, je roule un joint pour léviter
Tout pour le gain, j'ai médité ; ces fils de chien, j'vais éviter
C'est l'défilé depuis ma célébrité, j'leur coule un bain électrisé
J'leur serre la pince après pisser, wesh Valentin, t'sais pas qui c'est ?
Fils de pute, renseigne-toi, j'fais ton année dans le mois
Que dis-je, ""le mois"" : le week-end, sucez-moi et c'est nickel
Petite potion dans Vittel, y'a que comme ça qu'j'vois la vie belle
Super clean, pas de zipette, j'suis frais clean dans l'appuie-tête
Sur ma vie, j'suis un bon gars, je signe ma vie sur un contrat
Je raconte ma peine insondable, fuck la tienne, fais un ton-car
Ra-ta-ta-ta-ta-ta-ta, j'les baise fort, ça sent le caca
Chaque jour, un apprentissage donc chaque jour, un nouveau kata
[Pont 1 : Vald et 
Sofiane
]
Wesh les iencli ?
V.A.L.D, Fianso, go
Sans permission, Khal Drogo
Wesh les iencli ?
 Wesh les iencli ?
J'vois la guerre, j'vois pas d'pogo
Wesh les iencli ?
 Wesh les iencli ?
Bridé au shit d'astronaute
Flic de Shanghai, Sammo Law
[Refrain : Sofiane et 
Vald
]
Wesh les iencli, 
wesh les iencli
, wesh les iencli, 
wesh les iencli
Wesh les iencli, 
wesh les iencli
, wesh les iencli, 
wesh les iencli
Dans la zone, 
dans la zone
, dans la zone, 
dans la zone
Dans la zone, 
dans la zone
, dans la zone, yah yah
Wesh les iencli
, wesh les iencli, 
wesh les iencli
, wesh les iencli
Wesh les iencli
, wesh les iencli, 
wesh les iencli
, yah yah
Dans la zone
, dans la zone, 
dans la zone
, dans la zone
Dans la zone
, dans la zone, 
dans la zone
, yah yah

J'prends du plaisir qu'en souffrant, 
j'pousse à la faute sur l'coup franc
D'puis la primaire on est tous grands, j'assure ma sûreté sous l'cran
Dans tes rêves, tu règles ça mais 
Tokarev s'enraye jamais
Tout le 9-3 dans l'cul d'Alice quand l'pays des merveilles cramait
J'déterre rappeurs momifiés, brolic, chargeur modifié
Grosse lucarne dans Thomas Price ou j'tire dans l'gilet d'Olivier
Un couplet de taille bovine,
 
lourd comme Jimmy Iovine
Blanc comme animal sans teint, j'assure le dos d'mon Valentin
J'sors du tard-mi, barbe de tard-mo à la tess comme à l'armée
Toi t'sais pas qui j'suis, 3emmo, j'suis sympa mais j'suis armé
Ces affranchis qu'on vouvoie
, gros satellite russe nous voit
Une grosse besace, j'fais pas d'menace, j'promets comme parole de you-voi
Chacun joue son rôle, j'maintiens, l'empire des Carolingiens
J'ai fait tourner l'calumet, j'ai rendu paro l'Indien
Rançonner l'grand chancelier
, 
j'suis comme Vatican, j'ai pas d'roi
J'shoote le shérif, j'fais ma loi, j'visser Bourbon et Valois
Des Saxons à l'Île de Beauté, tu vas sauter y a des chances
Nique réclamer l'allégeance, j'suis v'nu braquer la régence
J'vais répartir mes dix fils, Corleone et Médicis
J'pars en tournée quarante journées, mais j'viens retourner l'édifice

Wesh les iencli ?
Veuillez déserter ma kush (wesh les iencli ?)
J'touche personne, personne me touche (wesh les iencli ?)
93 Empire en bouche (wesh les iencli ?)
[Refrain : Sofiane et 
Vald
]
Wesh les iencli, 
wesh les iencli
, wesh les iencli, 
wesh les iencli
Wesh les iencli, 
wesh les iencli
, wesh les iencli, 
wesh les iencli
Dans la zone, 
dans la zone
, dans la zone, 
dans la zone
Dans la zone, 
dans la zone
, dans la zone, yah yah
Wesh les iencli
, wesh les iencli, 
wesh les iencli
, wesh les iencli
Wesh les iencli
, wesh les iencli, 
wesh les iencli
, yah yah
Dans la zone
, dans la zone, 
dans la zone
, dans la zone
Dans la zone
, dans la zone, 
dans la zone
, yah yah

Wesh les iencli, wesh les iencli, wesh les iencli, wesh les iencli
Dans la zone, dans la zone et dans la zone
Hey hey",https://genius.com/Vald-iencli-lyrics
Vitrine,Agartha,2017,"Fuck it's easy

J'suis dans le sex club, def' comme Nate Dogg
La bitch fait du pole-dance sur un son dance-hall
Vitrine en fumée de weed
Vitrine en feu
J'suis dans le sex club, def' comme Nate Dogg
La bitch fait du pole-dance sur un son dance-hall
Vitrine en fumée de weed
Vitrine en feu
Triste vie, derrière vitrine, triste vie
Triste vie, derrière vitrine, triste vie

Souviens-toi quand t'étais moche, personne voulait d'toi
Tu ne faisais que sucer des bites, t'as bu l'sperme de toute l'équipe
Aujourd’hui, tu fais ta gueule, t'as refait ton cul squelettique
Charnelle est la gymnastique
J'suis dans le hood, hood, j'fais que fumer des spliffs
J'encule la morale et l'éthique
J'suis sans manière, dans sa schneck, j'y mets formes géométriques
Police sur bande kilométrique
Y'a ceux qui ont le barreau, y'a ceux qu'ont la barrette de shit
Et ceux qui nous dénoncent aux flics
Intouchable comme la chatte sidatique d'une bitch
Oh non, yeah, j'ai de la beuh pour toi, un peu d'O.G. pour toi
Un peu de lean pour toi, legging en sueur, elle mouille
Suce-moi la teub au lieu d'casser les couilles, pute
V-A-L-D-A-M-So, quelques pussy dans le bando
J'te-ma sa puterie dans l'benzo
Triste vie, vitrine enfumée de bédo
J'fume ce pli, Dem's, Dem's

Triste vie, derrière vitrine, triste vie
Triste vie, derrière vitrine, triste vie
J'suis dans le sex club, def' comme Nate Dogg
La bitch fait du pole-dance sur un son dance-hall
Vitrine en fumée de weed
Vitrine en feu

Voiture bélier dans les charts, j'ai plié l'capot
Comme y'avait pas d'porte ouverte, j'ai pété l'carreau
Laisser K.O. ses séquelles, lui font péter l'tarot
Derrière vitrine comme derrière barreau, derrière vitrine comme derrière barreau

Salope sur son 31
Pour sursaut dans ses reins
Le néon éclaire sa plastique, et son cœur en étain
Les jambes toujours plus ouvertes comme rappeur en déclin
Tes gens me parlent, dis-leur d'arrêter
J'tire des grandes barres d'eucalyptus
Elle sort ses seins mais va rien allaiter
Elle sent le cul et l'beurre de karité
Ce rap est sale, c'est pas d'la variété
Ou bien d'la sorcellerie, faut les Garcimorer
Toutes ces garces mijaurées, maxi promo surpasse la qualité
Sacrifice de bébé dans berceau alité
Peut faire de toi une personnalité
J'tire sur le joint comme un enfant déscolarisé
Et sur ton équipe de tchoins désolidarisées
Jamais, Ô grand jamais, je ne peux pas
C'est très souvent l'affaire de deux doigts
J'suis devant toi mais, pourtant, tu n'es pas prêt de me voir
V-A-L-Damso, Seezy pour signer l'homicide, embuer les vitres de ton domicile
Un jour t'es contre, un jour t'es avec, j'te vois comme Al-Qaïda
Un jour sur deux, j'ai envie d'péter la vitrine de BNP Paribas
Alcool et shit dans mon alliage
Le fond, la forme, je suis l'mariage
Aucune action du genre admirable
Population du genre à l'image de Dieu qui danse la Macarena
J'sors d'une ke-schne comme d'un marécage
Le cœur et la bite sont trop maniables
La querelle s'invite sur la capitale
Kamikaze navigue comme Qatari à Ris-Pa
J'roule Marie-Jeanne sans cocaïna
J'cours après le temps et l'ocarina
Derrière les vitres teintées, je m'souviens d'l'anonymat

J'suis dans le sex club, def' comme Nate Dogg
La bitch fait du pole-dance sur un son dance-hall
Vitrine en fumée de weed
Vitrine en feu
J'suis dans le sex club, def' comme Nate Dogg
La bitch fait du pole-dance sur un son dance-hall
Vitrine en fumée de weed
Vitrine en feu
Triste vie, derrière vitrine, triste vie
Triste vie, derrière vitrine, triste vie",https://genius.com/Vald-vitrine-lyrics
Eurotrap,Agartha,2016,"Ouais, o-o-o-oy
C'est le moment où on va enregistrer ""Eurotrap"", voilà. Pour l'moment, ça n'vous dit rien, vous n'connaissez pas la trap de viking, encore
On va faire d'la trap de viking, mec
Beaucoup de trap
Agartha
, ça n'vous dit rien

J'ai tellement la pêche quand y'a plus de
'Ce-pla' dans mes poches, oh oui, le boze
M'explose la tête, remballez vos cochonneries
J'suis grand, t'es petit comme le boson d'Higgs
J'ai la patte qui colle à cause de Mya Nichole
On ne rigole pas avec mes idoles, hey
Je me branle, je me branle, j'fais du bif', c'est nickel
Je te mens, je te nique, tu te manges le vide
Le nez vers les étoiles avant de finir enseveli
Bitch, te perds pas dans le 'ce-vi'
Moi, j'suis pour de vrai
Je peux tout le faire, je peux nous refaire
Tu pé-pom le zgeg, j'fais des commentaires
Donc tu t'améliores, je vais ramener l'or
Criez : ""Mazel Tov"" lorsque Vald est sobre (Mazel Tov !)
J'ai l'regard dans l'vide comme Joe Budden
Comme je m'enrichis, je prends d'la bedaine
Dose de méga shit pour qu'je la reperde
À ma droite, le verbe donc, à ma gauche, le teh car
Tels sont mes repères et la planète accouche
De cartels de merde, ouais, mais j'm'en fous
J'veux juste de quoi perdre la boule
Dans une sacoche du bled

Vous avez demandé le refrain, ne quittez pas
Vous avez demandé le refrain, ne quittez pas
Un conseiller va vous prendre dans quelques minutes

Comment faire du rap sans être dissident ? Han
Comment faire du rap sans être dissident ? Han
Comment faire du rap sans être dissident ?
Si c'est pour l'dividende, j'espère qu'tu niques ta mère dans ta diligence

Turnup dans le club, ho
Turnup dans le club
Ho, turnup dans le club
Turnup dans le club, ho, ho
Turnup dans le club
Turnup dans le club
Turnup dans le club, ho
Turnup dans le club

J'retire des balais dans l'cul
T'as vu mon faciès prendre du buzz
Maintenant, t'arrives super à l'aise en stud'
Moi, ça m'fait plaisir
Seulement, j'suis presque parfait, toi, t'es sacrément nul
Ta clique de sacripants pue
Qu'est-ce que t'as fait, à part aller dans l'mur ?
Le pare-brise en puzzle (le massacre est précis)
J'ai de l'amour et du marron, j'suis
Incompris comme Eddy Malou, bitch
Un bon prix, puis j'te démarre en I
J'ouvre des portes pour la galanterie
La vie, c'est dur, c'est pas demie-molle
Oreilles sifflantes lorsque je m'isole
Étoiles filantes lorsque je rigole
Aucun sentiment pour âme frivole
Non, non, non
Si j'ai pas les armes, je vais manigancer
Vu qu't'es quasi pute et puis quasi hombre
C'est l'heure de ta chute sur ma Casio
Putain, j'fais du blé, puis ça m'fait du bien
Putain fait du pied, putain veut du V
V, V, putain dans lumière, putain dans le noir
Putain pète un plomb, putain dans Uber, putain, au revoir

Comment faire du rap sans être dissident ? Han
Comment faire du rap sans être dissident ? Han
Comment faire du rap sans être dissident ?
Si c'est pour l'dividende, j'espère qu'tu niques ta mère dans ta diligence

Turnup dans le club, ho
Turnup dans le club
Ho, turnup dans le club
Turnup dans le club, ho, ho
Turnup dans le club
Turnup dans le club
Turnup dans le club, ho
Turnup dans le club

Est-ce que tu baises après ""Tournez manège !"" ?
Le tout, c'est d'l'admettre, je pourrais t'la mettre
Mais y'a un truc qui m'retient, pute, fils de chien
D'où tu t'permets ? Tu ne piges donc rien ?
Sans loyauté, y'aura pas d'royauté
J'ai mal aux pieds, pétasse, viens m'aborder
Regarde-moi barboter, je suis dans l'aquarium
J'te parle comme ton 're-pè', je suis dans ta daronne
Déjà repus avant même le repas
J'rappe la 're-pu' que bi'-bi' la 'c-Fna'
Je vis comme un mort
Et l'haleine de mort suit mon kefta
J'sais pas qu'est-ce t'as, t'es là, fais la feignasse
Devant l'chemin des dames, maintenant qu't'es là, fais la fella'
J'mange des falafel
Devant des caméras
Je 'pper-ra' des phases qui n'ont rien à voir entre elles
Je 'ter-doig' des 'tasses qui n'ont rien à voir entre elles
Je bédave et passe des journées qui n'ont rien à voir entre elles
En fait, je m'emmerde, je crois qu'c'est ça, l'enfer

Comment faire du rap sans être dissident ? Han
Comment faire du rap sans être dissident ? Han
Comment faire du rap sans être dissident ?
Si c'est pour l'dividende, j'espère qu'tu niques ta mère dans ta diligence

Turnup dans le club, ho
Turnup dans le club
Ho, turnup dans le club
Turnup dans le club, ho, ho
Turnup dans le club
Turnup dans le club
Turnup dans le club, ho

Turnup dans le club",https://genius.com/Vald-eurotrap-lyrics
Je t’aime,Agartha,2017,"Je t'aime encore
Je t'aime jusqu'à la mort
Je t'aime comme si tu étais moi
Je t'aime comme si tu n'étais plus là
Je t'aime encore
Je t'aime jusqu'à la mort
Je t'aime comme si tu étais moi
Je t'aime comme si tu n'étais plus là

Je t'aime encore, ma chérie, je pense à toi, l'alcool dans la vessie
Je bouffe d'autres ch*****, mais j'n'ai pas d'appétit
Dans la vraie vie, ces mots d'amour, j'ai tant d'mal à les dire ; je suis agressif
Quand on m'demande des câlins, je les tire par les tifs, quelle tragédie
Mais je t'aime encore, mon amour
Depuis toi je baise, il n'y a qu'elles qui font l'amour
Je ne sais plus faire la cour
Mon cœur a fermé sa douve
 ; 
parfois, je rêve de ta fouffe
Comme l'équipe de France de la coupe
Si quelqu'une parle de toi, je la coupe
Notre passé commun m'éclabousse
Alors j'l'étouffe dans la douce
Mais je t'aime encore, mon bébé
Je n'pense pas qu'le temps et l'argent vont m'aider
Personne ne m'comprend, je peux l'confesser
Il n'y avait qu'toi qui savait m'compléter
Je vis la lumière comme un sombre été
J'peux faire n'importe quoi, combien d'gens vont m'aimer ?
Je sais qu'jusqu'à mon décès
J'te réserverai la place du mort à bord de mon Féfé
Car je t'aime encore, ma belle
On peut tout recommencer sur un seul appel
J'ai croisé la bonne, et je sais c'est laquelle
Aucune tasse-pé ne pourrait apaiser ma peine
Même quand elle m'dit : ""J'vais t'faire tout oublier""
J'réponds : ""Ferme ta gueule, il faut qu'j'me rappelle""
On m'importune à peine que l'on cite ton nom
Mon cœur porte une attelle, depuis j'trouve le temps long

Je t'aime encore, mon ami, je t'aime à mort et à vie
Le temps efface tout qu'on a dit
J'vais mourir affichant complet
Vous donnerez mon corps à la science
J'ai laissé mon cœur à ton chevet
J'ai croisé un ange en avance

Je t'aime encore
Je t'aime jusqu'à la mort
Je t'aime comme si tu étais moi
Je t'aime comme si tu n'étais plus là
Je t'aime encore
Je t'aime jusqu'à la mort
Je t'aime comme si tu étais moi
Je t'aime comme si tu n'étais plus là

Je t’aime encore, mon salaud, je t’aime encore lorsque tout tombe à l’eau
Toi et moi face au monde, c’est comme ça qu’j’suis mégalo
Sur mon rafiot, t’auras toujours une place comme un croc sur mon gâteau
J’ai d’jà dégoté l’magot ; à ma droite, j'ai un ange, et ta face à ma gauche
J'crois qu'je t’aime encore, mon re-frè
Parfois, c’est toi qu'je vois dans mon reflet
Je sors toujours deux gobelets quand j’veux m’faire un rre-ve
Tu m'remets, je renais, j'peux ôter l'déguisement qu'je revets
J'te connais par cœur, je te sais
Y'a pas meilleur jeu de scène
Pour moi, j’ai peur mais, pour toi, je me saigne
Pour ton mariage, j’irai m’acheter un peigne
Ouais, je t’aime encore, mon cochon
Même lorsque ton regard s'évide avec mon pocheton
Entre nous, pas d'blème de chatte ou d'pognon
Quand j'te dis qu'j'te déteste, c'est qu'je t'aime mais qu'j'suis un peu grognon
Moi qui rêve tant d’horizon
J’peux pas t’regarder t'doigter l'oignon
Le manque d’argent comme les grilles d’une prison
Le soir, j’m’endors en comptant les barreaux qu’nous éliminons
Je t’aime encore, mon p’tit père
Viens, on reste dans la caisse, roule un p’tit teh
J’nous ai vu dans la perte et la vitesse
Tous les deux dans la merde et la lumière
La vie d’ma mère que j’vais nous délivrer
Quand tu dis qu’ça va pas, j’l'avais déjà deviné
Tiens-moi la main, j’aimerais pas dériver
Tout niquer seul, j’en ai jamais rêvé

Je t'aime encore, mon ami, je t'aime à mort et à vie
Le temps efface tout qu'on a dit
J'vais mourir affichant complet
Vous donnerez mon corps à la science
J'ai laissé mon coeur à ton chevet
J'ai croisé un ange en avance

Je t'aime encore
Je t'aime jusqu'à la mort
Je t'aime comme si tu étais moi
Je t'aime comme si tu n'étais plus là
Je t'aime encore
Je t'aime jusqu'à la mort
Je t'aime comme si tu étais moi
Je t'aime comme si tu n'étais plus là",https://genius.com/Vald-je-taime-lyrics
Megadose,Agartha,2016,"À chaque pause : megadose, mais je zappe ; ni je matte, ni la Une, ni la Dos, ni la Tres
Pour la dose qui te dresse, tu connais l'adresse
C'est pas l'93

Le cœur est morose, et seul le lean est rose
Rien n'va changer, même si j'augmente la dose
Avant qu'explose la Terre, la stratégie j'expose :
On t'crée la névrose pour que t'augmentes la dose
Un jour, tu oseras relever la tête
Pour l'instant, la porte est close
Donc augmente la dose
""Megadose versée par terre pour les innocents qu'on arrose""
Le marché nous a baisé, j'regarde les frères se faire rabaisser
Pour un salaire se faire enlaisser
Fermer sa gueule, ne faire qu'encaisser
S'empresser d’s'engraisser sans précédent
La colombe est amiantée, nos addictions sont manigancées
La frustration est alimentée
Comment patienter ?
 
J'arrive en balle
Comme un trafiquant d'armes et, comme lui, j'irai partir en paix
Gros, là, j'suis premier degré
J'ai raté ma vie si j'finis pas au trente-troisième
La chatte de ta mère la Bretonne
Est plus importante que celle de cent Maliennes
Qui gère les coefficients ?
Qui prémédite les attentats d'hier ?
Ne m'attends pas, ci-mer, j'ai déjà une haine
Proéminente pour m'accompagner
J'ai d'l'amour pour mon prochain
Mais j'refuse d'être le prochain
Personne viendra m'reprocher
D'avoir vécu les deux couilles accrochées
J'regarde la fin s'approcher
J'recherche une tchoin pas trop chère
Je m'souviens, lorsque j'secouais mon hochet
J'avais pas tous ces besoins d'phacochère
""À nos chaînes à ôter, à vos schnecks écorchées à l'hôtel""
Pour la hagra pas d'weekend
La guerre pour la paix ? Yes we can !
Les larmes et le sang essuyés, le chemin du McDo' indiqué
Pour le reste, on va pas t'aiguiller
La plupart du temps, j'en ai rien à foutre de dénoncer
Je n'veux que m'défoncer, rechercher la montée
Pour ne pas m'lamenter. Avant d'être millionnaire
À esclave ou 'ient-cli' j'suis apparenté

Fuck si tu perds la tête
Tant que tu payes ta dose, ha-ha-ha-ha
Fuck si tu perds la tête
Tant que tu payes ta dose, ha-ha-ha-ha
Fuck si tu perds la tête
Tant que tu payes ta dose, ha-ha-ha-ha
Fuck si tu perds la tête
Tant que tu payes ta dose, ha-ha-ha-ha

Mutation amorcée
J'suis déjà à un stade avancé
Je ne suis qu'une créature
Des multinationales sous rafale cadencée
Ravale ta pensée
Tout le monde le fait pour toi, tu n'as plus qu'à danser
Parfois, j'ai honte quand je pense qu'à m'droguer
Et baiser vos filles comme un putain d'vacancier
Megadose cachée dans l'aine
Enjolive une routine vraiment pas démentielle
L'acte j'enchaîne, mais j'ppe-ra l’essentiel
Le maître est sans fouet, son esclave est sans chaîne
Megadose carrée dans l'zen, tu veux planer dans l'ciel ?
Depuis tout p'tit, j'vois mes parents maqués
Par la banque
 ; 
je n'fais pas du rap
Pour prendre les armes dans l'clip et rafaler en l'air

Fuck, montagne de doses, faut qu'j'combatte le trône
Contacte le boss, faut qu'dans son trou d'balle je zone
Fort comme bombardement d'phosphore
J'prendrai pas de pause
Fuck, montagne de doses, faut qu'j'combatte le trône
Contacte le boss, faut qu'dans son trou d'balle je zone
Fort comme bombardement d'phosphore
J'prendrai pas de pause

Megadose vide mon regard quand je pense beaucoup
Megadose quand y'a plus d'espoir, plus d'Son Goku
Que des fous dans nos troupes, que d'la chair à canon dans nos couilles
J'vais briser mes chaînes, fuck briser des schneks en eau trouble

Fuck si tu perds la tête
Tant que tu payes ta dose, ha-ha-ha-ha
Fuck si tu perds la tête
Tant que tu payes ta dose, ha-ha-ha-ha
Fuck si tu perds la tête
Tant que tu payes ta dose, ha-ha-ha-ha
Fuck si tu perds la tête
Tant que tu payes ta dose, ha-ha-ha-ha

À chaque pause : megadose, mais je zappe ni je matte, ni la une, ni la dos, ni la tres
Pour la dose qui te dresse, tu connais l'adresse
C'est pas l'93

Megadose, megadose, megadose, megadose
Megadose, megadose, megadose, megadose
Megadose, megadose, megadose, megadose
Megadose, megadose, megadose, megadose
Megadose, megadose, megadose, megadose
Megadose, megadose, megadose, megadose
Megadose, megadose, megadose, megadose
Megadose, megadose, megadose, megadose
Megadose",https://genius.com/Vald-megadose-lyrics
Ma meilleure amie,Agartha,2017,"Ma meilleure amie m'fait voir la vie autrement
Quand on , j'parle même une autre langue
Merde, j'tombe amoureux lentement
Plus j'la vois, plus j'suis pris de tremblements
Merde, on avait dit : ""Pas d'ça entre nous""
Mais, quand j'la vois plus, j'suis dans le flou
Si j'lui avoue, ça sera sans retour
Mais j'ai besoin d'elle
Car ma meilleure amie m'fait voir la vie autrement
Quand on , j'parle même une autre langue
Merde, j'tombe amoureux lentement
Avec elle, j'peux m'exprimer franchement
Oh, oh, oh, oh, oh, oh, oh, oh
Oh, oh, oh, oh, oh, oh, oh, oh

Ma meilleure amie parle à mes potes
Et tout l'monde l'adore
Je sens son odeur depuis la porte
Je l'ai dans la peau, elle suinte de mes pores
J'fais jamais d'effort pour la mettre d'accord
Elle en demande encore, encore et encore
Et, forcé d'admettre
Quand j'perdais la tête, elle a raison, j'ai tort
Ma meilleure amie, tous les soirs avec moi
Dans le noir, sans espoir, avec moi
Le matin, les yeux collés, avec moi
Même en chien et sans monnaie, avec moi
Ma meilleure amie fait l'tour de la Terre
Ma meilleure amie, j'peux pas la tenir, la tenir en laisse
Ma meilleure amie fait l'tour de la pièce
Ma meilleure amie, c'est comme mon amie
Sauf que mon amie me dit d'arrêter
De voir ma meilleure amie, parce que je n'sors pas

Ma meilleure amie m'fait voir la vie autrement
Quand on , j'parle même une autre langue
Merde, j'tombe amoureux lentement
Son parfum provoque des étranglements
Oh, oh, oh, oh, oh, oh, oh, oh
Oh, oh, oh, oh, oh, oh, oh, oh
Ma meilleure amie m'fait voir la vie autrement
Quand on , j'parle même une autre langue
Merde, j'tombe amoureux lentement
Ça m'fait du mal, étrangement
Oh, oh, oh, oh, oh, oh, oh, oh
Oh, oh, oh, oh, oh, oh, oh, oh",https://genius.com/Vald-ma-meilleure-amie-lyrics
Si j’arrêtais,Agartha,2017,"Hi ! Agartha !
J'veux pas faire partie d'la jetset (non, non)
J'veux pas faire partie d'la jetset (oy, oy)

J'veux pas faire partie d'la jetset
J'coupe ma Sobies' au Get 27 à la limite
Mais c'est cadavérique, cette ambiance de pète sec
J'suis comme, j'suis comme paralysé
Le sperme s'consomme comme chewing-gum
Et de p'tites drogues pour faire rire l'Homme
Transitent de mains en mains
Plus j'côtoie l'Homme, plus je l'aime de moins en moins
Et, plus on parle, et puis plus ça glisse en partouze
Qu'est ce-que tu veux faire quand t'as v'là l'flouze ? On s'ennuie partout
Gros, c'est pas l'tout qu't'aies les cartouches ou les cartes
Faut qu't'écrases tout, ou qu'tu les écartes
J'vois ma vie comme un cartoon
Mes ennemis m'attrapent jamais, j'mange des bonbons à la pelle
Lorsqu'on veut m'aider, on m'tend la main d'Jamel
Pédé, passe la zeb, j'suis pas la bête de foire de Captcha Mag'

Si j'arrêtais d'faire semblant, juste une fois
Sullyvan est grand, le monde est trop p'tit
Si j'arrêtais d'faire semblant, juste une fois
Sullyvan est grand, le monde est trop p'tit

Et le monde est tellement grand
J'rassemble les éléments
J'ai l'idée, j'ai les vœux
Cette bitch est vénéneuse
Je lean et j'fais des euros
On fait vibrer tes vieux os
Ma firme est généreuse
Pas d'fausse modestie
J'manie l'crom et l'Bic comme Joe Pesci
T'obéis aux mauvais types
On cautérise nos plaies, on joue la comédie
On monétise nos vies, violètise nos vues
Nos limites, vos limites
Grosse équipe, Bose et pique
Do, Ré, Mi, faut rer-ti
Des questions ? Faurisson

Si j'arrêtais d'faire semblant, juste une fois
Sullyvan est grand, le monde est trop p'tit
Si j'arrêtais d'faire semblant, juste une fois
Sullyvan est grand, le monde est trop p'tit

Pute, j'ai besoin d'horizon, mais ton gros cul cache la vue
J'suis noyé dans l'houblon, le réel ne m'atteint plus
J'suis dans l'truc et dans l'tur comme dans Balladur
Pose ta tête sur mon armature
Ça rassure, j'fais tout pour me rassasier
Si tu doutes, tu feras l'reste à pieds
Allez, bouge, laisse taffer les grands
Y'a d'la mouille sur l'estafette, étrange
Intense étranglement quand j'reviens dans la Matrice
Quand j'sors mon micro, y'a toujours une amatrice
Fils, roule pas tes splifs avec un amas d'terre
Je plie ces amateurs, les yeux plissés vers 4 heures
Je vois les âmes à terre, leur tête inclinée
Lezarman fait sa ronde
Quand j'te prends par derrière, je vois cligner l'œil de Sauron
Tout niquer, chez nous, c'est inné, que tu l'veuilles ou non

Si j'arrêtais d'faire semblant, juste une fois
Sullyvan est grand, le monde est trop p'tit
Si j'arrêtais d'faire semblant, juste une fois
Sullyvan est grand, le monde est trop p'tit",https://genius.com/Vald-si-jarretais-lyrics
